company|title|location|link
amazon|2026 software dev engineer intern - austria|graz, styria, austria|https://www.linkedin.com/jobs/view/4335887120
genesys|software engineer intern|brest, brittany, france|https://www.linkedin.com/jobs/view/4325957319
amazon|2026 software dev engineer intern - france|clichy, île-de-france, france|https://www.linkedin.com/jobs/view/4342023786
amazon|2026 software dev engineer intern - germany|berlin, berlin, germany|https://www.linkedin.com/jobs/view/4341242740
amazon web services (aws)|2026 software dev engineer intern - germany|aachen, north rhine-westphalia, germany|https://www.linkedin.com/jobs/view/4341052969
amazon|2026 software dev engineer intern - germany|munich, bavaria, germany|https://www.linkedin.com/jobs/view/4341202812
amazon web services (aws)|2026 software dev engineer intern - germany|munich, bavaria, germany|https://www.linkedin.com/jobs/view/4341003147
amazon|software dev intern - ai / machine learning|berlin, germany|https://www.linkedin.com/jobs/view/4358269663
taktile|software engineer intern|berlin, berlin, germany|https://www.linkedin.com/jobs/view/4342501529
ge healthcare|software engineering intern|budapest, budapest, hungary|https://www.linkedin.com/jobs/view/4300035903
amazon|2026 software dev engineer intern - ireland|dublin, county dublin, ireland|https://www.linkedin.com/jobs/view/4308442126
amazon|2026 software dev engineer intern - italy|turin, piedmont, italy|https://www.linkedin.com/jobs/view/4343846847
amazon|software dev engineer internship - machine learning|luxembourg, luxembourg, luxembourg|https://www.linkedin.com/jobs/view/4345917594
amazon|2026 software dev engineer intern - luxembourg|luxembourg, luxembourg, luxembourg|https://www.linkedin.com/jobs/view/4338262127
amazon|software development intern, intech|deventer, overijssel, netherlands|https://www.linkedin.com/jobs/view/4334183568
amazon|2026 software dev engineer intern - netherlands|amsterdam, north holland, netherlands|https://www.linkedin.com/jobs/view/4338385192
amazon|software development engineer internship - vaga para mulheres, ies- latech|deventer, overijssel, netherlands|https://www.linkedin.com/jobs/view/4342905273
amazon|2026 software dev engineer intern - poland|gdańsk, pomorskie, poland|https://www.linkedin.com/jobs/view/4341572145
amazon|2026 software dev engineer intern - poland|warsaw, mazowieckie, poland|https://www.linkedin.com/jobs/view/4342051541
amazon|2026 software dev engineer intern - romania|iaşi, iaşi, romania|https://www.linkedin.com/jobs/view/4318251005
taktile|software engineer intern|iaşi, iaşi, romania|https://www.linkedin.com/jobs/view/4318298888
amazon|2026 software dev engineer intern - romania|iaşi, iaşi, romania|https://www.linkedin.com/jobs/view/4337635886
amazon|software dev engineer internship - ai|madrid, community of madrid, spain|https://www.linkedin.com/jobs/view/4362975946
amazon web services (aws)|2026 software dev engineer intern - spain|madrid, community of madrid, spain|https://www.linkedin.com/jobs/view/4308986222
amazon web services (aws)|2026 software dev engineer intern - spain|barcelona, catalonia, spain|https://www.linkedin.com/jobs/view/4308986221
amazon|2026 software dev engineer intern - sweden|stockholm, stockholm county, sweden|https://www.linkedin.com/jobs/view/4337167035
amazon|2026 software dev engineer intern - uk|edinburgh, scotland, united kingdom|https://www.linkedin.com/jobs/view/4308093564
amazon|software dev intern - ai / machine learning|london, england, united kingdom|https://www.linkedin.com/jobs/view/4340789851
amazon|2026 software dev engineer intern - uk|cambridge, england, united kingdom|https://www.linkedin.com/jobs/view/4308092612
siemens|train software engineer intern  - 3 months|city of london, england, united kingdom|https://www.linkedin.com/jobs/view/4321796506
amazon|software dev intern - ai / machine learning|cambridge, england, united kingdom|https://www.linkedin.com/jobs/view/4341060523
amazon|software dev intern - embedded development (linux)|cambridge, england, united kingdom|https://www.linkedin.com/jobs/view/4346595737
deductive ai|software engineer intern, london|london, england, united kingdom|https://www.linkedin.com/jobs/view/4318516271
amazon web services (aws)|software dev engineer internship - embedded development|berlin, germany|https://www.linkedin.com/jobs/view/4343966180
amazon web services (aws)|2026 software dev engineer intern - germany|berlin, berlin, germany|https://www.linkedin.com/jobs/view/4341262687
amazon|2026 software dev engineer intern - uk|london, england, united kingdom|https://www.linkedin.com/jobs/view/4308097460
comena|software engineering intern|munich, bavaria, germany|https://www.linkedin.com/jobs/view/4309748645
amazon|2026 software dev engineer intern - germany|aachen, north rhine-westphalia, germany|https://www.linkedin.com/jobs/view/4341222816
bigblue|software engineer intern|paris, île-de-france, france|https://www.linkedin.com/jobs/view/3575815459
arago|system software engineer intern|paris, île-de-france, france|https://www.linkedin.com/jobs/view/4361395617
apple|internship - aiml software development engineer|munich, bavaria, germany|https://www.linkedin.com/jobs/view/4360101203
apple|internship - software automation engineer|cork, county cork, ireland|https://www.linkedin.com/jobs/view/4359234017
inetum|intern .net software engineer|warsaw, mazowieckie, poland|https://www.linkedin.com/jobs/view/4338818664
aerocontact|intern- automation software developer (m/f/d) (h/f) - safran engineering services gmbh|berlin, berlin, germany|https://www.linkedin.com/jobs/view/4361100239
sits  traxion|internship - software engineering|waardenburg, gelderland, netherlands|https://www.linkedin.com/jobs/view/4337017535
stmicroelectronics|nfc software application intern (part time)|graz, styria, austria|https://www.linkedin.com/jobs/view/4354631347
erste digital|internship software engineer (all genders) - #work&study #cobol / db2 #natural/adabas|vienna, vienna, austria|https://www.linkedin.com/jobs/view/4351214800
procter & gamble|software engineering internship|mechelen, flemish region, belgium|https://www.linkedin.com/jobs/view/4287143227
nviso security|internship labs - software engineering & ai|brussels, brussels region, belgium|https://www.linkedin.com/jobs/view/4353845999
nokia bell labs|bell labs master student internship on building novel software development tools (master)|antwerp, flemish region, belgium|https://www.linkedin.com/jobs/view/4349723696
odoo|software engineer intern|ramillies, walloon region, belgium|https://www.linkedin.com/jobs/view/4349323559
match group|software engineer internship|ghent, flemish region, belgium|https://www.linkedin.com/jobs/view/4324653871
septentrio part of hexagon|internship  innovative software application/ tooling  leuven|leuven, flemish region, belgium|https://www.linkedin.com/jobs/view/4330541050
nviso security|internship labs - software engineering|brussels, brussels region, belgium|https://www.linkedin.com/jobs/view/4353696161
dentsu|software developer intern|aarhus, central denmark region, denmark|https://www.linkedin.com/jobs/view/4359100081
intermarket bank ag - factoring, supply chain finance und liquidity|internship software engineer (all humans) - #work&study #cobol / db2 #natural/adabas|vienna, vienna, austria|https://www.linkedin.com/jobs/view/4351144320
bitmovin|software engineer intern|vienna, austria|https://www.linkedin.com/jobs/view/4341732688
septentrio part of hexagon|internship  embedded software ecosystems integrator  leuven|leuven, flemish region, belgium|https://www.linkedin.com/jobs/view/4330461583
