company|title|location|link
bigblue|software engineer intern|paris, île-de-france, france|https://www.linkedin.com/jobs/view/3575815459
amazon|2024 software development engineer intern - embedded development (m/w/d)|dresden, saxony, germany|https://www.linkedin.com/jobs/view/3877273184
mygwork - lgbtq+ business community|2024 software development engineer intern - embedded development (m/w/d)|dresden, saxony, germany|https://www.linkedin.com/jobs/view/3954839016
mygwork - lgbtq+ business community|2024 software dev engineer intern|gdańsk, pomorskie, poland|https://www.linkedin.com/jobs/view/3954843122
doctor|2024 software dev engineer intern|gdańsk, pomorskie, poland|https://www.linkedin.com/jobs/view/3827922084
amazon|2024 software dev engineer intern|iaşi, iaşi, romania|https://www.linkedin.com/jobs/view/3877287309
mygwork - lgbtq+ business community|2024 software dev engineer intern|iaşi, iaşi, romania|https://www.linkedin.com/jobs/view/3954842389
doctor|2024 software dev engineer intern|iaşi, iaşi, romania|https://www.linkedin.com/jobs/view/3925389948
amazon|2024 software dev engineer intern (embedded development)|cambridge, england, united kingdom|https://www.linkedin.com/jobs/view/3877282181
make|ai software engineering intern|prague, prague, worldwide|https://www.linkedin.com/jobs/view/3867929049
livello technologies|student / intern / thesis as  fullstack javascript developer software engineer (m/f/d) - iot tech startup|düsseldorf, north rhine-westphalia, germany|https://www.linkedin.com/jobs/view/3919670738
livello technologies|embedded engineer software / hardware / pcb design (m/f/d) intern / thesis for iot startup|düsseldorf, north rhine-westphalia, germany|https://www.linkedin.com/jobs/view/3833005381
formlabs|embedded software engineering intern|budapest, budapest, hungary|https://www.linkedin.com/jobs/view/3947155670
mygwork - lgbtq+ business community|intern - optics software engineer|eindhoven, north brabant, netherlands|https://www.linkedin.com/jobs/view/3954578561
thermo fisher scientific|intern - optics software engineer|eindhoven, north brabant, netherlands|https://www.linkedin.com/jobs/view/3950839544
snowflake|software engineer intern - developer platform|warsaw, mazowieckie, poland|https://www.linkedin.com/jobs/view/3926902532
snowflake|software engineer intern - os engineering|warsaw, mazowieckie, poland|https://www.linkedin.com/jobs/view/3926901840
snowflake|software engineer intern in test (sdet) emea 2024|warsaw, mazowieckie, poland|https://www.linkedin.com/jobs/view/3926599920
ionlace - we're hiring!|intern, software engineer|stockholm, stockholm county, sweden|https://www.linkedin.com/jobs/view/3944620506
radical ai|software engineer intern|awliscombe, england, united kingdom|https://www.linkedin.com/jobs/view/3955684901
arcadis|software engineer intern|amersfoort, utrecht, netherlands|https://www.linkedin.com/jobs/view/3953514840
medius|software developer intern|cracow, małopolskie, poland|https://www.linkedin.com/jobs/view/3958202054
ow ocean winds|software development intern (full time)|madrid, community of madrid, spain|https://www.linkedin.com/jobs/view/3946620169
marlee (fingerprint for success)|expression of interest - software engineer intern|innere stadt, vienna, austria|https://www.linkedin.com/jobs/view/3958871351
marlee (fingerprint for success)|expression of interest - software engineer intern|vienna, vienna, austria|https://www.linkedin.com/jobs/view/3958601384
lga it|software analyst  intern|roeselare, flemish region, belgium|https://www.linkedin.com/jobs/view/3944816505
lga it|software analyst  intern|gavere, flemish region, belgium|https://www.linkedin.com/jobs/view/3920563558
odoo|software developer intern|ramillies, walloon region, belgium|https://www.linkedin.com/jobs/view/3957843364
sap|sap s/4hana product compliance ixp intern - software developer|sofia, sofia city, worldwide|https://www.linkedin.com/jobs/view/3943514303
sap|sap ixp intern - software developer in gardener with golang|sofia, sofia city, worldwide|https://www.linkedin.com/jobs/view/3951079747
relesys|client software supporter associate, internship - copenhagen👨💻🇩🇰|copenhagen, capital region of denmark, denmark|https://www.linkedin.com/jobs/view/3940331882
the hub|client software supporter associate, internship - copenhagen👨💻🇩🇰|copenhagen, capital region of denmark, denmark|https://www.linkedin.com/jobs/view/3939160362
qima|software engineer – internship – lille|lille, hauts-de-france, france|https://www.linkedin.com/jobs/view/3858854681
hp|software security research intern|hauts de bienne, france|https://www.linkedin.com/jobs/view/3947785373
co2 ai|full stack software engineer intern|paris, île-de-france, france|https://www.linkedin.com/jobs/view/3951134031
mygwork - lgbtq+ business community|software engineer intern - backend or fullstack|paris, île-de-france, france|https://www.linkedin.com/jobs/view/3954847224
mygwork - lgbtq+ business community|software engineer intern - front-end or fullstack|paris, île-de-france, france|https://www.linkedin.com/jobs/view/3954841567
sophia genetics|junior software development engineer internship|biarritz, nouvelle-aquitaine, france|https://www.linkedin.com/jobs/view/3953187605
spacex|fall 2024 software engineering internship/co-op|any-martin-rieux, hauts-de-france, france|https://www.linkedin.com/jobs/view/3909584511
braintrust|software engineer - six-month internship - fr or en|paris, île-de-france, france|https://www.linkedin.com/jobs/view/3936211426
dataiku|software engineer intern - business solutions - france, paris|paris, île-de-france, france|https://www.linkedin.com/jobs/view/3788278433
hrflow.ai|software engineer internship - ai startup - paris|paris, île-de-france, france|https://www.linkedin.com/jobs/view/3829229297
decathlon digital|internship software engineer - edge infra (f/m/d)|lille, hauts-de-france, france|https://www.linkedin.com/jobs/view/3948654699
braintrust|software engineer - six-month internship - fr or en|france|https://www.linkedin.com/jobs/view/3936212278
dataiku|software engineer intern - improve charting capabilities - france, paris|paris, île-de-france, france|https://www.linkedin.com/jobs/view/3809663957
ta europe|intern / working student (m/f/d) - software development|essen, north rhine-westphalia, germany|https://www.linkedin.com/jobs/view/3954095785
wingcopter|intern (software development for communication backend)|weiterstadt, hesse, germany|https://www.linkedin.com/jobs/view/3955545522
zalando|software engineer internship|berlin, berlin, germany|https://www.linkedin.com/jobs/view/3958698980
enzo|software engineer (intern)|heidelberg, baden-württemberg, germany|https://www.linkedin.com/jobs/view/3866672058
tacto|software engineer intern (m/f/d)|munich, bavaria, germany|https://www.linkedin.com/jobs/view/3837983184
teamviewer|intern software engineer (all genders)|stuttgart, baden-württemberg, germany|https://www.linkedin.com/jobs/view/3934715869
airbus defence and space|internship (d/f/m) for software development environment and tooling implementation|manching, bavaria, germany|https://www.linkedin.com/jobs/view/3946876641
sap|sap pe cpex integration & cross architecture ixp intern (f/m/d) - software developer|walldorf, baden-württemberg, germany|https://www.linkedin.com/jobs/view/3943509961
intracom telecom|intern software engineer|paiania, attiki, greece|https://www.linkedin.com/jobs/view/3915053036
netcompany-intrasoft|internship in software development|patras, western greece, greece|https://www.linkedin.com/jobs/view/3939349905
altair|software development intern|athens, attiki, greece|https://www.linkedin.com/jobs/view/3834721366
netcompany-intrasoft|internship in software development|thessaloniki, central macedonia, greece|https://www.linkedin.com/jobs/view/3939349906
renesas electronics|software engineering intern|athens, attiki, greece|https://www.linkedin.com/jobs/view/3953110070
renesas electronics|software engineering intern|athens, attiki, greece|https://www.linkedin.com/jobs/view/3953109275
genesys|2025 software engineer internships|galway, county galway, ireland|https://www.linkedin.com/jobs/view/3932316589
whatnot|summer 2024 software engineer intern, ireland|dublin, county dublin, ireland|https://www.linkedin.com/jobs/view/3955326896
motork|software engineer - internship (hybrid - milan)|milan, lombardy, italy|https://www.linkedin.com/jobs/view/3868282737
pwc italy|software engineer intern - milano [dig]|milan, lombardy, italy|https://www.linkedin.com/jobs/view/3825896697
ion|internship - software engineers/developers - italy|pisa, tuscany, italy|https://www.linkedin.com/jobs/view/3809672254
stmicroelectronics|software engineering intern|agrate brianza, lombardy, italy|https://www.linkedin.com/jobs/view/3938926719
stmicroelectronics|software engineering intern|agrate brianza, lombardy, italy|https://www.linkedin.com/jobs/view/3938927412
nedap|internship – embedded software testing & automation|groenlo, gelderland, netherlands|https://www.linkedin.com/jobs/view/3927621382
van lanschot kempen|software developer - internship(en)|amsterdam, north holland, netherlands|https://www.linkedin.com/jobs/view/3951566386
intk|intern software developer|utrecht, utrecht, netherlands|https://www.linkedin.com/jobs/view/3833637512
drieam|internship: software developer|eindhoven, north brabant, netherlands|https://www.linkedin.com/jobs/view/3876710793
deeploy|software engineer internship for ai saas product|utrecht, utrecht, netherlands|https://www.linkedin.com/jobs/view/3949241922
juniper networks|software engineering intern - amsterdam based|schiphol-rijk, north holland, netherlands|https://www.linkedin.com/jobs/view/3902074007
next generation sensors b.v.|student internship - software developer|maastricht, limburg, netherlands|https://www.linkedin.com/jobs/view/3835875953
mygwork - lgbtq+ business community|intern software engineer|eindhoven, north brabant, netherlands|https://www.linkedin.com/jobs/view/3954579048
tomtom|software engineer intern - adas|amsterdam, north holland, netherlands|https://www.linkedin.com/jobs/view/3954246045
mygwork - lgbtq+ business community|software engineer intern - openstreetmap data ingest and vandalism detection|eindhoven, north brabant, netherlands|https://www.linkedin.com/jobs/view/3959214324
lely|internship: software engineering|maassluis, south holland, netherlands|https://www.linkedin.com/jobs/view/3947298207
tomtom|software engineer intern - openstreetmap data ingest and vandalism detection|eindhoven, north brabant, netherlands|https://www.linkedin.com/jobs/view/3934490237
mygwork - lgbtq+ business community|intern/final graduation assignment firmware-embedded software engineering|eindhoven, north brabant, netherlands|https://www.linkedin.com/jobs/view/3954579077
axelera ai|ai embedded software intern - debugging tools development|eindhoven, north brabant, netherlands|https://www.linkedin.com/jobs/view/3931931387
axelera ai|ai embedded software intern - debugging tools development|amsterdam, north holland, netherlands|https://www.linkedin.com/jobs/view/3931925931
circle k|software quality assurance intern|warsaw, mazowieckie, poland|https://www.linkedin.com/jobs/view/3947449718
siemens digital industries software|software quality assurance intern|poznań, wielkopolskie, poland|https://www.linkedin.com/jobs/view/3939080428
informatica|intern - software engineer|cracow, małopolskie, poland|https://www.linkedin.com/jobs/view/3952968738
fandom|software engineer intern|poznań, wielkopolskie, poland|https://www.linkedin.com/jobs/view/3943856121
aptiv|embedded software intern|cracow, małopolskie, poland|https://www.linkedin.com/jobs/view/3806846800
splunk|software engineer intern - front-end (poland summer 2024)|cracow, małopolskie, poland|https://www.linkedin.com/jobs/view/3736184314
antmicro|open source software internship|poznań, wielkopolskie, poland|https://www.linkedin.com/jobs/view/3909570216
bridgestone mobility solutions|intern (java software developer)|warsaw, mazowieckie, poland|https://www.linkedin.com/jobs/view/3955630946
cnh|data management embedded software intern|warsaw, mazowieckie, poland|https://www.linkedin.com/jobs/view/3947233011
motorola solutions|software engineer/lab administrator - internship|cracow, małopolskie, poland|https://www.linkedin.com/jobs/view/3958669853
unbabel|software developer - summer internship|lisboa, lisbon, portugal|https://www.linkedin.com/jobs/view/3910534406
talent job seeker|software developer - summer internship|lisboa, lisbon, portugal|https://www.linkedin.com/jobs/view/3957942590
evolution|software engineering intern|lisbon, lisbon, portugal|https://www.linkedin.com/jobs/view/3883125340
betfair romania development|internship software engineer - pokerstars (hybrid)|cluj-napoca, cluj, romania|https://www.linkedin.com/jobs/view/3959052253
siemens digital industries software|strategic student program - software engineer intern|barcelona, catalonia, spain|https://www.linkedin.com/jobs/view/3940385269
siemens digital industries software|strategic student program - software engineer intern (marine)|tres cantos, community of madrid, spain|https://www.linkedin.com/jobs/view/3940386197
siemens digital industries software|product engineering software internship,  marine|tres cantos, community of madrid, spain|https://www.linkedin.com/jobs/view/3921681857
siemens digital industries software|strategic student program - software engineer intern|tres cantos, community of madrid, spain|https://www.linkedin.com/jobs/view/3940387110
milestone systems|trainee program/internship - software engineer - barcelona|barcelona, catalonia, spain|https://www.linkedin.com/jobs/view/3954025123
ea sports|rendering software engineer intern|madrid, community of madrid, spain|https://www.linkedin.com/jobs/view/3953136201
tttech auto|internship - embedded software|barcelona, catalonia, spain|https://www.linkedin.com/jobs/view/3945295343
capchase|software engineer in tools & infrastructure intern|spain|https://www.linkedin.com/jobs/view/3950332092
siemens digital industries software|product engineering software internship|tres cantos, community of madrid, spain|https://www.linkedin.com/jobs/view/3937779184
lunaphore|software intern (6 month internship)|tolochenaz, vaud, switzerland|https://www.linkedin.com/jobs/view/3934416857
gravis robotics|robotics software engineer internship - control & planning|zurich, zurich, switzerland|https://www.linkedin.com/jobs/view/3945827693
hitachi energy|internship in software systems 80 - 100% (f/m/d)|baden, aargau, switzerland|https://www.linkedin.com/jobs/view/3954371342
ubs|internship 2024, software developer, ubs risklab services|zurich, zurich, switzerland|https://www.linkedin.com/jobs/view/3902957218
ubs|internship 2024, software engineer in fx it|zurich, zurich, switzerland|https://www.linkedin.com/jobs/view/3909804664
hp|software security research intern|bristol, england, united kingdom|https://www.linkedin.com/jobs/view/3932339100
flare by cause|software developer intern|united kingdom|https://www.linkedin.com/jobs/view/3957306638
marlee (fingerprint for success)|expression of interest - software engineer intern|united kingdom|https://www.linkedin.com/jobs/view/3957005329
cambridge consultants|software engineering internship (12 months, 2024-2025)|cambridge, england, united kingdom|https://www.linkedin.com/jobs/view/3945141602
ncr voyix|software engineering intern|dundee, scotland, united kingdom|https://www.linkedin.com/jobs/view/3908977851
ncr voyix|software engineering intern|dundee, scotland, united kingdom|https://www.linkedin.com/jobs/view/3908976845
lucy electric|software engineering intern|basildon, england, united kingdom|https://www.linkedin.com/jobs/view/3957527660
parallel wireless|phy software engineer intern|bristol, england, united kingdom|https://www.linkedin.com/jobs/view/3808634618
axelera ai|ai embedded software intern - debugging tools development|bristol, england, united kingdom|https://www.linkedin.com/jobs/view/3931924961
metabolic|sustainability methods intern (metabolic software) - september 2024|amsterdam, north holland, netherlands|https://www.linkedin.com/jobs/view/3947026955
altair|software quality intern - electronics|greece|https://www.linkedin.com/jobs/view/3920365680
oracle|intern as software engineer|barcelona, catalonia, spain|https://www.linkedin.com/jobs/view/3915765839
oracle|intern as software engineer|barcelona, catalonia, spain|https://www.linkedin.com/jobs/view/3954373003
mygwork - lgbtq+ business community|intern as software engineer|barcelona, catalonia, spain|https://www.linkedin.com/jobs/view/3957436819
mygwork - lgbtq+ business community|intern as software engineer|barcelona, catalonia, spain|https://www.linkedin.com/jobs/view/3954806307
qualifio|software developer intern|ottignies-louvain-la-neuve, walloon region, belgium|https://www.linkedin.com/jobs/view/3941341186
datacamp|machine learning and software engineering content development intern|leuven, flemish region, belgium|https://www.linkedin.com/jobs/view/3924268446
motorola solutions|intern software developer (c++ / go)|cracow, małopolskie, poland|https://www.linkedin.com/jobs/view/3949481250
dyson|software engineering - embedded intern|cracow, małopolskie, poland|https://www.linkedin.com/jobs/view/3949498462
aptiv|software engineering intern|cracow, małopolskie, poland|https://www.linkedin.com/jobs/view/3806850508
ubs|tech internship - software engineer java, python, pl/sql|cracow, małopolskie, poland|https://www.linkedin.com/jobs/view/3943998197
rambus|intern embedded software|rotterdam, south holland, netherlands|https://www.linkedin.com/jobs/view/3874265277
kreativstorm|software engineer - intern (remote internship - it)|edinburgh, scotland, united kingdom|https://www.linkedin.com/jobs/view/3957171939
sophia genetics|junior software development engineer internship|rolle, vaud, switzerland|https://www.linkedin.com/jobs/view/3953187606
cohere|software engineer intern/co-op (fall 2024)|london, england, united kingdom|https://www.linkedin.com/jobs/view/3954876811
eutelsat oneweb|software engineering intern - uk|london, england, united kingdom|https://www.linkedin.com/jobs/view/3952958255
the final shot events|software intern|london area, united kingdom|https://www.linkedin.com/jobs/view/3942646082
mygwork - lgbtq+ business community|software engineer intern|madrid, community of madrid, spain|https://www.linkedin.com/jobs/view/3954572406
tomtom|software engineer intern|madrid, community of madrid, spain|https://www.linkedin.com/jobs/view/3933464243
gmv|internship: software engineer|tres cantos, community of madrid, spain|https://www.linkedin.com/jobs/view/3842165210
nexthink|java software engineer (intern)|madrid, community of madrid, spain|https://www.linkedin.com/jobs/view/3950370186
marvell technology|software and validation engineer intern (curriculare / extra-curriculare)|pavia, lombardy, italy|https://www.linkedin.com/jobs/view/3738991951
rohde & schwarz|intern (m/f/d) emc software development|munich, bavaria, germany|https://www.linkedin.com/jobs/view/3940315499
criteo|software engineer intern - front-end or fullstack|paris, île-de-france, france|https://www.linkedin.com/jobs/view/3817454687
wolters kluwer|internship software implementation engineer (6 months or apprenticeship))|bois-colombes, île-de-france, france|https://www.linkedin.com/jobs/view/3872413862
emerton|emerton data - software engineer internship|paris, île-de-france, france|https://www.linkedin.com/jobs/view/3942056205
snowflake|software engineer intern - developer productivity engineering|warsaw, mazowieckie, poland|https://www.linkedin.com/jobs/view/3944278219
station f|software engineer intern|paris, île-de-france, france|https://www.linkedin.com/jobs/view/3951543719
artefact|intern software engineer - paris|paris, île-de-france, france|https://www.linkedin.com/jobs/view/3764069386
mygwork - lgbtq+ business community|intern software engineer|eindhoven, north brabant, netherlands|https://www.linkedin.com/jobs/view/3954574853
s&p global|software engineer intern carfax big|gdańsk, pomorskie, poland|https://www.linkedin.com/jobs/view/3951969018
ai-inspect|software engineer intern|breda, north brabant, netherlands|https://www.linkedin.com/jobs/view/3952095769
siemens digital industries software|software developer intern|katowice, śląskie, poland|https://www.linkedin.com/jobs/view/3902371933
mygwork - lgbtq+ business community|software engineer intern carfax big|gdańsk, pomorskie, poland|https://www.linkedin.com/jobs/view/3954572683
thermo fisher scientific|intern software engineer|eindhoven, north brabant, netherlands|https://www.linkedin.com/jobs/view/3950837895
thermo fisher scientific|intern software engineer|eindhoven, north brabant, netherlands|https://www.linkedin.com/jobs/view/3950842172
altair|software development intern|loutrópolis thermís, northern aegean, greece|https://www.linkedin.com/jobs/view/3841318656
livello technologies|iot / edge software engineer (m/f/d) - internship / student / duales studium - tech-startup|düsseldorf, north rhine-westphalia, germany|https://www.linkedin.com/jobs/view/3832884003
join.com|lemvos gmbh: robotic software engineer - mandatory internship|augsburg, bavaria, germany|https://www.linkedin.com/jobs/view/3832854066
airbus defence and space|intern software developer / 3d designer (d/m/w) for a simulation and planning software|friedrichshafen, baden-württemberg, germany|https://www.linkedin.com/jobs/view/3947918331
sap|ixp intern (f/m/d) - sap analytics cloud software developer|walldorf, baden-württemberg, germany|https://www.linkedin.com/jobs/view/3948417483
marvell technology|software/firmware intern (working student / werkstudent)|ettlingen, baden-württemberg, germany|https://www.linkedin.com/jobs/view/3787111557
criteo|software engineer intern - backend or fullstack|paris, île-de-france, france|https://www.linkedin.com/jobs/view/3828949990
wolters kluwer|junior product software engineer - internship|bitritto, apulia, italy|https://www.linkedin.com/jobs/view/3904885471
intel corporation|software research engineer- cloud security intern (f/m/d)|karlsruhe, baden-württemberg, germany|https://www.linkedin.com/jobs/view/3929547426
fraunhofer iis|student assistant/ intern - software development in the audio division|erlangen, bavaria, germany|https://www.linkedin.com/jobs/view/3670741395
sap|ixp intern (f/m/d) - use cases for ai/ml in software development|walldorf, baden-württemberg, germany|https://www.linkedin.com/jobs/view/3862855857
happyops|working student/ intern software development (f/m/d)|germany|https://www.linkedin.com/jobs/view/3930487243
artificient mobility intelligence|software development internship/praktikum- m/w/d|aachen, north rhine-westphalia, germany|https://www.linkedin.com/jobs/view/3833051305
marvell technology|software and system test engineer intern (werkstudent / working student)|ettlingen, baden-württemberg, germany|https://www.linkedin.com/jobs/view/3734888091
cerence inc.|intern - software qa|aachen, north rhine-westphalia, germany|https://www.linkedin.com/jobs/view/3951974771
mygwork - lgbtq+ business community|intern software scientist - x-ray spectroscopy|eindhoven, north brabant, netherlands|https://www.linkedin.com/jobs/view/3954574945
thermo fisher scientific|intern software scientist - x-ray spectroscopy|eindhoven, north brabant, netherlands|https://www.linkedin.com/jobs/view/3950842173
tomtom|software engineer intern|amsterdam, north holland, netherlands|https://www.linkedin.com/jobs/view/3958094015
mygwork - lgbtq+ business community|software engineer intern|amsterdam, north holland, netherlands|https://www.linkedin.com/jobs/view/3959208886
thermo fisher scientific|intern/final graduation assignment firmware-embedded software engineering|eindhoven, north brabant, netherlands|https://www.linkedin.com/jobs/view/3950837902
chimpy|software engineer intern|zurich, zurich, switzerland|https://www.linkedin.com/jobs/view/3941672011
saeki|software engineering intern|bäretswil, zurich, switzerland|https://www.linkedin.com/jobs/view/3834272104
swiss-mile|robotics software intern|zurich, zurich, switzerland|https://www.linkedin.com/jobs/view/3807458667
kreativstorm|software engineer - intern (remote internship - it)|glasgow, scotland, united kingdom|https://www.linkedin.com/jobs/view/3957171938
metrea|intern software engineer|didcot, england, united kingdom|https://www.linkedin.com/jobs/view/3948309189
hp|3d software engineer internship|sant cugat del vallès, catalonia, spain|https://www.linkedin.com/jobs/view/3934889776
roche|intern in software engineer at post-market quality (pmq)|sant cugat del vallès, catalonia, spain|https://www.linkedin.com/jobs/view/3953297063
cariad|initiative application working student/intern in software development (m/f/d)|berlin, germany|https://www.linkedin.com/jobs/view/3951917177
motorola solutions|intern software developer (c#) - video systems|cracow, małopolskie, poland|https://www.linkedin.com/jobs/view/3949479462
danfoss|intern / student worker (m/f/d) simulation software engineer|hamburg, hamburg, germany|https://www.linkedin.com/jobs/view/3904541880
synaptics incorporated|software development intern|katowice, śląskie, poland|https://www.linkedin.com/jobs/view/3942279444
trimble inc.|software engineer intern|carquefou, pays de la loire, france|https://www.linkedin.com/jobs/view/3916021519
dataiku|software engineer intern - fuzzy distinct|paris, île-de-france, france|https://www.linkedin.com/jobs/view/3883065230
criteo|software engineer intern - backend or fullstack|grenoble, auvergne-rhône-alpes, france|https://www.linkedin.com/jobs/view/3828951886
criteo|software engineer intern - front-end or fullstack|grenoble, auvergne-rhône-alpes, france|https://www.linkedin.com/jobs/view/3817452833
