company|title|location|link
bigblue|software engineer intern|paris, île-de-france, france|https://www.linkedin.com/jobs/view/3575815459
spherical|intern - electrical engineering and software development|rotterdam, south holland, netherlands|https://www.linkedin.com/jobs/view/4019989474
deselect|software engineering intern|berchem, flemish region, belgium|https://www.linkedin.com/jobs/view/4012626179
deselect|software engineering intern|antwerp, flemish region, belgium|https://www.linkedin.com/jobs/view/4013218627
pelico|software and data engineering intern|paris, île-de-france, france|https://www.linkedin.com/jobs/view/4020810851
qualcomm|systems software intern (android) – sensors (cork, ireland)|cork, county cork, ireland|https://www.linkedin.com/jobs/view/3965647773
snowflake|software engineer intern in test (sdet) emea 2024|warsaw, mazowieckie, poland|https://www.linkedin.com/jobs/view/3926599920
sentry|software engineer intern (summer 2025)|vienna, vienna, austria|https://www.linkedin.com/jobs/view/3989927808
baker hughes|intern service software engineering uttm|north rhine-westphalia, germany|https://www.linkedin.com/jobs/view/3977884349
microsoft|software engineering intern|oslo, oslo, norway|https://www.linkedin.com/jobs/view/4008661301
make|intern - software tools management and automation generalist|madrid, community of madrid, spain|https://www.linkedin.com/jobs/view/4014334675
kreativstorm|software engineer - intern (remote internship - it)|salzburg, salzburg, austria|https://www.linkedin.com/jobs/view/4018744364
odoo|software developer intern|ramillies, walloon region, belgium|https://www.linkedin.com/jobs/view/4016612479
sap|sap ixp intern - software developer for circular economy cloud applications|sofia, sofia city, worldwide|https://www.linkedin.com/jobs/view/4001677101
systematic|internship: software developer|aarhus, central denmark region, denmark|https://www.linkedin.com/jobs/view/4011964809
rina|software developer, intern|aalborg, north denmark region, denmark|https://www.linkedin.com/jobs/view/4020867691
kamstrup|internship in high level software development|skanderborg, central denmark region, denmark|https://www.linkedin.com/jobs/view/4014819896
kamstrup|internship in advanced level software|skanderborg, central denmark region, denmark|https://www.linkedin.com/jobs/view/4014823340
kamstrup|internship in manufacturing software|skanderborg, central denmark region, denmark|https://www.linkedin.com/jobs/view/4014821482
kamstrup|internship in embedded software development for electricity meters|skanderborg, central denmark region, denmark|https://www.linkedin.com/jobs/view/4014819890
systematic|internship: software test engineer for healthcare solutions|aarhus, central denmark region, denmark|https://www.linkedin.com/jobs/view/4011966344
spacex|summer 2025 software engineering internship/co-op|any-martin-rieux, hauts-de-france, france|https://www.linkedin.com/jobs/view/4017125449
pigment|software engineer internship|paris, île-de-france, france|https://www.linkedin.com/jobs/view/4003558760
artefact|intern software engineer - paris|paris, île-de-france, france|https://www.linkedin.com/jobs/view/3764069386
dataiku|software engineer intern - improve charting capabilities - france, paris|paris, île-de-france, france|https://www.linkedin.com/jobs/view/4005334619
ottobock|internship/ thesis software & electronics development (d/f/m)|duderstadt, lower saxony, germany|https://www.linkedin.com/jobs/view/3999750200
teamviewer|intern/work student, software quality assurance (all genders)|stuttgart, baden-württemberg, germany|https://www.linkedin.com/jobs/view/3964596022
teamviewer|intern/work student, software engineering c++ (all genders)|stuttgart, baden-württemberg, germany|https://www.linkedin.com/jobs/view/4019346021
tacto|software engineer intern (m/f/d)|munich, bavaria, germany|https://www.linkedin.com/jobs/view/3837983184
teamviewer|intern, software engineering (all genders)|stuttgart, baden-württemberg, germany|https://www.linkedin.com/jobs/view/3965101274
enzo|software engineer (intern)|heidelberg, baden-württemberg, germany|https://www.linkedin.com/jobs/view/3970296446
i2m europe – a mann+hummel company|software engineer intern (m/w/d)|ludwigsburg, baden-württemberg, germany|https://www.linkedin.com/jobs/view/4021226576
teamviewer|intern/work student, software engineering c++ (all genders)|karlsruhe, baden-württemberg, germany|https://www.linkedin.com/jobs/view/4021587876
lilio|software testing and development intern/working student|munich, bavaria, germany|https://www.linkedin.com/jobs/view/4002064747
artificient mobility intelligence|software development internship/praktikum- m/w/d|aachen, north rhine-westphalia, germany|https://www.linkedin.com/jobs/view/4002457139
sap|working student (f/m/d) - future of work internship in innovative hr software sales|walldorf, baden-württemberg, germany|https://www.linkedin.com/jobs/view/3909308215
dolby laboratories|software engineer intern, cloud media solutions|berlin, germany|https://www.linkedin.com/jobs/view/4009833655
consist software solutions gmbh|senior softwareentwickler für interne systeme m/w/d|frankfurt, hesse, germany|https://www.linkedin.com/jobs/view/4012922022
intracom telecom|intern software engineer|paiania, attiki, greece|https://www.linkedin.com/jobs/view/3915053036
altair|software development intern|athens, attiki, greece|https://www.linkedin.com/jobs/view/3834721366
netcompany-intrasoft|internship in software development|patras, western greece, greece|https://www.linkedin.com/jobs/view/3939349905
netcompany-intrasoft|internship in software development|thessaloniki, central macedonia, greece|https://www.linkedin.com/jobs/view/3939349906
oracle|intern as software developer – part time for student|budapest, budapest, hungary|https://www.linkedin.com/jobs/view/3988528384
sap|sap ixp intern - software development|budapest, budapest, hungary|https://www.linkedin.com/jobs/view/4000281809
jpmorganchase|2025 software engineer program - summer internship - dublin|dublin, county dublin, ireland|https://www.linkedin.com/jobs/view/4015928501
stripe|software engineer, intern|dublin, county dublin, ireland|https://www.linkedin.com/jobs/view/4008886879
whatnot|summer 2025 software engineer intern - ireland|dublin, county dublin, ireland|https://www.linkedin.com/jobs/view/3984158053
virtu financial|internship - software engineer|dublin, county dublin, ireland|https://www.linkedin.com/jobs/view/3992729306
ibm|software developer intern|mulhuddart, fingal, ireland|https://www.linkedin.com/jobs/view/4008322957
arista networks|graduate/intern software engineer|dublin, county dublin, ireland|https://www.linkedin.com/jobs/view/4017529862
deutsche börse|software engineer - intern|cork, county cork, ireland|https://www.linkedin.com/jobs/view/4017367900
susquehanna international group|software development internship: summer 2025|dublin, county dublin, ireland|https://www.linkedin.com/jobs/view/4013919225
motork|software engineer - internship (hybrid - milan)|milan, lombardy, italy|https://www.linkedin.com/jobs/view/3868282737
pwc italy|software engineer intern - milano [dig]|milan, lombardy, italy|https://www.linkedin.com/jobs/view/3825896697
ion|internship - software engineers/developers - italy|pisa, tuscany, italy|https://www.linkedin.com/jobs/view/4016659495
ids georadar|software developer intern|pisa, tuscany, italy|https://www.linkedin.com/jobs/view/4009384470
ntt|cloud-native software development intern|capellen, luxembourg, luxembourg|https://www.linkedin.com/jobs/view/4020052210
ntt data, inc.|cloud-native software development intern|capellen, luxembourg, luxembourg|https://www.linkedin.com/jobs/view/4019434964
drieam|internship: software developer|eindhoven, north brabant, netherlands|https://www.linkedin.com/jobs/view/3876710793
optiver|software engineer internship (2025 start)|amsterdam, north holland, netherlands|https://www.linkedin.com/jobs/view/4007687164
databricks|software engineering intern (2025)|amsterdam, north holland, netherlands|https://www.linkedin.com/jobs/view/4018192830
seenons|software engineering intern|amsterdam, north holland, netherlands|https://www.linkedin.com/jobs/view/4019091966
rambus|intern embedded software|rotterdam, south holland, netherlands|https://www.linkedin.com/jobs/view/3874265277
axelera ai|ai embedded software intern - debugging tools development|amsterdam, north holland, netherlands|https://www.linkedin.com/jobs/view/3931925931
careervalue b.v.|software tester met testmanagement taken (intern)  arnhem|arnhem, gelderland, netherlands|https://www.linkedin.com/jobs/view/3979480028
cisco|software engineering summer internship|oslo, oslo, norway|https://www.linkedin.com/jobs/view/4008949509
laerdal medical|intern - software & data|stavanger, rogaland, norway|https://www.linkedin.com/jobs/view/4021874976
oil and gas job search ltd|junior software tester - internship|cracow, małopolskie, poland|https://www.linkedin.com/jobs/view/4017893655
siemens digital industries software|software developer intern|katowice, śląskie, poland|https://www.linkedin.com/jobs/view/4000393023
software mind|intern software engineer (.net)|cracow, małopolskie, poland|https://www.linkedin.com/jobs/view/4020126224
s&p global|software engineer intern - carfax big|gdańsk, pomorskie, poland|https://www.linkedin.com/jobs/view/3998099210
gts|software engineer internship / part-time - warsaw, poland|warsaw, mazowieckie, poland|https://www.linkedin.com/jobs/view/4012057007
jobs via efinancialcareers|tech internship - software engineer|warsaw, mazowieckie, poland|https://www.linkedin.com/jobs/view/4011674162
evolution|software engineering intern|lisbon, lisbon, portugal|https://www.linkedin.com/jobs/view/3883125340
stripe|software engineer, intern|bucharest, bucharest, romania|https://www.linkedin.com/jobs/view/4008211701
microsoft|software engineering internship opportunities|bucharest, bucharest, romania|https://www.linkedin.com/jobs/view/4016689561
roche|intern in software engineer at post-market quality (pmq)|sant cugat del vallès, catalonia, spain|https://www.linkedin.com/jobs/view/3953297063
kreativstorm|software engineer - intern (remote internship - it)|seville, andalusia, spain|https://www.linkedin.com/jobs/view/4018742448
the trade desk|2025 summer intern - software engineer - madrid|madrid, community of madrid, spain|https://www.linkedin.com/jobs/view/4008072060
bsport|full stack software engineer - internship|barcelona, catalonia, spain|https://www.linkedin.com/jobs/view/3968132742
datadog|software engineer - intern|madrid, community of madrid, spain|https://www.linkedin.com/jobs/view/4016978986
gmv|internship: software engineer|tres cantos, community of madrid, spain|https://www.linkedin.com/jobs/view/3999726146
garda capital partners|software engineer intern (.net)|geneva, geneva, switzerland|https://www.linkedin.com/jobs/view/4019045369
swissborg|software engineering intern (llm)|lausanne, vaud, switzerland|https://www.linkedin.com/jobs/view/4021297864
swissborg|software engineering intern (scala)|lausanne, vaud, switzerland|https://www.linkedin.com/jobs/view/4021293746
saeki|software engineering intern|bäretswil, zurich, switzerland|https://www.linkedin.com/jobs/view/3834272104
maven securities|software developer summer internship london 2025|london, england, united kingdom|https://www.linkedin.com/jobs/view/4013908399
jpmorganchase|2025 software engineer program - summer internship - glasgow & london|london, england, united kingdom|https://www.linkedin.com/jobs/view/4015932080
point72|2024 software engineer internship – long/short equities|london, england, united kingdom|https://www.linkedin.com/jobs/view/3977068347
jpmorganchase|2025 software engineer immersion program - summer internship - glasgow|glasgow, scotland, united kingdom|https://www.linkedin.com/jobs/view/4020780911
hp|cloud software developer internship|sant cugat del vallès, catalonia, spain|https://www.linkedin.com/jobs/view/4013385522
midokura|software engineer intern (ai for developer efficiency)|barcelona, catalonia, spain|https://www.linkedin.com/jobs/view/4000509797
databricks|software engineering intern (2025)|berlin, berlin, germany|https://www.linkedin.com/jobs/view/4012062801
tesla|software engineering internship (m/w/d) - gigafactory berlin-brandenburg|grünheide, brandenburg, germany|https://www.linkedin.com/jobs/view/3976935117
ostrom|intern: software development for power trading|berlin, berlin, germany|https://www.linkedin.com/jobs/view/4021695057
ultramarin|internship: quantitative software engineer - equity selection (m/f/d)|berlin, berlin, germany|https://www.linkedin.com/jobs/view/4019787081
qualifio|software developer intern|ottignies-louvain-la-neuve, walloon region, belgium|https://www.linkedin.com/jobs/view/3941341186
aptiv|software engineering intern|cracow, małopolskie, poland|https://www.linkedin.com/jobs/view/3972033552
ge healthcare|software engineer intern|cracow, małopolskie, poland|https://www.linkedin.com/jobs/view/3996263002
aptiv|embedded software intern|cracow, małopolskie, poland|https://www.linkedin.com/jobs/view/3806846800
abb|junior software tester - internship|cracow, małopolskie, poland|https://www.linkedin.com/jobs/view/3986986941
lely|internship: software engineering|maassluis, south holland, netherlands|https://www.linkedin.com/jobs/view/3947298207
kreativstorm|software engineer - intern (remote internship - it)|hannover, lower saxony, germany|https://www.linkedin.com/jobs/view/4018740865
palantir technologies|software engineer, internship|london, england, united kingdom|https://www.linkedin.com/jobs/view/3988301899
cisco|software engineer intern (placement year) - uk|feltham, england, united kingdom|https://www.linkedin.com/jobs/view/4016974937
guardian jobs|software development intern, brighterbox|london, england, united kingdom|https://www.linkedin.com/jobs/view/4003641686
gmv|internship: software engineer - big data team|tres cantos, community of madrid, spain|https://www.linkedin.com/jobs/view/4012924375
nova|software engineer junior / intern - cofrai|community of madrid, spain|https://www.linkedin.com/jobs/view/4017240351
teamsystem|software tester intern|milan, lombardy, italy|https://www.linkedin.com/jobs/view/4016962987
marvell technology|software validation applications engineering intern (curriculare / extra-curriculare)|pavia, lombardy, italy|https://www.linkedin.com/jobs/view/3841569212
machine learning reply gmbh|software engineer intern|munich, bavaria, germany|https://www.linkedin.com/jobs/view/4018210327
datadog|software engineer - intern|paris, île-de-france, france|https://www.linkedin.com/jobs/view/4016984319
ubs|tech internship - software engineer|warsaw, mazowieckie, poland|https://www.linkedin.com/jobs/view/4009776038
nvidia|software engineering intern - math libraries|warsaw, mazowieckie, poland|https://www.linkedin.com/jobs/view/4006342897
jobs via efinancialcareers|tech internship - software engineer|warsaw, mazowieckie, poland|https://www.linkedin.com/jobs/view/4020523417
front|software engineering intern - spring/summer 2025|paris, île-de-france, france|https://www.linkedin.com/jobs/view/4013594522
lemvos|robotic software engineer - mandatory internship|augsburg, bavaria, germany|https://www.linkedin.com/jobs/view/4021238770
maesn|software engineering internship in saas startup (full-time / remote)|germany|https://www.linkedin.com/jobs/view/4018571932
tomtom|software engineering intern|łódź, łódzkie, poland|https://www.linkedin.com/jobs/view/4015797941
hrflow.ai|software engineer internship - ai startup - paris|paris, île-de-france, france|https://www.linkedin.com/jobs/view/4015938974
mygwork - lgbtq+ business community|software engineer intern - carfax big|gdańsk, pomorskie, poland|https://www.linkedin.com/jobs/view/4000117672
axelera ai|ai embedded software intern - debugging tools development|eindhoven, north brabant, netherlands|https://www.linkedin.com/jobs/view/3931931387
cerence inc.|intern - software qa|ulm, baden-württemberg, germany|https://www.linkedin.com/jobs/view/3975238466
thermo fisher scientific|software internship ia&d|eindhoven, north brabant, netherlands|https://www.linkedin.com/jobs/view/4002514021
criteo|software engineer intern - front-end or fullstack|paris, île-de-france, france|https://www.linkedin.com/jobs/view/3817454687
lga it|software analyst  intern|roeselare, flemish region, belgium|https://www.linkedin.com/jobs/view/3944816505
criteo|software engineer intern - backend or fullstack|paris, île-de-france, france|https://www.linkedin.com/jobs/view/3828949990
sap|intern/ thesis/ working student (f/m/d) - improve software fault localization via llm|walldorf, baden-württemberg, germany|https://www.linkedin.com/jobs/view/3993622728
td|enterprise innovation - software developer intern/co-op (winter 2025)|front, piedmont, italy|https://www.linkedin.com/jobs/view/4021218515
thermo fisher scientific|intern software scientist - x-ray spectroscopy|eindhoven, north brabant, netherlands|https://www.linkedin.com/jobs/view/4002511373
motorola solutions|intern software developer (java)|cracow, małopolskie, poland|https://www.linkedin.com/jobs/view/4020434709
mygwork - lgbtq+ business community|software engineer intern - carfax big|gdańsk, pomorskie, poland|https://www.linkedin.com/jobs/view/4001559696
swiss-mile|robotics software intern|zurich, zurich, switzerland|https://www.linkedin.com/jobs/view/3807458667
instat sport|software engineer intern|lincoln, england, united kingdom|https://www.linkedin.com/jobs/view/4003100964
pimco|2025 summer intern - technology analyst, software engineering, london|london, england, united kingdom|https://www.linkedin.com/jobs/view/4009422205
intel corporation|intern fpga software design engineer|high wycombe, england, united kingdom|https://www.linkedin.com/jobs/view/4020518515
axelera ai|ai embedded software intern - debugging tools development|bristol, england, united kingdom|https://www.linkedin.com/jobs/view/3931924961
nvidia|software engineering intern - math libraries|munich, bavaria, germany|https://www.linkedin.com/jobs/view/4006344390
rohde & schwarz|intern (m/f/d) emc software development|munich, bavaria, germany|https://www.linkedin.com/jobs/view/3940315499
cadence design systems|intern software engineer - ai based functional verification – 5 months (f/m/d)|feldkirchen, bavaria, germany|https://www.linkedin.com/jobs/view/4018729846
pretto|ai software engineer intern - research internship - h/f|paris, île-de-france, france|https://www.linkedin.com/jobs/view/4012980632
jobs via efinancialcareers|software engineer intern - carfax big|gdańsk, pomorskie, poland|https://www.linkedin.com/jobs/view/4003063027
criteo|software engineer intern - backend or fullstack|grenoble, auvergne-rhône-alpes, france|https://www.linkedin.com/jobs/view/3828951886
criteo|software engineer intern - front-end or fullstack|grenoble, auvergne-rhône-alpes, france|https://www.linkedin.com/jobs/view/3817452833
delaware belux|software engineer internship 2024 - 2025|antwerp, flemish region, belgium|https://www.linkedin.com/jobs/view/4011323865
gravis robotics|robotics software engineer internship - perception|zurich, zurich, switzerland|https://www.linkedin.com/jobs/view/3945826802
ruag|aerospace software developer internship|prilly, vaud, switzerland|https://www.linkedin.com/jobs/view/4021132595
fiducial (previously bladesense)|internship software/computer vision engineer|delft, south holland, netherlands|https://www.linkedin.com/jobs/view/4018507930
palantir technologies|forward deployed software engineer, internship|london, england, united kingdom|https://www.linkedin.com/jobs/view/3988304193
palantir technologies|forward deployed software engineer, internship - uk government|london, england, united kingdom|https://www.linkedin.com/jobs/view/3988305120
spacex|spring 2025 software engineering internship/co-op|any-martin-rieux, hauts-de-france, france|https://www.linkedin.com/jobs/view/4017128187
