company|title|location|link
amd|software development engineer intern (f/m/d)|cologne, north rhine-westphalia, germany|https://www.linkedin.com/jobs/view/3959228645
airbus defence and space|intern software developer / 3d designer (d/m/w) for a simulation and planning software|immenstaad, baden-württemberg, germany|https://www.linkedin.com/jobs/view/3947916378
ibm|ibm poland internship - software engineer|cracow, małopolskie, poland|https://www.linkedin.com/jobs/view/3922488022
gravis robotics|robotics software engineer internship - perception|zurich, zurich, switzerland|https://www.linkedin.com/jobs/view/3945826802
bobst|internship / stage - software engineer|mex, vaud, switzerland|https://www.linkedin.com/jobs/view/3953214645
tesla|software engineering internship - service engineering|amsterdam, north holland, netherlands|https://www.linkedin.com/jobs/view/3955056727
bsport|full stack software engineer - internship|paris, île-de-france, france|https://www.linkedin.com/jobs/view/3842143838
brainlab|internship / thesis – software development (c++)|heidelberg, baden-württemberg, germany|https://www.linkedin.com/jobs/view/3860351334
cariad|initiative application working student/intern in software development (m/f/d)|wolfsburg, lower saxony, germany|https://www.linkedin.com/jobs/view/3951919118
faurecia|ai & software developer intern|bavans, bourgogne-franche-comté, france|https://www.linkedin.com/jobs/view/3888963565
