company|title|location|link
apple|cellular 5g/4g firmware verification engineer (m/f/d)|munich, bavaria, germany|https://www.linkedin.com/jobs/view/4414158686
apple|soc digital verification engineer (m,f,d)|munich, bavaria, germany|https://www.linkedin.com/jobs/view/4414162497
apple|pmu design verification engineer (m/f/d)|munich, bavaria, germany|https://www.linkedin.com/jobs/view/4414163499
apple|soc performance modeling internship - platform architecture (m/f/d)|munich, bavaria, germany|https://www.linkedin.com/jobs/view/4414155766
apple|cad logic equivalence checking (lec) engineer - m/f/d|munich, bavaria, germany|https://www.linkedin.com/jobs/view/4414170144
airbus defence and space|vie germany - quantum software development engineer (d/f/m)|munich, bavaria, germany|https://www.linkedin.com/jobs/view/4406033664
agile actors|ios software engineer|athens, attiki, greece|https://www.linkedin.com/jobs/view/4414465290
plum|ios engineer|athens, attiki, greece|https://www.linkedin.com/jobs/view/4366774459
apple|full stack engineer, services technology|dublin, county dublin, ireland|https://www.linkedin.com/jobs/view/4414159675
apple|site reliability engineer, dublin|dublin, county dublin, ireland|https://www.linkedin.com/jobs/view/4414164436
apple|software automation engineer, localisation & release engineering|cork, county cork, ireland|https://www.linkedin.com/jobs/view/4414161558
apple|software automation engineer, localisation & release engineering|cork, county cork, ireland|https://www.linkedin.com/jobs/view/4414155760
sony interactive entertainment|software eng ii|dublin, county dublin, ireland|https://www.linkedin.com/jobs/view/4412055019
amazon web services (aws)|software development engineer, aws lambda, aws lambda control plane|dublin, county dublin, ireland|https://www.linkedin.com/jobs/view/4420634951
apple|it-operations specialist|florence, tuscany, italy|https://www.linkedin.com/jobs/view/4419060538
apple|it-operations specialist|florence, tuscany, italy|https://www.linkedin.com/jobs/view/4419067125
apple|it-manager|milan, lombardy, italy|https://www.linkedin.com/jobs/view/4414167395
ali professional|software engineer|florence, tuscany, italy|https://www.linkedin.com/jobs/view/4419427520
italiaonline|app developer|assago, lombardy, italy|https://www.linkedin.com/jobs/view/4375983712
accenture italia|junior software engineer – technology|naples, campania, italy|https://www.linkedin.com/jobs/view/4325217358
qti srl|software engineer|florence, tuscany, italy|https://www.linkedin.com/jobs/view/4407774561
apple|it-manager|rome, latium, italy|https://www.linkedin.com/jobs/view/4414164426
apple|it-expert|milan, lombardy, italy|https://www.linkedin.com/jobs/view/4416335798
epic|software engineer|wv, parkersburg, worldwide|https://www.linkedin.com/jobs/view/3986113584
starapple|junior software ontwikkelaar|'s-hertogenbosch, north brabant, netherlands|https://www.linkedin.com/jobs/view/4419138327
starapple|startende software ontwikkelaar|the randstad, netherlands|https://www.linkedin.com/jobs/view/4417486280
garmin nederland|junior ios developer|leiden, south holland, netherlands|https://www.linkedin.com/jobs/view/4413922414
starapple|devops engineer|zaltbommel, gelderland, netherlands|https://www.linkedin.com/jobs/view/4421694254
appical|mobile developer|amsterdam, north holland, netherlands|https://www.linkedin.com/jobs/view/4411353303
politie nederland|software engineer - digit|driebergen-rijsenburg, utrecht, netherlands|https://www.linkedin.com/jobs/view/4421650472
starapple|software engineer|utrecht, netherlands|https://www.linkedin.com/jobs/view/4410216392
starapple|python-ontwikkelaar|utrecht, utrecht, netherlands|https://www.linkedin.com/jobs/view/4418112148
starapple|typescript developer|eindhoven, north brabant, netherlands|https://www.linkedin.com/jobs/view/4420280510
appear|c++ developer|oslo, oslo, norway|https://www.linkedin.com/jobs/view/4372126947
cisco|software engineer|norway|https://www.linkedin.com/jobs/view/4420444671
cisco|graduate software engineer - early in career, norway|norway|https://www.linkedin.com/jobs/view/4404079876
cisco|graduate software engineer - early in career, norway|oslo, oslo, norway|https://www.linkedin.com/jobs/view/4404081015
zivid|software engineer - motion|oslo, oslo, norway|https://www.linkedin.com/jobs/view/4415077996
mastercard|software engineer|oslo, oslo, norway|https://www.linkedin.com/jobs/view/4419606414
cisco|embedded software engineer wireless|norway|https://www.linkedin.com/jobs/view/4404071906
neat|oslo graduate software engineers - 2026 intake|oslo, oslo, norway|https://www.linkedin.com/jobs/view/4365892789
cisco|software engineer|cracow, małopolskie, poland|https://www.linkedin.com/jobs/view/4406618877
tripadvisor|software engineer ii - ios|cracow, małopolskie, poland|https://www.linkedin.com/jobs/view/4408845281
google|software engineer iii, pixel graphics|warsaw, mazowieckie, poland|https://www.linkedin.com/jobs/view/4415703544
revolut|graduate programme 2027: software engineer (ios)|poland|https://www.linkedin.com/jobs/view/4418843146
arq|ios engineer|cracow, małopolskie, poland|https://www.linkedin.com/jobs/view/4416957078
opera|python developer|wroclaw metropolitan area, worldwide|https://www.linkedin.com/jobs/view/4415013137
nokia|sw engineer|cracow, małopolskie, poland|https://www.linkedin.com/jobs/view/4417060422
google|software engineer iii, google kubernetes networking|warsaw, mazowieckie, poland|https://www.linkedin.com/jobs/view/4418264903
google|software engineer iii, google compute engine, control plane|warsaw, mazowieckie, poland|https://www.linkedin.com/jobs/view/4415905604
nvidia|software engineer, cpu and soc profiling tools|warsaw, mazowieckie, poland|https://www.linkedin.com/jobs/view/4395471459
google|software engineer, performance, reliability, observability, phd, early careers|warsaw, mazowieckie, poland|https://www.linkedin.com/jobs/view/4374056681
revolut|graduate programme 2027: software engineer (ios)|porto, porto, portugal|https://www.linkedin.com/jobs/view/4418824785
revolut|graduate programme 2027: software engineer (ios)|portugal|https://www.linkedin.com/jobs/view/4418822810
bitdefender|software developer macos|bucharest, romania|https://www.linkedin.com/jobs/view/4417702560
garmin cluj|ios software engineer  garmin connect team|cluj-napoca, cluj, romania|https://www.linkedin.com/jobs/view/4420272792
google|software engineer iii, embedded software, fitbit device|bucharest, bucharest, romania|https://www.linkedin.com/jobs/view/4416590645
google|software engineer iii, quantum (multiple openings)|los angeles, canada|https://www.linkedin.com/jobs/view/4408914770
amazon lab126|software dev engineer|irvine, canada|https://www.linkedin.com/jobs/view/4401531270
google|software engineer iii, google ads|irvine, canada|https://www.linkedin.com/jobs/view/4388959193
google|software engineer iii, google ads|los angeles, canada|https://www.linkedin.com/jobs/view/4367219784
amazon|embedded sde, amazon devices|hawthorne, canada|https://www.linkedin.com/jobs/view/4359310406
doordash|software engineer, backend (all teams)|los angeles, canada|https://www.linkedin.com/jobs/view/4409221550
snap inc.|software engineer, backend, level 4|los angeles, canada|https://www.linkedin.com/jobs/view/4420987662
snap inc.|software engineer, backend, level 4|los angeles, canada|https://www.linkedin.com/jobs/view/4421278018
snap inc.|software engineer, backend, level 4|los angeles, canada|https://www.linkedin.com/jobs/view/4420644407
amazon|ai builder, ring|hawthorne, canada|https://www.linkedin.com/jobs/view/4400431461
spacex|software engineer (platform team)|hawthorne, canada|https://www.linkedin.com/jobs/view/4398320770
spacex|software engineer, high performance computing|hawthorne, canada|https://www.linkedin.com/jobs/view/4366210690
abbott|cloud software engineer ii|los angeles, canada|https://www.linkedin.com/jobs/view/4378640465
ibm|it trainee|košice, kosice, worldwide|https://www.linkedin.com/jobs/view/4419280949
sap|go developer|bratislava, bratislava, worldwide|https://www.linkedin.com/jobs/view/4302722522
apple|language engineer (swedish), global siri|barcelona, catalonia, spain|https://www.linkedin.com/jobs/view/4414173052
apple|applied ml engineer - localisation & release engineering|barcelona, catalonia, spain|https://www.linkedin.com/jobs/view/4414167403
google|software engineer ii, threat intelligence|málaga, andalusia, spain|https://www.linkedin.com/jobs/view/4419089178
king|c++ developer|barcelona, catalonia, spain|https://www.linkedin.com/jobs/view/4399419623
santander digital services|ios junior developer (swift) - sds|madrid, community of madrid, spain|https://www.linkedin.com/jobs/view/4381145268
airbus defence and space|software engineer for aircraft simulator|getafe, community of madrid, spain|https://www.linkedin.com/jobs/view/4402415985
accenture españa|ios developer (a coruña)|greater la coruña area, worldwide|https://www.linkedin.com/jobs/view/4412925230
airbus|low-speed aircraft performance software developer - 1gzcf (d/f/m)|getafe, community of madrid, spain|https://www.linkedin.com/jobs/view/4418798369
ring|software development engineer (java&aws), ring|madrid, community of madrid, spain|https://www.linkedin.com/jobs/view/4393523906
ring|software development engineer, rbks dso eu|madrid, community of madrid, spain|https://www.linkedin.com/jobs/view/4409577947
apple|sr ios/cross-platform developer (findmy/airtag team)|malmo, skåne county, sweden|https://www.linkedin.com/jobs/view/4414161582
paypal|ios developer|stockholm, stockholm county, sweden|https://www.linkedin.com/jobs/view/4401775454
king|c++ developer|stockholm, stockholm county, sweden|https://www.linkedin.com/jobs/view/4408799537
king|c++ developer|malmo, skåne county, sweden|https://www.linkedin.com/jobs/view/4408784986
cisco|software engineer - graduate - sweden|stockholm, stockholm county, sweden|https://www.linkedin.com/jobs/view/4404059914
scrl|senior software engineer, ios|greater stockholm metropolitan area, worldwide|https://www.linkedin.com/jobs/view/4395856520
viaplay group|ios developer|stockholm, stockholm county, sweden|https://www.linkedin.com/jobs/view/4423988745
spotify|client engineer ii - core experience (formats & foundations)|stockholm, stockholm county, sweden|https://www.linkedin.com/jobs/view/4417751782
tobii dynavox®|software engineer - ios|stockholm, stockholm county, sweden|https://www.linkedin.com/jobs/view/4214589537
apple|applied machine learning engineer - security|zurich, zurich, switzerland|https://www.linkedin.com/jobs/view/4414167390
apple|aiml - senior ml/rl training infrastructure engineer, afm|zurich, zurich, switzerland|https://www.linkedin.com/jobs/view/4414170160
a1|ios software engineer|zurich, switzerland|https://www.linkedin.com/jobs/view/4418268283
apple|aiml - machine learning research engineer, generative ai - afm|zurich, zurich, switzerland|https://www.linkedin.com/jobs/view/4414162533
apple|aiml - machine learning research, multimodal foundation models|zurich, zurich, switzerland|https://www.linkedin.com/jobs/view/4414163533
holidaycheck ag|(junior) software engineer - ios (all genders)|bottighofen, thurgau, switzerland|https://www.linkedin.com/jobs/view/4407857432
google|software engineer iii, android virtual device framework|zurich, zurich, switzerland|https://www.linkedin.com/jobs/view/4423258442
appsflyer|sdk engineer|kyiv, kyiv city, ukraine|https://www.linkedin.com/jobs/view/4413057160
rakuten viber|ios rtc software engineer|kyiv, kyiv city, ukraine|https://www.linkedin.com/jobs/view/4416153977
apple|ml software engineer, london|london, england, united kingdom|https://www.linkedin.com/jobs/view/4414171025
apple|software engineer - darwin server, core os|london, england, united kingdom|https://www.linkedin.com/jobs/view/4414469737
apple|software engineer - infrastructure,swe developer foundations|london, england, united kingdom|https://www.linkedin.com/jobs/view/4415137874
apple|virtualisation engineer, coreos|london, england, united kingdom|https://www.linkedin.com/jobs/view/4414157719
apple|software engineer application|london, england, united kingdom|https://www.linkedin.com/jobs/view/4423996757
apple|software development engineer, photos ui, camera & photos|cambridge, england, united kingdom|https://www.linkedin.com/jobs/view/4414171055
apple|kernel engineer, core os|london, england, united kingdom|https://www.linkedin.com/jobs/view/4414166442
apple|c++ standard library performance engineer|london, england, united kingdom|https://www.linkedin.com/jobs/view/4414157721
apple|app development consulting engineer|london, england, united kingdom|https://www.linkedin.com/jobs/view/4414155726
apple|marcom creative technologist|london, england, united kingdom|https://www.linkedin.com/jobs/view/4414152820
apple|camera colour algorithm engineer|cambridge, england, united kingdom|https://www.linkedin.com/jobs/view/4414155763
apple|senior software engineer - backend, developer publications|london, england, united kingdom|https://www.linkedin.com/jobs/view/4414168355
apple|senior software engineer, photos ui, camera & photos|cambridge, england, united kingdom|https://www.linkedin.com/jobs/view/4414167407
apple|graphics architect|london, england, united kingdom|https://www.linkedin.com/jobs/view/4414173037
apple|swe - user land security researcher, sear (early career)|cheltenham, england, united kingdom|https://www.linkedin.com/jobs/view/4414172027
apple|devops software engineer lead - threat intelligence, sear|london, england, united kingdom|https://www.linkedin.com/jobs/view/4414154734
apple|emulation engineer|london, england, united kingdom|https://www.linkedin.com/jobs/view/4414151984
apple|devops software engineer lead - threat intelligence, sear|cheltenham, england, united kingdom|https://www.linkedin.com/jobs/view/4414166473
apple|early career cad tools optimisation engineer (design verification)|london, england, united kingdom|https://www.linkedin.com/jobs/view/4414170128
adevinta|ios engineer|barcelona, catalonia, spain|https://www.linkedin.com/jobs/view/4422425125
ubisoft barcelona mobile|tech programmer|barcelona, catalonia, spain|https://www.linkedin.com/jobs/view/4385025501
arise app|ios app developer (remote - m/f/d)|berlin, berlin, germany|https://www.linkedin.com/jobs/view/4412769777
payback|mobile engineer - ios (m/w/d)|berlin, germany|https://www.linkedin.com/jobs/view/4393544393
meyer sound|software engineer|berlin, berlin, germany|https://www.linkedin.com/jobs/view/4383503248
speechify|software engineer, macos core product|berlin, germany|https://www.linkedin.com/jobs/view/4358373749
pix4d|software engineer c++|berlin, berlin, germany|https://www.linkedin.com/jobs/view/4406977672
apple|partner solutions specialist emeia - cork|cork, county cork, ireland|https://www.linkedin.com/jobs/view/4414164453
apple|senior network engineer|cork, county cork, ireland|https://www.linkedin.com/jobs/view/4421049521
cisco|software engineer|cracow, małopolskie, poland|https://www.linkedin.com/jobs/view/4406617989
cisco|software engineer|cracow, małopolskie, poland|https://www.linkedin.com/jobs/view/4421874154
app-vise|junior app ontwikkelaar|heerhugowaard, north holland, netherlands|https://www.linkedin.com/jobs/view/4384717908
apple|software engineering manager, batch compute|dublin, county dublin, ireland|https://www.linkedin.com/jobs/view/4414151994
apple|software engineering manager (sre) - apple services engineering, dublin|dublin, county dublin, ireland|https://www.linkedin.com/jobs/view/4422888409
amazon web services (aws)|software development engineer, aws dms|dublin, county dublin, ireland|https://www.linkedin.com/jobs/view/4417428212
jpmorganchase|ios software engineer iii|glasgow, scotland, united kingdom|https://www.linkedin.com/jobs/view/4365064580
adobe|software development engineer (frontend)|edinburgh, scotland, united kingdom|https://www.linkedin.com/jobs/view/4423941887
cgi|ios developer|glasgow, scotland, united kingdom|https://www.linkedin.com/jobs/view/4414255919
blackrock|software engineer, associate|edinburgh, scotland, united kingdom|https://www.linkedin.com/jobs/view/4411215677
blackrock|software engineer, associate|edinburgh, scotland, united kingdom|https://www.linkedin.com/jobs/view/4418635355
motorola solutions|junior back end engineer|edinburgh, scotland, united kingdom|https://www.linkedin.com/jobs/view/4422655530
skyscanner|software engineering apprenticeship programme|glasgow, scotland, united kingdom|https://www.linkedin.com/jobs/view/4422891163
bosch|premaster programm - gapyear - software engineer ci/cd|lohr, bavaria, germany|https://www.linkedin.com/jobs/view/4402388033
apple|aiml - machine learning researcher, mlr|lausanne, vaud, switzerland|https://www.linkedin.com/jobs/view/4416755005
avl in sweden|software engineer - connected systems|gothenburg, västra götaland county, sweden|https://www.linkedin.com/jobs/view/4413552631
apple|quality engineer - machine learning|rellingen, schleswig-holstein, germany|https://www.linkedin.com/jobs/view/4414169252
apploft.|ios developer (m/w/d)|hamburg, hamburg, germany|https://www.linkedin.com/jobs/view/4028697095
amazon|jr. software develoment engineer|madrid, community of madrid, spain|https://www.linkedin.com/jobs/view/4410255892
revolut|graduate programme 2027: software engineer (ios)|spain|https://www.linkedin.com/jobs/view/4418838443
revolut|graduate programme 2027: software engineer (ios)|spain|https://www.linkedin.com/jobs/view/4418837401
adavo|ios engineer|malmo, skåne county, sweden|https://www.linkedin.com/jobs/view/4387120450
arm|graduate gpu software developer|lund, skåne county, sweden|https://www.linkedin.com/jobs/view/4381872729
quest global|swift developer|malmo, skåne county, sweden|https://www.linkedin.com/jobs/view/4409230781
revolut|graduate programme 2027: software engineer (ios)|united kingdom|https://www.linkedin.com/jobs/view/4419301372
starling|ios engineer|manchester, england, united kingdom|https://www.linkedin.com/jobs/view/4418975340
mda space|software engineer|manchester, england, united kingdom|https://www.linkedin.com/jobs/view/4417669023
bumper|junior backend engineer - uk|united kingdom|https://www.linkedin.com/jobs/view/4421796090
midnite|ios engineer - rewards ux|united kingdom|https://www.linkedin.com/jobs/view/4422424128
apple|cook|chester, england, united kingdom|https://www.linkedin.com/jobs/view/4414314944
apple|4g/5g software engineer, wireless technologies & ecosystems|munich, bavaria, germany|https://www.linkedin.com/jobs/view/4414168362
ebay|ios engineer|amsterdam, north holland, netherlands|https://www.linkedin.com/jobs/view/4408450683
codepole|ios developer|stockholm, stockholm county, sweden|https://www.linkedin.com/jobs/view/4410348789
paypal|sr ios engineer|stockholm, stockholm county, sweden|https://www.linkedin.com/jobs/view/4401764967
snap inc.|embedded engineer, operating system|vienna, vienna, austria|https://www.linkedin.com/jobs/view/4417082673
google|senior software engineer, ios, sleep coaching|warsaw, mazowieckie, poland|https://www.linkedin.com/jobs/view/4423245620
waymo|software engineer, driver validation|warsaw, mazowieckie, poland|https://www.linkedin.com/jobs/view/4413594064
google|software engineer, phd, early career, 2026 start|warsaw, mazowieckie, poland|https://www.linkedin.com/jobs/view/4365572950
google|software engineer, early careers, phd, gsoc server software|warsaw, mazowieckie, poland|https://www.linkedin.com/jobs/view/4365575666
affirm|software engineer ii, backend (ai agents)|london, ontario, canada|https://www.linkedin.com/jobs/view/4422072470
amazon|2026 applied scientist intern, amazon university talent acquisition|berlin, berlin, germany|https://www.linkedin.com/jobs/view/4369755791
amazon|2026 applied scientist intern, amazon university talent acquisition|munich, bavaria, germany|https://www.linkedin.com/jobs/view/4369763629
amazon|2026 applied scientist intern, amazon university talent acquisition|aachen, north rhine-westphalia, germany|https://www.linkedin.com/jobs/view/4369769443
amazon science|2026 applied scientist intern, amazon university talent acquisition|berlin, berlin, germany|https://www.linkedin.com/jobs/view/4411986113
prior labs|research scientist intern (phd)|berlin, berlin, germany|https://www.linkedin.com/jobs/view/4407422864
prior labs|research scientist intern (phd)|freiburg, baden-württemberg, germany|https://www.linkedin.com/jobs/view/4407413912
bobbie baustoffhandel 4.0|magento 2 entwickler (m/w/d)|aachen, north rhine-westphalia, germany|https://www.linkedin.com/jobs/view/3900523913
bobbie baustoffhandel 4.0|senior entwickler react (m/w/d) – digitale dachplanung am standort aachen|aachen, north rhine-westphalia, germany|https://www.linkedin.com/jobs/view/4363245051
taktile|software engineer intern|berlin, berlin, germany|https://www.linkedin.com/jobs/view/4342501529
tata consultancy services|backend developer intern|budapest, hungary|https://www.linkedin.com/jobs/view/4397266103
tata consultancy services|devops engineer intern|budapest, hungary|https://www.linkedin.com/jobs/view/4394774021
tata consultancy services|qa engineer intern|budapest, hungary|https://www.linkedin.com/jobs/view/4394759871
amazon|2026 applied scientist intern, amazon university talent acquisition|turin, piedmont, italy|https://www.linkedin.com/jobs/view/4335966728
amazon science|2026 applied scientist intern, amazon university talent acquisition|turin, piedmont, italy|https://www.linkedin.com/jobs/view/4411990070
amazon|data engineer internship - lux , amazon university talent acquisition (auta)|luxembourg, luxembourg, luxembourg|https://www.linkedin.com/jobs/view/4374757578
amazon|business intelligence intern|luxembourg, luxembourg, luxembourg|https://www.linkedin.com/jobs/view/4416060799
amazon|2026 applied scientist intern, amazon university talent acquisition|luxembourg, luxembourg, luxembourg|https://www.linkedin.com/jobs/view/4336689485
amazon science|2026 applied scientist intern, amazon university talent acquisition|echternach, grevenmacher, luxembourg|https://www.linkedin.com/jobs/view/4411985155
tkh airport solutions|intern - software engineering - front end development|haaksbergen, overijssel, netherlands|https://www.linkedin.com/jobs/view/4415953214
shipstation global poland|software engineer intern|zielona góra, lubuskie, poland|https://www.linkedin.com/jobs/view/4411206093
shipstation global poland|software engineer intern - full stack|zielona góra, lubuskie, poland|https://www.linkedin.com/jobs/view/4410993171
taktile|software engineer intern|iaşi, iaşi, romania|https://www.linkedin.com/jobs/view/4318298888
winnow|summer intern - software engineer (2026/2027 graduates)|cluj-napoca, cluj, romania|https://www.linkedin.com/jobs/view/4417477943
reacher|software engineer intern (fall 2025/summer 2026)|los angeles, canada|https://www.linkedin.com/jobs/view/4290120711
amazon|2026 applied scientist intern, amazon university talent acquisition|madrid, community of madrid, spain|https://www.linkedin.com/jobs/view/4400325015
amazon|2026 applied scientist intern, amazon university talent acquisition|barcelona, catalonia, spain|https://www.linkedin.com/jobs/view/4400324136
amazon science|2026 applied scientist intern, amazon university talent acquisition|barcelona, catalonia, spain|https://www.linkedin.com/jobs/view/4411978348
amazon|data engineer internship - uk, amazon university talent acquisition (auta)|london, england, united kingdom|https://www.linkedin.com/jobs/view/4374764214
amazon web services (aws)|2026 applied scientist intern, amazon university talent acquisition|london, england, united kingdom|https://www.linkedin.com/jobs/view/4336304822
amazon science|2026 applied scientist intern, amazon university talent acquisition|london, england, united kingdom|https://www.linkedin.com/jobs/view/4411971576
amazon web services (aws)|2026 applied scientist intern, amazon university talent acquisition|cambridge, england, united kingdom|https://www.linkedin.com/jobs/view/4336304821
amazon web services (aws)|2026 applied scientist intern, amazon university talent acquisition|edinburgh, scotland, united kingdom|https://www.linkedin.com/jobs/view/4336145396
thomson reuters|phd research scientist intern - foundational research|london, england, united kingdom|https://www.linkedin.com/jobs/view/4373381635
amazon|2026 software dev engineer intern - uk|london, england, united kingdom|https://www.linkedin.com/jobs/view/4308097460
deductive ai|software engineer intern, london|london, england, united kingdom|https://www.linkedin.com/jobs/view/4318516271
amazon|2026 software dev engineer intern - uk|cambridge, england, united kingdom|https://www.linkedin.com/jobs/view/4308092612
fever|becas de excelencia - engineering|madrid, community of madrid, spain|https://www.linkedin.com/jobs/view/4414222071
fever|becas de excelencia - engineering (barcelona)|barcelona, catalonia, spain|https://www.linkedin.com/jobs/view/4410176613
inhubber|sr. saas b2b sales – de c2/native, attraktive vergütung|albania, worldwide|https://www.linkedin.com/jobs/view/4422511553
arvatis media gmbh|plentyone engineer (m/w/d)|düsseldorf, north rhine-westphalia, germany|https://www.linkedin.com/jobs/view/4419906540
