company|title|location|link
sap|sap integration ixp intern - devops engineer|sofia, sofia city, worldwide|https://www.linkedin.com/jobs/view/4318367275
amazon|2026 software dev engineer intern - estonia|tallinn, harjumaa, worldwide|https://www.linkedin.com/jobs/view/4332775413
amazon web services (aws)|2026 applied scientist intern, amazon university talent acquisition|tallinn, harjumaa, worldwide|https://www.linkedin.com/jobs/view/4331395235
amazon|2026 business intelligence engineer internship|clichy, île-de-france, france|https://www.linkedin.com/jobs/view/4312927730
bigblue|solutions engineer intern|paris, île-de-france, france|https://www.linkedin.com/jobs/view/4332308160
comena|software engineering intern|munich, bavaria, germany|https://www.linkedin.com/jobs/view/4309748645
amazon|2026 business intelligence engineer internship|munich, bavaria, germany|https://www.linkedin.com/jobs/view/4312935250
bmw group|intern ai-based recommender systems (f/m/x)|munich, bavaria, germany|https://www.linkedin.com/jobs/view/4264451343
bobbie baustoffhandel 4.0|magento 2 entwickler (m/w/d)|aachen, north rhine-westphalia, germany|https://www.linkedin.com/jobs/view/3900523913
ge healthcare|software engineering intern|budapest, budapest, hungary|https://www.linkedin.com/jobs/view/4300035903
amazon|2026 software dev engineer intern - ireland|dublin, county dublin, ireland|https://www.linkedin.com/jobs/view/4308442126
amazon web services (aws)|2026 business intelligence engineer internship|milan, lombardy, italy|https://www.linkedin.com/jobs/view/4313224910
amazon|business intelligence intern|luxembourg, luxembourg, luxembourg|https://www.linkedin.com/jobs/view/4314152359
vanderlande|internship: ticket quality auditing tool|veghel, north brabant, netherlands|https://www.linkedin.com/jobs/view/4230811047
verpakkingsmanagement|service engineer weber|hilversum, north holland, netherlands|https://www.linkedin.com/jobs/view/4201047478
sogeti|medior cloud engineer|groningen, groningen, netherlands|https://www.linkedin.com/jobs/view/4311363884
capgemini|medior cloud engineer - nl|groningen, groningen, netherlands|https://www.linkedin.com/jobs/view/4314708665
capgemini|medior cloud engineer - nl|zwolle, overijssel, netherlands|https://www.linkedin.com/jobs/view/4315560465
sogeti|medior cloud engineer|leeuwarden, friesland, netherlands|https://www.linkedin.com/jobs/view/4332918465
sogeti|medior cloud engineer|zwolle, overijssel, netherlands|https://www.linkedin.com/jobs/view/4309359950
capgemini|medior cloud engineer - nl|leeuwarden, friesland, netherlands|https://www.linkedin.com/jobs/view/4319535821
picqer|head of engineering|arnhem, gelderland, netherlands|https://www.linkedin.com/jobs/view/4316070160
amazon|2026 software dev engineer intern - poland|warsaw, mazowieckie, poland|https://www.linkedin.com/jobs/view/4318287695
amazon|2026 software dev engineer intern - poland|gdańsk, pomorskie, poland|https://www.linkedin.com/jobs/view/4318292644
motorola solutions|cloud devops intern|cracow, małopolskie, poland|https://www.linkedin.com/jobs/view/4310363098
taktile|software engineer working student/intern|iaşi, iaşi, romania|https://www.linkedin.com/jobs/view/4318298888
amazon|2026 software dev engineer intern - romania|iaşi, iaşi, romania|https://www.linkedin.com/jobs/view/4318251005
amazon|2026 applied scientist intern, amazon university talent acquisition|iaşi, iaşi, romania|https://www.linkedin.com/jobs/view/4331395233
the walt disney company|software engineering intern, summer 2026|glendale, canada|https://www.linkedin.com/jobs/view/4332926936
reacher|software engineer intern (fall 2025/summer 2026)|los angeles, canada|https://www.linkedin.com/jobs/view/4290120711
amazon|jr. software development engineer|madrid, community of madrid, spain|https://www.linkedin.com/jobs/view/4298284923
amazon web services (aws)|2026 software dev engineer intern - spain|barcelona, catalonia, spain|https://www.linkedin.com/jobs/view/4308986221
amazon web services (aws)|2026 software dev engineer intern - spain|madrid, community of madrid, spain|https://www.linkedin.com/jobs/view/4308986222
amazon|2026 applied scientist intern, amazon university talent acquisition|barcelona, catalonia, spain|https://www.linkedin.com/jobs/view/4334121929
tata consultancy services|software engineer intern|zurich, switzerland|https://www.linkedin.com/jobs/view/4311871299
thomson reuters|applied scientist intern|zug, zug, switzerland|https://www.linkedin.com/jobs/view/4311139065
deductive ai|software engineer intern, london|london, england, united kingdom|https://www.linkedin.com/jobs/view/4318516271
amazon|2026 business intelligence engineer internship|london, england, united kingdom|https://www.linkedin.com/jobs/view/4306851600
targetjobs uk|gain a lot of experience during this web development internship in bristol!|bristol, england, united kingdom|https://www.linkedin.com/jobs/view/4320732566
thomson reuters|applied science intern|london, england, united kingdom|https://www.linkedin.com/jobs/view/4311118969
thales|internship ( 6 months full-time) full-stack developer|prague, prague, worldwide|https://www.linkedin.com/jobs/view/4333596896
mygwork - lgbtq+ business community|2026 applied scientist intern, amazon university talent acquisition|barcelona, catalonia, spain|https://www.linkedin.com/jobs/view/4337728648
adesso austria gmbh|lead data engineer (all genders) [wien]|vienna, austria|https://www.linkedin.com/jobs/view/3866805015
adesso austria gmbh|lead data engineer (all genders) [graz]|graz, styria, austria|https://www.linkedin.com/jobs/view/3866802372
bigblue|software engineer intern|paris, île-de-france, france|https://www.linkedin.com/jobs/view/3575815459
advenworks|data engineer - international internship|paris, île-de-france, france|https://www.linkedin.com/jobs/view/4264683521
hermeus|human machine interface (hmi) software engineering intern  - spring & summer 2026|ga, atlanta, worldwide|https://www.linkedin.com/jobs/view/4318270340
jungmut|full stack developer:in (w/m/d)|germany|https://www.linkedin.com/jobs/view/4313333377
centraal bureau voor de statistiek|software engineer|the hague, south holland, netherlands|https://www.linkedin.com/jobs/view/4307670409
datavisual|cloud engineer|enter, overijssel, netherlands|https://www.linkedin.com/jobs/view/4307896173
centraal bureau voor de statistiek|devops engineer|the hague, south holland, netherlands|https://www.linkedin.com/jobs/view/4307677339
the walt disney company|software engineering intern, summer 2026|glendale, canada|https://www.linkedin.com/jobs/view/4333046374
meta|research scientist intern, ai core machine learning|paris, île-de-france, france|https://www.linkedin.com/jobs/view/4309509934
meta|research scientist intern, code generation (msc)|paris, île-de-france, france|https://www.linkedin.com/jobs/view/4309525071
meta|research scientist intern, representation learning|paris, île-de-france, france|https://www.linkedin.com/jobs/view/4311947502
meta|research scientist intern, comms & language (phd) language research scientist|paris, île-de-france, france|https://www.linkedin.com/jobs/view/4310297381
meta|research scientist intern, alignment - brain and ai (phd) (paris)|paris, île-de-france, france|https://www.linkedin.com/jobs/view/4312444506
meta|research scientist intern, ai core machine learning (phd)|paris, île-de-france, france|https://www.linkedin.com/jobs/view/4313321055
meta|research scientist intern, code generation (phd) (paris)|paris, île-de-france, france|https://www.linkedin.com/jobs/view/4312233711
meta|research scientist intern, comms and language (phd) computer vision research|paris, île-de-france, france|https://www.linkedin.com/jobs/view/4310285589
meta|research scientist intern, representation learning (phd)|paris, île-de-france, france|https://www.linkedin.com/jobs/view/4311955399
meta|research scientist intern, code generation (phd) (tel aviv)|paris, île-de-france, france|https://www.linkedin.com/jobs/view/4333984812
delta air lines|graduate intern, innovation - extended reality (xr) - (summer 2026)|ga, atlanta, worldwide|https://www.linkedin.com/jobs/view/4315418601
meta|production engineer, intern|dublin, county dublin, ireland|https://www.linkedin.com/jobs/view/4313305359
monumental|forward deployed robotics engineer|amsterdam, north holland, netherlands|https://www.linkedin.com/jobs/view/4318520173
meta|research scientist intern, machine learning, human motion models (phd)|zurich, zurich, switzerland|https://www.linkedin.com/jobs/view/4313317108
meta|research scientist intern, 3d computer vision and generative ai (phd)|zurich, zurich, switzerland|https://www.linkedin.com/jobs/view/4306506280
meta|research scientist intern, generative ai (phd)|zurich, zurich, switzerland|https://www.linkedin.com/jobs/view/4311344188
meta|research scientist intern, perception for human inputs and interactions (phd)|zurich, zurich, switzerland|https://www.linkedin.com/jobs/view/4302967562
meta|research scientist intern, rendering and reconstruction (phd)|zurich, zurich, switzerland|https://www.linkedin.com/jobs/view/4305872702
meta|software engineer intern|london, england, united kingdom|https://www.linkedin.com/jobs/view/4299534674
meta|detection & response security engineer, intern|london, england, united kingdom|https://www.linkedin.com/jobs/view/4303768540
meta|production engineer, intern|london, england, united kingdom|https://www.linkedin.com/jobs/view/4315910641
meta|research scientist intern, code generation (phd) (london)|london, england, united kingdom|https://www.linkedin.com/jobs/view/4312234689
meta|software engineer intern, machine learning (phd)|london, england, united kingdom|https://www.linkedin.com/jobs/view/4306109884
meta|research scientist intern, monetization computer vision (phd)|london, england, united kingdom|https://www.linkedin.com/jobs/view/4301485470
meta|research scientist intern, audio, machine learning and computer vision (phd)|cambridge, england, united kingdom|https://www.linkedin.com/jobs/view/4294760052
meta|research scientist intern, 3d perception, understanding and generative ai (phd)|london, england, united kingdom|https://www.linkedin.com/jobs/view/4318945364
meta|research scientist intern, 3d world modelling, robotics and generative ai (phd)|london, england, united kingdom|https://www.linkedin.com/jobs/view/4295889706
leeroo|research scientist intern – phd (ai agentic systems)|london, england, united kingdom|https://www.linkedin.com/jobs/view/4270923748
meta|research scientist intern, fair embodiment & actions (phd)|paris, île-de-france, france|https://www.linkedin.com/jobs/view/4311910449
beyond now|summer-internship 2026: software developer (m/f/x) in r&d|raaba, styria, austria|https://www.linkedin.com/jobs/view/4303899459
beyond now|spring-internship 2026: software developer (m/f/x) in r&d|raaba, styria, austria|https://www.linkedin.com/jobs/view/4300688852
beyond now|summer-internship 2026: software developer (m/f/x) for customer projects|raaba, styria, austria|https://www.linkedin.com/jobs/view/4304001477
beyond now|spring-internship 2026: software developer (m/f/x) for customer projects|raaba, styria, austria|https://www.linkedin.com/jobs/view/4301001642
deliverect|data engineer intern|ghent, flemish region, belgium|https://www.linkedin.com/jobs/view/4319476134
juris legal|join us as a digital intern and help build the future of legal tech|copenhagen, capital region of denmark, denmark|https://www.linkedin.com/jobs/view/4332927590
finobo|lead fullstack developer (ui/ux first) søges til digital satsning i hjertet af aarhus ⚡|aarhus, central denmark region, denmark|https://www.linkedin.com/jobs/view/4318260252
pigment|internship - software engineer (back, fullstack)|paris, île-de-france, france|https://www.linkedin.com/jobs/view/4303067905
back market|analytics engineer ai intern|bordeaux, nouvelle-aquitaine, france|https://www.linkedin.com/jobs/view/4318533915
ingenico|ia development engineer intern|valence, auvergne-rhône-alpes, france|https://www.linkedin.com/jobs/view/4314760550
breega|devops & software engineering intern @ entalpic|paris, île-de-france, france|https://www.linkedin.com/jobs/view/4318250086
pigment|internship - site reliability engineer|paris, île-de-france, france|https://www.linkedin.com/jobs/view/4247416058
bonsai|growth engineer intern|paris, île-de-france, france|https://www.linkedin.com/jobs/view/4295517800
back market|data analytics intern, customer delight|paris, île-de-france, france|https://www.linkedin.com/jobs/view/4318541825
la french tech taiwan|affiliation marketing intern (german speaker)|paris, île-de-france, france|https://www.linkedin.com/jobs/view/4320499860
equifax|usis/eds technology intern|ga, alpharetta, worldwide|https://www.linkedin.com/jobs/view/4319562634
equifax|usis technology intern|ga, alpharetta, worldwide|https://www.linkedin.com/jobs/view/4302777988
snowflake|software engineer intern - berlin (2026)|berlin, berlin, germany|https://www.linkedin.com/jobs/view/4311124015
energy robotics|working student / intern (m/f/d) unsolicited|darmstadt, hesse, germany|https://www.linkedin.com/jobs/view/4309562282
european space agency - esa|intern in the engineering, software development and visualization tools|darmstadt, hesse, germany|https://www.linkedin.com/jobs/view/4333409612
mca germany|java-entwickler (w/m/d)|nuremberg, bavaria, germany|https://www.linkedin.com/jobs/view/4139491879
tagueri ag|software engineer (m/w/d)*|munich, bavaria, germany|https://www.linkedin.com/jobs/view/4268771588
tagueri ag|software engineer (m/w/d)*|stuttgart, baden-württemberg, germany|https://www.linkedin.com/jobs/view/4268774317
aampere|business automation intern (m/f/x)|munich, bavaria, germany|https://www.linkedin.com/jobs/view/4312291467
tiktok|automation & enablement project intern (tiktok live) 2025 start (bs/ms)|munich, bavaria, germany|https://www.linkedin.com/jobs/view/4280880590
qualcomm|fy26 intern - systems data engineer internship – sensors (cork, ireland)|cork, county cork, ireland|https://www.linkedin.com/jobs/view/4297851597
mongodb|2026 - software engineering intern, dublin|dublin, county dublin, ireland|https://www.linkedin.com/jobs/view/4299787109
mongodb|2026 - software engineering intern - internal engineering, dublin|dublin, county dublin, ireland|https://www.linkedin.com/jobs/view/4334079726
tiktok|sre video architecture project intern (rd) - 2026 start (bs/ms)|dublin, county dublin, ireland|https://www.linkedin.com/jobs/view/4309729602
tagueri ag|software engineer (m/v/x)*|hengelo, overijssel, netherlands|https://www.linkedin.com/jobs/view/4268774320
port of rotterdam|data engineer v  x  m|rotterdam, south holland, netherlands|https://www.linkedin.com/jobs/view/4333696579
surplusmap|internship data engineer|oslo, oslo, norway|https://www.linkedin.com/jobs/view/4226127074
mensa philosophical circle|artificial intelligence intern|poland|https://www.linkedin.com/jobs/view/4334241633
waymo|2026 summer intern, bs/ms, software engineering, commercialization|warsaw, mazowieckie, poland|https://www.linkedin.com/jobs/view/4311207640
waymo|2026 summer intern, bs/ms, software engineer, simulation multiverse|warsaw, mazowieckie, poland|https://www.linkedin.com/jobs/view/4314053939
uber|2026 automation internship, krakow|cracow, małopolskie, poland|https://www.linkedin.com/jobs/view/4331622165
bosch|automation & ai internship (f/m)|warsaw, mazowieckie, poland|https://www.linkedin.com/jobs/view/4319007793
bnp paribas|digital marketing developer intern|lisbon, lisbon, portugal|https://www.linkedin.com/jobs/view/4331755436
bnp paribas cib|digital marketing developer intern|lisboa, lisbon, portugal|https://www.linkedin.com/jobs/view/4333229217
transperfect|internship - site reliability engineer|lisbon, portugal|https://www.linkedin.com/jobs/view/4314022989
unbabel|site reliability engineering intern|lisbon, portugal|https://www.linkedin.com/jobs/view/4314043042
the walt disney studios|disney entertainment software engineering intern, summer 2026|burbank, canada|https://www.linkedin.com/jobs/view/4332436712
sift|software engineering intern|el segundo, canada|https://www.linkedin.com/jobs/view/4302879895
tiktok|software engineer intern (tiktok-social-user and relation) - 2026 summer (bs/ms)|los angeles, canada|https://www.linkedin.com/jobs/view/4277120938
newegg|ai project intern – computer vision|diamond bar, canada|https://www.linkedin.com/jobs/view/4303704897
descartes systems group|developer intern|žilina, zilina, worldwide|https://www.linkedin.com/jobs/view/4315842857
keysight technologies|software development intern|barcelona, catalonia, spain|https://www.linkedin.com/jobs/view/4313358184
chamberly ab|partner & intern – android developer (full stack)|sweden|https://www.linkedin.com/jobs/view/4314605178
cgi|tjänsteägare ai|stockholm, stockholm county, sweden|https://www.linkedin.com/jobs/view/4333081379
thomson reuters|research engineering intern|zug, zug, switzerland|https://www.linkedin.com/jobs/view/4312756097
ti&m|senior cloud platform engineer aws / gcp / azure|zurich, zurich, switzerland|https://www.linkedin.com/jobs/view/4251539272
ti&m|senior cloud application engineer aws / gcp / azure|zurich, zurich, switzerland|https://www.linkedin.com/jobs/view/4215538450
slb|full-stack software engineer intern (12 months)|abingdon-on-thames, england, united kingdom|https://www.linkedin.com/jobs/view/4314392604
slb|embedded software engineer intern (12 months)|stonehouse, england, united kingdom|https://www.linkedin.com/jobs/view/4310090388
slb|cloud software engineer intern (12 months)|abingdon-on-thames, england, united kingdom|https://www.linkedin.com/jobs/view/4307282227
tourism marketing agency|intern, associate ai engineer|london, england, united kingdom|https://www.linkedin.com/jobs/view/4319133657
monzo bank|associate software engineer - intern|london, england, united kingdom|https://www.linkedin.com/jobs/view/4301309975
dojo|intern, associate ai engineer|london, england, united kingdom|https://www.linkedin.com/jobs/view/4319090050
thomson reuters|research engineering intern|london, england, united kingdom|https://www.linkedin.com/jobs/view/4312750158
deutsche bank|lead engineer (d/m/w) – bare metal as-a-service (bmaas)|frankfurt, hesse, germany|https://www.linkedin.com/jobs/view/4263272246
instadeep|research engineer intern bioai|london, england, united kingdom|https://www.linkedin.com/jobs/view/4283928978
waymo|2026 summer intern, phd, machine learning engineer, simulation|london, england, united kingdom|https://www.linkedin.com/jobs/view/4301605050
latinx in ai (lxai)|2026 summer intern, phd, machine learning engineer, simulation|city of london, england, united kingdom|https://www.linkedin.com/jobs/view/4310317624
targetjobs uk|machine learning science intern - june 2026 - london - phd|london, england, united kingdom|https://www.linkedin.com/jobs/view/4319286042
aampere|business automation intern (m/f/x) @ e-mobility startup|munich, bavaria, germany|https://www.linkedin.com/jobs/view/4333867324
back market|affiliation marketing intern (german speaker)|paris, île-de-france, france|https://www.linkedin.com/jobs/view/4333828896
instaffo|(senior) devops/cloud engineer gcp - 100 % remote|dortmund, north rhine-westphalia, germany|https://www.linkedin.com/jobs/view/4317309823
back market|seller quality operations manager intern|bordeaux, nouvelle-aquitaine, france|https://www.linkedin.com/jobs/view/4333937038
touchpoint gmbh|full stack data engineer mit schwerpunkt dateninfrastruktur, ai-agents und automatisierung|flensburg, schleswig-holstein, germany|https://www.linkedin.com/jobs/view/4309265889
eyeline|research intern (fall 2025/spring 2026)|los angeles, canada|https://www.linkedin.com/jobs/view/4316042916
eyeline|research intern (summer 2026)|los angeles, canada|https://www.linkedin.com/jobs/view/4316043887
eurofunk kappacher gmbh|trainee softwareentwicklung (m/w/d)|sankt johann im pongau, salzburg, austria|https://www.linkedin.com/jobs/view/4143170633
sentry|software engineer, intern (summer 2026)|innere stadt, vienna, austria|https://www.linkedin.com/jobs/view/4309395824
revo foods|student internship in software engineering|vienna, vienna, austria|https://www.linkedin.com/jobs/view/4294423612
dynatrace|software engineering - summer internships 2026 (m/f/x)|vienna, vienna, austria|https://www.linkedin.com/jobs/view/4311446372
dynatrace|software engineering - summer internships 2026 (m/f/x)|linz, upper austria, austria|https://www.linkedin.com/jobs/view/4312473716
dynatrace|software engineering - summer internships 2026 (m/f/x)|graz, styria, austria|https://www.linkedin.com/jobs/view/4311427512
dynatrace|software engineering - summer internships 2026 (m/f/x)|hagenberg im mühlkreis, upper austria, austria|https://www.linkedin.com/jobs/view/4312466871
the riverside company|2026 private equity intern, riverside europe|brussels region, belgium|https://www.linkedin.com/jobs/view/4310966569
siemens digital industries software|strategic student program belgium, simcenter simulation and test solutions  (sts)|leuven, flemish region, belgium|https://www.linkedin.com/jobs/view/4314798360
terumo europe|marketing solutions & innovations intern|leuven, flemish region, belgium|https://www.linkedin.com/jobs/view/4318041837
odoo|software engineer intern|ramillies, walloon region, belgium|https://www.linkedin.com/jobs/view/4318244320
match group|software engineer internship|ghent, flemish region, belgium|https://www.linkedin.com/jobs/view/4314505518
procter & gamble|software engineering internship|mechelen, flemish region, belgium|https://www.linkedin.com/jobs/view/4287143227
procter & gamble|software engineering internship|brussels, brussels region, belgium|https://www.linkedin.com/jobs/view/4259880365
fidenz technologies|trainee software engineers|on, walloon region, belgium|https://www.linkedin.com/jobs/view/4304984793
septentrio part of hexagon|internship  embedded software ecosystems integrator  leuven|leuven, flemish region, belgium|https://www.linkedin.com/jobs/view/4095600538
septentrio part of hexagon|internship  innovative software application/ tooling  leuven|leuven, flemish region, belgium|https://www.linkedin.com/jobs/view/4186594874
belgie vacature|ervaren douanedeclarant|rekkem, flemish region, belgium|https://www.linkedin.com/jobs/view/4310476521
mensura|it operations medewerker-applicaties|hasselt, flemish region, belgium|https://www.linkedin.com/jobs/view/4332063603
orise|lead automation engineer (m/f/d)|antwerp, flemish region, belgium|https://www.linkedin.com/jobs/view/4317746221
vgd|business analist it|bruges, flemish region, belgium|https://www.linkedin.com/jobs/view/4302768719
vgd|business analist it|kortrijk, flemish region, belgium|https://www.linkedin.com/jobs/view/4302771711
vgd|business analist it|ghent, flemish region, belgium|https://www.linkedin.com/jobs/view/4302778512
vgd|business analist it|aalst, flemish region, belgium|https://www.linkedin.com/jobs/view/4302771710
vgd|business analist it|st-niklaas, flemish region, belgium|https://www.linkedin.com/jobs/view/4302773662
assa abloy group|technical support engineer|diegem, flemish region, belgium|https://www.linkedin.com/jobs/view/4270323221
belgie vacature|laborant klinische analyses|lier, flemish region, belgium|https://www.linkedin.com/jobs/view/4331356174
bosch digital bulgaria|technical communication and digital learning - intern|sofia, sofia city, worldwide|https://www.linkedin.com/jobs/view/4332416665
abysalto|software engineering trainee (student) – linux devices (m/f)|zagreb, zagreb, worldwide|https://www.linkedin.com/jobs/view/4277111164
talos|software engineer intern, connectivity|cyprus, worldwide|https://www.linkedin.com/jobs/view/4279261057
crystal intelligence|data analytics intern - stablecoin insights (remote)|limassol, limassol, worldwide|https://www.linkedin.com/jobs/view/4319390702
ethics code|prompt engineer/ qa- internship fall (contract sept-dec)|caleta, la romana, worldwide|https://www.linkedin.com/jobs/view/4288471436
amazon|software development intern, intech|deventer, overijssel, netherlands|https://www.linkedin.com/jobs/view/4334183568
