company|title|location|link
google|software engineer ii, embedded systems, firmware|mont-saint-guibert, walloon region, belgium|https://www.linkedin.com/jobs/view/4419068147
uber|software engineer - denmark pool|aarhus, central denmark region, denmark|https://www.linkedin.com/jobs/view/4418903028
amazon|system development engineer - image quality, rbks camera and imaging|tampere metropolitan area, worldwide|https://www.linkedin.com/jobs/view/4388744308
amazon|sr. software development engineer - image quality, rbks camera and imaging|tampere metropolitan area, worldwide|https://www.linkedin.com/jobs/view/4388739631
amazon|lead isp algorithm developer, camera and imaging|tampere metropolitan area, worldwide|https://www.linkedin.com/jobs/view/4402074326
zalando|backend engineer (data science / ml) - hybrid|helsinki, uusimaa, finland|https://www.linkedin.com/jobs/view/4383439842
amazon web services (aws)|software development engineer, aws security|courbevoie, île-de-france, france|https://www.linkedin.com/jobs/view/4377190566
aramis group|software engineer - pricing - f/h|arcueil, île-de-france, france|https://www.linkedin.com/jobs/view/4418141611
amazon web services (aws)|senior software development engineer - security automation, aws security opres|courbevoie, île-de-france, france|https://www.linkedin.com/jobs/view/4313466434
amazon web services (aws)|security engineer, aws cirt|courbevoie, île-de-france, france|https://www.linkedin.com/jobs/view/4413749848
aramisauto|software engineer - pricing - f/h - cdi|arcueil, île-de-france, france|https://www.linkedin.com/jobs/view/4402188059
amo|software engineer, backend (rust)|paris, île-de-france, france|https://www.linkedin.com/jobs/view/4318518230
apple|devops software engineer - security research, sear|paris, île-de-france, france|https://www.linkedin.com/jobs/view/4414157706
amo|software engineer, backend (safety)|paris, île-de-france, france|https://www.linkedin.com/jobs/view/4318505627
amazon web services (aws)|delivery consultant - ai/ml, aws professional services|ga, atlanta, worldwide|https://www.linkedin.com/jobs/view/4411828490
state farm|(hybrid) software engineer-aws|ga, atlanta, worldwide|https://www.linkedin.com/jobs/view/4423968658
amazon web services (aws)|delivery consultant - ai/ml, professional services - aws industries|ga, atlanta, worldwide|https://www.linkedin.com/jobs/view/4422642500
amazon web services (aws)|delivery consultant - ai/ml, professional services - aws industries|ga, atlanta, worldwide|https://www.linkedin.com/jobs/view/4422638514
amazon web services (aws)|delivery consultant - ai/ml, professional services - aws industries|ga, atlanta, worldwide|https://www.linkedin.com/jobs/view/4422625686
nasdaq|analyst - software developer|ga, atlanta, worldwide|https://www.linkedin.com/jobs/view/4391149193
amazon web services (aws)|delivery consultant - ai/ml, aws professional services|ga, atlanta, worldwide|https://www.linkedin.com/jobs/view/4421268342
salesforce|software engineer ii, search & data infrastructure -slack|ga, atlanta, worldwide|https://www.linkedin.com/jobs/view/4419418281
amazon web services (aws)|data engineer ii - amz27052.1|ga, atlanta, worldwide|https://www.linkedin.com/jobs/view/4422632556
slack|software engineer ii, search & data infrastructure -slack|ga, atlanta, worldwide|https://www.linkedin.com/jobs/view/4419460154
amazon web services (aws)|business intel engineer ii - amz27009.1|ga, atlanta, worldwide|https://www.linkedin.com/jobs/view/4419912701
autodesk|java software engineer|ga, atlanta, worldwide|https://www.linkedin.com/jobs/view/4406233625
adp|application developer|ga, alpharetta, worldwide|https://www.linkedin.com/jobs/view/4410317807
google|software engineer, phd, early career, infrastructure, 2026 start|ga, atlanta, worldwide|https://www.linkedin.com/jobs/view/4365577515
amazon|operations engineer, ssd startup|ga, atlanta, worldwide|https://www.linkedin.com/jobs/view/4419911687
iterable|software engineer ii|ga, atlanta, worldwide|https://www.linkedin.com/jobs/view/4415956920
salesforce|software engineer (swe/swe ii), ai platform- slack|ga, atlanta, worldwide|https://www.linkedin.com/jobs/view/4405663534
u.s. bank|software engineer 2 ( backend)|ga, atlanta, worldwide|https://www.linkedin.com/jobs/view/4415812111
slack|software engineer (swe/swe ii), ai platform- slack|ga, atlanta, worldwide|https://www.linkedin.com/jobs/view/4405656234
cnn|software engineer ii|ga, atlanta, worldwide|https://www.linkedin.com/jobs/view/4391380684
amazon|software development engineer, community feedback|berlin, germany|https://www.linkedin.com/jobs/view/4422388198
amazon|robotics software engineer, amazon robotics r&d|berlin, germany|https://www.linkedin.com/jobs/view/4420474399
amazon|robotics software engineer, amazon robotics r&d|berlin, germany|https://www.linkedin.com/jobs/view/4420481269
amazon web services (aws)|principal software engineer|berlin, germany|https://www.linkedin.com/jobs/view/4359625574
amazon|sr. robotics software engineer, amazon robotics|berlin, germany|https://www.linkedin.com/jobs/view/4419905810
ebay|software engineer, search ranking|berlin metropolitan area, worldwide|https://www.linkedin.com/jobs/view/4417990574
apple|software engineer, backend systems|munich, bavaria, germany|https://www.linkedin.com/jobs/view/4414162385
amazon web services (aws)|principal engineer, ec2|berlin, germany|https://www.linkedin.com/jobs/view/4269252301
apple|software engineer - backend systems, software delivery|munich, bavaria, germany|https://www.linkedin.com/jobs/view/4414156789
amazon|applied scientist, amazon robotics|berlin, germany|https://www.linkedin.com/jobs/view/4413751706
amazon|applied scientist, amazon robotics r&d|berlin, germany|https://www.linkedin.com/jobs/view/4420467746
apple|sw optimization engineer ai/ml|munich, bavaria, germany|https://www.linkedin.com/jobs/view/4414157731
flix|software engineer (kotlin, java) (m/f/d) - capacity management team|berlin, berlin, germany|https://www.linkedin.com/jobs/view/4404335707
zendesk|software backend engineer|berlin, berlin, germany|https://www.linkedin.com/jobs/view/4416845095
airbus defence and space|software developer - cloud/ai/big data platform team (automation focus)|manching, bavaria, germany|https://www.linkedin.com/jobs/view/4417669507
amazon web services (aws)|systems engineer, managed operations, managed operations|berlin, germany|https://www.linkedin.com/jobs/view/4418171884
trusted shops|software engineer backend & cloud (m/f/d)|berlin, berlin, germany|https://www.linkedin.com/jobs/view/4405552604
amazon science|applied scientist ii, aft ai, amazon aft ai|berlin, berlin, germany|https://www.linkedin.com/jobs/view/4419638472
apple|analog mixed-signal modeling software engineer (m/f/d)|munich, bavaria, germany|https://www.linkedin.com/jobs/view/4414172038
apple|cellular software engineer|munich, bavaria, germany|https://www.linkedin.com/jobs/view/4414169243
shopflix.gr|backend engineer|central athens, attiki, greece|https://www.linkedin.com/jobs/view/4372487415
epam systems|data software engineer|hungary|https://www.linkedin.com/jobs/view/4341323082
amazon|software development engineer|dublin, county dublin, ireland|https://www.linkedin.com/jobs/view/4418048472
amazon|software development engineer, amazon foundational security services|dublin, county dublin, ireland|https://www.linkedin.com/jobs/view/4419553637
amazon|software development engineer, amazon foundational security services|dublin, county dublin, ireland|https://www.linkedin.com/jobs/view/4416444673
amazon|software development engineer, amazon optics|dublin, county dublin, ireland|https://www.linkedin.com/jobs/view/4408067403
amazon|software development engineer, amazon optics|dublin, county dublin, ireland|https://www.linkedin.com/jobs/view/4404504132
amazon|software development engineer, amazon optics|dublin, county dublin, ireland|https://www.linkedin.com/jobs/view/4408064506
amazon web services (aws)|software development engineer - elasticache, aws elasticache|dublin, county dublin, ireland|https://www.linkedin.com/jobs/view/4400649366
amazon web services (aws)|software development engineer, firecracker|dublin, county dublin, ireland|https://www.linkedin.com/jobs/view/4416919898
amazon web services (aws)|software development engineer, aws dms|dublin, county dublin, ireland|https://www.linkedin.com/jobs/view/4419992629
amazon web services (aws)|software development engineer, aws lambda, aws lambda control plane|dublin, county dublin, ireland|https://www.linkedin.com/jobs/view/4409039474
amazon|systems development engineer, amazon foundational security services|dublin, county dublin, ireland|https://www.linkedin.com/jobs/view/4413493534
amazon|systems development engineer, amazon foundational security services|dublin, county dublin, ireland|https://www.linkedin.com/jobs/view/4384341212
amazon web services (aws)|software development engineer, ml navigators|dublin, county dublin, ireland|https://www.linkedin.com/jobs/view/4411847004
amazon web services (aws)|software development engineer - rds platform, aurora & rds console and cloudformation|dublin, county dublin, ireland|https://www.linkedin.com/jobs/view/4418453072
amazon web services (aws)|software development engineer - rds platform, rds|dublin, county dublin, ireland|https://www.linkedin.com/jobs/view/4416985653
amazon web services (aws)|software dev engineer, shield (anti-ddos)|dublin, county dublin, ireland|https://www.linkedin.com/jobs/view/4421206120
amazon web services (aws)|software dev engineer, shield (anti-ddos)|dublin, county dublin, ireland|https://www.linkedin.com/jobs/view/4421204167
amazon web services (aws)|systems development engineer, core network, esc|dublin, county dublin, ireland|https://www.linkedin.com/jobs/view/4378678852
amazon|systems development engineer, enterprise engineering|dublin, county dublin, ireland|https://www.linkedin.com/jobs/view/4389297373
amazon|sr. sde, amazon email services|dublin, county dublin, ireland|https://www.linkedin.com/jobs/view/4418041759
amaris consulting|ai software engineer|milan, lombardy, italy|https://www.linkedin.com/jobs/view/4416276479
amazon|applied scientist, alexa ai|turin, piedmont, italy|https://www.linkedin.com/jobs/view/4421259662
amazon|applied scientist, alexa ai|turin, piedmont, italy|https://www.linkedin.com/jobs/view/4421273273
qualcomm|backend software developer - arduino, turin, italy|turin, piedmont, italy|https://www.linkedin.com/jobs/view/4393471483
apple|software engineer - creative imaging apps|vilnius, vilniaus, worldwide|https://www.linkedin.com/jobs/view/4414153809
apple|graphics software engineer - creative imaging apps|vilnius, vilniaus, worldwide|https://www.linkedin.com/jobs/view/4414163532
nasdaq|software engineer|vilnius, vilniaus, worldwide|https://www.linkedin.com/jobs/view/4378624957
amazon|software dev engineer ii - 12 months contract|luxembourg, luxembourg, luxembourg|https://www.linkedin.com/jobs/view/4366746874
amazon|ai engineer, amazon business|luxembourg, luxembourg, luxembourg|https://www.linkedin.com/jobs/view/4411486974
amazon|business intelligence engineer, amazon groceries|luxembourg, luxembourg, luxembourg|https://www.linkedin.com/jobs/view/4416991624
amazon|software development manager, transportation network configuration|luxembourg, luxembourg, luxembourg|https://www.linkedin.com/jobs/view/4422402169
amazon|operations manager|oh, etna, worldwide|https://www.linkedin.com/jobs/view/4421873452
amazon|area manager ii|oh, etna, worldwide|https://www.linkedin.com/jobs/view/4419542978
amazon|sr. operations manager|oh, etna, worldwide|https://www.linkedin.com/jobs/view/4411831419
amazon|area manager ii, rsr|wv, davisville, worldwide|https://www.linkedin.com/jobs/view/4412410379
ebay|software engineer - services|amsterdam, north holland, netherlands|https://www.linkedin.com/jobs/view/4401948655
amazon|software development intern, intech|deventer, overijssel, netherlands|https://www.linkedin.com/jobs/view/4421204224
ebay|software engineer|amsterdam, north holland, netherlands|https://www.linkedin.com/jobs/view/4407211268
albert heijn|software engineer datakitchen|zaandam, north holland, netherlands|https://www.linkedin.com/jobs/view/4416940732
albert heijn|back end engineer (kotlin, kubernetes, kafka)|zaandam, north holland, netherlands|https://www.linkedin.com/jobs/view/4410222420
amazon|software development engineer internship - vaga para mulheres, ies- latech|deventer, overijssel, netherlands|https://www.linkedin.com/jobs/view/4342905273
ebay|backend engineer|amsterdam, north holland, netherlands|https://www.linkedin.com/jobs/view/4417940918
databricks|software engineer - backend|amsterdam, north holland, netherlands|https://www.linkedin.com/jobs/view/4297740909
albert heijn|back end engineer (kotlin, devops, kafka)|zaandam, north holland, netherlands|https://www.linkedin.com/jobs/view/4408546432
albert heijn|backend engineer (kotlin, kafka, ai/llm systems)|zaandam, north holland, netherlands|https://www.linkedin.com/jobs/view/4410052845
ebay|machine learning engineer|amsterdam, north holland, netherlands|https://www.linkedin.com/jobs/view/4399790472
samba tv|software engineer - data integration|amsterdam, north holland, netherlands|https://www.linkedin.com/jobs/view/4417315697
starapple|backend developer|wijchen, gelderland, netherlands|https://www.linkedin.com/jobs/view/4417048543
de bijenkorf|medior backend engineer|amsterdam, north holland, netherlands|https://www.linkedin.com/jobs/view/4418101220
booking.com|ai backend software engineer ii - ai application platform|amsterdam, north holland, netherlands|https://www.linkedin.com/jobs/view/4416900001
just eat takeaway.com|junior platform engineer|enschede, overijssel, netherlands|https://www.linkedin.com/jobs/view/4417267668
picnic technologies|software engineer - logistics|amsterdam, north holland, netherlands|https://www.linkedin.com/jobs/view/4416914803
databricks|software engineer - fullstack|amsterdam, north holland, netherlands|https://www.linkedin.com/jobs/view/4297748047
nippur|azure software engineer|nijmegen, gelderland, netherlands|https://www.linkedin.com/jobs/view/4414025981
appear|software engineer|oslo, norway|https://www.linkedin.com/jobs/view/4409946339
piano|java software engineer|oslo, norway|https://www.linkedin.com/jobs/view/4412768918
amazon|software development engineer, rbks opex|gdansk metropolitan area, worldwide|https://www.linkedin.com/jobs/view/4418113575
amazon|software development engineer, ring|gdansk metropolitan area, worldwide|https://www.linkedin.com/jobs/view/4415526279
amazon|software development engineer, ring operations|gdansk metropolitan area, worldwide|https://www.linkedin.com/jobs/view/4405883995
amazon|software development engineer, ring cloud computer vision|gdansk metropolitan area, worldwide|https://www.linkedin.com/jobs/view/4403846109
amazon|software development engineer – 2026|gdansk metropolitan area, worldwide|https://www.linkedin.com/jobs/view/4333206592
amazon|software development engineer, ring cloud computer vision|gdansk metropolitan area, worldwide|https://www.linkedin.com/jobs/view/4374454392
amazon|embedded software engineer ii, ring|gdansk metropolitan area, worldwide|https://www.linkedin.com/jobs/view/4384888307
amazon|senior software engineer, speech mlops|gdańsk, pomorskie, poland|https://www.linkedin.com/jobs/view/4380960415
amazon|senior software engineer, speech mlops|kraków, mazowieckie, poland|https://www.linkedin.com/jobs/view/4380960416
waymo|software engineer, payment be|warsaw, mazowieckie, poland|https://www.linkedin.com/jobs/view/4413585436
google|software engineer iii, infrastructure, google cloud|warsaw, mazowieckie, poland|https://www.linkedin.com/jobs/view/4403609556
amp|software engineer poland|warsaw, mazowieckie, poland|https://www.linkedin.com/jobs/view/4327625692
aristocrat|backend developer|warsaw, mazowieckie, poland|https://www.linkedin.com/jobs/view/4418226626
zendesk|software engineer (backend)|cracow, małopolskie, poland|https://www.linkedin.com/jobs/view/4411506395
allegro|software engineer 2 (java / kotlin) - delivery experience|warsaw, mazowieckie, poland|https://www.linkedin.com/jobs/view/4412771089
waymo|software engineer, fleet orchestration infra|warsaw, mazowieckie, poland|https://www.linkedin.com/jobs/view/4423286156
pepsico|back end developer|cracow metropolitan area, worldwide|https://www.linkedin.com/jobs/view/4414242882
akamai technologies|software engineer ii|cracow, małopolskie, poland|https://www.linkedin.com/jobs/view/4409000117
google|software engineer, early careers, phd, cloud ai|warsaw, mazowieckie, poland|https://www.linkedin.com/jobs/view/4320919263
google|software engineer iii, compute infrastructure control|warsaw, mazowieckie, poland|https://www.linkedin.com/jobs/view/4418262114
amazon|software development engineer, amazon privacy|iaşi, iaşi, romania|https://www.linkedin.com/jobs/view/4420652107
amazon|software development engineer, amazon stores|iaşi, iaşi, romania|https://www.linkedin.com/jobs/view/4410744479
amazon|software development engineer – 2026|iaşi, iaşi, romania|https://www.linkedin.com/jobs/view/4331790453
amazon|system development engineer , coss|iaşi, iaşi, romania|https://www.linkedin.com/jobs/view/4370114478
amazon|system development engineer , coss|bucharest, bucharest, romania|https://www.linkedin.com/jobs/view/4370105960
amazon|sr software dev engineer, customer behavior analytics|iaşi, iaşi, romania|https://www.linkedin.com/jobs/view/4364523026
adobe|ai software engineer|bucharest, bucharest, romania|https://www.linkedin.com/jobs/view/4410483807
adobe|software development engineer - adobe analytics|bucharest, bucharest, romania|https://www.linkedin.com/jobs/view/4416192579
amazon|sr software development engineer, buyer safety experience|bucharest, bucharest, romania|https://www.linkedin.com/jobs/view/4390841013
adobe|software development engineer - adobe sites optimizer|bucharest, bucharest, romania|https://www.linkedin.com/jobs/view/4395984324
amazon|software development engineer, ring neighbors|hawthorne, canada|https://www.linkedin.com/jobs/view/4342778430
amazon|software development engineer, device club|hawthorne, canada|https://www.linkedin.com/jobs/view/4406385646
amazon|software development engineer – amazon leo (us)|los angeles, canada|https://www.linkedin.com/jobs/view/4359611505
amazon|software development engineer, measurement, ad tech, and data science (mads)|santa monica, canada|https://www.linkedin.com/jobs/view/4411173433
amazon|software dev engineer ii, alexa mobile performance|irvine, canada|https://www.linkedin.com/jobs/view/4415862705
amazon web services (aws)|software dev engineer ii - amz26812.1|santa monica, canada|https://www.linkedin.com/jobs/view/4407554053
amazon|software development engineer - military veterans|culver city, canada|https://www.linkedin.com/jobs/view/4371834042
amazon|software development engineer, amazon leo for government|los angeles, canada|https://www.linkedin.com/jobs/view/4415588527
amazon|application builder, mobile applications|hawthorne, canada|https://www.linkedin.com/jobs/view/4398566144
amazon web services (aws)|software development engineer, aws engagement security|irvine, canada|https://www.linkedin.com/jobs/view/4416995114
amazon|data engineer, ring agent platforms|hawthorne, canada|https://www.linkedin.com/jobs/view/4402462625
amazon|software i&t engineer , amazon leo for government|el segundo, canada|https://www.linkedin.com/jobs/view/4372225520
amazon|data engineer ii, ring agent platforms|hawthorne, canada|https://www.linkedin.com/jobs/view/4387640498
amazon science|instrument control engineer, software, center for quantum computing|pasadena, canada|https://www.linkedin.com/jobs/view/4404167418
prime video & amazon mgm studios|systems development engineer, production and post production technology|culver city, canada|https://www.linkedin.com/jobs/view/4388759137
amazon|ai data engineer, ring/blink customer service engineering and insights|hawthorne, canada|https://www.linkedin.com/jobs/view/4413764590
prime video & amazon mgm studios|systems development engineer, production and post production technology|culver city, canada|https://www.linkedin.com/jobs/view/4408259354
prime video & amazon mgm studios|systems development engineer, production and post production technology|culver city, canada|https://www.linkedin.com/jobs/view/4408246784
prime video & amazon mgm studios|systems development engineer, production and post production technology|culver city, canada|https://www.linkedin.com/jobs/view/4408243851
amazon|sr. software dev engineer, production and post production technology|culver city, canada|https://www.linkedin.com/jobs/view/4408244888
microsoft|software engineer|serbia, worldwide|https://www.linkedin.com/jobs/view/4421344372
amazon|software development engineer, amazon business|madrid, community of madrid, spain|https://www.linkedin.com/jobs/view/4370113538
amazon|software development engineer – 2026|barcelona, catalonia, spain|https://www.linkedin.com/jobs/view/4370107915
amazon|software development engineer, amazon business|madrid, community of madrid, spain|https://www.linkedin.com/jobs/view/4370110790
amazon|software development engineer – 2026|madrid, community of madrid, spain|https://www.linkedin.com/jobs/view/4370122071
amazon|software development engineer - discovery tech, discotec (discovery technology & science)|madrid, community of madrid, spain|https://www.linkedin.com/jobs/view/4413201239
amazon|software development engineer - discovery tech, discotec (discovery technology & science)|madrid, community of madrid, spain|https://www.linkedin.com/jobs/view/4419924279
amazon|software developper engineer ii|madrid, community of madrid, spain|https://www.linkedin.com/jobs/view/4369763630
amazon|machine learning engineer, amazon tablets|madrid, community of madrid, spain|https://www.linkedin.com/jobs/view/4414960919
amazon|software development engineer sde (madrid), euic core search cx|madrid, community of madrid, spain|https://www.linkedin.com/jobs/view/4405402233
amazon|software developer engineer ii, business delivery experience|madrid, community of madrid, spain|https://www.linkedin.com/jobs/view/4381660907
amazon web services (aws)|systems engineer, managed operations|madrid, community of madrid, spain|https://www.linkedin.com/jobs/view/4380570965
amazon web services (aws)|systems engineer, managed operations|madrid, community of madrid, spain|https://www.linkedin.com/jobs/view/4383848664
amazon web services (aws)|systems engineer, managed operations|madrid, community of madrid, spain|https://www.linkedin.com/jobs/view/4343876716
amazon web services (aws)|system engineer, managed operations|madrid, community of madrid, spain|https://www.linkedin.com/jobs/view/4411231409
apple|language engineer (spanish), global siri|barcelona, catalonia, spain|https://www.linkedin.com/jobs/view/4414171030
apple|machine learning tools engineer, global siri|barcelona, catalonia, spain|https://www.linkedin.com/jobs/view/4414150964
amazon|software development manager, books data quality|madrid, community of madrid, spain|https://www.linkedin.com/jobs/view/4414665574
amazon web services (aws)|systems engineer, managed operations|madrid, community of madrid, spain|https://www.linkedin.com/jobs/view/4411232427
amphora logistics|software developer|barcelona, catalonia, spain|https://www.linkedin.com/jobs/view/4316946127
amazon|data engineer internship - esp, amazon university talent acquisition (auta)|barcelona, catalonia, spain|https://www.linkedin.com/jobs/view/4375077949
amaris consulting|backend engineer (java/python, aws) with driver's license -f/m/x|gothenburg, västra götaland county, sweden|https://www.linkedin.com/jobs/view/4421696764
apple|ar/vr software engineer, vision products software|greater stockholm metropolitan area, worldwide|https://www.linkedin.com/jobs/view/4414150947
paypal|backend software engineer|stockholm, stockholm county, sweden|https://www.linkedin.com/jobs/view/4407445348
amazon rivr|senior software engineer – backend|zurich, zurich, switzerland|https://www.linkedin.com/jobs/view/4338400542
amazon rivr|software engineer – devops|zurich, zurich, switzerland|https://www.linkedin.com/jobs/view/4410741340
amazon rivr|hardware interface software engineer|zurich, zurich, switzerland|https://www.linkedin.com/jobs/view/4410743256
amazon rivr|senior software engineer – mlops|zurich, zurich, switzerland|https://www.linkedin.com/jobs/view/4300095279
amazon rivr|software engineer robot platform - isaacsim simulation focus|zurich, zurich, switzerland|https://www.linkedin.com/jobs/view/4410205240
amazon rivr|robotics platform jetson integration engineer|zurich, zurich, switzerland|https://www.linkedin.com/jobs/view/4410728638
google|software engineer iii, database systems|zurich, zurich, switzerland|https://www.linkedin.com/jobs/view/4422038383
google|software engineer iii, infrastructure, merchant api|zurich, zurich, switzerland|https://www.linkedin.com/jobs/view/4416188632
amazon rivr|embedded linux systems engineer|zurich, zurich, switzerland|https://www.linkedin.com/jobs/view/4409035422
google|software engineer iii, infrastructure|zurich, zurich, switzerland|https://www.linkedin.com/jobs/view/4418808887
amo|middle golang developer|kyiv, kyiv city, ukraine|https://www.linkedin.com/jobs/view/4418925715
appsflyer|software engineer|kyiv, kyiv city, ukraine|https://www.linkedin.com/jobs/view/4387704083
appsflyer|backend engineer|kyiv, kyiv city, ukraine|https://www.linkedin.com/jobs/view/4412660862
amazon|software development engineer, alexa international|london, england, united kingdom|https://www.linkedin.com/jobs/view/4421873502
amazon|software development engineer, alexa for shopping|london, england, united kingdom|https://www.linkedin.com/jobs/view/4422382195
