company|title|location|link
amazon|software development engineer, ring|cambridge, england, united kingdom|https://www.linkedin.com/jobs/view/4410729887
amazon|software development engineer – 2026|london, england, united kingdom|https://www.linkedin.com/jobs/view/4409440772
amazon|software development engineer – 2026|cambridge, england, united kingdom|https://www.linkedin.com/jobs/view/4409450564
amazon|software dev engineer, amazon security automation|london, england, united kingdom|https://www.linkedin.com/jobs/view/4421351145
amazon|software development engineer, advertising|london, england, united kingdom|https://www.linkedin.com/jobs/view/4418442573
amazon web services (aws)|system development engineer, aws|london, england, united kingdom|https://www.linkedin.com/jobs/view/4417353604
amazon|software engineer , ring|cambridge, england, united kingdom|https://www.linkedin.com/jobs/view/4416914961
amazon|software engineer, ring|cambridge, england, united kingdom|https://www.linkedin.com/jobs/view/4416914957
amazon|embedded c++ software engineer, ring|cambridge, england, united kingdom|https://www.linkedin.com/jobs/view/4384339254
amazon web services (aws)|site reliability engineer, region services|london, england, united kingdom|https://www.linkedin.com/jobs/view/4300056448
apple|software engineer, apple cloud object store|london, england, united kingdom|https://www.linkedin.com/jobs/view/4414174016
prime video & amazon mgm studios|software development engineer, web & emerging modalities, prime video|london, england, united kingdom|https://www.linkedin.com/jobs/view/4411487921
amazon web services (aws)|site reliability engineer, region services|amber valley, england, united kingdom|https://www.linkedin.com/jobs/view/4300057420
amazon|ios software development engineer, ring|cambridge, england, united kingdom|https://www.linkedin.com/jobs/view/4416924322
amazon web services (aws)|systems engineer, aws|goring, england, united kingdom|https://www.linkedin.com/jobs/view/4418188460
amazon web services (aws)|systems engineer, aws|goring, england, united kingdom|https://www.linkedin.com/jobs/view/4418191190
amazon web services (aws)|systems engineer, aws|goring, england, united kingdom|https://www.linkedin.com/jobs/view/4418174698
amazon|ai design technologist, marketing productivity, amazon ads marketing|london, england, united kingdom|https://www.linkedin.com/jobs/view/4412412345
amazon|senior software development engineer, discovery tech|barcelona, catalonia, spain|https://www.linkedin.com/jobs/view/4370110795
microsoft|backend software engineer ii|barcelona, catalonia, spain|https://www.linkedin.com/jobs/view/4417722387
amazon|business intelligence engineer, nft|barcelona, catalonia, spain|https://www.linkedin.com/jobs/view/4398562311
apple|language engineer (polish), global siri|barcelona, catalonia, spain|https://www.linkedin.com/jobs/view/4414172048
adevinta|backend engineer|barcelona, catalonia, spain|https://www.linkedin.com/jobs/view/4405641654
amazon science|applied scientist, amazon robotics|berlin, berlin, germany|https://www.linkedin.com/jobs/view/4417982299
amazon|applied scientist ii, aft ai, amazon aft ai|berlin, germany|https://www.linkedin.com/jobs/view/4422161426
adobe|software development engineer - adobe mix modeler|bucharest, bucharest, romania|https://www.linkedin.com/jobs/view/4415028480
adobe|software development engineer - identity resilience|bucharest, bucharest, romania|https://www.linkedin.com/jobs/view/4416198504
adobe|software development engineer|bucharest, bucharest, romania|https://www.linkedin.com/jobs/view/4417895637
airbus defence and space|software engineer|bucharest, bucharest, romania|https://www.linkedin.com/jobs/view/4406409896
adobe|software development engineer|bucharest, bucharest, romania|https://www.linkedin.com/jobs/view/4409948718
apple|software engineer (data), ai & data platforms|cork, county cork, ireland|https://www.linkedin.com/jobs/view/4414169230
apple|ai / data engineer|cork, county cork, ireland|https://www.linkedin.com/jobs/view/4423937040
apple|web services engineer - localisation & release engineering|cork, county cork, ireland|https://www.linkedin.com/jobs/view/4414152811
apple|ml engineer, ai & data platforms|cork, county cork, ireland|https://www.linkedin.com/jobs/view/4414168343
apple|software engineer (data apps + frontend), ai & data platforms|cork, county cork, ireland|https://www.linkedin.com/jobs/view/4414166441
apple|full stack development engineer - operations rad bi - 18 month contract|cork, county cork, ireland|https://www.linkedin.com/jobs/view/4418803077
google|software engineer iii, discovery and assessment|cracow, małopolskie, poland|https://www.linkedin.com/jobs/view/4412945605
cisco|software engineer (python)|cracow, małopolskie, poland|https://www.linkedin.com/jobs/view/4407831137
akamai technologies|software engineer (java) - remote from poland|cracow, małopolskie, poland|https://www.linkedin.com/jobs/view/4384127078
akamai technologies|software engineer ii - akamai inference cloud - remote/poland|cracow, małopolskie, poland|https://www.linkedin.com/jobs/view/4401065630
pepsico|backend  engineer|cracow, małopolskie, poland|https://www.linkedin.com/jobs/view/4411543722
pepsico|backend  engineer|cracow, małopolskie, poland|https://www.linkedin.com/jobs/view/4411545779
arista networks|software engineer - sonic|cracow, małopolskie, poland|https://www.linkedin.com/jobs/view/4412742909
albert heijn|backend developer (kotlin/java, kafka, ai/llm systemen)|zaandam, north holland, netherlands|https://www.linkedin.com/jobs/view/4417328278
albert heijn|backend developer (kotlin, event-driven)|zaandam, north holland, netherlands|https://www.linkedin.com/jobs/view/4419152152
amazon|software development engineer – 2026|edinburgh, scotland, united kingdom|https://www.linkedin.com/jobs/view/4409459257
amazon|software development engineer, amazon ads creativex|edinburgh, scotland, united kingdom|https://www.linkedin.com/jobs/view/4409529618
amazon|software development engineer, advertising, supply enablement|edinburgh, scotland, united kingdom|https://www.linkedin.com/jobs/view/4414958970
amazon|2026 software dev engineer intern - uk|edinburgh, scotland, united kingdom|https://www.linkedin.com/jobs/view/4308093564
amazon|applied scientist, intelligent talent acquisition - lead generation & detection services|edinburgh, scotland, united kingdom|https://www.linkedin.com/jobs/view/4410206341
accenture|java software engineer|scotland, united kingdom|https://www.linkedin.com/jobs/view/4417947488
amazon|network development engineer, office network reliability engineering|edinburgh, scotland, united kingdom|https://www.linkedin.com/jobs/view/4418046575
accenture|software engineer|scotland, united kingdom|https://www.linkedin.com/jobs/view/4417226477
accenture uk & ireland|software engineer - scotland|glasgow, scotland, united kingdom|https://www.linkedin.com/jobs/view/4402328238
amazon|its network eng i (omc) - l4, operations management center (omc), omc|edinburgh, scotland, united kingdom|https://www.linkedin.com/jobs/view/4412994687
adesso se|software engineer enterprise search (all genders)|frankfurt, hesse, germany|https://www.linkedin.com/jobs/view/4191828198
adobe|cloud backend engineer - adobe cloud platform|hamburg, hamburg, germany|https://www.linkedin.com/jobs/view/4406226914
apple|ml software engineer - music creation apps - m/f/d|rellingen, schleswig-holstein, germany|https://www.linkedin.com/jobs/view/4414165451
apple|software engineering - audio & music apps - m/f/d|hamburg, hamburg, germany|https://www.linkedin.com/jobs/view/4414154713
apple|software engineering - audio & music apps - m/f/d|rellingen, schleswig-holstein, germany|https://www.linkedin.com/jobs/view/4414156773
adobe|senior software engineer, cloud platform|hamburg, hamburg, germany|https://www.linkedin.com/jobs/view/4406226913
adesso se|software engineer enterprise search (all genders)|hamburg, hamburg, germany|https://www.linkedin.com/jobs/view/4191823817
about you|backend engineer - recommendation (all genders)|hamburg, hamburg, germany|https://www.linkedin.com/jobs/view/4401415362
about you|backend engineer - search engine (all genders)|hamburg, hamburg, germany|https://www.linkedin.com/jobs/view/4401194723
about you|backend engineer - search engine (all genders)|greater hamburg area, worldwide|https://www.linkedin.com/jobs/view/4401408515
hermes germany gmbh|backend-developer (m/w/d)|hamburg, hamburg, germany|https://www.linkedin.com/jobs/view/4411887718
amazon|software development engineer, rufus|london, england, united kingdom|https://www.linkedin.com/jobs/view/4419117019
amazon|software dev engineer machine learning|madrid, community of madrid, spain|https://www.linkedin.com/jobs/view/4408003463
amazon web services (aws)|systems analyst, aws|amber valley, england, united kingdom|https://www.linkedin.com/jobs/view/4421867494
accenture|python developer|manchester, england, united kingdom|https://www.linkedin.com/jobs/view/4412757285
accenture|software engineer|leeds, england, united kingdom|https://www.linkedin.com/jobs/view/4415277365
accenture|python developer|greater leeds area, worldwide|https://www.linkedin.com/jobs/view/4412741396
accenture|java software engineer|manchester area, united kingdom|https://www.linkedin.com/jobs/view/4412744715
accenture|java software engineer|leeds, england, united kingdom|https://www.linkedin.com/jobs/view/4412743309
accenture uk & ireland|software engineer - leeds|leeds, england, united kingdom|https://www.linkedin.com/jobs/view/4328150936
accenture|software engineer (frontend / backend / full-stack)|manchester, england, united kingdom|https://www.linkedin.com/jobs/view/4407784057
accenture uk & ireland|software engineer - manchester|manchester, england, united kingdom|https://www.linkedin.com/jobs/view/4328029501
apple|cellular software development engineer|munich, bavaria, germany|https://www.linkedin.com/jobs/view/4414156771
apple|software build engineer, software delivery|munich, bavaria, germany|https://www.linkedin.com/jobs/view/4414152852
apple|software engineer – cellular data plane systems (m/f/d)|munich, bavaria, germany|https://www.linkedin.com/jobs/view/4414158696
amazon|ontologist, product knowledge ontology|munich, bavaria, germany|https://www.linkedin.com/jobs/view/4422452555
microsoft|software engineer - github actions|prague, prague, worldwide|https://www.linkedin.com/jobs/view/4421819164
microsoft|software engineer ii|prague, prague, worldwide|https://www.linkedin.com/jobs/view/4414606081
microsoft|software engineer|prague, prague, worldwide|https://www.linkedin.com/jobs/view/4414599284
rewe international ag|backend software engineer (m/f/x)|vienna, vienna, austria|https://www.linkedin.com/jobs/view/4407826503
waymo|software engineer, automation platform & workflows|warsaw, mazowieckie, poland|https://www.linkedin.com/jobs/view/4423267959
waymo|software engineer, backend|warsaw, mazowieckie, poland|https://www.linkedin.com/jobs/view/4363415641
google|software engineer ii, cloud ai/ml|warsaw, mazowieckie, poland|https://www.linkedin.com/jobs/view/4418201270
google|software engineer ii, cloud ml/ai|warsaw, mazowieckie, poland|https://www.linkedin.com/jobs/view/4417865286
samsung electronics polska|python developer|warsaw, mazowieckie, poland|https://www.linkedin.com/jobs/view/4417045739
google|software engineer ii, ai/ml|warsaw, mazowieckie, poland|https://www.linkedin.com/jobs/view/4417185242
amd|software development eng.|warsaw, mazowieckie, poland|https://www.linkedin.com/jobs/view/4412804421
amd|software development eng.|warsaw, mazowieckie, poland|https://www.linkedin.com/jobs/view/4413316837
affirm|software engineer ii, backend (pmi integrations)|london, ontario, canada|https://www.linkedin.com/jobs/view/4366041150
affirm|software engineer ii, backend (merchant advocacy)|london, ontario, canada|https://www.linkedin.com/jobs/view/4411906760
amazon|software development engineer, business information governance|dublin, county dublin, ireland|https://www.linkedin.com/jobs/view/4403143378
amazon web services (aws)|software development engineer, aws dms|dublin, county dublin, ireland|https://www.linkedin.com/jobs/view/4419996476
amazon web services (aws)|software development engineer, lambda - experience|dublin, county dublin, ireland|https://www.linkedin.com/jobs/view/4422172317
amazon web services (aws)|software development engineer, lambda - experience|dublin, county dublin, ireland|https://www.linkedin.com/jobs/view/4422641430
amazon web services (aws)|software development engineer - lambda, lambda - experience|dublin, county dublin, ireland|https://www.linkedin.com/jobs/view/4422161432
amazon web services (aws)|software development engineer, core network|dublin, county dublin, ireland|https://www.linkedin.com/jobs/view/4414678327
amazon|systems developer engineer, security integrations group|madrid, community of madrid, spain|https://www.linkedin.com/jobs/view/4419920462
ring|software development engineer, billing and subscriptions, ring|madrid, community of madrid, spain|https://www.linkedin.com/jobs/view/4421869491
amazon web services (aws)|systems development engineer, aws incident response (air), aws incident response (air)|dublin, county dublin, ireland|https://www.linkedin.com/jobs/view/4420653072
amazon|2026 software dev engineer intern - ireland|dublin, county dublin, ireland|https://www.linkedin.com/jobs/view/4392944927
amazon|systems engineer, amazon foundational security services|dublin, county dublin, ireland|https://www.linkedin.com/jobs/view/4393901608
zalando|software engineer - logistics engineering (all genders)|erfurt, thuringia, germany|https://www.linkedin.com/jobs/view/4422410727
ebay|software engineer - infrastructure|dublin, county dublin, ireland|https://www.linkedin.com/jobs/view/4398415290
apple|software engineering - audio & music apps - m/f/d|berlin, berlin, germany|https://www.linkedin.com/jobs/view/4414171041
amazon|sr. embedded sde, ring|gdansk metropolitan area, worldwide|https://www.linkedin.com/jobs/view/4415514879
google|software engineer iii, google compute engine, fleet management|dublin, county dublin, ireland|https://www.linkedin.com/jobs/view/4412938771
apple|linux kernel engineer|dublin, county dublin, ireland|https://www.linkedin.com/jobs/view/4414169235
google|software engineer iii, discovery and assessment|warsaw, mazowieckie, poland|https://www.linkedin.com/jobs/view/4412945604
amazon web services (aws)|systems engineer/dev ops eng, managed operations|berlin, germany|https://www.linkedin.com/jobs/view/4333646486
amazon|senior machine learning software development engineer, ai ops integration|dublin, county dublin, ireland|https://www.linkedin.com/jobs/view/4416902950
albert heijn|backend developer (kotlin, event-driven, devops)|zaandam, north holland, netherlands|https://www.linkedin.com/jobs/view/4415272450
jd.com|software engineer|amsterdam, north holland, netherlands|https://www.linkedin.com/jobs/view/4417738508
cisco|software engineer - cloud platform|galway, county galway, ireland|https://www.linkedin.com/jobs/view/4408504261
arista networks|software engineer, engineering productivity|dublin, county dublin, ireland|https://www.linkedin.com/jobs/view/4277905574
amazon web services (aws)|systems engineer/dev ops eng, managed operations|dublin, county dublin, ireland|https://www.linkedin.com/jobs/view/4405815473
jpmorganchase|software engineer iii - aws|dublin, county dublin, ireland|https://www.linkedin.com/jobs/view/4404534376
netapp|software engineer|reykjavik, capital region, worldwide|https://www.linkedin.com/jobs/view/4414813435
fresco|backend engineer (based in dublin or madrid)|dublin, county dublin, ireland|https://www.linkedin.com/jobs/view/4414000510
jpmorganchase|software engineer ii - backend (java)|dublin, county dublin, ireland|https://www.linkedin.com/jobs/view/4400342724
cisco|software engineer|galway, county galway, ireland|https://www.linkedin.com/jobs/view/4404057866
ebay|senior software engineer|amsterdam, north holland, netherlands|https://www.linkedin.com/jobs/view/4399795371
amazon web services (aws)|network development engineer , european sovereign cloud|dublin, county dublin, ireland|https://www.linkedin.com/jobs/view/4411221497
mongodb|software engineer 3|dublin, county dublin, ireland|https://www.linkedin.com/jobs/view/4420417366
apple|build and developer productivity engineer (m/f/d)|munich, bavaria, germany|https://www.linkedin.com/jobs/view/4414171035
amazon web services (aws)|senior software development engineer, aurora control plane developer experience|dublin, county dublin, ireland|https://www.linkedin.com/jobs/view/4406685620
ebay|mts 2, software engineer, data platforms|dublin, county dublin, ireland|https://www.linkedin.com/jobs/view/4412902173
amazon science|applied scientist, amazon robotics r&d|berlin, berlin, germany|https://www.linkedin.com/jobs/view/4417996022
dhl ecommerce nederland|scala developer|utrecht, utrecht, netherlands|https://www.linkedin.com/jobs/view/4413480324
google|software engineer iii, ai infrastructure|warsaw, mazowieckie, poland|https://www.linkedin.com/jobs/view/4418847879
amazon web services (aws)|network development engineer , eusc (european sovereign cloud)|dublin, county dublin, ireland|https://www.linkedin.com/jobs/view/4378682738
tesla|software distributed systems engineer, energy software|amsterdam, north holland, netherlands|https://www.linkedin.com/jobs/view/4420221475
google|software engineer iii, flume ml|warsaw, mazowieckie, poland|https://www.linkedin.com/jobs/view/4414142554
allegro|software engineer 1 (java / kotlin) - allegro ads|poznań, wielkopolskie, poland|https://www.linkedin.com/jobs/view/4416639719
google|software engineer iii, infrastructure, wan core|dublin, county dublin, ireland|https://www.linkedin.com/jobs/view/4418592823
temu|software engineer|ireland|https://www.linkedin.com/jobs/view/4409774322
zattoo|software engineer - video ingest & storage|berlin, berlin, germany|https://www.linkedin.com/jobs/view/4419595702
google|software engineer iii, global network technology|dublin, county dublin, ireland|https://www.linkedin.com/jobs/view/4418819440
amazon web services (aws)|snr. systems development engineer, esc managed operations|dublin, county dublin, ireland|https://www.linkedin.com/jobs/view/4298292739
amazon web services (aws)|systems engineer, esc managed operations|madrid, community of madrid, spain|https://www.linkedin.com/jobs/view/4343596557
mongodb|software engineer 3, query execution|dublin, county dublin, ireland|https://www.linkedin.com/jobs/view/4385530436
klaviyo|software engineer ii, reliability|dublin, county dublin, ireland|https://www.linkedin.com/jobs/view/4367296032
wolt|software engineer|berlin, berlin, germany|https://www.linkedin.com/jobs/view/4416571498
sap|developer associate (f/m/d) for sap cloud infrastructure|berlin, berlin, germany|https://www.linkedin.com/jobs/view/4412135147
google|software engineer, performance, reliability, observability, phd, early career|warsaw, mazowieckie, poland|https://www.linkedin.com/jobs/view/4321301694
mongodb|software engineer 3|dublin, county dublin, ireland|https://www.linkedin.com/jobs/view/4390660470
pinterest|software engineer ii|dublin, county dublin, ireland|https://www.linkedin.com/jobs/view/4422403184
amazon|software development manager, icon|dublin, county dublin, ireland|https://www.linkedin.com/jobs/view/4391524215
amazon web services (aws)|systems engineer, esc managed operations|madrid, community of madrid, spain|https://www.linkedin.com/jobs/view/4405893679
jamf|software engineer ii (java)|brno, south moravia, worldwide|https://www.linkedin.com/jobs/view/4419915328
adesso se|software engineer enterprise search (all genders)|munich, bavaria, germany|https://www.linkedin.com/jobs/view/4191826403
adesso se|software engineer enterprise search (all genders)|leipzig, saxony, germany|https://www.linkedin.com/jobs/view/4191823818
adesso se|software engineer enterprise search (all genders)|stuttgart, baden-württemberg, germany|https://www.linkedin.com/jobs/view/4191829005
adesso se|software engineer enterprise search (all genders)|dortmund, north rhine-westphalia, germany|https://www.linkedin.com/jobs/view/4191828197
sony interactive entertainment|software eng ii|dublin, county dublin, ireland|https://www.linkedin.com/jobs/view/4412052110
apple|senior full stack engineer - services technology|dublin, county dublin, ireland|https://www.linkedin.com/jobs/view/4414163504
adesso se|software engineer enterprise search (all genders)|düsseldorf, north rhine-westphalia, germany|https://www.linkedin.com/jobs/view/4191826407
google|software engineer, phd, early career, compute infrastructure, spatial flexibility|warsaw, mazowieckie, poland|https://www.linkedin.com/jobs/view/4382459042
akamai technologies|software engineer - akamai inference cloud - remote/poland|cracow, małopolskie, poland|https://www.linkedin.com/jobs/view/4388102171
adesso se|software engineer enterprise search (all genders)|cologne, north rhine-westphalia, germany|https://www.linkedin.com/jobs/view/4191829007
apple|cellular rf receiver systems engineer - dsp (m/f/d)|linz, upper austria, austria|https://www.linkedin.com/jobs/view/4414162514
loop®|ios developer|salzburg, salzburg, austria|https://www.linkedin.com/jobs/view/4342897135
apple|rf system validation engineer|linz, upper austria, austria|https://www.linkedin.com/jobs/view/4414439791
platogo|junior backend developer|vienna, vienna, austria|https://www.linkedin.com/jobs/view/4417933254
piper maddox|software developer|vienna, austria|https://www.linkedin.com/jobs/view/4418599878
apple|experienced cellular ip design engineer (m/f/d)|linz, upper austria, austria|https://www.linkedin.com/jobs/view/4414457698
anyline|software engineer (m/f/x)|vienna, vienna, austria|https://www.linkedin.com/jobs/view/4417618340
accenture dach|(junior) backend engineer (all genders)|innsbruck, tyrol, austria|https://www.linkedin.com/jobs/view/4413831729
cherry|software engineer (m/w/d) - systemnahe software|vienna, austria|https://www.linkedin.com/jobs/view/4408825375
snap inc.|embedded engineer, operating system|vienna, austria|https://www.linkedin.com/jobs/view/4417140351
tinder|software engineer ii, ios|ghent, flemish region, belgium|https://www.linkedin.com/jobs/view/4392052141
sofascore|ios software engineer|croatia, zagreb, worldwide|https://www.linkedin.com/jobs/view/4413042186
porsche digital croatia|ios engineer|croatia, zagreb, worldwide|https://www.linkedin.com/jobs/view/4417477524
plum|ios engineer|nicosia, nicosia, worldwide|https://www.linkedin.com/jobs/view/4303994490
veo technologies|ios engineer|copenhagen, capital region of denmark, denmark|https://www.linkedin.com/jobs/view/4405648047
nokia|software engineering trainee|espoo, uusimaa, finland|https://www.linkedin.com/jobs/view/4414355103
apple|machine learning tools engineer, global siri|paris, île-de-france, france|https://www.linkedin.com/jobs/view/4414169260
apple|security tooling - senior software engineer, sear|paris, île-de-france, france|https://www.linkedin.com/jobs/view/4414154737
apple|applied machine learning engineer - security|paris, île-de-france, france|https://www.linkedin.com/jobs/view/4414157697
apple|software engineering manager – system applications (paris)|paris, île-de-france, france|https://www.linkedin.com/jobs/view/4414159647
apple|vulnerability researcher|paris, île-de-france, france|https://www.linkedin.com/jobs/view/4414162524
apple|firmware security researcher, sear|paris, île-de-france, france|https://www.linkedin.com/jobs/view/4414152835
apple|offensive security researcher, sear|paris, île-de-france, france|https://www.linkedin.com/jobs/view/4414163520
apple|aiml - machine learning researcher, mlr|paris, île-de-france, france|https://www.linkedin.com/jobs/view/4414150972
apple|offensive security researcher - kernel & embedded security|paris, île-de-france, france|https://www.linkedin.com/jobs/view/4414162515
ibm|c/c++ software developer|ga, atlanta, worldwide|https://www.linkedin.com/jobs/view/4400415433
cox automotive inc.|software engineer ii|ga, atlanta, worldwide|https://www.linkedin.com/jobs/view/4418123026
google|senior software engineer, full stack|ga, atlanta, worldwide|https://www.linkedin.com/jobs/view/4419012426
google|senior software engineer, engineering productivity platforms and devices|ga, atlanta, worldwide|https://www.linkedin.com/jobs/view/4413849488
renewed vision|macos software engineer|ga, alpharetta, worldwide|https://www.linkedin.com/jobs/view/4406118870
apple|us-operations specialist|ga, atlanta, worldwide|https://www.linkedin.com/jobs/view/4414164423
ibm|ai engineer|ga, atlanta, worldwide|https://www.linkedin.com/jobs/view/4414031746
boeing|associate programmer analyst|ga, warner robins, worldwide|https://www.linkedin.com/jobs/view/4414098274
hertz|full stack developer- tnc|ga, atlanta, worldwide|https://www.linkedin.com/jobs/view/4383920760
morgan stanley|associate, software engineer|ga, alpharetta, worldwide|https://www.linkedin.com/jobs/view/4409955214
cargill|associate ai engineer (atlanta)|ga, atlanta, worldwide|https://www.linkedin.com/jobs/view/4382086531
scribd, inc.|software engineer (backend), content foundations|ga, atlanta, worldwide|https://www.linkedin.com/jobs/view/4419578013
google|software engineer, phd, early career, embedded systems and firmware, 2026 start|ga, atlanta, worldwide|https://www.linkedin.com/jobs/view/4365573991
apollo mission critical engineering|software engineering associate|ga, mableton, worldwide|https://www.linkedin.com/jobs/view/4370351671
ags - american gaming systems|software engineer ii- api|ga, duluth, worldwide|https://www.linkedin.com/jobs/view/4410874009
apple|cad physical design engineer (m/f/d)|munich, bavaria, germany|https://www.linkedin.com/jobs/view/4423932196
