company|title|location|link
rewe international ag|senior software delivery engineer (m/f/x)|vienna, vienna, austria|https://www.linkedin.com/jobs/view/4295320167
jobgether|senior social media (remote)|austria|https://www.linkedin.com/jobs/view/4342762694
ikarus security software gmbh|senior fullstack engineer (m/f/x)|vienna, austria|https://www.linkedin.com/jobs/view/4349654506
rewe international ag|senior java fullstack developer (m/w/x)|vienna, vienna, austria|https://www.linkedin.com/jobs/view/4143622001
rtg steuerberatung und wirtschaftsprüfung|it mitarbeiter:in (m/w/d)|dornbirn, vorarlberg, austria|https://www.linkedin.com/jobs/view/4347432100
aspire software|growth marketing manager|vienna, vienna, austria|https://www.linkedin.com/jobs/view/4340764976
rosenbauer group|embedded software development (m/w/d)|leonding, upper austria, austria|https://www.linkedin.com/jobs/view/4343103695
sharp brains|information technology support technician|vienna, austria|https://www.linkedin.com/jobs/view/4349562365
adesso austria gmbh|java developer (all genders) [graz]|graz, styria, austria|https://www.linkedin.com/jobs/view/4291852596
daphos gmbh|senior backend developer (m/w/d) münchen oder wien mit homeoffice-anteil|vienna, vienna, austria|https://www.linkedin.com/jobs/view/4347901578
med-el|software quality engineer (m/f/d)|innsbruck, tyrol, austria|https://www.linkedin.com/jobs/view/4336125829
mindrift|freelance software developer (ruby) / quality assurance (ai trainer)|austria|https://www.linkedin.com/jobs/view/4342691417
refurbed|backend engineer (f/m/x) - remote|vienna, austria|https://www.linkedin.com/jobs/view/4338362785
yuvenda|cloud backend sw-entwickler (m/w/d)|vienna, vienna, austria|https://www.linkedin.com/jobs/view/4347713933
docpit|saas junior  sales consultant  (m/f/x)|austria|https://www.linkedin.com/jobs/view/4341989257
timetac|react native developer (f/m/d)|graz, styria, austria|https://www.linkedin.com/jobs/view/4340012983
binderholz group|softwareentwickler (m/w/d)|fügen, tyrol, austria|https://www.linkedin.com/jobs/view/4348551793
nxp semiconductors|junior software engineer – iot, ota & secure provisioning (m/f/d)|gratkorn, styria, austria|https://www.linkedin.com/jobs/view/4323924679
prisma|senior backend engineer [typescript] (prisma orm)|innere stadt, vienna, austria|https://www.linkedin.com/jobs/view/4334599102
hemmersbach|onsite it-support 2nd level (m/w/d)|vienna, austria|https://www.linkedin.com/jobs/view/4348680822
myneva|senior software engineer (m/w/d) .net|vienna, vienna, austria|https://www.linkedin.com/jobs/view/4105413103
red bull|financial data & process developer|fuschl am see, salzburg, austria|https://www.linkedin.com/jobs/view/4266347890
bitpanda|manager, engineering|vienna, vienna, austria|https://www.linkedin.com/jobs/view/4340784453
angeheuert ⚓ recruiting mit tiefgang|lead software developer (m/w/d)|vienna, austria|https://www.linkedin.com/jobs/view/4348541150
keyrock|senior full stack web engineer|vienna, vienna, austria|https://www.linkedin.com/jobs/view/4324658510
viewpointsystem|sales manager (all genders)|vienna, vienna, austria|https://www.linkedin.com/jobs/view/4348264245
hyundai glovis europe|hr specialist (m/w/d)|vienna, vienna, austria|https://www.linkedin.com/jobs/view/4349580639
bonrepublic|platform engineer (m/f/d)|vienna, vienna, austria|https://www.linkedin.com/jobs/view/4348777896
sap fioneer|partner - banking transformation (m/f/d)|austria|https://www.linkedin.com/jobs/view/4326195297
delegate group|it-systemadministrator:in (w/m/d)|vienna, vienna, austria|https://www.linkedin.com/jobs/view/4341851144
sharp brains|information technology support technician|vienna, austria|https://www.linkedin.com/jobs/view/4349513120
viewpointsystem|quality manager (all genders)|vienna, vienna, austria|https://www.linkedin.com/jobs/view/4348659705
ekontrol gmbh|sales manager|vienna, austria|https://www.linkedin.com/jobs/view/4320550438
snap inc.|machine learning engineer, platform|vienna, vienna, austria|https://www.linkedin.com/jobs/view/4339244993
vertigis|consultant telecommunication (m/w/x)|innsbruck, tyrol, austria|https://www.linkedin.com/jobs/view/4291265808
intetics|980  genai on-prem solution support engineer|austria|https://www.linkedin.com/jobs/view/4305725093
alten austria|c++/c# entwickler (all gender)|graz, styria, austria|https://www.linkedin.com/jobs/view/4280791500
ebcont|senior java developer (d/w/m)|linz, upper austria, austria|https://www.linkedin.com/jobs/view/3005866949
sigmatek automation|senior software entwickler - embedded linux (m/w/d)|lamprechtshausen, salzburg, austria|https://www.linkedin.com/jobs/view/4348259990
d.a.t.a.|fullstack-entwicklerin - ehealth bildverarbeitung teilzeit/vollzeit mit home-office (m/w/d)|vienna, vienna, austria|https://www.linkedin.com/jobs/view/4316840915
adesso austria gmbh|fullstack developer (all genders) [graz]|graz, styria, austria|https://www.linkedin.com/jobs/view/4119717832
devjobs|teamleiter frontend development @ communi5 technologies gmbh|vienna, austria|https://www.linkedin.com/jobs/view/4325866198
ebcont|senior java developer (d/w/m)|graz, styria, austria|https://www.linkedin.com/jobs/view/4166238776
snap inc.|embedded engineer, graphics|vienna, vienna, austria|https://www.linkedin.com/jobs/view/4343180012
hirelight eb consulting|lead software developer (m/w/d)|salzburg, salzburg, austria|https://www.linkedin.com/jobs/view/4348411802
vkb-bank|it requirements engineer|linz, upper austria, austria|https://www.linkedin.com/jobs/view/4324504607
canonical|software engineer (python/linux/packaging)|vienna, vienna, austria|https://www.linkedin.com/jobs/view/4284594438
gac motor europe|financial specialist|graz, styria, austria|https://www.linkedin.com/jobs/view/4325111005
international atomic energy agency (iaea)|laboratory technician (mass spectrometry)(g5)|seibersdorf, lower austria, austria|https://www.linkedin.com/jobs/view/4348883746
accilium|junior brand & digital associate (f/m/x)|vienna, austria|https://www.linkedin.com/jobs/view/4339831525
infineon technologies|internship: application engineering (f/m/div)|villach, carinthia, austria|https://www.linkedin.com/jobs/view/4251636171
techniknews.net|content-creator bei techniknews|austria|https://www.linkedin.com/jobs/view/4340575998
direct mind gmbh|full-stack lead developer (m/w/d) – ki-basiertes fundraising|vienna, austria|https://www.linkedin.com/jobs/view/4349078935
mic customs solutions|software support engineer (m/f/x)|linz, upper austria, austria|https://www.linkedin.com/jobs/view/4342278387
dynatrace|it support engineer (m/f/x)|linz, upper austria, austria|https://www.linkedin.com/jobs/view/4337171708
viewpointsystem|team lead sales (all genders)|vienna, vienna, austria|https://www.linkedin.com/jobs/view/4348793784
telus digital|virtual work: online data analyst (m,f,d) austria|salzburg, austria|https://www.linkedin.com/jobs/view/4342271218
keyrock|senior full stack web engineer - trading|vienna, vienna, austria|https://www.linkedin.com/jobs/view/4324916783
mic customs solutions|business analyst (m/f/x)|linz, upper austria, austria|https://www.linkedin.com/jobs/view/4309671510
pentanova cs gmbh|automation technician m/f/d|gleisdorf, styria, austria|https://www.linkedin.com/jobs/view/4226879463
raiffeisen group it gmbh|data engineer (f/m/x)|vienna, vienna, austria|https://www.linkedin.com/jobs/view/4337084649
moweex digital solutions|assistent:in der geschäftsführung (d/m/w) teilzeit (20 stunden)|linz, upper austria, austria|https://www.linkedin.com/jobs/view/4347445213
mountx gmbh|software developer (m/w/d) für service management|klagenfurt, carinthia, austria|https://www.linkedin.com/jobs/view/4349788383
deutsche telekom|berater für data engineering (m/w/d) (ref4561m)|fünfkirchen, lower austria, austria|https://www.linkedin.com/jobs/view/4332454293
alten austria|softwareentwickler c/c++ & python (all gender)|linz, upper austria, austria|https://www.linkedin.com/jobs/view/4304882354
ustp – university of applied sciences st. pölten|junior researcher datascience for digital health (w/m/d) (35-40h)|st pölten, lower austria, austria|https://www.linkedin.com/jobs/view/4325127101
tttech|software tools developer - java & python (m/f/d)|vienna, vienna, austria|https://www.linkedin.com/jobs/view/4337071015
hotelkit|it administrator for windows and linux (m/f/d) from 30 hours/week, based in salzburg|salzburg, salzburg, austria|https://www.linkedin.com/jobs/view/4338441910
gropyus|lead parametric computational design (all genders)|vienna, vienna, austria|https://www.linkedin.com/jobs/view/4316358535
tgw logistics|software tester:in (m/w/d)*|marchtrenk, upper austria, austria|https://www.linkedin.com/jobs/view/4296204555
devjobs|customer success manager @ kinnovis|brunn am gebirge, lower austria, austria|https://www.linkedin.com/jobs/view/4326185764
bridgecom semiconductors|rf system verification engineer (m/f/d)|linz, upper austria, austria|https://www.linkedin.com/jobs/view/4349876090
tset|enterprise account executive (m/f/d)|vienna, vienna, austria|https://www.linkedin.com/jobs/view/4290752506
dynatrace|fullstack software engineer (devops) - (m/f/x)|vienna, vienna, austria|https://www.linkedin.com/jobs/view/4337112015
kyocera avx components (salzburg) gmbh|it support spezialist (m/w/d)|salzburg, salzburg, austria|https://www.linkedin.com/jobs/view/4299559138
aspire software|partner manager|vienna, vienna, austria|https://www.linkedin.com/jobs/view/4341212007
angeheuert ⚓ recruiting mit tiefgang|senior embedded software engineer|austria|https://www.linkedin.com/jobs/view/4348457326
mp2 it-solutions gmbh|web developer – contao/wordpress|breitenfurth bei wien, lower austria, austria|https://www.linkedin.com/jobs/view/4339494651
hirelight eb consulting|lead developer (m/w/d)|vienna, vienna, austria|https://www.linkedin.com/jobs/view/4348481574
ge healthcare|mechanical designer (f/m/d) probes engineering|vöcklamarkt, upper austria, austria|https://www.linkedin.com/jobs/view/4303019888
cherry|software developer (m/w/d) - embedded software / firmware|vienna, austria|https://www.linkedin.com/jobs/view/4347388644
cryptonow|customer care specialist (ch & eu)|vienna, vienna, austria|https://www.linkedin.com/jobs/view/4269298517
cloudflight|data engineer (m/f/x)|amstetten, lower austria, austria|https://www.linkedin.com/jobs/view/4348112170
timetac|(senior) product manager (w/m/d)|graz, styria, austria|https://www.linkedin.com/jobs/view/4339922668
binderholz group|senior structural engineer nl (m/f/d)|hallein, salzburg, austria|https://www.linkedin.com/jobs/view/4347593177
cms electronics group|embedded designer – elektronik entwickler*in (m/w/d)|klagenfurt, carinthia, austria|https://www.linkedin.com/jobs/view/4339412886
bridgecom semiconductors|rf component verification engineer (m/f/d)|linz, upper austria, austria|https://www.linkedin.com/jobs/view/4348022518
sportradar|senior software engineer - ad:s social (m/f/d)|vienna, vienna, austria|https://www.linkedin.com/jobs/view/4336678861
globeair|certifying staff aircraft engineer b2|hörsching, upper austria, austria|https://www.linkedin.com/jobs/view/4347450250
canonical|community engineer (multiple roles and seniority levels)|vienna, vienna, austria|https://www.linkedin.com/jobs/view/4282694248
anton paar|requirements engineer (f/m/x)|graz, styria, austria|https://www.linkedin.com/jobs/view/4322239926
swimsol gmbh|junior sales associate (m/f/d)|vienna, vienna, austria|https://www.linkedin.com/jobs/view/4348066565
contilox gmbh|senior software entwickler:in|schlatt, upper austria, austria|https://www.linkedin.com/jobs/view/4348720334
&|hardware developer - high frequency engineering (m/f/d)|vienna, vienna, austria|https://www.linkedin.com/jobs/view/4308420641
xxxldigital – part of xxxl group|business analyst (purchasing platform) (m/w/d)|vienna, vienna, austria|https://www.linkedin.com/jobs/view/4315488804
raiffeisen group it gmbh|business analyst (w/m/x)|vienna, vienna, austria|https://www.linkedin.com/jobs/view/4337155161
liebherr aerospace and transportation|(junior) erp & application supporter (m/w/d)|korneuburg, lower austria, austria|https://www.linkedin.com/jobs/view/4297867606
university of vienna|senior scientist, chemistry|innere stadt, vienna, austria|https://www.linkedin.com/jobs/view/4339268728
eurofunk kappacher gmbh|software test engineer (m/w/d)|klagenfurt, carinthia, austria|https://www.linkedin.com/jobs/view/4321119320
deutsche telekom|senior ki-entwickler (m/w/d)|fünfkirchen, lower austria, austria|https://www.linkedin.com/jobs/view/4332444668
r&c request gmbh|test manager|vienna, vienna, austria|https://www.linkedin.com/jobs/view/4347969116
eversports|product designer (f/m/x)|vienna, austria|https://www.linkedin.com/jobs/view/4334716485
green shirts|finance & back-office geringfügig green shirts|vienna, vienna, austria|https://www.linkedin.com/jobs/view/4347433386
hotel kohlerhof|rezeptionist front offic:in|fügen, tyrol, austria|https://www.linkedin.com/jobs/view/4347569878
workheld|product owner - manufacturing cloud (b2b, saas, iiot)|vienna, vienna, austria|https://www.linkedin.com/jobs/view/4349748576
gate space|cnc manufacturing technician|vienna, vienna, austria|https://www.linkedin.com/jobs/view/4314245632
globeair|certifying staff aircraft engineer b1 (m/f/d)|hörsching, upper austria, austria|https://www.linkedin.com/jobs/view/4282215607
qtlabs - quantum technology laboratories gmbh|senior embedded systems engineer (alle genders)|vienna, vienna, austria|https://www.linkedin.com/jobs/view/4347664480
light for the world|senior accountant (f/m/d)|vienna, vienna, austria|https://www.linkedin.com/jobs/view/4348696317
gbtec group|(senior) account executive (w/m/d) - grc software|vienna, vienna, austria|https://www.linkedin.com/jobs/view/4348876190
tiwag-tiroler wasserkraft ag|it-controller (m/w/d)|innsbruck, tyrol, austria|https://www.linkedin.com/jobs/view/4343190339
machine learning reply gmbh|(senior) data scientist (m/f/d)|vienna, vienna, austria|https://www.linkedin.com/jobs/view/4343373268
influence.vision|senior marketing manager (m/w/d)|vienna, vienna, austria|https://www.linkedin.com/jobs/view/4349508585
quio|data-driven content analyst 100% remote - spezialist*in mustererkennung & kpi-optimierung|austria|https://www.linkedin.com/jobs/view/4347972843
glatzer|konstrukteur|fischamend, lower austria, austria|https://www.linkedin.com/jobs/view/4348249879
chatlyn|talentpool saas account executive (m/w/x)|vienna, vienna, austria|https://www.linkedin.com/jobs/view/4349803855
canonical|sales development representative|vienna, vienna, austria|https://www.linkedin.com/jobs/view/4343770195
5v video|software system architect|gratkorn, styria, austria|https://www.linkedin.com/jobs/view/4326302851
rosenbauer group|test engineer (m/w/d)|leonding, upper austria, austria|https://www.linkedin.com/jobs/view/4339005535
chatlyn|talentpool sales development teilzeit/vollzeit (m/w/x)|vienna, vienna, austria|https://www.linkedin.com/jobs/view/4347027235
evoila|technical project manager (m/f/d)|vienna, vienna, austria|https://www.linkedin.com/jobs/view/4280337537
cloudflight|mid-level fullstack java / kotlin developer (m/f/x)|amstetten, lower austria, austria|https://www.linkedin.com/jobs/view/4348035776
lisec austria gmbh|expert software engineering (m/w/d)|seitenstetten markt, lower austria, austria|https://www.linkedin.com/jobs/view/4294241139
mic customs solutions|it project manager (m/f/x)|linz, upper austria, austria|https://www.linkedin.com/jobs/view/4278621040
tgw logistics|software-entwickler:in (m/w/d)*|marchtrenk, upper austria, austria|https://www.linkedin.com/jobs/view/4257635494
hrworks gmbh|senior backend engineer / architect (m/f/d)|vienna, vienna, austria|https://www.linkedin.com/jobs/view/4200184571
otrs group|sales hunter (w/m/d)|ort im innkreis, upper austria, austria|https://www.linkedin.com/jobs/view/4284784757
myneva|senior software engineer (m/w/d) .net|klagenfurt-villach area, worldwide|https://www.linkedin.com/jobs/view/4204468603
cloudflight|mid-level fullstack java / kotlin developer (m/f/x)|greater graz, worldwide|https://www.linkedin.com/jobs/view/4348019909
hemmersbach|onsite it-support 2nd level (m/w/d) - eggelsberg|eggelsberg, upper austria, austria|https://www.linkedin.com/jobs/view/4337878212
tag software group|customer success manager|austria|https://www.linkedin.com/jobs/view/4342450872
roompricegenie|remote senior data engineer (ai/ml) (m/f/d)|austria|https://www.linkedin.com/jobs/view/4339359343
deutsche telekom|mainframe-administrator (system & dba) (m/w/d)|fünfkirchen, lower austria, austria|https://www.linkedin.com/jobs/view/4332461212
dewetron|business application specialist crm/erp (w/m/d)|raaba, styria, austria|https://www.linkedin.com/jobs/view/4342659323
cloudflight|data engineer (m/f/x)|vienna, austria|https://www.linkedin.com/jobs/view/4347574952
red bull media house|product manager – content management journeys|elsbethen, salzburg, austria|https://www.linkedin.com/jobs/view/4338221407
doka|teamlead it erp applications (m/f/d)|amstetten, lower austria, austria|https://www.linkedin.com/jobs/view/4313131866
efinio it & engineering|devops engineer (m/w/d)|vienna, vienna, austria|https://www.linkedin.com/jobs/view/4268563517
red bull media house|ai product manager/engineer|elsbethen, salzburg, austria|https://www.linkedin.com/jobs/view/4312594263
cloudflight|data engineer (m/f/x)|graz, styria, austria|https://www.linkedin.com/jobs/view/4347724094
novasign|senior software developer (c# & react)|vienna, vienna, austria|https://www.linkedin.com/jobs/view/4348156941
parking network b.v.|software engineer - cloud services (wals, at)|wals, salzburg, austria|https://www.linkedin.com/jobs/view/4342980616
efinio it & engineering|devops engineer (m/w/d)|vienna, vienna, austria|https://www.linkedin.com/jobs/view/4268560586
canonical|hr generalist - emea|vienna, vienna, austria|https://www.linkedin.com/jobs/view/4339897682
nuki home solutions gmbh|fullstack developer for e-commerce applications (f/m/d)|graz, styria, austria|https://www.linkedin.com/jobs/view/4323492986
dynatrace|manager, software engineering|linz, upper austria, austria|https://www.linkedin.com/jobs/view/4337112008
cloudflight|mid-level fullstack java / kotlin developer (m/f/x)|greater sankt polten, worldwide|https://www.linkedin.com/jobs/view/4348170148
canonical|software engineer - l3 support|vienna, vienna, austria|https://www.linkedin.com/jobs/view/4284593741
capture group|senior business analyst (m/w/d)|vienna, vienna, austria|https://www.linkedin.com/jobs/view/4325259099
canonical|software engineering manager - sustaining engineering|vienna, vienna, austria|https://www.linkedin.com/jobs/view/4284581938
pcs professional clinical software gmbh|full stack developer (m/w/d) für health care applikationen|klagenfurt, carinthia, austria|https://www.linkedin.com/jobs/view/4349611876
copa-data|business development manager manufacturing – americas (m/f/d)|salzburg, salzburg, austria|https://www.linkedin.com/jobs/view/4315724161
solutionsinflow gmbh|software-entwickler:in für digitalisierungslösungen in der automatisierung|gramastetten, upper austria, austria|https://www.linkedin.com/jobs/view/4348411351
primestar group|convention & events coordinator (m/w/d)|hietzing, vienna, austria|https://www.linkedin.com/jobs/view/4314669291
med-el|it system engineer (m/f/d)|vienna, vienna, austria|https://www.linkedin.com/jobs/view/4277880977
gbtec group|it consultant - grc software (m/w/d)|vienna, vienna, austria|https://www.linkedin.com/jobs/view/4256678553
cae|training manager-en|innere stadt, vienna, austria|https://www.linkedin.com/jobs/view/4340024135
universal music publishing gmbh|senior software engineer  search (all genders)|salzburg, salzburg, austria|https://www.linkedin.com/jobs/view/4331496571
teamviewer|ai qa engineer (all genders)|linz, upper austria, austria|https://www.linkedin.com/jobs/view/4342764128
silicon austria labs (sal)|junior scientist - analog circuit designer for solid-state quantum system on chip (all genders) // job-id: 222|villach, carinthia, austria|https://www.linkedin.com/jobs/view/4314661377
solarys software gmbh|office & operations coordinator (m/w/d)  65-80%  wien|vienna, vienna, austria|https://www.linkedin.com/jobs/view/4333588584
arivo|office allrounder:in (m/w/d)|graz, styria, austria|https://www.linkedin.com/jobs/view/4349621017
servus intralogistics gmbh|softwareentwickler c/c++ - embedded robotic m/w|dornbirn, vorarlberg, austria|https://www.linkedin.com/jobs/view/4212056562
canonical|python and kubernetes software engineer - data, ai/ml & analytics|vienna, vienna, austria|https://www.linkedin.com/jobs/view/4148908945
sentry|senior software engineer, platform|innere stadt, vienna, austria|https://www.linkedin.com/jobs/view/4342989768
teamviewer|product designer (all genders) ai|linz, upper austria, austria|https://www.linkedin.com/jobs/view/4343091100
eworx network & internet gmbh|it pre-sales techniker (m/w/d)|rohrbach, upper austria, austria|https://www.linkedin.com/jobs/view/4337897131
atoss software se|head of partner management|vienna, vienna, austria|https://www.linkedin.com/jobs/view/4326473715
suppliot gmbh|erp application und support manager:in (w/m/d)|vienna, vienna, austria|https://www.linkedin.com/jobs/view/4301888596
canonical|revenue accountant|vienna, vienna, austria|https://www.linkedin.com/jobs/view/4347476477
otrs group|customer success manager (w/m/d)|ort im innkreis, upper austria, austria|https://www.linkedin.com/jobs/view/4340221946
canonical|director, talent science|vienna, vienna, austria|https://www.linkedin.com/jobs/view/4339835056
canonical|senior web engineer|vienna, vienna, austria|https://www.linkedin.com/jobs/view/4284586768
seekda|growth marketing manager|vienna, vienna, austria|https://www.linkedin.com/jobs/view/4340325770
geze uk|hr business partner (mwd)|hallwang, salzburg, austria|https://www.linkedin.com/jobs/view/4336330605
metamagix software & consulting gmbh|mitarbeiterin für online marketing mit crm kenntnissen gesucht (wien)|vienna, austria|https://www.linkedin.com/jobs/view/4348189990
visplore|python developer (m/f/d)|vienna, austria|https://www.linkedin.com/jobs/view/4341382117
roche|senior principal backend software engineer (m/f/d)|vienna, vienna, austria|https://www.linkedin.com/jobs/view/4342625759
edtmayer systemtechnik gmbh|konstrukteur (m/w/d)|vienna, vienna, austria|https://www.linkedin.com/jobs/view/4280518415
b-sec better secure gmbh & co kg|(senior) software engineer|weingraben, burgenland, austria|https://www.linkedin.com/jobs/view/4349448220
atg europe|it support specialist|vienna, vienna, austria|https://www.linkedin.com/jobs/view/4324656241
dynatrace|senior frontend engineer (m/f/x) - full time/part time|linz, upper austria, austria|https://www.linkedin.com/jobs/view/4337241569
cloudflight|mid-level fullstack java / kotlin developer (m/f/x)|innsbruck, tyrol, austria|https://www.linkedin.com/jobs/view/4347979969
big wave digital|senior oop developer (c#) – cool product, smarter people – vienna|vienna, austria|https://www.linkedin.com/jobs/view/4326450324
nexufend gmbh|golang / software systems engineer|vienna, vienna, austria|https://www.linkedin.com/jobs/view/4348106612
datagroup rhein-main gmbh (ehemals urano)|it-service engineer (all genders)|vienna, vienna, austria|https://www.linkedin.com/jobs/view/4334316078
dynatrace|senior java software engineer - extensions (m/f/x) full time / part time|linz, upper austria, austria|https://www.linkedin.com/jobs/view/4337221484
innoscripta se|b2b pre-sales manager (w/m/d)|vienna, vienna, austria|https://www.linkedin.com/jobs/view/4349644813
computer futures|c++ developer (m/f/d) finance / trading|vienna, vienna, austria|https://www.linkedin.com/jobs/view/4342887585
santander österreich|mitarbeiter client support (m/w/d)|vienna, vienna, austria|https://www.linkedin.com/jobs/view/4338959735
four paws|project manager (m/f/d)|vienna, vienna, austria|https://www.linkedin.com/jobs/view/4326700693
planet|strategic solutions manager (payment)|vienna, austria|https://www.linkedin.com/jobs/view/4320068537
communardo|technical consultant / supervisor (m/w/d)|dornbirn, vorarlberg, austria|https://www.linkedin.com/jobs/view/4317985854
frauscher sensor technology india|software architect|sankt marienkirchen am hausruck, upper austria, austria|https://www.linkedin.com/jobs/view/4342842355
palfinger ag|application engineer (w/m/d)|köstendorf, salzburg, austria|https://www.linkedin.com/jobs/view/4339432328
austrian airlines|internship ops efficiency & sustainability (all genders) would you like to actively contribute to the transformation towards climate-friendly aviation? then apply for an internship with us!|vienna, vienna, austria|https://www.linkedin.com/jobs/view/4337378081
prodware|initiativ (m/w/d)|vienna, vienna, austria|https://www.linkedin.com/jobs/view/4214671448
dynatrace|agentic ai developer (m/f/x)|vienna, vienna, austria|https://www.linkedin.com/jobs/view/4339252236
canonical|technical manager - automotive and industrial|vienna, vienna, austria|https://www.linkedin.com/jobs/view/4070529337
loxone|head of hardware development (m/w/d)|kollerschlag, upper austria, austria|https://www.linkedin.com/jobs/view/4349090979
raiffeisen bank international ag|senior data scientist/ml engineer/ai engineer (f/m/x)|vienna, vienna, austria|https://www.linkedin.com/jobs/view/4339830858
apc business services gmbh|applikationsbetreuer (w/m/x)|maria enzersdorf, lower austria, austria|https://www.linkedin.com/jobs/view/4323992823
seekda|sales executive|vienna, vienna, austria|https://www.linkedin.com/jobs/view/4341044864
anton paar|master's thesis in software development (f/m/x)|graz, styria, austria|https://www.linkedin.com/jobs/view/4299608150
