company|title|location|link
amazon|2026 software dev engineer intern - austria|graz, styria, austria|https://www.linkedin.com/jobs/view/4335887120
amazon|2026 software dev engineer intern - france|clichy, île-de-france, france|https://www.linkedin.com/jobs/view/4342023786
genesys|software engineer intern|brest, brittany, france|https://www.linkedin.com/jobs/view/4325957319
amazon web services (aws)|2026 software dev engineer intern - germany|aachen, north rhine-westphalia, germany|https://www.linkedin.com/jobs/view/4341052969
amazon|2026 software dev engineer intern - germany|berlin, berlin, germany|https://www.linkedin.com/jobs/view/4341242740
amazon|2026 software dev engineer intern - germany|munich, bavaria, germany|https://www.linkedin.com/jobs/view/4341202812
amazon web services (aws)|2026 software dev engineer intern - germany|berlin, berlin, germany|https://www.linkedin.com/jobs/view/4341262687
amazon|2026 software dev engineer intern - germany|aachen, north rhine-westphalia, germany|https://www.linkedin.com/jobs/view/4341222816
comena|software engineering intern|munich, bavaria, germany|https://www.linkedin.com/jobs/view/4309748645
amazon web services (aws)|2026 software dev engineer intern - germany|munich, bavaria, germany|https://www.linkedin.com/jobs/view/4341003147
taktile|software engineer intern|berlin, berlin, germany|https://www.linkedin.com/jobs/view/4342501529
ge healthcare|software engineering intern|budapest, budapest, hungary|https://www.linkedin.com/jobs/view/4300035903
amazon|2026 software dev engineer intern - ireland|dublin, county dublin, ireland|https://www.linkedin.com/jobs/view/4308442126
amazon|2026 software dev engineer intern - italy|turin, piedmont, italy|https://www.linkedin.com/jobs/view/4342799368
amazon|2026 software dev engineer intern - luxembourg|luxembourg, luxembourg, luxembourg|https://www.linkedin.com/jobs/view/4338262127
amazon|2026 software dev engineer intern - netherlands|amsterdam, north holland, netherlands|https://www.linkedin.com/jobs/view/4338385192
amazon|software development intern, intech|deventer, overijssel, netherlands|https://www.linkedin.com/jobs/view/4334183568
amazon|software development engineer internship - vaga para mulheres, ies- latech|deventer, overijssel, netherlands|https://www.linkedin.com/jobs/view/4342905273
amazon|2026 software dev engineer intern - poland|gdańsk, pomorskie, poland|https://www.linkedin.com/jobs/view/4341572145
amazon|2026 software dev engineer intern - poland|warsaw, mazowieckie, poland|https://www.linkedin.com/jobs/view/4342051541
amazon|2026 software dev engineer intern - romania|iaşi, iaşi, romania|https://www.linkedin.com/jobs/view/4337635886
amazon|2026 software dev engineer intern - romania|iaşi, iaşi, romania|https://www.linkedin.com/jobs/view/4318251005
taktile|software engineer intern|iaşi, iaşi, romania|https://www.linkedin.com/jobs/view/4318298888
reacher|software engineer intern (fall 2025/summer 2026)|los angeles, canada|https://www.linkedin.com/jobs/view/4290120711
amazon web services (aws)|2026 software dev engineer intern - spain|madrid, community of madrid, spain|https://www.linkedin.com/jobs/view/4308986222
amazon web services (aws)|2026 software dev engineer intern - spain|barcelona, catalonia, spain|https://www.linkedin.com/jobs/view/4308986221
amazon|2026 software dev engineer intern - sweden|stockholm, stockholm county, sweden|https://www.linkedin.com/jobs/view/4337167035
deductive ai|software engineer intern, london|london, england, united kingdom|https://www.linkedin.com/jobs/view/4318516271
amazon|software dev intern - embedded development (linux)|cambridge, england, united kingdom|https://www.linkedin.com/jobs/view/4343014763
amazon|software dev intern - ai / machine learning|cambridge, england, united kingdom|https://www.linkedin.com/jobs/view/4341060523
amazon|2026 software dev engineer intern - uk|london, england, united kingdom|https://www.linkedin.com/jobs/view/4308097460
amazon|2026 software dev engineer intern - uk|cambridge, england, united kingdom|https://www.linkedin.com/jobs/view/4308092612
siemens|train software engineer intern  - 3 months|city of london, england, united kingdom|https://www.linkedin.com/jobs/view/4321796506
amazon|2026 software dev engineer intern - uk|edinburgh, scotland, united kingdom|https://www.linkedin.com/jobs/view/4308093564
amazon|software dev intern - ai / machine learning|london, england, united kingdom|https://www.linkedin.com/jobs/view/4340789851
alpic|internship - software engineer - final year|paris, île-de-france, france|https://www.linkedin.com/jobs/view/4318516294
bigblue|software engineer intern|paris, île-de-france, france|https://www.linkedin.com/jobs/view/3575815459
breega|devops & software engineering intern @ entalpic|paris, île-de-france, france|https://www.linkedin.com/jobs/view/4318250086
emerton|emerton data - associate consultant & data scientist internship|paris, île-de-france, france|https://www.linkedin.com/jobs/view/4341178085
pigment|data scientist internship|paris, île-de-france, france|https://www.linkedin.com/jobs/view/4342892600
hermeus|human machine interface (hmi) software engineering intern  - spring & summer 2026|ga, atlanta, worldwide|https://www.linkedin.com/jobs/view/4318270340
genuine parts company|software engineering intern - summer 2026|ga, atlanta, worldwide|https://www.linkedin.com/jobs/view/4337014755
iteratec|praktikant (m/w/d) softwareentwicklung|stuttgart, baden-württemberg, germany|https://www.linkedin.com/jobs/view/4347866857
snowflake|software engineer intern - berlin (2026)|berlin, berlin, germany|https://www.linkedin.com/jobs/view/4311124015
nextaudit|praktikum (w/m/d) softwareentwickler - vue.js|aachen, north rhine-westphalia, germany|https://www.linkedin.com/jobs/view/4341880751
air liquide|trainee - software product developer|pioltello, lombardy, italy|https://www.linkedin.com/jobs/view/4335690528
snowflake|software engineer intern - engineering systems (2026)|warsaw, mazowieckie, poland|https://www.linkedin.com/jobs/view/4343110115
waymo|2026 summer intern, bs/ms, software engineer, simulation multiverse|warsaw, mazowieckie, poland|https://www.linkedin.com/jobs/view/4314053939
circle|software engineer, intern, summer 2026|los angeles metropolitan area, worldwide|https://www.linkedin.com/jobs/view/4340030868
sift|software engineering intern|el segundo, canada|https://www.linkedin.com/jobs/view/4302879895
keysight technologies|software development intern|barcelona, catalonia, spain|https://www.linkedin.com/jobs/view/4313358184
tietoevry|c++ trainee engineer - tietoevry create (m/f/d)|lviv, lviv, ukraine|https://www.linkedin.com/jobs/view/4321647745
slb|software engineer intern (12 months)|stonehouse, england, united kingdom|https://www.linkedin.com/jobs/view/4338787785
pleo|senior product manager - partnerships|copenhagen, capital region of denmark, denmark|https://www.linkedin.com/jobs/view/4342008858
the leading hotels of the world|intern - regional marketing|paris, île-de-france, france|https://www.linkedin.com/jobs/view/4304166749
tso-data|bachelor-/master-/abschlussarbeit|nuremberg, bavaria, germany|https://www.linkedin.com/jobs/view/3643847124
sap|working student (f/m/d) - sap enterprise architects for rise management programs|walldorf, baden-württemberg, germany|https://www.linkedin.com/jobs/view/4279257747
teamviewer|intern, talent acquisition (all genders)|bremen, bremen, germany|https://www.linkedin.com/jobs/view/4342185213
teamviewer|intern, talent acquisition (all genders)|stuttgart, baden-württemberg, germany|https://www.linkedin.com/jobs/view/4339821249
miebach|praktikant*in - simulation|frankfurt am main, hesse, germany|https://www.linkedin.com/jobs/view/4342694249
teamviewer|work student, product strategy (all genders)|munich, bavaria, germany|https://www.linkedin.com/jobs/view/4312325542
teamviewer|intern, talent acquisition (all genders)|göppingen, baden-württemberg, germany|https://www.linkedin.com/jobs/view/4340101119
miebach|werkstudent*in simulation|frankfurt am main, hesse, germany|https://www.linkedin.com/jobs/view/4122353732
teamviewer|work student, finance business applications (all genders)|göppingen, baden-württemberg, germany|https://www.linkedin.com/jobs/view/4338951926
teamviewer|work student, product strategy (all genders)|karlsruhe, baden-württemberg, germany|https://www.linkedin.com/jobs/view/4312340114
teamviewer|intern, talent acquisition (all genders)|karlsruhe, baden-württemberg, germany|https://www.linkedin.com/jobs/view/4342274921
sap|working student (f/m/d) - ea rise management programs for discrete manufacturing industries (de)|walldorf, baden-württemberg, germany|https://www.linkedin.com/jobs/view/4327153313
miebach|praktikant*in - simulation|munich, bavaria, germany|https://www.linkedin.com/jobs/view/4342299554
m&m software gmbh|konzeptentwicklung von zero trust security auf microsoft azure|sankt georgen im schwarzwald, baden-württemberg, germany|https://www.linkedin.com/jobs/view/4191429024
teamviewer|intern, talent acquisition (all genders)|berlin, berlin, germany|https://www.linkedin.com/jobs/view/4340735390
italdesign|master thesis project "improvement of virtual body tracking through deep learning and imu sensors"|moncalieri, piedmont, italy|https://www.linkedin.com/jobs/view/4336150341
italdesign|master thesis project "data & process analyst for ai transformation"|moncalieri, piedmont, italy|https://www.linkedin.com/jobs/view/4315428932
philips|internship: regulatory affairs ai engineering|best, north brabant, netherlands|https://www.linkedin.com/jobs/view/4326235685
aerox b.v.|aerox - intern assignment develop qr system|utrecht, utrecht, netherlands|https://www.linkedin.com/jobs/view/4289904244
the ocean cleanup|internship financial operations|rotterdam, south holland, netherlands|https://www.linkedin.com/jobs/view/4302303991
pleo|senior product manager - partnerships|amsterdam, north holland, netherlands|https://www.linkedin.com/jobs/view/4342028804
foot locker|intern, end user support|utrecht, utrecht, netherlands|https://www.linkedin.com/jobs/view/4348778567
pleo|senior product manager - partnerships|lisboa, lisbon, portugal|https://www.linkedin.com/jobs/view/4341579427
pleo|senior product manager - partnerships|madrid, community of madrid, spain|https://www.linkedin.com/jobs/view/4342038879
hypertype|master's thesis in computer science: building knowledge graphs|stockholm, stockholm county, sweden|https://www.linkedin.com/jobs/view/4340831925
hypertype|master's thesis in computer science: knowledge graph retrieval|stockholm, stockholm county, sweden|https://www.linkedin.com/jobs/view/4340622266
pleo|senior product manager - partnerships|stockholm, stockholm county, sweden|https://www.linkedin.com/jobs/view/4341589403
hypertype|master's thesis in machine learning: chunking in multilingual technical documentation|stockholm, stockholm county, sweden|https://www.linkedin.com/jobs/view/4340582280
pleo|senior product manager - partnerships|london, england, united kingdom|https://www.linkedin.com/jobs/view/4341559374
sap|sap intern software development (f/m/d) - supply chain management consulting|hamburg, hamburg, germany|https://www.linkedin.com/jobs/view/4325719351
weinmann|duales studium informatik-ingenieurwesen 2026|hamburg, hamburg, germany|https://www.linkedin.com/jobs/view/4295061528
weinmann emergency france|duales studium informatik-ingenieurwesen 2026|hamburg, hamburg, germany|https://www.linkedin.com/jobs/view/4335894513
prodware|werkstudentin/werkstudent (m/w/d) - microsoft data analytics & ai (da&ai)|germering, bavaria, germany|https://www.linkedin.com/jobs/view/3896465489
prodware|werkstudentin/werkstudent (m/w/d) - microsoft data analytics & ai (da&ai)|germering, bavaria, germany|https://www.linkedin.com/jobs/view/3896191036
teamviewer|intern, talent acquisition (all genders)|munich, bavaria, germany|https://www.linkedin.com/jobs/view/4340335972
sap|working student (f/m/d) - ea rise management programs for discrete manufacturing industries (de)|walldorf, baden-württemberg, germany|https://www.linkedin.com/jobs/view/4327063342
objektkultur software gmbh|praktikum, werkstudent, thesis - cloud infrastruktur & security (m/w/d) - einstieg ab 2026 möglich|karlsruhe, baden-württemberg, germany|https://www.linkedin.com/jobs/view/3906671872
aradex ag|working student (m/f/d) backend developer|lorch, baden-württemberg, germany|https://www.linkedin.com/jobs/view/4114327687
kyndryl|lead ai & agentic ai architect (ai squad leader)|valbonne, provence-alpes-côte d'azur, france|https://www.linkedin.com/jobs/view/4323055289
man truck & bus se|thesis production readiness of ai workflow automation using compound llm systems (f/m/d)|munich, bavaria, germany|https://www.linkedin.com/jobs/view/4343194960
lindner group|master's thesis pricing model for short-lived cloud services (agw*)|germany|https://www.linkedin.com/jobs/view/4296220043
sahibinden.com|senior research engineer|türkiye, istanbul, worldwide|https://www.linkedin.com/jobs/view/4348881481
baltic amadeus|junior system adminstrator|vilnius, vilniaus, worldwide|https://www.linkedin.com/jobs/view/4343475118
delft university of technology|postdoc researcher in probabilistic surrogate modelling for floating solar farms|delft, south holland, netherlands|https://www.linkedin.com/jobs/view/4339375367
electrochemical flow systems laboratory|postdoc researcher in probabilistic surrogate modelling for floating solar farms|delft, south holland, netherlands|https://www.linkedin.com/jobs/view/4339367111
cady|school experience rep|ga, alpharetta, worldwide|https://www.linkedin.com/jobs/view/4343426002
airbus defence and space|working student procurement commodity it & ground systems (d/f/m)|munich, bavaria, germany|https://www.linkedin.com/jobs/view/4347506698
teamviewer|work student, data engineer (all genders)|göppingen, baden-württemberg, germany|https://www.linkedin.com/jobs/view/4338864212
airbus defence and space|working student procurement air power commodity it & ground systems (d/f/m)|munich, bavaria, germany|https://www.linkedin.com/jobs/view/4347609589
german aerospace center (dlr)|student computer science (f/m/x) - evaluation of a cesium renderer in cosmoscout vr|brunswick, lower saxony, germany|https://www.linkedin.com/jobs/view/4288986024
german aerospace center (dlr)|student/in informatik (w/m/d) - bewertung eines cäsium-renderers in cosmoscout vr|brunswick, lower saxony, germany|https://www.linkedin.com/jobs/view/4288977874
airbus aircraft|working student within mechanical systems installation (msi) airframe engineering (d/f/m)|hamburg, hamburg, germany|https://www.linkedin.com/jobs/view/4348209399
accenture the netherlands|technology consulting intern health & public service|amsterdam, north holland, netherlands|https://www.linkedin.com/jobs/view/4295111561
yivi app|master thesis project  ecdsa zero-knowledge credentials in yivi’s eudi wallet|utrecht, utrecht, netherlands|https://www.linkedin.com/jobs/view/4343194401
international schools partnership limited|admissions manager colegio vasco de gama (lisboa, portugal)|madrid, community of madrid, spain|https://www.linkedin.com/jobs/view/4343180677
international schools partnership - iberia|admissions manager colegio vasco de gama (lisboa, portugal)|madrid, community of madrid, spain|https://www.linkedin.com/jobs/view/4326653318
nepa|master thesis: designing an ai agent mmm|stockholm county, sweden|https://www.linkedin.com/jobs/view/4336838779
london early years foundation (leyf)|early years practitioner level 3 - burgess park pre-school - term time only|london, england, united kingdom|https://www.linkedin.com/jobs/view/4324567932
eka ventures|data scientist and investment associate|greater london, england, united kingdom|https://www.linkedin.com/jobs/view/4318799111
east lothian council|schools ict officer|haddington, scotland, united kingdom|https://www.linkedin.com/jobs/view/4339897002
london early years foundation (leyf)|nursery room manager - leys nursery and pre-school - full time|london, england, united kingdom|https://www.linkedin.com/jobs/view/4307671751
london early years foundation (leyf)|nursery room manager - noah's ark nursery and pre-school - full time|london, england, united kingdom|https://www.linkedin.com/jobs/view/4307673804
london early years foundation (leyf)|early years teacher (l2/l3) - weir link nursery and pre-school - full time|london, england, united kingdom|https://www.linkedin.com/jobs/view/4323609450
london early years foundation (leyf)|nursery room manager - weir link nursery and pre-school - full time|london, england, united kingdom|https://www.linkedin.com/jobs/view/4323699193
london early years foundation (leyf)|nursery room manager - farrance road nursery and pre-school - full time|london, england, united kingdom|https://www.linkedin.com/jobs/view/4303673949
london early years foundation (leyf)|nursery room manager - deanery road nursery and pre-school - full time|london, england, united kingdom|https://www.linkedin.com/jobs/view/4325712916
agilisys|school ict engineer|sefton, england, united kingdom|https://www.linkedin.com/jobs/view/4275221456
sanofi|people services trainee - german speaking|budapest, budapest, hungary|https://www.linkedin.com/jobs/view/4284374392
asml|finance internship: product costing & manufacturing support|veldhoven, north brabant, netherlands|https://www.linkedin.com/jobs/view/4342921707
school of computer science and engineering, bangor university|student administrator|bangor, wales, united kingdom|https://www.linkedin.com/jobs/view/4342766237
gedu global education|head of data & analytics|london, england, united kingdom|https://www.linkedin.com/jobs/view/4342963846
university of westminster|graduate school officer|london, england, united kingdom|https://www.linkedin.com/jobs/view/4342839358
cdata software|technical support engineer|tirana, tirana, worldwide|https://www.linkedin.com/jobs/view/4334849292
supportyourapp|(fluent english) technical support consultant (remote)|tirana, tirana, worldwide|https://www.linkedin.com/jobs/view/4339862295
ehvert mission critical - a salas o'brien company|electrical engineer|tirana, tirana, worldwide|https://www.linkedin.com/jobs/view/4332864704
search atlas|lead devops engineer|tirana, tirana, worldwide|https://www.linkedin.com/jobs/view/4343011231
deel|team lead, engineering, fintech|albania, worldwide|https://www.linkedin.com/jobs/view/4326560781
talentbridge albania|accountant|tirana, tirana, worldwide|https://www.linkedin.com/jobs/view/4349871046
search atlas|principal backend engineer (python/django)|tirana, tirana, worldwide|https://www.linkedin.com/jobs/view/4332333421
neurons lab|head of ai engineering|albania, worldwide|https://www.linkedin.com/jobs/view/4339259807
supportyourapp|(fluent arabic & english) aml & kyc specialist (albania, remotely)|vlorë, vlorë, worldwide|https://www.linkedin.com/jobs/view/4343056050
epam systems|sap fico architect|albania, worldwide|https://www.linkedin.com/jobs/view/4311951516
stallant health & wellness|financial controller|albania, worldwide|https://www.linkedin.com/jobs/view/4298705078
ikons italia|ins945 sw architect|albania, worldwide|https://www.linkedin.com/jobs/view/4326536255
epam systems|senior/lead sap cap node.js developer|albania, worldwide|https://www.linkedin.com/jobs/view/4289619589
deloitte|qa engineer|tirana, tirana, worldwide|https://www.linkedin.com/jobs/view/4349734011
search atlas|lead backend engineer (python/django)|tirana, tirana, worldwide|https://www.linkedin.com/jobs/view/4319090128
deel|senior risk analyst - operational risk management|albania, worldwide|https://www.linkedin.com/jobs/view/4321895246
yassir|senior cloud ops engineer|tirana, tirana, worldwide|https://www.linkedin.com/jobs/view/4030468686
ruby labs|graphic & motion designer (performance marketing)|albania, worldwide|https://www.linkedin.com/jobs/view/4338285450
fxc intelligence|software development engineer in test (sdet)|albania, worldwide|https://www.linkedin.com/jobs/view/4320823549
axelera ai|hardware security architect|albania, worldwide|https://www.linkedin.com/jobs/view/4339824400
muk|cloud services development manager|albania, worldwide|https://www.linkedin.com/jobs/view/4309161323
nexum al|accountant|durrës, durres, worldwide|https://www.linkedin.com/jobs/view/4348398758
proxify|senior devops engineer (azure)|albania, worldwide|https://www.linkedin.com/jobs/view/4335992113
ehvert mission critical - a salas o'brien company|electrical design engineer (albania)|tirana, tirana, worldwide|https://www.linkedin.com/jobs/view/4319265928
groupe hospitalier artois-ternois|chargé d'opération travaux / conseiller transition énergétique et écologique h/f|arras, dibrë, worldwide|https://www.linkedin.com/jobs/view/4229702351
deloitte|angular frontend developer|tirana, tirana, worldwide|https://www.linkedin.com/jobs/view/4296231044
sisal hub albania|java developer senior specialist|tirana, tirana, worldwide|https://www.linkedin.com/jobs/view/4339187689
epam systems|sap fico architect|albania, worldwide|https://www.linkedin.com/jobs/view/4311951516
axelera ai|senior r&d engineer - system architecture (italy based)|tirana, tirana, worldwide|https://www.linkedin.com/jobs/view/4339239802
dilaxia nova|speculative application|albania, shkodër, worldwide|https://www.linkedin.com/jobs/view/4342941377
world health organization|public health support officer (disease control)|tirana, tirana, worldwide|https://www.linkedin.com/jobs/view/4342209372
supportyourapp|(fluent english) l2 technical support consultant (remotely)|tirana, tirana, worldwide|https://www.linkedin.com/jobs/view/4339109424
rippedboxstation|tier 1 support specialist|albania, worldwide|https://www.linkedin.com/jobs/view/4320150884
tirana bank|inbound agent|tirana, tirana, worldwide|https://www.linkedin.com/jobs/view/4326508310
móveo technology|devops senior specialist|tirana, tirana, worldwide|https://www.linkedin.com/jobs/view/4349640234
neurons lab|ai architect (bfsi)|tirana, tirana, worldwide|https://www.linkedin.com/jobs/view/4339349707
axelera ai|senior r&d engineer - system architecture (italy based)|albania, worldwide|https://www.linkedin.com/jobs/view/4339249816
room estate|administration specialist|tirana, tirana, worldwide|https://www.linkedin.com/jobs/view/4348358263
block labs|senior frontend engineer (react)|albania, worldwide|https://www.linkedin.com/jobs/view/4325067067
la sia spa|ingegnere elettrico|albania, tirana, worldwide|https://www.linkedin.com/jobs/view/4342671263
sisal hub albania|accounting specialist|tirana, tirana, worldwide|https://www.linkedin.com/jobs/view/4334106818
agoda|bi developer (supply analytics, bangkok-based, relocation provided)|tirana, tirana, worldwide|https://www.linkedin.com/jobs/view/4334503702
block labs|senior software engineer - (go)|albania, worldwide|https://www.linkedin.com/jobs/view/4325216227
agoda|business analyst (supply analytics, bangkok-based, relocation provided)|tirana, tirana, worldwide|https://www.linkedin.com/jobs/view/4334553602
hashwhale|hr cum finance|albania, worldwide|https://www.linkedin.com/jobs/view/4320270779
supportyourapp|(fluent german & english) customer support consultant (remote)|durrës, durres, worldwide|https://www.linkedin.com/jobs/view/4339852086
arpya|artificial intelligence engineer|albania, tirana, worldwide|https://www.linkedin.com/jobs/view/4337383200
yassir|senior qa engineer - manual & automated testing|tirana, tirana, worldwide|https://www.linkedin.com/jobs/view/4268371981
alabama baptist state board of missions|youth director|albania, worldwide|https://www.linkedin.com/jobs/view/4291189146
atrax|full stack developer - focus on node|tirana, tirana, worldwide|https://www.linkedin.com/jobs/view/4326708535
third pillar recruiting|graphic designer|tirana, tirana, worldwide|https://www.linkedin.com/jobs/view/4343044869
epam systems|sap abap architect|albania, worldwide|https://www.linkedin.com/jobs/view/4311439418
everai|mid/senior video marketing artist (full remote - albania)|albania, worldwide|https://www.linkedin.com/jobs/view/4338375057
native teams|credit control lead|albania, worldwide|https://www.linkedin.com/jobs/view/4342947733
the flex|senior backend & frontend engineer|albania, worldwide|https://www.linkedin.com/jobs/view/4342439385
epam systems|sap abap architect|albania, worldwide|https://www.linkedin.com/jobs/view/4311434464
groupe hospitalier artois-ternois|cadre de santé - ehpad le clos de dainville|arras, dibrë, worldwide|https://www.linkedin.com/jobs/view/4286330048
cloudstaff|financial accountant|albania, worldwide|https://www.linkedin.com/jobs/view/4320300682
epam systems|sap fico architect|albania, worldwide|https://www.linkedin.com/jobs/view/4311947584
agoda|analyst (supply analytics, bangkok-based, relocation provided)|tirana, tirana, worldwide|https://www.linkedin.com/jobs/view/4334176203
draxton mobility inspired|process industrialization engineer|utrillas, aragon, spain|https://www.linkedin.com/jobs/view/4335743040
fullstack|agentic python engineer - remote - colombia|pereira, risaralda, colombia|https://www.linkedin.com/jobs/view/4315358656
bairesdev|junior backend developer (node.js)  ref#284230|pereira, risaralda, colombia|https://www.linkedin.com/jobs/view/4258062407
bairesdev|internal communications and community management analyst - remote work  ref#154975|pereira, risaralda, colombia|https://www.linkedin.com/jobs/view/4258060635
teramind|senior c++ developer|armenia, quindío, colombia|https://www.linkedin.com/jobs/view/4347029530
fullstack|ai prompt engineer - remote - colombia|pereira, risaralda, colombia|https://www.linkedin.com/jobs/view/4342314705
fullstack|elasticsearch + agentic ai developer - remote - colombia|pereira, risaralda, colombia|https://www.linkedin.com/jobs/view/4334970148
