company|title|location|link
amazon|2026 software dev engineer intern - austria|graz, styria, austria|https://www.linkedin.com/jobs/view/4335887120
genesys|software engineer intern|brest, brittany, france|https://www.linkedin.com/jobs/view/4325957319
amazon|2026 software dev engineer intern - france|clichy, île-de-france, france|https://www.linkedin.com/jobs/view/4342023786
taktile|software engineer intern|berlin, berlin, germany|https://www.linkedin.com/jobs/view/4342501529
amazon web services (aws)|software dev engineer internship - embedded development (linux)|dresden, saxony, germany|https://www.linkedin.com/jobs/view/4344192182
amazon|2026 software dev engineer intern - germany|munich, bavaria, germany|https://www.linkedin.com/jobs/view/4341202812
amazon|2026 software dev engineer intern - germany|berlin, berlin, germany|https://www.linkedin.com/jobs/view/4341242740
amazon|2026 software dev engineer intern - germany|aachen, north rhine-westphalia, germany|https://www.linkedin.com/jobs/view/4341222816
amazon web services (aws)|2026 software dev engineer intern - germany|berlin, berlin, germany|https://www.linkedin.com/jobs/view/4341262687
amazon web services (aws)|2026 software dev engineer intern - germany|munich, bavaria, germany|https://www.linkedin.com/jobs/view/4341003147
amazon web services (aws)|2026 software dev engineer intern - germany|aachen, north rhine-westphalia, germany|https://www.linkedin.com/jobs/view/4341052969
comena|software engineering intern|munich, bavaria, germany|https://www.linkedin.com/jobs/view/4309748645
ge healthcare|software engineering intern|budapest, budapest, hungary|https://www.linkedin.com/jobs/view/4300035903
amazon|2026 software dev engineer intern - ireland|dublin, county dublin, ireland|https://www.linkedin.com/jobs/view/4308442126
amazon|2026 software dev engineer intern - italy|turin, piedmont, italy|https://www.linkedin.com/jobs/view/4343846847
amazon|2026 software dev engineer intern - luxembourg|luxembourg, luxembourg, luxembourg|https://www.linkedin.com/jobs/view/4338262127
amazon|software development engineer internship - vaga para mulheres, ies- latech|deventer, overijssel, netherlands|https://www.linkedin.com/jobs/view/4342905273
amazon|software development intern, intech|deventer, overijssel, netherlands|https://www.linkedin.com/jobs/view/4334183568
amazon|2026 software dev engineer intern - netherlands|amsterdam, north holland, netherlands|https://www.linkedin.com/jobs/view/4338385192
amazon|2026 software dev engineer intern - poland|warsaw, mazowieckie, poland|https://www.linkedin.com/jobs/view/4342051541
amazon|2026 software dev engineer intern - poland|gdańsk, pomorskie, poland|https://www.linkedin.com/jobs/view/4341572145
taktile|software engineer intern|iaşi, iaşi, romania|https://www.linkedin.com/jobs/view/4318298888
amazon|2026 software dev engineer intern - romania|iaşi, iaşi, romania|https://www.linkedin.com/jobs/view/4318251005
amazon|2026 software dev engineer intern - romania|iaşi, iaşi, romania|https://www.linkedin.com/jobs/view/4337635886
reacher|software engineer intern (fall 2025/summer 2026)|los angeles, canada|https://www.linkedin.com/jobs/view/4290120711
amazon web services (aws)|2026 software dev engineer intern - spain|barcelona, catalonia, spain|https://www.linkedin.com/jobs/view/4308986221
amazon web services (aws)|2026 software dev engineer intern - spain|madrid, community of madrid, spain|https://www.linkedin.com/jobs/view/4308986222
amazon|2026 software dev engineer intern - sweden|stockholm, stockholm county, sweden|https://www.linkedin.com/jobs/view/4337167035
amazon|software dev intern - ai / machine learning|london, england, united kingdom|https://www.linkedin.com/jobs/view/4340789851
amazon|software dev intern - ai / machine learning|cambridge, england, united kingdom|https://www.linkedin.com/jobs/view/4341060523
amazon|software dev intern - embedded development (linux)|cambridge, england, united kingdom|https://www.linkedin.com/jobs/view/4343014763
amazon|2026 software dev engineer intern - uk|london, england, united kingdom|https://www.linkedin.com/jobs/view/4308097460
amazon|2026 software dev engineer intern - uk|cambridge, england, united kingdom|https://www.linkedin.com/jobs/view/4308092612
amazon|2026 software dev engineer intern - uk|edinburgh, scotland, united kingdom|https://www.linkedin.com/jobs/view/4308093564
deductive ai|software engineer intern, london|london, england, united kingdom|https://www.linkedin.com/jobs/view/4318516271
siemens|train software engineer intern  - 3 months|city of london, england, united kingdom|https://www.linkedin.com/jobs/view/4321796506
bigblue|software engineer intern|paris, île-de-france, france|https://www.linkedin.com/jobs/view/3575815459
alpic|internship - software engineer - final year|paris, île-de-france, france|https://www.linkedin.com/jobs/view/4318516294
breega|devops & software engineering intern @ entalpic|paris, île-de-france, france|https://www.linkedin.com/jobs/view/4318250086
genuine parts company|software engineering intern - summer 2026|ga, atlanta, worldwide|https://www.linkedin.com/jobs/view/4337014755
hermeus|human machine interface (hmi) software engineering intern  - summer 2026|ga, atlanta, worldwide|https://www.linkedin.com/jobs/view/4344264533
teamviewer|work student, software engineer - python (all genders)|göppingen, baden-württemberg, germany|https://www.linkedin.com/jobs/view/4338864212
iteratec|praktikant (m/w/d) softwareentwicklung|stuttgart, baden-württemberg, germany|https://www.linkedin.com/jobs/view/4347866857
nextaudit|praktikum (w/m/d) softwareentwickler - vue.js|aachen, north rhine-westphalia, germany|https://www.linkedin.com/jobs/view/4350168377
snowflake|software engineer intern - berlin (2026)|berlin, berlin, germany|https://www.linkedin.com/jobs/view/4311124015
air liquide|trainee - software product developer|pioltello, lombardy, italy|https://www.linkedin.com/jobs/view/4335690528
utrecht university|phd position in probabilistic and differential algorithms|utrecht, utrecht, netherlands|https://www.linkedin.com/jobs/view/4344983383
snowflake|software engineer intern (backend) - warsaw 2026|warsaw, mazowieckie, poland|https://www.linkedin.com/jobs/view/4343110115
waymo|2026 summer intern, bs/ms, software engineer, simulation multiverse|warsaw, mazowieckie, poland|https://www.linkedin.com/jobs/view/4314053939
sift|software engineering intern|el segundo, canada|https://www.linkedin.com/jobs/view/4302879895
circle|software engineer, intern, summer 2026|los angeles metropolitan area, worldwide|https://www.linkedin.com/jobs/view/4340030868
keysight technologies|software development intern|barcelona, catalonia, spain|https://www.linkedin.com/jobs/view/4313358184
slb|software engineer intern (12 months)|stonehouse, england, united kingdom|https://www.linkedin.com/jobs/view/4338787785
the leading hotels of the world|intern - regional marketing|paris, île-de-france, france|https://www.linkedin.com/jobs/view/4304166749
aradex ag|working student (m/f/d) backend developer|lorch, baden-württemberg, germany|https://www.linkedin.com/jobs/view/4114327687
miebach|werkstudent*in simulation|frankfurt am main, hesse, germany|https://www.linkedin.com/jobs/view/4122353732
objektkultur software gmbh|praktikum, werkstudent, thesis - cloud software development - full-stack (m/w/d) - einstieg ab 2026 möglich|karlsruhe, baden-württemberg, germany|https://www.linkedin.com/jobs/view/3906677416
sap|working student / intern (f/m/d): sap data management and landscape transformation services (dmlt)|walldorf, baden-württemberg, germany|https://www.linkedin.com/jobs/view/4326188105
tso-data|bachelor-/master-/abschlussarbeit|nuremberg, bavaria, germany|https://www.linkedin.com/jobs/view/3643847124
prodware|werkstudentin/werkstudent (m/w/d) - microsoft data analytics & ai (da&ai)|germering, bavaria, germany|https://www.linkedin.com/jobs/view/3896465489
prodware|werkstudentin/werkstudent (m/w/d) - microsoft data analytics & ai (da&ai)|germering, bavaria, germany|https://www.linkedin.com/jobs/view/3896191036
miebach|praktikant*in - simulation|frankfurt am main, hesse, germany|https://www.linkedin.com/jobs/view/4342694249
miebach|praktikant*in - simulation|munich, bavaria, germany|https://www.linkedin.com/jobs/view/4342299554
sap|working student (f/m/d) - sap enterprise architects for rise management programs|walldorf, baden-württemberg, germany|https://www.linkedin.com/jobs/view/4279257747
italdesign|master thesis project "data & process analyst for ai transformation"|moncalieri, piedmont, italy|https://www.linkedin.com/jobs/view/4315428932
italdesign|master thesis project "improvement of virtual body tracking through deep learning and imu sensors"|moncalieri, piedmont, italy|https://www.linkedin.com/jobs/view/4336150341
foot locker|intern, end user support|utrecht, utrecht, netherlands|https://www.linkedin.com/jobs/view/4348778567
philips|internship: regulatory affairs ai engineering|best, north brabant, netherlands|https://www.linkedin.com/jobs/view/4326235685
the ocean cleanup|internship financial operations|rotterdam, south holland, netherlands|https://www.linkedin.com/jobs/view/4302303991
hypertype|master's thesis in machine learning: chunking in multilingual technical documentation|stockholm, stockholm county, sweden|https://www.linkedin.com/jobs/view/4340582280
hypertype|master's thesis in computer science: knowledge graph retrieval|stockholm, stockholm county, sweden|https://www.linkedin.com/jobs/view/4340622266
hypertype|master's thesis in computer science: building knowledge graphs|stockholm, stockholm county, sweden|https://www.linkedin.com/jobs/view/4340831925
weinmann emergency france|duales studium informatik-ingenieurwesen 2026|hamburg, hamburg, germany|https://www.linkedin.com/jobs/view/4335894513
weinmann|duales studium informatik-ingenieurwesen 2026|hamburg, hamburg, germany|https://www.linkedin.com/jobs/view/4295061528
sap|sap intern software development (f/m/d) - supply chain management consulting|hamburg, hamburg, germany|https://www.linkedin.com/jobs/view/4325719351
siemens|master thesis: graphical authoring of system overviews for security threat & risk analyses|munich, bavaria, germany|https://www.linkedin.com/jobs/view/4344593968
teamviewer|intern, talent acquisition (all genders)|göppingen, baden-württemberg, germany|https://www.linkedin.com/jobs/view/4340101119
teamviewer|work student, finance business applications (all genders)|göppingen, baden-württemberg, germany|https://www.linkedin.com/jobs/view/4338951926
kyndryl|lead ai & agentic ai architect (ai squad leader)|valbonne, provence-alpes-côte d'azur, france|https://www.linkedin.com/jobs/view/4323055289
lindner group|master's thesis pricing model for short-lived cloud services (agw*)|germany|https://www.linkedin.com/jobs/view/4296220043
sahibinden.com|senior research engineer|türkiye, istanbul, worldwide|https://www.linkedin.com/jobs/view/4348881481
objektkultur software gmbh|praktikum, werkstudent, thesis - cloud infrastruktur & security (m/w/d) - einstieg ab 2026 möglich|karlsruhe, baden-württemberg, germany|https://www.linkedin.com/jobs/view/3906671872
sap|working student (f/m/d) - ea rise management programs for discrete manufacturing industries (de)|walldorf, baden-württemberg, germany|https://www.linkedin.com/jobs/view/4327153313
sap|working student (f/m/d) - ea rise management programs for discrete manufacturing industries (de)|walldorf, baden-württemberg, germany|https://www.linkedin.com/jobs/view/4327063342
baltic amadeus|junior system adminstrator|vilnius, vilniaus, worldwide|https://www.linkedin.com/jobs/view/4343475118
electrochemical flow systems laboratory|postdoc researcher in probabilistic surrogate modelling for floating solar farms|delft, south holland, netherlands|https://www.linkedin.com/jobs/view/4339367111
delft university of technology|postdoc researcher in probabilistic surrogate modelling for floating solar farms|delft, south holland, netherlands|https://www.linkedin.com/jobs/view/4339375367
hebron christian academy|lower school receptionist|ga, dacula, worldwide|https://www.linkedin.com/jobs/view/4345442603
airbus aircraft|working student within system physical integration (d/f/m)|hamburg, hamburg, germany|https://www.linkedin.com/jobs/view/4344164681
airbus defence and space|working student procurement commodity it & ground systems (d/f/m)|munich, bavaria, germany|https://www.linkedin.com/jobs/view/4347506698
yivi app|master thesis project  ecdsa zero-knowledge credentials in yivi’s eudi wallet|utrecht, utrecht, netherlands|https://www.linkedin.com/jobs/view/4343194401
international schools partnership - iberia|admissions manager colegio vasco de gama (lisboa, portugal)|madrid, community of madrid, spain|https://www.linkedin.com/jobs/view/4326653318
international schools partnership limited|admissions manager colegio vasco de gama (lisboa, portugal)|madrid, community of madrid, spain|https://www.linkedin.com/jobs/view/4343180677
the university of sheffield|post graduate research officer|sheffield, england, united kingdom|https://www.linkedin.com/jobs/view/4350102224
agilisys|school ict engineer|sefton, england, united kingdom|https://www.linkedin.com/jobs/view/4275221456
eka ventures|data scientist and investment associate|greater london, england, united kingdom|https://www.linkedin.com/jobs/view/4318799111
london early years foundation (leyf)|nursery room manager - leys nursery and pre-school - full time|london, england, united kingdom|https://www.linkedin.com/jobs/view/4307671751
london early years foundation (leyf)|early years teacher (l2/l3) - weir link nursery and pre-school - full time|london, england, united kingdom|https://www.linkedin.com/jobs/view/4323609450
london early years foundation (leyf)|early years practitioner level 3 - burgess park pre-school - term time only|london, england, united kingdom|https://www.linkedin.com/jobs/view/4324567932
london early years foundation (leyf)|nursery room manager - farrance road nursery and pre-school - full time|london, england, united kingdom|https://www.linkedin.com/jobs/view/4303673949
london early years foundation (leyf)|nursery room manager - weir link nursery and pre-school - full time|london, england, united kingdom|https://www.linkedin.com/jobs/view/4323699193
london early years foundation (leyf)|nursery room manager - noah's ark nursery and pre-school - full time|london, england, united kingdom|https://www.linkedin.com/jobs/view/4307673804
london early years foundation (leyf)|nursery room manager - deanery road nursery and pre-school - full time|london, england, united kingdom|https://www.linkedin.com/jobs/view/4325712916
sanofi|people services trainee - german speaking|budapest, budapest, hungary|https://www.linkedin.com/jobs/view/4284374392
lucid motors|sales operations intern|amsterdam, north holland, netherlands|https://www.linkedin.com/jobs/view/4328580252
university of westminster|graduate school officer|london, england, united kingdom|https://www.linkedin.com/jobs/view/4342839358
school of computer science and engineering, bangor university|student administrator|bangor, wales, united kingdom|https://www.linkedin.com/jobs/view/4342766237
gbs|head of data & analytics|london, england, united kingdom|https://www.linkedin.com/jobs/view/4344059621
man truck & bus se|thesis production readiness of ai workflow automation using compound llm systems (f/m/d)|munich, bavaria, germany|https://www.linkedin.com/jobs/view/4343194960
