company|title|location|link
taktile|software engineer intern|berlin, berlin, germany|https://www.linkedin.com/jobs/view/4342501529
amazon|software dev engineer intern machine learning, amazon robotics|berlin, germany|https://www.linkedin.com/jobs/view/4412153249
comena|software engineering intern|munich, bavaria, germany|https://www.linkedin.com/jobs/view/4309748645
praxipal|forward deployed engineer working student (m/f/d)|berlin, berlin, germany|https://www.linkedin.com/jobs/view/4393946388
slashdata|market research analyst (remote - within europe)|germany|https://www.linkedin.com/jobs/view/4405673625
slashdata|market research analyst (remote - within europe)|greece|https://www.linkedin.com/jobs/view/4405671727
ge healthcare|software engineering intern|budapest, budapest, hungary|https://www.linkedin.com/jobs/view/4400205708
amazon|2026 software dev engineer intern - ireland|dublin, county dublin, ireland|https://www.linkedin.com/jobs/view/4392944927
amazon|software development engineer internship - vaga para mulheres, ies- latech|deventer, overijssel, netherlands|https://www.linkedin.com/jobs/view/4342905273
amazon|software dev engineer internship - ai|gdansk metropolitan area, worldwide|https://www.linkedin.com/jobs/view/4346651647
amazing auctane|software engineer intern|zielona góra, lubuskie, poland|https://www.linkedin.com/jobs/view/4411206093
amazing auctane|software engineer intern - full stack|zielona góra, lubuskie, poland|https://www.linkedin.com/jobs/view/4410993171
taktile|software engineer intern|iaşi, iaşi, romania|https://www.linkedin.com/jobs/view/4318298888
winnow|summer intern - software engineer (2026/2027 graduates)|cluj-napoca, cluj, romania|https://www.linkedin.com/jobs/view/4415326967
reacher|software engineer intern (fall 2025/summer 2026)|los angeles, canada|https://www.linkedin.com/jobs/view/4290120711
slashdata|market research analyst (remote - within europe)|serbia, worldwide|https://www.linkedin.com/jobs/view/4405672641
slashdata|market research analyst (remote - within europe)|spain|https://www.linkedin.com/jobs/view/4405679470
amazon|2026 software dev engineer intern - uk|london, england, united kingdom|https://www.linkedin.com/jobs/view/4308097460
deductive ai|software engineer intern, london|london, england, united kingdom|https://www.linkedin.com/jobs/view/4318516271
amazon|2026 software dev engineer intern - uk|cambridge, england, united kingdom|https://www.linkedin.com/jobs/view/4308092612
amazon|2026 software dev engineer intern - uk|edinburgh, scotland, united kingdom|https://www.linkedin.com/jobs/view/4308093564
slashdata|market research analyst (remote - within europe)|united kingdom|https://www.linkedin.com/jobs/view/4405671728
university of amsterdam|student-assistant for the methods desk communication science|amsterdam, north holland, netherlands|https://www.linkedin.com/jobs/view/4413100711
accurat.ai|intern data scientist|ghent, flemish region, belgium|https://www.linkedin.com/jobs/view/4393890896
doubleverify|software engineering intern|ghent, flemish region, belgium|https://www.linkedin.com/jobs/view/4414260769
accenture belgium|young graduate - software and platform - agentic ai engineer - as of september 2026|brussels, brussels region, belgium|https://www.linkedin.com/jobs/view/4415095541
infobip|ai software engineering intern|split, split-dalmatia, worldwide|https://www.linkedin.com/jobs/view/4404789658
infobip|ai software engineering intern|zagreb, zagreb, worldwide|https://www.linkedin.com/jobs/view/4404793447
alpic|internship - software engineer - final year|paris, île-de-france, france|https://www.linkedin.com/jobs/view/4318516294
station f|data scientist intern  s2 26|paris, île-de-france, france|https://www.linkedin.com/jobs/view/4413840628
emerton|emerton data - associate consultant & data scientist internship|paris, île-de-france, france|https://www.linkedin.com/jobs/view/4408819621
hermeus|software engineering intern (hmi) - fall 2026|ga, atlanta, worldwide|https://www.linkedin.com/jobs/view/4394333202
sequoia capital global equities|junior software engineer (or internship)|berlin, berlin, germany|https://www.linkedin.com/jobs/view/4415872986
cresta|junior software engineer (or internship)|berlin, berlin, germany|https://www.linkedin.com/jobs/view/4415386137
snowflake|software engineer intern - berlin (2026)|berlin, berlin, germany|https://www.linkedin.com/jobs/view/4311124015
acemate.ai|software developer (intern / working student)|berlin, berlin, germany|https://www.linkedin.com/jobs/view/4412546363
nextaudit|praktikum (w/m/d) softwareentwickler - vue.js|aachen, north rhine-westphalia, germany|https://www.linkedin.com/jobs/view/4401224662
airbus defence and space|internship (d/f/m) within satellite onboard software|immenstaad am bodensee, baden-württemberg, germany|https://www.linkedin.com/jobs/view/4402810166
niologic gmbh|physiker (m/w/d) als trainee software engineering for ai-systems|hürth, north rhine-westphalia, germany|https://www.linkedin.com/jobs/view/4401693326
air space intelligence|internship - software engineer|gdańsk, pomorskie, poland|https://www.linkedin.com/jobs/view/4392918629
snowflake|software engineer intern (backend) - warsaw 2026|warsaw, mazowieckie, poland|https://www.linkedin.com/jobs/view/4343110115
siemens digital industries software|embedded software qa engineer, internship|poznań, wielkopolskie, poland|https://www.linkedin.com/jobs/view/4390997804
roche|software engineer in test intern|sant cugat del vallès, catalonia, spain|https://www.linkedin.com/jobs/view/4413075019
chalmers university of technology|doctoral student in earth observation, data science, and ai for poverty estimation|gothenburg, västra götaland county, sweden|https://www.linkedin.com/jobs/view/4414143655
snowflake|software engineer intern - zurich (2026)|zurich, zurich, switzerland|https://www.linkedin.com/jobs/view/4414230417
info support|master's thesis in software development: scala code quality metrics (multi paradigm)|veenendaal, utrecht, netherlands|https://www.linkedin.com/jobs/view/4409611018
kyndryl|lead ai & agentic ai architect (ai squad leader)|valbonne, provence-alpes-côte d'azur, france|https://www.linkedin.com/jobs/view/4323055289
lindner group|master's thesis pricing model for short-lived cloud services (agw*)|germany|https://www.linkedin.com/jobs/view/4395169052
amazon web services (aws)|aws director of technology, germany & central europe, aws global sales|munich, bavaria, germany|https://www.linkedin.com/jobs/view/4405295300
devoteam  google cloud partner|young graduates - google cloud, data & ai|machelen, flemish region, belgium|https://www.linkedin.com/jobs/view/4386162331
devoteam|internship in ai/ml 2026|machelen, flemish region, belgium|https://www.linkedin.com/jobs/view/4395026454
accenture belgium|young graduate – data&ai tech – as of september 2026|brussels, brussels region, belgium|https://www.linkedin.com/jobs/view/4397634129
devoteam|young graduates – databricks data & ai engineer|machelen, flemish region, belgium|https://www.linkedin.com/jobs/view/4386153695
inside higher ed|assistant professor of spatial information &amp; data science|ga, dahlonega, worldwide|https://www.linkedin.com/jobs/view/4409569975
exxeta|thesis (bachelor/master) devops (all genders)|karlsruhe, baden-württemberg, germany|https://www.linkedin.com/jobs/view/4409495844
airbus defence and space|master thesis at the testing department of the e-aircraft systems house (d/f/m)|munich, bavaria, germany|https://www.linkedin.com/jobs/view/4410133363
devoteam  google cloud partner|young graduates – google cloud, data & ai|amsterdam, north holland, netherlands|https://www.linkedin.com/jobs/view/4395006944
accenture the netherlands|data & ai thesis internship - data science/ml engineering|amsterdam, north holland, netherlands|https://www.linkedin.com/jobs/view/4407930692
bux|chief product & technology officer|amsterdam area, worldwide|https://www.linkedin.com/jobs/view/4413557303
info support|master's thesis in cloud: hyperscaler strategies for great user experience and business engagement - lessons for a federation provider|veenendaal, utrecht, netherlands|https://www.linkedin.com/jobs/view/4409612011
accenture the netherlands|health & public services technology internship|amsterdam, north holland, netherlands|https://www.linkedin.com/jobs/view/4400078678
university of la verne|lfce student assistant digital media specialist (2023/2024) - fws only|la verne, canada|https://www.linkedin.com/jobs/view/4252835059
university of la verne|lfce student assistant digital media specialist ay 2025-2026 - fws only|la verne, canada|https://www.linkedin.com/jobs/view/4302807490
sequence|product engineer - london|london, england, united kingdom|https://www.linkedin.com/jobs/view/4379738852
sequence|ai engineer - london|london, england, united kingdom|https://www.linkedin.com/jobs/view/4415386107
sequence|senior product engineer (backend) - london|london, england, united kingdom|https://www.linkedin.com/jobs/view/4372208758
sequence|senior software engineer - london|london, england, united kingdom|https://www.linkedin.com/jobs/view/4372210752
ltm|senior specialist - architecture|ga, atlanta, worldwide|https://www.linkedin.com/jobs/view/4405182020
ltm|senior specialist - architecture|ga, atlanta, worldwide|https://www.linkedin.com/jobs/view/4405180014
ltm|senior specialist - architecture|ga, atlanta, worldwide|https://www.linkedin.com/jobs/view/4405169840
ltm|senior specialist - architecture|ga, atlanta, worldwide|https://www.linkedin.com/jobs/view/4405167932
ltm|senior specialist - architecture|ga, atlanta, worldwide|https://www.linkedin.com/jobs/view/4405169811
ltm|senior specialist - architecture|ga, atlanta, worldwide|https://www.linkedin.com/jobs/view/4402480629
ltm|principal - architecture|ga, atlanta, worldwide|https://www.linkedin.com/jobs/view/4405179064
tso-data|bachelor-/master-/abschlussarbeit|nuremberg, bavaria, germany|https://www.linkedin.com/jobs/view/3643847124
sap|working student (f/m/d) - sap enterprise architects for management programs|walldorf, baden-württemberg, germany|https://www.linkedin.com/jobs/view/4413529673
objektkultur software gmbh|praktikum, werkstudierende - cloud infrastruktur & security (m/w/d)|karlsruhe, baden-württemberg, germany|https://www.linkedin.com/jobs/view/4404191036
info support|master's thesis in data & ai: fair and trustworthy recommendations in e-commerce using ai|veenendaal, utrecht, netherlands|https://www.linkedin.com/jobs/view/4409606207
chalmers university of technology|phd student position in web and emerging applications security|gothenburg, västra götaland county, sweden|https://www.linkedin.com/jobs/view/4403376377
ait austrian institute of technology|master thesis "meta learning in nonlineary dynamic system modelling"|vienna, vienna, austria|https://www.linkedin.com/jobs/view/4396379674
aircall|gtm enablement intern|paris, île-de-france, france|https://www.linkedin.com/jobs/view/4373813708
airbus defence and space|working student (d/f/m) procurement commodity it & ground systems|munich, bavaria, germany|https://www.linkedin.com/jobs/view/4404114970
airbus aircraft|working student procurement strategy (d/f/m)|hamburg, hamburg, germany|https://www.linkedin.com/jobs/view/4412445400
the ocean cleanup|internship – digital marketing|rotterdam, south holland, netherlands|https://www.linkedin.com/jobs/view/4410351919
dept®|intern visual design|amsterdam, north holland, netherlands|https://www.linkedin.com/jobs/view/4405877916
dept®|intern visual design|rotterdam, south holland, netherlands|https://www.linkedin.com/jobs/view/4405894182
yivi app|master thesis project  ecdsa zero-knowledge credentials in yivi’s eudi wallet|utrecht, utrecht, netherlands|https://www.linkedin.com/jobs/view/4388346321
campbell hall|middle school math|los angeles, canada|https://www.linkedin.com/jobs/view/4383872617
international schools partnership limited|admissions manager colegio vasco de gama (lisboa, portugal)|madrid, community of madrid, spain|https://www.linkedin.com/jobs/view/4414776156
roche|commercial excellence internship (as of july/ august for 12 months in rotkreuz)|rotkreuz, zug, switzerland|https://www.linkedin.com/jobs/view/4411768893
orbital|staff ai engineer|london, england, united kingdom|https://www.linkedin.com/jobs/view/4411506026
orbital|staff ai engineer|london area, united kingdom|https://www.linkedin.com/jobs/view/4414617877
entrepreneurs first|talent acquisition specialist|london, england, united kingdom|https://www.linkedin.com/jobs/view/4415398326
novo nordisk|equipment & qualification responsible|måløv, capital region of denmark, denmark|https://www.linkedin.com/jobs/view/4411502144
columbia road|sales technology consultant (early career)|tampere, pirkanmaa, finland|https://www.linkedin.com/jobs/view/4384259608
columbia road|sales technology consultant (early career)|helsinki, uusimaa, finland|https://www.linkedin.com/jobs/view/4358462521
green coast hotel - mgallery collection|reservation agent|vlora, vlorë, worldwide|https://www.linkedin.com/jobs/view/4413543079
allo|support agent - albania|tirana, tirana, worldwide|https://www.linkedin.com/jobs/view/4380599613
altamira|full-stack (node.js/react.js)|tirana, tirana, worldwide|https://www.linkedin.com/jobs/view/4378035878
touch support, inc. & snf back office|junior accountant|tirana, tirana, worldwide|https://www.linkedin.com/jobs/view/4385744004
deloitte|deloitte expo  albania|tirana, tirana, worldwide|https://www.linkedin.com/jobs/view/4405575161
dexi.io (part of engage3)|junior scrum master|tirana, tirana, worldwide|https://www.linkedin.com/jobs/view/4313040374
bulls media worldgroup|junior qa engineer|tirana, tirana, worldwide|https://www.linkedin.com/jobs/view/4373679488
pragmatike|founding full stack ai engineer|tirana, tirana, worldwide|https://www.linkedin.com/jobs/view/4390495145
bulls media worldgroup|information technology support specialists|tirana, tirana, worldwide|https://www.linkedin.com/jobs/view/4349435105
bulls media worldgroup|data analyst|tirana, tirana, worldwide|https://www.linkedin.com/jobs/view/4407263985
compose software|senior backend developer (java/spring boot)|tirana, tirana, worldwide|https://www.linkedin.com/jobs/view/4410036613
learntastic|software engineering team lead – react/node/postgresql|albania, worldwide|https://www.linkedin.com/jobs/view/4410214732
b2tech|.net engineer|tirana, tirana, worldwide|https://www.linkedin.com/jobs/view/4404714045
allo|senior backend engineer (java/spring boot)|tirana, tirana, worldwide|https://www.linkedin.com/jobs/view/4366932584
reboot monkey|data center technician - albania - tirana - on-site|tirana, tirana, worldwide|https://www.linkedin.com/jobs/view/4382628144
allo|senior frontend engineer (react/next.js)|tirana, tirana, worldwide|https://www.linkedin.com/jobs/view/4366939422
hashwhale|hr cum finance|albania, worldwide|https://www.linkedin.com/jobs/view/4320270779
arpya|technical project manager|albania, tirana, worldwide|https://www.linkedin.com/jobs/view/4412310018
ey|finance associate|tirana, tirana, worldwide|https://www.linkedin.com/jobs/view/4413565326
amaris consulting|level 1 help desk support specialist|albania, worldwide|https://www.linkedin.com/jobs/view/4410612580
imerit scholars|albanian language expert|albania, worldwide|https://www.linkedin.com/jobs/view/4415077834
block labs|technical project manager - igaming|albania, worldwide|https://www.linkedin.com/jobs/view/4373351630
kontakt al|construction engineer|albania, tirana, worldwide|https://www.linkedin.com/jobs/view/4408838607
alfadocs.com|senior full stack/backend engineer (php + react)|albania, worldwide|https://www.linkedin.com/jobs/view/4399138705
lutech|erp developer|tirana, tirana, worldwide|https://www.linkedin.com/jobs/view/4411167463
n8n|engineering manager  n8n community  remote-europe|albania, worldwide|https://www.linkedin.com/jobs/view/4398900101
deel|team lead, engineering, fintech|albania, worldwide|https://www.linkedin.com/jobs/view/4383242281
yassir|senior qa engineer - manual & automated testing|tirana, tirana, worldwide|https://www.linkedin.com/jobs/view/4268371981
groupe hospitalier artois-ternois|chargé d'opération travaux / conseiller transition énergétique et écologique h/f|arras, dibrë, worldwide|https://www.linkedin.com/jobs/view/4229702351
n8n|senior technical success manager - oem - emea|albania, worldwide|https://www.linkedin.com/jobs/view/4409401723
enpal|quality analyst / heat pump / entry-level|tirana, tirana, worldwide|https://www.linkedin.com/jobs/view/4393542155
the flex|senior software engineer|albania, worldwide|https://www.linkedin.com/jobs/view/4367316104
sumitomo electric|logistic specialist|bathore, tirana, worldwide|https://www.linkedin.com/jobs/view/4365588617
lango|proposal specialist|albania, tirana, worldwide|https://www.linkedin.com/jobs/view/4414147461
quotidiano sanità club|e-learning instructional designer|albania, tirana, worldwide|https://www.linkedin.com/jobs/view/4407887404
concentrix|receptionist/facility assistant part time|albania, durres, worldwide|https://www.linkedin.com/jobs/view/4404056533
cdata software|technical support engineer|tirana, tirana, worldwide|https://www.linkedin.com/jobs/view/4404969983
accor|cost controller|vlorë, vlorë, worldwide|https://www.linkedin.com/jobs/view/4393809551
deel|engineering tech lead, ai|albania, worldwide|https://www.linkedin.com/jobs/view/4409971591
bizaway|travel agent - spanish speaking|shkodër, shkodër, worldwide|https://www.linkedin.com/jobs/view/4390009987
software business srl benefit|consulente sap|albania, tirana, worldwide|https://www.linkedin.com/jobs/view/4413520972
deloitte|qa engineer|tirana, tirana, worldwide|https://www.linkedin.com/jobs/view/4395034659
block labs|senior software engineer (go) - igaming|albania, worldwide|https://www.linkedin.com/jobs/view/4408646586
university of medicine, tirana|kandidatët për pozicionin e punës “specialist” në sektorin e kurrikulës dhe pranimeve, drejtoria e administrimit akademik dhe kurrikulës, rektorati i universitetit të mjekësisë|tirana, tirana, worldwide|https://www.linkedin.com/jobs/view/4414944976
novamed|catheterization laboratory tech ft|elbasan, elbasan, worldwide|https://www.linkedin.com/jobs/view/4411400608
service factory solutions|sap basis administrator|albania, tirana, worldwide|https://www.linkedin.com/jobs/view/4412744574
block labs|senior backend engineer (go)|albania, worldwide|https://www.linkedin.com/jobs/view/4325216227
deloitte|software quality engineer  engineering team|tirana, tirana, worldwide|https://www.linkedin.com/jobs/view/4399053239
alfadocs.com|senior data migration engineer (php)|albania, worldwide|https://www.linkedin.com/jobs/view/4399152470
adaptive teams|senior amazon ppc manager|bahçallëk, korçë, worldwide|https://www.linkedin.com/jobs/view/4357701729
rina|italy certification commercial support advisor|albania, worldwide|https://www.linkedin.com/jobs/view/4390954138
bip|devops engineer|tirana, tirana, worldwide|https://www.linkedin.com/jobs/view/4399966076
pragmatike|principal backend engineer (golang)|albania, worldwide|https://www.linkedin.com/jobs/view/4389227954
epam systems|sap service delivery manager|albania, worldwide|https://www.linkedin.com/jobs/view/4392667690
flex business solutions|executive assistant|albania, tirana, worldwide|https://www.linkedin.com/jobs/view/4411239568
royal caribbean group|assistant housekeeping manager|albania, tirana, worldwide|https://www.linkedin.com/jobs/view/4385363096
sicpa|senior java backend engineer|albania, tirana, worldwide|https://www.linkedin.com/jobs/view/4414204754
beta balkan team|angular senior developer|albania, worldwide|https://www.linkedin.com/jobs/view/4410999870
rina|italy certification commercial support advisor|albania, worldwide|https://www.linkedin.com/jobs/view/4390942418
teamsystem|senior backend developer - .net & c#|tirana, tirana, worldwide|https://www.linkedin.com/jobs/view/4368710422
agoda|analyst (supply analytics) (bangkok-based role, relocation provided)|tirana, tirana, worldwide|https://www.linkedin.com/jobs/view/4410525942
agoda|senior analyst (supply analytics, bangkok-based, relocation provided)|tirana, tirana, worldwide|https://www.linkedin.com/jobs/view/4299778137
agoda|senior engineering manager (bangkok based, relocation provided)|tirana, tirana, worldwide|https://www.linkedin.com/jobs/view/4370566363
concentrix|customer service advisor - airbnb - italian|tirana, tirana, worldwide|https://www.linkedin.com/jobs/view/4373139243
concentrix|advisor i, customer service - italian|tirana, tirana, worldwide|https://www.linkedin.com/jobs/view/4373139242
bip|ai application operations & maintenance engineer (azure)|tirana, tirana, worldwide|https://www.linkedin.com/jobs/view/4411220252
agoda|insights analyst (bangkok based, relocation provided)|tirana, tirana, worldwide|https://www.linkedin.com/jobs/view/4410527750
agoda|data analyst, (statistics/ml/bi) (bangkok-based, relocation provided)|tirana, tirana, worldwide|https://www.linkedin.com/jobs/view/4410540950
agoda|people data analyst(bangkok based, relocation provided)|tirana, tirana, worldwide|https://www.linkedin.com/jobs/view/4410543435
bip|senior software engineer|tirana, tirana, worldwide|https://www.linkedin.com/jobs/view/4411227296
agoda|senior analyst/ associate manager - strategic partnership (bangkok based, relocation provided)|tirana, tirana, worldwide|https://www.linkedin.com/jobs/view/4410536506
agoda|senior analyst- customer experience group(bangkok based, relocation provided)|tirana, tirana, worldwide|https://www.linkedin.com/jobs/view/4410534744
agoda|senior analyst- customer marketing (bangkok based, relocation provided)|tirana, tirana, worldwide|https://www.linkedin.com/jobs/view/4410553034
eosol|supervisor mecánico fv|castelnou, aragon, spain|https://www.linkedin.com/jobs/view/4389577443
audifarma s.a|ingeniero de desarrollo junior|pereira, risaralda, colombia|https://www.linkedin.com/jobs/view/4408760949
cuidarte tu salud ips|asistente de sistemas|pereira, risaralda, colombia|https://www.linkedin.com/jobs/view/4413956878
veritran|programmer analyst - co|pereira, risaralda, colombia|https://www.linkedin.com/jobs/view/4161553518
flex|software engineer|armenia metropolitan area, worldwide|https://www.linkedin.com/jobs/view/4312342877
universidad pedagógica y tecnológica de colombia|tecnico en sistemas - pereira|pereira, risaralda, colombia|https://www.linkedin.com/jobs/view/4411920746
solé|líder de sistemas|dosquebradas, risaralda, colombia|https://www.linkedin.com/jobs/view/4410572458
audifarma s.a|ingeniero aseg calidad software junior|pereira, risaralda, colombia|https://www.linkedin.com/jobs/view/4408784039
bairesdev|junior backend developer (node.js)  ref#284230|pereira, risaralda, colombia|https://www.linkedin.com/jobs/view/4258062407
energitel telco|gerente técnico y de proyectos|dosquebradas, risaralda, colombia|https://www.linkedin.com/jobs/view/4410832804
bairesdev|junior fullstack react & node developer - remote work  ref#284270|pereira, risaralda, colombia|https://www.linkedin.com/jobs/view/4258067035
bairesdev|junior project manager - remote work  ref#282119|pereira, risaralda, colombia|https://www.linkedin.com/jobs/view/4258065175
agileengine|full stack developer id63542|pereira, risaralda, colombia|https://www.linkedin.com/jobs/view/4410806033
agileengine|ai full stack developer id63542|pereira, risaralda, colombia|https://www.linkedin.com/jobs/view/4410499263
bairesdev|fullstack engineer (ai project) - remote work  ref#283504|pereira, risaralda, colombia|https://www.linkedin.com/jobs/view/4192196952
bairesdev|android developer - remote work  ref#170652|pereira, risaralda, colombia|https://www.linkedin.com/jobs/view/4258062349
bairesdev|software engineer php - remote work  ref#284090|pereira, risaralda, colombia|https://www.linkedin.com/jobs/view/4258059635
bairesdev|it support analyst - remote work  ref#284123|pereira, risaralda, colombia|https://www.linkedin.com/jobs/view/4258064236
bairesdev|junior scrum master - remote work  ref#284255|pereira, risaralda, colombia|https://www.linkedin.com/jobs/view/4258059703
provectus|senior software engineer / solutions architect (python & genai)|armenia, quindío, colombia|https://www.linkedin.com/jobs/view/4392937102
bairesdev|hr business partner - remote work  ref#171486|pereira, risaralda, colombia|https://www.linkedin.com/jobs/view/4192199696
linktic s.a.s|ingeniero cloud junior|pereira, risaralda, colombia|https://www.linkedin.com/jobs/view/4406641240
agileengine|senior java developer id46880|pereira, risaralda, colombia|https://www.linkedin.com/jobs/view/4415073840
hitachi energy|project management (administrador de proyectos)|dosquebradas, risaralda, colombia|https://www.linkedin.com/jobs/view/4368714651
agileengine|senior backend engineer id63949|pereira, risaralda, colombia|https://www.linkedin.com/jobs/view/4414178481
bairesdev|employer branding trainee - remote work  ref#284153|pereira, risaralda, colombia|https://www.linkedin.com/jobs/view/4258065197
audifarma s.a|contador junior pereira|pereira, risaralda, colombia|https://www.linkedin.com/jobs/view/4415862661
on off tu amigo digital|líder de desarrollo móvil / mobile tech lead|pereira, risaralda, colombia|https://www.linkedin.com/jobs/view/4413404963
empresa confidencial|scrum master|pereira, risaralda, colombia|https://www.linkedin.com/jobs/view/4415533014
bairesdev|internal communications and community management analyst - remote work  ref#154975|pereira, risaralda, colombia|https://www.linkedin.com/jobs/view/4258060635
agileengine|senior software engineer in test id57977|pereira, risaralda, colombia|https://www.linkedin.com/jobs/view/4414721733
agileengine|software engineer (senior) id51942|pereira, risaralda, colombia|https://www.linkedin.com/jobs/view/4411395104
