company|title|location|link
vaarst|graduate robotics software engineer|bristol, england, united kingdom|https://www.linkedin.com/jobs/view/3824358201
gradfuel|software engineering graduate with global technology leader|newcastle upon tyne, england, united kingdom|https://www.linkedin.com/jobs/view/3780817665
grb (graduate recruitment bureau)|graduate software engineer - summer 2024|surrey, england, united kingdom|https://www.linkedin.com/jobs/view/3892353241
it career switch|trainee web developer|chelmsford, england, united kingdom|https://www.linkedin.com/jobs/view/3879245492
it career switch|trainee web developer|leeds, england, united kingdom|https://www.linkedin.com/jobs/view/3879247305
it career switch|trainee web developer|aberdeen, scotland, united kingdom|https://www.linkedin.com/jobs/view/3879242885
it career switch|trainee web developer|wolverhampton, england, united kingdom|https://www.linkedin.com/jobs/view/3879247286
it career switch|trainee web developer|stoke-on-trent, england, united kingdom|https://www.linkedin.com/jobs/view/3879248128
e-careers|software developer trainee|langley, england, united kingdom|https://www.linkedin.com/jobs/view/3744795167
e-careers|software developer trainee|chester, england, united kingdom|https://www.linkedin.com/jobs/view/3714810985
e-careers|trainee - software developer|oldham, england, united kingdom|https://www.linkedin.com/jobs/view/3744794727
e-careers|software developer trainee|runcorn, england, united kingdom|https://www.linkedin.com/jobs/view/3714810987
e-careers|software developer trainee|fulwood, england, united kingdom|https://www.linkedin.com/jobs/view/3702466959
e-careers|software developer trainee|lytham st anne's, england, united kingdom|https://www.linkedin.com/jobs/view/3714812718
e-careers|software developer trainee|blackpool, england, united kingdom|https://www.linkedin.com/jobs/view/3702470254
e-careers|software developer trainee|macclesfield, england, united kingdom|https://www.linkedin.com/jobs/view/3745001135
e-careers|trainee - software developer|bury, england, united kingdom|https://www.linkedin.com/jobs/view/3651668905
e-careers|software developer trainee|winsford, england, united kingdom|https://www.linkedin.com/jobs/view/3702471193
motorola solutions|junior software engineer|glasgow, scotland, united kingdom|https://www.linkedin.com/jobs/view/3881679959
e-careers|software developer trainee|delamere, england, united kingdom|https://www.linkedin.com/jobs/view/3744790859
e-careers|trainee - software developer|sale, england, united kingdom|https://www.linkedin.com/jobs/view/3881511845
e-careers|software developer trainee|manley, england, united kingdom|https://www.linkedin.com/jobs/view/3744790860
e-careers|software developer trainee|northwich, england, united kingdom|https://www.linkedin.com/jobs/view/3702467862
e-careers|trainee - software developer|denton, england, united kingdom|https://www.linkedin.com/jobs/view/3714816242
e-careers|trainee - software developer|trafford park, england, united kingdom|https://www.linkedin.com/jobs/view/3681119470
e-careers|trainee - software developer|manchester, england, united kingdom|https://www.linkedin.com/jobs/view/3886083001
e-careers|software developer trainee|oakhanger, england, united kingdom|https://www.linkedin.com/jobs/view/3744796028
e-careers|software developer trainee|burscough, england, united kingdom|https://www.linkedin.com/jobs/view/3702466957
e-careers|trainee - software developer|stalybridge, england, united kingdom|https://www.linkedin.com/jobs/view/3832368005
e-careers|trainee - software developer|leeds, england, united kingdom|https://www.linkedin.com/jobs/view/3651668907
e-careers|software developer trainee|accrington, england, united kingdom|https://www.linkedin.com/jobs/view/3702469284
nuyew tech academy|trainee web developer career pathway|nottingham, england, united kingdom|https://www.linkedin.com/jobs/view/3850018415
e-careers|trainee - software developer|eccles, england, united kingdom|https://www.linkedin.com/jobs/view/3651671711
cobblestone energy|graduate software engineer - dubai, uae|london, england, united kingdom|https://www.linkedin.com/jobs/view/3641766406
change grow live|web developer|leeds, england, united kingdom|https://www.linkedin.com/jobs/view/3911337418
e-careers|software developer trainee|brierfield, england, united kingdom|https://www.linkedin.com/jobs/view/3702466958
energy jobline|graduate plc software engineer|wymondham, england, united kingdom|https://www.linkedin.com/jobs/view/3891962369
energy jobline|application software engineer - javascript|cambridge, england, united kingdom|https://www.linkedin.com/jobs/view/3902025130
cobblestone energy|graduate software engineer - dubai, uae|birmingham, england, united kingdom|https://www.linkedin.com/jobs/view/3641765480
energy jobline|graduate embedded software engineer|milton keynes, england, united kingdom|https://www.linkedin.com/jobs/view/3909745092
energy jobline|graduate/junior software support engineer/analyst x 2 - swindon - fintech - training & progressio...|swindon, england, united kingdom|https://www.linkedin.com/jobs/view/3902032959
nuyew tech academy|trainee web developer career pathway|glasgow, scotland, united kingdom|https://www.linkedin.com/jobs/view/3849569129
redtech recruitment|software qa engineer - graduate considered|cambridge, england, united kingdom|https://www.linkedin.com/jobs/view/3909185363
nuyew tech academy|trainee web developer career pathway|cardiff, wales, united kingdom|https://www.linkedin.com/jobs/view/3850016682
octagon group|embedded software engineer|towcester, england, united kingdom|https://www.linkedin.com/jobs/view/3907410107
itonlinelearning recruitment|coding and programming trainee|slough, england, united kingdom|https://www.linkedin.com/jobs/view/3903486117
itonlinelearning recruitment|coding and programming trainee|oxford, england, united kingdom|https://www.linkedin.com/jobs/view/3903482632
itonlinelearning recruitment|coding and programming trainee|royal sutton coldfield, england, united kingdom|https://www.linkedin.com/jobs/view/3901547873
itonlinelearning recruitment|coding and programming trainee|bolton, england, united kingdom|https://www.linkedin.com/jobs/view/3901547759
robustelli ∙ soucy ∙ hussey, p.a.|devops engineer (graduate considered)|cambridge, england, united kingdom|https://www.linkedin.com/jobs/view/3856897274
itonlinelearning recruitment|coding and programming trainee|southampton, england, united kingdom|https://www.linkedin.com/jobs/view/3891418688
itonlinelearning recruitment|coding and programming trainee|bournemouth, england, united kingdom|https://www.linkedin.com/jobs/view/3903482615
itonlinelearning recruitment|coding and programming trainee|huddersfield, england, united kingdom|https://www.linkedin.com/jobs/view/3901550365
itonlinelearning recruitment|coding and programming trainee|norwich, england, united kingdom|https://www.linkedin.com/jobs/view/3891405999
itonlinelearning recruitment|coding and programming trainee|kingston upon hull, england, united kingdom|https://www.linkedin.com/jobs/view/3883236459
certara|graduate web developer|sheffield, england, united kingdom|https://www.linkedin.com/jobs/view/3909349787
itonlinelearning recruitment|coding and programming trainee|gloucester, england, united kingdom|https://www.linkedin.com/jobs/view/3906675053
oho group ltd|graduate full stack engineer (ex facebook and google)|london area, united kingdom|https://www.linkedin.com/jobs/view/3906860046
itonlinelearning recruitment|coding and programming trainee|newport, wales, united kingdom|https://www.linkedin.com/jobs/view/3883248370
thales|software engineer|crawley, england, united kingdom|https://www.linkedin.com/jobs/view/3884033736
thales|software engineer web technologies|crawley, england, united kingdom|https://www.linkedin.com/jobs/view/3846408725
illumina|software test engineer|cambridge, england, united kingdom|https://www.linkedin.com/jobs/view/3866624546
gradfuel|hardware and mechatronics graduate in product engineering for luxury brand|bath, england, united kingdom|https://www.linkedin.com/jobs/view/3773987558
tesco|software development engineer ii – tesco labs|welwyn garden city, england, united kingdom|https://www.linkedin.com/jobs/view/3779131903
profectus recruitment|c++ software engineer|derby, england, united kingdom|https://www.linkedin.com/jobs/view/3891420228
clickjobs.io|graduate software engineer (embedded)|luton, england, united kingdom|https://www.linkedin.com/jobs/view/3909373821
profectus recruitment|c++ software engineer|matlock bath, england, united kingdom|https://www.linkedin.com/jobs/view/3888123523
adsyst (automation) limited|junior / graduate control systems engineer|yateley, england, united kingdom|https://www.linkedin.com/jobs/view/3889797307
vector recruitment ltd|graduate electronics engineer - security & defence|cambridge, england, united kingdom|https://www.linkedin.com/jobs/view/3882895803
redtech recruitment|r&amp;amp;d software engineer / developer|cambridge, england, united kingdom|https://www.linkedin.com/jobs/view/3890612964
itdev|graduate electronics engineer|southampton, england, united kingdom|https://www.linkedin.com/jobs/view/3887465576
analog devices|engineer, software development|greater leeds area, worldwide|https://www.linkedin.com/jobs/view/3908004640
xenserver|associate software engineer – xenserver interfaces|cambridge, england, united kingdom|https://www.linkedin.com/jobs/view/3893245055
european recruitment|software engineer - msc and phd grads|oxford, england, united kingdom|https://www.linkedin.com/jobs/view/3896163720
robustelli ∙ soucy ∙ hussey, p.a.|junior operations engineer - graduate|cambridge, england, united kingdom|https://www.linkedin.com/jobs/view/3886770012
tesco|software development engineer iii - tesco labs|welwyn garden city, england, united kingdom|https://www.linkedin.com/jobs/view/3802244583
energy jobline|graduate fpga engineer|cambridge, england, united kingdom|https://www.linkedin.com/jobs/view/3903036444
macstaff|graduate mechatronics engineer|dorking, england, united kingdom|https://www.linkedin.com/jobs/view/3832068661
matchtech|relocation software engineer|england, united kingdom|https://www.linkedin.com/jobs/view/3822436580
bennett & game recruitment limited|graduate design engineer|westbury, england, united kingdom|https://www.linkedin.com/jobs/view/3881250246
solidx ltd|solidworks engineer|cambridge, england, united kingdom|https://www.linkedin.com/jobs/view/3896678198
canonical|software engineer (linux/python or go) - container images|manchester, england, united kingdom|https://www.linkedin.com/jobs/view/3895322243
thales|system integration and test engineer|glasgow, scotland, united kingdom|https://www.linkedin.com/jobs/view/3845773107
ernest gordon recruitment|graduate it support engineer|york, england, united kingdom|https://www.linkedin.com/jobs/view/3899978262
fundacion interamericana del corazon - argentina|associate solutions engineer - uk|london, england, united kingdom|https://www.linkedin.com/jobs/view/3860929846
leonardo|industrial placement software engineer|edinburgh, scotland, united kingdom|https://www.linkedin.com/jobs/view/3778188981
instil|senior software engineer|belfast, northern ireland, united kingdom|https://www.linkedin.com/jobs/view/3902331587
marcus webb associates limited|systems engineer|greater stoke-on-trent area, worldwide|https://www.linkedin.com/jobs/view/3876830594
bennett & game recruitment limited|structural engineer|warrington, england, united kingdom|https://www.linkedin.com/jobs/view/3905813862
alternative networks (now part of daisy group)|graduate distribution system operator (dso) engineer|london, england, united kingdom|https://www.linkedin.com/jobs/view/3857581547
emerson|mechanical engineer|crawley, england, united kingdom|https://www.linkedin.com/jobs/view/3908275968
bilfinger uk|graduate scada/system engineer|winnersh, england, united kingdom|https://www.linkedin.com/jobs/view/3712075008
jobs via efinancialcareers|python software engineer- prop market maker|london, england, united kingdom|https://www.linkedin.com/jobs/view/3891550572
evera recruitment|project engineer- electronic diagnostics software|gaydon, england, united kingdom|https://www.linkedin.com/jobs/view/3900572835
fundacion interamericana del corazon - argentina|associate solutions engineer - uk|southampton, england, united kingdom|https://www.linkedin.com/jobs/view/3881686091
jobs via efinancialcareers|python developer tools engineer- world-leading prop trading fund|london, england, united kingdom|https://www.linkedin.com/jobs/view/3891551268
enterprise recruitment ltd|graduate electronics engineer|cambridge, england, united kingdom|https://www.linkedin.com/jobs/view/3704802223
rina|senior embedded software engineer (c/c++)|leatherhead, england, united kingdom|https://www.linkedin.com/jobs/view/3890135969
bennett & game recruitment limited|graduate civil engineer|keighley, england, united kingdom|https://www.linkedin.com/jobs/view/3882481381
enterprise recruitment ltd|graduate electronics engineer (client support)|cambridge, england, united kingdom|https://www.linkedin.com/jobs/view/3882362544
advanced technical recruitment|junior test &amp;amp; installation engineer|manchester, england, united kingdom|https://www.linkedin.com/jobs/view/3854620468
steel connexions ltd|structural engineer (sfs / lgf)|royal sutton coldfield, england, united kingdom|https://www.linkedin.com/jobs/view/3887381694
thales|system integration and test engineer|cheadle, england, united kingdom|https://www.linkedin.com/jobs/view/3765137594
jobs via efinancialcareers|python software developer (risk)- systematic quant fund|london, england, united kingdom|https://www.linkedin.com/jobs/view/3852978371
calibre search|associate rail (structures) engineer|amersham, england, united kingdom|https://www.linkedin.com/jobs/view/3894194508
vector recruitment ltd|electronics engineer - cyber security engineer|cambridge, england, united kingdom|https://www.linkedin.com/jobs/view/3882898712
thales|software engineering manager|crawley, england, united kingdom|https://www.linkedin.com/jobs/view/3884035312
thales|lead systems integration and test engineer|templecombe, england, united kingdom|https://www.linkedin.com/jobs/view/3838295065
advanced technical recruitment|semiconductor test & installation engineer|manchester, england, united kingdom|https://www.linkedin.com/jobs/view/3886417510
gradfuel|business growth graduate with global technology leader|newcastle upon tyne, england, united kingdom|https://www.linkedin.com/jobs/view/3780818420
milestone infrastructure|design engineer bridges|oxford, england, united kingdom|https://www.linkedin.com/jobs/view/3888265970
coherent corp.|senior/lead embedded software engineer|glasgow, scotland, united kingdom|https://www.linkedin.com/jobs/view/3762324989
energy jobline|hv design engineer|manchester, england, united kingdom|https://www.linkedin.com/jobs/view/3902012578
gradfuel|project management graduate with global technology leader|newcastle upon tyne, england, united kingdom|https://www.linkedin.com/jobs/view/3780817577
crouch waterfall & partners ltd|principal structural engineer (buildings)|basingstoke, england, united kingdom|https://www.linkedin.com/jobs/view/3660077588
bennett & game recruitment limited|structural engineer - surveying|london, england, united kingdom|https://www.linkedin.com/jobs/view/3888121541
bennett & game recruitment limited|structural engineer - surveying|city of london, england, united kingdom|https://www.linkedin.com/jobs/view/3890059661
bennett & game recruitment limited|structural engineer - surveying|city of london, england, united kingdom|https://www.linkedin.com/jobs/view/3881248213
redtech recruitment|product specialist graduate level|london, england, united kingdom|https://www.linkedin.com/jobs/view/3809725065
thales|solutions architect|crawley, england, united kingdom|https://www.linkedin.com/jobs/view/3887651867
mygwork - lgbtq+ business community|senior ai/ml engineer - sequence learning|london, england, united kingdom|https://www.linkedin.com/jobs/view/3899077185
gsk|senior ai/ml engineer - sequence learning|london, england, united kingdom|https://www.linkedin.com/jobs/view/3908299700
energy jobline|uav power system engineer (solar array / lithium batteries)|medstead, england, united kingdom|https://www.linkedin.com/jobs/view/3901775918
hilson moran|junior public health engineer|farnborough, england, united kingdom|https://www.linkedin.com/jobs/view/3904530184
wsp in the uk|structural engineer (building structures)|edinburgh, scotland, united kingdom|https://www.linkedin.com/jobs/view/3907098542
platform recruitment|senior hardware engineer|hertfordshire, england, united kingdom|https://www.linkedin.com/jobs/view/3884265862
wsp in the uk|structural engineer (building structures)|glasgow, scotland, united kingdom|https://www.linkedin.com/jobs/view/3907097642
gradfuel|supplier technical assistance graduate in industrial operations for luxury brand|newcastle upon tyne, england, united kingdom|https://www.linkedin.com/jobs/view/3773988514
gradfuel|supplier technical assistance graduate in industrial operations for luxury brand|bath, england, united kingdom|https://www.linkedin.com/jobs/view/3773992560
gradfuel|supplier technical assistance graduate in industrial operations for luxury brand|leeds, england, united kingdom|https://www.linkedin.com/jobs/view/3773990608
gradfuel|supplier technical assistance graduate in industrial operations for luxury brand|sheffield, england, united kingdom|https://www.linkedin.com/jobs/view/3773993358
wsp in the uk|system safety engineer (all levels) - rail|manchester, england, united kingdom|https://www.linkedin.com/jobs/view/3901024616
ice recruit|principal structural engineer|plymouth, england, united kingdom|https://www.linkedin.com/jobs/view/3890893635
wsp in the uk|system safety engineer (all levels) - rail|london, england, united kingdom|https://www.linkedin.com/jobs/view/3901025205
gradfuel|supplier technical assistance graduate in industrial operations for luxury brand|bristol, england, united kingdom|https://www.linkedin.com/jobs/view/3773993384
wsp in the uk|system safety engineer (all levels) - rail|leeds, england, united kingdom|https://www.linkedin.com/jobs/view/3901027031
wsp in the uk|system safety engineer (all levels) - rail|birmingham, england, united kingdom|https://www.linkedin.com/jobs/view/3901028046
energy jobline|senior structural design engineer|warrington, england, united kingdom|https://www.linkedin.com/jobs/view/3891981737
vertical recruitment|associate principal  principal structural engineer|manchester, england, united kingdom|https://www.linkedin.com/jobs/view/3826628831
energy jobline|public health design engineer|bristol, england, united kingdom|https://www.linkedin.com/jobs/view/3892689439
holt executive ltd|senior satcom systems engineer|bedford, england, united kingdom|https://www.linkedin.com/jobs/view/3869772121
aecom|senior mechanical engineer|cardiff, wales, united kingdom|https://www.linkedin.com/jobs/view/3787490889
energy jobline|public health design engineer|london, england, united kingdom|https://www.linkedin.com/jobs/view/3892686024
boeing|system safety engineer (full-time or part-time)|yeovil, england, united kingdom|https://www.linkedin.com/jobs/view/3844439252
wsp in the uk|system safety engineer (all levels) - rail|cardiff, wales, united kingdom|https://www.linkedin.com/jobs/view/3901022758
oil and gas job search ltd|principal mechanical engineer|aberdeen, scotland, united kingdom|https://www.linkedin.com/jobs/view/3900068232
energy jobline|lead systems integration and test engineer|templecombe, england, united kingdom|https://www.linkedin.com/jobs/view/3901796818
frazer-nash consultancy|phd graduate - fluids and thermal engineering|glasgow, scotland, united kingdom|https://www.linkedin.com/jobs/view/3805601660
frazer-nash consultancy|phd graduate - fluids and thermal engineering|bristol, england, united kingdom|https://www.linkedin.com/jobs/view/3805607133
oil and gas job search ltd|senior mechanical engineer|aberdeen, scotland, united kingdom|https://www.linkedin.com/jobs/view/3900070082
frazer-nash consultancy|phd graduate - fluids and thermal engineering|warrington, england, united kingdom|https://www.linkedin.com/jobs/view/3805605260
frazer-nash consultancy|phd graduate - fluids and thermal engineering|burton upon trent, england, united kingdom|https://www.linkedin.com/jobs/view/3805602610
qinetiq|flight test engineer instructor - fixed wing|boscombe, england, united kingdom|https://www.linkedin.com/jobs/view/3728394325
energy jobline|senior structural engineer (design)|warrington, england, united kingdom|https://www.linkedin.com/jobs/view/3891985193
frazer-nash consultancy|phd graduate - fluids and thermal engineering|plymouth, england, united kingdom|https://www.linkedin.com/jobs/view/3805600985
dats recruitment|senior structural engineer (design)|daresbury, england, united kingdom|https://www.linkedin.com/jobs/view/3817088478
canonical|engineering manager|london, england, united kingdom|https://www.linkedin.com/jobs/view/3742892703
mygwork - lgbtq+ business community|senior/principal geotechnical engineer|cardiff, wales, united kingdom|https://www.linkedin.com/jobs/view/3893583890
canonical|engineering manager|glasgow, scotland, united kingdom|https://www.linkedin.com/jobs/view/3860984731
canonical|engineering manager|sudbury, england, united kingdom|https://www.linkedin.com/jobs/view/3860989147
canonical|engineering manager|edinburgh, scotland, united kingdom|https://www.linkedin.com/jobs/view/3860989134
deploy recruitment group|senior hv design engineer|bristol, england, united kingdom|https://www.linkedin.com/jobs/view/3903166279
deploy recruitment group|senior hv design engineer|manchester, england, united kingdom|https://www.linkedin.com/jobs/view/3903166056
right now group|it support analyst|long ditton, england, united kingdom|https://www.linkedin.com/jobs/view/3824651154
frazer-nash consultancy|phd graduate - nuclear analyst (bristol)|bristol, england, united kingdom|https://www.linkedin.com/jobs/view/3884268764
deploy recruitment group|senior hv design engineer|glasgow, scotland, united kingdom|https://www.linkedin.com/jobs/view/3908783633
bennett & game recruitment limited|senior civil engineer|henley-on-thames, england, united kingdom|https://www.linkedin.com/jobs/view/3884251107
hdr|senior electrical engineer - power delivery and substations|glasgow, scotland, united kingdom|https://www.linkedin.com/jobs/view/3818896614
frazer-nash consultancy|nuclear analyst (bristol)|bristol, england, united kingdom|https://www.linkedin.com/jobs/view/3884271347
wae|senior engineer - test and validation|kidlington, england, united kingdom|https://www.linkedin.com/jobs/view/3886122063
mygwork - lgbtq+ business community|senior process engineers - energy/water|leeds, england, united kingdom|https://www.linkedin.com/jobs/view/3897763003
frazer-nash consultancy|phd graduate - nuclear analyst (gloucester)|gloucester, england, united kingdom|https://www.linkedin.com/jobs/view/3884274002
hilson moran|senior / principal public health engineer|orpington, england, united kingdom|https://www.linkedin.com/jobs/view/3904525977
hdr|senior electrical engineer - power delivery and substations|london, england, united kingdom|https://www.linkedin.com/jobs/view/3909841375
hdr|senior electrical engineer - power delivery and substations|croydon, england, united kingdom|https://www.linkedin.com/jobs/view/3909839962
clickjobs.io|senior propulsion test engineer|hartwell, england, united kingdom|https://www.linkedin.com/jobs/view/3909012974
ernest gordon recruitment|trainee engineer (bms)|glasgow, scotland, united kingdom|https://www.linkedin.com/jobs/view/3900976756
element materials technology|trainee emc test engineer|great malvern, england, united kingdom|https://www.linkedin.com/jobs/view/3866986883
karimix uk ltd|trainee air conditioning engineer|northampton, england, united kingdom|https://www.linkedin.com/jobs/view/3894272857
utac|trainee - passive safety test engineer|millbrook, england, united kingdom|https://www.linkedin.com/jobs/view/3870952494
energy jobline|trainee audio video installation engineer|harlow, england, united kingdom|https://www.linkedin.com/jobs/view/3909742116
doctor|engineering operations technician intern|london, england, united kingdom|https://www.linkedin.com/jobs/view/3843693118
doctor|2024 software dev engineer graduate|amsterdam, north holland, netherlands|https://www.linkedin.com/jobs/view/3851771635
canonical|software engineer (linux/python or go) - container images|amsterdam, north holland, netherlands|https://www.linkedin.com/jobs/view/3895322250
msg|trainee software engineer java public sector (m/w/d)|berlin, berlin, germany|https://www.linkedin.com/jobs/view/3711985101
ml6  your partner in ai|data engineer|berlin, berlin, germany|https://www.linkedin.com/jobs/view/3820546203
canonical|graduate linux system engineer - qa, tooling, automation|bucharest, bucharest, romania|https://www.linkedin.com/jobs/view/3689050646
allcloud|aws data engineer|bucharest, bucharest, romania|https://www.linkedin.com/jobs/view/3884759171
mygwork - lgbtq+ business community|offensive security engineer, 3|bucharest, bucharest, romania|https://www.linkedin.com/jobs/view/3852314081
mygwork - lgbtq+ business community|career events â apply for early career roles|cracow, małopolskie, poland|https://www.linkedin.com/jobs/view/3848227840
leonardo|summer placement software engineer|edinburgh, scotland, united kingdom|https://www.linkedin.com/jobs/view/3778188995
canonical|software engineer (linux/python or go) - container images|edinburgh, scotland, united kingdom|https://www.linkedin.com/jobs/view/3895321290
