company|title|location|link
leonardo|software engineering graduate apprenticeship|edinburgh, scotland, united kingdom|https://www.linkedin.com/jobs/view/3778195025
quantum motion|quantum engineer (entry-level rotation programme)|london, england, united kingdom|https://www.linkedin.com/jobs/view/3904653209
ecocareers|graduate/junior grid - power - electrical engineer – renewable energy (bess and solar)|swindon, england, united kingdom|https://www.linkedin.com/jobs/view/3911267414
quick release_|graduate analyst intake 2024|birmingham, england, united kingdom|https://www.linkedin.com/jobs/view/3905237828
ecocareers|graduate town planner|england, united kingdom|https://www.linkedin.com/jobs/view/3880269251
integrum power engineering|junior design engineer|stockport, england, united kingdom|https://www.linkedin.com/jobs/view/3911306732
noir|graduate recruitment consultant|london, england, united kingdom|https://www.linkedin.com/jobs/view/3907144836
the information lab|the information lab - graduate data consulting analyst|london, england, united kingdom|https://www.linkedin.com/jobs/view/3842070081
energy jobline|graduate systems engineer|derby, england, united kingdom|https://www.linkedin.com/jobs/view/3892684749
ecocareers|software developer/ data scientist - phd graduate|abingdon-on-thames, england, united kingdom|https://www.linkedin.com/jobs/view/3885224134
andretti global|graduate aerodynamics engineer|silverstone, england, united kingdom|https://www.linkedin.com/jobs/view/3909679065
bennett & game recruitment limited|graduate accountant|west wickham, england, united kingdom|https://www.linkedin.com/jobs/view/3890062375
wr engineering recruiters|graduate civil engineer|manchester, england, united kingdom|https://www.linkedin.com/jobs/view/3893039616
client server|graduate penetration tester red team|london, england, united kingdom|https://www.linkedin.com/jobs/view/3905560425
energy jobline|graduate application support analyst - trading systems|london, england, united kingdom|https://www.linkedin.com/jobs/view/3902021699
systems engineering & assessment ltd|graduate programme - systems engineering|beckington, england, united kingdom|https://www.linkedin.com/jobs/view/3909881752
energy jobline|graduate engineer|newry, northern ireland, united kingdom|https://www.linkedin.com/jobs/view/3901790284
siemens digital industries software|application engineer - associate graduate program (w/m/d)|solihull, england, united kingdom|https://www.linkedin.com/jobs/view/3879115849
hartpury university and hartpury college|.net software / web developer|gloucestershire, england, united kingdom|https://www.linkedin.com/jobs/view/3901389228
kohler co.|graduate electronics innovation engineer|cheltenham, england, united kingdom|https://www.linkedin.com/jobs/view/3909181034
net zero search|graduate/junior grid - power - electrical engineer – renewable energy (bess and solar)|swindon, england, united kingdom|https://www.linkedin.com/jobs/view/3907703879
burman recruitment|software engineer|london, england, united kingdom|https://www.linkedin.com/jobs/view/3883683417
siemens|graduate communications engineer|hebburn, england, united kingdom|https://www.linkedin.com/jobs/view/3901325402
developrec|graduate - recruitment consultant|city of portsmouth, england, united kingdom|https://www.linkedin.com/jobs/view/3855565987
certinia|associate software engineer|harrogate, england, united kingdom|https://www.linkedin.com/jobs/view/3903459221
energy jobline|graduate mechatronics engineer|dorking, england, united kingdom|https://www.linkedin.com/jobs/view/3891962942
jobs via efinancialcareers|graduate (2024) software engineer - £65,000 p/a + bonus + benefits|london, england, united kingdom|https://www.linkedin.com/jobs/view/3909694466
bowerford associates limited|graduate structural engineer|exeter, england, united kingdom|https://www.linkedin.com/jobs/view/3890646614
energy jobline|automation and controls graduate engineer|loughborough, england, united kingdom|https://www.linkedin.com/jobs/view/3892673381
jcw|compliance graduate|london area, united kingdom|https://www.linkedin.com/jobs/view/3864282856
mygwork - lgbtq+ business community|graduate product services operations analyst|london, england, united kingdom|https://www.linkedin.com/jobs/view/3898785592
dug|graduate geophysicist|london, england, united kingdom|https://www.linkedin.com/jobs/view/3862946428
ultra intelligence & communications|graduate hardware engineer|maidenhead, england, united kingdom|https://www.linkedin.com/jobs/view/3837664710
wr engineering recruiters|graduate civil engineer|city of london, england, united kingdom|https://www.linkedin.com/jobs/view/3890612975
tiptopjob|graduate mechanical design engineer|west sussex, england, united kingdom|https://www.linkedin.com/jobs/view/3889103282
utac|graduate facilities engineer uk|england, united kingdom|https://www.linkedin.com/jobs/view/3906656449
murphy|graduate engineer|newry, northern ireland, united kingdom|https://www.linkedin.com/jobs/view/3888057831
hydrock|experienced graduate structural engineer - london (immediate start)|london, england, united kingdom|https://www.linkedin.com/jobs/view/3774815948
nicholas associates group|graduate account manager|bracknell, england, united kingdom|https://www.linkedin.com/jobs/view/3886414699
ernest gordon recruitment|graduate product designer (play equipment)|wrexham, wales, united kingdom|https://www.linkedin.com/jobs/view/3908789330
lumanity|graduate health economist|london, england, united kingdom|https://www.linkedin.com/jobs/view/3860563290
city science|graduate net zero & sustainability planning|united kingdom|https://www.linkedin.com/jobs/view/3892466819
queueco|quantitative developer|london, england, united kingdom|https://www.linkedin.com/jobs/view/3590340856
ecocareers|graduate town planner|london, england, united kingdom|https://www.linkedin.com/jobs/view/3900850221
b. braun group|entry level healthcare it engineer|newcastle upon tyne, england, united kingdom|https://www.linkedin.com/jobs/view/3899092464
energy jobline|software developer/ data scientist - phd graduate|abingdon-on-thames, england, united kingdom|https://www.linkedin.com/jobs/view/3892806112
viper innovations ltd|graduate product engineer|portishead, england, united kingdom|https://www.linkedin.com/jobs/view/3908491949
lucy electric|engineering graduate|thame, england, united kingdom|https://www.linkedin.com/jobs/view/3782357085
set2recruit|graduate recruiter|greater exeter area, worldwide|https://www.linkedin.com/jobs/view/3904079166
equals one ltd|electrical engineering graduate|wolverhampton, england, united kingdom|https://www.linkedin.com/jobs/view/3904564501
bennett & game recruitment limited|graduate civil engineer|keighley, england, united kingdom|https://www.linkedin.com/jobs/view/3881249182
tiptopjob|graduate electrical engineers|derby, england, united kingdom|https://www.linkedin.com/jobs/view/3890124781
wmjobs|graduate it support consultant|solihull, england, united kingdom|https://www.linkedin.com/jobs/view/3893595827
thales|systems engineer|glasgow, scotland, united kingdom|https://www.linkedin.com/jobs/view/3838285103
energy jobline|junior design engineer|stockport, england, united kingdom|https://www.linkedin.com/jobs/view/3909105827
macstaff|graduate electrical design engineer|dorking, england, united kingdom|https://www.linkedin.com/jobs/view/3848374186
thales|systems engineer|glasgow, scotland, united kingdom|https://www.linkedin.com/jobs/view/3838292336
fintech-rec.co.uk|graduate fx broker|city of london, england, united kingdom|https://www.linkedin.com/jobs/view/3907848474
equals one ltd|electrical engineering graduate|four ashes, england, united kingdom|https://www.linkedin.com/jobs/view/3906084431
suez|graduate tax assistant|weston-super-mare, england, united kingdom|https://www.linkedin.com/jobs/view/3902466467
hackajob|software engineer|loudwater, england, united kingdom|https://www.linkedin.com/jobs/view/3881573480
capella professional|graduate electrical design engineer|nottinghamshire, england, united kingdom|https://www.linkedin.com/jobs/view/3885663072
enterprise recruitment ltd|graduate electronics engineer|cambridge, england, united kingdom|https://www.linkedin.com/jobs/view/3868447043
cromwell|data scientist (6289)|leicester, england, united kingdom|https://www.linkedin.com/jobs/view/3755078389
energy jobline|graduate civil engineer|england, united kingdom|https://www.linkedin.com/jobs/view/3902034077
optimal staffing|trainee forex trader|united kingdom|https://www.linkedin.com/jobs/view/3886959153
am recruitment ltd|graduate electrical engineer|billingham, england, united kingdom|https://www.linkedin.com/jobs/view/3879368235
mygwork - lgbtq+ business community|financial services graduate programme|london, england, united kingdom|https://www.linkedin.com/jobs/view/3893509872
motorola solutions|graduate system integration & test engineer|rugby, england, united kingdom|https://www.linkedin.com/jobs/view/3854823336
energy jobline|graduate structural engineer (design / calculations)|burton upon trent, england, united kingdom|https://www.linkedin.com/jobs/view/3896517032
oil and gas job search ltd|graduate flow assurance engineer, aberdeen|aberdeen, scotland, united kingdom|https://www.linkedin.com/jobs/view/3853254046
the opportunity hub uk|graduate admin assistant|london, england, united kingdom|https://www.linkedin.com/jobs/view/3906317834
noriker power ltd|noriker power renewable energy graduate scheme|cheltenham, england, united kingdom|https://www.linkedin.com/jobs/view/3905558721
energy jobline|electrical engineering graduate|wolverhampton, england, united kingdom|https://www.linkedin.com/jobs/view/3905078693
crossover|graduate engineer, trilogy (remote) - $60,000/year usd|london, england, united kingdom|https://www.linkedin.com/jobs/view/3908039080
mygwork - lgbtq+ business community|graduate engineer i pall|portsmouth, england, united kingdom|https://www.linkedin.com/jobs/view/3852308865
ernest gordon recruitment|graduate product designer play equipment|wrexham, wales, united kingdom|https://www.linkedin.com/jobs/view/3905150578
energy jobline|graduate structural engineer (design / calculations)|burton upon trent, england, united kingdom|https://www.linkedin.com/jobs/view/3896517032
energy jobline|graduate electronics engineer|cambridge, england, united kingdom|https://www.linkedin.com/jobs/view/3909743390
graduate career solutions|junior mechanical design engineer|leicester, england, united kingdom|https://www.linkedin.com/jobs/view/3905877031
energy jobline|junior application support analyst - trading systems|london, england, united kingdom|https://www.linkedin.com/jobs/view/3902027191
tiptopjob|graduate acoustics engineer|west midlands, england, united kingdom|https://www.linkedin.com/jobs/view/3907799291
energy jobline|graduate cae integration engineer|basildon, england, united kingdom|https://www.linkedin.com/jobs/view/3902041196
enable|graduate business development representative|belfast, northern ireland, united kingdom|https://www.linkedin.com/jobs/view/3711761277
slb|graduate geosolutions geophysicist|london area, united kingdom|https://www.linkedin.com/jobs/view/3899513037
eldredge furniture|entry level sales development represenative - graduate|bristol, england, united kingdom|https://www.linkedin.com/jobs/view/3907666126
tag|junior it support engineer|london area, united kingdom|https://www.linkedin.com/jobs/view/3885055035
rocket lawyer uk|software engineering intern - mobile (summer 2024)|london, england, united kingdom|https://www.linkedin.com/jobs/view/3816067768
s&p global|graduate product services operations analyst|london, england, united kingdom|https://www.linkedin.com/jobs/view/3909619123
energy jobline|r&d robotics systems engineer|london, england, united kingdom|https://www.linkedin.com/jobs/view/3902006623
siemens eda (siemens digital industries software)|application engineer - associate graduate program (pcb design and analysis) m/f/d|newbury, england, united kingdom|https://www.linkedin.com/jobs/view/3831120980
premier technical recruitment ltd|graduate electrical engineers|derby, england, united kingdom|https://www.linkedin.com/jobs/view/3898734602
mygwork - lgbtq+ business community|electrical engineering graduate|wolverhampton, england, united kingdom|https://www.linkedin.com/jobs/view/3852336590
noriker power ltd|noriker power graduate scheme|cheltenham, england, united kingdom|https://www.linkedin.com/jobs/view/3905564039
mygwork - lgbtq+ business community|moody's rms graduate program 2024 - customer success|london, england, united kingdom|https://www.linkedin.com/jobs/view/3870767803
capio spine center stockholm|materials science / engineering graduate (sales)|east sussex, england, united kingdom|https://www.linkedin.com/jobs/view/3872340203
noir|graduate recruitment consultant|greater london, england, united kingdom|https://www.linkedin.com/jobs/view/3905204523
concurrent technologies plc|embedded software engineer|theale, england, united kingdom|https://www.linkedin.com/jobs/view/3873376941
siemens digital industries software|application engineer - associate graduate program (pcb design and analysis) m/f/d|newbury, england, united kingdom|https://www.linkedin.com/jobs/view/3833744018
leonardo|graduate hardware engineer|southampton, england, united kingdom|https://www.linkedin.com/jobs/view/3778193227
energy jobline|graduate electrical design engineer|dorking, england, united kingdom|https://www.linkedin.com/jobs/view/3896511386
energy jobline|graduate scheme sales engineer|stockport, england, united kingdom|https://www.linkedin.com/jobs/view/3901781650
londinium recruitment|graduate quantity surveyor|london, england, united kingdom|https://www.linkedin.com/jobs/view/3894930228
eldredge furniture|sales development representative - graduate|leeds, england, united kingdom|https://www.linkedin.com/jobs/view/3909333059
eldredge furniture|sales development representative - graduate|leeds, england, united kingdom|https://www.linkedin.com/jobs/view/3884689631
tarmac|civil engineer graduate|porthmadog, wales, united kingdom|https://www.linkedin.com/jobs/view/3873378573
randstad uk|graduate laboratory analyst|gibraltar, worldwide|https://www.linkedin.com/jobs/view/3896314148
hydrock|graduate public health engineer - london (sep 2024 start)|london, england, united kingdom|https://www.linkedin.com/jobs/view/3863033535
haines watts|accounts graduate|leeds, england, united kingdom|https://www.linkedin.com/jobs/view/3895913431
systra|graduate engineer - electrical design|york, england, united kingdom|https://www.linkedin.com/jobs/view/3893186916
leonardo|graduate test systems engineer|edinburgh, scotland, united kingdom|https://www.linkedin.com/jobs/view/3887295235
vicon|computer vision scientist|yarnton, england, united kingdom|https://www.linkedin.com/jobs/view/3851101389
thales|digital twin systems engineer|crawley, england, united kingdom|https://www.linkedin.com/jobs/view/3884034405
hydrock|graduate mechanical engineer - bristol (sep 2024 start)|bristol, england, united kingdom|https://www.linkedin.com/jobs/view/3897782720
robustelli ∙ soucy ∙ hussey, p.a.|r&d software engineer - nlp|southampton, england, united kingdom|https://www.linkedin.com/jobs/view/3894274765
energy jobline|graduate qs / junior project engineer|cowdenbeath, scotland, united kingdom|https://www.linkedin.com/jobs/view/3902030043
science group|electronics 10 week summer|cambridge, england, united kingdom|https://www.linkedin.com/jobs/view/3903699637
eldredge furniture|graduate sales development representative|manchester, england, united kingdom|https://www.linkedin.com/jobs/view/3908649886
canonical|graduate linux system engineer - qa, tooling, automation|sudbury, england, united kingdom|https://www.linkedin.com/jobs/view/3689050635
hydrock|experienced graduate structural engineer - edinburgh (september start)|edinburgh, scotland, united kingdom|https://www.linkedin.com/jobs/view/3868496460
leonardo|graduate electronics engineer|edinburgh, scotland, united kingdom|https://www.linkedin.com/jobs/view/3778192330
atmos international|project engineer|manchester, england, united kingdom|https://www.linkedin.com/jobs/view/3896629530
first central|graduate home technical pricing analyst|haywards heath, england, united kingdom|https://www.linkedin.com/jobs/view/3888829150
setsales|graduate head hunter at setsales|london, england, united kingdom|https://www.linkedin.com/jobs/view/3901508483
oxford metrics|computer vision scientist|yarnton, england, united kingdom|https://www.linkedin.com/jobs/view/3884067513
londinium recruitment|graduate quantity surveyor|dartford, england, united kingdom|https://www.linkedin.com/jobs/view/3890299921
sgs|commercial law graduate opportunity|ellesmere port, england, united kingdom|https://www.linkedin.com/jobs/view/3866250447
the config team ltd|associate consultant (sap software & applications development)|greater lincoln area, united kingdom|https://www.linkedin.com/jobs/view/3875067416
leonardo|graduate microwave engineer|luton, england, united kingdom|https://www.linkedin.com/jobs/view/3778190761
staffordshire university|ktp associate|stoke, england, united kingdom|https://www.linkedin.com/jobs/view/3903986353
haysmacintyre|register your interest: audit graduate scheme (not for profit) (january 2025)|london area, united kingdom|https://www.linkedin.com/jobs/view/3909118933
original talent recruitment|graduate powertrain test engineer|milton keynes, england, united kingdom|https://www.linkedin.com/jobs/view/3901412016
penguin recruitment|graduate mechanical engineer|denton, england, united kingdom|https://www.linkedin.com/jobs/view/3877264135
gcs|graduate recruitment consultant|london, england, united kingdom|https://www.linkedin.com/jobs/view/3862029220
londinium recruitment|graduate quantity surveyor|kent, england, united kingdom|https://www.linkedin.com/jobs/view/3886414113
clickjobs.io|graduate business analyst|england, united kingdom|https://www.linkedin.com/jobs/view/3909373871
michael page|logistics & planning graduate|nottingham, england, united kingdom|https://www.linkedin.com/jobs/view/3872741836
energy jobline|design engineer|england, united kingdom|https://www.linkedin.com/jobs/view/3902038467
emtech recruitment|graduate transport planner|jacobs well, england, united kingdom|https://www.linkedin.com/jobs/view/3883584136
fusepump|graduate recruitment consultant|exeter, england, united kingdom|https://www.linkedin.com/jobs/view/3907661556
globallogic|trainee aqa engineer (js) irc217928|lviv, lviv, ukraine|https://www.linkedin.com/jobs/view/3908460250
kamstrup|platform engineer|skanderborg, central denmark region, denmark|https://www.linkedin.com/jobs/view/3862852222
kamstrup|platform engineer|skanderborg, central denmark region, denmark|https://www.linkedin.com/jobs/view/3864168314
the hub|head of sales enablement|aarhus, central denmark region, denmark|https://www.linkedin.com/jobs/view/3910564123
mygwork - lgbtq+ business community|2024 software dev engineer graduate|amsterdam, north holland, netherlands|https://www.linkedin.com/jobs/view/3857675446
imc trading|machine learning engineer – internship (for m.sc. candidates)|amsterdam, north holland, netherlands|https://www.linkedin.com/jobs/view/3848060382
blocktech|graduate quantitative trader|amsterdam, north holland, netherlands|https://www.linkedin.com/jobs/view/3907007462
bridgestone mobility solutions|applied scientist / gen ai intern (phd or masters)|amsterdam, north holland, netherlands|https://www.linkedin.com/jobs/view/3907753418
optiver|graduate quantitative researcher (2024 start)|amsterdam, north holland, netherlands|https://www.linkedin.com/jobs/view/3702649586
canonical|graduate esg compliance counsel or esg compliance officer - tech sector|amsterdam, north holland, netherlands|https://www.linkedin.com/jobs/view/3876274418
exotec|project system engineer|amsterdam, north holland, netherlands|https://www.linkedin.com/jobs/view/3866613506
inbody europe|graphic design intern|amsterdam, north holland, netherlands|https://www.linkedin.com/jobs/view/3896462164
informa markets|content intern - pharma|amsterdam, north holland, netherlands|https://www.linkedin.com/jobs/view/3908229129
university of amsterdam|-intern- ondersteuner ict in het onderwijs|amsterdam, north holland, netherlands|https://www.linkedin.com/jobs/view/3907358838
arnold & siedsma|trainee octrooigemachtigde werktuigbouwkunde|amsterdam, north holland, netherlands|https://www.linkedin.com/jobs/view/3892438162
page personnel|(trainee) formalities officer|amsterdam, north holland, netherlands|https://www.linkedin.com/jobs/view/3905396136
equinix|2024 opportunity development summer intern with french|amsterdam, north holland, netherlands|https://www.linkedin.com/jobs/view/3882008676
hotelprofessionals|hotel management trainee (f/m/d)|amsterdam, north holland, netherlands|https://www.linkedin.com/jobs/view/3860142899
hotelprofessionals|hotel management trainee (f/m/d)|amsterdam, north holland, netherlands|https://www.linkedin.com/jobs/view/3860146357
equinix|2024 opportunity development summer intern with dutch|amsterdam, north holland, netherlands|https://www.linkedin.com/jobs/view/3830620061
peoplecert|english speaking examiners (full-time)|athens, attiki, greece|https://www.linkedin.com/jobs/view/3681793174
peoplecert|english speaking examiners (part-time)|athens, attiki, greece|https://www.linkedin.com/jobs/view/3811787347
brs shipbrokers|junior data analyst|athens metropolitan area, worldwide|https://www.linkedin.com/jobs/view/3907327567
canonical|graduate esg compliance counsel or esg compliance officer - tech sector|athens, attiki, greece|https://www.linkedin.com/jobs/view/3876272887
canonical|graduate esg compliance counsel or esg compliance officer - tech sector|marousi, attiki, greece|https://www.linkedin.com/jobs/view/3876272881
adacom|systems engineer ( on premises greece )|athens, attiki, greece|https://www.linkedin.com/jobs/view/3891675371
deloitte|cms developer (deloitte digital) - athens or patras|athens, attiki, greece|https://www.linkedin.com/jobs/view/3902563101
salfo & associates sa.|πολιτικοί μηχανικοί επίβλεψης κατασκευής οικοδομικών (διάφορες περιοχές της ελλάδας)|athens, attiki, greece|https://www.linkedin.com/jobs/view/3838668706
iknowhealth s.a.|healthcare technical project manager|marousi, attiki, greece|https://www.linkedin.com/jobs/view/3887698068
star bulk|automation / electrical engineer (vpm)|marousi, attiki, greece|https://www.linkedin.com/jobs/view/3909574206
peoplecert|english speaking examiner|athens, attiki, greece|https://www.linkedin.com/jobs/view/3838396194
sap|business processes associate consultant|athens, attiki, greece|https://www.linkedin.com/jobs/view/3879363944
blueground|financial reporting associate manager|athens, attiki, greece|https://www.linkedin.com/jobs/view/3696088221
canonical|engineering manager|marousi, attiki, greece|https://www.linkedin.com/jobs/view/3860989177
randstad hellas|accountant|athens, attiki, greece|https://www.linkedin.com/jobs/view/3906613871
canonical|engineering manager|athens, attiki, greece|https://www.linkedin.com/jobs/view/3860983829
qualco|customer service desk analyst|athens, attiki, greece|https://www.linkedin.com/jobs/view/3879347459
deutsche telekom cloud services|mobile access architect|athens, attiki, greece|https://www.linkedin.com/jobs/view/3870415200
grant thornton greece|energy junior consultant|athens, attiki, greece|https://www.linkedin.com/jobs/view/3835155142
james woodman|senior accountant|athens, attiki, greece|https://www.linkedin.com/jobs/view/3830011201
costa navarino|golf operations manager - costa navarino (2024)|greece|https://www.linkedin.com/jobs/view/3822721737
oracle|software engineer_a&g search - fresh graduate|barcelona, catalonia, spain|https://www.linkedin.com/jobs/view/3872651131
mygwork - lgbtq+ business community|product data analyst - fresh graduate|barcelona, catalonia, spain|https://www.linkedin.com/jobs/view/3848261393
mygwork - lgbtq+ business community|software engineer_a&g search- fresh graduate|barcelona, catalonia, spain|https://www.linkedin.com/jobs/view/3848255665
kara|software engineer|barcelona, catalonia, spain|https://www.linkedin.com/jobs/view/3879055650
smartcic global services|junior software developer|cornellà de llobregat, catalonia, spain|https://www.linkedin.com/jobs/view/3905842812
sita|graduate|barcelona, catalonia, spain|https://www.linkedin.com/jobs/view/3904630475
babel profiles|graduate it technical consultant with french|sant cugat del vallès, catalonia, spain|https://www.linkedin.com/jobs/view/3904071612
kosmos|marketing assistant|barcelona, catalonia, spain|https://www.linkedin.com/jobs/view/3910349134
canonical|graduate linux system engineer - qa, tooling, automation|barcelona, catalonia, spain|https://www.linkedin.com/jobs/view/3689050648
babel profiles|graduate it technical consultant with italian|barcelona, catalonia, spain|https://www.linkedin.com/jobs/view/3903420940
wiris|technical support graduate|barcelona, catalonia, spain|https://www.linkedin.com/jobs/view/3907329972
hewlett packard enterprise|digital sales representative for switzerland - graduate|barcelona, catalonia, spain|https://www.linkedin.com/jobs/view/3779375433
canonical|software engineer (linux/python or go) - container images|barcelona, catalonia, spain|https://www.linkedin.com/jobs/view/3895322246
mbr partners|emea solutions engineering leader (oss)|barcelona, catalonia, spain|https://www.linkedin.com/jobs/view/3873357908
emerald stay® (a certified b corp)|accountant|barcelona, catalonia, spain|https://www.linkedin.com/jobs/view/3898428385
sap|cx sales development associate- nordic market|barcelona, catalonia, spain|https://www.linkedin.com/jobs/view/3856630351
