company|title|location|link
canonical|engineering manager|toulouse, occitanie, france|https://www.linkedin.com/jobs/view/3860982920
canonical|engineering manager|nice, provence-alpes-côte d'azur, france|https://www.linkedin.com/jobs/view/3860982927
mount sinai morningside|technology specialist i – solutions architect and qa lead - digital and technology partners - remote|us, île-de-france, france|https://www.linkedin.com/jobs/view/3857142979
verkor|erp data integration leader (m/f)|grenoble, auvergne-rhône-alpes, france|https://www.linkedin.com/jobs/view/3809674527
canonical|engineering manager|marseille, provence-alpes-côte d'azur, france|https://www.linkedin.com/jobs/view/3860982968
mount sinai morningside|epic revenue cycle application analyst ii- hospital billing - digital and technology partners - hybrid|us, île-de-france, france|https://www.linkedin.com/jobs/view/3849286328
mount sinai morningside|it director/solutions architect - digital and technology partners - remote|us, île-de-france, france|https://www.linkedin.com/jobs/view/3855309221
technopolis group|senior economist – quantitative economic analysis|greater paris metropolitan region, worldwide|https://www.linkedin.com/jobs/view/3890972176
appel médical|pharmacien diplômé h/f (f/h)|laval, pays de la loire, france|https://www.linkedin.com/jobs/view/3837478364
mount sinai morningside|epic grand central applications analyst iii-digital and technology partners - hybrid|us, île-de-france, france|https://www.linkedin.com/jobs/view/3843360144
ipsen|clinical monitoring lead|les ulis, île-de-france, france|https://www.linkedin.com/jobs/view/3897001914
bnp paribas|stage –– chargé.e de projets évènementiels 5 mois – h/f|pantin, île-de-france, france|https://www.linkedin.com/jobs/view/3881982579
département de seine et marne|chargé de l'offre transports scolaire des élèves et étudiants en situation d'handicap 3 mois f/h|melun, île-de-france, france|https://www.linkedin.com/jobs/view/3753489429
oil and gas job search ltd|senior engineer - electrical network calculations m/f|la celle-sous-gouzon, nouvelle-aquitaine, france|https://www.linkedin.com/jobs/view/3853249671
mygwork - lgbtq+ business community|pmo support (hybrid)|bagneux, île-de-france, france|https://www.linkedin.com/jobs/view/3859502046
appel médical|pharmacien diplômé h/f (f/h) de mars à fin juillet|brest, brittany, france|https://www.linkedin.com/jobs/view/3826619292
cority|senior sustainability consultant|paris, île-de-france, france|https://www.linkedin.com/jobs/view/3885144724
mount sinai morningside|epic/emr it manager-digital and technology partners- hybrid|us, île-de-france, france|https://www.linkedin.com/jobs/view/3865690318
ul solutions|senior software sales executive, esg|saclay, île-de-france, france|https://www.linkedin.com/jobs/view/3822144271
mount sinai morningside|firewall it manager - digital and technology partners - remote|us, île-de-france, france|https://www.linkedin.com/jobs/view/3888717954
technip energies|senior engineer - electrical network calculations m/f|nanterre, île-de-france, france|https://www.linkedin.com/jobs/view/3614521031
akila|head of finance operations, performance & strategy|paris, île-de-france, france|https://www.linkedin.com/jobs/view/3905989038
greensolver|senior advisory due diligence consultant and wind specialist u.k  m/f|paris, île-de-france, france|https://www.linkedin.com/jobs/view/3897502033
mount sinai morningside|physician associate - general surgery - msh - full time|us, île-de-france, france|https://www.linkedin.com/jobs/view/3843338172
quadient|pmo support (hybrid)|bagneux, île-de-france, france|https://www.linkedin.com/jobs/view/3860991984
ul solutions|senior sales executive, software supply chain|saint-aubin-de-cadelech, nouvelle-aquitaine, france|https://www.linkedin.com/jobs/view/3831855613
cority|implementation consultant- safety & occupational health|france|https://www.linkedin.com/jobs/view/3855429325
moody's corporation|assc dir-product consultant|puteaux, île-de-france, france|https://www.linkedin.com/jobs/view/3847755101
mount sinai morningside|rn nursing administrator-msh-evenings- 3pm-12 am- eow|us, île-de-france, france|https://www.linkedin.com/jobs/view/3843345992
mount sinai morningside|senior technical project manager-scientific computing & data-msh|us, île-de-france, france|https://www.linkedin.com/jobs/view/3843325577
studi|conseiller en formation (f/h) - alternance|soissons, hauts-de-france, france|https://www.linkedin.com/jobs/view/3904509916
technip energies|general piping installation lead (f/m)|vaulx-en-velin, auvergne-rhône-alpes, france|https://www.linkedin.com/jobs/view/3862354843
veritone|major account executive|paris, île-de-france, france|https://www.linkedin.com/jobs/view/3903970441
station f|machine learning research intern|paris, île-de-france, france|https://www.linkedin.com/jobs/view/3768529987
symetrie|étudiant doctorant/etudiante doctorante|nîmes, occitanie, france|https://www.linkedin.com/jobs/view/3841864941
texas instruments|field applications engineering intern - alternative to fpga for high-speed data acquisition - paris, france|issy-les-moulineaux, île-de-france, france|https://www.linkedin.com/jobs/view/3839391318
arm|cpu performance analysis and modelling intern|sophia antipolis, provence-alpes-côte d'azur, france|https://www.linkedin.com/jobs/view/3737379379
omnes education|chargé(e) de scolarité et parcours étudiant cdi|greater paris metropolitan region, worldwide|https://www.linkedin.com/jobs/view/3902058217
kicklox - plateforme de matching entre talents tech & porteurs de projets|graduate programme - architecte logiciel embarqué - h/f chez thales six gts france s.a.s.|cholet, pays de la loire, france|https://www.linkedin.com/jobs/view/3813823928
valeo|r&d trainee/apprentice/vie|créteil, île-de-france, france|https://www.linkedin.com/jobs/view/3879385139
valeo|r&d trainee/apprentice/vie|créteil, île-de-france, france|https://www.linkedin.com/jobs/view/3879330561
nokia|mobile network systems fr intern|massy, île-de-france, france|https://www.linkedin.com/jobs/view/3787868992
caresyntax|surgical team intern (m/d/f) -paris, france|france|https://www.linkedin.com/jobs/view/3906656715
cobblestone energy|graduate software engineer - dubai, uae|georgia, tbilisi, worldwide|https://www.linkedin.com/jobs/view/3641765394
epam systems|software functional testing trainee|georgia, worldwide|https://www.linkedin.com/jobs/view/3904533784
datasync technologies, inc.|computer network defense analyst (cnda)|georgia, worldwide|https://www.linkedin.com/jobs/view/3809510460
mphasis|delivery module lead|georgia, worldwide|https://www.linkedin.com/jobs/view/3903903304
fidelity business partners, inc.|property manager (with leasing and maintenance experience)|georgia, worldwide|https://www.linkedin.com/jobs/view/3770438996
sap fioneer|developer graduates (f/d/m)|germany|https://www.linkedin.com/jobs/view/3893177451
adp|graduate program software engineer|bremen, germany|https://www.linkedin.com/jobs/view/3879324251
sap fioneer|developer graduates (f/d/m) - germany based|germany|https://www.linkedin.com/jobs/view/3893182020
sap fioneer|developer graduates (f/d/m) - germany based|germany|https://www.linkedin.com/jobs/view/3893177454
european recruitment|graduate software engineer|germany|https://www.linkedin.com/jobs/view/3896105559
sap fioneer|it-consultants graduates (f/d/m)|germany|https://www.linkedin.com/jobs/view/3894082807
cobblestone energy|graduate software engineer - dubai, uae|berlin, germany|https://www.linkedin.com/jobs/view/3641766308
european recruitment|graduate software consultant|munich, bavaria, germany|https://www.linkedin.com/jobs/view/3888057438
moyyn|junior product manager (graduate/career switcher) (44_cl_52_1)|berlin, berlin, germany|https://www.linkedin.com/jobs/view/3909843916
cognex corporation|graduate program - associate software engineer|aachen, north rhine-westphalia, germany|https://www.linkedin.com/jobs/view/3751285016
wemolo|iot software engineer (all genders)|munich, bavaria, germany|https://www.linkedin.com/jobs/view/3891621234
sopra steria|(junior) java software entwickler (m/w/d)|germany|https://www.linkedin.com/jobs/view/3596167475
mygwork - lgbtq+ business community|2024 graduate software dev engineer|berlin, berlin, germany|https://www.linkedin.com/jobs/view/3897182775
siemens eda (siemens digital industries software)|application engineer – associate graduate program (w/m/d)|munich, bavaria, germany|https://www.linkedin.com/jobs/view/3873104970
e-frontiers|backend iot engineer (python & c++)|munich, bavaria, germany|https://www.linkedin.com/jobs/view/3906474765
intersystems|working student computer science (m/f/d)|darmstadt, hesse, germany|https://www.linkedin.com/jobs/view/3892536427
radar roster|nlp ai engineer (m/f/d)|frankfurt, hesse, germany|https://www.linkedin.com/jobs/view/3891679266
commerzbank ag|it trainee – software engineer / developer.|frankfurt am main, hesse, germany|https://www.linkedin.com/jobs/view/3783717388
yourcode - award winning it & digital consultancy|absolvent / junior software ingenieur, münchen|munich, bavaria, germany|https://www.linkedin.com/jobs/view/3895553786
cloudflare|research engineer|germany|https://www.linkedin.com/jobs/view/3902360290
ge renewable energy|grid solutions graduate engineer (m/w/d)-2|salzbergen, lower saxony, germany|https://www.linkedin.com/jobs/view/3869773244
starkkraft technologies & starkkraft engineering|trainee - software entwicklung und testautomatisierung|frankfurt am main, hesse, germany|https://www.linkedin.com/jobs/view/3909152911
think-cell software|c++ developer (m/f/d) in berlin and remote 130 000 eur per year|berlin, germany|https://www.linkedin.com/jobs/view/3890772421
ge vernova|grid solutions graduate engineer (m/w/d)-2|berlin, berlin, germany|https://www.linkedin.com/jobs/view/3873490326
think-cell software|c++ developer (m/f/d) in berlin and remote 130 000 eur per year|brandenburg, germany|https://www.linkedin.com/jobs/view/3890772377
binaris informatik gmbh|trainee (m/w/d)|langenfeld, rhineland-palatinate, germany|https://www.linkedin.com/jobs/view/3586239435
think-cell software|c++ developer (m/f/d) in berlin and remote 130 000 eur per year|munich, bavaria, germany|https://www.linkedin.com/jobs/view/3890791419
schneider electric|trainee als software application engineer (w/m/d)  quereinstieg - proleit|herzogenaurach, bavaria, germany|https://www.linkedin.com/jobs/view/3882779640
prisma|general applications: engineering|berlin, germany|https://www.linkedin.com/jobs/view/3689053630
think-cell software|c++ developer (m/f/d) in berlin and remote 130 000 eur per year|potsdam, brandenburg, germany|https://www.linkedin.com/jobs/view/3890769945
canonical|graduate sales development representative|düsseldorf, north rhine-westphalia, germany|https://www.linkedin.com/jobs/view/3903839017
canonical|graduate linux system engineer - qa, tooling, automation|frankfurt am main, hesse, germany|https://www.linkedin.com/jobs/view/3689055078
canonical|graduate linux system engineer - qa, tooling, automation|dresden, saxony, germany|https://www.linkedin.com/jobs/view/3689048916
man energy solutions|graduate corporate strategic procurement (m/f/x)|augsburg, bavaria, germany|https://www.linkedin.com/jobs/view/3888770313
canonical|graduate linux system engineer - qa, tooling, automation|hamburg, hamburg, germany|https://www.linkedin.com/jobs/view/3689052634
1komma5°|sales graduate program (m/w/d) - 1komma5° hamburg|hamburg, hamburg, germany|https://www.linkedin.com/jobs/view/3864487539
1komma5°|sales graduate program (m/w/d) - 1komma5° hamburg|hamburg, hamburg, germany|https://www.linkedin.com/jobs/view/3839789051
check24 vergleichsportal gmbh|trainee (m/w/d) software development insurtech|hamburg, hamburg, germany|https://www.linkedin.com/jobs/view/3856649058
cloudflare|research systems engineer|germany|https://www.linkedin.com/jobs/view/3902356599
canonical|graduate linux system engineer - qa, tooling, automation|munich, bavaria, germany|https://www.linkedin.com/jobs/view/3689049895
pharmiweb.jobs: global life science jobs|technical assistant - working student (m/f/d)|berlin, berlin, germany|https://www.linkedin.com/jobs/view/3908573366
think-cell software|c++ internship (m/f/d) with relocation to berlin|frankfurt, hesse, germany|https://www.linkedin.com/jobs/view/3903590472
think-cell software|c++ internship (m/f/d) with relocation to berlin|bremen, germany|https://www.linkedin.com/jobs/view/3903592900
nxp semiconductors|r-10048539 automotive field application engineer - graduate (f/m/d)|munich, bavaria, germany|https://www.linkedin.com/jobs/view/3817352380
canonical|software engineer (linux/python or go) - container images|berlin, berlin, germany|https://www.linkedin.com/jobs/view/3895324193
canonical|graduate sales development representative|nuremberg, bavaria, germany|https://www.linkedin.com/jobs/view/3903837179
msg|trainee software engineer java public sector (m/w/d)|nuremberg, bavaria, germany|https://www.linkedin.com/jobs/view/3711983415
msg|trainee software engineer java public sector (m/w/d)|munich, bavaria, germany|https://www.linkedin.com/jobs/view/3711980855
think-cell software|c++ internship (m/f/d) with relocation to berlin|heidelberg, baden-württemberg, germany|https://www.linkedin.com/jobs/view/3903583851
think-cell software|c++ internship (m/f/d) with relocation to berlin|aachen, north rhine-westphalia, germany|https://www.linkedin.com/jobs/view/3903580794
think-cell software|c++ internship (m/f/d) with relocation to berlin|erfurt, thuringia, germany|https://www.linkedin.com/jobs/view/3903586716
canonical|software engineer (linux/python or go) - container images|hamburg, hamburg, germany|https://www.linkedin.com/jobs/view/3895318840
sap|(junior) developer sap btp abap enablement team (f/m/d)|walldorf, baden-württemberg, germany|https://www.linkedin.com/jobs/view/3865282004
canonical|software engineer (linux/python or go) - container images|frankfurt am main, hesse, germany|https://www.linkedin.com/jobs/view/3895323232
canonical|software engineer (linux/python or go) - container images|munich, bavaria, germany|https://www.linkedin.com/jobs/view/3895320300
think-cell software|c++ internship (m/f/d) with relocation to berlin|constance, baden-württemberg, germany|https://www.linkedin.com/jobs/view/3903597082
think-cell software|c++ internship (m/f/d) with relocation to berlin|dresden, saxony, germany|https://www.linkedin.com/jobs/view/3903585570
canonical|graduate sales development representative|dresden, saxony, germany|https://www.linkedin.com/jobs/view/3903832872
think-cell software|c++ internship (m/f/d) with relocation to berlin|göttingen, lower saxony, germany|https://www.linkedin.com/jobs/view/3903593443
aldi süd|university graduate - sap architecture (m/f/x)|mülheim an der ruhr, north rhine-westphalia, germany|https://www.linkedin.com/jobs/view/3899269218
european recruitment|software engineer - msc and phd graduates|munich, bavaria, germany|https://www.linkedin.com/jobs/view/3896164208
lexisnexis risk solutions|data scientist weather & energy markets|karlsruhe, baden-württemberg, germany|https://www.linkedin.com/jobs/view/3846077647
sap|(junior) devops engineer as site reliability engineer (sre) (f/m/d) for sap btp abap environment|walldorf, baden-württemberg, germany|https://www.linkedin.com/jobs/view/3847697249
adesso orange ag|trainee sap software developer (all genders)|berlin, berlin, germany|https://www.linkedin.com/jobs/view/3733043381
statworx|trainee data engineering (w/m/d)|frankfurt am main, hesse, germany|https://www.linkedin.com/jobs/view/3855356543
german aerospace center (dlr)|student assistant (w/m/d) - framework development for non-destructive testing data|hamburg, hamburg, germany|https://www.linkedin.com/jobs/view/3902214702
adesso orange ag|trainee sap software developer (all genders)|hannover, lower saxony, germany|https://www.linkedin.com/jobs/view/3733039774
adesso orange ag|trainee sap software developer (all genders)|hamburg, hamburg, germany|https://www.linkedin.com/jobs/view/3733042307
adesso orange ag|trainee sap software developer (all genders)|leipzig, saxony, germany|https://www.linkedin.com/jobs/view/3733044273
adesso orange ag|trainee sap software developer (all genders)|essen, north rhine-westphalia, germany|https://www.linkedin.com/jobs/view/3733038986
canonical|graduate visual ui designer|nuremberg, bavaria, germany|https://www.linkedin.com/jobs/view/3841756927
adesso orange ag|trainee sap software developer (all genders)|würzburg, bavaria, germany|https://www.linkedin.com/jobs/view/3887125495
adesso orange ag|trainee sap software developer (all genders)|ulm, baden-württemberg, germany|https://www.linkedin.com/jobs/view/3733042423
adesso orange ag|trainee sap software developer (all genders)|bremen, bremen, germany|https://www.linkedin.com/jobs/view/3733040641
adesso orange ag|trainee sap software developer (all genders)|münster, north rhine-westphalia, germany|https://www.linkedin.com/jobs/view/3733040628
adesso orange ag|trainee sap software developer (all genders)|dortmund, north rhine-westphalia, germany|https://www.linkedin.com/jobs/view/3733040661
canonical|graduate visual ui designer|hamburg, hamburg, germany|https://www.linkedin.com/jobs/view/3841757816
adesso orange ag|trainee sap software developer (all genders)|siegen, north rhine-westphalia, germany|https://www.linkedin.com/jobs/view/3733040745
msg|trainee software engineer java public sector (m/w/d)|cologne, north rhine-westphalia, germany|https://www.linkedin.com/jobs/view/3711986061
canonical|graduate visual ui designer|leipzig, saxony, germany|https://www.linkedin.com/jobs/view/3841757822
canonical|graduate visual ui designer|düsseldorf, north rhine-westphalia, germany|https://www.linkedin.com/jobs/view/3841762002
fraunhofer fhr|initiativbewerbung studierende (hilfskraft, hiwi, praktikum, abschlussarbeit)|wachtberg, north rhine-westphalia, germany|https://www.linkedin.com/jobs/view/3827850843
canonical|graduate visual ui designer|dresden, saxony, germany|https://www.linkedin.com/jobs/view/3841758630
ekvip automation gmbh|automation engineer - nexeed automation control plus|leipzig, saxony, germany|https://www.linkedin.com/jobs/view/3832850335
kinexon|(senior) software engineer iot (m/f/d) - c++|munich, bavaria, germany|https://www.linkedin.com/jobs/view/3790112645
msg|trainee software engineer java public sector (m/w/d)|hamburg, hamburg, germany|https://www.linkedin.com/jobs/view/3711979886
sap fioneer|business solution consultants graduates (f/d/m) - germany based|germany|https://www.linkedin.com/jobs/view/3893175825
check24 vergleichsportal gmbh|trainee (m/w/d) software entwicklung insurtech|munich, bavaria, germany|https://www.linkedin.com/jobs/view/3902355051
siemens|trainee@it (w/m/d)|regensburg, bavaria, germany|https://www.linkedin.com/jobs/view/3785057552
cisco|associate consulting engineer - germany - start date september 2024|berlin, berlin, germany|https://www.linkedin.com/jobs/view/3850673305
siemens|trainee@it (w/m/d)|nuremberg, bavaria, germany|https://www.linkedin.com/jobs/view/3901323864
siemens|trainee@it (w/m/d)|erlangen, bavaria, germany|https://www.linkedin.com/jobs/view/3785060126
cisco|associate consulting engineer - germany - start date september 2024|cologne bonn region, worldwide|https://www.linkedin.com/jobs/view/3850674100
siemens|trainee@it (w/m/d)|erlangen, bavaria, germany|https://www.linkedin.com/jobs/view/3785062029
siemens|trainee@it (w/m/d)|regensburg, bavaria, germany|https://www.linkedin.com/jobs/view/3785056580
siemens|trainee@it (w/m/d)|karlsruhe, baden-württemberg, germany|https://www.linkedin.com/jobs/view/3785060119
remondis it|trainee it business analyst (m/w/d)|lünen, north rhine-westphalia, germany|https://www.linkedin.com/jobs/view/3834273315
siemens|trainee@it (w/m/d)|karlsruhe, baden-württemberg, germany|https://www.linkedin.com/jobs/view/3785062031
kinexon|senior software engineer|munich, bavaria, germany|https://www.linkedin.com/jobs/view/3909764336
siemens|trainee@it (w/m/d)|amberg, bavaria, germany|https://www.linkedin.com/jobs/view/3785058362
accenture dach|field application engineer (all genders)|munich, bavaria, germany|https://www.linkedin.com/jobs/view/3870870997
clarios|battery design and data analyst (m/f/d)|hannover, lower saxony, germany|https://www.linkedin.com/jobs/view/3903111030
dell technologies|sales graduate programm - start oktober 2024|halle, saxony-anhalt, germany|https://www.linkedin.com/jobs/view/3907344791
canyon bicycles gmbh|senior iot embedded software engineer (m/f/d)|coblenz, rhineland-palatinate, germany|https://www.linkedin.com/jobs/view/3815571617
siemens|trainee@it (w/m/d)|amberg, bavaria, germany|https://www.linkedin.com/jobs/view/3785058363
infosys bpm|technical support agent|düsseldorf, north rhine-westphalia, germany|https://www.linkedin.com/jobs/view/3773515628
creating healthy places|duale*r student*in (m/w/d) mediendesign (b.a.)|langenfeld, north rhine-westphalia, germany|https://www.linkedin.com/jobs/view/3881908288
kumavision ag|trainee it consulting (m/w/d)|stuttgart, baden-württemberg, germany|https://www.linkedin.com/jobs/view/3862537315
saphir deutschland gmbh|job-integrated master: junior hr specialist (m/f/d) executive reward & performance, allianz|munich, bavaria, germany|https://www.linkedin.com/jobs/view/3873483217
vector informatik|trainee softwareentwicklung (m/w/d)|karlsruhe, baden-württemberg, germany|https://www.linkedin.com/jobs/view/3786926519
kumavision ag|trainee it consulting (m/w/d)|dortmund, north rhine-westphalia, germany|https://www.linkedin.com/jobs/view/3862535426
fujifilm healthcare europe|human resources coordinator|ratingen, north rhine-westphalia, germany|https://www.linkedin.com/jobs/view/3907540966
ni (national instruments)|(senior) systems engineer aerospace testsolutions (m/f/d)|north rhine-westphalia, germany|https://www.linkedin.com/jobs/view/3850614371
fraunhofer mevis|auszubildende*r fachinformatiker*in systemintegration|bremen, bremen, germany|https://www.linkedin.com/jobs/view/3909634369
koddi|internship - digital marketing analyst|düsseldorf, north rhine-westphalia, germany|https://www.linkedin.com/jobs/view/3904436858
port-neo - the cx-agency|trainee account management (m/w/d)|ulm, baden-württemberg, germany|https://www.linkedin.com/jobs/view/3864280487
the resolute group ltd|senior mechanical engineer|frankfurt rhine-main metropolitan area, worldwide|https://www.linkedin.com/jobs/view/3886970518
workday|sales development representative, new university graduate (german speaking)|berlin, berlin, germany|https://www.linkedin.com/jobs/view/3761130201
airbus|vie (d/f/m): network engineer|donauwörth, bavaria, germany|https://www.linkedin.com/jobs/view/3869367930
fraunhofer fkie|studierende als hilfskraft, pflichtpraktikant*in, absolvent*in für abschlussarbeit (ba/ma)|wachtberg, north rhine-westphalia, germany|https://www.linkedin.com/jobs/view/3827851855
canonical|graduate esg compliance counsel or esg compliance officer - tech sector|düsseldorf, north rhine-westphalia, germany|https://www.linkedin.com/jobs/view/3876274439
sistrix|student:in im online marketing/seo (m/w/d)|bonn, north rhine-westphalia, germany|https://www.linkedin.com/jobs/view/3903699714
datadiorama - it systemhaus für potsdam|auszubildende*r für fachinformatik - systemintegration|potsdam, brandenburg, germany|https://www.linkedin.com/jobs/view/3832575956
canonical|graduate esg compliance counsel or esg compliance officer - tech sector|nuremberg, bavaria, germany|https://www.linkedin.com/jobs/view/3876272882
canonical|graduate esg compliance counsel or esg compliance officer - tech sector|hamburg, hamburg, germany|https://www.linkedin.com/jobs/view/3876276283
clearml|data science team lead|germany|https://www.linkedin.com/jobs/view/3910991768
airbus|thesis in smallsat core avionics products: translation of crypto communication building blocks from c++ to fpga|friedrichshafen, baden-württemberg, germany|https://www.linkedin.com/jobs/view/3902925407
renesas electronics|staff product marketing specialist (f/m/d)|düsseldorf, north rhine-westphalia, germany|https://www.linkedin.com/jobs/view/3904899361
velocity clinical research, inc.|clinical research coordinator ii|wiesbaden, hesse, germany|https://www.linkedin.com/jobs/view/3847922553
velocity clinical research, inc.|clinical research coordinator ii|lübeck, schleswig-holstein, germany|https://www.linkedin.com/jobs/view/3893496538
velocity clinical research, inc.|clinical research coordinator ii|lübeck, schleswig-holstein, germany|https://www.linkedin.com/jobs/view/3891721909
ibm|werkstudent master@ibm sales engineer (f/m/x)|frankfurt, hesse, germany|https://www.linkedin.com/jobs/view/3905135136
stiftung universität hildesheim|two professorship (m/f/d)|hildesheim, lower saxony, germany|https://www.linkedin.com/jobs/view/3784018648
merantix|business process analyst intern @ deltia (remote within germany)|berlin, berlin, germany|https://www.linkedin.com/jobs/view/3839777885
join.com|10xcrm (fesma solutions gmbh): trainee (m/w/d) in automatisierungen im bereich marketing und vertrieb in bremen|bremen, bremen, germany|https://www.linkedin.com/jobs/view/3901171281
join.com|10xcrm (fesma solutions gmbh): trainee (m/w/d) in automatisierungen im bereich marketing und vertrieb in bremen|bremen, bremen, germany|https://www.linkedin.com/jobs/view/3901168193
powerco|expert key user r&d solutions (all genders)|salzgitter, lower saxony, germany|https://www.linkedin.com/jobs/view/3871307439
v2x inc|elektriker/ elektroniker für betriebstechnik (m/w/d) / power systems specialist|wiesbaden, hesse, germany|https://www.linkedin.com/jobs/view/3888849284
