company|title|location|link
sentry (sentry.io)|software engineer, new grad (2024)|vienna, vienna, austria|https://www.linkedin.com/jobs/view/3856194198
pontoon solutions|it - technical project manager (m/w/d)|innere stadt, vienna, austria|https://www.linkedin.com/jobs/view/3804210253
join.com|sales development representative (m/w/d) 100% remote|austria|https://www.linkedin.com/jobs/view/3861534242
join.com|sales development representative (m/w/d)|linz, upper austria, austria|https://www.linkedin.com/jobs/view/3852884049
join.com|sales development representative (m/w/d)|austria|https://www.linkedin.com/jobs/view/3861529824
join.com|sales development representative (m/w/d)|graz, styria, austria|https://www.linkedin.com/jobs/view/3852883166
join.com|sales development representative (m/w/d)|vienna, vienna, austria|https://www.linkedin.com/jobs/view/3852879720
join.com|sales development representative (m/w/d)|salzburg, salzburg, austria|https://www.linkedin.com/jobs/view/3852877927
join.com|sales development representative (m/w/d)|austria|https://www.linkedin.com/jobs/view/3852879721
voestalpine|it management mitarbeiter:in|linz, upper austria, austria|https://www.linkedin.com/jobs/view/3855744198
spar ics - information & communication services|product engineer (m/w/d) für mes/erp systeme der spar produktionsbetriebe|wernberg, carinthia, austria|https://www.linkedin.com/jobs/view/3897190623
stieglbrauerei zu salzburg gmbh|event-manager:in|salzburg, salzburg, austria|https://www.linkedin.com/jobs/view/3904634703
spar ics - information & communication services|product engineer (professional, senior) für warehouse und supply chain management (m/w/d)|salzburg, austria|https://www.linkedin.com/jobs/view/3897188970
isg international service group|mitarbeiterin buchhaltung (m/w/d)|tresdorf, lower austria, austria|https://www.linkedin.com/jobs/view/3894692905
devoteam g cloud|young graduates program|machelen, flemish region, belgium|https://www.linkedin.com/jobs/view/3860522964
alten belgium|embedded software developer (fr/nl + en)|brussels metropolitan area, worldwide|https://www.linkedin.com/jobs/view/3888076579
cuez by tinkerlist.tv|account executive|leuven, flemish region, belgium|https://www.linkedin.com/jobs/view/3868466241
nrb|security engineer|liège, walloon region, belgium|https://www.linkedin.com/jobs/view/3896188447
heidelberger druckmaschinen ag|duales hochschulstudium bachelor of science informatik ws 2024/2025 (m/w/d)|kiel, flemish region, belgium|https://www.linkedin.com/jobs/view/3809658317
job squad|german customer support agent in sofia|sofia, sofia city, worldwide|https://www.linkedin.com/jobs/view/3685737944
inthing corp|quality assurance engineer|croatia, zagreb, worldwide|https://www.linkedin.com/jobs/view/3908218085
perpay inc.|software engineer, new grad|philadelphia, panama|https://www.linkedin.com/jobs/view/3796436874
reuters news agency|software engineer - new grad|mn, eagan, worldwide|https://www.linkedin.com/jobs/view/3904050950
thomson reuters|software engineer - new grad|mn, eagan, worldwide|https://www.linkedin.com/jobs/view/3905333449
bubble|technical product support specialist - new grad 2023|ny, new york, worldwide|https://www.linkedin.com/jobs/view/3841615218
neuralink|software engineer new grad|fremont, canada|https://www.linkedin.com/jobs/view/3783505709
skyways|software engineer - machine learning (ml/cv)|tx, austin, worldwide|https://www.linkedin.com/jobs/view/3577723786
instagram|product designer (university grad)|ny, new york, worldwide|https://www.linkedin.com/jobs/view/3859773368
seismic|software engineer intern (ai/machine learning)|san diego, canada|https://www.linkedin.com/jobs/view/3907145842
nbcuniversal|software engineering internships - academic year|ny, new york, worldwide|https://www.linkedin.com/jobs/view/3888269766
assort health|software engineer|san francisco, canada|https://www.linkedin.com/jobs/view/3856762505
ixl learning|software engineer, new grad|nc, raleigh, worldwide|https://www.linkedin.com/jobs/view/3865685087
sony interactive entertainment|game test analyst – live services / online multiplayer|san diego, canada|https://www.linkedin.com/jobs/view/3584988401
nbcuniversal|software engineering internships - academic year|ct, stamford, worldwide|https://www.linkedin.com/jobs/view/3888270394
u.s. news & world report|software developer|dc, washington, worldwide|https://www.linkedin.com/jobs/view/3636864907
instagram|product designer (university grad)|menlo park, canada|https://www.linkedin.com/jobs/view/3859779120
bubble|technical product support specialist - new grad 2024|ny, new york, worldwide|https://www.linkedin.com/jobs/view/3841615219
promoted.ai|ai sales engineer (new grad)|san francisco, canada|https://www.linkedin.com/jobs/view/3882619885
meta|production engineer (university grad)|fremont, canada|https://www.linkedin.com/jobs/view/3910940251
dolby laboratories|cloud intern, dev ops|san francisco, canada|https://www.linkedin.com/jobs/view/3759502509
meta|offensive security engineer (university grad)|ny, new york, worldwide|https://www.linkedin.com/jobs/view/3881512652
nbcuniversal|product management internships - academic year|ny, new york, worldwide|https://www.linkedin.com/jobs/view/3888273127
dolby laboratories|cloud intern, transcoding (summer 24)|san francisco, canada|https://www.linkedin.com/jobs/view/3759503350
c2r ventures|quantitative developer|ny, new york, worldwide|https://www.linkedin.com/jobs/view/3905253759
applied intuition|product manager - new grad|mountain view, canada|https://www.linkedin.com/jobs/view/3908036010
oracle|software engineer - database technologies|united states|https://www.linkedin.com/jobs/view/3900540087
ramp|new grad 2024  software engineer  backend|new york, united states|https://www.linkedin.com/jobs/view/3786592680
nbcuniversal|product management internships - academic year|ny, new york, worldwide|https://www.linkedin.com/jobs/view/3888269740
appian corporation|product manager (new grad)|va, mclean, worldwide|https://www.linkedin.com/jobs/view/3906056833
stellent it|software engineer|fl, jacksonville, worldwide|https://www.linkedin.com/jobs/view/3888431064
meta|product security engineer (university grad)|menlo park, canada|https://www.linkedin.com/jobs/view/3826317005
meta|offensive security engineer (university grad)|wa, bellevue, worldwide|https://www.linkedin.com/jobs/view/3827308107
dolby laboratories|cloud intern, livestreaming|san francisco, canada|https://www.linkedin.com/jobs/view/3759504264
mygwork - lgbtq+ business community|game test analyst – live services / online multiplayer|san diego, canada|https://www.linkedin.com/jobs/view/3852341151
cube hub inc.|factory automation plc engineer (recent grads accepted) - onsite waterloo ia - lg|ia, waterloo, worldwide|https://www.linkedin.com/jobs/view/3788420245
oracle|sales & business development representative - denver, co - june 2024 start date|co, denver, worldwide|https://www.linkedin.com/jobs/view/3901288223
mat holdings, inc.|product manager - entry level|long grove, israel|https://www.linkedin.com/jobs/view/3889026827
lee lab at stanford|preclinical systems neuroscience data analyst|stanford, canada|https://www.linkedin.com/jobs/view/3907667632
nbcuniversal|cyber security internships - academic year|universal city, canada|https://www.linkedin.com/jobs/view/3888268884
imi process automation|imi grad - engineering|rancho santa margarita, canada|https://www.linkedin.com/jobs/view/3905264279
meta|offensive security engineer (university grad)|dc, washington, worldwide|https://www.linkedin.com/jobs/view/3827309069
ramp|new grad 2024  software engineer  frontend|new york, united states|https://www.linkedin.com/jobs/view/3713179127
mygwork - lgbtq+ business community|game test analyst - pssqa|san diego, canada|https://www.linkedin.com/jobs/view/3852341202
amd|kubernetes sw developer|tx, austin, worldwide|https://www.linkedin.com/jobs/view/3905507608
honeywell|computer/software engineer & computer science - recent grad/full time (us person required)|united states|https://www.linkedin.com/jobs/view/3699044663
arketa|sales development rep (sdr)|united states|https://www.linkedin.com/jobs/view/3867314004
nbcuniversal|tv entertainment production, development & programming internships - academic year|ny, new york, worldwide|https://www.linkedin.com/jobs/view/3888274116
get it recruit - marketing|sales development representative (new grad) - remote  wfh|ny, new york, worldwide|https://www.linkedin.com/jobs/view/3891224439
nbcuniversal|ip security & technology internships – academic year|universal city, canada|https://www.linkedin.com/jobs/view/3888271399
nbcuniversal|ip security & technology internships – academic year|universal city, canada|https://www.linkedin.com/jobs/view/3888274113
stellent it|ux/ui  designer|nv, las vegas, worldwide|https://www.linkedin.com/jobs/view/3888424925
mygwork - lgbtq+ business community|baseball test analyst|san diego, canada|https://www.linkedin.com/jobs/view/3852343081
dch health system|coder (new grad)|al, tuscaloosa, worldwide|https://www.linkedin.com/jobs/view/3868521723
bolt|senior software engineer - payments|united states|https://www.linkedin.com/jobs/view/3902456479
mantech|technology & data solutions - technical intern|united states|https://www.linkedin.com/jobs/view/3904604677
novatio engineering, inc.|electrical project engineer|waltham, morocco|https://www.linkedin.com/jobs/view/3905293464
assort health|senior software engineer|san francisco, canada|https://www.linkedin.com/jobs/view/3856764330
boostdraft|product manager|san francisco bay area, worldwide|https://www.linkedin.com/jobs/view/3887680431
nbcuniversal|nbcu news group technology internships – academic year|ny, new york, worldwide|https://www.linkedin.com/jobs/view/3888273157
honeywell|embedded software engineer - recent grad/full time (us person required)|united states|https://www.linkedin.com/jobs/view/3828272536
construction grad, llc|assistant project manager|co, breckenridge, worldwide|https://www.linkedin.com/jobs/view/3888076402
qualtrics|systems support specialist|ut, provo, worldwide|https://www.linkedin.com/jobs/view/3884826599
imi|imi grad - engineering|rancho santa margarita, canada|https://www.linkedin.com/jobs/view/3901960839
haymarket media us|haymarket studio intern|ny, new york, worldwide|https://www.linkedin.com/jobs/view/3841563118
health care service corporation|university new grad - finance analyst|tx, richardson, worldwide|https://www.linkedin.com/jobs/view/3903358364
scout clean energy|resource assessment manager|co, boulder, worldwide|https://www.linkedin.com/jobs/view/3905314398
infinite computer solutions|senior quality analyst|texas, united states|https://www.linkedin.com/jobs/view/3870744331
ion|technical support analyst, chicago - 5849/9555|chicago, israel|https://www.linkedin.com/jobs/view/3639951574
nbcuniversal|brand creative & design internships - academic year|ny, new york, worldwide|https://www.linkedin.com/jobs/view/3904431266
boostdraft|legal tech sales specialist (in-house counsel, legal dept)|united states|https://www.linkedin.com/jobs/view/3891660034
the applied research laboratory at penn state university|part-time grad student intern|university park, panama|https://www.linkedin.com/jobs/view/3631117709
aptim|construction & project management intern|ny, new york, worldwide|https://www.linkedin.com/jobs/view/3802332795
aptim|project engineering intern|san diego, canada|https://www.linkedin.com/jobs/view/3802548358
warner bros. discovery|ncaa digital project management post grad|ga, atlanta, worldwide|https://www.linkedin.com/jobs/view/3875995361
microchip technology inc.|engineer i - manufacturing|lawrence, morocco|https://www.linkedin.com/jobs/view/3776120982
l3harris technologies|global real estate (new grad -remote)|united states|https://www.linkedin.com/jobs/view/3903981702
applied materials|research scientist iii - new college grad (e3)|santa clara, canada|https://www.linkedin.com/jobs/view/3900241004
applied materials|systems engineer ii - new college grad|santa clara, canada|https://www.linkedin.com/jobs/view/3894463521
tractian|sales development representative|ga, atlanta, worldwide|https://www.linkedin.com/jobs/view/3837055446
rocs grad staffing|accounting assistant|district of columbia, united states|https://www.linkedin.com/jobs/view/3907880997
iconma|document specialist ii|sunnyvale, canada|https://www.linkedin.com/jobs/view/3906858183
imi process automation|imi grad - inside sales|rancho santa margarita, canada|https://www.linkedin.com/jobs/view/3905262464
first street|hydrologic modeler (new grad)|ny, new york, worldwide|https://www.linkedin.com/jobs/view/3848880769
canoo|new grad - vehicle attributes engineer|ok, oklahoma city, worldwide|https://www.linkedin.com/jobs/view/3892754927
nvidia|compiler engineer, deep learning - new college grad 2024|santa clara, canada|https://www.linkedin.com/jobs/view/3851086234
nvidia|circuit design engineer - new college grad 2024|santa clara, canada|https://www.linkedin.com/jobs/view/3858604842
hntb|new grad engineer i - summer 2024|san jose, canada|https://www.linkedin.com/jobs/view/3805950516
charles river development|charles river fall 2024 co-op, crd|burlington, morocco|https://www.linkedin.com/jobs/view/3842798706
specialized dental partners|dental specialists recruiter - remote|tn, franklin, worldwide|https://www.linkedin.com/jobs/view/3790519636
rimland services nfp|dog walker and/or pet sitter - ne/se dc|dc, washington, worldwide|https://www.linkedin.com/jobs/view/3787911133
city of long beach|administrative analyst i-iv|long beach, canada|https://www.linkedin.com/jobs/view/3898325773
veeva systems|sales development program|ny, new york, worldwide|https://www.linkedin.com/jobs/view/3695137695
oak view group|ubs arena operations intern|ny, elmont, worldwide|https://www.linkedin.com/jobs/view/3866860317
westinghouse electric company|engineer i|cranberry township, panama|https://www.linkedin.com/jobs/view/3849747364
ally energy|engineer-new services field grad radiography|springfield, israel|https://www.linkedin.com/jobs/view/3848833841
california state university, los angeles|timely support coordinator|los angeles, canada|https://www.linkedin.com/jobs/view/3779837488
nbcuniversal telemundo enterprises|telemundo production services & project management internships – academic year|fl, miami, worldwide|https://www.linkedin.com/jobs/view/3900197187
mygwork - lgbtq+ business community|ncaa digital project management post grad|ga, atlanta, worldwide|https://www.linkedin.com/jobs/view/3872752472
forward|medical assistant (new grad)|ny, new york, worldwide|https://www.linkedin.com/jobs/view/3906582311
mission bio|sr bioinformatics scientist|south san francisco, canada|https://www.linkedin.com/jobs/view/3904718624
l3harris technologies|systems engineer (new grad- salt lake city, ut) 1|ut, salt lake city, worldwide|https://www.linkedin.com/jobs/view/3866488615
instructional connections, llc|online academic coach (highered, remote, part-time)|fl, miami, worldwide|https://www.linkedin.com/jobs/view/3874860222
nextera energy resources|sr. qa automation engineer|fl, juno beach, worldwide|https://www.linkedin.com/jobs/view/3911349856
milton cat|it support technician|me, scarborough, worldwide|https://www.linkedin.com/jobs/view/3816196547
cedars-sinai marina del rey hospital|operations analyst, bariatric clinic - marina del rey hospital|marina del rey, canada|https://www.linkedin.com/jobs/view/3843990796
jefferson health|institutional work study grad|northwest philadelphia, panama|https://www.linkedin.com/jobs/view/3804140689
te connectivity|product development engineering intern|nc, winston-salem, worldwide|https://www.linkedin.com/jobs/view/3830182003
viasat|digital signal processing engineer, early career|az, tempe, worldwide|https://www.linkedin.com/jobs/view/3771471619
canoo|new grad exterior designer|ok, oklahoma city, worldwide|https://www.linkedin.com/jobs/view/3895439916
first street|wildfire modeler (new grad)|new york city metropolitan area, worldwide|https://www.linkedin.com/jobs/view/3848879760
rochester institute of technology|analyst|ny, rochester, worldwide|https://www.linkedin.com/jobs/view/3869794225
sunrise systems, inc.|buyer/procurement specialist|md, walkersville, worldwide|https://www.linkedin.com/jobs/view/3778278606
raytheon|2024 intern - raytheon - mission systems - software intern (onsite)|co, aurora, worldwide|https://www.linkedin.com/jobs/view/3906888020
jefferson health|institutional work study grad|northwest philadelphia, panama|https://www.linkedin.com/jobs/view/3804138775
milton cat|it support technician|milford, morocco|https://www.linkedin.com/jobs/view/3816193771
instructional connections, llc|online academic coach (highered, remote, part-time)|fl, orlando, worldwide|https://www.linkedin.com/jobs/view/3909636761
rosendin|project assistant|va, sterling, worldwide|https://www.linkedin.com/jobs/view/3909346334
instructional connections, llc|online academic coach (highered, remote, part-time)|ga, atlanta, worldwide|https://www.linkedin.com/jobs/view/3909640016
rocs grad staffing|business development coordinator|va, ashburn, worldwide|https://www.linkedin.com/jobs/view/3902918792
instructional connections, llc|online academic coach (highered, remote, part-time)|tx, dallas, worldwide|https://www.linkedin.com/jobs/view/3909633102
palantir technologies|forward deployed software engineer, new grad - us government|dc, washington, worldwide|https://www.linkedin.com/jobs/view/3783157870
rochester institute of technology|analyst|new york metropolitan area, rochester, worldwide|https://www.linkedin.com/jobs/view/3894095415
software technology inc.|looking for scientist 2 - molecular section - nashville, tn|tn, nashville, worldwide|https://www.linkedin.com/jobs/view/3888428266
altec|controls developer- entry level- new grad|mo, st joseph, worldwide|https://www.linkedin.com/jobs/view/3809918492
findmyclinicaltrial|unpaid (for credit) fall internship|dc, washington, worldwide|https://www.linkedin.com/jobs/view/3887690152
emerson|associate field engineer|riverside, canada|https://www.linkedin.com/jobs/view/3908674521
hntb|new grad engineer i - summer 2024|pittsburgh, panama|https://www.linkedin.com/jobs/view/3802543888
hntb|new grad engineer i - summer 2024|oh, cleveland, worldwide|https://www.linkedin.com/jobs/view/3797239333
hntb|new grad engineer i - summer 2024|ks, overland park, worldwide|https://www.linkedin.com/jobs/view/3797306686
hntb|new grad engineer i - summer 2024|la, baton rouge, worldwide|https://www.linkedin.com/jobs/view/3801748090
hntb|new grad engineer i - summer 2024|wi, madison, worldwide|https://www.linkedin.com/jobs/view/3795662746
duke university|program coordinator|nc, durham, worldwide|https://www.linkedin.com/jobs/view/3859726620
cadence design systems|software engineer (c++, computational geometry, cfd) - new/recent college grad - r46080|tx, austin, worldwide|https://www.linkedin.com/jobs/view/3870316570
reddit, inc.|senior data engineer, experimentation platform|united states|https://www.linkedin.com/jobs/view/3897024780
ge vernova|electrical power systems engineer - wams|wa, bothell, worldwide|https://www.linkedin.com/jobs/view/3884129880
ion|first line support analyst - 7911|nj, jersey city, worldwide|https://www.linkedin.com/jobs/view/3639951529
honeybee robotics|principal engineer|co, longmont, worldwide|https://www.linkedin.com/jobs/view/3883458078
hntb|new grad engineer i - summer 2024|mi, detroit, worldwide|https://www.linkedin.com/jobs/view/3797964280
reddit, inc.|staff software engineer - experimentation platform|united states|https://www.linkedin.com/jobs/view/3897022825
africa direct|photographer/admin/listing/packing|co, denver, worldwide|https://www.linkedin.com/jobs/view/3887172740
massachusetts institute of technology|program coordinator|cambridge, morocco|https://www.linkedin.com/jobs/view/3848284584
securemac|macos objective-c developer  swift developer|nv, las vegas, worldwide|https://www.linkedin.com/jobs/view/3333121562
milton cat|it support technician|ny, batavia, worldwide|https://www.linkedin.com/jobs/view/3816193772
university of the pacific|senior career advisor|sacramento, canada|https://www.linkedin.com/jobs/view/3907821730
steneral consulting|senior enterprise gis system admin|fl, juno beach, worldwide|https://www.linkedin.com/jobs/view/3781895650
steneral consulting|senior enterprise gis system admin|fl, juno beach, worldwide|https://www.linkedin.com/jobs/view/3780757481
steneral consulting|onsite work - need senior enterprise gis system admin in juno beach fl|fl, juno beach, worldwide|https://www.linkedin.com/jobs/view/3763916070
steneral consulting|senior enterprise gis system admin|fl, juno beach, worldwide|https://www.linkedin.com/jobs/view/3764180249
adventhealth|supply chain tech|co, castle rock, worldwide|https://www.linkedin.com/jobs/view/3868705502
forward|medical assistant (new grad)|dc, washington, worldwide|https://www.linkedin.com/jobs/view/3882214713
hntb|new grad engineer i - summer 2024|harrisburg, panama|https://www.linkedin.com/jobs/view/3802550112
nvidia|compiler optimization engineer, llvm and mlir - new college grad|wa, redmond, worldwide|https://www.linkedin.com/jobs/view/3734667170
aztec municipal school district|technology director sy 24-25|nm, aztec, worldwide|https://www.linkedin.com/jobs/view/3840731660
3 key consulting, inc.|associate engineer, packaging - (jp10455)|thousand oaks, canada|https://www.linkedin.com/jobs/view/3588652504
energy jobline|construction financial analyst - cost accounting|va, leesburg, worldwide|https://www.linkedin.com/jobs/view/3909151897
nvidia|compiler optimization engineer, llvm and mlir - new college grad|santa clara, canada|https://www.linkedin.com/jobs/view/3734670060
aequor|us_scientist i/associate scientist (pipeline)|south san francisco, canada|https://www.linkedin.com/jobs/view/3873775052
aequor information technologies pvt. ltd.|us_scientist i/associate scientist (pipeline)|south san francisco, canada|https://www.linkedin.com/jobs/view/3873124557
raytheon|2024 intern - raytheon ground systems - software intern (onsite)|co, aurora, worldwide|https://www.linkedin.com/jobs/view/3905586934
team builders recruiting and consulting, llc|virtual design & construction engineer|los angeles, canada|https://www.linkedin.com/jobs/view/3841346837
hntb|new grad planner i (analyst) - summer 2024|tx, austin, worldwide|https://www.linkedin.com/jobs/view/3832749408
rocs grad staffing|staff accountant|md, bethesda, worldwide|https://www.linkedin.com/jobs/view/3903195032
nvidia|power architect - new college grad 2024|santa clara, canada|https://www.linkedin.com/jobs/view/3810848965
integrated resources, inc ( iri )|quality control technician|rocklin, canada|https://www.linkedin.com/jobs/view/3903788894
uc santa barbara|career counselor, environment + society - 67437|santa barbara, canada|https://www.linkedin.com/jobs/view/3890171664
adventhealth|supply chain distribution technician|ga, calhoun, worldwide|https://www.linkedin.com/jobs/view/3909562902
hntb|new grad engineer i- for current or previous hntb interns/co-ops only- great lakes division|chicago, israel|https://www.linkedin.com/jobs/view/3674785754
forward|medical assistant (new grad)|az, phoenix, worldwide|https://www.linkedin.com/jobs/view/3844446677
ally energy|radiography field grad services engineer-new|mi, lansing, worldwide|https://www.linkedin.com/jobs/view/3848838008
william woods university|reg. asst. dir. of admissions – grad. ed. - se mo|mo, fulton, worldwide|https://www.linkedin.com/jobs/view/3615953122
asm|college grad- systems electrical engineer - ev|az, phoenix, worldwide|https://www.linkedin.com/jobs/view/3720720660
burns & mcdonnell|assistant electrical engineer - substation (kansas city)|mo, kansas city, worldwide|https://www.linkedin.com/jobs/view/3686029155
burns & mcdonnell|assistant mechanical engineer - aviation & federal, fueling (atlanta)|ga, atlanta, worldwide|https://www.linkedin.com/jobs/view/3669267320
jobot|automation technician|wi, waukesha, worldwide|https://www.linkedin.com/jobs/view/3908233549
talent advisory group (tag)|senior associate electrical engineer, test equipment|oh, cincinnati, worldwide|https://www.linkedin.com/jobs/view/3888443976
jobot|controls/electrical engineer - college grad or experienced!|tx, san antonio, worldwide|https://www.linkedin.com/jobs/view/3909140831
tekwissen ®|factory automation engineer - foundry|ia, waterloo, worldwide|https://www.linkedin.com/jobs/view/3891933255
nvidia|asic clocks engineer - new college grad 2024|santa clara, canada|https://www.linkedin.com/jobs/view/3683383386
3 key consulting, inc.|associate engineer, biopharma packaging - (jp10592)|thousand oaks, canada|https://www.linkedin.com/jobs/view/3619877196
rosendin|engineer iii|tx, pflugerville, worldwide|https://www.linkedin.com/jobs/view/3892151859
burns & mcdonnell|assistant project controls specialist - construction (brea)|brea, canada|https://www.linkedin.com/jobs/view/3853541156
the mom project|recruitment communications specialist|chicago, israel|https://www.linkedin.com/jobs/view/3816941382
rosendin|engineer iii|san jose, canada|https://www.linkedin.com/jobs/view/3748288123
hntb|intern electrical engineer: traction power systems - summer 2024|chelmsford, morocco|https://www.linkedin.com/jobs/view/3882200866
westinghouse electric company|electrical engineer, i&c - new grad|cranberry township, panama|https://www.linkedin.com/jobs/view/3806819500
huitt-zollars, inc.|structural (bridge) graduate eit|tx, dallas, worldwide|https://www.linkedin.com/jobs/view/3857873679
baylor scott & white health|physician assistant - cv/ct - inpatient|tx, plano, worldwide|https://www.linkedin.com/jobs/view/3873096018
job juncture|virtual design & construction engineer|los angeles, canada|https://www.linkedin.com/jobs/view/3765380411
