company|title|location|link
marriott international|university intern-europe|barcelona, catalonia, spain|https://www.linkedin.com/jobs/view/4216493971
marriott international|university intern-europe|barcelona, catalonia, spain|https://www.linkedin.com/jobs/view/4216499292
spain internship|communications & marketing internship - 20-25h per week / € 500 per month|seville, andalusia, spain|https://www.linkedin.com/jobs/view/4061489125
marriott international|university intern-europe|barcelona, catalonia, spain|https://www.linkedin.com/jobs/view/4228742708
spain internship|paid reception assistant and general hostel support internship in barcelona, spain|barcelona, catalonia, spain|https://www.linkedin.com/jobs/view/4061485582
sanlucar company|logistics import-export intern|puzol, valencian community, spain|https://www.linkedin.com/jobs/view/4175519640
astek|chemical engineer intern|madrid, community of madrid, spain|https://www.linkedin.com/jobs/view/4215843476
fever|ambassadors / content creator intern|madrid, community of madrid, spain|https://www.linkedin.com/jobs/view/4227201206
juniper networks|intern - global services - spain|madrid, community of madrid, spain|https://www.linkedin.com/jobs/view/4232985849
ex venture inc.|social media marketing internship in canary island|las palmas de gran canaria, canary islands, spain|https://www.linkedin.com/jobs/view/4223564107
allianz technology|employee engagement & listening intern/working student (m/f/d)|barcelona, catalonia, spain|https://www.linkedin.com/jobs/view/4208044488
saeta yield|becario de tesorería - treasury intern renewable energy|madrid, community of madrid, spain|https://www.linkedin.com/jobs/view/4218821177
axpo group|marketing intern - graphic design (f/m/d)|madrid, community of madrid, spain|https://www.linkedin.com/jobs/view/4219858882
spain internship|entertainment internship in a 4* hotel in ibiza and peñiscola, spain|ibiza, balearic islands, spain|https://www.linkedin.com/jobs/view/4061484642
spain internship|paid sales internship for a real estate platform in barcelona, spain|barcelona, catalonia, spain|https://www.linkedin.com/jobs/view/4061498007
audiostack|business development & sales engineering internship|barcelona, catalonia, spain|https://www.linkedin.com/jobs/view/4227076290
spain internship|brokering internship in valencia, spain|valencia, valencian community, spain|https://www.linkedin.com/jobs/view/4061486470
worley|transport civil engineering intern|madrid, community of madrid, spain|https://www.linkedin.com/jobs/view/4022826283
ayuntamiento de rivas vaciamadrid|convocatoria de una plaza de técnico-a de gestión educativa correspondiente a la oep 2019. turno promoción interna|vaciamadrid, community of madrid, spain|https://www.linkedin.com/jobs/view/4047038937
domma|healthcare business development intern|sant cugat del vallès, catalonia, spain|https://www.linkedin.com/jobs/view/4229022642
spain internship|marketing and seo assistant internship in sevilla, spain|seville, andalusia, spain|https://www.linkedin.com/jobs/view/4061484654
lumapps|sales development representative intern - uk market (f/m) - barcelona|barcelona, catalonia, spain|https://www.linkedin.com/jobs/view/4232768717
danone|btheone - prl internship (sant hilari)|sant hilari sacalm, catalonia, spain|https://www.linkedin.com/jobs/view/4062591149
the goodyear tire & rubber company|fleet online services internship|madrid, community of madrid, spain|https://www.linkedin.com/jobs/view/4230296057
westinghouse electric company|supplier performance engineering intern|västerås, västmanland county, sweden|https://www.linkedin.com/jobs/view/4225894800
philip morris international|swiss internships 2025|marly, fribourg, switzerland|https://www.linkedin.com/jobs/view/4220426857
reliefweb|legal intern|geneva, geneva, switzerland|https://www.linkedin.com/jobs/view/4230451778
ey|intern indirect tax bern (graduate)|bern, berne, switzerland|https://www.linkedin.com/jobs/view/4186566072
tietalent|internship im legal für 6 monate|zurich, zurich, switzerland|https://www.linkedin.com/jobs/view/4233301703
avaloq|internship in trade processing (12-month fixed-term contract)|bioggio, ticino, switzerland|https://www.linkedin.com/jobs/view/4221740323
optotune|r&d internship in product development|dietikon / im berg, zurich, switzerland|https://www.linkedin.com/jobs/view/4222695113
marriott international|university intern-europe|geneva, geneva, switzerland|https://www.linkedin.com/jobs/view/4191521484
nestlé|quality intern|orbe, vaud, switzerland|https://www.linkedin.com/jobs/view/4217444465
oxyle|r&d intern|schlieren, zurich, switzerland|https://www.linkedin.com/jobs/view/4227212858
esri r&d center zurich|r&d internship|zurich, zurich, switzerland|https://www.linkedin.com/jobs/view/4210481468
msc cruises|hotel services intern|geneva, geneva, switzerland|https://www.linkedin.com/jobs/view/4210629096
reliefweb|ers internships|geneva, geneva, switzerland|https://www.linkedin.com/jobs/view/4232060078
exeon analytics|cybersecurity training intern (internship / working student)|switzerland|https://www.linkedin.com/jobs/view/4226661787
swiss international air lines|internship in crew ai chatbot development (limited to 6-8 months, 80-100%, all genders)|kloten, zurich, switzerland|https://www.linkedin.com/jobs/view/4224929218
on|data engineering intern|zurich, zurich, switzerland|https://www.linkedin.com/jobs/view/4227615254
marriott international|university intern-europe|geneva, geneva, switzerland|https://www.linkedin.com/jobs/view/4224676296
coty|r&d fragrance technology development intern|geneva, geneva, switzerland|https://www.linkedin.com/jobs/view/4222831986
bof careers|data engineering intern|zurich, zurich, switzerland|https://www.linkedin.com/jobs/view/4227945030
flyability|mechanical engineer intern|paudex, vaud, switzerland|https://www.linkedin.com/jobs/view/4228161107
beyond gravity|intern materials & processes 100% (all genders)|zurich, zurich, switzerland|https://www.linkedin.com/jobs/view/4225325493
hitachi energy|continuous improvement intern 80 - 100 % (f/m/d)|zurich, zurich, switzerland|https://www.linkedin.com/jobs/view/4208987809
siemens|internship energy management in building automation 80-100%|zug, zug, switzerland|https://www.linkedin.com/jobs/view/4224627501
allianz technology|working student / intern billing support (60%-80%) (m/f/d)|wallisellen / hof, zurich, switzerland|https://www.linkedin.com/jobs/view/4216702594
abb|internship in research & development - electrical engineering / physics (80-100%)|schaffhausen, schaffhausen, switzerland|https://www.linkedin.com/jobs/view/4226363179
hitachi energy|internship in software engineering with focus on reliability engineering (f/m/d)|baden, aargau, switzerland|https://www.linkedin.com/jobs/view/4213393004
mammut sports group ag|intern development apparel 3d (all, 80-100%), 6-12 months|seon, aargau, switzerland|https://www.linkedin.com/jobs/view/4226428207
gravis robotics|mechanical engineering internship|zurich, zurich, switzerland|https://www.linkedin.com/jobs/view/4134115671
incyte|intern quality performance & operational excellence|morges, vaud, switzerland|https://www.linkedin.com/jobs/view/4228985994
carify|start-up internship: b2b sales - german speaking (6 monate praktikum)|zurich, zurich, switzerland|https://www.linkedin.com/jobs/view/4218855282
ig arbeit|praktikantin / praktikant - soziale arbeit / eingliederungsmassnahmen intern 60 % (m/w/d)|lucerne, lucerne, switzerland|https://www.linkedin.com/jobs/view/4203775660
yuppo|marketing artist intern|istanbul, istanbul, worldwide|https://www.linkedin.com/jobs/view/4229004058
continental|internship hydrogen infrastructures development - 1 year|grimsby, england, united kingdom|https://www.linkedin.com/jobs/view/4205891980
west coast partnership development|direct retailing intern (12 months fixed term)|london, england, united kingdom|https://www.linkedin.com/jobs/view/4230990924
ripple|blockchain partner analyst intern|london, england, united kingdom|https://www.linkedin.com/jobs/view/4131959956
targetjobs uk|sustainability summer internship programme – energy|deeside, wales, united kingdom|https://www.linkedin.com/jobs/view/4221479516
dataannotation|graduate research intern biology - ai trainer|london, england, united kingdom|https://www.linkedin.com/jobs/view/4220980529
bending spoons|software engineer intern|greater lincoln area, united kingdom|https://www.linkedin.com/jobs/view/4230286608
bending spoons|hr team assistant, intern|london, england, united kingdom|https://www.linkedin.com/jobs/view/4230627305
the bright agency|creative intern|london area, united kingdom|https://www.linkedin.com/jobs/view/4218733729
dataannotation|graduate research intern biology - ai trainer|west bromwich, england, united kingdom|https://www.linkedin.com/jobs/view/4220986058
blackstone|2025 blackstone credit & insurance, insurance institutional client solutions h2 off cycle intern|london, england, united kingdom|https://www.linkedin.com/jobs/view/4228313477
ge vernova|competitive intelligence intern|bracknell, england, united kingdom|https://www.linkedin.com/jobs/view/4218727952
blue zoo animation studio|2025 internship  motion graphics intern, digital|london, england, united kingdom|https://www.linkedin.com/jobs/view/4226019499
confluent|cloud applications placement intern|united kingdom|https://www.linkedin.com/jobs/view/4185697522
max mara fashion group|wholesale showroom internship / placement|greater london, england, united kingdom|https://www.linkedin.com/jobs/view/4227508091
targetjobs uk|electrical design engineer intern (2025 summer internship)|bicester, england, united kingdom|https://www.linkedin.com/jobs/view/4221478670
cisco|site reliability engineer (network engineer) intern - placement year|feltham, england, united kingdom|https://www.linkedin.com/jobs/view/4034651761
dataannotation|graduate research intern biology|manchester, england, united kingdom|https://www.linkedin.com/jobs/view/4221407510
dataannotation|graduate research intern biology|wakefield, england, united kingdom|https://www.linkedin.com/jobs/view/4221409253
huawei technologies research & development (uk) ltd|research scientist intern-performance simulation|cambridge, england, united kingdom|https://www.linkedin.com/jobs/view/3906295419
bravox s/a indústria e comércio eletrônico.|mechanical design intern|west yorkshire, england, united kingdom|https://www.linkedin.com/jobs/view/4193986851
dataannotation|graduate research intern|st albans, england, united kingdom|https://www.linkedin.com/jobs/view/4220549944
tencent cloud|sales trainee, intern|london area, united kingdom|https://www.linkedin.com/jobs/view/4190985127
park place technologies|sales intern|london, england, united kingdom|https://www.linkedin.com/jobs/view/4214972860
tencent singapore|speech synthesis intern 104829|london, england, united kingdom|https://www.linkedin.com/jobs/view/4199141536
one sided coin|business development internship|edinburgh, scotland, united kingdom|https://www.linkedin.com/jobs/view/4232749488
state street|global cybersecurity services, uk&i ciso, 12 months internship program|london, england, united kingdom|https://www.linkedin.com/jobs/view/4230917823
belk|store intern - full time - charleston, sc|shop, england, united kingdom|https://www.linkedin.com/jobs/view/4220664621
charles taylor|summer internship programme - travel claims|christchurch, england, united kingdom|https://www.linkedin.com/jobs/view/4229248121
ge vernova|production engineering intern-1|lisburn, northern ireland, united kingdom|https://www.linkedin.com/jobs/view/4232908428
costello medical|graphic design intern|bristol, england, united kingdom|https://www.linkedin.com/jobs/view/4225512181
tiktok|reverse engineering-native security intern|london, england, united kingdom|https://www.linkedin.com/jobs/view/4227320858
siemens eda (siemens digital industries software)|asic design verification intern - strategic student program poland|cambridge, england, united kingdom|https://www.linkedin.com/jobs/view/4207453011
san antonio regional hospital|pharmacist intern|staffordshire, england, united kingdom|https://www.linkedin.com/jobs/view/4229901624
thermo fisher scientific|emea inside sales intern|paisley, scotland, united kingdom|https://www.linkedin.com/jobs/view/4228670648
cfo insights|marketing campaign intern (danish speaker)|london, england, united kingdom|https://www.linkedin.com/jobs/view/4067134490
private equity insights|marketing campaign intern (danish speaker)|london, england, united kingdom|https://www.linkedin.com/jobs/view/4068284700
cfo insights|danish speaker intern|london, england, united kingdom|https://www.linkedin.com/jobs/view/4068282947
private equity insights|danish speaker intern|london, england, united kingdom|https://www.linkedin.com/jobs/view/4068286083
insurtech insights|danish speaker intern|london, england, united kingdom|https://www.linkedin.com/jobs/view/4068286422
richemont|strategic communications assistant intern (12 month ftc)|london, england, united kingdom|https://www.linkedin.com/jobs/view/4185027956
tiktok|industry strategy intern london|london, england, united kingdom|https://www.linkedin.com/jobs/view/4227627056
amazon web services (aws)|program management internship, emea dc delivery & planning|london, england, united kingdom|https://www.linkedin.com/jobs/view/4193301424
targetjobs uk|summer internship opportunity - operations strategy intern|london, england, united kingdom|https://www.linkedin.com/jobs/view/4225052146
canditalent|sales & marketing management intern|greater london, england, united kingdom|https://www.linkedin.com/jobs/view/4224341038
ex venture inc.|social media manager internship in bali|london, england, united kingdom|https://www.linkedin.com/jobs/view/4193057159
indie campers|international ops internship - london|london, england, united kingdom|https://www.linkedin.com/jobs/view/4219306710
celonis|intern business analytics & management consulting (value engineering) - uk|london, england, united kingdom|https://www.linkedin.com/jobs/view/4227252088
convatec|sustainability summer internship programme - logistics|deeside, wales, united kingdom|https://www.linkedin.com/jobs/view/4211913617
slb|hr learning & competency intern, digital & integration|london area, united kingdom|https://www.linkedin.com/jobs/view/4210794882
science group|content writer & marketing intern. twelve-month undergraduate placement|epsom, england, united kingdom|https://www.linkedin.com/jobs/view/4173142540
private equity insights|entrepreneur in residence intern (spanish speaker) private equity insights|london, england, united kingdom|https://www.linkedin.com/jobs/view/4068287288
altman solon|strategy consulting intern tmt|london, england, united kingdom|https://www.linkedin.com/jobs/view/4229234269
pragmatic semiconductor|2025 research intern - ai at the edge|cambridge, england, united kingdom|https://www.linkedin.com/jobs/view/4228589138
dataannotation|graduate research intern|london area, united kingdom|https://www.linkedin.com/jobs/view/4222360328
targetjobs uk|veterinary internship - rotating|longbridge, england, united kingdom|https://www.linkedin.com/jobs/view/4226827410
cfo insights|entrepreneur in residence intern (spanish speaker) cfo insights|london, england, united kingdom|https://www.linkedin.com/jobs/view/4068287214
setsales|entrepreneur in residence intern (italian speaker) setsales|london, england, united kingdom|https://www.linkedin.com/jobs/view/4068282916
cfo insights|entrepreneur in residence intern (french speaker) cfo insights|london, england, united kingdom|https://www.linkedin.com/jobs/view/4068285612
setsales|entrepreneur in residence intern (german speaker) setsales|london, england, united kingdom|https://www.linkedin.com/jobs/view/4068068205
cfo insights|entrepreneur in residence intern (danish speaker) cfo insights|london, england, united kingdom|https://www.linkedin.com/jobs/view/4068282851
huawei technologies research & development (uk) ltd|compiler industrial placement intern|cambridge, england, united kingdom|https://www.linkedin.com/jobs/view/4174429538
targetjobs uk|veterinary internship - neurology|high wycombe, england, united kingdom|https://www.linkedin.com/jobs/view/4225052145
bsh uk & ireland|sales support intern|milton keynes, england, united kingdom|https://www.linkedin.com/jobs/view/4233107643
uber|2025 operations internship, amsterdam|amsterdam, north holland, netherlands|https://www.linkedin.com/jobs/view/4214697613
idexx|employee marketing & internal communications intern|hoofddorp, north holland, netherlands|https://www.linkedin.com/jobs/view/4205235143
consultport|marketing internship|berlin, berlin, germany|https://www.linkedin.com/jobs/view/4212089361
enpal|business development intern (m/w/d)|berlin, berlin, germany|https://www.linkedin.com/jobs/view/3802393443
kleinanzeigen|intern business development motors (f/m/d)|berlin, berlin, germany|https://www.linkedin.com/jobs/view/4214604718
enpal|strategic projects - intern (w/m/d)|berlin, berlin, germany|https://www.linkedin.com/jobs/view/4118938598
pepsico|first gen: shopper marketing intern belgium 2025|zaventem, flemish region, belgium|https://www.linkedin.com/jobs/view/4221520297
mib trieste school of management|allianz: full scholarship & internship in italy|bucharest, romania|https://www.linkedin.com/jobs/view/4206022671
paramount|comedy central cee intern|budapest, budapest, hungary|https://www.linkedin.com/jobs/view/4228273567
patriksson group|showroom internship - denmark|copenhagen municipality, capital region of denmark, denmark|https://www.linkedin.com/jobs/view/4230652791
kh engineering|civil engineering intern|schiedam, south holland, netherlands|https://www.linkedin.com/jobs/view/4231381266
solactive ag|intern (m/f/d) institutional sales|frankfurt, hesse, germany|https://www.linkedin.com/jobs/view/4211294863
blacklane|b2b marketing intern|london, england, united kingdom|https://www.linkedin.com/jobs/view/4225580684
bombardier|planning admin intern (1 year ftc)|biggin hill, england, united kingdom|https://www.linkedin.com/jobs/view/4216513303
scaleup.agency|ai & business analyst / consultant (remote internship)|lyon, auvergne-rhône-alpes, france|https://www.linkedin.com/jobs/view/4213478144
deloitte|stagiaire en droit de l'immigration - mobilité internationale f/h|lyon, auvergne-rhône-alpes, france|https://www.linkedin.com/jobs/view/4207112227
kraft heinz|logistics intern|milan, lombardy, italy|https://www.linkedin.com/jobs/view/4228785333
tiktok|tiktok data center operations engineer intern, norway, june 2025|oslo, oslo, norway|https://www.linkedin.com/jobs/view/4152162100
deutsche bank|internship xtrackers etf sales france & mena|paris, île-de-france, france|https://www.linkedin.com/jobs/view/4233152154
stryker|marketing communications intern  for our european trauma & extremities division|leiden, south holland, netherlands|https://www.linkedin.com/jobs/view/4229276644
marriott international|human resources intern|santa eulalia del río, balearic islands, spain|https://www.linkedin.com/jobs/view/4186415689
regiondo|commercial operations intern - m/f/d|munich, bavaria, germany|https://www.linkedin.com/jobs/view/4226363482
awwg|office staff intern - awwg barcelona|barcelona, catalonia, spain|https://www.linkedin.com/jobs/view/4198553809
zentiva|communication intern|warsaw, mazowieckie, poland|https://www.linkedin.com/jobs/view/4208201526
baker hughes|12 month university internship – engineering intern 2025 opportunities (shannon)|shannon, county clare, ireland|https://www.linkedin.com/jobs/view/4041181542
vip district|communication & performance intern|madrid, community of madrid, spain|https://www.linkedin.com/jobs/view/4230013652
bynder|marketing content operations intern|amsterdam, north holland, netherlands|https://www.linkedin.com/jobs/view/4220440082
kraft heinz|hr intern|latina, latium, italy|https://www.linkedin.com/jobs/view/4230622928
crossing borders|some intern - join our multicultural team in copenhagen!|copenhagen, capital region of denmark, denmark|https://www.linkedin.com/jobs/view/4215657926
delta electronics emea|marketing and graphic design intern|hoofddorp, north holland, netherlands|https://www.linkedin.com/jobs/view/4215868417
domes resorts|food & beverage intern - makris athens|athens, attiki, greece|https://www.linkedin.com/jobs/view/4225515841
the estée lauder companies inc.|product marketing intern (m/w/d) aveda|munich, bavaria, germany|https://www.linkedin.com/jobs/view/4226266878
babybjörn ab|regional marketing intern|stockholm, stockholm county, sweden|https://www.linkedin.com/jobs/view/4225172147
pierre fabre laboratories|digital marketing intern (6 months - july - december 2025)|brussels region, belgium|https://www.linkedin.com/jobs/view/4187780259
arup|project and program management stage / intern|milan, lombardy, italy|https://www.linkedin.com/jobs/view/4229844375
the social hub (b corp™)|meeting and events intern|groningen, groningen, netherlands|https://www.linkedin.com/jobs/view/4184847023
infineon technologies|internship: application engineering (f/m/div)|villach, carinthia, austria|https://www.linkedin.com/jobs/view/4040672951
stmicroelectronics|engineer internship: lead quality assessment for innovative android project|graz, styria, austria|https://www.linkedin.com/jobs/view/4150447987
bosch belgium|human resources internship|anderlecht, brussels region, belgium|https://www.linkedin.com/jobs/view/4215370831
deloitte|internship finance - academic year 2025-2026|zaventem, flemish region, belgium|https://www.linkedin.com/jobs/view/4201018637
century 21 benelux|design internship|waterloo, walloon region, belgium|https://www.linkedin.com/jobs/view/4216508634
pwc belgium|school internship in employer branding/events 2025_2026|brussels, brussels region, belgium|https://www.linkedin.com/jobs/view/4229477623
bnp paribas|investment banking analyst internship program - bnp paribas advisory belux|uccle, brussels region, belgium|https://www.linkedin.com/jobs/view/4223493065
veepee|communication & event internship (f/m/x)|brussels, brussels region, belgium|https://www.linkedin.com/jobs/view/4212353091
bosch belgium|internship trade marketing & communication|anderlecht, brussels region, belgium|https://www.linkedin.com/jobs/view/4232146177
chanel|client reception internship - chanel knokke – june to september 2025|brussels, brussels region, belgium|https://www.linkedin.com/jobs/view/4223716962
pepsico|first gen: commercial finance intern 2025|zaventem, flemish region, belgium|https://www.linkedin.com/jobs/view/4229486551
pwc belgium|school internship in data consulting (as of march '26)|brussels, brussels region, belgium|https://www.linkedin.com/jobs/view/4206054540
geopostcodes|content and seo marketing intern - study internship|brussels, brussels region, belgium|https://www.linkedin.com/jobs/view/4206840002
locala|paid internship - account manager - brussels|brussels, brussels region, belgium|https://www.linkedin.com/jobs/view/4225887910
gsk|internship: genai/ai/ml engineers & data scientists/analysts (master, phd, post-doc), belgium – 2025|wavre, walloon region, belgium|https://www.linkedin.com/jobs/view/4148661446
kellanova|customer service  &  logistics intern|zaventem, flemish region, belgium|https://www.linkedin.com/jobs/view/4229421259
bestmix software|internship: dynamics 365 ‘retail & commerce’ module|maldegem, flemish region, belgium|https://www.linkedin.com/jobs/view/3582378829
gsk|internship : cold chain and logistics solutions, global vaccines supply chain, belgium – 2025|wavre, walloon region, belgium|https://www.linkedin.com/jobs/view/4119787401
gsk|internship: process & machinery safety, belgium – 2025|wavre, walloon region, belgium|https://www.linkedin.com/jobs/view/4230072333
nato|nato internship - executive management division|brussels, brussels region, belgium|https://www.linkedin.com/jobs/view/4229015453
mondelēz international|internship mondelez (lu, oreo, côte d'or, milka,...) - consumer & shopper insights (m/f/x) - 6 months - august 2025 - mechelen|mechelen, flemish region, belgium|https://www.linkedin.com/jobs/view/4187459251
nato|nato internship - office of chief information officer (ocio)|brussels, brussels region, belgium|https://www.linkedin.com/jobs/view/4228304937
nato|nato internship - international military staff, nato standardization office|brussels, brussels region, belgium|https://www.linkedin.com/jobs/view/4228308636
boston consulting group (bcg)|visiting associate, internship, belgium|brussels, brussels region, belgium|https://www.linkedin.com/jobs/view/4074892787
sofadex-puratos|internship: hr business partner|groot-bijgaarden, flemish region, belgium|https://www.linkedin.com/jobs/view/4229815577
ey belgium careers|internship in transactions and corporate finance - m&a|machelen, flemish region, belgium|https://www.linkedin.com/jobs/view/4227382466
athora belgium|internal audit internship|brussels, brussels region, belgium|https://www.linkedin.com/jobs/view/4131142833
ey belgium careers|internship accounting & business consultant - antwerpen|antwerp, flemish region, belgium|https://www.linkedin.com/jobs/view/4227303445
scaleup.agency|ai & business analyst / consultant (remote internship)|odense, region of southern denmark, denmark|https://www.linkedin.com/jobs/view/4213472743
ooono|digital marketing intern|copenhagen, capital region of denmark, denmark|https://www.linkedin.com/jobs/view/4224318575
nova founders capital|finance intern|copenhagen, capital region of denmark, denmark|https://www.linkedin.com/jobs/view/4231732679
substant|marketing intern|brejning, region of southern denmark, denmark|https://www.linkedin.com/jobs/view/4223528953
the lego group|internship - r&d processing test center|billund, region of southern denmark, denmark|https://www.linkedin.com/jobs/view/4229002621
