company|title|location|link
west midlands police|rocu student cyber crime intern; student placement|west midlands, england, united kingdom|https://www.linkedin.com/jobs/view/4230037913
ametek|software engineering intern (test automation)|towcester, england, united kingdom|https://www.linkedin.com/jobs/view/4197893102
intune clinic|clinic administration intern|newcastle upon tyne, england, united kingdom|https://www.linkedin.com/jobs/view/4229100735
newmark|assistant surveyor - summer internship - commercial|manchester, england, united kingdom|https://www.linkedin.com/jobs/view/4218087478
amazon|2025 capacity install technician intern|hemel hempstead, england, united kingdom|https://www.linkedin.com/jobs/view/4206576944
pragmatic semiconductor|summer 2025 intern - analog / mixed signal ic design|cambridge, england, united kingdom|https://www.linkedin.com/jobs/view/4213472790
pão de queijo factory|creative intern (photography/filmmaking/marketing)|manchester area, united kingdom|https://www.linkedin.com/jobs/view/4230799779
nokia|6g summer intern engineer|cambridge, england, united kingdom|https://www.linkedin.com/jobs/view/4226094558
blue education|chinese speaking marketing intern_content_work placement|london, england, united kingdom|https://www.linkedin.com/jobs/view/4228343014
nvidia|cpu compiler intern - 2025|cambridge, england, united kingdom|https://www.linkedin.com/jobs/view/4228848987
epredia|electronic engineering intern|runcorn, england, united kingdom|https://www.linkedin.com/jobs/view/4218806507
altera|fpga design intern|marlow, england, united kingdom|https://www.linkedin.com/jobs/view/4146956714
analog devices|fy25 technical sales intern|hayes, england, united kingdom|https://www.linkedin.com/jobs/view/4141669014
united utilities|mechanical engineering summer intern|warrington, england, united kingdom|https://www.linkedin.com/jobs/view/4233105681
synaptics incorporated|intern, digital ic design & verification|cambridge, england, united kingdom|https://www.linkedin.com/jobs/view/4195173870
humanitarian operations|3d animation intern|edinburgh, scotland, united kingdom|https://www.linkedin.com/jobs/view/4204806696
all.space|fpga firmware engineer intern|reading, england, united kingdom|https://www.linkedin.com/jobs/view/4230736249
cnh|eh&s intern|basildon, england, united kingdom|https://www.linkedin.com/jobs/view/4223019323
ge healthcare|ultrasound inside sales specialist intern|chalfont st giles, england, united kingdom|https://www.linkedin.com/jobs/view/4213903698
hamilton specialist referrals|veterinary internship - surgery|high wycombe, england, united kingdom|https://www.linkedin.com/jobs/view/4221344232
humanitarian operations|print production and installation intern|edinburgh, scotland, united kingdom|https://www.linkedin.com/jobs/view/4146376308
open cosmos|ait (assembley, integration & test) intern|harwell, england, united kingdom|https://www.linkedin.com/jobs/view/4228997808
alef online academy|b2c sales intern (polish proficiency & commission-based)|united kingdom|https://www.linkedin.com/jobs/view/4220449249
dassault systèmes|industry process consultant intern/ emag low frequency intern|warwick, england, united kingdom|https://www.linkedin.com/jobs/view/4227030706
vets now|veterinary internship - surgery|manchester, england, united kingdom|https://www.linkedin.com/jobs/view/4221348479
vet record careers|veterinary internship - anaesthesia|high wycombe, england, united kingdom|https://www.linkedin.com/jobs/view/4209533475
vets now|veterinary internship - surgery|glasgow, scotland, united kingdom|https://www.linkedin.com/jobs/view/4221347266
city explorer - live streaming hub|live video streamer internship|london area, united kingdom|https://www.linkedin.com/jobs/view/4223425684
city explorer - live streaming hub|live video streamer internship|london area, united kingdom|https://www.linkedin.com/jobs/view/4232157577
vets now|veterinary internship - diagnostic imaging|glasgow, scotland, united kingdom|https://www.linkedin.com/jobs/view/4221341970
macquarie group|dutch speaking off-cycle internship  infrastructure and energy capital|london, england, united kingdom|https://www.linkedin.com/jobs/view/4225661566
retail insights|danish speaker intern|london, england, united kingdom|https://www.linkedin.com/jobs/view/4068284806
linnaeus|veterinary surgical intern|stockton-on-tees, england, united kingdom|https://www.linkedin.com/jobs/view/4220975976
nova founders capital|global internship program at nova founders|london, england, united kingdom|https://www.linkedin.com/jobs/view/4068067365
the lego group|digital product design intern|london, england, united kingdom|https://www.linkedin.com/jobs/view/4230838443
ex venture inc.|business consulting internship in bali|london, england, united kingdom|https://www.linkedin.com/jobs/view/4189585320
ardian jobs & internships|investor relations intern - may 2025  london|london, england, united kingdom|https://www.linkedin.com/jobs/view/4145289975
slb|hr intern|reading, england, united kingdom|https://www.linkedin.com/jobs/view/4197976018
scb group|graduate internship opportunity - london|london, england, united kingdom|https://www.linkedin.com/jobs/view/4089946592
paypal|smb strategy intern|london, england, united kingdom|https://www.linkedin.com/jobs/view/4201282088
zero100|research data internship|london, england, united kingdom|https://www.linkedin.com/jobs/view/4229805185
loro piana|retail operations - intern|london, england, united kingdom|https://www.linkedin.com/jobs/view/4223815746
l'oréal|talent acquisition resourcer summer internship 2025|london, england, united kingdom|https://www.linkedin.com/jobs/view/4227684061
slb|hr intern|leeds, england, united kingdom|https://www.linkedin.com/jobs/view/4197974303
mediobanca|m&a fig internship - london  fluent in french|london, england, united kingdom|https://www.linkedin.com/jobs/view/4132547257
montblanc|retail coordinator intern (12 month ftc)|london, england, united kingdom|https://www.linkedin.com/jobs/view/4225306285
tencent|data product intern, gaming|london area, united kingdom|https://www.linkedin.com/jobs/view/4230265433
slb|compensation and benefits analyst intern|london area, united kingdom|https://www.linkedin.com/jobs/view/4227333745
honor|copywriting intern|london area, united kingdom|https://www.linkedin.com/jobs/view/4192087422
hp|computer security research intern|bristol, england, united kingdom|https://www.linkedin.com/jobs/view/4105049801
ddb remedy london|intern associate writer|london, england, united kingdom|https://www.linkedin.com/jobs/view/4227618451
franklyn's forum|pr and talent manager intern|london area, united kingdom|https://www.linkedin.com/jobs/view/4230723068
coty|industrial chemist intern|ashford, england, united kingdom|https://www.linkedin.com/jobs/view/4193267499
bt group|corporate affairs intern|london, england, united kingdom|https://www.linkedin.com/jobs/view/4230872367
biomérieux|hr graduate intern uk& ireland|basingstoke, england, united kingdom|https://www.linkedin.com/jobs/view/4221372677
delicious agency|intern assistant|london, england, united kingdom|https://www.linkedin.com/jobs/view/4212311694
nvidia|networking architecture intern, security research – summer 2025|united kingdom|https://www.linkedin.com/jobs/view/4214154246
targetjobs uk|actuarial intern|london, england, united kingdom|https://www.linkedin.com/jobs/view/4228794253
siemens healthineers|hr intern - total rewards placement|camberley, england, united kingdom|https://www.linkedin.com/jobs/view/4197572221
hanover communications|intern  sport communications  london|london, england, united kingdom|https://www.linkedin.com/jobs/view/4230749494
indie campers|international ops internship - manchester|greater manchester, england, united kingdom|https://www.linkedin.com/jobs/view/4085726387
keyrock|trading operations specialist (6 months internship)|city of london, england, united kingdom|https://www.linkedin.com/jobs/view/4228336751
living optics|internship living optics - business administration|milton, england, united kingdom|https://www.linkedin.com/jobs/view/4222327089
hays|recruiting intern|leicester, england, united kingdom|https://www.linkedin.com/jobs/view/4226306637
fitzpatrick referrals|surgical internship|godalming, england, united kingdom|https://www.linkedin.com/jobs/view/4208461289
ryan|summer tax technology internship|london, england, united kingdom|https://www.linkedin.com/jobs/view/4226355108
insurtech insights|entrepreneur in residence intern (spanish speaker) insurtech insights|london, england, united kingdom|https://www.linkedin.com/jobs/view/4068286428
convatec|sustainability summer internship programme – sterilisation|deeside, wales, united kingdom|https://www.linkedin.com/jobs/view/4211911963
ipc systems|customer success intern|london, england, united kingdom|https://www.linkedin.com/jobs/view/4192448071
dataannotation|graduate research intern|united kingdom|https://www.linkedin.com/jobs/view/4222356964
bending spoons|hiring management intern|oxford, england, united kingdom|https://www.linkedin.com/jobs/view/4230288417
signify|intern - manufacturing general management|cwmbrân, wales, united kingdom|https://www.linkedin.com/jobs/view/4211747195
charles taylor|summer internship - assistance support case manager|portsmouth, england, united kingdom|https://www.linkedin.com/jobs/view/4222494597
indie campers|international ops internship - bristol|bristol, england, united kingdom|https://www.linkedin.com/jobs/view/4230978742
dataannotation|graduate research intern|bradford, england, united kingdom|https://www.linkedin.com/jobs/view/4222358836
take-two interactive|uk tax and treasury intern|london, england, united kingdom|https://www.linkedin.com/jobs/view/4118683877
private equity insights|entrepreneur in residence intern (italian speaker) private equity insights|london, england, united kingdom|https://www.linkedin.com/jobs/view/3804393173
dataannotation|graduate research intern, chemistry - ai trainer|wolverhampton, england, united kingdom|https://www.linkedin.com/jobs/view/4196997479
dataannotation|graduate research intern, chemistry - ai trainer|west bromwich, england, united kingdom|https://www.linkedin.com/jobs/view/4216019833
bending spoons|hiring management intern|cambridge, england, united kingdom|https://www.linkedin.com/jobs/view/4230287446
dataannotation|graduate research intern, chemistry - ai trainer|aberdeen, scotland, united kingdom|https://www.linkedin.com/jobs/view/4196996600
dataannotation|graduate research intern chemistry - ai trainer|leeds, england, united kingdom|https://www.linkedin.com/jobs/view/4196998486
insurtech insights|entrepreneur in residence intern (french speaker) insurtech insights|london, england, united kingdom|https://www.linkedin.com/jobs/view/4068284887
wolters kluwer|corporate strategy mba summer internship|london, england, united kingdom|https://www.linkedin.com/jobs/view/4220565243
overcome|clinical psychology intern|united kingdom|https://www.linkedin.com/jobs/view/4081883541
huawei technologies research & development (uk) ltd|intern for computing architecture (contractor)|cambridge, england, united kingdom|https://www.linkedin.com/jobs/view/3820050447
private equity insights|entrepreneur in residence intern (german speaker) private equity insights|london, england, united kingdom|https://www.linkedin.com/jobs/view/4068286116
private equity insights|entrepreneur in residence intern (scandinavian speaker) private equity insights|london, england, united kingdom|https://www.linkedin.com/jobs/view/4068281679
retail insights|entrepreneur in residence intern (italian speaker) retail insights|london, england, united kingdom|https://www.linkedin.com/jobs/view/4068281890
cfo insights|entrepreneur in residence intern (italian speaker) cfo insights|london, england, united kingdom|https://www.linkedin.com/jobs/view/4068286084
cfo insights|entrepreneur in residence intern (german speaker) cfo insights|london, england, united kingdom|https://www.linkedin.com/jobs/view/4068288181
targetjobs uk|veterinary internship - internal medicine|derby, england, united kingdom|https://www.linkedin.com/jobs/view/4222632987
usertesting|panel operations intern|edinburgh, scotland, united kingdom|https://www.linkedin.com/jobs/view/4227180821
retail insights|entrepreneur in residence intern (german speaker) retail insights|london, england, united kingdom|https://www.linkedin.com/jobs/view/4070535161
cfo insights|entrepreneur in residence intern (scandinavian speaker) cfo insights|london, england, united kingdom|https://www.linkedin.com/jobs/view/4068289021
medivet|veterinary internship|godstone, england, united kingdom|https://www.linkedin.com/jobs/view/4230829816
insurtech insights|entrepreneur in residence intern (scandinavian speaker) insurtech insights|london, england, united kingdom|https://www.linkedin.com/jobs/view/4068285538
global maritime|intern - one year placement (naval architect)|london area, united kingdom|https://www.linkedin.com/jobs/view/4223754919
insurtech insights|entrepreneur in residence intern (danish speaker) insurtech insights|london, england, united kingdom|https://www.linkedin.com/jobs/view/4068285636
tietalent|graduate nurse and registered nurse operating room internship (opportunities at all campuses)|easton, england, united kingdom|https://www.linkedin.com/jobs/view/4219617377
tietalent|graduate nurse, acute care (med surg) internship, opportunities at all campuses (full time)|easton, england, united kingdom|https://www.linkedin.com/jobs/view/4219616504
setsales|entrepreneur in residence intern (danish speaker) setsales|london, england, united kingdom|https://www.linkedin.com/jobs/view/4068286184
pride veterinary referrals|veterinary internship - internal medicine|derby, england, united kingdom|https://www.linkedin.com/jobs/view/4221333597
iff|marketing intern|aarhus, central denmark region, denmark|https://www.linkedin.com/jobs/view/4228922060
stibo systems|intern, employer branding and hr|aarhus, central denmark region, denmark|https://www.linkedin.com/jobs/view/4214573695
arla foods|internship, data governance - aarhus|aarhus municipality, central denmark region, denmark|https://www.linkedin.com/jobs/view/4220585368
terma group|intern for supply chain and business process management, lystrup|aarhus municipality, central denmark region, denmark|https://www.linkedin.com/jobs/view/4195124491
scr|intern konsulent - ax2012 r3|aarhus, central denmark region, denmark|https://www.linkedin.com/jobs/view/4229821369
unilever|ice cream: customer development internship – e-commerce growth strategy|amsterdam, north holland, netherlands|https://www.linkedin.com/jobs/view/4230718120
gisou by negin mirsalehi|internship: social content|amsterdam, north holland, netherlands|https://www.linkedin.com/jobs/view/4222852753
colgate-palmolive|digital content marketing intern|amsterdam, north holland, netherlands|https://www.linkedin.com/jobs/view/4222353352
toms|marketing intern - emea|amsterdam, north holland, netherlands|https://www.linkedin.com/jobs/view/4217405470
danone|internship (supply chain): activity & projects management|hoofddorp, north holland, netherlands|https://www.linkedin.com/jobs/view/4205038910
waldorf astoria amsterdam|finance intern|amsterdam, north holland, netherlands|https://www.linkedin.com/jobs/view/4209563063
the heineken company|internship - global sales - route to consumer|amsterdam, north holland, netherlands|https://www.linkedin.com/jobs/view/4230751382
kraft heinz|finance internship|amsterdam, north holland, netherlands|https://www.linkedin.com/jobs/view/4215849528
goodkarma agency|social media marketing intern|amsterdam, north holland, netherlands|https://www.linkedin.com/jobs/view/4226887530
samsung electronics|internship display|schiphol, north holland, netherlands|https://www.linkedin.com/jobs/view/4228948566
pepsico|first gen: food brand marketing intern 2025|utrecht, utrecht, netherlands|https://www.linkedin.com/jobs/view/4220089650
parfumado|social media & creative content intern|amsterdam, north holland, netherlands|https://www.linkedin.com/jobs/view/4209818304
g-star|intern paid search|amsterdam, north holland, netherlands|https://www.linkedin.com/jobs/view/4219818621
ofi|internship ofi cocoa - branding and marketing (amsterdam)|amsterdam, north holland, netherlands|https://www.linkedin.com/jobs/view/4207343321
shiseido|digital intern|schiphol, north holland, netherlands|https://www.linkedin.com/jobs/view/4195442533
g-star|intern product development|amsterdam, north holland, netherlands|https://www.linkedin.com/jobs/view/4219170067
pepsico|first gen: food brand marketing intern 2025|utrecht, utrecht, netherlands|https://www.linkedin.com/jobs/view/4217891575
tata consultancy services|sales intern|amsterdam, north holland, netherlands|https://www.linkedin.com/jobs/view/4213339218
click crew media|performance advertising intern|amsterdam, north holland, netherlands|https://www.linkedin.com/jobs/view/4153881495
tubble|e-commerce marketing intern|amsterdam, north holland, netherlands|https://www.linkedin.com/jobs/view/4230023690
pepsico|first gen: digital marketing / media intern 2025|utrecht, utrecht, netherlands|https://www.linkedin.com/jobs/view/4215117249
bol|internship design (visual, branding & interaction)|utrecht, utrecht, netherlands|https://www.linkedin.com/jobs/view/4221329557
renault group|finance intern|schiphol-rijk, north holland, netherlands|https://www.linkedin.com/jobs/view/4216336598
scotch & soda|fashion design intern|amsterdam, north holland, netherlands|https://www.linkedin.com/jobs/view/4219498165
publicis groupe nl|intern pr & influence (nl)|amsterdam, north holland, netherlands|https://www.linkedin.com/jobs/view/4205983999
pepsico|first gen: shopper marketing intern 2025|utrecht, utrecht, netherlands|https://www.linkedin.com/jobs/view/4219535030
bissell homecare, inc.|training and development intern|amsterdam, north holland, netherlands|https://www.linkedin.com/jobs/view/4223721545
dopper|intern social media & content creation|haarlem, north holland, netherlands|https://www.linkedin.com/jobs/view/4229022838
swissôtel amsterdam|finance and front office intern|amsterdam, north holland, netherlands|https://www.linkedin.com/jobs/view/3816145304
redefine meat|brand marketing intern|utrecht, utrecht, netherlands|https://www.linkedin.com/jobs/view/4224389827
virtuagym|performance marketing intern|amsterdam, north holland, netherlands|https://www.linkedin.com/jobs/view/4158623528
24cars|social media marketing intern|amsterdam, north holland, netherlands|https://www.linkedin.com/jobs/view/4216510556
beiersdorf|intern digital marketing (all genders)|amsterdam, north holland, netherlands|https://www.linkedin.com/jobs/view/4129435618
sofitel legend the grand amsterdam|front office intern|amsterdam, north holland, netherlands|https://www.linkedin.com/jobs/view/4211399628
bridgestone mobility solutions|product marketing intern|amsterdam, north holland, netherlands|https://www.linkedin.com/jobs/view/4175820954
juridische faculteitsvereniging groningen|internationale student-stage notariaat|amsterdam, north holland, netherlands|https://www.linkedin.com/jobs/view/4197059006
wondr experience|dynamic marketing internship|amsterdam, north holland, netherlands|https://www.linkedin.com/jobs/view/4218732593
assurant|intern - human resources (paid)|amsterdam, north holland, netherlands|https://www.linkedin.com/jobs/view/4116595997
leonardo hotels benelux|marketing intern|amsterdam, north holland, netherlands|https://www.linkedin.com/jobs/view/4230792770
on a daily basis|business development intern|amsterdam, north holland, netherlands|https://www.linkedin.com/jobs/view/4144191003
kraft heinz|marketing artwork intern|amsterdam, north holland, netherlands|https://www.linkedin.com/jobs/view/4220567415
utrechtinc|marketing intern|utrecht, utrecht, netherlands|https://www.linkedin.com/jobs/view/4225398877
iknowhow sa|hr payroll intern (internship grant needed)|filothei-psychiko, attiki, greece|https://www.linkedin.com/jobs/view/4225985350
signal|shipping operations intern|athens, attiki, greece|https://www.linkedin.com/jobs/view/4225539494
cepal hellas financial services s.a.|join cepal as an intern|athens, attiki, greece|https://www.linkedin.com/jobs/view/4225539978
pet city group sa|e-comm content intern|metamorfosi, attiki, greece|https://www.linkedin.com/jobs/view/4224336595
tesla|software engineering internship|athens, attiki, greece|https://www.linkedin.com/jobs/view/4131674106
alumil|sales engineering intern|akharnaí, attiki, greece|https://www.linkedin.com/jobs/view/4224308654
bat|hr intern|athens, attiki, greece|https://www.linkedin.com/jobs/view/4223688697
nokia|hr intern|athens, attiki, greece|https://www.linkedin.com/jobs/view/4221190689
indie campers|international ops internship - athens|athens, attiki, greece|https://www.linkedin.com/jobs/view/4174163750
guidepoint|talent acquisition intern|athens, attiki, greece|https://www.linkedin.com/jobs/view/4231713888
altair|technical writer intern - greece|athens, attiki, greece|https://www.linkedin.com/jobs/view/4099788330
domes resorts|chef intern - makris athens|athens, attiki, greece|https://www.linkedin.com/jobs/view/4230493818
hyde johannesburg rosebank|finance intern|barcelona, catalonia, spain|https://www.linkedin.com/jobs/view/4136679727
ihg hotels & resorts|finance internship - kimpton vividora barcelona|barcelona, catalonia, spain|https://www.linkedin.com/jobs/view/4223056286
hyde johannesburg rosebank|it intern|barcelona, catalonia, spain|https://www.linkedin.com/jobs/view/4136682528
marriott international|university intern-europe|barcelona, catalonia, spain|https://www.linkedin.com/jobs/view/4190991375
hyde johannesburg rosebank|engineering intern|barcelona, catalonia, spain|https://www.linkedin.com/jobs/view/4136683444
livo|hr quality intern|barcelona, catalonia, spain|https://www.linkedin.com/jobs/view/4220512629
netenders|legal intern|barcelona, catalonia, spain|https://www.linkedin.com/jobs/view/4224846955
kering eyewear|kering eyewear trade marketing intern|barcelona, catalonia, spain|https://www.linkedin.com/jobs/view/4222340085
hyde johannesburg rosebank|food & beverage operational intern|barcelona, catalonia, spain|https://www.linkedin.com/jobs/view/4136684385
grupo freixenet|internship program|sant sadurní d'anoia, catalonia, spain|https://www.linkedin.com/jobs/view/3864216459
mango|fashion design intern talent pool|palau-solità i plegamans, catalonia, spain|https://www.linkedin.com/jobs/view/4202634796
spain internship|paid 300€ visual design internship in barcelona, spain|barcelona, catalonia, spain|https://www.linkedin.com/jobs/view/4061490600
sls hotels|it intern|barcelona, catalonia, spain|https://www.linkedin.com/jobs/view/4151966684
spain internship|paid 400€/month marketing and adminstration internship in barcelona, spain|barcelona, catalonia, spain|https://www.linkedin.com/jobs/view/4061490483
spain internship|e-marketing and web content internship in barcelona, spain|barcelona, catalonia, spain|https://www.linkedin.com/jobs/view/4061491251
spain internship|designer intern in barcelona|barcelona, catalonia, spain|https://www.linkedin.com/jobs/view/4061486490
bitpanda|intern, business it|barcelona, catalonia, spain|https://www.linkedin.com/jobs/view/4219602424
kering eyewear|kering eyewear finance intern|barcelona, catalonia, spain|https://www.linkedin.com/jobs/view/4228327449
roche|graduate intern - regulatory affairs|sant cugat del vallès, catalonia, spain|https://www.linkedin.com/jobs/view/4232326123
street child|french fundraising intern|barcelona, catalonia, spain|https://www.linkedin.com/jobs/view/4225520641
amenitiz|revops intern (crm)|barcelona, catalonia, spain|https://www.linkedin.com/jobs/view/4225197928
the hoxton|f&b intern|barcelona, catalonia, spain|https://www.linkedin.com/jobs/view/4229149422
street child|italian fundraising intern|barcelona, catalonia, spain|https://www.linkedin.com/jobs/view/4225518935
louis vuitton|internship · proyectos nuevos productos (h/m)|barberà del vallès, catalonia, spain|https://www.linkedin.com/jobs/view/4217420018
catalonia hotels & resorts|expansion department internship|barcelona, catalonia, spain|https://www.linkedin.com/jobs/view/4228281973
henkel|intern sales - supermarkets|barcelona, catalonia, spain|https://www.linkedin.com/jobs/view/4207835470
danone|global talent attraction intern|barcelona, catalonia, spain|https://www.linkedin.com/jobs/view/4219653505
mango|intern planner - kids|palau-solità i plegamans, catalonia, spain|https://www.linkedin.com/jobs/view/4205700710
spain internship|paid 250€/month kindergarten internship in barcelona, spain|barcelona, catalonia, spain|https://www.linkedin.com/jobs/view/4061491570
marriott international|university intern-europe|barcelona, catalonia, spain|https://www.linkedin.com/jobs/view/4216802035
danone|financial controlling intern|barcelona, catalonia, spain|https://www.linkedin.com/jobs/view/4214299998
marriott international|university intern-europe|barcelona, catalonia, spain|https://www.linkedin.com/jobs/view/4190991390
spain internship|part-time paid online marketing internship in barcelona|barcelona, catalonia, spain|https://www.linkedin.com/jobs/view/4061492626
marriott international|university intern-europe|barcelona, catalonia, spain|https://www.linkedin.com/jobs/view/4216494989
marriott international|university intern-europe|barcelona, catalonia, spain|https://www.linkedin.com/jobs/view/4190994126
spain internship|paid 200 €/month kindergarten internship in barcelona, spain|barcelona, catalonia, spain|https://www.linkedin.com/jobs/view/4061491907
auroralearning|community manager internship|barcelona, catalonia, spain|https://www.linkedin.com/jobs/view/4218044809
europastry|#beyou program - raw materials intern|sant cugat del vallès, catalonia, spain|https://www.linkedin.com/jobs/view/4208431105
