company|title|location|link
microsoft|security researcher intern, microsoft threat intelligence center – internship opportunity|cheltenham, england, united kingdom|https://www.linkedin.com/jobs/view/4231322500
parfums christian dior|marketing intern switzerland & austria (m/w/d) vollzeit, in wien|vienna, vienna, austria|https://www.linkedin.com/jobs/view/4219149601
parfums christian dior|marketing intern switzerland & austria (m/w/d)|vienna, austria|https://www.linkedin.com/jobs/view/4217850489
procter & gamble|strategic finance internship (m/f/d)|vienna, vienna, austria|https://www.linkedin.com/jobs/view/4204920769
lime|operations and business development intern - austria|innere stadt, vienna, austria|https://www.linkedin.com/jobs/view/4208862422
procter & gamble|sales internship (m/f/d)|vienna, vienna, austria|https://www.linkedin.com/jobs/view/4204923430
international cultural diversity organization (icdo)|social and digital media intern|innere stadt, vienna, austria|https://www.linkedin.com/jobs/view/4185914195
red bull|internship student & field marketing|fuschl am see, salzburg, austria|https://www.linkedin.com/jobs/view/4232790933
enery|m&a intern (vienna, austria) (f/m/d)|vienna, vienna, austria|https://www.linkedin.com/jobs/view/4076661230
comprehensive nuclear-test-ban treaty organization - ctbto|internship - budget and finance section|vienna, vienna, austria|https://www.linkedin.com/jobs/view/4228365365
nuki home solutions gmbh|internships (f/m/d)|graz, styria, austria|https://www.linkedin.com/jobs/view/4195693422
join|happy fido gmbh: marketing & content creation internship at happy fido|austria|https://www.linkedin.com/jobs/view/4219257113
alpla group|intern change management and organizational development (all gender)|hard, vorarlberg, austria|https://www.linkedin.com/jobs/view/4184377643
vertrieb für die zukunft|impact intern sales & marketing|vienna, vienna, austria|https://www.linkedin.com/jobs/view/4229471782
blue tomato gmbh|internship newsletter & onsite marketing (m/w/d)|graz, styria, austria|https://www.linkedin.com/jobs/view/4152781108
palfinger north america|description: professional internship application engineering (f/m/d)|salzburg, salzburg, austria|https://www.linkedin.com/jobs/view/4223000106
inverto  a bcg company|data & insights consulting intern in procurement / supply chain management (f/m/d)|vienna, vienna, austria|https://www.linkedin.com/jobs/view/4141971680
ge healthcare|internship - marketing social media|vöcklamarkt, upper austria, austria|https://www.linkedin.com/jobs/view/4232964511
dynatrace|intern people operations (m/f/x)|linz, upper austria, austria|https://www.linkedin.com/jobs/view/4226403914
red bull|internship general sports events|elsbethen, salzburg, austria|https://www.linkedin.com/jobs/view/4231516319
red bull|internship podcast & story research|elsbethen, salzburg, austria|https://www.linkedin.com/jobs/view/4225309049
international atomic energy agency (iaea)|internship - na-naca-communication support|innere stadt, vienna, austria|https://www.linkedin.com/jobs/view/4227504155
christian dior couture|retail intern (m/w/d), vienna|vienna, vienna, austria|https://www.linkedin.com/jobs/view/4218759985
international atomic energy agency (iaea)|internship - infrastructure development|innere stadt, vienna, austria|https://www.linkedin.com/jobs/view/4223565507
inoqo|food & agriculture research intern - student in austria|vienna, vienna, austria|https://www.linkedin.com/jobs/view/4106581420
austrian airlines|internship flight operations (all genders)|vienna, vienna, austria|https://www.linkedin.com/jobs/view/4208689355
kommunalkredit|internship - m&a and debt advisory|vienna, vienna, austria|https://www.linkedin.com/jobs/view/4216567434
hirschmann automotive|young talents: internships & final theses (m/f/d)|rankweil, vorarlberg, austria|https://www.linkedin.com/jobs/view/3994719433
dxc technology|software development - intern|linz, upper austria, austria|https://www.linkedin.com/jobs/view/4227127115
octapharma austria|fh-intern for the r&d innovative technologies department (m/w/d)|vienna, vienna, austria|https://www.linkedin.com/jobs/view/4188159826
stmicroelectronics|nfc software application engineer (summer internship)|graz, styria, austria|https://www.linkedin.com/jobs/view/4150451672
infineon technologies|internship: statistics (f/m/div)|graz, styria, austria|https://www.linkedin.com/jobs/view/4182956834
aldi süd holding|intern - human rights (f/m/d)|salzburg, salzburg, austria|https://www.linkedin.com/jobs/view/4219134108
raiffeisen bank international ag|studentenjob (w/m/x) - institutional business international (20-25h/woche)|vienna, vienna, austria|https://www.linkedin.com/jobs/view/4207713540
the social hub (b corp™)|coworking intern|vienna, vienna, austria|https://www.linkedin.com/jobs/view/4209879505
greiner|intern it strategy support (all genders)|vienna, vienna, austria|https://www.linkedin.com/jobs/view/4227987840
thermo fisher scientific|r&d intern|vienna, vienna, austria|https://www.linkedin.com/jobs/view/4217338053
lomography|marketing volontariat austria, germany & switzerland (m/f/x - internship)|vienna, vienna, austria|https://www.linkedin.com/jobs/view/4232929193
aldi süd holding|intern supplier onboarding & contracting (f/m/d)|wals-siezenheim, salzburg, austria|https://www.linkedin.com/jobs/view/4194097328
ait austrian institute of technology|internship "6g broadband radio channel measurement system"|vienna, vienna, austria|https://www.linkedin.com/jobs/view/4118237803
austrian airlines|internship technical purchasing (all genders)|innere stadt, vienna, austria|https://www.linkedin.com/jobs/view/4229483841
uniqa insurance group|intern health & life strategy (m/w/d) (befristet für 6 monate)|vienna, vienna, austria|https://www.linkedin.com/jobs/view/4204032070
uniqa insurance group|intern inhouse consulting / strategy (m/w/d) (befristet für 6 monate)|vienna, vienna, austria|https://www.linkedin.com/jobs/view/4227671352
infineon technologies|internship: embedded system programmer (w/m/div)*|villach, carinthia, austria|https://www.linkedin.com/jobs/view/4144425402
infineon technologies|internship: web development to support component validation activities (f/m/div)|villach, carinthia, austria|https://www.linkedin.com/jobs/view/4040677383
skidata|firmware & data integration intern|grödig, salzburg, austria|https://www.linkedin.com/jobs/view/4228932472
huawei|power electronics/magnetic simulation intern (m/f/d) for at least 6 months|vienna, vienna, austria|https://www.linkedin.com/jobs/view/4186467786
innio group|internship - project manager validation (m/f/d)|jenbach, tyrol, austria|https://www.linkedin.com/jobs/view/4218874410
infineon technologies|internship: analog ic design engineer for programmatic ic design approach (f/m/div)|villach, carinthia, austria|https://www.linkedin.com/jobs/view/4189493922
infineon technologies|internship: design and verification of hw board solutions (f/m/div)|graz, styria, austria|https://www.linkedin.com/jobs/view/4058384238
innio group|internship in sourcing (m/f/d)|jenbach, tyrol, austria|https://www.linkedin.com/jobs/view/4229599888
philip morris international|retail merchandising and infrastructure intern (m/f/d)|vienna, vienna, austria|https://www.linkedin.com/jobs/view/4204772770
infineon technologies|internship: high speed and rf lab validation engineer in development center villach (f/m/div)|villach, carinthia, austria|https://www.linkedin.com/jobs/view/4040674594
crh|internal sales / order processing (mwd) - leviat|vienna, vienna, austria|https://www.linkedin.com/jobs/view/4217328016
red bull|internship knowledge management|elsbethen, salzburg, austria|https://www.linkedin.com/jobs/view/4224550309
indie campers|international ops internship - vienna|vienna, vienna, austria|https://www.linkedin.com/jobs/view/4223987000
international atomic energy agency (iaea)|internship - research and applications with particle accelerators|innere stadt, vienna, austria|https://www.linkedin.com/jobs/view/4225697089
join|hewlett packard enterprise (hpe): intern technical consulting (f/m/d)|vienna, vienna, austria|https://www.linkedin.com/jobs/view/4213961698
coca-cola europacific partners|internship - marketing shopper|anderlecht, brussels region, belgium|https://www.linkedin.com/jobs/view/4214744994
coca-cola europacific partners|internship - commercial development|anderlecht, brussels region, belgium|https://www.linkedin.com/jobs/view/4212957784
microsoft|government affairs internship opportunities (event and business operations)|brussels region, belgium|https://www.linkedin.com/jobs/view/4224313218
beiersdorf|brand management internship - eucerin|brussels, brussels region, belgium|https://www.linkedin.com/jobs/view/4203603931
l'oréal|internship marketing (paid) - august 2025|brussels, brussels region, belgium|https://www.linkedin.com/jobs/view/4162681569
l'oréal|internship finance (paid) - august 2025|brussels, brussels region, belgium|https://www.linkedin.com/jobs/view/4162677938
ing belgium|internship esg reporting|brussels, brussels region, belgium|https://www.linkedin.com/jobs/view/4221649674
nestlé|supply chain intern - nespresso|brussels, brussels region, belgium|https://www.linkedin.com/jobs/view/4219034930
nato|nato internship - public diplomacy division (pdd)|brussels, brussels region, belgium|https://www.linkedin.com/jobs/view/4229011799
procter & gamble|supply chain & manufacturing intern|brussels, brussels region, belgium|https://www.linkedin.com/jobs/view/4204925048
agilytic|marketing intern|brussels, brussels region, belgium|https://www.linkedin.com/jobs/view/4226114809
beiersdorf|marketing category management internship - nivea|brussels, brussels region, belgium|https://www.linkedin.com/jobs/view/4200092684
marriott international|front office intern - renaissance brussels hotel|uccle, brussels region, belgium|https://www.linkedin.com/jobs/view/4227698410
gimber|finance internship|belgium|https://www.linkedin.com/jobs/view/3963346855
bayer|internships|diegem, flemish region, belgium|https://www.linkedin.com/jobs/view/4205040024
agilytic|business development intern|brussels, brussels region, belgium|https://www.linkedin.com/jobs/view/4226120039
nestlé|digital marketing intern - nescafé dolce gusto|brussels, brussels region, belgium|https://www.linkedin.com/jobs/view/4197449807
wwf-belgium|accounting intern|brussels, brussels region, belgium|https://www.linkedin.com/jobs/view/4208187972
pepsico|first gen: corporate communications intern 2025|zaventem, flemish region, belgium|https://www.linkedin.com/jobs/view/4214725216
digi belgium|legal intern|brussels, brussels region, belgium|https://www.linkedin.com/jobs/view/4204023324
louis vuitton|accounting intern|brussels, brussels region, belgium|https://www.linkedin.com/jobs/view/4230973775
easyfairs|group strategy and m&a intern|brussels, brussels region, belgium|https://www.linkedin.com/jobs/view/4015070707
qover|b2b social media intern|brussels, brussels region, belgium|https://www.linkedin.com/jobs/view/4226355464
iba|internship|louvain-la-neuve, walloon region, belgium|https://www.linkedin.com/jobs/view/4208979036
izycoffee|operations & launch management: intern|ghent, flemish region, belgium|https://www.linkedin.com/jobs/view/4214387892
the estée lauder companies inc.|brand marketing- school internship|diegem, flemish region, belgium|https://www.linkedin.com/jobs/view/4105442511
accurat.ai|internship - marketing|ghent, flemish region, belgium|https://www.linkedin.com/jobs/view/4127170754
wemanity belgium|event & communication intern|brussels, brussels region, belgium|https://www.linkedin.com/jobs/view/4230580875
sabca|internship programs|brussels, brussels region, belgium|https://www.linkedin.com/jobs/view/4131165824
intersystems|marketing intern|vilvoorde, flemish region, belgium|https://www.linkedin.com/jobs/view/4204799938
lizy|marketing content intern nl|hôpital etterbeek-ixelles, brussels region, belgium|https://www.linkedin.com/jobs/view/4200204496
newport tank containers|internship|duisburg, flemish region, belgium|https://www.linkedin.com/jobs/view/4185912037
veepee|marketing intern|vorst, brussels region, belgium|https://www.linkedin.com/jobs/view/4222668939
veepee|b2b marketing internship (f/m/x)|brussels, brussels region, belgium|https://www.linkedin.com/jobs/view/4162627602
obelis group|accounting internship|brussels, brussels region, belgium|https://www.linkedin.com/jobs/view/4227330541
ntt data, inc.|intern business development representatitive|diegem, flemish region, belgium|https://www.linkedin.com/jobs/view/4205739757
european food information council (eufic)|business development intern|brussels region, belgium|https://www.linkedin.com/jobs/view/4230802609
toyota motor europe|r&d intern - circular economy – technology strategy planning|zaventem, flemish region, belgium|https://www.linkedin.com/jobs/view/4208046057
easyfairs|product development intern|brussels, brussels region, belgium|https://www.linkedin.com/jobs/view/4205813165
edgard & cooper   b corp|marketing intern 2025|kortrijk, flemish region, belgium|https://www.linkedin.com/jobs/view/4199360246
easyfairs|group strategy & business development intern|brussels, brussels region, belgium|https://www.linkedin.com/jobs/view/4229123497
devnation|business development intern - stagiaire en développement commercial - stage étudiant(e)|brussels, brussels region, belgium|https://www.linkedin.com/jobs/view/4228241691
radisson hotel group|meeting & events operations intern|brussels, brussels region, belgium|https://www.linkedin.com/jobs/view/4204584316
deliveroo|operations intern - account management|le faubourg de bruxelles, walloon region, belgium|https://www.linkedin.com/jobs/view/4220976851
toyota motor europe|cad styling modeller intern|zaventem, flemish region, belgium|https://www.linkedin.com/jobs/view/4213604140
ab inbev|communications and corporate brand intern|leuven, flemish region, belgium|https://www.linkedin.com/jobs/view/4121150600
too good to go|sales hero internship - french speaking (sept 2025 - wallonie)|brussels, brussels region, belgium|https://www.linkedin.com/jobs/view/4212078700
luminus|finance data & automation intern|brussels, brussels region, belgium|https://www.linkedin.com/jobs/view/4226399309
radisson hotel group|f&b intern (breakfast)|brussels, brussels region, belgium|https://www.linkedin.com/jobs/view/4204581912
zf group|internship at zf wind power - digitalization (m/f/d) in antwerp and lommel (belgium)|antwerp, flemish region, belgium|https://www.linkedin.com/jobs/view/4229451477
toyota motor europe|internship vehicle body structure optimisation using ai/ml for crash safety performance|zaventem, flemish region, belgium|https://www.linkedin.com/jobs/view/4228312332
jan de nul group|internship in electromechanics|hofstade, flemish region, belgium|https://www.linkedin.com/jobs/view/4089903914
nesto|chirurgisch internship|herentals, flemish region, belgium|https://www.linkedin.com/jobs/view/4225978907
ing belgium|ing capital markets & advisory internship program|brussels, brussels region, belgium|https://www.linkedin.com/jobs/view/4207422658
coca-cola europacific partners|internship - commercial operations|anderlecht, brussels region, belgium|https://www.linkedin.com/jobs/view/4219131646
louis vuitton|retail performance & data analytics intern|brussels, brussels region, belgium|https://www.linkedin.com/jobs/view/4223477355
unilever|internship eu external affairs|anderlecht, brussels region, belgium|https://www.linkedin.com/jobs/view/4213983947
l'oréal|internship category management (paid) - per now|brussels, brussels region, belgium|https://www.linkedin.com/jobs/view/4162681567
l'oréal|internship medical marketing (paid) - august 2025|brussels, brussels region, belgium|https://www.linkedin.com/jobs/view/4162678953
amazon|bel 2025 public policy manager intern|brussels, brussels region, belgium|https://www.linkedin.com/jobs/view/4045059113
louis vuitton|quality and client experience intern|brussels, brussels region, belgium|https://www.linkedin.com/jobs/view/4211062557
wilfried martens centre for european studies|general internship|brussels, brussels region, belgium|https://www.linkedin.com/jobs/view/4199486510
jde peet's|internship commercial sales support|brussels, brussels region, belgium|https://www.linkedin.com/jobs/view/4210857615
nato|internship - international military staff, operations and planning division|brussels, brussels region, belgium|https://www.linkedin.com/jobs/view/4228309565
technopolis group|internship - economics & advanced quantitative methods|brussels, brussels region, belgium|https://www.linkedin.com/jobs/view/4141165573
bestmix software|internship: work with our development team!|maldegem, flemish region, belgium|https://www.linkedin.com/jobs/view/4148718859
otiv|internship product and r&d|ghent, flemish region, belgium|https://www.linkedin.com/jobs/view/4219693741
nato|nato internship - innovation, hybrid and cyber (ihc) division|brussels, brussels region, belgium|https://www.linkedin.com/jobs/view/4229015452
pwc belgium|internship – smart manufacturing strategy|brussels, brussels region, belgium|https://www.linkedin.com/jobs/view/4221538726
epi company|data analytics & reporting intern – hybrid in amsterdam|brussels, brussels region, belgium|https://www.linkedin.com/jobs/view/4222322446
puratos|internship marketing: product & communication - chocolate|groot-bijgaarden, flemish region, belgium|https://www.linkedin.com/jobs/view/4184404193
pwc belgium|school internship in deals analytics (2025-2026)|brussels, brussels region, belgium|https://www.linkedin.com/jobs/view/4165418558
nato|nato internship - international military staff, cooperative security division|brussels, brussels region, belgium|https://www.linkedin.com/jobs/view/4228304934
bearingpoint|internship business analyst - data & analytics team|brussels region, belgium|https://www.linkedin.com/jobs/view/4223533849
proximus ada|internship - marketing & communications – 3-6 months|brussels, brussels region, belgium|https://www.linkedin.com/jobs/view/4186781803
toyota motor europe|internship body & paint business|evere, brussels region, belgium|https://www.linkedin.com/jobs/view/4214825182
beiersdorf|trade marketing pos internship - nivea|brussels, brussels region, belgium|https://www.linkedin.com/jobs/view/4196532992
nato|nato internship - internal oversight service|brussels, brussels region, belgium|https://www.linkedin.com/jobs/view/4228305898
dries van noten|digital intern|antwerp, flemish region, belgium|https://www.linkedin.com/jobs/view/4224482694
nestlé|sales support intern - nestlé|brussels, brussels region, belgium|https://www.linkedin.com/jobs/view/4228919197
qover|b2b marketing analytics intern|brussels, brussels region, belgium|https://www.linkedin.com/jobs/view/4226357138
bestmix software|internship: standardized data dashboard for smarter insights|maldegem, flemish region, belgium|https://www.linkedin.com/jobs/view/4161466684
proximus group|internship hr - orchestrate our internship event|brussels, brussels region, belgium|https://www.linkedin.com/jobs/view/4184909017
qover|student internship – multilingual customer care - insurance (july to end september 2025)|brussels, brussels region, belgium|https://www.linkedin.com/jobs/view/4231720207
bestmix software|internship: re-implement a translation service|maldegem, flemish region, belgium|https://www.linkedin.com/jobs/view/3712561497
septentrio|internship  design of a compact smart antenna prototype  leuven|leuven, flemish region, belgium|https://www.linkedin.com/jobs/view/4092881715
dries van noten|store planning intern|antwerp, flemish region, belgium|https://www.linkedin.com/jobs/view/4217842010
toyota motor europe|internship on vision language models|zaventem, flemish region, belgium|https://www.linkedin.com/jobs/view/4189370013
fleishmanhillard|graduate intern, financial services public affairs consultancy, 6-month paid internship, brussels|brussels, brussels region, belgium|https://www.linkedin.com/jobs/view/4207603135
septentrio|internship  hardware product innovation  leuven|leuven, flemish region, belgium|https://www.linkedin.com/jobs/view/4095603371
johnson & johnson innovative medicine|graduate internship – global clinical operations – data analysis & dashboards|beerse, flemish region, belgium|https://www.linkedin.com/jobs/view/4230063088
toyota motor europe|internship professional activation team|zaventem, flemish region, belgium|https://www.linkedin.com/jobs/view/4209730003
merchery|production intern|brussels, brussels region, belgium|https://www.linkedin.com/jobs/view/4215320923
powerdot|business developer intern|brussels, brussels region, belgium|https://www.linkedin.com/jobs/view/4231766033
kraft heinz|sales internship (stage) - based in belgium|berchem, flemish region, belgium|https://www.linkedin.com/jobs/view/4180613583
pepsico|first gen: commercial finance intern 2025|zaventem, flemish region, belgium|https://www.linkedin.com/jobs/view/4229484712
cyclecure|warehouse operations intern|brussels, brussels region, belgium|https://www.linkedin.com/jobs/view/3928115353
septentrio|internship  hardware product innovation  leuven|flemish region, belgium|https://www.linkedin.com/jobs/view/4132957195
charles river associates|intern (european competition practice)|brussels, brussels region, belgium|https://www.linkedin.com/jobs/view/4186440489
toyota motor europe|internship connected service planning|zaventem, flemish region, belgium|https://www.linkedin.com/jobs/view/4222867977
eurofins|problem analyst (brussels) - 3 months internship|brussels, brussels region, belgium|https://www.linkedin.com/jobs/view/4224333536
release|hospitality intern|antwerp, flemish region, belgium|https://www.linkedin.com/jobs/view/4223463860
swift|java development intern - reporting application|brussels, brussels region, belgium|https://www.linkedin.com/jobs/view/4194297563
boston scientific|health economics & market access intern - belgium|diegem, flemish region, belgium|https://www.linkedin.com/jobs/view/4203260080
bestmix software|internship: automated database update mechanism|maldegem, flemish region, belgium|https://www.linkedin.com/jobs/view/3712550272
novable|b2b marketing: growth hacking (internship)|brussels, brussels region, belgium|https://www.linkedin.com/jobs/view/4215387079
brightanalytics|internships – hooglede (belgium)|hooglede, flemish region, belgium|https://www.linkedin.com/jobs/view/4104385599
effixis, an artefact company|llm engineer intern|brussels, brussels region, belgium|https://www.linkedin.com/jobs/view/4188123237
farmtech society|eu credited internship in hydroponic growing with stipend|antwerp, flemish region, belgium|https://www.linkedin.com/jobs/view/4232750948
egym  dach|sales manager - internship|brussels, brussels region, belgium|https://www.linkedin.com/jobs/view/4188968859
toyota motor europe|internship generative ai for production engineering|zaventem, flemish region, belgium|https://www.linkedin.com/jobs/view/4211113193
henkel|internship in category management - adhesive technologies - july 2025 (m/f/x)|brussels, brussels region, belgium|https://www.linkedin.com/jobs/view/4222890484
id&a|public affairs & events intern|mechelen, flemish region, belgium|https://www.linkedin.com/jobs/view/4225376601
electra|b2b development intern 🇧🇪🇳🇱🇱🇺|ixelles, belgium|https://www.linkedin.com/jobs/view/4129693865
nokia|intern - immersive media coding|antwerp, flemish region, belgium|https://www.linkedin.com/jobs/view/4220237466
dynafin consulting|recruitment internship september|brussels region, belgium|https://www.linkedin.com/jobs/view/4227236355
levi strauss & co.|allocation analyst intern|zaventem, flemish region, belgium|https://www.linkedin.com/jobs/view/4227661111
accor|meeting planner intern h/f/x - 6 months|brussels, brussels region, belgium|https://www.linkedin.com/jobs/view/4222811827
tétris|tétris intern project manager / site manager - bruxelles|brussels, brussels region, belgium|https://www.linkedin.com/jobs/view/4139239433
centre for future generations (cfg)|biotechnology industry & engagement internship|brussels, brussels region, belgium|https://www.linkedin.com/jobs/view/4232439285
ey|internship technology & innovation - february 2026 - financial services|brussels, brussels region, belgium|https://www.linkedin.com/jobs/view/4223386357
easyfairs|e-learning intern|brussels, brussels region, belgium|https://www.linkedin.com/jobs/view/4206576789
bestmix software|internship: enhancing user experience: researching behavior-driven support systems|maldegem, flemish region, belgium|https://www.linkedin.com/jobs/view/4161465800
ifreq football|sales intern|zaventem, flemish region, belgium|https://www.linkedin.com/jobs/view/4228932676
tietalent|internship firmware and application development|leuven, flemish region, belgium|https://www.linkedin.com/jobs/view/4224379721
a6k|acceleration intern|charleroi, walloon region, belgium|https://www.linkedin.com/jobs/view/4225301871
nokia|bell labs internship on building novel genai-driven research assets (master student)|antwerp, flemish region, belgium|https://www.linkedin.com/jobs/view/4162697964
engibex|accounting intern|brussels, brussels region, belgium|https://www.linkedin.com/jobs/view/4232795178
proximus group|internship - academic collaborations database development|brussels, brussels region, belgium|https://www.linkedin.com/jobs/view/4130568404
engel & völkers belgium|marketing intern engel & völkers belgium|brussels, brussels region, belgium|https://www.linkedin.com/jobs/view/4228411487
radisson hotel group|cost control trainee (internship)|brussels, brussels region, belgium|https://www.linkedin.com/jobs/view/3973964766
space applications services nv/sa|electronics engineer - internship|brussels, brussels region, belgium|https://www.linkedin.com/jobs/view/4227744236
