company|title|location|link
whatnot|software engineer, 2025 new grad|dublin, county dublin, ireland|https://www.linkedin.com/jobs/view/4149260099
analog devices|fy25 graduate software engineering opportunities|limerick, county limerick, ireland|https://www.linkedin.com/jobs/view/4018482472
databricks|software engineer - new grad (2025 start)|amsterdam, north holland, netherlands|https://www.linkedin.com/jobs/view/4023888460
samsara|software engineer (new grad) - poland|poland|https://www.linkedin.com/jobs/view/4141644875
whatnot|ads software engineer, 2025 new grad|cracow, małopolskie, poland|https://www.linkedin.com/jobs/view/4157526667
arm|graduate gpu software developer|lund, skåne county, sweden|https://www.linkedin.com/jobs/view/4071795000
midas|new grad software engineer program|istanbul, istanbul, worldwide|https://www.linkedin.com/jobs/view/4142446671
optimove|graduate software developer|dundee, scotland, united kingdom|https://www.linkedin.com/jobs/view/4117650545
oliver bernard|graduate software engineer|newcastle upon tyne, england, united kingdom|https://www.linkedin.com/jobs/view/4146353943
oliver bernard|graduate software engineer|newcastle upon tyne, england, united kingdom|https://www.linkedin.com/jobs/view/4136771339
oliver bernard|graduate software engineer|newcastle upon tyne, england, united kingdom|https://www.linkedin.com/jobs/view/4157299781
palantir technologies|software engineer, new grad|london, england, united kingdom|https://www.linkedin.com/jobs/view/3988300913
virtuetech recruitment group|graduate software developer  c#  asp.net  sql  fintech  fx payments  london  hybrid  up to £25k + package|greater london, england, united kingdom|https://www.linkedin.com/jobs/view/4158254888
palantir technologies|forward deployed software engineer, new grad|london, england, united kingdom|https://www.linkedin.com/jobs/view/3988302426
canonical|graduate/associate software engineer - build & release infrastructure|vienna, vienna, austria|https://www.linkedin.com/jobs/view/4121134841
kbc bank & verzekering|software engineer young graduate|flemish region, belgium|https://www.linkedin.com/jobs/view/4157159641
barco|young graduate software engineer|kortrijk, flemish region, belgium|https://www.linkedin.com/jobs/view/4143519536
vivid resourcing|graduate/ junior-  software .net developer|ghent, flemish region, belgium|https://www.linkedin.com/jobs/view/4142467829
unilin|young graduate microsoft stack/angular software engineer|wielsbeke, flemish region, belgium|https://www.linkedin.com/jobs/view/4125859256
canonical|graduate/associate software engineer - build & release infrastructure|sofia, sofia city, worldwide|https://www.linkedin.com/jobs/view/4121134848
accenture nordics|software engineering graduate|copenhagen, capital region of denmark, denmark|https://www.linkedin.com/jobs/view/4134862294
mastercard|software engineer, launch graduate program 2025 - copenhagen, denmark-r-228710|copenhagen, capital region of denmark, denmark|https://www.linkedin.com/jobs/view/4144127808
wise|graduate software engineer|tallinn, harjumaa, worldwide|https://www.linkedin.com/jobs/view/4142244820
canonical|graduate/associate software engineer - build & release infrastructure|tallinn, harjumaa, worldwide|https://www.linkedin.com/jobs/view/4121134838
canonical|graduate/associate software engineer - build & release infrastructure|helsinki, uusimaa, finland|https://www.linkedin.com/jobs/view/4121132882
canonical|graduate/associate software engineer - build & release infrastructure|paris, île-de-france, france|https://www.linkedin.com/jobs/view/4121134845
canonical|graduate/associate software engineer - build & release infrastructure|grenoble, auvergne-rhône-alpes, france|https://www.linkedin.com/jobs/view/4121139002
amazon web services (aws)|2025 graduate software dev engineer|munich, bavaria, germany|https://www.linkedin.com/jobs/view/4047072261
amazon web services (aws)|2025 graduate software dev engineer|berlin, berlin, germany|https://www.linkedin.com/jobs/view/4047072262
amazon web services (aws)|2025 graduate software dev engineer|aachen, north rhine-westphalia, germany|https://www.linkedin.com/jobs/view/4153428169
netlight|software engineering consultant (2024/25 graduate)|berlin, germany|https://www.linkedin.com/jobs/view/4136765255
canonical|graduate/associate software engineer - build & release infrastructure|hamburg, hamburg, germany|https://www.linkedin.com/jobs/view/4121133892
canonical|graduate/associate software engineer - build & release infrastructure|frankfurt am main, hesse, germany|https://www.linkedin.com/jobs/view/4121138271
canonical|graduate/associate software engineer - build & release infrastructure|berlin, berlin, germany|https://www.linkedin.com/jobs/view/4121137286
european space agency - esa|esa graduate trainee in space and planetary visualisation software development|darmstadt, hesse, germany|https://www.linkedin.com/jobs/view/4141604820
canonical|graduate/associate software engineer - build & release infrastructure|budapest, budapest, hungary|https://www.linkedin.com/jobs/view/4121134842
arista networks|graduate/intern software engineer|dublin, county dublin, ireland|https://www.linkedin.com/jobs/view/4155468989
susquehanna international group|software developer graduate: 2025|dublin, county dublin, ireland|https://www.linkedin.com/jobs/view/4017342546
bearingpoint|2025 graduate opportunities - software development|dublin, county dublin, ireland|https://www.linkedin.com/jobs/view/4048684177
amazon|2025 graduate software dev engineer|dublin, county dublin, ireland|https://www.linkedin.com/jobs/view/4046085944
sita|graduate software engineering|letterkenny, county donegal, ireland|https://www.linkedin.com/jobs/view/4133854885
valeo|graduate software engineer (12 month fixed term contract)|tuam, county galway, ireland|https://www.linkedin.com/jobs/view/4129606885
bearingpoint|2025 graduate opportunities - software test|dublin, county dublin, ireland|https://www.linkedin.com/jobs/view/4048683211
canonical|graduate/associate software engineer - build & release infrastructure|dublin, county dublin, ireland|https://www.linkedin.com/jobs/view/4121132876
bending spoons|graduate software engineer|italy|https://www.linkedin.com/jobs/view/4157283039
canonical|graduate/associate software engineer - build & release infrastructure|rome, latium, italy|https://www.linkedin.com/jobs/view/4121135427
coesia s.p.a.|automation and software engineers – ypp (graduate program)|fiorano modenese, emilia-romagna, italy|https://www.linkedin.com/jobs/view/4135237921
canonical|graduate/associate software engineer - build & release infrastructure|riga, riga, worldwide|https://www.linkedin.com/jobs/view/4121135421
amazon|2025 graduate software dev engineer|luxembourg, luxembourg, luxembourg|https://www.linkedin.com/jobs/view/4051844664
canonical|graduate/associate software engineer - build & release infrastructure|nice, provence-alpes-côte d'azur, france|https://www.linkedin.com/jobs/view/4121136439
miro|graduate software engineer|amsterdam, north holland, netherlands|https://www.linkedin.com/jobs/view/4135282256
flow traders|graduate software developer, c++|amsterdam, north holland, netherlands|https://www.linkedin.com/jobs/view/4037170198
amazon|2025 software dev engineer graduate|amsterdam, north holland, netherlands|https://www.linkedin.com/jobs/view/4089377872
optiver|graduate software engineer|amsterdam, north holland, netherlands|https://www.linkedin.com/jobs/view/4070152361
amazon|2025 software dev engineer graduate|the hague, south holland, netherlands|https://www.linkedin.com/jobs/view/4089383055
canonical|graduate/associate software engineer - build & release infrastructure|oslo, oslo, norway|https://www.linkedin.com/jobs/view/4121136441
visa|graduate software engineer|warsaw, mazowieckie, poland|https://www.linkedin.com/jobs/view/4142239045
hipo.ro|2025 graduate software dev engineer|ilfov, romania|https://www.linkedin.com/jobs/view/4072227160
amazon|2025 graduate software dev engineer|iaşi, iaşi, romania|https://www.linkedin.com/jobs/view/4085650067
oracle|software engineer - fresh graduate|barcelona, catalonia, spain|https://www.linkedin.com/jobs/view/4102775379
oracle|software engineer - fresh graduate|barcelona, catalonia, spain|https://www.linkedin.com/jobs/view/4090972723
canonical|graduate/associate software engineer - build & release infrastructure|málaga, andalusia, spain|https://www.linkedin.com/jobs/view/4121133895
canonical|graduate/associate software engineer - build & release infrastructure|granada, andalusia, spain|https://www.linkedin.com/jobs/view/4121134840
canonical|graduate/associate software engineer - build & release infrastructure|madrid, community of madrid, spain|https://www.linkedin.com/jobs/view/4121139004
canonical|graduate/associate software engineer - build & release infrastructure|valencia, valencian community, spain|https://www.linkedin.com/jobs/view/4121138272
netlight|software developer (consultant, graduate)|stockholm, stockholm county, sweden|https://www.linkedin.com/jobs/view/3686111631
canonical|graduate/associate software engineer - build & release infrastructure|stockholm, stockholm county, sweden|https://www.linkedin.com/jobs/view/4121139013
julius baer|university graduate – software engineering 100% (f/m/d)|zurich, zurich, switzerland|https://www.linkedin.com/jobs/view/4151097811
mercedes-amg petronas formula one team|graduate software engineer|brackley, england, united kingdom|https://www.linkedin.com/jobs/view/4145306183
dizplai|graduate software developer|manchester, england, united kingdom|https://www.linkedin.com/jobs/view/4154591240
wiredhouse|graduate software engineer|eastwood, england, united kingdom|https://www.linkedin.com/jobs/view/4157983423
dorset software|graduate software developer|bristol, england, united kingdom|https://www.linkedin.com/jobs/view/4133976196
dorset software|graduate software developer|oxford, england, united kingdom|https://www.linkedin.com/jobs/view/4082022589
autodesk|graduate software engineer (starting q1 2025)|birmingham, england, united kingdom|https://www.linkedin.com/jobs/view/4141988416
dorset software|graduate software developer|poole, england, united kingdom|https://www.linkedin.com/jobs/view/4115787791
sinara|graduate software engineer|london, england, united kingdom|https://www.linkedin.com/jobs/view/4137036696
tiptopjob|graduate software engineer|london, england, united kingdom|https://www.linkedin.com/jobs/view/4147514994
dorset software|graduate software developer|edinburgh, scotland, united kingdom|https://www.linkedin.com/jobs/view/4132956842
scott logic|graduate software developer|newcastle upon tyne, england, united kingdom|https://www.linkedin.com/jobs/view/4159239883
alphasights|graduate software engineer|london, england, united kingdom|https://www.linkedin.com/jobs/view/4108711787
itdev|graduate software engineer|southampton, england, united kingdom|https://www.linkedin.com/jobs/view/4144513000
emerge web studio|graduate software engineer|east sussex, england, united kingdom|https://www.linkedin.com/jobs/view/4136862223
reply|graduate software developer|manchester, england, united kingdom|https://www.linkedin.com/jobs/view/4129882937
tata technologies|graduate software engineer|warwick, england, united kingdom|https://www.linkedin.com/jobs/view/4139627820
hunter bond|graduate software engineer – new fintech startup (up to £200k + bonus + hybrid)|london area, united kingdom|https://www.linkedin.com/jobs/view/4150617844
oliver bernard|graduate software engineer - £30k - £40k|newcastle upon tyne, england, united kingdom|https://www.linkedin.com/jobs/view/4146350380
s&p global|graduate software engineer|london, england, united kingdom|https://www.linkedin.com/jobs/view/4125950170
insignis talent|graduate software engineer|weymouth, england, united kingdom|https://www.linkedin.com/jobs/view/4138623361
bending spoons|graduate software engineer|united kingdom|https://www.linkedin.com/jobs/view/4157273971
bending spoons|graduate software engineer|manchester area, united kingdom|https://www.linkedin.com/jobs/view/4157278477
certinia|graduate software engineer|harrogate, england, united kingdom|https://www.linkedin.com/jobs/view/4151313912
amazon|2025 graduate software dev engineer|london, england, united kingdom|https://www.linkedin.com/jobs/view/4051048565
bending spoons|graduate software engineer|england, united kingdom|https://www.linkedin.com/jobs/view/4157279370
bending spoons|graduate software engineer|london area, united kingdom|https://www.linkedin.com/jobs/view/4157275717
grayce|graduate software tester|london, england, united kingdom|https://www.linkedin.com/jobs/view/4154591158
bending spoons|graduate software engineer|bath, england, united kingdom|https://www.linkedin.com/jobs/view/4157276617
tietalent|graduate software engineer|london, england, united kingdom|https://www.linkedin.com/jobs/view/4157083060
bending spoons|graduate software engineer|edinburgh, scotland, united kingdom|https://www.linkedin.com/jobs/view/4157277556
oho group ltd|graduate software engineer|cambridge, england, united kingdom|https://www.linkedin.com/jobs/view/4141591404
bending spoons|graduate software engineer|durham, england, united kingdom|https://www.linkedin.com/jobs/view/4157279253
bt group|software engineering graduate|belfast, northern ireland, united kingdom|https://www.linkedin.com/jobs/view/4092115072
bending spoons|graduate software engineer|birmingham, england, united kingdom|https://www.linkedin.com/jobs/view/4157281040
free-work uk|graduate software engineer|england, united kingdom|https://www.linkedin.com/jobs/view/4159315941
atkinsréalis|software graduate scheme|west midlands, england, united kingdom|https://www.linkedin.com/jobs/view/4051238065
grayce|graduate software tester|london area, united kingdom|https://www.linkedin.com/jobs/view/4117245650
client server|graduate software engineer computer science|newcastle upon tyne, england, united kingdom|https://www.linkedin.com/jobs/view/4143151241
tietalent|software developer c# - computer science graduate|newcastle upon tyne, england, united kingdom|https://www.linkedin.com/jobs/view/4149949799
canonical|graduate/associate software engineer - build & release infrastructure|manchester, england, united kingdom|https://www.linkedin.com/jobs/view/4121136440
canonical|graduate/associate software engineer - build & release infrastructure|glasgow, scotland, united kingdom|https://www.linkedin.com/jobs/view/4121137288
siluettispa|stem graduate software sales development representative|london, england, united kingdom|https://www.linkedin.com/jobs/view/4132964055
canonical|graduate/associate software engineer - build & release infrastructure|athens, attiki, greece|https://www.linkedin.com/jobs/view/4121139008
canonical|graduate/associate software engineer - build & release infrastructure|marousi, attiki, greece|https://www.linkedin.com/jobs/view/4121135420
amazon|2025 graduate software dev engineer|barcelona, catalonia, spain|https://www.linkedin.com/jobs/view/4040160954
canonical|graduate/associate software engineer - build & release infrastructure|brussels, brussels region, belgium|https://www.linkedin.com/jobs/view/4121135425
canonical|graduate/associate software engineer - build & release infrastructure|bucharest, bucharest, romania|https://www.linkedin.com/jobs/view/4121139003
canonical|graduate/associate software engineer - build & release infrastructure|cracow, małopolskie, poland|https://www.linkedin.com/jobs/view/4121136430
canonical|graduate/associate software engineer - build & release infrastructure|rotterdam, south holland, netherlands|https://www.linkedin.com/jobs/view/4121134846
leonardo|graduate software engineer|edinburgh, scotland, united kingdom|https://www.linkedin.com/jobs/view/4062262072
canonical|graduate/associate software engineer - build & release infrastructure|edinburgh, scotland, united kingdom|https://www.linkedin.com/jobs/view/4121136432
leonardo|software engineering graduate apprenticeship|edinburgh, scotland, united kingdom|https://www.linkedin.com/jobs/view/4058000921
capua|graduate software developer (visa sponsoring role)|london area, united kingdom|https://www.linkedin.com/jobs/view/4156150331
reply|graduate software developer|london area, united kingdom|https://www.linkedin.com/jobs/view/4133421014
oliver bernard|graduate software engineer|london area, united kingdom|https://www.linkedin.com/jobs/view/4154776558
acre|graduate backend software engineer|london, england, united kingdom|https://www.linkedin.com/jobs/view/4108624863
hunter bond|graduate software developer/ quant developer/ quant researcher - up to £180,000 + bonus + package|london area, united kingdom|https://www.linkedin.com/jobs/view/4149498831
canonical|graduate/associate software engineer - build & release infrastructure|lyon, auvergne-rhône-alpes, france|https://www.linkedin.com/jobs/view/4121137295
amazon|2025 graduate software dev engineer|madrid, community of madrid, spain|https://www.linkedin.com/jobs/view/4040164410
ryanair - europe's favourite airline|graduate cloud software developer (java/go)|madrid, community of madrid, spain|https://www.linkedin.com/jobs/view/4145691848
interact software|graduate software engineer|manchester, england, united kingdom|https://www.linkedin.com/jobs/view/4133905938
canonical|graduate/associate software engineer - build & release infrastructure|milan, lombardy, italy|https://www.linkedin.com/jobs/view/4121139001
canonical|graduate/associate software engineer - build & release infrastructure|munich, bavaria, germany|https://www.linkedin.com/jobs/view/4121134839
oracle|software engineer - fresh graduate|prague, prague, worldwide|https://www.linkedin.com/jobs/view/4141630326
oracle|software engineer in platform integration team- fresh graduate|prague, prague, worldwide|https://www.linkedin.com/jobs/view/4057772709
canonical|graduate/associate software engineer - build & release infrastructure|prague, prague, worldwide|https://www.linkedin.com/jobs/view/4121138273
canonical|graduate/associate software engineer - build & release infrastructure|warsaw, mazowieckie, poland|https://www.linkedin.com/jobs/view/4121139011
valeo|graduate software engineer (12 month fixed term contract)|tuam, county galway, ireland|https://www.linkedin.com/jobs/view/4131130758
valeo|graduate software engineer (12 month fixed term contract)|tuam, county galway, ireland|https://www.linkedin.com/jobs/view/4131136725
canonical|graduate/associate software engineer - build & release infrastructure|amsterdam, north holland, netherlands|https://www.linkedin.com/jobs/view/4121134835
canonical|graduate/associate software engineer - build & release infrastructure|nuremberg, bavaria, germany|https://www.linkedin.com/jobs/view/4121139007
canonical|graduate/associate software engineer - build & release infrastructure|wrocław, dolnośląskie, poland|https://www.linkedin.com/jobs/view/4121135423
cegeka|young graduate - software development consultant (september 2025)|flemish region, belgium|https://www.linkedin.com/jobs/view/4127609804
canonical|graduate/associate software engineer - build & release infrastructure|porto, porto, portugal|https://www.linkedin.com/jobs/view/4121137292
canonical|graduate/associate software engineer - build & release infrastructure|pisa, tuscany, italy|https://www.linkedin.com/jobs/view/4121133903
canonical|graduate/associate software engineer - build & release infrastructure|sevilla la nueva, community of madrid, spain|https://www.linkedin.com/jobs/view/4121138274
canonical|graduate/associate software engineer - build & release infrastructure|salamanca, castilla and leon, spain|https://www.linkedin.com/jobs/view/4121133897
canonical|graduate/associate software engineer - build & release infrastructure|rennes, brittany, france|https://www.linkedin.com/jobs/view/4121136436
canonical|graduate/associate software engineer - build & release infrastructure|lille, hauts-de-france, france|https://www.linkedin.com/jobs/view/4121138269
digital manufacturing ireland|graduate cloud/iot software engineer|limerick, county limerick, ireland|https://www.linkedin.com/jobs/view/4157744322
canonical|graduate/associate software engineer - build & release infrastructure|nantes, pays de la loire, france|https://www.linkedin.com/jobs/view/4121132885
palantir technologies|forward deployed software engineer, new grad - uk government|london, england, united kingdom|https://www.linkedin.com/jobs/view/3988303357
canonical|graduate/associate software engineer - build & release infrastructure|antwerp, flemish region, belgium|https://www.linkedin.com/jobs/view/4121137285
canonical|graduate/associate software engineer - build & release infrastructure|strasbourg, grand est, france|https://www.linkedin.com/jobs/view/4121135419
canonical|graduate/associate software engineer - build & release infrastructure|marseille, provence-alpes-côte d'azur, france|https://www.linkedin.com/jobs/view/4121137291
canonical|graduate/associate software engineer - build & release infrastructure|toulouse, occitanie, france|https://www.linkedin.com/jobs/view/4121138275
canonical|graduate/associate software engineer - build & release infrastructure|düsseldorf, north rhine-westphalia, germany|https://www.linkedin.com/jobs/view/4121137293
vodafone|discover graduate program greece  software development @ athens, crete, thessaloniki|iráklion, crete, greece|https://www.linkedin.com/jobs/view/4141141623
canonical|graduate/associate software engineer - build & release infrastructure|turin, piedmont, italy|https://www.linkedin.com/jobs/view/4121133901
canonical|graduate/associate software engineer - build & release infrastructure|lisbon, lisbon, portugal|https://www.linkedin.com/jobs/view/4121132877
canonical|graduate/associate software engineer - build & release infrastructure|coimbra, coimbra, portugal|https://www.linkedin.com/jobs/view/4121133893
canonical|graduate/associate software engineer - build & release infrastructure|aveiro, aveiro, portugal|https://www.linkedin.com/jobs/view/4121132879
canonical|graduate/associate software engineer - build & release infrastructure|cluj-napoca, cluj, romania|https://www.linkedin.com/jobs/view/4121136437
canonical|graduate/associate software engineer - build & release infrastructure|timişoara, timiş, romania|https://www.linkedin.com/jobs/view/4121136435
canonical|graduate/associate software engineer - build & release infrastructure|barcelona, catalonia, spain|https://www.linkedin.com/jobs/view/4121138267
bipsync|graduate software engineer|cardiff, wales, united kingdom|https://www.linkedin.com/jobs/view/4149000306
hunter bond|graduate software engineer - hybrid working - £50,000 - £100,000 base (+bonus)|greater london, england, united kingdom|https://www.linkedin.com/jobs/view/4146374169
oliver bernard|graduate software engineer|newcastle upon tyne, england, united kingdom|https://www.linkedin.com/jobs/view/4132832921
oliver bernard|graduate software engineer|england, united kingdom|https://www.linkedin.com/jobs/view/4157296994
acre|graduate backend software engineer (immediate start)|london, england, united kingdom|https://www.linkedin.com/jobs/view/4137147761
sts defence|graduate software engineer|gosport, england, united kingdom|https://www.linkedin.com/jobs/view/4157056034
azuki|graduate software engineer|cambridge, england, united kingdom|https://www.linkedin.com/jobs/view/3742407586
amazon|2025 graduate software dev engineer|swansea, wales, united kingdom|https://www.linkedin.com/jobs/view/4138435317
bending spoons|graduate software engineer|oxfordshire, england, united kingdom|https://www.linkedin.com/jobs/view/4157274891
abb|graduate embedded software engineer|stonehouse, england, united kingdom|https://www.linkedin.com/jobs/view/4149192675
capgemini|graduate software engineering programme 2025|telford, england, united kingdom|https://www.linkedin.com/jobs/view/4058376396
spectrum it recruitment|graduate / junior c++ software engineer|southampton, england, united kingdom|https://www.linkedin.com/jobs/view/4150330391
bae systems digital intelligence|graduate software engineer|guildford, england, united kingdom|https://www.linkedin.com/jobs/view/4148263645
bae systems|graduate software engineer|surrey, england, united kingdom|https://www.linkedin.com/jobs/view/4148659223
robustelli ∙ soucy ∙ hussey, p.a.|graduate r&d software engineer|saffron walden, england, united kingdom|https://www.linkedin.com/jobs/view/4157983407
redtech recruitment|application software engineer - all levels - graduate considered|cambridge, england, united kingdom|https://www.linkedin.com/jobs/view/4148772591
canonical|software engineer - python - ubuntu pro client - graduate level|sudbury, england, united kingdom|https://www.linkedin.com/jobs/view/4099117273
cgi|technical graduate - geospatial software engineer 2025|greater lincoln area, united kingdom|https://www.linkedin.com/jobs/view/4087530743
hunter bond|graduate software engineer - up to £120k + bonus - london|greater london, england, united kingdom|https://www.linkedin.com/jobs/view/4154548948
gradbay|graduate software engineer|knutsford, england, united kingdom|https://www.linkedin.com/jobs/view/4145097985
canonical|graduate/associate software engineer - build & release infrastructure|dresden, saxony, germany|https://www.linkedin.com/jobs/view/4121137289
canonical|graduate/associate software engineer - build & release infrastructure|bordeaux, nouvelle-aquitaine, france|https://www.linkedin.com/jobs/view/4121136431
saftronics limited|graduate software engineer|leeds, england, united kingdom|https://www.linkedin.com/jobs/view/4156343515
robustelli ∙ soucy ∙ hussey, p.a.|application software engineer - javascript - graduate considered|cambridge, england, united kingdom|https://www.linkedin.com/jobs/view/4146402186
