company|title|location|link
spectrum it recruitment|graduate electronic/software engineer|southampton, england, united kingdom|https://www.linkedin.com/jobs/view/3943024952
ic resources|graduate c++ software engineer|buckinghamshire, england, united kingdom|https://www.linkedin.com/jobs/view/3948600036
robustelli ∙ soucy ∙ hussey, p.a.|software qa engineer graduate considered|cambridge, england, united kingdom|https://www.linkedin.com/jobs/view/3932006377
canonical|software engineer - python - ubuntu pro client - graduate level|sudbury, england, united kingdom|https://www.linkedin.com/jobs/view/3933892405
mygwork - lgbtq+ business community|graduate software development engineer – redshift query processing|berlin, berlin, germany|https://www.linkedin.com/jobs/view/3923638088
mygwork - lgbtq+ business community|2024 graduate software dev engineer|madrid, community of madrid, spain|https://www.linkedin.com/jobs/view/3852319711
cobblestone energy|graduate software engineer - dubai, uae|greater manchester, england, united kingdom|https://www.linkedin.com/jobs/view/3641768205
cbsbutler|graduate software engineer (embedded)|rochester, england, united kingdom|https://www.linkedin.com/jobs/view/3890906828
leonardo|aerospace software engineering graduate|yeovil, england, united kingdom|https://www.linkedin.com/jobs/view/3926151351
itaacon s.r.o|graduate software developer|bicester, england, united kingdom|https://www.linkedin.com/jobs/view/3919739892
tharsus|graduate software developer|blyth, england, united kingdom|https://www.linkedin.com/jobs/view/3932699866
pepper mill|graduate software developer|glasgow, scotland, united kingdom|https://www.linkedin.com/jobs/view/3918932099
pepper mill|graduate software engineer|glasgow, scotland, united kingdom|https://www.linkedin.com/jobs/view/3918926603
spectrum it recruitment|graduate software developer|east sussex, england, united kingdom|https://www.linkedin.com/jobs/view/3937834392
oho group ltd|graduate software developer – finance – hedge fund – java/c++/python – £40k – £60k|greater london, england, united kingdom|https://www.linkedin.com/jobs/view/3348033096
cambridge intelligence|graduate software developer (2024 intake)|cambridge, england, united kingdom|https://www.linkedin.com/jobs/view/3932149335
grb (graduate recruitment bureau)|graduate embedded software engineer|cambridge, england, united kingdom|https://www.linkedin.com/jobs/view/3918589331
