company|title|location|link
analog devices|fy24 graduate software engineering opportunities|limerick, county limerick, ireland|https://www.linkedin.com/jobs/view/3814645177
whatnot|new grad software engineer, poland|cracow, małopolskie, poland|https://www.linkedin.com/jobs/view/3918601442
samsara|software engineer (new grad) - poland|poland|https://www.linkedin.com/jobs/view/3797269898
oracle|ai software engineer - fresh graduate|barcelona, catalonia, spain|https://www.linkedin.com/jobs/view/3915769412
mygwork - lgbtq+ business community|ai software engineer - fresh graduate|barcelona, catalonia, spain|https://www.linkedin.com/jobs/view/3932095125
ciena|new grad: dataplane software engineer|edinburgh, scotland, united kingdom|https://www.linkedin.com/jobs/view/3875387368
cobblestone energy|graduate software engineer - dubai, uae|vienna, vienna, austria|https://www.linkedin.com/jobs/view/3641768207
barco|young graduate software developer|kortrijk, flemish region, belgium|https://www.linkedin.com/jobs/view/3906017558
twipe|graduate programme - software engineer|leuven, flemish region, belgium|https://www.linkedin.com/jobs/view/3840153587
cobblestone energy|graduate software engineer - dubai, uae|brussels, brussels region, belgium|https://www.linkedin.com/jobs/view/3641767212
cobblestone energy|graduate software engineer - dubai, uae|antwerp, flemish region, belgium|https://www.linkedin.com/jobs/view/3642640039
cobblestone energy|graduate software engineer - dubai, uae|sofia, sofia city, worldwide|https://www.linkedin.com/jobs/view/3641763823
systematic|soon-to-be or newly graduated software developer|aarhus, central denmark region, denmark|https://www.linkedin.com/jobs/view/3935032802
cobblestone energy|graduate software engineer - dubai, uae|aarhus, central denmark region, denmark|https://www.linkedin.com/jobs/view/3641761745
cobblestone energy|graduate software engineer - dubai, uae|copenhagen, capital region of denmark, denmark|https://www.linkedin.com/jobs/view/3641765379
danske bank|it graduate for software engineering position in finance tribe|copenhagen, capital region of denmark, denmark|https://www.linkedin.com/jobs/view/3934491253
cobblestone energy|graduate software engineer - dubai, uae|tallinn, harjumaa, worldwide|https://www.linkedin.com/jobs/view/3641763655
cobblestone energy|graduate software engineer - dubai, uae|espoo, uusimaa, finland|https://www.linkedin.com/jobs/view/3641761747
cobblestone energy|graduate software engineer - dubai, uae|helsinki, uusimaa, finland|https://www.linkedin.com/jobs/view/3641766276
ion|software developer/engineer - graduate development program|any-martin-rieux, hauts-de-france, france|https://www.linkedin.com/jobs/view/3809677067
cobblestone energy|graduate software engineer - dubai, uae|paris, île-de-france, france|https://www.linkedin.com/jobs/view/3642639085
cobblestone energy|graduate software engineer - dubai, uae|lyon, auvergne-rhône-alpes, france|https://www.linkedin.com/jobs/view/3641764451
amazon|2024 graduate software dev engineer|clichy, île-de-france, france|https://www.linkedin.com/jobs/view/3877272309
adp|graduate program software engineer (m/w/d)|bremen, germany|https://www.linkedin.com/jobs/view/3928605008
delivery hero|graduate software engineer (android) - deliveries, logistics (all genders)|berlin, berlin, germany|https://www.linkedin.com/jobs/view/3947288706
european recruitment|graduate software consultant|munich, bavaria, germany|https://www.linkedin.com/jobs/view/3937335488
ivanti|graduate software business development representative|germany|https://www.linkedin.com/jobs/view/3936992874
cobblestone energy|graduate software engineer - dubai, uae|hamburg, hamburg, germany|https://www.linkedin.com/jobs/view/3641765413
cobblestone energy|graduate software engineer - dubai, uae|münchen, bavaria, germany|https://www.linkedin.com/jobs/view/3641767244
european recruitment|graduate software developer - stem / physics / mathematics|germany|https://www.linkedin.com/jobs/view/3940689529
mygwork - lgbtq+ business community|2024 graduate software dev engineer|berlin, berlin, germany|https://www.linkedin.com/jobs/view/3897182775
european recruitment|software engineering consultant / stem graduates|munich, bavaria, germany|https://www.linkedin.com/jobs/view/3945424307
amazon web services (aws)|2024 graduate software dev engineer|munich, bavaria, germany|https://www.linkedin.com/jobs/view/3941962581
amazon web services (aws)|2024 graduate software dev engineer|berlin, berlin, germany|https://www.linkedin.com/jobs/view/3941962559
doctor|2024 graduate software dev engineer|berlin, berlin, germany|https://www.linkedin.com/jobs/view/3870738809
renesas electronics|graduate embedded software engineer|athens, attiki, greece|https://www.linkedin.com/jobs/view/3906261861
cobblestone energy|graduate software engineer - dubai, uae|athens, attiki, greece|https://www.linkedin.com/jobs/view/3641767239
vodafone|discover graduate program greece  software development @ athens, crete, thessaloniki|iráklion, crete, greece|https://www.linkedin.com/jobs/view/3864868677
tms technology|best in class graduate entry path into international software engineering|budapest, hungary|https://www.linkedin.com/jobs/view/3945213081
cobblestone energy|graduate software engineer - dubai, uae|budapest, budapest, hungary|https://www.linkedin.com/jobs/view/3641763664
cobblestone energy|graduate software engineer - dubai, uae|debrecen, hajdú-bihar, hungary|https://www.linkedin.com/jobs/view/3641765402
dun & bradstreet|graduate software engineering opportunity|dublin, county dublin, ireland|https://www.linkedin.com/jobs/view/3945560147
amazon|2024 graduate software dev engineer|dublin, county dublin, ireland|https://www.linkedin.com/jobs/view/3877292454
mollie|software engineer - new graduate|milan, lombardy, italy|https://www.linkedin.com/jobs/view/3901370419
ion|software developer/engineer - graduate development program|milan, lombardy, italy|https://www.linkedin.com/jobs/view/3809676120
ion|software developer/engineer - graduate development program|collecchio, emilia-romagna, italy|https://www.linkedin.com/jobs/view/3809673286
ion|software developer/engineer - graduate development program|turin, piedmont, italy|https://www.linkedin.com/jobs/view/3809678068
ion|software developer/engineer - graduate development program|pisa, tuscany, italy|https://www.linkedin.com/jobs/view/3809677066
amazon|2024 graduate software dev engineer|ro, emilia-romagna, italy|https://www.linkedin.com/jobs/view/3877290645
amazon|2024 graduate software dev engineer|asti, piedmont, italy|https://www.linkedin.com/jobs/view/3920385812
cobblestone energy|graduate software engineer - dubai, uae|luxembourg, luxembourg, luxembourg|https://www.linkedin.com/jobs/view/3641762696
mygwork - lgbtq+ business community|2024 graduate software dev engineer|kirchberg, luxembourg, luxembourg|https://www.linkedin.com/jobs/view/3848249955
amazon|2024 graduate software dev engineer|luxembourg, luxembourg, luxembourg|https://www.linkedin.com/jobs/view/3877283882
arm|graduate embedded software engineer - cpu verification|sophia antipolis, provence-alpes-côte d'azur, france|https://www.linkedin.com/jobs/view/3902454964
cm.com|graduation internship software engineering|north brabant, netherlands|https://www.linkedin.com/jobs/view/3849421561
imc trading|graduate software engineer (c++) - expression of interest|amsterdam, north holland, netherlands|https://www.linkedin.com/jobs/view/3932955584
cobblestone energy|graduate software engineer - dubai, uae|tilburg, north brabant, netherlands|https://www.linkedin.com/jobs/view/3641762685
doctor|2024 software dev engineer graduate|amsterdam, north holland, netherlands|https://www.linkedin.com/jobs/view/3851771635
cobblestone energy|graduate software engineer - dubai, uae|oslo, oslo, norway|https://www.linkedin.com/jobs/view/3641762705
nov|senior software developer /software developer /graduate software developer (norway)|kristiansand, agder, norway|https://www.linkedin.com/jobs/view/3943870156
visa|graduate software engineer|warsaw, mazowieckie, poland|https://www.linkedin.com/jobs/view/3924566754
cobblestone energy|graduate software engineer - dubai, uae|cracow, małopolskie, poland|https://www.linkedin.com/jobs/view/3641763700
cobblestone energy|graduate software engineer - dubai, uae|poznań, wielkopolskie, poland|https://www.linkedin.com/jobs/view/3641768173
cobblestone energy|graduate software engineer - dubai, uae|warsaw, mazowieckie, poland|https://www.linkedin.com/jobs/view/3641764528
cobblestone energy|graduate software engineer - dubai, uae|wrocław, dolnośląskie, poland|https://www.linkedin.com/jobs/view/3641767308
cisco|software/data engineer (graduate)|oeiras, lisbon, portugal|https://www.linkedin.com/jobs/view/3880293309
cobblestone energy|graduate software engineer - dubai, uae|lisboa, lisbon, portugal|https://www.linkedin.com/jobs/view/3641768156
cobblestone energy|graduate software engineer - dubai, uae|porto, porto, portugal|https://www.linkedin.com/jobs/view/3641765445
cobblestone energy|graduate software engineer - dubai, uae|bucharest, bucharest, romania|https://www.linkedin.com/jobs/view/3641762817
cobblestone energy|graduate software engineer - dubai, uae|cluj-napoca, cluj, romania|https://www.linkedin.com/jobs/view/3641767353
oracle|software engineer - fresh graduate|barcelona, catalonia, spain|https://www.linkedin.com/jobs/view/3915767668
mygwork - lgbtq+ business community|software engineer - fresh graduate|barcelona, catalonia, spain|https://www.linkedin.com/jobs/view/3932610928
cobblestone energy|graduate software engineer - dubai, uae|barcelona, catalonia, spain|https://www.linkedin.com/jobs/view/3671491754
cobblestone energy|graduate software engineer - dubai, uae|madrid, community of madrid, spain|https://www.linkedin.com/jobs/view/3641768194
verisure|software engineer graduate program 2024/2025|pozuelo de alarcón, community of madrid, spain|https://www.linkedin.com/jobs/view/3930460450
amazon|2024 graduate software dev engineer|barcelona, catalonia, spain|https://www.linkedin.com/jobs/view/3877272888
amazon|2024 graduate software dev engineer|madrid, community of madrid, spain|https://www.linkedin.com/jobs/view/3877276475
doctor|2024 graduate software dev engineer|madrid, community of madrid, spain|https://www.linkedin.com/jobs/view/3799901527
netlight|software developer (consultant, graduate)|stockholm, stockholm county, sweden|https://www.linkedin.com/jobs/view/3686111631
cobblestone energy|graduate software engineer - dubai, uae|stockholm, stockholm county, sweden|https://www.linkedin.com/jobs/view/3653768265
cobblestone energy|graduate software engineer - dubai, uae|gothenburg, västra götaland county, sweden|https://www.linkedin.com/jobs/view/3641762729
cobblestone energy|graduate software engineer - dubai, uae|zurich, zurich, switzerland|https://www.linkedin.com/jobs/view/3641763751
kobil|software engineer - recent college graduate|istanbul, istanbul, worldwide|https://www.linkedin.com/jobs/view/3832164077
cobblestone energy|graduate software engineer - dubai, uae|kyiv, kyiv city, ukraine|https://www.linkedin.com/jobs/view/3641764600
cobblestone energy|graduate software engineer - dubai, uae|kharkiv, kharkiv, ukraine|https://www.linkedin.com/jobs/view/3642638083
dorset software|graduate software developer|poole, england, united kingdom|https://www.linkedin.com/jobs/view/3926399632
klickstarters|graduate software engineer|cambridge, england, united kingdom|https://www.linkedin.com/jobs/view/3940988564
deltaxml ltd|software engineer (junior or graduate)|great malvern, england, united kingdom|https://www.linkedin.com/jobs/view/3939689163
targetjobs uk|graduate software developer|glasgow, scotland, united kingdom|https://www.linkedin.com/jobs/view/3939800674
targetjobs uk|graduate software developer|london, england, united kingdom|https://www.linkedin.com/jobs/view/3939454153
tiptopjob|graduate software developer : london : hybrid|london, england, united kingdom|https://www.linkedin.com/jobs/view/3942180579
pepper mill|graduate software developer|manchester, england, united kingdom|https://www.linkedin.com/jobs/view/3918930304
pepper mill|graduate software developer|southampton, england, united kingdom|https://www.linkedin.com/jobs/view/3918925821
pepper mill|graduate software developer|birmingham, england, united kingdom|https://www.linkedin.com/jobs/view/3918929319
dirlik designs|graduate software developer|blyth, england, united kingdom|https://www.linkedin.com/jobs/view/3921518976
pepper mill|graduate software engineer|london, england, united kingdom|https://www.linkedin.com/jobs/view/3918933053
highbury consulting|graduate software engineer|city of london, england, united kingdom|https://www.linkedin.com/jobs/view/3945391115
grb (graduate recruitment bureau)|graduate software developer|west midlands, england, united kingdom|https://www.linkedin.com/jobs/view/3906309940
hewett recruitment    bcorp™|graduate software developer|great malvern, england, united kingdom|https://www.linkedin.com/jobs/view/3945743989
polyai|software engineer - graduate (must be in uk)|london, england, united kingdom|https://www.linkedin.com/jobs/view/3924542691
oho group ltd|graduate software engineer|greater london, england, united kingdom|https://www.linkedin.com/jobs/view/3830973939
vaarst|graduate software engineer|bristol, england, united kingdom|https://www.linkedin.com/jobs/view/3770760653
jam recruitment|graduate software engineer|lutterworth, england, united kingdom|https://www.linkedin.com/jobs/view/3939644717
bennett & game recruitment limited|graduate software engineer|sandwich, england, united kingdom|https://www.linkedin.com/jobs/view/3881247766
mygwork - lgbtq+ business community|graduate software engineer|warton, england, united kingdom|https://www.linkedin.com/jobs/view/3911659185
tpp|graduate software developer|leeds, england, united kingdom|https://www.linkedin.com/jobs/view/3937599540
spectrum it recruitment|graduate software developer|east sussex, england, united kingdom|https://www.linkedin.com/jobs/view/3943041404
hiring people|graduate / junior software developer|sheffield, england, united kingdom|https://www.linkedin.com/jobs/view/3948653301
fruition it|graduate .net software developers|leeds, england, united kingdom|https://www.linkedin.com/jobs/view/3942151071
mygwork - lgbtq+ business community|graduate software engineer|barrow-in-furness, england, united kingdom|https://www.linkedin.com/jobs/view/3911656277
spectrum it recruitment|graduate software engineer|guildford, england, united kingdom|https://www.linkedin.com/jobs/view/3938660801
vaarst|graduate robotics software engineer|bristol, england, united kingdom|https://www.linkedin.com/jobs/view/3824358201
ncr atleos|graduate software engineer|dundee, scotland, united kingdom|https://www.linkedin.com/jobs/view/3940995306
enterprise recruitment ltd|graduate software engineer|hampshire, england, united kingdom|https://www.linkedin.com/jobs/view/3919318040
bae systems|graduate software engineer|east riding of yorkshire, england, united kingdom|https://www.linkedin.com/jobs/view/3913658294
ge vernova|software engineering graduate programme|rugby, england, united kingdom|https://www.linkedin.com/jobs/view/3921053427
samsung cambridge solution centre|graduate embedded software enginer|cambridge, england, united kingdom|https://www.linkedin.com/jobs/view/3943826856
jam recruitment|graduate mobile software engineer|lutterworth, england, united kingdom|https://www.linkedin.com/jobs/view/3939646568
cae|junior / graduate software engineer - flight simulator development|benson, england, united kingdom|https://www.linkedin.com/jobs/view/3930781365
esri|graduate software development engineer (rust)|edinburgh, scotland, united kingdom|https://www.linkedin.com/jobs/view/3931818604
capgemini engineering|graduate software engineering programme|bath, england, united kingdom|https://www.linkedin.com/jobs/view/3941886564
esri|graduate software development engineer (rust)|cardiff, wales, united kingdom|https://www.linkedin.com/jobs/view/3928846668
grb (graduate recruitment bureau)|graduate business analyst - insurance software products|west midlands, england, united kingdom|https://www.linkedin.com/jobs/view/3902359703
ic resources|graduate c++ software engineer|newcastle upon tyne, england, united kingdom|https://www.linkedin.com/jobs/view/3942090202
grb (graduate recruitment bureau)|graduate software engineer - summer 2024|surrey, england, united kingdom|https://www.linkedin.com/jobs/view/3892353241
acre|graduate backend software engineer (summer 2024)|london, england, united kingdom|https://www.linkedin.com/jobs/view/3868552896
robustelli ∙ soucy ∙ hussey, p.a.|software engineer mobile application development - graduate|leicester, england, united kingdom|https://www.linkedin.com/jobs/view/3934807981
cmc markets|information technology graduate - software development|greater london, england, united kingdom|https://www.linkedin.com/jobs/view/3940911185
hunter bond|2024 graduate software developer – elite fintech startup (up to £80k + bonus + hybrid)|greater london, england, united kingdom|https://www.linkedin.com/jobs/view/3948265922
ernest gordon recruitment|graduate architect (revit software)|northampton, england, united kingdom|https://www.linkedin.com/jobs/view/3944562525
redtech recruitment|software engineer &amp;ndash; mobile application development - graduate|leicester, england, united kingdom|https://www.linkedin.com/jobs/view/3938796992
remoteworker uk|graduate software developer|brighton, england, united kingdom|https://www.linkedin.com/jobs/view/3947099213
ernest gordon recruitment|graduate architect revit software|northampton, england, united kingdom|https://www.linkedin.com/jobs/view/3925518662
mygwork - lgbtq+ business community|2024 software dev engineer graduate|amsterdam, north holland, netherlands|https://www.linkedin.com/jobs/view/3857675446
amazon|2024 software dev engineer graduate|amsterdam, north holland, netherlands|https://www.linkedin.com/jobs/view/3877288574
amazon|2024 graduate software dev engineer|barcelona, catalonia, spain|https://www.linkedin.com/jobs/view/3894269474
cobblestone energy|graduate software engineer - dubai, uae|berlin, germany|https://www.linkedin.com/jobs/view/3641766308
delivery hero|graduate software engineer (ios) (all genders)|berlin, berlin, germany|https://www.linkedin.com/jobs/view/3944549174
amazon|2024 graduate software dev engineer|bucharest, bucharest, romania|https://www.linkedin.com/jobs/view/3877289645
cobblestone energy|graduate software engineer - dubai, uae|cork, county cork, ireland|https://www.linkedin.com/jobs/view/3641768130
cobblestone energy|graduate software engineer - dubai, uae|dublin, county dublin, ireland|https://www.linkedin.com/jobs/view/3641764476
mygwork - lgbtq+ business community|2024 graduate software dev engineer|dublin, county dublin, ireland|https://www.linkedin.com/jobs/view/3848277219
cobblestone energy|graduate software engineer - dubai, uae|istanbul, istanbul, worldwide|https://www.linkedin.com/jobs/view/3641765554
tiptopjob|graduate software developer|london, england, united kingdom|https://www.linkedin.com/jobs/view/3940432899
targetjobs uk|graduate software developer - london|london, england, united kingdom|https://www.linkedin.com/jobs/view/3939447958
oho group ltd|graduate software engineer|london area, united kingdom|https://www.linkedin.com/jobs/view/3916789939
redtech recruitment|graduate software engineer (python / c / c++/ java)|hertford, england, united kingdom|https://www.linkedin.com/jobs/view/3929868194
spectrum it recruitment|graduate software engineer|surrey, england, united kingdom|https://www.linkedin.com/jobs/view/3938879209
enterprise recruitment ltd|graduate software engineer £45k|london, england, united kingdom|https://www.linkedin.com/jobs/view/3656386068
hunter bond|graduate software engineering opportunity- up to £80,000 + bonus + package|london area, united kingdom|https://www.linkedin.com/jobs/view/3942639334
acre|graduate software engineer in test|london, england, united kingdom|https://www.linkedin.com/jobs/view/3922533742
hitachi energy|uk graduate - enterprise software|surrey, england, united kingdom|https://www.linkedin.com/jobs/view/3948540149
hitachi energy|uk graduate position enterprise software|surrey, england, united kingdom|https://www.linkedin.com/jobs/view/3948534989
software works for you|graduate software customer support agent|sevenoaks, england, united kingdom|https://www.linkedin.com/jobs/view/3931645578
pepper mill|graduate software engineer|manchester, england, united kingdom|https://www.linkedin.com/jobs/view/3918932115
targetjobs uk|graduate software developer - manchester|manchester, england, united kingdom|https://www.linkedin.com/jobs/view/3939453141
targetjobs uk|graduate software developer - manchester|manchester, england, united kingdom|https://www.linkedin.com/jobs/view/3939447746
couchbase|graduate software engineer - kv engine|manchester, england, united kingdom|https://www.linkedin.com/jobs/view/3862847095
cobblestone energy|graduate software engineer - dubai, uae|milan, lombardy, italy|https://www.linkedin.com/jobs/view/3641761784
european recruitment|software engineer (graduating student)|munich, bavaria, germany|https://www.linkedin.com/jobs/view/3941118094
european recruitment|graduate it/software consultant|munich, bavaria, germany|https://www.linkedin.com/jobs/view/3949243944
mygwork - lgbtq+ business community|2024 graduate software dev engineer|clichy, île-de-france, france|https://www.linkedin.com/jobs/view/3869790563
doctor|2024 graduate software dev engineer|clichy, île-de-france, france|https://www.linkedin.com/jobs/view/3869409536
mygwork - lgbtq+ business community|erp foundations: software engineer in test - fresh graduate|prague, prague, worldwide|https://www.linkedin.com/jobs/view/3932089683
cobblestone energy|graduate software engineer - dubai, uae|rome, latium, italy|https://www.linkedin.com/jobs/view/3641767250
amazon|2024 graduate software dev engineer|warsaw, mazowieckie, poland|https://www.linkedin.com/jobs/view/3900046790
fortna|graduate software commissioning engineer|houten, utrecht, netherlands|https://www.linkedin.com/jobs/view/3911211177
cobblestone energy|graduate software engineer - dubai, uae|łódź, łódzkie, poland|https://www.linkedin.com/jobs/view/3641762704
amazon web services (aws)|graduate software development engineer – redshift query processing|berlin, germany|https://www.linkedin.com/jobs/view/3929279035
amazon|2024 graduate software dev engineer|gdańsk, pomorskie, poland|https://www.linkedin.com/jobs/view/3900048395
mygwork - lgbtq+ business community|2024 graduate software dev engineer|barcelona, catalonia, spain|https://www.linkedin.com/jobs/view/3897183536
doctor|2024 graduate software dev engineer|barcelona, catalonia, spain|https://www.linkedin.com/jobs/view/3890820854
doctor|2024 graduate software dev engineer|gdańsk, pomorskie, poland|https://www.linkedin.com/jobs/view/3897719549
doctor|2024 graduate software dev engineer|asti, piedmont, italy|https://www.linkedin.com/jobs/view/3918517279
cobblestone energy|graduate software engineer - dubai, uae|marseille, provence-alpes-côte d'azur, france|https://www.linkedin.com/jobs/view/3641761748
microchip technology inc.|graduate virtual development platform software engineer|dublin, county dublin, ireland|https://www.linkedin.com/jobs/view/3907347649
mygwork - lgbtq+ business community|2024 graduate software dev engineer|gdańsk, pomorskie, poland|https://www.linkedin.com/jobs/view/3899957676
mygwork - lgbtq+ business community|2024 graduate software dev engineer|iaşi, iaşi, romania|https://www.linkedin.com/jobs/view/3852322662
sage|graduate software engineer .net|barcelona, catalonia, spain|https://www.linkedin.com/jobs/view/3947636118
hunter bond|graduate software engineer - up to £200k comp + benefits - hybrid working|greater london, england, united kingdom|https://www.linkedin.com/jobs/view/3946485914
tiptopjob|graduate software engineer|london, england, united kingdom|https://www.linkedin.com/jobs/view/3942181147
pepper mill|graduate software engineer|birmingham, england, united kingdom|https://www.linkedin.com/jobs/view/3918930299
pepper mill|graduate software engineer|bristol, england, united kingdom|https://www.linkedin.com/jobs/view/3918933042
gearset|graduate software engineer|cambridge, england, united kingdom|https://www.linkedin.com/jobs/view/3944490425
pinecone|graduate software engineer, field operations|manchester, england, united kingdom|https://www.linkedin.com/jobs/view/3870975263
jooble|graduate software engineer|kent, england, united kingdom|https://www.linkedin.com/jobs/view/3944644765
cae usa|junior / graduate software engineer - flight simulator development|benson, england, united kingdom|https://www.linkedin.com/jobs/view/3932810791
targetjobs uk|graduate software engineer|southampton, england, united kingdom|https://www.linkedin.com/jobs/view/3939808126
jonathan lee recruitment|graduate software engineer|coalville, england, united kingdom|https://www.linkedin.com/jobs/view/3934404015
targetjobs uk|software engineering graduate - space|harwell, england, united kingdom|https://www.linkedin.com/jobs/view/3939474565
oho group ltd|graduate software engineer|london area, united kingdom|https://www.linkedin.com/jobs/view/3941343112
perforce software|[graduate] associate software engineer|belfast, northern ireland, united kingdom|https://www.linkedin.com/jobs/view/3938565723
leonardo|graduate software engineer|southampton, england, united kingdom|https://www.linkedin.com/jobs/view/3778192327
remoteworker uk|software engineer (junior or graduate)|great malvern, england, united kingdom|https://www.linkedin.com/jobs/view/3946552255
