company|title|location|link
agilent technologies|graduate remote support engineer (m/f/d) – flüssigchromatographie (hplc)|waldbronn, baden-württemberg, germany|https://www.linkedin.com/jobs/view/4021673434
canonical|software engineer - go - container images|dresden, saxony, germany|https://www.linkedin.com/jobs/view/4089848877
canonical|software engineer - go - container images|dresden, saxony, germany|https://www.linkedin.com/jobs/view/4068933849
canonical|software engineer - go - container images|dresden, saxony, germany|https://www.linkedin.com/jobs/view/4067126944
canonical|technical author (multiple roles and seniority levels)|frankfurt am main, hesse, germany|https://www.linkedin.com/jobs/view/4068265706
huawei|storage engineer / it network engineer|düsseldorf, north rhine-westphalia, germany|https://www.linkedin.com/jobs/view/4102788909
amazon web services (aws)|associate professional services consultant - early career program|munich, bavaria, germany|https://www.linkedin.com/jobs/view/4114787181
unternehmertum|uvc partners: junior venture scout working student (m/f/x)|munich, bavaria, germany|https://www.linkedin.com/jobs/view/4106260964
canonical|technical author (multiple roles and seniority levels)|hamburg, hamburg, germany|https://www.linkedin.com/jobs/view/4068266721
computacenter|trainee it consulting - softwareentwicklung w/m/d|frankfurt am main, hesse, germany|https://www.linkedin.com/jobs/view/4096377283
emerson|service engineer (m/w/d)|düsseldorf, north rhine-westphalia, germany|https://www.linkedin.com/jobs/view/3932192940
emerson|testsystem developer (m/f/d) - product development & electronics focus|baden-württemberg, germany|https://www.linkedin.com/jobs/view/4099276938
alten|absolvent naturwissenschaften (all gender)|stuttgart, baden-württemberg, germany|https://www.linkedin.com/jobs/view/4098096541
dornier medtech|cybersecurity expert(m/f/d)|greater munich metropolitan area, worldwide|https://www.linkedin.com/jobs/view/4086223484
yunex traffic|absolvent (w/m/d) der informatik / elektrotechnik / netzwerktechnik|berlin metropolitan area, worldwide|https://www.linkedin.com/jobs/view/4036800212
university of konstanz|doctoral position or postdoctoral researcher in human-computer interaction|constance, baden-württemberg, germany|https://www.linkedin.com/jobs/view/4090720927
sap fioneer|global head talent management|berlin, berlin, germany|https://www.linkedin.com/jobs/view/4073410704
bridgingit|trainee softwareentwicklung (wmd)|frankfurt am main, hesse, germany|https://www.linkedin.com/jobs/view/3586238453
finanz informatik|trainee business/banking|hannover, lower saxony, germany|https://www.linkedin.com/jobs/view/4103775986
yunex traffic|absolvent (w/m/d) der informatik / elektrotechnik / netzwerktechnik|bremen, bremen, germany|https://www.linkedin.com/jobs/view/3719946109
yunex traffic|absolvent (w/m/d) der informatik / elektrotechnik / netzwerktechnik|erfurt, thuringia, germany|https://www.linkedin.com/jobs/view/4036497422
sap fioneer|global head talent management|walldorf, hesse, germany|https://www.linkedin.com/jobs/view/4073410705
sap|junior associate (f/m/d) for sap responsible design & production (circular economy)|markdorf, baden-württemberg, germany|https://www.linkedin.com/jobs/view/4096123279
join.com|10xcrm (fesma solutions gmbh): trainee (m/w/d) in automatisierungen im bereich marketing und vertrieb in bremen|bremen, bremen, germany|https://www.linkedin.com/jobs/view/4111737281
asco engineering gmbh|htl absolvent:in stahlbauplanung (m/w/d)|neustadt, brandenburg, germany|https://www.linkedin.com/jobs/view/4062232535
infosys bpm|technical support executive|berlin, germany|https://www.linkedin.com/jobs/view/4120419884
fichtner|hydropower designer (m/f/x)|stuttgart region, worldwide|https://www.linkedin.com/jobs/view/4090755713
fortinet|systems engineer - subject matter expert|frankfurt, hesse, germany|https://www.linkedin.com/jobs/view/4104785434
hdi group|trainee it management & strategy|cologne, north rhine-westphalia, germany|https://www.linkedin.com/jobs/view/4089614954
fortinet|systems engineer - subject matter expert|frankfurt, hesse, germany|https://www.linkedin.com/jobs/view/4104789268
charles river associates|consulting associate (european competition practice) - m/f/d|greater dusseldorf area, worldwide|https://www.linkedin.com/jobs/view/4017824028
fichtner|hydropower designer (m/f/x)|frankfurt, hesse, germany|https://www.linkedin.com/jobs/view/4090760231
sap|business processes associate consultant (f/m/d) with focus on s/4hana manufacturing and logistics|sankt leon-rot, baden-württemberg, germany|https://www.linkedin.com/jobs/view/4088752597
insider.|sales development representative - germany|berlin, berlin, germany|https://www.linkedin.com/jobs/view/4042355665
yunex traffic|absolvent (w/m/d) der elektrotechnik im projektmanagement|essen, north rhine-westphalia, germany|https://www.linkedin.com/jobs/view/3964149632
powerco|(senior) expert engineer for automation and machine connectivity (all genders)|salzgitter, lower saxony, germany|https://www.linkedin.com/jobs/view/4011622889
fortinet|systems engineer – subject matter expert – public sector government|frankfurt, hesse, germany|https://www.linkedin.com/jobs/view/4104788291
canonical|junior hr generalist - emea|frankfurt am main, hesse, germany|https://www.linkedin.com/jobs/view/4105730757
canonical|junior hr generalist - emea|leipzig, saxony, germany|https://www.linkedin.com/jobs/view/4105732355
vattenfall|international trainee - project construction management|berlin, berlin, germany|https://www.linkedin.com/jobs/view/4122797480
canonical|junior hr generalist - emea|nuremberg, bavaria, germany|https://www.linkedin.com/jobs/view/4105733307
canonical|junior hr generalist - emea|düsseldorf, north rhine-westphalia, germany|https://www.linkedin.com/jobs/view/4105731480
wunderflats|technical team leader software engineering (f/m/d)|berlin, germany|https://www.linkedin.com/jobs/view/4117165712
fortinet|systems engineer – subject matter expert – manufacturing/transport|frankfurt, hesse, germany|https://www.linkedin.com/jobs/view/4104785441
thost projektmanagement gmbh|ahs2401 - absolvent*in / junior projektmanager*in (m/w/d) in der projektsteuerung|pforzheim, baden-württemberg, germany|https://www.linkedin.com/jobs/view/3955559121
canonical|embedded linux field engineering manager|düsseldorf, north rhine-westphalia, germany|https://www.linkedin.com/jobs/view/4122063138
fortinet|systems engineer – subject matter expert – manufacturing/transport|frankfurt, hesse, germany|https://www.linkedin.com/jobs/view/4104785492
infopro digital|strategy analyst (m/f/x)|germany|https://www.linkedin.com/jobs/view/4122154288
atmosfair ggmbh|trainee on the job im bereich klimaschutz-projektentwicklung (d/m/w)|berlin, berlin, germany|https://www.linkedin.com/jobs/view/4091670131
cma cgm|fleet officer trainee|hamburg, hamburg, germany|https://www.linkedin.com/jobs/view/4120419278
ge vernova|decarbonization industry principal, power energy and resources software (pers)|bavaria, germany|https://www.linkedin.com/jobs/view/4127705093
bechtle|hochschulabsolvent it vertrieb / e-commerce (w/m/d)|neckarsulm, baden-württemberg, germany|https://www.linkedin.com/jobs/view/3956479255
omni:us|business development representative (all genders)|berlin, berlin, germany|https://www.linkedin.com/jobs/view/4114698013
fortinet|systems engineer – subject matter expert – public sector regional|hamburg, hamburg, germany|https://www.linkedin.com/jobs/view/4104786451
hilti deutschland|karriereprogramm sales & marketing für hochschulabsolventen (m/w/d)|fürth, bavaria, germany|https://www.linkedin.com/jobs/view/4061569058
hilti deutschland|karriereprogramm sales & marketing für hochschulabsolventen (m/w/d)|karlsruhe, baden-württemberg, germany|https://www.linkedin.com/jobs/view/4010357377
emerson|product manager for servo motion technology (m/f/d)|amberg, bavaria, germany|https://www.linkedin.com/jobs/view/4044571386
canonical|embedded linux software engineering manager - platform optimisation|hamburg, hamburg, germany|https://www.linkedin.com/jobs/view/4088432156
emerson|product manager for servo motion technology (m/f/d)|laatzen, lower saxony, germany|https://www.linkedin.com/jobs/view/4044570631
hilti deutschland|karriereprogramm sales & marketing für hochschulabsolventen (m/w/d)|passau, bavaria, germany|https://www.linkedin.com/jobs/view/4061567477
canonical|engineering manager - apparmor|leipzig, saxony, germany|https://www.linkedin.com/jobs/view/4118751942
canonical|engineering manager - apparmor|dresden, saxony, germany|https://www.linkedin.com/jobs/view/4118756253
we.conect - discover a unique b2b event experience!|business development manager - b2b events international (m/f/d)|berlin, berlin, germany|https://www.linkedin.com/jobs/view/4073751385
sap|service associate (f/m/d) in sap mailroom (1 year temp.)|walldorf, baden-württemberg, germany|https://www.linkedin.com/jobs/view/4124165428
sap|service associate (f/m/d) in sap mailroom (1 year temp.)|walldorf, baden-württemberg, germany|https://www.linkedin.com/jobs/view/4124097397
canonical|embedded linux software engineering manager - platform optimisation|düsseldorf, north rhine-westphalia, germany|https://www.linkedin.com/jobs/view/4088429811
canonical|embedded linux software engineering manager - platform optimisation|leipzig, saxony, germany|https://www.linkedin.com/jobs/view/4088430506
copeland|senior product manager hvac|aachen, north rhine-westphalia, germany|https://www.linkedin.com/jobs/view/4077680325
sap|service associate (f/m/d) in sap mailroom (1 year temp.)|walldorf, baden-württemberg, germany|https://www.linkedin.com/jobs/view/4124164475
fortinet|systems engineer, subject matter expert - vertical retail & media / chemical & pharma|frankfurt, hesse, germany|https://www.linkedin.com/jobs/view/4104784565
newrest|junior accountant intern (unpaid, potentially paid depending on performance)|kelsterbach, hesse, germany|https://www.linkedin.com/jobs/view/4031166465
hilti deutschland|karriereprogramm sales & marketing für hochschulabsolventen (m/w/d)|villingen-schwenningen, baden-württemberg, germany|https://www.linkedin.com/jobs/view/4010353883
amazon web services (aws)|logistics specialist , data center communities|frankfurt, hesse, germany|https://www.linkedin.com/jobs/view/4019404957
sap|service associate (f/m/d) in sap transportation services (1 year temp.)|sankt leon-rot, baden-württemberg, germany|https://www.linkedin.com/jobs/view/4120575958
hilti deutschland|karriereprogramm sales & marketing für hochschulabsolventen (m/w/d)|biberach an der riß, baden-württemberg, germany|https://www.linkedin.com/jobs/view/4010358350
hilti deutschland|karriereprogramm sales & marketing für hochschulabsolventen (m/w/d) hamburg/kiel|kiel, schleswig-holstein, germany|https://www.linkedin.com/jobs/view/4086173903
sap|service associate (f/m/d) in sap transportation services (1 year temp.)|sankt leon-rot, baden-württemberg, germany|https://www.linkedin.com/jobs/view/4120579637
thost projektmanagement gmbh|akra2401 - junior-projektmanager*in / absolvent*in (m/w/d) in der projektsteuerung bereich bau / immobilien|munich, bavaria, germany|https://www.linkedin.com/jobs/view/3955558159
ge vernova|europe decarbonization sales director, power energy resources (pers)|bavaria, germany|https://www.linkedin.com/jobs/view/4126013819
opentext|account development executive - french speaking|grasbrunn, bavaria, germany|https://www.linkedin.com/jobs/view/4123115038
emerson|werkstudent/in hr (m/w/d)|remscheid, north rhine-westphalia, germany|https://www.linkedin.com/jobs/view/4012699276
french consulting|special needs identification and assignment coordinator|spangdahlem, rhineland-palatinate, germany|https://www.linkedin.com/jobs/view/4126646148
canonical|engineering manager - ubuntu security|leipzig, saxony, germany|https://www.linkedin.com/jobs/view/4118548663
emerson|key account manager prozess- und chemieindustrie nrw|düsseldorf, north rhine-westphalia, germany|https://www.linkedin.com/jobs/view/4084375150
canonical|engineering manager - security standards and hardening|berlin, berlin, germany|https://www.linkedin.com/jobs/view/4118739977
canonical|hr generalist - emea|berlin, berlin, germany|https://www.linkedin.com/jobs/view/4068133606
canonical|engineering manager - security standards and hardening|nuremberg, bavaria, germany|https://www.linkedin.com/jobs/view/4118746239
canonical|engineering manager - security standards and hardening|frankfurt am main, hesse, germany|https://www.linkedin.com/jobs/view/4118741951
emerson|werkstudent/in hr marketing/ employer branding (m/w/d)|remscheid, north rhine-westphalia, germany|https://www.linkedin.com/jobs/view/4005874864
ul solutions|senior software sales executive esg|neu-isenburg, hesse, germany|https://www.linkedin.com/jobs/view/4069162043
canonical|cloud professional services manager|frankfurt am main, hesse, germany|https://www.linkedin.com/jobs/view/4069169970
canonical|engineering manager - security standards and hardening|munich, bavaria, germany|https://www.linkedin.com/jobs/view/4118739975
ul solutions|senior sales executive, software , product stewardship|neu-isenburg, hesse, germany|https://www.linkedin.com/jobs/view/4069160271
canonical|cloud professional services manager|hamburg, hamburg, germany|https://www.linkedin.com/jobs/view/4069177197
canonical|cloud professional services manager|munich, bavaria, germany|https://www.linkedin.com/jobs/view/4069173667
canonical|cloud professional services manager|düsseldorf, north rhine-westphalia, germany|https://www.linkedin.com/jobs/view/4069171808
canonical|cloud professional services manager|leipzig, saxony, germany|https://www.linkedin.com/jobs/view/4069176116
canonical|hr generalist - emea|düsseldorf, north rhine-westphalia, germany|https://www.linkedin.com/jobs/view/4068136109
ul solutions|senior sales executive, software , product stewardship|krefeld, north rhine-westphalia, germany|https://www.linkedin.com/jobs/view/4069162042
olympus emea|communications manager (m/f/d)|hamburg, hamburg, germany|https://www.linkedin.com/jobs/view/4071395037
finovesta gmbh|(fach-) hochschulabsolventen als wertpapierhändler (m/w/d)|greater dusseldorf area, worldwide|https://www.linkedin.com/jobs/view/3925395439
canonical|cloud professional services manager|nuremberg, bavaria, germany|https://www.linkedin.com/jobs/view/4069169971
emerson|commercial excellence director|langenfeld, north rhine-westphalia, germany|https://www.linkedin.com/jobs/view/4121129385
sap|associate customer service manager (f/m/d)|dresden, saxony, germany|https://www.linkedin.com/jobs/view/4098449561
opentext|account development executive - german speaking|grasbrunn, bavaria, germany|https://www.linkedin.com/jobs/view/4096869220
emerson|sales operations process manager (m/f/d)|munich, bavaria, germany|https://www.linkedin.com/jobs/view/4096081805
mpc capital ag|chartering manager (m/f/d) drybulk - netherlands|hamburg, hamburg, germany|https://www.linkedin.com/jobs/view/4107697249
emerson|teamleiter montage|baden-württemberg, germany|https://www.linkedin.com/jobs/view/3775361058
emerson|transportation technical marketer (m/f/d)|munich, bavaria, germany|https://www.linkedin.com/jobs/view/4084835528
emerson|transportation technical marketer (m/f/d)|germany|https://www.linkedin.com/jobs/view/4084834805
netzsch group|student (m/f/d) for final thesis in product development|waldkraiburg, bavaria, germany|https://www.linkedin.com/jobs/view/4125727764
amazon|engineering intern|berlin, berlin, germany|https://www.linkedin.com/jobs/view/4107202263
motorschadenvergleich.de|software-entwicklung & it - trainee/quereinsteiger|mittelhof, rhineland-palatinate, germany|https://www.linkedin.com/jobs/view/4117299080
finanz informatik|trainee it (m/w/d)|frankfurt am main, hesse, germany|https://www.linkedin.com/jobs/view/4109235953
netzsch pumps & systems usa|student (m/f/d) for final thesis in product development|waldkraiburg, bavaria, germany|https://www.linkedin.com/jobs/view/4125487867
german aerospace center (dlr)|student aerospace/electrical engineering, computer science or similar (f/m/x)|brunswick, lower saxony, germany|https://www.linkedin.com/jobs/view/4025410432
unternehmertum|unsolicited application: intern or working student for our investment team at uvc|munich, bavaria, germany|https://www.linkedin.com/jobs/view/3871218662
imms institut für mikroelektronik- und mechatronik-systeme gemeinnützige gmbh (imms gmbh)|student (m/f/d): characterise a nanopositioning system|ilmenau, thuringia, germany|https://www.linkedin.com/jobs/view/3948805193
german aerospace center (dlr)|student of aerospace/electrical engineering, computer science, or similar (f/m/x)|brunswick, lower saxony, germany|https://www.linkedin.com/jobs/view/4015946040
testo solutions global|trainee (m/w/d) testo saveris gmbh – karriereeinstieg für young professionals|titisee-neustadt, baden-württemberg, germany|https://www.linkedin.com/jobs/view/4096868299
german aerospace center (dlr)|student/in (w/m/d) - informatik, medieninformatik, game design o. ä.|sankt augustin, north rhine-westphalia, germany|https://www.linkedin.com/jobs/view/4029163448
bauhaus luftfahrt|student (m/f/d) for a master's thesis in the field of fuel cell and cooling system design for aviation|greater munich metropolitan area, worldwide|https://www.linkedin.com/jobs/view/4124995722
german aerospace center (dlr)|student/in (w/m/d) informatik, luftfahrttechnik o. ä.|hamburg, hamburg, germany|https://www.linkedin.com/jobs/view/4063829785
german aerospace center (dlr)|student/in informatik o. ä. (w/m/d)|oberpfaffenhofen, bavaria, germany|https://www.linkedin.com/jobs/view/4063832212
union investment|trainee (m/w/d) informationstechnologie plus|frankfurt am main, hesse, germany|https://www.linkedin.com/jobs/view/4084129931
german aerospace center (dlr)|student/in informatik o. ä. (w/m/d)|brunswick, lower saxony, germany|https://www.linkedin.com/jobs/view/4071990221
vector informatik|trainee softwareentwicklung embedded (m/w/d)|stuttgart, baden-württemberg, germany|https://www.linkedin.com/jobs/view/3786930051
tso-data|trainee (w/m/d)|nuremberg, bavaria, germany|https://www.linkedin.com/jobs/view/4104130779
sinn power|thesis im maschinenbauwesen für erneuerbare energien - schwerpunkt konstruktion (w/m/d)|gauting, bavaria, germany|https://www.linkedin.com/jobs/view/4124881180
gob software & systeme gmbh & co. kg|trainee vertrieb (w/m/d) b2b softwarelösungen|krefeld, north rhine-westphalia, germany|https://www.linkedin.com/jobs/view/3972613662
ista|duale/r student/in - bachelor of science in wirtschaftsinformatik (w/m/d)|essen, north rhine-westphalia, germany|https://www.linkedin.com/jobs/view/4106424640
german aerospace center (dlr)|student/in mechatronik, maschinenbau, elektrotechnik o. ä. (w/m/d)|stuttgart, baden-württemberg, germany|https://www.linkedin.com/jobs/view/3983552956
sanofi|initiativbewerbung studierende thesis (all genders)|frankfurt am main, hesse, germany|https://www.linkedin.com/jobs/view/4093659862
dermalog identification systems gmbh|student assistant für stichprobenaufnahmen (m/w/d)|hamburg, hamburg, germany|https://www.linkedin.com/jobs/view/4074022945
rhön-klinikum ag|dualer student (m/w/d) digital health|bad neustadt an der saale, bavaria, germany|https://www.linkedin.com/jobs/view/3789486294
sap|phd student (f/m/d) - business ai research|walldorf, baden-württemberg, germany|https://www.linkedin.com/jobs/view/4086245299
gradfuel europe|apparel design internship|berlin, berlin, germany|https://www.linkedin.com/jobs/view/4090662019
bmw group|dualer student künstliche intelligenz (w/m/x)|dingolfing, bavaria, germany|https://www.linkedin.com/jobs/view/3921046748
gradfuel europe|apparel design internship|herzogenaurach, bavaria, germany|https://www.linkedin.com/jobs/view/4090657560
eurofins humangenetik & pränatal-medizin|student für das probenmanagement (m/w/d), flexible arbeitszeiten|leipzig, saxony, germany|https://www.linkedin.com/jobs/view/4115248683
sanofi|initiativbewerbung studierende praktikum (all genders)|frankfurt am main, hesse, germany|https://www.linkedin.com/jobs/view/4093666082
sap|working student (f/m/d) - sap services germany|walldorf, baden-württemberg, germany|https://www.linkedin.com/jobs/view/4087462685
pilz|student für abschlussarbeit im bereich entwicklung technologien (m/w/d)|ostfildern, baden-württemberg, germany|https://www.linkedin.com/jobs/view/3932768297
mediserv bank gmbh|student der wirtschaftsinformatik (m/w/d) / duales studium - asw zum 01.09.2025|saarbrücken, saarland, germany|https://www.linkedin.com/jobs/view/3931735171
computacenter|trainee it consulting - softwareentwicklung w/m/d|ludwigshafen, rhineland-palatinate, germany|https://www.linkedin.com/jobs/view/4096375459
german aerospace center (dlr)|student/in maschinenbau, fahrzeugtechnik o. ä. (w/m/d)|stuttgart, baden-württemberg, germany|https://www.linkedin.com/jobs/view/4064490477
hessische zentrale für datenverarbeitung|dualer student (m/w/d) wirtschaftsinformatik / schwerpunkt egovernment (b. sc.)|wiesbaden, hesse, germany|https://www.linkedin.com/jobs/view/4111195031
valeo|thesis (m/f/d) in the field of traffic simulation|bietigheim-bissingen, baden-württemberg, germany|https://www.linkedin.com/jobs/view/3996234037
huawei|phd student: confidential llm systems / confidential disaggregated architectures (m/f/d)|munich, bavaria, germany|https://www.linkedin.com/jobs/view/3994482649
dat deutsche automobil treuhand|dhbw student informatik (m/w/d)|ostfildern, baden-württemberg, germany|https://www.linkedin.com/jobs/view/4078688012
docuware|initiativbewerbung für student:innen und schüler:innen (m/w/d)|germering, bavaria, germany|https://www.linkedin.com/jobs/view/3910028436
imms institut für mikroelektronik- und mechatronik-systeme gemeinnützige gmbh (imms gmbh)|student (m/w/d): layoutstrategien für kapazitive dac-arrays von sar-adc|ilmenau, thuringia, germany|https://www.linkedin.com/jobs/view/4077434167
adesso se|trainee sicherheitsinfrastruktur (all genders)|ulm, baden-württemberg, germany|https://www.linkedin.com/jobs/view/3733042407
adesso se|trainee sicherheitsinfrastruktur (all genders)|stuttgart, baden-württemberg, germany|https://www.linkedin.com/jobs/view/3733041591
vfm-gruppe|trainee oder experte gewerbeversicherung (m/w/d)|pegnitz, bavaria, germany|https://www.linkedin.com/jobs/view/4105636463
schwarz digits|dhbw student (m/w/d) wirtschaftsinformatik mit schwerpunkt softwareengineering - start 2025|germany|https://www.linkedin.com/jobs/view/4093657574
accenture dach|trainee sap banking (all genders)|berlin, berlin, germany|https://www.linkedin.com/jobs/view/4058541441
valeo|thesis (m/f/d) in the field of traffic simulation|bietigheim-bissingen, baden-württemberg, germany|https://www.linkedin.com/jobs/view/3996252551
trumpf|thesis plasma-load emulation with a software defined radio (ss25)|freiburg, baden-württemberg, germany|https://www.linkedin.com/jobs/view/4118592429
dat deutsche automobil treuhand|dhbw student wirtschaftsinformatik (m/w/d)|ostfildern, baden-württemberg, germany|https://www.linkedin.com/jobs/view/4036982321
computacenter|trainee it consulting - netzwerk w/m/d|frankfurt am main, hesse, germany|https://www.linkedin.com/jobs/view/4096364665
ifm|dualer student der softwaretechnologie (b.sc.) (m/w/d) technischen hochschule mittelhessen (thm)|siegen, north rhine-westphalia, germany|https://www.linkedin.com/jobs/view/3980176562
computacenter|trainee it consulting - netzwerk w/m/d|ludwigshafen, rhineland-palatinate, germany|https://www.linkedin.com/jobs/view/4096370389
philips|trainee programm - sales für innovative gesundheitslösungen (m/w/d)|westphalia, north rhine-westphalia, germany|https://www.linkedin.com/jobs/view/4060126920
philips|trainee programm - sales für innovative gesundheitslösungen (m/w/d)|berlin metropolitan area, worldwide|https://www.linkedin.com/jobs/view/4060132526
wilken software group|schüler- bzw. schnupperpraktikum|ulm, baden-württemberg, germany|https://www.linkedin.com/jobs/view/4104377783
emerson|ausbildung als zerspanungsmechaniker/-in (m/w/d)|remscheid, north rhine-westphalia, germany|https://www.linkedin.com/jobs/view/4018520650
threenitas|full-stack developer trainee (internship)|athens, attiki, greece|https://www.linkedin.com/jobs/view/3971884961
deloitte|junior iot developer @ thessaloniki, patras, heraklion, ioannina|iráklion, crete, greece|https://www.linkedin.com/jobs/view/3927270833
improvit|software engineer / it consultant|athens, attiki, greece|https://www.linkedin.com/jobs/view/4111370861
deloitte|junior iot developer @ thessaloniki, patras, heraklion, ioannina|thessaloniki, central macedonia, greece|https://www.linkedin.com/jobs/view/3927269923
improvit|software engineer/ it consultant|athens, attiki, greece|https://www.linkedin.com/jobs/view/4094606361
deloitte|junior iot developer @ thessaloniki, patras, heraklion, ioannina|patras, western greece, greece|https://www.linkedin.com/jobs/view/3927270832
netu group|full stack software developer|athens, attiki, greece|https://www.linkedin.com/jobs/view/4111986190
canonical|graduate/associate software engineer - build & release infrastructure|marousi, attiki, greece|https://www.linkedin.com/jobs/view/4121135420
canonical|graduate/associate software engineer - build & release infrastructure|athens, attiki, greece|https://www.linkedin.com/jobs/view/4121139008
vodafone|career opportunities @ tech hub thessaloniki|thessaloniki, central macedonia, greece|https://www.linkedin.com/jobs/view/3955084194
canonical|software engineer - python - container images|athens, attiki, greece|https://www.linkedin.com/jobs/view/4089849854
