company|title|location|link
txt group|global trainee program- switzerland|cologno monzese, lombardy, italy|https://www.linkedin.com/jobs/view/4108487599
hellas gold s.a.|junior mining engineer|stageira-akanthos, central macedonia, greece|https://www.linkedin.com/jobs/view/4097301078
ge-n.nl  graduate engineer - network|junior e&i engineer|sneek, friesland, netherlands|https://www.linkedin.com/jobs/view/4112796580
ion|business analyst - graduate development program|collecchio, emilia-romagna, italy|https://www.linkedin.com/jobs/view/4016661341
vestas|control software trainee|leça do bailio, porto, portugal|https://www.linkedin.com/jobs/view/4077455630
hewlett packard enterprise|technical support engineer - graduate|las rozas de madrid, community of madrid, spain|https://www.linkedin.com/jobs/view/4080828498
aalto university|future talent in it, data warehouse engineer trainee|espoo, uusimaa, finland|https://www.linkedin.com/jobs/view/4102531649
danfoss|summer trainee, software|tampere, pirkanmaa, finland|https://www.linkedin.com/jobs/view/4114404093
remondis it|trainee requirements engineer (m/w/d)|lünen, north rhine-westphalia, germany|https://www.linkedin.com/jobs/view/4092810218
sambanova systems|simulation engineer|stockholm, stockholm county, sweden|https://www.linkedin.com/jobs/view/4049935509
bosch|junior managers program – research & development automated driving – trainee program (f/m/div.)|gerlingen, baden-württemberg, germany|https://www.linkedin.com/jobs/view/4120412572
atkinsréalis|graduate civil engineer|dublin, county dublin, ireland|https://www.linkedin.com/jobs/view/4024713793
gaming laboratories international, llc|math analyst i_nl|haarlem, north holland, netherlands|https://www.linkedin.com/jobs/view/4124990132
alstom|computer engineering trainee (internship at alstom talent energy program)|madrid, community of madrid, spain|https://www.linkedin.com/jobs/view/4092851132
pm group|graduate process engineer - 2025|antwerp, flemish region, belgium|https://www.linkedin.com/jobs/view/4119945772
pareto|graduate management scheme|leipzig, saxony, germany|https://www.linkedin.com/jobs/view/4047490893
texas instruments|systems engineering intern (m/f/d)|freising, bavaria, germany|https://www.linkedin.com/jobs/view/4117404298
vestas|control software trainee|porto, portugal|https://www.linkedin.com/jobs/view/4122675658
atta systems|backend engineer (2-4yrs experience, java, spring framework)|bucharest, bucharest, romania|https://www.linkedin.com/jobs/view/3803570305
valeo|r&d test engineering graduate (12 month fixed term contract)|tuam, county galway, ireland|https://www.linkedin.com/jobs/view/4124725723
jensen hughes|graduate fire engineer 2025 start - dublin|dublin, county dublin, ireland|https://www.linkedin.com/jobs/view/4052097866
jensen hughes|graduate fire engineer 2025 start - galway/cork|galway, county galway, ireland|https://www.linkedin.com/jobs/view/4083482187
ict strypes portugal|embedded software engineer (porto/lisboa)|porto, portugal|https://www.linkedin.com/jobs/view/4064820363
pm group|graduate architect dublin 2025|dublin, county dublin, ireland|https://www.linkedin.com/jobs/view/4014704751
live nation entertainment|trainee it technician|dublin, county dublin, ireland|https://www.linkedin.com/jobs/view/4073094409
thales|graduate programme – parcours chef de projet technique logiciel|gennevilliers, île-de-france, france|https://www.linkedin.com/jobs/view/3937236844
ayesa|ingeniero/a de caminos - programa graduate worldwide|greater santa cruz de tenerife metropolitan area, worldwide|https://www.linkedin.com/jobs/view/4119530094
hp|returns operations specialist (graduate role)|bucharest, bucharest, romania|https://www.linkedin.com/jobs/view/4098600356
intersystems italia|graduate clinical intern|milan, lombardy, italy|https://www.linkedin.com/jobs/view/4127505521
sap|junior developer in cloud erp (public cloud engineering)|brno, south moravia, worldwide|https://www.linkedin.com/jobs/view/4072484669
setanta college|graduate sales executive|italy|https://www.linkedin.com/jobs/view/4121107118
community phone|product engineer|greece|https://www.linkedin.com/jobs/view/4098501358
teamsoft servizi professionali|neolaureato/a in economia|forlì, emilia-romagna, italy|https://www.linkedin.com/jobs/view/4124345409
qibit italy|neolaureato/a in statistica - junior sas developer|milan, lombardy, italy|https://www.linkedin.com/jobs/view/4123159749
accenture italia|technology trainee program|assago, lombardy, italy|https://www.linkedin.com/jobs/view/4058541601
canonical|graduate sales development representative|turin, piedmont, italy|https://www.linkedin.com/jobs/view/4068125819
valeo|r&d test & validation engineering graduate (12 month fixed term contract)|tuam, county galway, ireland|https://www.linkedin.com/jobs/view/4124580857
fondazione milano cortina 2026|energy project office ( curricular internship)|milan, lombardy, italy|https://www.linkedin.com/jobs/view/4101189435
valeo|purchasing graduate (12 month fixed term contract)|tuam, county galway, ireland|https://www.linkedin.com/jobs/view/4124577843
revolut|rev-celerator graduate programme: android software engineer|barcelona, catalonia, spain|https://www.linkedin.com/jobs/view/4033426245
metso|summer trainee, automation engineering|tampere, pirkanmaa, finland|https://www.linkedin.com/jobs/view/4113883147
valeo|purchasing graduate (12 month fixed term contract)|tuam, county galway, ireland|https://www.linkedin.com/jobs/view/4124723841
analog devices|fy25 graduate systems applications engineer|limerick, county limerick, ireland|https://www.linkedin.com/jobs/view/4067692734
neodyne|junior electrical engineer|cork, county cork, ireland|https://www.linkedin.com/jobs/view/4123339188
yacht sentinel|application engineer|boulogne-billancourt, île-de-france, france|https://www.linkedin.com/jobs/view/4110186007
ayesa - uk and ireland|junior geologist|dublin, county dublin, ireland|https://www.linkedin.com/jobs/view/4089982809
canonical|graduate sales development representative|milan, lombardy, italy|https://www.linkedin.com/jobs/view/4068276214
arrise powering pragmatic play|graduate contracts officer|sliema, sliema, worldwide|https://www.linkedin.com/jobs/view/4123388069
canonical|software engineer - python - container images|berlin, berlin, germany|https://www.linkedin.com/jobs/view/4089850827
givaudan|flavourist trainee|warsaw, mazowieckie, poland|https://www.linkedin.com/jobs/view/4058965834
arguseye|product developer|linköping, östergötland county, sweden|https://www.linkedin.com/jobs/view/4103407245
gob software & systeme gmbh & co. kg|trainee softwareentwicklung (w/m/d)|krefeld, north rhine-westphalia, germany|https://www.linkedin.com/jobs/view/4078875472
community phone|product engineer|france|https://www.linkedin.com/jobs/view/4122916137
canonical|software engineer - python - container images|berlin, berlin, germany|https://www.linkedin.com/jobs/view/4089848990
canonical|graduate visual ui designer|munich, bavaria, germany|https://www.linkedin.com/jobs/view/4034778004
gob software & systeme gmbh & co. kg|trainee it-consultant (w/m/d)|krefeld, north rhine-westphalia, germany|https://www.linkedin.com/jobs/view/4077679648
abb|intern cybersecurity|etten-leur, north brabant, netherlands|https://www.linkedin.com/jobs/view/4066469260
nedap|graduation assignment – cybersecurity|groenlo, gelderland, netherlands|https://www.linkedin.com/jobs/view/4085576942
kempower|chargeye summer trainee program 2025 by kempower - cloud software trainee|greater lahti area, worldwide|https://www.linkedin.com/jobs/view/4121270873
deltia|manufacturing data analyst|berlin, berlin, germany|https://www.linkedin.com/jobs/view/4084768304
valeo|r&d test & validation engineering graduate (12 month fixed term contract)|tuam, county galway, ireland|https://www.linkedin.com/jobs/view/4124725727
canonical|graduate visual ui designer|dublin, county dublin, ireland|https://www.linkedin.com/jobs/view/4034774418
canonical|graduate visual ui designer|nuremberg, bavaria, germany|https://www.linkedin.com/jobs/view/4067130516
gob software & systeme gmbh & co. kg|mathematiker (w/m/d) als trainee it-consulting|krefeld, north rhine-westphalia, germany|https://www.linkedin.com/jobs/view/4062008490
canonical|graduate visual ui designer|düsseldorf, north rhine-westphalia, germany|https://www.linkedin.com/jobs/view/4068272422
canonical|software engineer - python - container images|cracow, małopolskie, poland|https://www.linkedin.com/jobs/view/4068934742
analog devices|fy25 graduate product engineer, biosensor group|limerick, county limerick, ireland|https://www.linkedin.com/jobs/view/4102786378
canonical|software engineer - python - container images|leipzig, saxony, germany|https://www.linkedin.com/jobs/view/4089850829
canonical|graduate visual ui designer|dresden, saxony, germany|https://www.linkedin.com/jobs/view/4068273318
canonical|software engineer - python - container images|leipzig, saxony, germany|https://www.linkedin.com/jobs/view/4068940114
canonical|software engineer - python - container images|düsseldorf, north rhine-westphalia, germany|https://www.linkedin.com/jobs/view/4117655912
crowdstrike|intelligence analyst intern - advanced research team (remote)|munich, bavaria, germany|https://www.linkedin.com/jobs/view/4083066794
canonical|software engineer - python - container images|leipzig, saxony, germany|https://www.linkedin.com/jobs/view/4026771135
canonical|graduate sales development representative|nantes, pays de la loire, france|https://www.linkedin.com/jobs/view/4023491444
pm group|graduate architect cork 2025|cork, county cork, ireland|https://www.linkedin.com/jobs/view/4013696820
sap|developer associate (f/m/d): product development for intelligent situation handling|walldorf, baden-württemberg, germany|https://www.linkedin.com/jobs/view/4072912048
canonical|software engineer - python - container images|antwerp, flemish region, belgium|https://www.linkedin.com/jobs/view/4117661096
canonical|software engineer - python - container images|cracow, małopolskie, poland|https://www.linkedin.com/jobs/view/4089852710
adesso orange ag|trainee sap software developer (all genders)|jena, thuringia, germany|https://www.linkedin.com/jobs/view/4060354365
proactive global|junior commissioning engineer|poland|https://www.linkedin.com/jobs/view/4032807841
canonical|software engineer - python - container images|barcelona, catalonia, spain|https://www.linkedin.com/jobs/view/4089855195
canonical|software engineer - python - container images|tartu, tartumaa, worldwide|https://www.linkedin.com/jobs/view/4117655933
canonical|software engineer - python - container images|cracow, małopolskie, poland|https://www.linkedin.com/jobs/view/4068180946
global blue|software development lead|budapest, hungary|https://www.linkedin.com/jobs/view/4102949836
danfoss|summer trainee, cyber security|vaasa, ostrobothnia, finland|https://www.linkedin.com/jobs/view/4118521338
canonical|software engineer - python - container images|stockholm, stockholm county, sweden|https://www.linkedin.com/jobs/view/4068181963
mckinsey & company|junior capabilities & insights analyst - private equity|milan, lombardy, italy|https://www.linkedin.com/jobs/view/4002475321
exact|.net software engineer product teams|delft, south holland, netherlands|https://www.linkedin.com/jobs/view/3631265980
canonical|software engineer - python - container images|budapest, budapest, hungary|https://www.linkedin.com/jobs/view/4068939135
opmobility|internship - junior calculation engineer m/f|sainte-julie, auvergne-rhône-alpes, france|https://www.linkedin.com/jobs/view/4048258538
canonical|software engineer - python - container images|granada, andalusia, spain|https://www.linkedin.com/jobs/view/4026773027
core value s.r.l.|neo laureato/a in materie stem per consulenza sap|turin, piedmont, italy|https://www.linkedin.com/jobs/view/4111062953
canonical|software engineer - python - container images|granada, andalusia, spain|https://www.linkedin.com/jobs/view/4117657480
canonical|software engineer - python - container images|prague, prague, worldwide|https://www.linkedin.com/jobs/view/4089852727
wüstenrot gruppe|full-stack developer - banking &amp; customer portal (m/w/d)|vienna, vienna, austria|https://www.linkedin.com/jobs/view/4087662519
wüstenrot gruppe|full-stack developer - banking &amp; customer portal (m/w/d)|salzburg, salzburg, austria|https://www.linkedin.com/jobs/view/4087659738
optidata a/s|back end developer|odense, region of southern denmark, denmark|https://www.linkedin.com/jobs/view/4095182146
papa oscar ventures|junior web developer (m/w/d)|frankfurt, hesse, germany|https://www.linkedin.com/jobs/view/4079955902
nvidia|field applications engineer, embedded and robotics - new college grad 2025|munich, bavaria, germany|https://www.linkedin.com/jobs/view/4124906201
itaricon|javascript entwickler (mensch*)|dresden, saxony, germany|https://www.linkedin.com/jobs/view/4072414658
dymatrix|(junior) cloud data engineer (all genders)|stuttgart, baden-württemberg, germany|https://www.linkedin.com/jobs/view/4017143419
youki gmbh|youki - backend developer  jobs at youki gmbh|würzburg, bavaria, germany|https://www.linkedin.com/jobs/view/4096849460
ritz instrument transformers|application engineer (m/w/d)|hamburg, hamburg, germany|https://www.linkedin.com/jobs/view/4088229143
remondis it|trainee requirements engineer (m/w/d)|lünen, north rhine-westphalia, germany|https://www.linkedin.com/jobs/view/4093675401
we-site gmbh - shopify agentur|frontend entwickler / webdesigner (m/w/d) als werkstudent|hamburg, hamburg, germany|https://www.linkedin.com/jobs/view/4120918869
barmeniagothaer|full-stack entwickler (w/m/d)|wuppertal, north rhine-westphalia, germany|https://www.linkedin.com/jobs/view/3602972023
remondis it|softwareentwickler java (m/w/d)|lünen, north rhine-westphalia, germany|https://www.linkedin.com/jobs/view/4095546312
t&a systeme gmbh|java enterprise developer (m/w/d)|hattingen, north rhine-westphalia, germany|https://www.linkedin.com/jobs/view/4108559529
barmeniagothaer|linux system engineer (w/m/d)|wuppertal, north rhine-westphalia, germany|https://www.linkedin.com/jobs/view/3822572815
mayflower gmbh|senior backend entwickler*in in java, spring boot (w/d/m)|würzburg, bavaria, germany|https://www.linkedin.com/jobs/view/4111038589
mayflower gmbh|senior python engineer*in mit schwerpunkt genai (w/d/m)|nuremberg, bavaria, germany|https://www.linkedin.com/jobs/view/3993260708
mayflower gmbh|senior python engineer*in mit schwerpunkt genai (w/d/m)|munich, bavaria, germany|https://www.linkedin.com/jobs/view/3993236571
mayflower gmbh|senior frontend developer mit typescript (w/d/m)|munich, bavaria, germany|https://www.linkedin.com/jobs/view/4014347661
mayflower gmbh|senior python engineer mit schwerpunkt genai (w/d/m)|nuremberg, bavaria, germany|https://www.linkedin.com/jobs/view/4107852577
barmeniagothaer|sap entwickler (w/m/d) abap|wuppertal, north rhine-westphalia, germany|https://www.linkedin.com/jobs/view/3697208707
barmeniagothaer|it system engineer (w/m/d) backup & recovery|wuppertal, north rhine-westphalia, germany|https://www.linkedin.com/jobs/view/3711081890
barmeniagothaer|site reliability engineer (w/m/d)|wuppertal, north rhine-westphalia, germany|https://www.linkedin.com/jobs/view/3737942064
mayflower gmbh|kopie von senior frontend developer mit typescript (w/d/m)|nuremberg, bavaria, germany|https://www.linkedin.com/jobs/view/4014355504
tietalent|auszubildende fachinformatikerin/fachinformatiker fuer anwendungsentwicklung in wiesbaden (w/m/d)|wiesbaden, hesse, germany|https://www.linkedin.com/jobs/view/4127711089
tietalent|auszubildende fachinformatikerin/fachinformatiker fuer systemintegration in berlin (w/m/d)|berlin, berlin, germany|https://www.linkedin.com/jobs/view/4116602594
metergrid gmbh|senior system-administrator:in - crm focus (hubspot) / automation engineer|germany|https://www.linkedin.com/jobs/view/4121321362
it search and selection|devops engineer (migration) – remote from ireland|ireland|https://www.linkedin.com/jobs/view/4126510684
it search and selection|devops engineer (azure) – onsite 5 days dublin city|dublin, county dublin, ireland|https://www.linkedin.com/jobs/view/4126504985
tripletex as|backend java utvikler|oslo, oslo, norway|https://www.linkedin.com/jobs/view/4114818139
capgemini|java utvikler|bergen, vestland, norway|https://www.linkedin.com/jobs/view/4115410679
sogeti|java utvikler|bergen, vestland, norway|https://www.linkedin.com/jobs/view/4100581777
handelsbanken|salesforce developer|greater oslo region, worldwide|https://www.linkedin.com/jobs/view/4110306357
lyse|devops engineer|norway|https://www.linkedin.com/jobs/view/4111243453
tqa|mlops engineer|bucharest, romania|https://www.linkedin.com/jobs/view/4119561640
rule14 llc|data scientist - ai, ml, nlp developer|los angeles, canada|https://www.linkedin.com/jobs/view/4065927292
the aerospace corporation|2025 power systems engineering grad intern|el segundo, canada|https://www.linkedin.com/jobs/view/4123151126
ev.careers|data engineer ii, telematics processing and insights team|serbia, stari grad, worldwide|https://www.linkedin.com/jobs/view/4124170614
ev.careers|senior analytics engineer, sc&l (fixed term contract)|serbia, stari grad, worldwide|https://www.linkedin.com/jobs/view/4124173030
acronis|senior devops developer|serbia, stari grad, worldwide|https://www.linkedin.com/jobs/view/4124762825
acronis|secops engineer|serbia, stari grad, worldwide|https://www.linkedin.com/jobs/view/4074028903
knowit|frontend-utvecklare|linköping, östergötland county, sweden|https://www.linkedin.com/jobs/view/3654216648
doktor.se|fullstack-utvecklare|stockholm, stockholm county, sweden|https://www.linkedin.com/jobs/view/4117555951
b3 reach|system developer|linköpings kommun, östergötland county, sweden|https://www.linkedin.com/jobs/view/3818113088
b3 reach|system developer|linköpings kommun, östergötland county, sweden|https://www.linkedin.com/jobs/view/3831016208
techseed|ai engineer på det medarbetarägda konsultbolaget!|gothenburg, västra götaland county, sweden|https://www.linkedin.com/jobs/view/4117989257
techseed|senior embedded linux utvecklare|västerås, västmanland county, sweden|https://www.linkedin.com/jobs/view/4110718626
hiq|devops engineer|stockholm, stockholm county, sweden|https://www.linkedin.com/jobs/view/3927601855
jobcourier|system engineer (m/w)|bern, berne, switzerland|https://www.linkedin.com/jobs/view/4121648599
university of applied sciences and arts northwestern switzerland fhnw|iam engineer*in 80-100%|windisch, aargau, switzerland|https://www.linkedin.com/jobs/view/4118713575
peak|data scientist (new grad)|türkiye, istanbul, worldwide|https://www.linkedin.com/jobs/view/4071395633
caspian one|grad/junior kdb developer|london area, united kingdom|https://www.linkedin.com/jobs/view/4122673072
per aarsleff a/s|it-udvikler til azure-integrationer med fokus på forretningsprocesser|aarhus, central denmark region, denmark|https://www.linkedin.com/jobs/view/4115273519
fluido|salesforce developer - danmark|gentofte, capital region of denmark, denmark|https://www.linkedin.com/jobs/view/4118089730
testhuset.dk|teknisk tester - ballerup|ballerup, capital region of denmark, denmark|https://www.linkedin.com/jobs/view/3919164634
it search and selection|principal engineer production environment – dublin hybrid onsite/wfh|dublin, county dublin, ireland|https://www.linkedin.com/jobs/view/4126511459
papa oscar ventures|web developer - praktikum/werkstudent (m/w/d)|frankfurt, hesse, germany|https://www.linkedin.com/jobs/view/4079958465
ikb deutsche industriebank ag|trainee firmenkundenbetreuung  (m/w/d)|frankfurt, hesse, germany|https://www.linkedin.com/jobs/view/3841782831
we-site gmbh - shopify agentur|fullstack-entwickler (m/w/d) in vollzeit|hamburg, hamburg, germany|https://www.linkedin.com/jobs/view/4119735110
fis informationssysteme und consulting gmbh|sap entwickler abap (m/w/d)|hamburg, hamburg, germany|https://www.linkedin.com/jobs/view/3933375500
michael page|junior developer|london, england, united kingdom|https://www.linkedin.com/jobs/view/4117617499
planisware|solution engineer (w/m/d)|munich, bavaria, germany|https://www.linkedin.com/jobs/view/3584054253
resaro|responsible ai scientist - computer vision (m/f/d)|munich, bavaria, germany|https://www.linkedin.com/jobs/view/4122780467
eagleburgmann|application engineer (w/m/d)|wolfratshausen, bavaria, germany|https://www.linkedin.com/jobs/view/4074766114
opus recruitment solutions|frontend ingenieur (m/w/d)|karlsruhe, baden-württemberg, germany|https://www.linkedin.com/jobs/view/4117553310
check24 vergleichsportal gmbh|junior php entwickler (m/w/d) aurumtours|leipzig, saxony, germany|https://www.linkedin.com/jobs/view/4090635690
robotron datenbank-software gmbh|(senior-) software developer prognose & ki (m/w/d)|leipzig, saxony, germany|https://www.linkedin.com/jobs/view/4127147156
barmeniagothaer|devops engineer (w/m/d) kubernetes|wuppertal, north rhine-westphalia, germany|https://www.linkedin.com/jobs/view/3737938722
think about it gmbh|sap entwickler (m/w/d)|bochum, north rhine-westphalia, germany|https://www.linkedin.com/jobs/view/4126199878
mayflower gmbh|senior python engineer mit schwerpunkt genai (w/d/m)|würzburg, bavaria, germany|https://www.linkedin.com/jobs/view/4107857041
swiss life deutschland|business intelligence entwickler (w/m/d)|munich, bavaria, germany|https://www.linkedin.com/jobs/view/4110049527
raynet|software technical writer (technische/r redakteur/in)|paderborn, north rhine-westphalia, germany|https://www.linkedin.com/jobs/view/4108639231
german aerospace center (dlr)|softwareentwicklerin oder softwareentwickler o. ä. (w/m/d)|cologne, north rhine-westphalia, germany|https://www.linkedin.com/jobs/view/4085504807
robotron datenbank-software gmbh|robotron datenbank-software gmbh: (senior-) software-developer für den fachbereich messwesen und iot energiewirtschaft (m/w/d) - robotron datenbank-software gmbh - wachstumsregion dresden|dresden, saxony, germany|https://www.linkedin.com/jobs/view/4096845031
canonical|software engineer - go - container images|vienna, vienna, austria|https://www.linkedin.com/jobs/view/4089851648
canonical|software engineer - go - container images|vienna, vienna, austria|https://www.linkedin.com/jobs/view/4068937210
canonical|software engineer - go - container images|vienna, vienna, austria|https://www.linkedin.com/jobs/view/4117653017
emerson|senior control systems engineer (m/d/f)|kundl, tyrol, austria|https://www.linkedin.com/jobs/view/3767944928
canonical|graduate/associate software engineer - build & release infrastructure|antwerp, flemish region, belgium|https://www.linkedin.com/jobs/view/4121137285
unilin|young graduate microsoft stack/angular software engineer|wielsbeke, flemish region, belgium|https://www.linkedin.com/jobs/view/4125859256
in4matic|junior system engineer|ghent, flemish region, belgium|https://www.linkedin.com/jobs/view/4077597648
canonical|software engineer - python - container images|antwerp, flemish region, belgium|https://www.linkedin.com/jobs/view/4089850830
canonical|software engineer - go - container images|antwerp, flemish region, belgium|https://www.linkedin.com/jobs/view/4068931991
vrije universiteit brussel|research software devops engineer|brussels, brussels region, belgium|https://www.linkedin.com/jobs/view/4124731472
canonical|engineering manager|antwerp, flemish region, belgium|https://www.linkedin.com/jobs/view/4127927157
honeywell|field service engineer ii|essen, flemish region, belgium|https://www.linkedin.com/jobs/view/4041043703
canonical|software engineer - python - container images|plovdiv, plovdiv, worldwide|https://www.linkedin.com/jobs/view/4089856003
canonical|software engineer - python - container images|plovdiv, plovdiv, worldwide|https://www.linkedin.com/jobs/view/4089854415
canonical|software engineer - python - container images|plovdiv, plovdiv, worldwide|https://www.linkedin.com/jobs/view/4068938201
canonical|software engineer - python - container images|plovdiv, plovdiv, worldwide|https://www.linkedin.com/jobs/view/4068182322
canonical|software engineer - python - container images|plovdiv, plovdiv, worldwide|https://www.linkedin.com/jobs/view/4117659420
canonical|software engineer - go - container images|zagreb, zagreb, worldwide|https://www.linkedin.com/jobs/view/4068269906
canonical|software engineer - go - container images|zagreb, zagreb, worldwide|https://www.linkedin.com/jobs/view/4117647810
canonical|software engineer - go - container images|zagreb, zagreb, worldwide|https://www.linkedin.com/jobs/view/4089851641
hitachi rail|signalling it test and integration engineer|copenhagen, capital region of denmark, denmark|https://www.linkedin.com/jobs/view/4090636701
canonical|software engineer - python - container images|tartu, tartumaa, worldwide|https://www.linkedin.com/jobs/view/4068935687
siemens|software engineer trainee, #futurewerner|espoo, uusimaa, finland|https://www.linkedin.com/jobs/view/4094459556
canonical|software engineer - python - container images|helsinki, uusimaa, finland|https://www.linkedin.com/jobs/view/4089855184
canonical|graduate/associate software engineer - build & release infrastructure|rennes, brittany, france|https://www.linkedin.com/jobs/view/4121136436
canonical|graduate/associate software engineer - build & release infrastructure|toulouse, occitanie, france|https://www.linkedin.com/jobs/view/4121138275
canonical|software engineer - python - container images|strasbourg, grand est, france|https://www.linkedin.com/jobs/view/4089852732
canonical|software engineer - python - container images|strasbourg, grand est, france|https://www.linkedin.com/jobs/view/4089850822
canonical|software engineer - python - container images|strasbourg, grand est, france|https://www.linkedin.com/jobs/view/4068938185
