company|title|location|link
norsk helsenett sf|norsk helsenett søker utviklere til reseptformidleren|oslo, oslo, norway|https://www.linkedin.com/jobs/view/4185761796
meta|production engineer (university grad)|dublin, county dublin, ireland|https://www.linkedin.com/jobs/view/4120826247
meta|production engineer (university grad)|london, england, united kingdom|https://www.linkedin.com/jobs/view/4120824482
devoteam i google cloud partner|young graduates program data & ai|machelen, flemish region, belgium|https://www.linkedin.com/jobs/view/4183931435
trifork|java software developer|aarhus, central denmark region, denmark|https://www.linkedin.com/jobs/view/4133443346
trifork|java software developer|greater aarhus area, worldwide|https://www.linkedin.com/jobs/view/4116584126
sopra steria|senior/lead .net udvikler til afdeling i vækst|copenhagen municipality, capital region of denmark, denmark|https://www.linkedin.com/jobs/view/4175120701
sopra steria|senior data engineer til nyt team|copenhagen municipality, capital region of denmark, denmark|https://www.linkedin.com/jobs/view/4175124177
metergrid gmbh|data engineer|germany|https://www.linkedin.com/jobs/view/4142334549
knowit|utvikler?|bergen, vestland, norway|https://www.linkedin.com/jobs/view/4001701789
knowit|data engineer til vårt cloud-team|oslo, oslo, norway|https://www.linkedin.com/jobs/view/4106726068
amedia|amedia søker senior utvikler|oslo, norway|https://www.linkedin.com/jobs/view/4178261276
insider.|software developer / intercontinental support - insider testinium tech hub (remote)|istanbul, istanbul, worldwide|https://www.linkedin.com/jobs/view/4149060724
insider.|software developer / intercontinental support - insider testinium tech hub (remote)|greater istanbul, worldwide|https://www.linkedin.com/jobs/view/4149064448
tasklet factory|softwareudvikler|aalborg municipality, north denmark region, denmark|https://www.linkedin.com/jobs/view/4174822701
fjernvarme fyn a/s|cloud operations engineer|odense, region of southern denmark, denmark|https://www.linkedin.com/jobs/view/4182561379
hntb|new grad engineer i - summer 2025|ga, atlanta, worldwide|https://www.linkedin.com/jobs/view/4115740321
kramer & crew gmbh & co. kg|system engineer (m/w/d) exchange & active directory|frankfurt, hesse, germany|https://www.linkedin.com/jobs/view/4178772043
kramer & crew gmbh & co. kg|system engineer (m/w/d) server- und storagevirtualisierung / hci|cologne, north rhine-westphalia, germany|https://www.linkedin.com/jobs/view/4178770485
kramer & crew gmbh & co. kg|system engineer (m/w/d) mitarbeiterin support|cologne, north rhine-westphalia, germany|https://www.linkedin.com/jobs/view/4178769610
kramer & crew gmbh & co. kg|system engineer (m/w/d) backup & recovery|cologne, north rhine-westphalia, germany|https://www.linkedin.com/jobs/view/4178769605
simon-kucher|(senior) it deployment engineer (m/w/d) – berlin|berlin, berlin, germany|https://www.linkedin.com/jobs/view/4069857387
smarketer gmbh|backend developer msd (w/m/d)|berlin, berlin, germany|https://www.linkedin.com/jobs/view/4189400661
simon-kucher|(senior) it deployment engineer (m/w/d) – hamburg|hamburg, hamburg, germany|https://www.linkedin.com/jobs/view/4069862078
think about it gmbh|senior it-system engineer mit schwerpunkt ms azure/m365 (m/w/d)|bochum, north rhine-westphalia, germany|https://www.linkedin.com/jobs/view/4180231768
simon-kucher|(senior) it deployment engineer (m/w/d) – frankfurt|frankfurt, hesse, germany|https://www.linkedin.com/jobs/view/4069861052
swiss life deutschland|microsoft dynamics 365 developer (m/w/d) – schwerpunkt crm in voll- oder teilzeit|munich, bavaria, germany|https://www.linkedin.com/jobs/view/4183365315
amesto|senior developer|kristiansand, agder, norway|https://www.linkedin.com/jobs/view/4139940874
braver|braver søker appfarm-utvikler som vil jobbe med digital produktutvikling|oslo, oslo, norway|https://www.linkedin.com/jobs/view/4096095438
apoteket ab|microsoft power platform developer|solna, stockholm county, sweden|https://www.linkedin.com/jobs/view/4137598564
göteborgs kommun|software asset management sam-specialist|gothenburg, västra götaland county, sweden|https://www.linkedin.com/jobs/view/4178223212
göteborgs stad|software asset management sam-specialist.|gothenburg, västra götaland county, sweden|https://www.linkedin.com/jobs/view/4150287886
university of applied sciences and arts northwestern switzerland fhnw|senior full-stack software engineer 50-100%|windisch, aargau, switzerland|https://www.linkedin.com/jobs/view/4150270672
university of applied sciences and arts northwestern switzerland fhnw|it system engineer 80-100%|windisch, aargau, switzerland|https://www.linkedin.com/jobs/view/4129613782
anderson green ltd|graduate electrical design engineer|nottingham, england, united kingdom|https://www.linkedin.com/jobs/view/4093672528
sgs|informatiker*in / systemtechniker*in als (senior) it-system engineer (m/w/d)|hamburg, hamburg, germany|https://www.linkedin.com/jobs/view/4034757654
simon-kucher|(senior) it deployment engineer (m/w/d) – münchen|munich, bavaria, germany|https://www.linkedin.com/jobs/view/4069863012
evoila|technical project manager (m/f/d)|vienna, vienna, austria|https://www.linkedin.com/jobs/view/4167804193
evoila|technical project manager (m/f/d)|vienna, austria|https://www.linkedin.com/jobs/view/4172621525
öbb|regionaler produktionssupport salzburg (m/w/x)|salzburg, salzburg, austria|https://www.linkedin.com/jobs/view/4184432673
devoteam i google cloud partner|young grad ml engineer|machelen, flemish region, belgium|https://www.linkedin.com/jobs/view/4183933087
analog devices|engineer, field applications, new college grad program|antwerp metropolitan area, worldwide|https://www.linkedin.com/jobs/view/4185646169
mpleo - septeo hr|customer support officer - young grad program|zaventem, flemish region, belgium|https://www.linkedin.com/jobs/view/4188217565
heidelberger druckmaschinen ag|duales hochschulstudium bachelor of science informatik (m/w/d)|kiel, flemish region, belgium|https://www.linkedin.com/jobs/view/4179601041
maslina resort|bellboy/driver|stari grad, split-dalmatia, worldwide|https://www.linkedin.com/jobs/view/4185914316
maslina resort|senior villa concierge|hvar, split-dalmatia, worldwide|https://www.linkedin.com/jobs/view/4158255856
databricks|software engineer - new grad (2025 start)|aarhus, central denmark region, denmark|https://www.linkedin.com/jobs/view/4179627139
twoday|software developer internship|aarhus, central denmark region, denmark|https://www.linkedin.com/jobs/view/4174421872
testhuset.dk|tester - aarhus|aarhus, central denmark region, denmark|https://www.linkedin.com/jobs/view/4012638999
testhuset.dk|tester - ballerup|ballerup, capital region of denmark, denmark|https://www.linkedin.com/jobs/view/3919168315
systems engineering a/s|softwareudvikler|copenhagen, capital region of denmark, denmark|https://www.linkedin.com/jobs/view/4187153454
testhuset.dk|test manager - aarhus|aarhus, central denmark region, denmark|https://www.linkedin.com/jobs/view/3919163794
testhuset.dk|test manager - ballerup|ballerup, capital region of denmark, denmark|https://www.linkedin.com/jobs/view/3919167574
kmd|integration developer|aalborg municipality, north denmark region, denmark|https://www.linkedin.com/jobs/view/4182782073
ordrestyring|customer support consultant- norwegian|copenhagen municipality, capital region of denmark, denmark|https://www.linkedin.com/jobs/view/4169745166
tv 2 danmark|product manager til video editing & management|odense, region of southern denmark, denmark|https://www.linkedin.com/jobs/view/4184045553
orifarm|analyst til financial planning & analysis|odense, region of southern denmark, denmark|https://www.linkedin.com/jobs/view/4138061421
vitec aloc|presales consultant @ finansiel software|odense, region of southern denmark, denmark|https://www.linkedin.com/jobs/view/4182075332
khr architecture|khr architecture søger bygningskonstruktørpraktikanter|copenhagen, capital region of denmark, denmark|https://www.linkedin.com/jobs/view/3897195873
bankdata|senior proceskonsulent|fredericia, region of southern denmark, denmark|https://www.linkedin.com/jobs/view/4189607422
ramboll|erfaren softwareudvikler til rambøll stakeholder intelligence|aarhus, central denmark region, denmark|https://www.linkedin.com/jobs/view/4117293880
miralix a/s|sales executive til sjælland|region zealand, denmark|https://www.linkedin.com/jobs/view/4163533271
eg a/s|forretningskonsulenter til transportbranchen|kolding, region of southern denmark, denmark|https://www.linkedin.com/jobs/view/4188187877
analog devices|engineer, field applications, new college grad program|helsinki metropolitan area, worldwide|https://www.linkedin.com/jobs/view/4035636205
logitech|digital marketing intern - g hub|us, île-de-france, france|https://www.linkedin.com/jobs/view/4184872705
analog devices|engineer, field applications, new college grad program fy26|wissous, île-de-france, france|https://www.linkedin.com/jobs/view/4185648056
arm|graduate micro-architect and performance modelling engineer - cpu|sophia antipolis, provence-alpes-côte d'azur, france|https://www.linkedin.com/jobs/view/4059678958
samsara|account development representative (new grad) - inbound, atl|ga, atlanta, worldwide|https://www.linkedin.com/jobs/view/4153620713
samsara|account development representative (new grad) - outbound, atl|ga, atlanta, worldwide|https://www.linkedin.com/jobs/view/4153619745
cargill|software engineering intern summer 2025 - atlanta, ga|ga, atlanta, worldwide|https://www.linkedin.com/jobs/view/4136338665
enercon services, inc.|may/june 2025 new graduate - distribution engineer - power delivery group|ga, kennesaw, worldwide|https://www.linkedin.com/jobs/view/4032256754
salesforce|summer 2025 intern - total rewards analyst intern|ga, atlanta, worldwide|https://www.linkedin.com/jobs/view/4181451468
ciena|wavelogic software developer - new grad|ga, atlanta, worldwide|https://www.linkedin.com/jobs/view/4161711554
enercon services, inc.|new graduate may/june 2025 - civil/structural engineer - enercon federal services|ga, kennesaw, worldwide|https://www.linkedin.com/jobs/view/4031690088
renesas electronics|principal digital engineer|ga, johns creek, worldwide|https://www.linkedin.com/jobs/view/4177113998
enercon services, inc.|new graduate- environmental due diligence services tech|ga, kennesaw, worldwide|https://www.linkedin.com/jobs/view/4181365233
1898 & co.|energy & utilities analyst, electrical engineer - 1898 & co. (atlanta)|ga, atlanta, worldwide|https://www.linkedin.com/jobs/view/4017904064
1898 & co.|energy & utilities analyst, electrical engineer - 1898 & co. (atlanta)|ga, atlanta, worldwide|https://www.linkedin.com/jobs/view/4017904063
innovative therapy concepts|northside gwinnett rehabilitation aide|ga, lawrenceville, worldwide|https://www.linkedin.com/jobs/view/4162240545
gamomat development gmbh|software engineer – backend (all genders welcome) - berlin oder 100% remote|berlin, berlin, germany|https://www.linkedin.com/jobs/view/4032241613
steadforce|software backend engineer (m/w/d)|munich, bavaria, germany|https://www.linkedin.com/jobs/view/3837967325
remondis it|softwarearchitekt java (m/w/d)|lünen, north rhine-westphalia, germany|https://www.linkedin.com/jobs/view/4095547219
one hiring|in-house project manager (m/w/d)|düsseldorf, north rhine-westphalia, germany|https://www.linkedin.com/jobs/view/4177299191
remondis it|softwareentwickler java (m/w/d)|lünen, north rhine-westphalia, germany|https://www.linkedin.com/jobs/view/4095546312
insider.|sales development representative - germany (fresh grad)|berlin, berlin, germany|https://www.linkedin.com/jobs/view/4174151136
alten germany|softwareentwickler im agilen feature team (all gender))|munich, bavaria, germany|https://www.linkedin.com/jobs/view/4179636977
insider.|sales development representative - germany (fresh grad)|munich, bavaria, germany|https://www.linkedin.com/jobs/view/4174152075
insider.|sales development representative - germany (fresh grad)|hamburg, hamburg, germany|https://www.linkedin.com/jobs/view/4174153038
f&s prozessautomation gmbh|embedded systems engineer (m/w/d)|dohna, saxony, germany|https://www.linkedin.com/jobs/view/4149741141
swiss life deutschland|(junior) it-lizenzmanager (m/w/d)|hannover, lower saxony, germany|https://www.linkedin.com/jobs/view/4185495496
maxsolar gmbh|projektassistenz in der projektentwicklung (m/w/d) – erneuerbare energien|berlin, berlin, germany|https://www.linkedin.com/jobs/view/4173621791
builtech holding gmbh|werkstudent it (m/w/d)|berlin, berlin, germany|https://www.linkedin.com/jobs/view/4142501580
swiss life deutschland|business analyst (m/w/d) - digitale antragsprozesse|hannover, lower saxony, germany|https://www.linkedin.com/jobs/view/4175813165
mayflower gmbh|senior backend entwickler*in in java, spring boot (w/d/m)|würzburg, bavaria, germany|https://www.linkedin.com/jobs/view/4111038589
si pro gmbh|absolvent betriebswirtschaftslehre m.sc. bwl einstieg unternehmensberatung sap (m/w/d), mannheim, berlin, münchen, hamburg|mannheim, baden-württemberg, germany|https://www.linkedin.com/jobs/view/4183809243
mayflower gmbh|senior backend entwickler*in mit java, spring boot (w/d/m)|munich, bavaria, germany|https://www.linkedin.com/jobs/view/4014346661
scalara|marketing manager:in (w/m/d)|cologne, north rhine-westphalia, germany|https://www.linkedin.com/jobs/view/4160428935
mgrp|it (services) specialist (m/w/d)|crailsheim, baden-württemberg, germany|https://www.linkedin.com/jobs/view/4160421676
wtz roßlau|versuchsingenieur motorenentwicklung (m/w/d)|dessau, saxony-anhalt, germany|https://www.linkedin.com/jobs/view/4102467389
holcim|it specialist/it-spezialist|edingen-neckarhausen, baden-württemberg, germany|https://www.linkedin.com/jobs/view/4088308398
fis informationssysteme und consulting gmbh|sap entwickler abap (m/w/d)|grafenrheinfeld, bavaria, germany|https://www.linkedin.com/jobs/view/4145427089
smaract group|entwicklungsingenieur (m/w/d) – präzisions-positionierer und aktoren|oldenburg, lower saxony, germany|https://www.linkedin.com/jobs/view/4136111353
tietalent|wirtschaftsinformatik data science|stuttgart, baden-württemberg, germany|https://www.linkedin.com/jobs/view/4116605146
universitätsklinikum augsburg|projektleiter für automatisierungstechnik (m/w/d)|uedem, north rhine-westphalia, germany|https://www.linkedin.com/jobs/view/3948523312
f&s prozessautomation gmbh|anwendungs­entwickler / softwareentwickler (m/w/d) - embedded systems|dohna, saxony, germany|https://www.linkedin.com/jobs/view/4149742055
spitzke se|projektmanager digitalisierung (m/w/d)|grossbeeren, brandenburg, germany|https://www.linkedin.com/jobs/view/4167181532
nigel wright group|senior sharepoint entwickler (m/w/d)|wuppertal, north rhine-westphalia, germany|https://www.linkedin.com/jobs/view/4171009754
instaffo|pre-sales manager|ulm, baden-württemberg, germany|https://www.linkedin.com/jobs/view/4172695967
university hospital schleswig-holstein (uksh)|biologe / biochemiker (m/w/d) in der humangenetik|kiel, schleswig-holstein, germany|https://www.linkedin.com/jobs/view/4175542681
rentcard gmbh|werkstudent (m/w/d) - produkt management  operations  support|augsburg, bavaria, germany|https://www.linkedin.com/jobs/view/4170835239
datadiorama - it systemhaus für potsdam|netzwerk- und systemadministrator*in (m/w/d)|potsdam, brandenburg, germany|https://www.linkedin.com/jobs/view/4159645575
rsi blitzschutzsysteme gmbh|elektroprüfer (m/w/d)|heppenheim an der bergstraße, hesse, germany|https://www.linkedin.com/jobs/view/4189608704
cambaum gmbh|senior design & development engineer (m/w/d) (konstruktionsingenieur/in)|baden-baden, baden-württemberg, germany|https://www.linkedin.com/jobs/view/4096836646
johanniter-unfall-hilfe e.v.|it-administrator (m/w/d) für den field service & support|schwerin, mecklenburg-west pomerania, germany|https://www.linkedin.com/jobs/view/4115183309
simon-kucher|projektleiter (m/w/d) it-infrastruktur – münchen|munich, bavaria, germany|https://www.linkedin.com/jobs/view/4153117000
mayflower gmbh|senior python engineer*in mit schwerpunkt genai (w/d/m)|munich, bavaria, germany|https://www.linkedin.com/jobs/view/3993236571
weatherdock ag|entwicklungsingenieur hochfrequenztechnik (ingenieur/in - informations-, kommunikationstechnik)|nuremberg, bavaria, germany|https://www.linkedin.com/jobs/view/4106556336
robotron datenbank-software gmbh|(senior) software developer prognose & ki (m/w/d)|leipzig, saxony, germany|https://www.linkedin.com/jobs/view/4133868863
agicap deutschland|customer onboarding manager (m/w/d)|berlin, berlin, germany|https://www.linkedin.com/jobs/view/4160066229
iabg|senior projektleiter software engineering (m/w/d)|ottobrunn, bavaria, germany|https://www.linkedin.com/jobs/view/4158552281
orendt studios holding gmbh|key account manager (m/w/d)|hamburg, hamburg, germany|https://www.linkedin.com/jobs/view/4174870620
orendt studios holding gmbh|key account manager (m/w/d)|düsseldorf, north rhine-westphalia, germany|https://www.linkedin.com/jobs/view/4174874265
simon-kucher|sourcing manager it (m/w/d) – hamburg|hamburg, hamburg, germany|https://www.linkedin.com/jobs/view/4000332720
remondis it|it lizenzmanager (m/w/d)|lünen, north rhine-westphalia, germany|https://www.linkedin.com/jobs/view/4095548219
anschuetz gmbh|konfigurationsmanager (m/w/d)|kiel, schleswig-holstein, germany|https://www.linkedin.com/jobs/view/4180274045
globus baumarkt|marketing campaign manager (w/m/d)|darmstadt, hesse, germany|https://www.linkedin.com/jobs/view/4104208972
conny|case manager (m/w/d)|berlin, berlin, germany|https://www.linkedin.com/jobs/view/4124577299
globus baumarkt|a/b testing / cro spezialist (w/m/d)|darmstadt, hesse, germany|https://www.linkedin.com/jobs/view/4104208968
veganz group ag|(senior) qualitätsmanager:in (m/w/d) in der lebensmittelproduktion|ludwigsfelde, brandenburg, germany|https://www.linkedin.com/jobs/view/4133011236
otis elevator co.|werkstudent im bereich testautomatisierung (m/w/d) berlin|berlin, berlin, germany|https://www.linkedin.com/jobs/view/4154780500
arcade engineering gmbh|sps-programmierer / dipl.-ingenieur für automatisierungstechnik (m/w/d) (ingenieur/in - automatisierungstechnik)|radebeul, saxony, germany|https://www.linkedin.com/jobs/view/4161662451
veeva systems|sales development program (germany)|berlin, germany|https://www.linkedin.com/jobs/view/4025588066
rsi blitzschutzsysteme gmbh|elektrotechniker (m/w/d)|heppenheim an der bergstraße, hesse, germany|https://www.linkedin.com/jobs/view/4189607781
landratsamt emmendingen|leiter/in (m/w/d) des forstreviers biederbach-prechtal|emmendingen, baden-württemberg, germany|https://www.linkedin.com/jobs/view/4187440881
pechschwarz®|kopie von senior art director / creative director (m/w/d)|wuppertal, north rhine-westphalia, germany|https://www.linkedin.com/jobs/view/4127174549
hp|presales technical consultant print & solutions (m/f/d)|eschborn, hesse, germany|https://www.linkedin.com/jobs/view/4170968434
stf gruppe|vermessungstechniker mobile mapping (m/w/d)|bonn, north rhine-westphalia, germany|https://www.linkedin.com/jobs/view/4127269468
hornbach baumarkt ag|it architect modern workplace (gn)|landau in der pfalz, rhineland-palatinate, germany|https://www.linkedin.com/jobs/view/4139896670
belform|senior projektleiter / projektmanager im innenausbau / objekteinrichtung in münchen (m/w/d)|munich, bavaria, germany|https://www.linkedin.com/jobs/view/4094472018
marquardt group|leiter facility management (m/w/d)|ichtershausen, thuringia, germany|https://www.linkedin.com/jobs/view/4188004499
giesecke+devrient|procurement excellence manager (m/w/d)|munich, bavaria, germany|https://www.linkedin.com/jobs/view/4099932223
philips|account manager (m/w/d) patientenmonitore - region norddeutschland|germany|https://www.linkedin.com/jobs/view/4091974153
teambank ag|marketing campaign manager / kampagnenmanager (d/m/w) - befristet bis 31.10.2026|nuremberg, bavaria, germany|https://www.linkedin.com/jobs/view/4178795894
r+s group gmbh|elektroniker für gebäudeautomation / gebäudesystemintegration (m/w/d)|fulda, hesse, germany|https://www.linkedin.com/jobs/view/3983290009
r+s group gmbh|ausbildung zum elektroniker für gebäudesystemintegration (m/w/d)|nesse-apfelstädt, thuringia, germany|https://www.linkedin.com/jobs/view/3972004297
wwm gmbh & co. kg|kaufmännischer sachbearbeiter (m/w/d)|monschau, north rhine-westphalia, germany|https://www.linkedin.com/jobs/view/4164994524
marquardt group|leiter facility management (m/w/d)|ichtershausen, thuringia, germany|https://www.linkedin.com/jobs/view/4179918978
gip exyr gmbh|senior consultant telco - bss/oss :: tm forum know-how m/w/x hybrid (remote / mainz)|mainz, rhineland-palatinate, germany|https://www.linkedin.com/jobs/view/4185487302
s&n systemhaus für netzwerk- und datentechnik gmbh|it dozent / trainer (m/w/d) in rostock|rostock, mecklenburg-west pomerania, germany|https://www.linkedin.com/jobs/view/4160442931
join.com|synpulse8 deutschland gmbh: pre-sales manager (m/w/d)|ulm, baden-württemberg, germany|https://www.linkedin.com/jobs/view/4163555173
maxsolar gmbh|bauingenieur (m/w/d) - schwerpunkt tiefbau/statik für umspannwerke und windanlagen|feldkirchen, bavaria, germany|https://www.linkedin.com/jobs/view/4127252209
fraunhofer institute for interfacial engineering and biotechnology|ma/ praktikum/ wiss. hilfskraft - prozesssimulation einer sprühtrocknung mit überhitztem wasserdampf|stuttgart, baden-württemberg, germany|https://www.linkedin.com/jobs/view/4137432509
fis informationssysteme und consulting gmbh|sap presales solution architekten ewm (m/w/d)|grafenrheinfeld, bavaria, germany|https://www.linkedin.com/jobs/view/4184116034
computacenter|talent acquisition consultant w/m/d - 360-grad-recruiting|kerpen, north rhine-westphalia, germany|https://www.linkedin.com/jobs/view/4157740694
wwm gmbh & co. kg|kaufmännischer sachbearbeiter (m/w/d) (kaufmännische fachkraft)|monschau, north rhine-westphalia, germany|https://www.linkedin.com/jobs/view/4167962834
holidu|sales manager ostsee (w/m/d)|greater hamburg area, worldwide|https://www.linkedin.com/jobs/view/4182079760
holidu|praktikum sales & account management bodensee (w/m/d)|friedrichshafen, baden-württemberg, germany|https://www.linkedin.com/jobs/view/4178629175
holidu|account manager bodensee (w/m/d)|friedrichshafen, baden-württemberg, germany|https://www.linkedin.com/jobs/view/4173923488
etl-gruppe|steuerfachangestellter (m/w/d)|bremen, bremen, germany|https://www.linkedin.com/jobs/view/4139177910
wwm gmbh & co. kg|kaufmännischer sachbearbeiter (m/w/d) (veranstaltungskaufmann/-frau)|alsdorf, rhineland-palatinate, germany|https://www.linkedin.com/jobs/view/4110661122
heidelberger druckmaschinen ag|duales hochschulstudium bachelor of science wirtschaftsinformatik software engineering oder application management 2025 (m/w/d) - standort wiesloch-walldorf|wiesloch, baden-württemberg, germany|https://www.linkedin.com/jobs/view/3989304637
accenture dach|consultant business analyse – öffentliche verwaltung / public service (all genders)|kronberg, hesse, germany|https://www.linkedin.com/jobs/view/4058531532
zeitverlag gerd bucerius gmbh & co. kg|auszubildende medienkaufleute digital und print zeitve...|hamburg, hamburg, germany|https://www.linkedin.com/jobs/view/4168170330
join.com|freiheit partgmbb: steuerfachangestellte:r|hamburg, hamburg, germany|https://www.linkedin.com/jobs/view/4160057135
vesterling ag|sap eppm / sap ps / sap cpm berater  projekte, ppm, eppm  bis 95.000€, homeoffice möglich (mwd)|frankfurt, hesse, germany|https://www.linkedin.com/jobs/view/3904079115
vattenfall|regionalleiter:in b2b - pv und wp projekte|berlin, berlin, germany|https://www.linkedin.com/jobs/view/4082182830
vattenfall|regionalleiter:in b2b - pv und wp projekte|hamburg, hamburg, germany|https://www.linkedin.com/jobs/view/4051001481
die zeit|duales studium betriebswirtschaftslehre zeitverlag (b.sc.) (m/w/d)|hamburg, hamburg, germany|https://www.linkedin.com/jobs/view/3831911413
ats global|(senior) expert shopfloor it solutions (m/w/d)|kassel, hesse, germany|https://www.linkedin.com/jobs/view/4184434417
continentale versicherung|duales studium wirtschaftsmathematik - aktuarwissenschaften an der th rosenheim, bachelor of science|munich, bavaria, germany|https://www.linkedin.com/jobs/view/4122623586
continentale versicherung|duales studium wirtschaftsinformatik an der th rosenheim, bachelor of science|munich, bavaria, germany|https://www.linkedin.com/jobs/view/4122629140
würth deutschland|spezialist für autoglas und fahrzeugpflege (m/w/d)|leipzig, saxony, germany|https://www.linkedin.com/jobs/view/4169688388
whatnot|software engineer, 2025 new grad|dublin, county dublin, ireland|https://www.linkedin.com/jobs/view/4149260099
analog devices|fy24 graduate electronic engineering opportunities|limerick, county limerick, ireland|https://www.linkedin.com/jobs/view/3814642546
analog devices|fy25 graduate electronic engineering opportunities|limerick, county limerick, ireland|https://www.linkedin.com/jobs/view/4018482473
salesforce|commercial graduate rotation program - german speaker|dublin, county dublin, ireland|https://www.linkedin.com/jobs/view/4167065953
salesforce|commercial graduate rotation program - norwegian speakers (september start)|dublin, county dublin, ireland|https://www.linkedin.com/jobs/view/4157795925
salesforce|commercial graduate rotation program - dutch speakers (september start)|dublin, county dublin, ireland|https://www.linkedin.com/jobs/view/4157799307
salesforce|commercial graduate rotation program - finnish speakers (september start)|dublin, county dublin, ireland|https://www.linkedin.com/jobs/view/4157794918
