company|title|location|link
norsk helsenett sf|funksjonell tester til norsk helsenett sin legemiddelmodul|trondheim, trøndelag, norway|https://www.linkedin.com/jobs/view/4250522571
dremio|software engineer - new grad (2025 graduate)|lisbon, lisbon, portugal|https://www.linkedin.com/jobs/view/4246761749
sopra steria|senior fullstack java udvikler til afdeling i vækst|copenhagen municipality, capital region of denmark, denmark|https://www.linkedin.com/jobs/view/4258022745
sopra steria|senior data engineer til team i udvikling|copenhagen municipality, capital region of denmark, denmark|https://www.linkedin.com/jobs/view/4257971980
trifork|google cloud expert|aarhus, central denmark region, denmark|https://www.linkedin.com/jobs/view/4202020330
tv 2 danmark|software engineer – video playback team, tv 2|odense, region of southern denmark, denmark|https://www.linkedin.com/jobs/view/4258069470
knowit|utvikler?|bergen, vestland, norway|https://www.linkedin.com/jobs/view/4001701789
hiscox|technology engineering graduate in lisbon!|lisbon, portugal|https://www.linkedin.com/jobs/view/4255849199
snap inc.|software engineer, full stack, level 4|los angeles, canada|https://www.linkedin.com/jobs/view/4262000780
snap inc.|software engineer, backend, level 5|los angeles, canada|https://www.linkedin.com/jobs/view/4260286414
snap inc.|staff software engineer, backend, level 6|los angeles, canada|https://www.linkedin.com/jobs/view/4260285381
snap inc.|principal machine learning engineer, ml inference platform, level 7|los angeles, canada|https://www.linkedin.com/jobs/view/4260558346
logineko|devops engineer|novi grad, sevnica, worldwide|https://www.linkedin.com/jobs/view/4235905702
tenfifty ab|remote data scientist|gothenburg, västra götaland county, sweden|https://www.linkedin.com/jobs/view/4212682500
tenfifty ab|senior pythonutvecklare|gothenburg, västra götaland county, sweden|https://www.linkedin.com/jobs/view/4254604422
cvation - part of skaylink|software engineer|copenhagen, capital region of denmark, denmark|https://www.linkedin.com/jobs/view/4261713467
sopra steria|senior fullstack .net udvikler til dynamisk team i vækst|copenhagen, capital region of denmark, denmark|https://www.linkedin.com/jobs/view/4245421309
it forum gruppen a/s|data engineer|herning, central denmark region, denmark|https://www.linkedin.com/jobs/view/4101154351
evy solutions gmbh|softwareentwickler backend leipzig / münchen (m/w/d)|leipzig, saxony, germany|https://www.linkedin.com/jobs/view/4256454701
kramer & crew gmbh & co. kg|system engineer (m/w/d) exchange & active directory|frankfurt, hesse, germany|https://www.linkedin.com/jobs/view/4217567627
kramer & crew gmbh & co. kg|system engineer (m/w/d) backup & recovery|cologne, north rhine-westphalia, germany|https://www.linkedin.com/jobs/view/4237207082
kramer & crew gmbh & co. kg|system engineer (m/w/d) mitarbeiterin support|cologne, north rhine-westphalia, germany|https://www.linkedin.com/jobs/view/4247672547
think about it gmbh|it-system engineer client management (m/w/d)|bochum, north rhine-westphalia, germany|https://www.linkedin.com/jobs/view/4257187383
think about it gmbh|senior it-system engineer client management (m/w/d)|bochum, north rhine-westphalia, germany|https://www.linkedin.com/jobs/view/4257192052
central norway regional health authority|ønsker du å skape verdifulle programvareløsninger for helsesektoren?|trondheim, trøndelag, norway|https://www.linkedin.com/jobs/view/4261421002
amesto|seniorkonsulent – data engineer|oslo, oslo, norway|https://www.linkedin.com/jobs/view/4226810220
experis norway|data engineer|trondheim, trøndelag, norway|https://www.linkedin.com/jobs/view/4248022403
apoteket ab|microsoft power platform developer|solna, stockholm county, sweden|https://www.linkedin.com/jobs/view/4194782360
rocken®|senior system engineer (m/w/d)|cham, zug, switzerland|https://www.linkedin.com/jobs/view/4259953249
highpoint|application engineer|farnborough, england, united kingdom|https://www.linkedin.com/jobs/view/4250070955
anderson green ltd|graduate electrical design engineer|nottingham, england, united kingdom|https://www.linkedin.com/jobs/view/4093672528
rewe international ag|software entwickler:in mit fokus oracle (m/w/x)|vienna, vienna, austria|https://www.linkedin.com/jobs/view/4255123755
simon-kucher|senior consultant data engineering (m/w/d)|vienna, vienna, austria|https://www.linkedin.com/jobs/view/4223037173
wiener linien|spezialistin (w/m/d) softwareentwicklung dienstzuteilung|vienna, vienna, austria|https://www.linkedin.com/jobs/view/4255900266
analog devices|engineer, field applications, new college grad program|antwerp metropolitan area, worldwide|https://www.linkedin.com/jobs/view/4185646169
heidelberger druckmaschinen ag|duales hochschulstudium bachelor of science informatik (m/w/d)|kiel, flemish region, belgium|https://www.linkedin.com/jobs/view/4179601041
invitario  the smarter way to invite|customer success manager|plovdiv, plovdiv, worldwide|https://www.linkedin.com/jobs/view/4200961575
jobright.ai|software engineer, new grad & entry level|wa, seattle, worldwide|https://www.linkedin.com/jobs/view/4260623962
jobright.ai|software engineer, new grad & entry level|united states|https://www.linkedin.com/jobs/view/4260624906
jobright.ai|front-end engineer, new grad & entry level|wa, seattle, worldwide|https://www.linkedin.com/jobs/view/4260625843
jobright.ai|software engineer, new grad & entry level|san diego, canada|https://www.linkedin.com/jobs/view/4260625431
jobright.ai|software engineer, new grad & entry level|tennessee, united states|https://www.linkedin.com/jobs/view/4260625889
sparrow|full stack engineer|ny, new york, worldwide|https://www.linkedin.com/jobs/view/4199879843
gptzero|founding frontend engineer (growth team)|ny, new york, worldwide|https://www.linkedin.com/jobs/view/4232395730
wise pirates|r&d gen ai  ml engineer|tx, allen, worldwide|https://www.linkedin.com/jobs/view/4158514143
jobright.ai|system development engineer (new grad)|virginia, united states|https://www.linkedin.com/jobs/view/4260637290
furtherai|forward deployed engineer [new grads ok]|san francisco, canada|https://www.linkedin.com/jobs/view/4248526352
meta|production engineer (university grad)|ny, new york, worldwide|https://www.linkedin.com/jobs/view/4120822696
meta|production engineer (university grad)|fremont, canada|https://www.linkedin.com/jobs/view/4120823599
meta|production engineer (university grad)|wa, bellevue, worldwide|https://www.linkedin.com/jobs/view/4120829028
meta|production engineer (university grad)|sunnyvale, canada|https://www.linkedin.com/jobs/view/4120822684
lensa|production engineer (university grad)|sunnyvale, canada|https://www.linkedin.com/jobs/view/4261481343
nuro|software engineer, ai platform - new grad|mountain view, canada|https://www.linkedin.com/jobs/view/4191146990
collective|software engineer (new grad)|san francisco, canada|https://www.linkedin.com/jobs/view/4254111586
candid health|software engineer new grad|san francisco, canada|https://www.linkedin.com/jobs/view/4260433381
jobright.ai|software engineer (new grad & entry level)|california, united states|https://www.linkedin.com/jobs/view/4260631110
snap inc.|software engineer, full stack, level 4|palo alto, canada|https://www.linkedin.com/jobs/view/4262005524
snap inc.|software engineer, backend, level 5|new york, united states|https://www.linkedin.com/jobs/view/4260281786
snap inc.|software engineer, full stack, level 4|wa, bellevue, worldwide|https://www.linkedin.com/jobs/view/4262004573
snap inc.|software engineer, backend, level 5|wa, bellevue, worldwide|https://www.linkedin.com/jobs/view/4260280937
snap inc.|staff software engineer, backend, level 6|wa, seattle, worldwide|https://www.linkedin.com/jobs/view/4260288093
snap inc.|principal machine learning engineer, ml inference platform, level 7|wa, seattle, worldwide|https://www.linkedin.com/jobs/view/4260555735
snap inc.|principal machine learning engineer, ml inference platform, level 7|wa, bellevue, worldwide|https://www.linkedin.com/jobs/view/4260553936
sentry|software engineer, new grad (2025)|san francisco, canada|https://www.linkedin.com/jobs/view/4252028280
archetype sc|powerapp developer|sc, myrtle beach, worldwide|https://www.linkedin.com/jobs/view/4250716910
lensa|new grad civil engineer i - summer 2025|santa ana, canada|https://www.linkedin.com/jobs/view/4262010848
westinghouse electric company|electrical test engineer- new grad|warrendale, panama|https://www.linkedin.com/jobs/view/4174941551
lensa|new grad civil engineer i - summer 2025|ontario, canada|https://www.linkedin.com/jobs/view/4262015322
verista|cqv engineer (new grad)|me, portland, worldwide|https://www.linkedin.com/jobs/view/4130647052
