company|title|location|link
canonical|software engineer - python - container images|oslo, oslo, norway|https://www.linkedin.com/jobs/view/4068934745
ion|data engineer/analyst - graduate development program|pisa, tuscany, italy|https://www.linkedin.com/jobs/view/4017419535
canonical|software engineer - python - container images|nuremberg, bavaria, germany|https://www.linkedin.com/jobs/view/4089855193
canonical|software engineer - python - container images|prague, prague, worldwide|https://www.linkedin.com/jobs/view/4068186027
valeo|purchasing graduate (12 month fixed term contract)|tuam, county galway, ireland|https://www.linkedin.com/jobs/view/4124723841
canonical|software engineer - python - container images|nuremberg, bavaria, germany|https://www.linkedin.com/jobs/view/4117658454
canonical|software engineer - python - container images|athens, attiki, greece|https://www.linkedin.com/jobs/view/4138530345
canonical|software engineer - python - container images|tartu, tartumaa, worldwide|https://www.linkedin.com/jobs/view/4089851748
canonical|software engineer - python - container images|tartu, tartumaa, worldwide|https://www.linkedin.com/jobs/view/4068935687
canonical|software engineer - python - container images|tartu, tartumaa, worldwide|https://www.linkedin.com/jobs/view/4068185142
epam systems|automated testing in java trainee|lithuania, worldwide|https://www.linkedin.com/jobs/view/4144430941
canonical|software engineer - python - container images|warsaw, mazowieckie, poland|https://www.linkedin.com/jobs/view/4117661109
splunk|performance engineer intern|cracow, małopolskie, poland|https://www.linkedin.com/jobs/view/4145167955
canonical|software engineer - python - container images|cracow, małopolskie, poland|https://www.linkedin.com/jobs/view/4089849862
epam systems|automated testing in .net trainee|warsaw, mazowieckie, poland|https://www.linkedin.com/jobs/view/4146036921
valeo|industrial test engineering graduate (12 month fixed term contract)|tuam, county galway, ireland|https://www.linkedin.com/jobs/view/4124726648
aareon dach|trainee (m/w/d) it-tech|dortmund, north rhine-westphalia, germany|https://www.linkedin.com/jobs/view/4143516801
canonical|software engineer - python - container images|athens, attiki, greece|https://www.linkedin.com/jobs/view/4138528476
canonical|software engineer - python - container images|cracow, małopolskie, poland|https://www.linkedin.com/jobs/view/4068180946
ion|business analyst - graduate development program|pisa, tuscany, italy|https://www.linkedin.com/jobs/view/4016665016
canonical|software engineer - python - container images|budapest, budapest, hungary|https://www.linkedin.com/jobs/view/4138532199
canonical|software engineer - python - container images|budapest, budapest, hungary|https://www.linkedin.com/jobs/view/4138531314
canonical|software engineer - python - container images|prague, prague, worldwide|https://www.linkedin.com/jobs/view/4117658480
airbus aircraft|#discover i 2025-2026 internship as method engineer|greater algeciras metropolitan area, worldwide|https://www.linkedin.com/jobs/view/4052305159
canonical|software engineer - python - container images|cracow, małopolskie, poland|https://www.linkedin.com/jobs/view/4089852710
canonical|software engineer - python - container images|antwerp, flemish region, belgium|https://www.linkedin.com/jobs/view/4068934740
canonical|software engineer - python - container images|leipzig, saxony, germany|https://www.linkedin.com/jobs/view/4026771135
segula technologies|stamping engineer in uae|slovakia, worldwide|https://www.linkedin.com/jobs/view/4141122428
canonical|software engineer - python - container images|toulouse, occitanie, france|https://www.linkedin.com/jobs/view/4138531341
canonical|software engineer - python - container images|paris, île-de-france, france|https://www.linkedin.com/jobs/view/4068940133
canonical|software engineer - python - container images|antwerp, flemish region, belgium|https://www.linkedin.com/jobs/view/4089852704
canonical|graduate sales development representative|marseille, provence-alpes-côte d'azur, france|https://www.linkedin.com/jobs/view/4068271531
canonical|software engineer - python - container images|marousi, attiki, greece|https://www.linkedin.com/jobs/view/4089852722
canonical|software engineer - python - container images|antwerp, flemish region, belgium|https://www.linkedin.com/jobs/view/4089850830
arup|renewable energy trainee|madrid, community of madrid, spain|https://www.linkedin.com/jobs/view/4034395442
timeless soft gmbh|full stack entwickler|vienna, austria|https://www.linkedin.com/jobs/view/4105132835
wüstenrot gruppe|full-stack developer - banking &amp; customer portal (m/w/d)|salzburg, salzburg, austria|https://www.linkedin.com/jobs/view/4087659738
wüstenrot gruppe|full-stack developer - banking &amp; customer portal (m/w/d)|vienna, vienna, austria|https://www.linkedin.com/jobs/view/4087662519
velliv|team lead/udvikler til kundevendte løsninger|ballerup, capital region of denmark, denmark|https://www.linkedin.com/jobs/view/4132089731
dymatrix|(junior) cloud data engineer (all genders)|stuttgart, baden-württemberg, germany|https://www.linkedin.com/jobs/view/4148236507
papa oscar ventures|junior web developer (m/w/d)|frankfurt, hesse, germany|https://www.linkedin.com/jobs/view/4079955902
itaricon|javascript entwickler (mensch*)|dresden, saxony, germany|https://www.linkedin.com/jobs/view/4072414658
metergrid gmbh|backend engineer (python/django) (m/w/d)|hamburg, hamburg, germany|https://www.linkedin.com/jobs/view/4149715369
1000°digital gmbh|werkstudent php-webentwicklung (m/w/d)|leipzig, saxony, germany|https://www.linkedin.com/jobs/view/4118162420
tietalent|it systems engineer (m/w/d)|aachen, north rhine-westphalia, germany|https://www.linkedin.com/jobs/view/4124963508
mayflower gmbh|senior backend entwickler in java, springboot (w/d/m)|würzburg, bavaria, germany|https://www.linkedin.com/jobs/view/4115956712
fraunhofer iis|softwareentwickler*in – ai in embedded systems|erlangen, bavaria, germany|https://www.linkedin.com/jobs/view/4139380697
barmeniagothaer|sap developer (w/m/d) icm|wuppertal, north rhine-westphalia, germany|https://www.linkedin.com/jobs/view/3669774040
think about it gmbh|sap entwickler (m/w/d)|bochum, north rhine-westphalia, germany|https://www.linkedin.com/jobs/view/4152183992
fis informationssysteme und consulting gmbh|sap-produktentwickler (m/w/d)|grafenrheinfeld, bavaria, germany|https://www.linkedin.com/jobs/view/4021421103
r+s group gmbh|sps programmierer / automatisierungstechniker (m/w/d)|fulda, hesse, germany|https://www.linkedin.com/jobs/view/3972008073
fischer elektronik gmbh & co. kg|sap anwendungsbetreuer (m/w/d) in voll- oder teilzeit|lüdenscheid, north rhine-westphalia, germany|https://www.linkedin.com/jobs/view/4136441407
otto-von-guericke university magdeburg|435/2024 wissenschaftliche*r mitarbeiter*in (m/w/d) im bereich "transfer learning für ki-anwendungen auf basis von low-cost fpgas“|magdeburg, saxony-anhalt, germany|https://www.linkedin.com/jobs/view/4131262757
vodafone|praktikant innovation garage mit den schwerpunkten mobile media und mixed re (m/w/d) in düsseldorf|düsseldorf, north rhine-westphalia, germany|https://www.linkedin.com/jobs/view/3603890124
it search and selection|devops engineer – onsite 5 days dublin city|dublin, county dublin, ireland|https://www.linkedin.com/jobs/view/4151393662
it search and selection|devops engineer (azure) – onsite 5 days dublin city|dublin, county dublin, ireland|https://www.linkedin.com/jobs/view/4151393663
it search and selection|principal engineer production environment – dublin hybrid onsite/wfh|dublin, county dublin, ireland|https://www.linkedin.com/jobs/view/4151393610
norsk rikskringkasting (nrk)|er du utvikler ogvil være med på ålage nye løsningerfor nrks tv-kanaler?|oslo, oslo, norway|https://www.linkedin.com/jobs/view/4137986398
nav|er du utvikler og opptatt av sikkerhet?|oslo, oslo, norway|https://www.linkedin.com/jobs/view/4138951959
sparebank 1 østlandet|fullstack utviklere|hamar, innlandet, norway|https://www.linkedin.com/jobs/view/4149671994
handelsbanken|salesforce developer|greater oslo region, worldwide|https://www.linkedin.com/jobs/view/4110306357
politiets it-enhet|utvikler plattform|oslo, oslo, norway|https://www.linkedin.com/jobs/view/4134424446
secfix|backend engineer java (fresh grad, < 2 years)|romania|https://www.linkedin.com/jobs/view/4145959704
whatnot|cloud security engineer, 2025 new grad|los angeles metropolitan area, worldwide|https://www.linkedin.com/jobs/view/4151215778
doktor.se|fullstack-utvecklare|stockholm, stockholm county, sweden|https://www.linkedin.com/jobs/view/4117555951
friday|junior adas feature engineer – bli en del av framtidens bilsäkerhet|greater gothenburg metropolitan area, worldwide|https://www.linkedin.com/jobs/view/4149601320
knowit|frontend-utvecklare|linköping, östergötland county, sweden|https://www.linkedin.com/jobs/view/3654216648
swedish armed forces|junior systemutvecklare c#/.net & sharepoint|enköping, uppsala county, sweden|https://www.linkedin.com/jobs/view/4143640178
dizparc|javautvecklare|växjö, kronoberg county, sweden|https://www.linkedin.com/jobs/view/3967382174
b3 reach|system developer|linköpings kommun, östergötland county, sweden|https://www.linkedin.com/jobs/view/3818113088
dynamist ab|devops engineer|stockholm, stockholm county, sweden|https://www.linkedin.com/jobs/view/4135268925
b3 reach|system developer|linköpings kommun, östergötland county, sweden|https://www.linkedin.com/jobs/view/3831016208
göteborgs stad|bpms utvecklare.|gothenburg, västra götaland county, sweden|https://www.linkedin.com/jobs/view/4138374488
montrose by carnegie|frontendutvecklare till montrose by carnegie|greater stockholm metropolitan area, worldwide|https://www.linkedin.com/jobs/view/4123853643
techlove|backendutvecklare för kunds räkning sökes!|stockholm, stockholm county, sweden|https://www.linkedin.com/jobs/view/4130605606
ictech|mjukvaruutvecklare inom inbäddade system till växande konsultbolag!|värmland county, sweden|https://www.linkedin.com/jobs/view/4150017070
amendo tech|servicenow-utvecklare till länsförsäkringar ab|stockholm, stockholm county, sweden|https://www.linkedin.com/jobs/view/4144126997
ictech|embeddedutvecklare sökes till ictech i linköping!|greater linköping metropolitan area, worldwide|https://www.linkedin.com/jobs/view/4145548617
swedish migration agency|senior systemutvecklare för utveckling av event streaming-plattform|norrköping, östergötland county, sweden|https://www.linkedin.com/jobs/view/4144113191
b3 consulting group|qlik-utvecklare till b3 vibe (norra sverige)|gävle, gävleborg county, sweden|https://www.linkedin.com/jobs/view/4142344497
valuequest gmbh|data analyst / data scientist (w/m/d)|zürich metropolitan area, worldwide|https://www.linkedin.com/jobs/view/4144335711
jobcourier|system engineer (m/w)|bern, berne, switzerland|https://www.linkedin.com/jobs/view/4149903755
valuequest gmbh|data analyst / data scientist (w/m/d)|zurich, zurich, switzerland|https://www.linkedin.com/jobs/view/4144373350
university of applied sciences and arts northwestern switzerland fhnw|iam engineer*in 80-100%|windisch, aargau, switzerland|https://www.linkedin.com/jobs/view/4118713575
vertigo games|product specialist (new grad)|türkiye, istanbul, worldwide|https://www.linkedin.com/jobs/view/3759785895
saragossa|cambridge/oxford/imperial grad data engineer|london area, united kingdom|https://www.linkedin.com/jobs/view/4148680166
testhuset.dk|young talent program|aarhus, central denmark region, denmark|https://www.linkedin.com/jobs/view/3905631733
horizoom gmbh|full-stack developer vue / rails (m/w/d)|berlin, berlin, germany|https://www.linkedin.com/jobs/view/4140465779
conny|legal engineer (m/w/d)|berlin, berlin, germany|https://www.linkedin.com/jobs/view/4124576466
fluido|salesforce developer - danmark|gentofte, capital region of denmark, denmark|https://www.linkedin.com/jobs/view/4118089730
tietalent|mitarbeiter (m/w/d) qualitätssicherung im bereich anwendungstechnik (at)|friedrichsdorf, hesse, germany|https://www.linkedin.com/jobs/view/4140848717
consat|test engineer|gothenburg, västra götaland county, sweden|https://www.linkedin.com/jobs/view/4130456109
techseed|vi söker embeddedutvecklare till vår medarbetarägda embedded-enhet!|gothenburg, västra götaland county, sweden|https://www.linkedin.com/jobs/view/4119122662
techseed|cloudutvecklare till medarbetarägt konsultbolag!|gothenburg, västra götaland county, sweden|https://www.linkedin.com/jobs/view/4119127260
metergrid gmbh|full-stack engineer (python/react) (m/w/d)|hamburg, hamburg, germany|https://www.linkedin.com/jobs/view/4149716423
we-site gmbh - shopify agentur|fullstack-entwickler (m/w/d) in vollzeit|hamburg, hamburg, germany|https://www.linkedin.com/jobs/view/4145776633
fis informationssysteme und consulting gmbh|sap entwickler abap (m/w/d)|hamburg, hamburg, germany|https://www.linkedin.com/jobs/view/3933375500
apploft. gmbh|praktikant für mobile app-entwicklung/qa (m/w/d)|hamburg, hamburg, germany|https://www.linkedin.com/jobs/view/3855706096
tietalent|duales masterstudium data science und artificial intelligence (m/w/d) in wedel 2025|wedel, schleswig-holstein, germany|https://www.linkedin.com/jobs/view/4116498989
volkswagen group it solutions gmbh|duales studium  wirtschaftsinformatik (m/w/d)|hannover, lower saxony, germany|https://www.linkedin.com/jobs/view/4096123271
kold+partners|di - azure engineer|copenhagen, capital region of denmark, denmark|https://www.linkedin.com/jobs/view/4143276596
swiss life deutschland|business intelligence entwickler (w/m/d)|munich, bavaria, germany|https://www.linkedin.com/jobs/view/4140694002
politiets sikkerhetstjeneste (pst)|dataplatformutvikler|oslo, norway|https://www.linkedin.com/jobs/view/4145782967
emagine|erfaren data engineer/developer|greater stockholm metropolitan area, worldwide|https://www.linkedin.com/jobs/view/4148655536
atea sverige|servicenow-utvecklare|stockholm, stockholm county, sweden|https://www.linkedin.com/jobs/view/4139226467
saab|devops engineer|järfälla, stockholm county, sweden|https://www.linkedin.com/jobs/view/4142649517
techseed|embeddedutvecklare|västerås, västmanland county, sweden|https://www.linkedin.com/jobs/view/4106256049
f&s prozessautomation gmbh|anwendungs­entwickler / softwareentwickler (m/w/d) - embedded systems|dohna, saxony, germany|https://www.linkedin.com/jobs/view/4149742055
knowit|vi søker fullstack, frontend og backendutviklere|stavanger, rogaland, norway|https://www.linkedin.com/jobs/view/3738819592
infosim®|praktikum research & development (m/w/d)|würzburg, bavaria, germany|https://www.linkedin.com/jobs/view/4130216578
iabg|projektleiter systems engineering (heer) (m/w/d)|ottobrunn, bavaria, germany|https://www.linkedin.com/jobs/view/3780384893
kettenwulf|sap anwendungsbetreuer (m/w/d)|eslohe, north rhine-westphalia, germany|https://www.linkedin.com/jobs/view/4092129532
politiets sikkerhetstjeneste (pst)|tech lead og seniorutvikler|oslo, norway|https://www.linkedin.com/jobs/view/4145902975
canonical|software engineer - go - container images|vienna, vienna, austria|https://www.linkedin.com/jobs/view/4117653017
canonical|software engineer - go - container images|vienna, vienna, austria|https://www.linkedin.com/jobs/view/4089851648
canonical|graduate/associate software engineer - build & release infrastructure|antwerp, flemish region, belgium|https://www.linkedin.com/jobs/view/4121137285
unilin|young graduate microsoft stack/angular software engineer|wielsbeke, flemish region, belgium|https://www.linkedin.com/jobs/view/4125859256
canonical|software engineer - python - container images|antwerp, flemish region, belgium|https://www.linkedin.com/jobs/view/4138526942
canonical|software engineer - python - container images|antwerp, flemish region, belgium|https://www.linkedin.com/jobs/view/4138532198
canonical|software engineer - python - container images|brussels, brussels region, belgium|https://www.linkedin.com/jobs/view/4138531311
canonical|software engineer - go - container images|antwerp, flemish region, belgium|https://www.linkedin.com/jobs/view/4068931991
canonical|software engineer - go - container images|antwerp, flemish region, belgium|https://www.linkedin.com/jobs/view/4068274161
canonical|software engineer - go - container images|brussels, brussels region, belgium|https://www.linkedin.com/jobs/view/4117651253
canonical|software engineer - go - container images|brussels, brussels region, belgium|https://www.linkedin.com/jobs/view/4068936421
canonical|software engineer - go - container images|brussels, brussels region, belgium|https://www.linkedin.com/jobs/view/4068135165
canonical|software engineer - go - container images|brussels, brussels region, belgium|https://www.linkedin.com/jobs/view/4089849728
canonical|engineering manager|antwerp, flemish region, belgium|https://www.linkedin.com/jobs/view/4127927157
canonical|software engineer - python - container images|plovdiv, plovdiv, worldwide|https://www.linkedin.com/jobs/view/4138529485
canonical|software engineer - python - container images|plovdiv, plovdiv, worldwide|https://www.linkedin.com/jobs/view/4117659420
canonical|software engineer - python - container images|plovdiv, plovdiv, worldwide|https://www.linkedin.com/jobs/view/4089856003
canonical|software engineer - python - container images|plovdiv, plovdiv, worldwide|https://www.linkedin.com/jobs/view/4089854415
canonical|software engineer - go - container images|zagreb, zagreb, worldwide|https://www.linkedin.com/jobs/view/4139269437
canonical|software engineer - go - container images|zagreb, zagreb, worldwide|https://www.linkedin.com/jobs/view/4068269906
canonical|software engineer - go - container images|zagreb, zagreb, worldwide|https://www.linkedin.com/jobs/view/4117647810
hitachi rail|signalling it test and integration engineer|copenhagen, capital region of denmark, denmark|https://www.linkedin.com/jobs/view/4090636701
schneider electric|nordic graduate program 2025-denmark|ballerup, capital region of denmark, denmark|https://www.linkedin.com/jobs/view/4096857158
emerson|senior system service engineer|copenhagen, capital region of denmark, denmark|https://www.linkedin.com/jobs/view/4139647923
canonical|engineering manager|tartu, tartumaa, worldwide|https://www.linkedin.com/jobs/view/4127921835
kongsberg maritime|summer trainee, test engineer|turku, southwest finland, finland|https://www.linkedin.com/jobs/view/4106835770
metso|summer trainee, devops engineer|tampere, pirkanmaa, finland|https://www.linkedin.com/jobs/view/4113882203
canonical|graduate/associate software engineer - build & release infrastructure|toulouse, occitanie, france|https://www.linkedin.com/jobs/view/4121138275
canonical|graduate/associate software engineer - build & release infrastructure|strasbourg, grand est, france|https://www.linkedin.com/jobs/view/4121135419
canonical|graduate/associate software engineer - build & release infrastructure|lille, hauts-de-france, france|https://www.linkedin.com/jobs/view/4121138269
canonical|software engineer - python - container images|bordeaux, nouvelle-aquitaine, france|https://www.linkedin.com/jobs/view/4138533069
canonical|software engineer - python - container images|bordeaux, nouvelle-aquitaine, france|https://www.linkedin.com/jobs/view/4138525942
canonical|software engineer - python - container images|lille, hauts-de-france, france|https://www.linkedin.com/jobs/view/4138526966
canonical|software engineer - python - container images|marseille, provence-alpes-côte d'azur, france|https://www.linkedin.com/jobs/view/4138525952
canonical|software engineer - python - container images|paris, île-de-france, france|https://www.linkedin.com/jobs/view/4089852714
canonical|software engineer - python - container images|bordeaux, nouvelle-aquitaine, france|https://www.linkedin.com/jobs/view/4068940105
canonical|software engineer - python - container images|bordeaux, nouvelle-aquitaine, france|https://www.linkedin.com/jobs/view/4068183286
canonical|software engineer - python - container images|rennes, brittany, france|https://www.linkedin.com/jobs/view/4117659418
canonical|software engineer - python - container images|grenoble, auvergne-rhône-alpes, france|https://www.linkedin.com/jobs/view/4068939139
canonical|software engineer - python - container images|toulouse, occitanie, france|https://www.linkedin.com/jobs/view/4068940109
canonical|software engineer - python - container images|metz, grand est, france|https://www.linkedin.com/jobs/view/4117658458
canonical|software engineer - python - container images|metz, grand est, france|https://www.linkedin.com/jobs/view/4089851759
canonical|software engineer - python - container images|metz, grand est, france|https://www.linkedin.com/jobs/view/4089851747
canonical|software engineer - python - container images|metz, grand est, france|https://www.linkedin.com/jobs/view/4068933983
canonical|software engineer - python - container images|metz, grand est, france|https://www.linkedin.com/jobs/view/4068186022
canonical|software engineer - go - container images|marseille, provence-alpes-côte d'azur, france|https://www.linkedin.com/jobs/view/4139268627
canonical|software engineer - go - container images|lille, hauts-de-france, france|https://www.linkedin.com/jobs/view/4139271336
canonical|software engineer - go - container images|bordeaux, nouvelle-aquitaine, france|https://www.linkedin.com/jobs/view/4139268612
canonical|software engineer - go - container images|grenoble, auvergne-rhône-alpes, france|https://www.linkedin.com/jobs/view/4117647823
canonical|software engineer - go - container images|bordeaux, nouvelle-aquitaine, france|https://www.linkedin.com/jobs/view/4068931993
canonical|software engineer - go - container images|bordeaux, nouvelle-aquitaine, france|https://www.linkedin.com/jobs/view/4068275085
canonical|software engineer - go - container images|grenoble, auvergne-rhône-alpes, france|https://www.linkedin.com/jobs/view/4089851626
canonical|software engineer - go - container images|grenoble, auvergne-rhône-alpes, france|https://www.linkedin.com/jobs/view/4068937202
canonical|software engineer - go - container images|grenoble, auvergne-rhône-alpes, france|https://www.linkedin.com/jobs/view/4068271441
canonical|software engineer - go - container images|metz, grand est, france|https://www.linkedin.com/jobs/view/4089848884
canonical|software engineer - go - container images|metz, grand est, france|https://www.linkedin.com/jobs/view/4068936424
canonical|software engineer - go - container images|metz, grand est, france|https://www.linkedin.com/jobs/view/4068274186
canonical|engineering manager|strasbourg, grand est, france|https://www.linkedin.com/jobs/view/4127924408
canonical|engineering manager|toulouse, occitanie, france|https://www.linkedin.com/jobs/view/4127920959
pmg|graduate leadership program - ai & software engineering|ga, atlanta, worldwide|https://www.linkedin.com/jobs/view/3973679660
canonical|software engineer - python - ubuntu pro client - graduate level|ga, atlanta, worldwide|https://www.linkedin.com/jobs/view/4099111911
canonical|software engineer - python - container images|ga, atlanta, worldwide|https://www.linkedin.com/jobs/view/4117659361
canonical|software engineer - python - container images|ga, atlanta, worldwide|https://www.linkedin.com/jobs/view/4138526958
georgia institute of technology|software engineer - open rank research engineer i/ii/sr.|ga, atlanta, worldwide|https://www.linkedin.com/jobs/view/4081324593
jobs via dice|senior sensors engineer|ga, warner robins, worldwide|https://www.linkedin.com/jobs/view/4151028810
jobs via dice|senior missile engineer|ga, warner robins, worldwide|https://www.linkedin.com/jobs/view/4151032310
thomas & hutton|project manager - civil site development|ga, savannah, worldwide|https://www.linkedin.com/jobs/view/4137077291
canonical|software engineer - python - container images|frankfurt am main, hesse, germany|https://www.linkedin.com/jobs/view/4089853701
canonical|software engineer - python - container images|berlin, berlin, germany|https://www.linkedin.com/jobs/view/4068937356
canonical|software engineer - python - container images|düsseldorf, north rhine-westphalia, germany|https://www.linkedin.com/jobs/view/4068178989
canonical|software engineer - python - container images|munich, bavaria, germany|https://www.linkedin.com/jobs/view/4117661116
canonical|software engineer - python - container images|nuremberg, bavaria, germany|https://www.linkedin.com/jobs/view/4068181902
canonical|software engineer - python - container images|hamburg, hamburg, germany|https://www.linkedin.com/jobs/view/4089854428
canonical|software engineer - python - container images|dresden, saxony, germany|https://www.linkedin.com/jobs/view/4138532219
canonical|software engineer - go - container images|hamburg, hamburg, germany|https://www.linkedin.com/jobs/view/4139265766
canonical|software engineer - go - container images|hamburg, hamburg, germany|https://www.linkedin.com/jobs/view/4089850695
emerson|(senior) software engineer (m/f/d)|düsseldorf, north rhine-westphalia, germany|https://www.linkedin.com/jobs/view/4098236536
canonical|software engineer - go - container images|nuremberg, bavaria, germany|https://www.linkedin.com/jobs/view/4089854300
canonical|software engineer - go - container images|nuremberg, bavaria, germany|https://www.linkedin.com/jobs/view/4068937244
canonical|software engineer - go - container images|nuremberg, bavaria, germany|https://www.linkedin.com/jobs/view/4068276105
canonical|software engineer - go - container images|leipzig, saxony, germany|https://www.linkedin.com/jobs/view/4139265756
canonical|software engineer - go - container images|leipzig, saxony, germany|https://www.linkedin.com/jobs/view/4089855058
