company|title|location|link
faro technologies|mobile-app-entwickler*in, schwerpunkt ui/ux|korntal-münchingen, baden-württemberg, germany|https://www.linkedin.com/jobs/view/4263062590
cego|ai data scientist|aalborg, north denmark region, denmark|https://www.linkedin.com/jobs/view/4307004553
sopra steria|senior fullstack java udvikler til afdeling i vækst|copenhagen municipality, capital region of denmark, denmark|https://www.linkedin.com/jobs/view/4283431182
hverdagsai|ai agentudvikler (python/n8n)|copenhagen, capital region of denmark, denmark|https://www.linkedin.com/jobs/view/4300541767
trifork|experienced .net developer|aarhus, central denmark region, denmark|https://www.linkedin.com/jobs/view/4309599735
trifork|experienced .net developer|greater aarhus area, worldwide|https://www.linkedin.com/jobs/view/4309909012
trifork|google cloud expert|aarhus, central denmark region, denmark|https://www.linkedin.com/jobs/view/4202020330
knowit|utvikler?|bergen, vestland, norway|https://www.linkedin.com/jobs/view/4001701789
knowit|data engineer til vårt cloud-team|oslo, oslo, norway|https://www.linkedin.com/jobs/view/4106726068
adentis portugal|desenvolvedor php sênior|viseu, viseu, portugal|https://www.linkedin.com/jobs/view/4306891959
d3|backend engineer - new grad|los angeles, canada|https://www.linkedin.com/jobs/view/4297925587
snap inc.|software engineer, backend, level 4|los angeles, canada|https://www.linkedin.com/jobs/view/4315124412
snap inc.|software engineer, backend, level 5|los angeles, canada|https://www.linkedin.com/jobs/view/4309032016
snap inc.|principal machine learning engineer, ml inference platform, level 7|los angeles, canada|https://www.linkedin.com/jobs/view/4260558346
latinx in ai (lxai)|principal machine learning engineer, ml inference platform, level 7|santa monica, canada|https://www.linkedin.com/jobs/view/4313597710
tenfifty ab|remote data scientist|gothenburg, västra götaland county, sweden|https://www.linkedin.com/jobs/view/4212682500
tenfifty ab|senior pythonutvecklare|gothenburg, västra götaland county, sweden|https://www.linkedin.com/jobs/view/4254604422
sentry|software engineer, new grad (2026)|innere stadt, vienna, austria|https://www.linkedin.com/jobs/view/4309395825
cvation - part of skaylink|software engineer|copenhagen, capital region of denmark, denmark|https://www.linkedin.com/jobs/view/4309623303
initiate|senior data engineer|copenhagen metropolitan area, worldwide|https://www.linkedin.com/jobs/view/4306471421
lensa|new grad engineer i - summer 2026|ga, atlanta, worldwide|https://www.linkedin.com/jobs/view/4312497409
kramer & crew gmbh & co. kg|(senior) software engineer .net/c#|cologne, north rhine-westphalia, germany|https://www.linkedin.com/jobs/view/4260798250
kramer & crew gmbh & co. kg|system engineer (m/w/d) service desk|cologne, north rhine-westphalia, germany|https://www.linkedin.com/jobs/view/4247672547
think about it gmbh|it-system engineer client management (m/w/d)|bochum, north rhine-westphalia, germany|https://www.linkedin.com/jobs/view/4300647285
pb consult gmbh|developer microsoft dynamics 365 business central (m/w/d)|werne an der lippe, north rhine-westphalia, germany|https://www.linkedin.com/jobs/view/4277157797
bwi gmbh|system engineer backup (m/w/d)|munich, bavaria, germany|https://www.linkedin.com/jobs/view/4309665344
bwi gmbh|system engineer backup (m/w/d)|bonn, north rhine-westphalia, germany|https://www.linkedin.com/jobs/view/4309671202
bwi gmbh|system engineer backup (m/w/d)|wilhelmshaven, lower saxony, germany|https://www.linkedin.com/jobs/view/4309649902
bwi gmbh|system engineer backup (m/w/d)|strausberg, brandenburg, germany|https://www.linkedin.com/jobs/view/4309667285
siemens energy|werkstudent (w/m/d) digitalisierung|berlin, berlin, germany|https://www.linkedin.com/jobs/view/4307050853
siemens energy|werkstudent (w/m/d) digitalisierung|hamburg, hamburg, germany|https://www.linkedin.com/jobs/view/4307066148
hiqa - health information and quality authority|senior security infrastructure engineer / innealtóir sinsearach um bonneagar slándála|dublin, county dublin, ireland|https://www.linkedin.com/jobs/view/4303012506
amesto|senior/ principal developer|kristiansand, agder, norway|https://www.linkedin.com/jobs/view/4290965622
amesto|konsulent/seniorkonsulent - data engineer|oslo, oslo, norway|https://www.linkedin.com/jobs/view/4307096104
aveniq|senior devops engineer container technologies|baden, aargau, switzerland|https://www.linkedin.com/jobs/view/4302646369
targetjobs uk|halo grad scheme|stowmarket, england, united kingdom|https://www.linkedin.com/jobs/view/4303656675
evoila|technical project manager (m/f/d)|vienna, vienna, austria|https://www.linkedin.com/jobs/view/4280337537
simon-kucher|senior consultant data engineering (m/w/d)|vienna, vienna, austria|https://www.linkedin.com/jobs/view/4223037173
analog devices|engineer, field applications, new college grad program|antwerp metropolitan area, worldwide|https://www.linkedin.com/jobs/view/4185646169
heidelberger druckmaschinen ag|duales hochschulstudium bachelor of science informatik (m/w/d)|kiel, flemish region, belgium|https://www.linkedin.com/jobs/view/4309539870
invitario  the smarter way to invite|customer success manager|plovdiv, plovdiv, worldwide|https://www.linkedin.com/jobs/view/4200961575
timesafe|full stack engineer|silkeborg municipality, central denmark region, denmark|https://www.linkedin.com/jobs/view/4307244273
databricks|software engineer - new grad (2026 start) - aarhus|aarhus, central denmark region, denmark|https://www.linkedin.com/jobs/view/4297744052
sopra steria|talent pipeline (uopfordret) - software engineering, tech. management & data intelligence|copenhagen municipality, capital region of denmark, denmark|https://www.linkedin.com/jobs/view/4304684332
eg a/s|softwareudvikler|aarhus, central denmark region, denmark|https://www.linkedin.com/jobs/view/4315683115
sopra steria|talent pipeline - senior .net udvikler til afdeling i vækst|copenhagen municipality, capital region of denmark, denmark|https://www.linkedin.com/jobs/view/4308967816
danish industry|senior .net developer|copenhagen, capital region of denmark, denmark|https://www.linkedin.com/jobs/view/4302508735
rittal danmark|sales specialist - energy & power|vallensbæk strand, capital region of denmark, denmark|https://www.linkedin.com/jobs/view/4248442139
bankdata|test coordinator|aarhus, central denmark region, denmark|https://www.linkedin.com/jobs/view/4314619398
career  a jks company|automatikspecialist|vipperød, region zealand, denmark|https://www.linkedin.com/jobs/view/4310272842
comet x-ray|servicetekniker i taastrup|høje-taastrup municipality, capital region of denmark, denmark|https://www.linkedin.com/jobs/view/4307219672
sterigenics|maintenance technician|helsingør, capital region of denmark, denmark|https://www.linkedin.com/jobs/view/4313205620
bankdata|senior db2 engineer - mainframe dba|fredericia, region of southern denmark, denmark|https://www.linkedin.com/jobs/view/4311381546
envidan denmark|senior maskiningeniør/maskinmester til vandbranchen|aarhus, central denmark region, denmark|https://www.linkedin.com/jobs/view/4301305402
envidan denmark|senior maskiningeniør til nogle af de største anlægsprojekter i vandbranchen|aalborg, north denmark region, denmark|https://www.linkedin.com/jobs/view/4301193646
eg a/s|supportkonsulent til eg bolig – med flair for regnskab og kundeservice|aarhus, central denmark region, denmark|https://www.linkedin.com/jobs/view/4303048007
arm|graduate cpu microarchitecture modelling and performance analysis|sophia antipolis, provence-alpes-côte d'azur, france|https://www.linkedin.com/jobs/view/4312897408
arm|senior cpu architect|sophia antipolis, provence-alpes-côte d'azur, france|https://www.linkedin.com/jobs/view/4289487132
qgenda|implementation consultant - 2025 new grad|ga, atlanta, worldwide|https://www.linkedin.com/jobs/view/4312177194
ciena|waveserver software developer - new grad|ga, atlanta, worldwide|https://www.linkedin.com/jobs/view/4315226937
hntb|new grad engineer i - summer 2026|ga, atlanta, worldwide|https://www.linkedin.com/jobs/view/4314813636
renesas electronics|principal digital design engineer|ga, johns creek, worldwide|https://www.linkedin.com/jobs/view/4312921899
renesas electronics|principal digital design engineer|ga, duluth, worldwide|https://www.linkedin.com/jobs/view/4309695510
courser|business development representative|ga, savannah, worldwide|https://www.linkedin.com/jobs/view/4288020624
cargill|software engineer intern summer 2026 - atlanta, ga|ga, atlanta, worldwide|https://www.linkedin.com/jobs/view/4285580468
agnes scott college|graduate admission counselor|ga, decatur, worldwide|https://www.linkedin.com/jobs/view/4298788124
omp|supply chain consultant co-op|ga, atlanta, worldwide|https://www.linkedin.com/jobs/view/4295972634
1898 & co.|energy & utilities analyst, electrical engineer – 1898 & co. (multiple locations)|ga, atlanta, worldwide|https://www.linkedin.com/jobs/view/4211915814
burns & mcdonnell|energy & utilities analyst, electrical engineer - 1898 & co. (atlanta)|ga, atlanta, worldwide|https://www.linkedin.com/jobs/view/4298801059
burns & mcdonnell|energy & utilities analyst, electrical engineer - 1898 & co. (atlanta)|ga, atlanta, worldwide|https://www.linkedin.com/jobs/view/4015165684
burns & mcdonnell|assistant civil engineer - transmission (multiple locations)|ga, atlanta, worldwide|https://www.linkedin.com/jobs/view/4295709819
1898 & co.|energy & utilities analyst, mechanical engineer- 1898 & co. (atlanta)|ga, atlanta, worldwide|https://www.linkedin.com/jobs/view/4295968915
1898 & co.|energy & utilities analyst, electrical engineer - 1898 & co. (atlanta)|ga, atlanta, worldwide|https://www.linkedin.com/jobs/view/4017904064
burns & mcdonnell|assistant civil/structural engineer - transmission & distribution (atlanta)|ga, atlanta, worldwide|https://www.linkedin.com/jobs/view/4297192316
1898 & co.|energy & utilities analyst, electrical engineer - 1898 & co. (atlanta)|ga, atlanta, worldwide|https://www.linkedin.com/jobs/view/4297039277
burns & mcdonnell|assistant structural engineer - aviation & federal (atlanta)|ga, atlanta, worldwide|https://www.linkedin.com/jobs/view/4281881706
merrick & company|electrical facility engineer intern|ga, chamblee, worldwide|https://www.linkedin.com/jobs/view/4290832190
databricks|software engineer - new grad (2026 start)|berlin, berlin, germany|https://www.linkedin.com/jobs/view/4297749056
lea partners|venture capital analyst (m/w/d)|karlsruhe, baden-württemberg, germany|https://www.linkedin.com/jobs/view/4286702958
telli|ai operations intern|berlin, berlin, germany|https://www.linkedin.com/jobs/view/4272315467
instaffo|web-developer|bremen, bremen, germany|https://www.linkedin.com/jobs/view/4241039578
swiss life lebensversicherung se|software testmanager (m/w/d)|munich, bavaria, germany|https://www.linkedin.com/jobs/view/4314815255
thinkred|it-supporter (m/w/d)|bad soden am taunus, hesse, germany|https://www.linkedin.com/jobs/view/4304264678
doctolib|product marketing manager (x/f/m)|berlin, germany|https://www.linkedin.com/jobs/view/4198240749
cetos services ag|it-supporter (m/w/d) gesucht|berlin, berlin, germany|https://www.linkedin.com/jobs/view/4308763679
optenda|market analyst (m/w/d)|essen, north rhine-westphalia, germany|https://www.linkedin.com/jobs/view/4294455244
u2d  up2date solutions gmbh|projektmanager event-software (m/w/d) u2d ventari|nuremberg, bavaria, germany|https://www.linkedin.com/jobs/view/4307222620
kommit gesellschaft für informationstechnik mbh|junior account manager (mwd)  region ost|cologne, north rhine-westphalia, germany|https://www.linkedin.com/jobs/view/4195451667
universitätsklinikum augsburg|projektleiter für automatisierungstechnik (m/w/d)|uedem, north rhine-westphalia, germany|https://www.linkedin.com/jobs/view/3948523312
carl|m&a intern ab 2026 (m/w/d)|berlin, berlin, germany|https://www.linkedin.com/jobs/view/4027789640
enkime|projektmanager (m/w/d) social media|berlin, berlin, germany|https://www.linkedin.com/jobs/view/4310730197
mayflower gmbh|senior python engineer*in mit schwerpunkt genai (w/d/m)|würzburg, bavaria, germany|https://www.linkedin.com/jobs/view/3993263129
amoria bond|testingenieur (m/w/d) elektrotechnik / prüftechnik|nistertal, rhineland-palatinate, germany|https://www.linkedin.com/jobs/view/4297424850
wikus sägenfabrik gmbh & co. kg|entwicklungsingenieur mechatronische systeme (m/w/d)|spangenberg, hesse, germany|https://www.linkedin.com/jobs/view/4315899581
think about it gmbh|senior it administrator (m/w/d)|bochum, north rhine-westphalia, germany|https://www.linkedin.com/jobs/view/4300638407
pechschwarz®|head of performance marketing (m/w/d)|wuppertal, north rhine-westphalia, germany|https://www.linkedin.com/jobs/view/4121369753
hoyer|kaufmännischer sachbearbeiter (m/w/d) im backoffice in berlin|berlin, berlin, germany|https://www.linkedin.com/jobs/view/4309995666
talention|trainee sales (gn)|wuppertal, north rhine-westphalia, germany|https://www.linkedin.com/jobs/view/4264470957
ald vacuum technologies gmbh|software-ingenieur automatisierungstechnik (m/w/div.)|hanau am main, hesse, germany|https://www.linkedin.com/jobs/view/4274338439
swiss life lebensversicherung se|senior camunda entwickler (m/w/d)|munich, bavaria, germany|https://www.linkedin.com/jobs/view/4314820093
conny|werkstudent case management(m/w/d)|berlin, berlin, germany|https://www.linkedin.com/jobs/view/4124573862
hoyer|kaufmännischer sachbearbeiter (m/w/d) im backoffice in linthe|cammer, brandenburg, germany|https://www.linkedin.com/jobs/view/4310206611
iso-gruppe|junior it sales consultant (m/w/d) sap add-ons & data quality|frankfurt am main, hesse, germany|https://www.linkedin.com/jobs/view/4307389281
si pro gmbh|absolvent betriebswirtschaftslehre m.sc. bwl einstieg unternehmensberatung sap (m/w/d), mannheim, berlin, münchen, hamburg|mannheim, baden-württemberg, germany|https://www.linkedin.com/jobs/view/4301643620
ohb digital services gmbh|proposal manager für cyber security und it (m/w/d)|bremen, bremen, germany|https://www.linkedin.com/jobs/view/4314066884
dekabank|werkstudent (w/m/d) cloud-competence & prozesse|frankfurt, hesse, germany|https://www.linkedin.com/jobs/view/4314132900
pechschwarz®|kopie von senior art director / creative director (m/w/d)|wuppertal, north rhine-westphalia, germany|https://www.linkedin.com/jobs/view/4127174549
vesterling ag|sap abap entwickler  abap oo, product lifecyle entwicklung, kundenprojekte  hybrid/remote (mwd)|frankfurt, hesse, germany|https://www.linkedin.com/jobs/view/4253165696
diehl metall|opex manager (m/w/d)|berlin, berlin, germany|https://www.linkedin.com/jobs/view/4311847980
mayflower gmbh|senior ai solutions engineer*in (w/d/m)|würzburg, bavaria, germany|https://www.linkedin.com/jobs/view/4284770160
1komma5°|inside sales coordinator (m/w/d) für intelligente energiesysteme - 1komma5° göttingen|göttingen, lower saxony, germany|https://www.linkedin.com/jobs/view/4306546596
stadtverwaltung bad kissingen|bauingenieur (m/w/d) öffentliche infrastruktur / tiefbau|bad kissingen, bavaria, germany|https://www.linkedin.com/jobs/view/4303563371
lapp group|specialist corporate communications (m/w/d) – elternzeitvertretung|stuttgart, baden-württemberg, germany|https://www.linkedin.com/jobs/view/4298741936
klickpiloten|(senior) sea-manager in stuttgart (m/w/d) &amp;#8211; hybrid|stuttgart, baden-württemberg, germany|https://www.linkedin.com/jobs/view/4315034117
eurofins|einen naturwissenschaftler (m/w/d) (studium biologie, ernährungswissenschaften, biochemie etc.)|munich, bavaria, germany|https://www.linkedin.com/jobs/view/4311368640
stf gruppe|vermessungstechniker mobile mapping (m/w/d)|nuremberg, bavaria, germany|https://www.linkedin.com/jobs/view/4254326414
hornbach|it architect modern workplace (gn)|bornheim, rhineland-palatinate, germany|https://www.linkedin.com/jobs/view/4188182117
stf gruppe|vermessungstechniker mobile mapping (m/w/d)|ismaning, bavaria, germany|https://www.linkedin.com/jobs/view/4254330220
lpe immobilien management gmbh|buchhaltung im immobilienmanagement (voll-/teilzeit)|munich, bavaria, germany|https://www.linkedin.com/jobs/view/4308348385
kramer & crew gmbh & co. kg|account manager*in (m/w/d)|cologne, north rhine-westphalia, germany|https://www.linkedin.com/jobs/view/4263036834
philips|account manager (m/w/d) hospital patient monitoring - region norddeutschland|ruhr region, worldwide|https://www.linkedin.com/jobs/view/4304417413
helios kliniken gmbh|hr-projektmanager (m/w/d)|berlin, berlin, germany|https://www.linkedin.com/jobs/view/4294517269
skopos|werkstudent (m/w/d) marktforschung - customer experience (cx) & communities|aachen, north rhine-westphalia, germany|https://www.linkedin.com/jobs/view/4299227446
swiss life deutschland|enterprise architect (m/w/d)|hannover, lower saxony, germany|https://www.linkedin.com/jobs/view/4291125543
lapp group|duales studium: bwl-digital business management|stuttgart, baden-württemberg, germany|https://www.linkedin.com/jobs/view/4292901876
medizinischer dienst bayern|pflegefachkraft (m/w/d) für die einzelfallbegutachtung|traunstein, bavaria, germany|https://www.linkedin.com/jobs/view/4304780042
zeiss group|expert architect embedded product software (m/w/x)|oberkochen, baden-württemberg, germany|https://www.linkedin.com/jobs/view/4314152068
netto marken-discount|sachbearbeiter e-commerce (m/w/d)|regensburg, bavaria, germany|https://www.linkedin.com/jobs/view/4240044460
etl-gruppe|steuerfachangestellter (m/w/d)|bremen, bremen, germany|https://www.linkedin.com/jobs/view/4289615418
etl-gruppe|steuerfachangestellter (m/w/d)|bremen, bremen, germany|https://www.linkedin.com/jobs/view/4289613503
lapp group|duales studium: bwl-dienstleistungsmanagement – media, vertrieb und kommunikation|stuttgart, baden-württemberg, germany|https://www.linkedin.com/jobs/view/4292906354
gmh gruppe|ausbildung 2026 als verfahrenstechnologin metall (w/d/m)|georgsmarienhütte, lower saxony, germany|https://www.linkedin.com/jobs/view/4272077434
ascom|regional marketing specialist dach (m/w/d) - befristet für 1 jahr (80%-100%)|frankfurt rhine-main metropolitan area, worldwide|https://www.linkedin.com/jobs/view/4311547562
wayss & freytag ingenieurbau ag|arbeitsvorbereiter (m/w/d)|munich, bavaria, germany|https://www.linkedin.com/jobs/view/4262415712
plath. gmbh & co. kg|volljurist/wirtschaftsjurist (m/w/d) contract & claim manager|munich, bavaria, germany|https://www.linkedin.com/jobs/view/4307226252
bwi gmbh|senior it system administrator netzwerk - unterstützung der bundeswehr im ausland (m/w/d)|frankfurt am main, hesse, germany|https://www.linkedin.com/jobs/view/4312569854
bwi gmbh|duales studium zum bachelor of science in wirtschaftsinformatik cyber security inkl. ausbildung zum fachinformatiker anwendungsentwicklung (m/w/d)|strausberg, brandenburg, germany|https://www.linkedin.com/jobs/view/4303085375
bwi gmbh|senior it system administrator netzwerk - unterstützung der bundeswehr im ausland (m/w/d)|bonn, north rhine-westphalia, germany|https://www.linkedin.com/jobs/view/4312574786
bwi gmbh|duales studium zum bachelor of science in wirtschaftsinformatik ki & data science inkl. ausbildung zum fachinformatiker anwendungsentwicklung (m/w/d)|bonn, north rhine-westphalia, germany|https://www.linkedin.com/jobs/view/4303073508
volkswagen group services gmbh|duales studium 2026 i logistik- und informationsmanagement (m/w/d)|brunswick, lower saxony, germany|https://www.linkedin.com/jobs/view/4259770097
bwi gmbh|duales studium zum bachelor of science in wirtschaftsinformatik ki & data science inkl. ausbildung zum fachinformatiker systemintegration (m/w/d)|leipzig, saxony, germany|https://www.linkedin.com/jobs/view/4303091277
continentale versicherung|duales studium wirtschaftsinformatik an der th rosenheim, bachelor of science|munich, bavaria, germany|https://www.linkedin.com/jobs/view/4312137361
bwi gmbh|senior it system administrator netzwerk - unterstützung der bundeswehr im ausland (m/w/d)|leipzig, saxony, germany|https://www.linkedin.com/jobs/view/4312579679
bwi gmbh|duales studium zum bachelor of science in wirtschaftsinformatik ki & data science inkl. ausbildung zum fachinformatiker anwendungsentwicklung (m/w/d)|wilhelmshaven, lower saxony, germany|https://www.linkedin.com/jobs/view/4303074512
bwi gmbh|senior it system administrator netzwerk - unterstützung der bundeswehr im ausland (m/w/d)|hannover, lower saxony, germany|https://www.linkedin.com/jobs/view/4312574785
arm|graduate software engineer|budapest, budapest, hungary|https://www.linkedin.com/jobs/view/4307639496
stripe|software engineer, new grad|dublin, county dublin, ireland|https://www.linkedin.com/jobs/view/4294949931
stripe|backend engineer/api, payments and risk|dublin, county dublin, ireland|https://www.linkedin.com/jobs/view/4289317979
nitro software|software engineer intern (c++)|dublin, county dublin, ireland|https://www.linkedin.com/jobs/view/4304662953
ryanair - europe's favourite airline|grad programme – labs|dublin, county dublin, ireland|https://www.linkedin.com/jobs/view/4309853666
stripe|full stack engineer, payments and risk|dublin, county dublin, ireland|https://www.linkedin.com/jobs/view/4290602097
2k|dublin engineering graduate program|dublin, county dublin, ireland|https://www.linkedin.com/jobs/view/4294133989
stripe|full stack engineer, revenue and finance automation|dublin, county dublin, ireland|https://www.linkedin.com/jobs/view/4289951056
2k|2k games - publishing graduate programme (dublin)|dublin, county dublin, ireland|https://www.linkedin.com/jobs/view/4294137378
godfrey north|economist|dublin, county dublin, ireland|https://www.linkedin.com/jobs/view/4312403531
kpmg ireland|transfer pricing economist|dublin, county dublin, ireland|https://www.linkedin.com/jobs/view/4313209986
schweitzer|it helpdesk mitarbeiter:in (w/m/x)|naturno, trentino-alto adige, italy|https://www.linkedin.com/jobs/view/4262232744
databricks|software engineer - new grad (2026 start)|amsterdam, north holland, netherlands|https://www.linkedin.com/jobs/view/4297756009
arm|graduate software tools engineer|trondheim, trøndelag, norway|https://www.linkedin.com/jobs/view/4299390474
arm|graduate graphics software engineer, vulkan team|trondheim, trøndelag, norway|https://www.linkedin.com/jobs/view/4307059664
arm|graduate graphics software engineer, direct3d team|trondheim, trøndelag, norway|https://www.linkedin.com/jobs/view/4299646296
intellectual labs|droneingeniør (uav/fpv/vtol)|oslo, oslo, norway|https://www.linkedin.com/jobs/view/4303709973
era group - emea|supply chain manager|norway|https://www.linkedin.com/jobs/view/4303515963
honeywell|servicetekniker - brann|bergen, vestland, norway|https://www.linkedin.com/jobs/view/4312731234
honeywell|brannalarmtekniker|trondheim region, worldwide|https://www.linkedin.com/jobs/view/4262950997
honeywell|lead field service technician - fire alarm|norway|https://www.linkedin.com/jobs/view/4261740174
amd|gpu ml modeling / mlops engineer|warsaw, mazowieckie, poland|https://www.linkedin.com/jobs/view/4301420532
stripe|software engineer, new grad|bucharest, bucharest, romania|https://www.linkedin.com/jobs/view/4294962318
undelucram.ro|inginer proiectant sisteme electrice|bucharest, bucharest, romania|https://www.linkedin.com/jobs/view/4284807073
hipo.ro|inginer proiectant sisteme electrice|ilfov, romania|https://www.linkedin.com/jobs/view/4295087931
undelucram.ro|inginer proiectant - parc eolian buzau|buzău, buzău, romania|https://www.linkedin.com/jobs/view/4299086218
hipo.ro|inginer proiectant - parc eolian buzau|ilfov, romania|https://www.linkedin.com/jobs/view/4315324839
angajatori de top|cariera in it - consiliere gratuita in cariera - 24-25 octombrie, centrul regional de afaceri din timisoara|ilfov, romania|https://www.linkedin.com/jobs/view/4212369213
angajatori de top|cariera in it - consiliere gratuita in cariera - 17-18 octombrie, sala palatului|ilfov, romania|https://www.linkedin.com/jobs/view/4212364576
ziprecruiter|software engineer - new grad|santa monica, canada|https://www.linkedin.com/jobs/view/4307938042
d3|frontend engineer - new grad|los angeles, canada|https://www.linkedin.com/jobs/view/4298288410
freeform|software engineer (new grad january 2026)|los angeles, canada|https://www.linkedin.com/jobs/view/4295711788
freeform|software engineer (new grad summer 2026)|los angeles, canada|https://www.linkedin.com/jobs/view/4293339453
radiant system|software engineer - 2026 new graduate|el segundo, canada|https://www.linkedin.com/jobs/view/4300084877
graymatter robotics|robotics engineer: software, new grad|los angeles metropolitan area, worldwide|https://www.linkedin.com/jobs/view/4278671526
d3|digital marketing associate - new grad|los angeles, canada|https://www.linkedin.com/jobs/view/4298262308
graymatter robotics|robotics engineer: software, new grad|los angeles metropolitan area, worldwide|https://www.linkedin.com/jobs/view/4278669713
freeform|electrical engineer (new grad january 2026)|los angeles, canada|https://www.linkedin.com/jobs/view/4296326791
imeg|structural engineering new grad  pasadena, ca|pasadena, canada|https://www.linkedin.com/jobs/view/4294887420
snap inc.|software engineer, ios, level 4|los angeles, canada|https://www.linkedin.com/jobs/view/4310177009
freeform|electrical engineer (new grad summer 2026)|los angeles, canada|https://www.linkedin.com/jobs/view/4293507682
radiant system|mechanical engineer - 2026 new grad (fluid systems, mechanisms, or structures)|el segundo, canada|https://www.linkedin.com/jobs/view/4300088631
directv|2026 directv content internship|el segundo, canada|https://www.linkedin.com/jobs/view/4301540234
freeform|manufacturing engineer (new grad summer 2026)|los angeles, canada|https://www.linkedin.com/jobs/view/4293513497
