company|title|location|link
prometeia|junior credit risk modeller - istanbul|istanbul, istanbul, worldwide|https://www.linkedin.com/jobs/view/3987801545
netcom group s.p.a|system development engineer|türkiye, bursa, worldwide|https://www.linkedin.com/jobs/view/3968894453
kartaca|system administrator intern|türkiye, istanbul, worldwide|https://www.linkedin.com/jobs/view/3988530219
rajab manpower consultants|mechanical engineer for saudi arabia|greater istanbul, worldwide|https://www.linkedin.com/jobs/view/3890904051
adesso turkey|data engineer (snowflake)|türkiye, worldwide|https://www.linkedin.com/jobs/view/3970780135
mavi|business solutions associate (sap sd, mm)|kâğıthane, istanbul, worldwide|https://www.linkedin.com/jobs/view/3975699908
sap|account executive - sap academy for customer success - turkey|greater istanbul, worldwide|https://www.linkedin.com/jobs/view/3988368923
oil and gas job search ltd|mechanical analysis lead engineer- hybrid|fatih, istanbul, worldwide|https://www.linkedin.com/jobs/view/3948431644
rajab manpower consultants|cost / scheduling engineers for saudi arabia|greater istanbul, worldwide|https://www.linkedin.com/jobs/view/3890900900
ipekyol group|project lead|şişli, istanbul, worldwide|https://www.linkedin.com/jobs/view/3539098340
crossover|ai super engineer, gt.school (remote) - $200,000/year usd|türkiye, i̇stanbul, worldwide|https://www.linkedin.com/jobs/view/3988835805
oil and gas job search ltd|mechanical analysis lead engineer- hybrid|fatih, istanbul, worldwide|https://www.linkedin.com/jobs/view/3983265885
adesso turkey|senior software developer (java)|türkiye, worldwide|https://www.linkedin.com/jobs/view/3837238609
yzd elektrik i̇nşaat tic ve san ltd. şti.|mekanik i̇malat mühendisi|adana, adana, worldwide|https://www.linkedin.com/jobs/view/3988513822
tav technologies|bid manager / senior specialist|türkiye, istanbul, worldwide|https://www.linkedin.com/jobs/view/3988235238
solvia digital solutions|sap analytics cloud consultant|türkiye, istanbul, worldwide|https://www.linkedin.com/jobs/view/3966590740
solvia digital solutions|associate sap hcm/sf consultant|türkiye, istanbul, worldwide|https://www.linkedin.com/jobs/view/3988576984
insider.|management trainee for chief revenue officer  revenue operations team|türkiye, i̇stanbul, worldwide|https://www.linkedin.com/jobs/view/3673324996
hsbc|asset, liabilities, capital management & product control specialist|türkiye, istanbul, worldwide|https://www.linkedin.com/jobs/view/3978397211
adesso turkey|senior devops engineer|türkiye, worldwide|https://www.linkedin.com/jobs/view/3902538522
care in turkey|crm specialist|türkiye, istanbul, worldwide|https://www.linkedin.com/jobs/view/3988515575
adesso turkey|senior software developer (angular)|türkiye, istanbul, worldwide|https://www.linkedin.com/jobs/view/3950308882
mastercard|senior managing consultant, advisors business development-r-222143|greater istanbul, worldwide|https://www.linkedin.com/jobs/view/3942851511
triple-id|privileged access management (pam) bootcamp - security consultant|ankara, ankara, worldwide|https://www.linkedin.com/jobs/view/3987041262
bat|demand planning executive|istanbul, istanbul, worldwide|https://www.linkedin.com/jobs/view/3969989919
adesso turkey|sales manager (insurance)|türkiye, istanbul, worldwide|https://www.linkedin.com/jobs/view/3966450609
michael page|customer relationship management (crm) specialist|türkiye, i̇stanbul, worldwide|https://www.linkedin.com/jobs/view/3986856547
solvia digital solutions|sap sd consultant (remote)|türkiye, worldwide|https://www.linkedin.com/jobs/view/3920341150
afiniti|lead software engineer (r&d)|türkiye, i̇stanbul, worldwide|https://www.linkedin.com/jobs/view/3943736571
kartaca|kartaca internal customer relations specialist|türkiye, istanbul, worldwide|https://www.linkedin.com/jobs/view/3981212664
lindsay corporation|associate, warehouse|çorlu bucağı, tekirdağ, worldwide|https://www.linkedin.com/jobs/view/3966476443
agesa hayat ve emeklilik|mobile solutions architect|türkiye, istanbul, worldwide|https://www.linkedin.com/jobs/view/3986839764
adesso turkey|senior software developer (vuejs)|türkiye, istanbul, worldwide|https://www.linkedin.com/jobs/view/3977538862
solvia digital solutions|senior sap pp consultant (remote)|türkiye, worldwide|https://www.linkedin.com/jobs/view/3920341158
everymatrix|trainee .net engineer|lviv, lviv, ukraine|https://www.linkedin.com/jobs/view/3980085189
cadmus|lead - software engineering|ukraine|https://www.linkedin.com/jobs/view/3986542709
globallogic|trainee developer irc230686|kyiv, kyiv city, ukraine|https://www.linkedin.com/jobs/view/3974792603
globallogic|trainee software engineer (c/embedded) irc231528|lviv, lviv, ukraine|https://www.linkedin.com/jobs/view/3977234070
cobblestone energy|graduate software engineer - dubai, uae|kyiv, kyiv city, ukraine|https://www.linkedin.com/jobs/view/3958003183
cobblestone energy|graduate software engineer - dubai, uae|kharkiv, kharkiv, ukraine|https://www.linkedin.com/jobs/view/3957699948
kevych solutions|trainee ios engineer|lviv, lviv, ukraine|https://www.linkedin.com/jobs/view/3973650702
globallogic|trainee test engineer for cambium project irc226487|lviv, lviv, ukraine|https://www.linkedin.com/jobs/view/3948398258
globallogic|trainee test engineer for cambium project irc226487|kyiv, kyiv city, ukraine|https://www.linkedin.com/jobs/view/3948392998
kevych solutions|trainee/junior project manager|lviv, lviv, ukraine|https://www.linkedin.com/jobs/view/3986525187
mercedes-amg petronas formula one team|graduate software engineer|brackley, england, united kingdom|https://www.linkedin.com/jobs/view/3987201259
energy jobline|graduate software developer - london - hybrid|london, england, united kingdom|https://www.linkedin.com/jobs/view/3989524137
john gerlach & company llc|graduate software developer - london - hybrid|royston, england, united kingdom|https://www.linkedin.com/jobs/view/3978557017
dorset software|graduate software developer|manchester, england, united kingdom|https://www.linkedin.com/jobs/view/3978550630
tiptopjob|graduate software developer|london, england, united kingdom|https://www.linkedin.com/jobs/view/3968998898
datalex|graduate full stack software engineer - manchester|manchester, england, united kingdom|https://www.linkedin.com/jobs/view/3988801504
dorset software|graduate software developer|oxford, england, united kingdom|https://www.linkedin.com/jobs/view/3960120489
all.space|graduate software engineer|reading, england, united kingdom|https://www.linkedin.com/jobs/view/3974303235
mammoet|graduate engineer|haile, england, united kingdom|https://www.linkedin.com/jobs/view/3982530618
tiptopjob|graduate software engineer|london, england, united kingdom|https://www.linkedin.com/jobs/view/3983214049
it career switch|trainee web developer - no experience required|nottingham, england, united kingdom|https://www.linkedin.com/jobs/view/3934738223
pepper mill|junior software developer|london, england, united kingdom|https://www.linkedin.com/jobs/view/3989864767
pepper mill|graduate software developer|manchester, england, united kingdom|https://www.linkedin.com/jobs/view/3989865759
it career switch|trainee web developer - no experience required|portsmouth, england, united kingdom|https://www.linkedin.com/jobs/view/3934738272
it career switch|trainee web developer - no experience required|oxford, england, united kingdom|https://www.linkedin.com/jobs/view/3955390955
oliver bernard|graduate software engineer - £30k - £40k|newcastle upon tyne, england, united kingdom|https://www.linkedin.com/jobs/view/3977346352
it career switch|trainee web developer - no experience required|liverpool, england, united kingdom|https://www.linkedin.com/jobs/view/3914632355
reply|graduate software developer|greater bristol area, united kingdom|https://www.linkedin.com/jobs/view/3967623639
pepper mill|graduate software developer|birmingham, england, united kingdom|https://www.linkedin.com/jobs/view/3989870513
it career switch|trainee web developer - no experience required|middlesbrough, england, united kingdom|https://www.linkedin.com/jobs/view/3914624866
it career switch|trainee web developer - no experience required|belfast, northern ireland, united kingdom|https://www.linkedin.com/jobs/view/3976930351
stem solutions, llc|graduate software engineer - 2025 start|manchester, england, united kingdom|https://www.linkedin.com/jobs/view/3968537490
pepper mill|graduate software developer|southampton, england, united kingdom|https://www.linkedin.com/jobs/view/3989867556
it career switch|trainee web developer - no experience required|matlock bath, england, united kingdom|https://www.linkedin.com/jobs/view/3976926649
grayce|data graduate - london|london, england, united kingdom|https://www.linkedin.com/jobs/view/3982686102
it career switch|trainee web developer - no experience required|glasgow, scotland, united kingdom|https://www.linkedin.com/jobs/view/3976929373
it career switch|trainee web developer - no experience required|stoke-on-trent, england, united kingdom|https://www.linkedin.com/jobs/view/3976926664
pepper mill|graduate software developer|glasgow, scotland, united kingdom|https://www.linkedin.com/jobs/view/3989868551
sparta global|graduate software developer|london, england, united kingdom|https://www.linkedin.com/jobs/view/3989852826
grayce|technology graduate - london|london, england, united kingdom|https://www.linkedin.com/jobs/view/3959778585
spectrum it recruitment|graduate software developer|brighton, england, united kingdom|https://www.linkedin.com/jobs/view/3988725262
tiptopjob|graduate software engineer|whitwick, england, united kingdom|https://www.linkedin.com/jobs/view/3984979128
pepper mill|graduate software engineer|bristol, england, united kingdom|https://www.linkedin.com/jobs/view/3989871422
pepper mill|junior software developer|bristol, england, united kingdom|https://www.linkedin.com/jobs/view/3989865782
e-careers|software developer trainee|northwich, england, united kingdom|https://www.linkedin.com/jobs/view/3989025246
e-careers|software developer trainee|blackpool, england, united kingdom|https://www.linkedin.com/jobs/view/3989032291
storyteq|graduate data administrator|birmingham, england, united kingdom|https://www.linkedin.com/jobs/view/3980030627
bending spoons|graduate software engineer|oxfordshire, england, united kingdom|https://www.linkedin.com/jobs/view/3988509855
grayce|technology graduate - manchester|manchester, england, united kingdom|https://www.linkedin.com/jobs/view/3959777567
spectrum it recruitment|graduate software developer|london, england, united kingdom|https://www.linkedin.com/jobs/view/3983515925
it career switch|trainee web developer - no experience required|twickenham, england, united kingdom|https://www.linkedin.com/jobs/view/3953402373
e-careers|software developer trainee|glazebury, england, united kingdom|https://www.linkedin.com/jobs/view/3989029439
e-careers|software developer trainee|culcheth, england, united kingdom|https://www.linkedin.com/jobs/view/3989031256
langham recruitment|graduate software engineer c++/python/robotics|bristol, england, united kingdom|https://www.linkedin.com/jobs/view/3989872257
sparta global|graduate software engineer|london, england, united kingdom|https://www.linkedin.com/jobs/view/3989854683
grayce|data graduate - cambridge|cambridge, england, united kingdom|https://www.linkedin.com/jobs/view/3982684509
e-careers|trainee - software developer|ashton-under-lyne, england, united kingdom|https://www.linkedin.com/jobs/view/3651671709
itonlinelearning recruitment|coding and programming trainee|enfield, england, united kingdom|https://www.linkedin.com/jobs/view/3969387439
generation success|graduate software developer|glasgow, scotland, united kingdom|https://www.linkedin.com/jobs/view/3960724088
it career switch|trainee web developer|enfield, england, united kingdom|https://www.linkedin.com/jobs/view/3981334523
solirius consulting|graduate software test engineer|london, england, united kingdom|https://www.linkedin.com/jobs/view/3987798318
graphcore|graduate software engineer|bristol, england, united kingdom|https://www.linkedin.com/jobs/view/3981842317
informed solutions|graduate associate – digital, data and technology|altrincham, england, united kingdom|https://www.linkedin.com/jobs/view/3921098172
sparta global|graduate software developer|glasgow, scotland, united kingdom|https://www.linkedin.com/jobs/view/3989857019
understanding recruitment|graduate software engineer|united kingdom|https://www.linkedin.com/jobs/view/3988292747
hunter bond|graduate software engineer - hybrid working - £35,000 - £100,000 base (+bonus)|greater london, england, united kingdom|https://www.linkedin.com/jobs/view/3987839511
e-careers|trainee - software developer|chadderton, england, united kingdom|https://www.linkedin.com/jobs/view/3714811969
pepper mill|junior software engineer|bristol, england, united kingdom|https://www.linkedin.com/jobs/view/3989871406
e-careers|software developer trainee|helsby, england, united kingdom|https://www.linkedin.com/jobs/view/3702472098
it career switch|trainee web developer|london, england, united kingdom|https://www.linkedin.com/jobs/view/3982130939
it career switch|trainee web developer|bromley, england, united kingdom|https://www.linkedin.com/jobs/view/3982127941
energy jobline|graduate engineer - python, c++, java - newcastle|newcastle upon tyne, england, united kingdom|https://www.linkedin.com/jobs/view/3989522272
spectrum it recruitment|graduate software developer|city of london, england, united kingdom|https://www.linkedin.com/jobs/view/3986408115
it career switch|trainee web developer|nottingham, england, united kingdom|https://www.linkedin.com/jobs/view/3982133490
it career switch|trainee web developer|belfast, northern ireland, united kingdom|https://www.linkedin.com/jobs/view/3980379081
e-careers|trainee - software developer|urmston, england, united kingdom|https://www.linkedin.com/jobs/view/3686095275
oho group ltd|graduate software engineer|london area, united kingdom|https://www.linkedin.com/jobs/view/3941343112
it career switch|trainee web developer|coventry, england, united kingdom|https://www.linkedin.com/jobs/view/3982132658
it career switch|trainee web developer|wolverhampton, england, united kingdom|https://www.linkedin.com/jobs/view/3982131767
it career switch|trainee web developer|birmingham, england, united kingdom|https://www.linkedin.com/jobs/view/3982131700
e-careers|software developer trainee|widnes, england, united kingdom|https://www.linkedin.com/jobs/view/3714812721
it career switch|trainee web developer|leicester, england, united kingdom|https://www.linkedin.com/jobs/view/3982128996
it career switch|trainee web developer|cardiff, wales, united kingdom|https://www.linkedin.com/jobs/view/3982131765
e-careers|software developer trainee|kelsall, england, united kingdom|https://www.linkedin.com/jobs/view/3744794179
e-careers|software developer trainee|barnoldswick, england, united kingdom|https://www.linkedin.com/jobs/view/3702465995
itonlinelearning recruitment|coding and programming trainee|kingston upon thames, england, united kingdom|https://www.linkedin.com/jobs/view/3978137560
cred|backend engineer|london, england, united kingdom|https://www.linkedin.com/jobs/view/3959573610
hunter bond|graduate software engineer - up to £150,000 + bonus + package|london area, united kingdom|https://www.linkedin.com/jobs/view/3984637983
itonlinelearning recruitment|coding and programming trainee|leicester, england, united kingdom|https://www.linkedin.com/jobs/view/3975808374
itonlinelearning recruitment|coding and programming trainee|coventry, england, united kingdom|https://www.linkedin.com/jobs/view/3966934172
it career switch|trainee web developer|stoke-on-trent, england, united kingdom|https://www.linkedin.com/jobs/view/3982130824
e-careers|software developer trainee|sandbach, england, united kingdom|https://www.linkedin.com/jobs/view/3714809991
it career switch|trainee web developer|chelmsford, england, united kingdom|https://www.linkedin.com/jobs/view/3982131565
reward|graduate software engineer|belfast, northern ireland, united kingdom|https://www.linkedin.com/jobs/view/3981800912
it career switch|trainee web developer|northampton, england, united kingdom|https://www.linkedin.com/jobs/view/3982127962
e-careers|software developer trainee|backford, england, united kingdom|https://www.linkedin.com/jobs/view/3744792731
e-careers|software developer trainee|saighton, england, united kingdom|https://www.linkedin.com/jobs/view/3744791779
e-careers|software developer trainee|delamere, england, united kingdom|https://www.linkedin.com/jobs/view/3744790859
e-careers|software developer trainee|weaverham, england, united kingdom|https://www.linkedin.com/jobs/view/3702468575
e-careers|trainee - software developer|worsley, england, united kingdom|https://www.linkedin.com/jobs/view/3744794726
it career switch|trainee web developer|bristol, england, united kingdom|https://www.linkedin.com/jobs/view/3982128841
e-careers|software developer trainee|accrington, england, united kingdom|https://www.linkedin.com/jobs/view/3702469284
it career switch|trainee web developer|cambridge, england, united kingdom|https://www.linkedin.com/jobs/view/3982131541
itonlinelearning recruitment|coding and programming trainee|reading, england, united kingdom|https://www.linkedin.com/jobs/view/3978347827
oho group ltd|graduate software engineer|london area, united kingdom|https://www.linkedin.com/jobs/view/3961841383
e-careers|software developer trainee|haslington, england, united kingdom|https://www.linkedin.com/jobs/view/3714810982
e-careers|software developer trainee|macclesfield, england, united kingdom|https://www.linkedin.com/jobs/view/3923883585
itonlinelearning recruitment|coding and programming trainee|bournemouth, england, united kingdom|https://www.linkedin.com/jobs/view/3973403953
e-careers|software developer trainee|blackburn, england, united kingdom|https://www.linkedin.com/jobs/view/3881509890
it career switch|trainee web developer|sheffield, england, united kingdom|https://www.linkedin.com/jobs/view/3982131778
e-careers|software developer trainee|goostrey, england, united kingdom|https://www.linkedin.com/jobs/view/3744791777
oho group ltd|graduate software engineer|london area, united kingdom|https://www.linkedin.com/jobs/view/3979593922
itonlinelearning recruitment|coding and programming trainee|hounslow, england, united kingdom|https://www.linkedin.com/jobs/view/3988236383
e-careers|software developer trainee|knutsford, england, united kingdom|https://www.linkedin.com/jobs/view/3702466956
itonlinelearning recruitment|coding and programming trainee|huddersfield, england, united kingdom|https://www.linkedin.com/jobs/view/3970658975
e-careers|software developer trainee|neston, england, united kingdom|https://www.linkedin.com/jobs/view/3766079282
itonlinelearning recruitment|coding and programming trainee|doncaster, england, united kingdom|https://www.linkedin.com/jobs/view/3975810136
itonlinelearning recruitment|coding and programming trainee|sheffield, england, united kingdom|https://www.linkedin.com/jobs/view/3973407109
e-careers|software developer trainee|lytham st anne's, england, united kingdom|https://www.linkedin.com/jobs/view/3714812718
e-careers|software developer trainee|kirkham, england, united kingdom|https://www.linkedin.com/jobs/view/3714810984
e-careers|software developer trainee|burscough, england, united kingdom|https://www.linkedin.com/jobs/view/3702466957
e-careers|software developer trainee|carnforth, england, united kingdom|https://www.linkedin.com/jobs/view/3793316573
e-careers|trainee - software developer|ramsbottom, england, united kingdom|https://www.linkedin.com/jobs/view/3745000339
itonlinelearning recruitment|coding and programming trainee|crawley, england, united kingdom|https://www.linkedin.com/jobs/view/3973405563
itonlinelearning recruitment|coding and programming trainee|kingston upon hull, england, united kingdom|https://www.linkedin.com/jobs/view/3978353273
itonlinelearning recruitment|coding and programming trainee|macclesfield, england, united kingdom|https://www.linkedin.com/jobs/view/3969386649
it career switch|trainee web developer|dartford, england, united kingdom|https://www.linkedin.com/jobs/view/3982132646
targetjobs uk|technology graduate|stoke-on-trent, england, united kingdom|https://www.linkedin.com/jobs/view/3939479318
itonlinelearning recruitment|coding and programming trainee|ipswich, england, united kingdom|https://www.linkedin.com/jobs/view/3973405674
itonlinelearning recruitment|coding and programming trainee|croydon, england, united kingdom|https://www.linkedin.com/jobs/view/3966936046
itonlinelearning recruitment|coding and programming trainee|southend-on-sea, england, united kingdom|https://www.linkedin.com/jobs/view/3985237467
e-careers|software developer trainee|oswaldtwistle, england, united kingdom|https://www.linkedin.com/jobs/view/3714809983
spectrum it recruitment|graduate / junior c++ software engineer|southampton, england, united kingdom|https://www.linkedin.com/jobs/view/3988048838
mustard systems ltd.|graduate cricket trader|greater london, england, united kingdom|https://www.linkedin.com/jobs/view/3979344117
it career switch|trainee web developer|preston, england, united kingdom|https://www.linkedin.com/jobs/view/3986822538
itonlinelearning recruitment|coding and programming trainee|glasgow, scotland, united kingdom|https://www.linkedin.com/jobs/view/3975811053
e-careers|trainee - software developer|bury, england, united kingdom|https://www.linkedin.com/jobs/view/3651668905
sparta global|graduate software engineer|glasgow, scotland, united kingdom|https://www.linkedin.com/jobs/view/3989848997
e-careers|trainee - software developer|stockport, england, united kingdom|https://www.linkedin.com/jobs/view/3745000337
e-careers|software developer trainee|st michael's on wyre, england, united kingdom|https://www.linkedin.com/jobs/view/3965556300
mineral park, inc.|graduate engineer|brierley hill, england, united kingdom|https://www.linkedin.com/jobs/view/3968420334
robustelli ∙ soucy ∙ hussey, p.a.|graduate software developer in test|southampton, england, united kingdom|https://www.linkedin.com/jobs/view/3971292919
it career switch|trainee web developer|kingston upon hull, england, united kingdom|https://www.linkedin.com/jobs/view/3982132730
vivo talent solutions|graduate recruitment consultant|birmingham, england, united kingdom|https://www.linkedin.com/jobs/view/3982301858
itonlinelearning recruitment|coding and programming trainee|edinburgh, scotland, united kingdom|https://www.linkedin.com/jobs/view/3978348442
itonlinelearning recruitment|coding and programming trainee|preston, england, united kingdom|https://www.linkedin.com/jobs/view/3978354271
e-careers|trainee - software developer|eccles, england, united kingdom|https://www.linkedin.com/jobs/view/3651671711
itonlinelearning recruitment|coding and programming trainee|belfast, northern ireland, united kingdom|https://www.linkedin.com/jobs/view/3988234563
kerridge commercial systems|graduate software developer|hungerford, england, united kingdom|https://www.linkedin.com/jobs/view/3984888772
reply|graduate ai & software engineer|sheffield, england, united kingdom|https://www.linkedin.com/jobs/view/3971001479
sparta global|junior software engineer|manchester, england, united kingdom|https://www.linkedin.com/jobs/view/3989852815
wits warehouse solutions|software developer full stack graduate|leeds, england, united kingdom|https://www.linkedin.com/jobs/view/3983231097
grayce|data graduate|manchester area, united kingdom|https://www.linkedin.com/jobs/view/3945821126
pepper mill|graduate technology consultant|london, england, united kingdom|https://www.linkedin.com/jobs/view/3989870485
labman|graduate robotics engineer|stokesley, england, united kingdom|https://www.linkedin.com/jobs/view/3932037931
e-careers|software developer trainee|guilden sutton, england, united kingdom|https://www.linkedin.com/jobs/view/3744793673
itonlinelearning recruitment|coding and programming trainee|newport, wales, united kingdom|https://www.linkedin.com/jobs/view/3983907039
e-careers|software developer trainee|hargrave, england, united kingdom|https://www.linkedin.com/jobs/view/3900034209
cbsbutler|graduate software engineer (embedded)|rochester, england, united kingdom|https://www.linkedin.com/jobs/view/3890906828
e-careers|software developer trainee|newport, wales, united kingdom|https://www.linkedin.com/jobs/view/3766081223
hunter bond|associate/graduate software engineer : elite hedge fund : £100k+ : python / django / react / rust|london area, united kingdom|https://www.linkedin.com/jobs/view/3980988035
e-careers|software developer trainee|ness, scotland, united kingdom|https://www.linkedin.com/jobs/view/3744797413
pepper mill|junior java software engineer|bristol, england, united kingdom|https://www.linkedin.com/jobs/view/3957321655
pepper mill|junior c# software developer|london, england, united kingdom|https://www.linkedin.com/jobs/view/3956111658
sparta global|junior software engineer|glasgow, scotland, united kingdom|https://www.linkedin.com/jobs/view/3989854657
sigma labs|sigma labs - graduate technology consultant programme|london, england, united kingdom|https://www.linkedin.com/jobs/view/3980344027
kerridge commercial systems|graduate software developer|gibraltar, worldwide|https://www.linkedin.com/jobs/view/3923899898
cathcart technology|software developer|east kilbride, scotland, united kingdom|https://www.linkedin.com/jobs/view/3982877933
samsung cambridge solution centre|graduate embedded software enginer|cambridge, england, united kingdom|https://www.linkedin.com/jobs/view/3967704516
eso|graduate qa|belfast, northern ireland, united kingdom|https://www.linkedin.com/jobs/view/3989260259
