company|title|location|link
motorola solutions|junior backend engineer / c#|cracow, małopolskie, poland|https://www.linkedin.com/jobs/view/4082605542
marketer ux gmbh|webflow-developer (m/w/d) im medienhafen düsseldorf|düsseldorf, north rhine-westphalia, germany|https://www.linkedin.com/jobs/view/4120261802
twofour - agentur für digitalstrategie, konzeption & webentwicklung|senior developer magento (w/m/d)|rosenheim, bavaria, germany|https://www.linkedin.com/jobs/view/4110158623
acronis|macos c++/ objective-c developer (trueimage)|serbia, stari grad, worldwide|https://www.linkedin.com/jobs/view/4036802973
meta|production engineer (university grad)|dublin, county dublin, ireland|https://www.linkedin.com/jobs/view/4120826247
meta|software engineer (university grad)|london, england, united kingdom|https://www.linkedin.com/jobs/view/4120822691
meta|production engineer (university grad)|london, england, united kingdom|https://www.linkedin.com/jobs/view/4120824482
trifork|java software developer|greater aarhus area, worldwide|https://www.linkedin.com/jobs/view/4116584126
trifork|java software developer|aarhus, central denmark region, denmark|https://www.linkedin.com/jobs/view/4116573457
trifork|experienced .net developer|greater aarhus area, worldwide|https://www.linkedin.com/jobs/view/4116578863
trifork|experienced .net developer|aarhus, central denmark region, denmark|https://www.linkedin.com/jobs/view/4116568978
sopra steria|senior/lead java udvikler til afdeling i vækst|copenhagen, capital region of denmark, denmark|https://www.linkedin.com/jobs/view/4117390401
sopra steria|senior data engineer til nyopstartet team|copenhagen, capital region of denmark, denmark|https://www.linkedin.com/jobs/view/4067800298
knowit|data engineer til vårt cloud-team|oslo, oslo, norway|https://www.linkedin.com/jobs/view/4106726068
acronis|senior solutions engineer dach (remote)|serbia, stari grad, worldwide|https://www.linkedin.com/jobs/view/4118521582
insider.|software developer – insider testinium tech hub (remote)|greater istanbul, worldwide|https://www.linkedin.com/jobs/view/4092393853
cvation - part of skaylink|software engineer|copenhagen, capital region of denmark, denmark|https://www.linkedin.com/jobs/view/4105025300
inmobile|senior .net developer|aarhus municipality, central denmark region, denmark|https://www.linkedin.com/jobs/view/4103406562
twoday|senior .net developer - commercial east|copenhagen municipality, capital region of denmark, denmark|https://www.linkedin.com/jobs/view/4025814715
energinet|softwareudvikler til platforms-team|fredericia, region of southern denmark, denmark|https://www.linkedin.com/jobs/view/4125108407
hntb|new grad engineer i - summer 2025|ga, atlanta, worldwide|https://www.linkedin.com/jobs/view/4115740321
giesecke+devrient|software developer (m/w/d)|munich, bavaria, germany|https://www.linkedin.com/jobs/view/4074976697
join.com|mondia group: java backend developer (m/f/d)|hamburg, hamburg, germany|https://www.linkedin.com/jobs/view/4123408338
t&a systeme gmbh|business and web app developer (m/w/d)|hattingen, north rhine-westphalia, germany|https://www.linkedin.com/jobs/view/4111225398
maxsolar gmbh|it-system-engineer microsoft (m/w/d) - erneuerbare energien|feldkirchen, bavaria, germany|https://www.linkedin.com/jobs/view/4047638789
swiss life deutschland|anwendungsentwickler (m/w/d) / devops engineer (m/w/d)|munich, bavaria, germany|https://www.linkedin.com/jobs/view/4110044873
axel springer|system- / cloud engineer - identity access management (m/w/d)|berlin, germany|https://www.linkedin.com/jobs/view/4058444100
breuninger|(senior) it systemadministrator / system engineer / devops engineer (m/w/d)|stuttgart, baden-württemberg, germany|https://www.linkedin.com/jobs/view/4074069686
sgs|informatiker*in / systemtechniker*in als (senior) it-system engineer (m/w/d)|hamburg, hamburg, germany|https://www.linkedin.com/jobs/view/4034757654
think about it gmbh|senior it-system engineer mit schwerpunkt ms azure/m365 (m/w/d)|bochum, north rhine-westphalia, germany|https://www.linkedin.com/jobs/view/4127190807
columbus|senior data engineer  data & ai|oslo, oslo, norway|https://www.linkedin.com/jobs/view/3664572173
hntb|new grad electrical engineer i - summer 2025|los angeles, canada|https://www.linkedin.com/jobs/view/4072345731
hntb|new grad civil engineer i - aviation - summer 2025|los angeles, canada|https://www.linkedin.com/jobs/view/4072957340
acronis|senior acumatica software engineer|serbia, stari grad, worldwide|https://www.linkedin.com/jobs/view/4125174050
acronis|cloud expert engineer with french|serbia, stari grad, worldwide|https://www.linkedin.com/jobs/view/4000300808
university of applied sciences and arts northwestern switzerland fhnw|full-stack software engineer 100%|windisch, aargau, switzerland|https://www.linkedin.com/jobs/view/4098072770
rocken®|lead system engineer (m/w/d)|zug, zug, switzerland|https://www.linkedin.com/jobs/view/4117158734
aegon uk|analyst programmer (pega)|edinburgh, scotland, united kingdom|https://www.linkedin.com/jobs/view/4117150420
aegon uk|analyst programmer (pega)|witham, england, united kingdom|https://www.linkedin.com/jobs/view/4117150417
anderson green ltd|graduate electrical design engineer|nottingham, england, united kingdom|https://www.linkedin.com/jobs/view/4093672528
swiss life deutschland|microsoft dynamics 365 developer (m/w/d) – schwerpunkt crm in voll- oder teilzeit|munich, bavaria, germany|https://www.linkedin.com/jobs/view/4111052544
faktor zehn|junior softwareentwickler java für unser trainee programm (mensch*)|austria|https://www.linkedin.com/jobs/view/4105585036
the estée lauder companies inc.|hr payroll & reporting specialist (all genders) - wien - 32h bis 38,5h/woche|vienna, vienna, austria|https://www.linkedin.com/jobs/view/4118982026
testhuset.dk|tester - aarhus|aarhus, central denmark region, denmark|https://www.linkedin.com/jobs/view/4012638999
curia|softwareudvikler med potentiale til at blive softwarearkitekt til r&d|arden, north denmark region, denmark|https://www.linkedin.com/jobs/view/4124569601
testhuset.dk|tester - ballerup|ballerup, capital region of denmark, denmark|https://www.linkedin.com/jobs/view/3919168315
analog devices|engineer, field applications, new college grad program|copenhagen metropolitan area, worldwide|https://www.linkedin.com/jobs/view/4035639096
testhuset.dk|test manager - aarhus|aarhus, central denmark region, denmark|https://www.linkedin.com/jobs/view/3919163794
testhuset.dk|test manager - ballerup|ballerup, capital region of denmark, denmark|https://www.linkedin.com/jobs/view/3919167574
trifork|ai/ml expert|greater aarhus area, worldwide|https://www.linkedin.com/jobs/view/4116584120
comet x-ray|pta technician|copenhagen metropolitan area, worldwide|https://www.linkedin.com/jobs/view/4089317669
miralix a/s|sales executive|hedensted municipality, central denmark region, denmark|https://www.linkedin.com/jobs/view/4119541388
kvik a/s|planlægningsspecialist|vildbjerg, central denmark region, denmark|https://www.linkedin.com/jobs/view/4106452835
pro&co a/s|planlægningsspecialist – produktionsplanlægning til nye højder|vildbjerg, central denmark region, denmark|https://www.linkedin.com/jobs/view/4112929713
analog devices|engineer, field applications, new college grad program|helsinki metropolitan area, worldwide|https://www.linkedin.com/jobs/view/4035636205
arm|graduate micro-architect and performance modelling engineer - cpu|sophia antipolis, provence-alpes-côte d'azur, france|https://www.linkedin.com/jobs/view/4059678958
salesforce|software engineering amts/mts (new grad)|ga, atlanta, worldwide|https://www.linkedin.com/jobs/view/4066585330
deposco|associate consultant  - may 2025 grad|ga, alpharetta, worldwide|https://www.linkedin.com/jobs/view/4024329658
enercon services, inc.|new graduate may/june 2025 - electrical engineer - enercon federal services|ga, kennesaw, worldwide|https://www.linkedin.com/jobs/view/3998510365
enercon services, inc.|new graduate may/june 2025- safety analysis engineer|ga, kennesaw, worldwide|https://www.linkedin.com/jobs/view/4001285104
enercon services, inc.|new graduate may/june 2025 - civil/structural engineer - enercon federal services|ga, kennesaw, worldwide|https://www.linkedin.com/jobs/view/4031690088
salesforce|sales development representative (new grad)|ga, atlanta, worldwide|https://www.linkedin.com/jobs/view/4090626277
enercon services, inc.|may/june 2025 new graduate - distribution engineer - power delivery group|ga, kennesaw, worldwide|https://www.linkedin.com/jobs/view/4032256754
holder construction|preconstruction engineer (new college grad 2024-2025)|georgia, united states|https://www.linkedin.com/jobs/view/4125890839
enercon services, inc.|new graduate dec 2024 - mechanical analysis engineer|ga, kennesaw, worldwide|https://www.linkedin.com/jobs/view/4104195965
1898 & co.|energy & utilities analyst, electrical engineer - 1898 & co. (atlanta)|ga, atlanta, worldwide|https://www.linkedin.com/jobs/view/4017904063
innovative therapy concepts|northside gwinnett rehabilitation aide|ga, lawrenceville, worldwide|https://www.linkedin.com/jobs/view/4115359302
1898 & co.|energy & utilities analyst, electrical engineer 1898 & co. (atlanta or charlotte)|ga, atlanta, worldwide|https://www.linkedin.com/jobs/view/4017902341
databricks|software engineer - new grad (2025 start)|berlin, berlin, germany|https://www.linkedin.com/jobs/view/4023889358
steadforce|software backend engineer (m/w/d)|munich, bavaria, germany|https://www.linkedin.com/jobs/view/3837967325
gamomat development gmbh|software engineer – backend (all genders welcome) - berlin oder 100% remote|berlin, berlin, germany|https://www.linkedin.com/jobs/view/4032241613
sc media house|werkstudent:in fullstack development (m/w/d)|munich, bavaria, germany|https://www.linkedin.com/jobs/view/4115422010
wattify gmbh|youki - backend developer|amberg, bavaria, germany|https://www.linkedin.com/jobs/view/3834260469
remondis it|softwarearchitekt java (m/w/d)|lünen, north rhine-westphalia, germany|https://www.linkedin.com/jobs/view/4095547219
tietalent|software backend engineer (m/w/d)|munich, bavaria, germany|https://www.linkedin.com/jobs/view/4091785095
barmeniagothaer|backend-entwickler (w/m/d) java|wuppertal, north rhine-westphalia, germany|https://www.linkedin.com/jobs/view/3602966863
faktor zehn|junior softwareentwickler java für unser trainee programm (mensch*)|munich, bavaria, germany|https://www.linkedin.com/jobs/view/4105583210
orendt studios holding gmbh|software developer, senior (m/w/d)|ratingen, north rhine-westphalia, germany|https://www.linkedin.com/jobs/view/4018165731
mayflower gmbh|senior backend entwickler*in in java, spring boot (w/d/m)|nuremberg, bavaria, germany|https://www.linkedin.com/jobs/view/4014347743
infosim®|initiativbewerbung bei infosim (w/m/d)|germany|https://www.linkedin.com/jobs/view/4110490123
thought leader systems|initiativbewerbung|frankfurt, hesse, germany|https://www.linkedin.com/jobs/view/3834271917
mayflower gmbh|senior fullstack engineer*in (w/d/m)|nuremberg, bavaria, germany|https://www.linkedin.com/jobs/view/3999083270
almex gmbh|it-administrator (m/w/d)|hannover, lower saxony, germany|https://www.linkedin.com/jobs/view/4081728037
carl|m&a intern ab q4 (m/w/d)|berlin, berlin, germany|https://www.linkedin.com/jobs/view/4027789640
doctolib|manager go-to-market strategy (x/f/m)|berlin, berlin, germany|https://www.linkedin.com/jobs/view/4008915066
mayflower gmbh|senior fullstack engineer*in (w/d/m)|würzburg, bavaria, germany|https://www.linkedin.com/jobs/view/3999082213
u2d  up2date solutions gmbh|projektmanager event-software (m/w/d)|nuremberg, bavaria, germany|https://www.linkedin.com/jobs/view/4091928177
mayflower gmbh|senior backend entwickler in java, springboot (w/d/m)|würzburg, bavaria, germany|https://www.linkedin.com/jobs/view/4115956712
remondis it|devops engineer (m/w/d)|lünen, north rhine-westphalia, germany|https://www.linkedin.com/jobs/view/4095550247
remondis it|oracle datenbankadministrator (m/w/d)|lünen, north rhine-westphalia, germany|https://www.linkedin.com/jobs/view/4095550107
conny|legal assistant (m/w/d)|berlin, berlin, germany|https://www.linkedin.com/jobs/view/4124578255
wattify gmbh|youki - founders associate market|amberg, bavaria, germany|https://www.linkedin.com/jobs/view/3834269594
mayflower gmbh|senior frontend developer*in mit typescript (w/d/m)|würzburg, bavaria, germany|https://www.linkedin.com/jobs/view/4014348712
builtech holding gmbh|it-systemadministrator (windows-umfeld) (m/w/d)|berlin, berlin, germany|https://www.linkedin.com/jobs/view/4125999061
wtz roßlau|versuchsingenieur motorenentwicklung (m/w/d)|dessau, saxony-anhalt, germany|https://www.linkedin.com/jobs/view/4102467389
remondis it|mitarbeiter im service desk / it support (m/w/d)|lünen, north rhine-westphalia, germany|https://www.linkedin.com/jobs/view/4016828934
simon-kucher|sourcing manager it (m/w/d) – frankfurt|frankfurt, hesse, germany|https://www.linkedin.com/jobs/view/4000336363
simon-kucher|sourcing manager it (m/w/d) – hamburg|hamburg, hamburg, germany|https://www.linkedin.com/jobs/view/4000332720
schöller si|marketing- und sales-manager (m/w/d)|reutlingen, baden-württemberg, germany|https://www.linkedin.com/jobs/view/4090300426
johanniter-unfall-hilfe e.v.|it-administrator (m/w/d) für den field service &amp; support|rostock, mecklenburg-west pomerania, germany|https://www.linkedin.com/jobs/view/4093886745
holcim|it specialist/it-spezialist|mannheim, baden-württemberg, germany|https://www.linkedin.com/jobs/view/4088308398
mayflower gmbh|senior frontend developer*in mit typescript (w/d/m)|nuremberg, bavaria, germany|https://www.linkedin.com/jobs/view/4125468239
datadiorama - it systemhaus für potsdam|netzwerk- und systemadministrator*in (m/w/d)|potsdam, brandenburg, germany|https://www.linkedin.com/jobs/view/4123715401
johanniter-unfall-hilfe e.v.|it-administrator (m/w/d) für den field service & support|rostock, mecklenburg-west pomerania, germany|https://www.linkedin.com/jobs/view/4093854455
mayflower gmbh|senior frontend developer mit typescript (w/d/m)|würzburg, bavaria, germany|https://www.linkedin.com/jobs/view/4107854270
deltra business software gmbh & co. kg|online marketing managerin (m/w/d) mit schwerpunkt social media|detmold, north rhine-westphalia, germany|https://www.linkedin.com/jobs/view/4117231827
remondis it|prozessberater it-service-management (m/w/d)|lünen, north rhine-westphalia, germany|https://www.linkedin.com/jobs/view/4016836003
mgrp|it (services) specialist (m/w/d)|crailsheim, baden-württemberg, germany|https://www.linkedin.com/jobs/view/4118939065
weatherdock ag|entwicklungsingenieur hochfrequenztechnik (ingenieur/in - informations-, kommunikationstechnik)|nuremberg, bavaria, germany|https://www.linkedin.com/jobs/view/4106556336
johanniter-unfall-hilfe e.v.|it-administrator (m/w/d) für den field service & support|schwerin, mecklenburg-west pomerania, germany|https://www.linkedin.com/jobs/view/4115183309
join.com|ellipsys gmbh: it administrator / managed it-services (m/w/d)|berlin, berlin, germany|https://www.linkedin.com/jobs/view/4111412226
metergrid gmbh|praktikum im sales management (saas)  (m/w/d)|germany|https://www.linkedin.com/jobs/view/4123163405
robotron datenbank-software gmbh|(senior -) software developer prognose & ki|dresden, saxony, germany|https://www.linkedin.com/jobs/view/4096842288
mayflower gmbh|senior python engineer mit schwerpunkt genai (w/d/m)|munich, bavaria, germany|https://www.linkedin.com/jobs/view/4107857060
iabg|projektleiter software engineering (m/w/d)|munich, bavaria, germany|https://www.linkedin.com/jobs/view/4022381305
veeva systems|sales development program (germany)|berlin, germany|https://www.linkedin.com/jobs/view/4025588066
remondis it|it lizenzmanager (m/w/d)|lünen, north rhine-westphalia, germany|https://www.linkedin.com/jobs/view/4095548219
vesterling ag|junior sales consultant ms dynamics 365  ms business central, erp  hybrid/remote (mwd)|münster, north rhine-westphalia, germany|https://www.linkedin.com/jobs/view/4109292903
vesterling ag|junior it sales consultant ms dynamics 365  ms business central, erp  hybrid/remote (mwd)|münster, north rhine-westphalia, germany|https://www.linkedin.com/jobs/view/4102264550
insulet corporation|territory manager (field based)|munich, bavaria, germany|https://www.linkedin.com/jobs/view/4079526957
wirthwein|it projektmanager / it projektleiter digitalisierung (m/w/d)|creglingen, baden-württemberg, germany|https://www.linkedin.com/jobs/view/4081857428
barmeniagothaer|it specialist (w/m/d) pam - iam|wuppertal, north rhine-westphalia, germany|https://www.linkedin.com/jobs/view/3708049836
arcade engineering gmbh|sps-programmierer / dipl.-ingenieur für automatisierungstechnik (m / w / d)|radebeul, saxony, germany|https://www.linkedin.com/jobs/view/4113984607
conny|werkstudent case management(m/w/d)|berlin, berlin, germany|https://www.linkedin.com/jobs/view/4124573862
belform|senior projektleiter / projektmanager im innenausbau / objekteinrichtung in münchen (m/w/d)|munich, bavaria, germany|https://www.linkedin.com/jobs/view/4094472018
mann+hummel|tpm-koordinator (m/w/d)|himmelkron, bavaria, germany|https://www.linkedin.com/jobs/view/4114136581
tietalent|consultant business analyse – öffentliche verwaltung / public service (all genders)|jena, thuringia, germany|https://www.linkedin.com/jobs/view/4081607073
tietalent|consultant business analyse – öffentliche verwaltung / public service (all genders)|kaiserslautern, rhineland-palatinate, germany|https://www.linkedin.com/jobs/view/4081607074
swiss life deutschland|(senior) software entwickler (m/w/d) - ccm-systems|munich, bavaria, germany|https://www.linkedin.com/jobs/view/4110046766
r+s group gmbh|elektroniker für gebäudeautomation / gebäudesystemintegration (m/w/d)|fulda, hesse, germany|https://www.linkedin.com/jobs/view/3983290009
tietalent|consultant business analyse – öffentliche verwaltung / public service (all genders)|bonn, north rhine-westphalia, germany|https://www.linkedin.com/jobs/view/4081602726
r+s group gmbh|ausbildung zum elektroniker für gebäudesystemintegration (m/w/d)|fulda, hesse, germany|https://www.linkedin.com/jobs/view/3972008085
skopos|werkstudent (m/w/d) marktforschung - customer experience (cx) & communities|hürth, north rhine-westphalia, germany|https://www.linkedin.com/jobs/view/3834281423
rent4event|vertriebsmitarbeiter im innendienst m/w/d|düsseldorf, north rhine-westphalia, germany|https://www.linkedin.com/jobs/view/4115705213
r+s group gmbh|ausbildung zum elektroniker für gebäudesystemintegration (m/w/d)|nesse-apfelstädt, thuringia, germany|https://www.linkedin.com/jobs/view/3972004297
think about it gmbh|operativer einkäufer (m/w/d)|bochum, north rhine-westphalia, germany|https://www.linkedin.com/jobs/view/4126197957
tietalent|consultant business analyse – öffentliche verwaltung / public service (all genders)|berlin, berlin, germany|https://www.linkedin.com/jobs/view/4081604349
agilent technologies|graduate kundendienst-ingenieur/in flüssigchromatographie (m/f/d)|mainz, rhineland-palatinate, germany|https://www.linkedin.com/jobs/view/4070757733
deutsche hausverwaltung plus gmbh|objektbetreuer (m/w/d) in der weg-verwaltung|leipzig, saxony, germany|https://www.linkedin.com/jobs/view/4072744342
r+s group gmbh|bauleiter (m/w/d) für hochbauprojekte|fulda, hesse, germany|https://www.linkedin.com/jobs/view/3972007157
provinzial konzern|solution designer - bereich rückversicherung (all genders)|greater hamburg area, worldwide|https://www.linkedin.com/jobs/view/4102191238
vesterling ag|junior berater sap ppm  kundenprojekte, prozesse, sap eppm  homeoffice (mwd)|germany|https://www.linkedin.com/jobs/view/3904082024
swiss life deutschland|senior softwareentwickler (m/w/d) für bpm/ecm plattform|munich, bavaria, germany|https://www.linkedin.com/jobs/view/4110051293
vesterling ag|junior berater sap ppm  kundenprojekte, prozesse, sap eppm  homeoffice (mwd)|frankfurt, hesse, germany|https://www.linkedin.com/jobs/view/3904080050
swiss life deutschland|enterprise architect (m/w/d)|hannover, lower saxony, germany|https://www.linkedin.com/jobs/view/4118297146
thermo fisher scientific|inventory controls specialist (m/w/d)|germering, bavaria, germany|https://www.linkedin.com/jobs/view/4119551798
lapp group|duales studium: wirtschaftsinformatik – data science|stuttgart, baden-württemberg, germany|https://www.linkedin.com/jobs/view/4104797604
wwm gmbh & co. kg|kauffrau/-mann für büromanagement schwerpunkt finanzbuchhaltung & controlling (m/w/d)|monschau, north rhine-westphalia, germany|https://www.linkedin.com/jobs/view/3834283011
provinzial konzern|solution designer - bereich rückversicherung (all genders)|düsseldorf, north rhine-westphalia, germany|https://www.linkedin.com/jobs/view/4073739968
shimadzu deutschland gmbh|service ingenieur*in / techniker*in hplc / toc|munich, bavaria, germany|https://www.linkedin.com/jobs/view/4102776149
philips|account manager (m/w/d) patientenmonitore - region norddeutschland|germany|https://www.linkedin.com/jobs/view/4091974153
bechtle plm|account manager solidworks software lösungen außendienst (w/m/d)|nuremberg, bavaria, germany|https://www.linkedin.com/jobs/view/4119349674
fis informationssysteme und consulting gmbh|sap presales solution architekten ewm (m/w/d)|grafenrheinfeld, bavaria, germany|https://www.linkedin.com/jobs/view/4036015001
s&n systemhaus für netzwerk- und datentechnik gmbh|it dozent / trainer (m/w/d) in rostock|rostock, mecklenburg-west pomerania, germany|https://www.linkedin.com/jobs/view/4122919254
join.com|pier7 architekten gmbh: architekt (m/w/d) für die entwurfs- und ausführungsplanung|düsseldorf, north rhine-westphalia, germany|https://www.linkedin.com/jobs/view/4123054619
grafana labs|senior observability architect (remote, germany)|germany|https://www.linkedin.com/jobs/view/4031307196
wolters kluwer|senior cx/ux researcher (m/w/d) - hybrid|germany|https://www.linkedin.com/jobs/view/4091426855
vattenfall|regionalleiter:in b2b - pv und wp projekte|cologne, north rhine-westphalia, germany|https://www.linkedin.com/jobs/view/4123386773
vesterling ag|sap eppm senior consultant  projekte, prozesse, ppm, eppm  bis 95.000€, homeoffice möglich (mwd)|frankfurt, hesse, germany|https://www.linkedin.com/jobs/view/3904079115
deutsche hausverwaltung plus gmbh|objektbetreuer (m/w/d) in der weg-verwaltung|dresden, saxony, germany|https://www.linkedin.com/jobs/view/4091477477
vattenfall|regionalleiter:in b2b - pv und wp projekte|munich, bavaria, germany|https://www.linkedin.com/jobs/view/4082183788
die zeit|duales studium betriebswirtschaftslehre zeitverlag (b.sc.) (m/w/d)|hamburg, hamburg, germany|https://www.linkedin.com/jobs/view/3831911413
vattenfall|regionalleiter:in b2b - pv und wp projekte|hamburg, hamburg, germany|https://www.linkedin.com/jobs/view/4051001481
join.com|sarraf praxen für physiotherapie: physiotherapeut:in|kissing, bavaria, germany|https://www.linkedin.com/jobs/view/4108018376
deutsche hausverwaltung plus gmbh|lohnbuchhalter (m/w/d)|hamburg, hamburg, germany|https://www.linkedin.com/jobs/view/4092369879
vvp volbers vehmeyer & partner partg mbb|duales studium betriebswirtschaft "bachelor of arts / b.a . - schwerpunkt steuern|georgsdorf, lower saxony, germany|https://www.linkedin.com/jobs/view/4119564114
vattenfall|regionalleiter:in b2b - pv und wp projekte|stuttgart, baden-württemberg, germany|https://www.linkedin.com/jobs/view/4082186470
twilio|software engineering graduate - dublin, ireland (start: june/july 2025)|ireland|https://www.linkedin.com/jobs/view/4101153244
2k|senior manager, engineering graduate program|dublin, county dublin, ireland|https://www.linkedin.com/jobs/view/4101277920
motorola solutions|junior embedded software engineer|cork, county cork, ireland|https://www.linkedin.com/jobs/view/4072061965
analog devices|fy24 graduate software engineering opportunities|limerick, county limerick, ireland|https://www.linkedin.com/jobs/view/3814645177
analog devices|fy25 graduate software engineering opportunities|limerick, county limerick, ireland|https://www.linkedin.com/jobs/view/4018482472
link personnel services|graduate electrical engineer|swords, fingal, ireland|https://www.linkedin.com/jobs/view/4119019061
kpmg ireland|tax technology graduate programme 2025|dublin, county dublin, ireland|https://www.linkedin.com/jobs/view/4114859849
analog devices|fy24 graduate electronic engineering opportunities|limerick, county limerick, ireland|https://www.linkedin.com/jobs/view/3814642546
analog devices|fy25 graduate electronic engineering opportunities|limerick, county limerick, ireland|https://www.linkedin.com/jobs/view/4018482473
altair|presales specialist – data analytics|turin, piedmont, italy|https://www.linkedin.com/jobs/view/3707666267
databricks|software engineer - new grad (2025 start)|amsterdam, north holland, netherlands|https://www.linkedin.com/jobs/view/4023888460
grafana labs|observability architect (remote, netherlands)|brabantine city row, worldwide|https://www.linkedin.com/jobs/view/4109311165
letsreg|chief technology officer|oslo, oslo, norway|https://www.linkedin.com/jobs/view/4104337070
todai|senior machine learning engineer|halden, viken, norway|https://www.linkedin.com/jobs/view/4101963741
norconsult|supportmedarbeider it|bærum, viken, norway|https://www.linkedin.com/jobs/view/4106214950
johnson controls|automasjonsingeniør|greater oslo region, worldwide|https://www.linkedin.com/jobs/view/4114882148
johnson controls|teknisk support spesialist|oslo, oslo, norway|https://www.linkedin.com/jobs/view/4104207370
johnson controls|serviceingeniør – byggautomasjon|oslo, oslo, norway|https://www.linkedin.com/jobs/view/4114879414
