company|title|location|link
dornier medtech|software engineer embedded systems (m/w/d)|greater munich metropolitan area, worldwide|https://www.linkedin.com/jobs/view/4082124645
canonical|software engineer - python - container images|hamburg, hamburg, germany|https://www.linkedin.com/jobs/view/4068180944
canonical|software engineer - python - container images|nuremberg, bavaria, germany|https://www.linkedin.com/jobs/view/4068934760
deutsche telekom|trainee focus technology (m/f/d) - board area technology & innovation|bonn, north rhine-westphalia, germany|https://www.linkedin.com/jobs/view/4027609680
gob software & systeme gmbh & co. kg|mathematiker (w/m/d) als trainee it-consulting|krefeld, north rhine-westphalia, germany|https://www.linkedin.com/jobs/view/4062008490
canonical|software engineer - python - container images|munich, bavaria, germany|https://www.linkedin.com/jobs/view/4068178998
canonical|software engineer - python - container images|nuremberg, bavaria, germany|https://www.linkedin.com/jobs/view/4089853695
360t|test / automation engineer (f/m/d)|frankfurt am main, hesse, germany|https://www.linkedin.com/jobs/view/4094469727
bosch|junior managers program – research & development automated driving – trainee program (f/m/div.)|gerlingen, baden-württemberg, germany|https://www.linkedin.com/jobs/view/4087390969
canonical|software engineer - python - container images|hamburg, hamburg, germany|https://www.linkedin.com/jobs/view/4068940123
canonical|software engineer - python - container images|nuremberg, bavaria, germany|https://www.linkedin.com/jobs/view/4068181902
german aerospace center (dlr)|student assistant (m/f/d) for the creation of vr/ar demonstrators|ulm, baden-württemberg, germany|https://www.linkedin.com/jobs/view/4030279644
canonical|software engineer - python - container images|leipzig, saxony, germany|https://www.linkedin.com/jobs/view/4089850829
canonical|software engineer - python - container images|leipzig, saxony, germany|https://www.linkedin.com/jobs/view/4068940114
canonical|graduate visual ui designer|dresden, saxony, germany|https://www.linkedin.com/jobs/view/4068273318
canonical|software engineer - python - container images|hamburg, hamburg, germany|https://www.linkedin.com/jobs/view/4089855177
canonical|software engineer - python - container images|hamburg, hamburg, germany|https://www.linkedin.com/jobs/view/4089854428
canonical|software engineer - python - container images|munich, bavaria, germany|https://www.linkedin.com/jobs/view/4089848989
unternehmertum|junior venture scout working student (m/f/x)|munich, bavaria, germany|https://www.linkedin.com/jobs/view/4074554019
canonical|software engineer - python - container images|leipzig, saxony, germany|https://www.linkedin.com/jobs/view/4026771135
spectrum ag|trainee systems engineer – system architecture (m/w/d)|schweinfurt, bavaria, germany|https://www.linkedin.com/jobs/view/4089345348
merck healthcare|innovation cup 2025 - team green chemistry (all genders)|darmstadt, hesse, germany|https://www.linkedin.com/jobs/view/4045022578
adesso orange ag|trainee sap software developer (all genders)|essen, north rhine-westphalia, germany|https://www.linkedin.com/jobs/view/4060353430
adesso orange ag|trainee sap software developer (all genders)|bonn, north rhine-westphalia, germany|https://www.linkedin.com/jobs/view/4060354366
analog devices|fy25 graduate customer quality engineer|greater munich metropolitan area, worldwide|https://www.linkedin.com/jobs/view/4084667918
agilent technologies|graduate remote support engineer (m/f/d) – atomspektroskopie|waldbronn, baden-württemberg, germany|https://www.linkedin.com/jobs/view/4092431598
adesso orange ag|trainee sap software developer (all genders)|bremen, bremen, germany|https://www.linkedin.com/jobs/view/4060351949
adesso orange ag|trainee sap software developer (all genders)|hamburg, hamburg, germany|https://www.linkedin.com/jobs/view/4060356190
adesso orange ag|trainee sap software developer (all genders)|erfurt, thuringia, germany|https://www.linkedin.com/jobs/view/4060358021
emerson|digital design engineer|rosenheim, bavaria, germany|https://www.linkedin.com/jobs/view/4106762962
adesso orange ag|trainee sap software developer (all genders)|hannover, lower saxony, germany|https://www.linkedin.com/jobs/view/4060356192
amadeus|dual study program in applied computer science (b.sc.) 2025 at the dhbw mannheim (all genders)|bad homburg, hesse, germany|https://www.linkedin.com/jobs/view/4077406731
italdesign|vehicle validation performance engineer|gaimersheim, bavaria, germany|https://www.linkedin.com/jobs/view/4056925724
adesso orange ag|trainee sap software developer (all genders)|stuttgart, baden-württemberg, germany|https://www.linkedin.com/jobs/view/3733040659
freie universität berlin|stud. beschäftigte*r (m/w/d) 41 mostd. befristet auf 2 jahre kennung: student_ra_triangle_of_capitalism|berlin, berlin, germany|https://www.linkedin.com/jobs/view/4092811260
adesso orange ag|trainee sap software developer (all genders)|saarbrücken, saarland, germany|https://www.linkedin.com/jobs/view/3733037993
sap|product learning associate (w/m/d)|walldorf, baden-württemberg, germany|https://www.linkedin.com/jobs/view/4103341426
adesso orange ag|trainee sap software developer (all genders)|dortmund, north rhine-westphalia, germany|https://www.linkedin.com/jobs/view/4060356193
check24 vergleichsportal gmbh|trainee (m/w/d) software development insurtech|hamburg, hamburg, germany|https://www.linkedin.com/jobs/view/4000188544
tietalent|trainee (w/m/d) it & digital business services|ditzingen, baden-württemberg, germany|https://www.linkedin.com/jobs/view/4090055905
adesso orange ag|trainee sap software developer (all genders)|siegen, north rhine-westphalia, germany|https://www.linkedin.com/jobs/view/3733040745
bosch|graduate specialist program (trainee) - technischer vertrieb connected hydraulics|lohr, bavaria, germany|https://www.linkedin.com/jobs/view/4108458464
bosch|junior managers program – research & development corporate research - trainee program (m/f/div.)|gerlingen, baden-württemberg, germany|https://www.linkedin.com/jobs/view/4087389953
sap|cloud-native developer associate (f/m/d) - development portal|garching, bavaria, germany|https://www.linkedin.com/jobs/view/4108456408
aievas ag|trainee php-symfony webapplication fullstack-entwickler (m/w/d)|burscheid, north rhine-westphalia, germany|https://www.linkedin.com/jobs/view/4099266603
sap|cloud-native developer associate (f/m/d) - development portal|garching, bavaria, germany|https://www.linkedin.com/jobs/view/4108450827
vector informatik|trainee softwareentwicklung embedded (m/w/d)|regensburg, bavaria, germany|https://www.linkedin.com/jobs/view/3786927420
adobe|2025 intern - sales|munich, bavaria, germany|https://www.linkedin.com/jobs/view/4048455284
mercury media technology gmbh & co. kg|ux/ui engineer (m/f/d)|hamburg, hamburg, germany|https://www.linkedin.com/jobs/view/3841782876
adesso orange ag|trainee sap software developer (all genders)|stralsund, mecklenburg-west pomerania, germany|https://www.linkedin.com/jobs/view/4060352922
mhp – a porsche company|cloud engineer (f/m/d)|ludwigsburg, baden-württemberg, germany|https://www.linkedin.com/jobs/view/4085640286
e-storage|sr. applications engineer - estorage|berlin, berlin, germany|https://www.linkedin.com/jobs/view/4096161463
csb-system|trainee it software support analyst schwerpunkt digitale vernetzung (m/w/d)|geilenkirchen, north rhine-westphalia, germany|https://www.linkedin.com/jobs/view/4103799704
emerson|software sales engineer (m/f/d)|munich, bavaria, germany|https://www.linkedin.com/jobs/view/4052032503
canonical|software engineer - go - container images|berlin, berlin, germany|https://www.linkedin.com/jobs/view/4068931994
canonical|software engineer - go - container images|munich, bavaria, germany|https://www.linkedin.com/jobs/view/4089849745
modell aachen gmbh|trainee consulting, saas sales, product management (m/w/d)|aachen, north rhine-westphalia, germany|https://www.linkedin.com/jobs/view/4061560104
digitale leute|trainee product manager (m/w/d)|munich, bavaria, germany|https://www.linkedin.com/jobs/view/4104762145
canonical|software engineer - go - container images|munich, bavaria, germany|https://www.linkedin.com/jobs/view/4068932961
prisma|general applications: business operations|germany|https://www.linkedin.com/jobs/view/4076963207
canonical|software engineer - go - container images|düsseldorf, north rhine-westphalia, germany|https://www.linkedin.com/jobs/view/4089852586
sap|medical assistant (f/m/d) (part-time; 60%)|walldorf, baden-württemberg, germany|https://www.linkedin.com/jobs/view/4095201782
powerco|battery cell design expert simulation (all genders)|salzgitter, lower saxony, germany|https://www.linkedin.com/jobs/view/4089453279
stellantis|trainee on the job - sales animation jeep® (m/w/d)|rüsselsheim, hesse, germany|https://www.linkedin.com/jobs/view/4104351705
canonical|software engineer - go - container images|düsseldorf, north rhine-westphalia, germany|https://www.linkedin.com/jobs/view/4068936414
canonical|software engineer - go - container images|düsseldorf, north rhine-westphalia, germany|https://www.linkedin.com/jobs/view/4068269778
canonical|technical author (multiple roles and seniority levels)|dresden, saxony, germany|https://www.linkedin.com/jobs/view/4068264798
vereinigte volksbank raiffeisenbank eg|trainee (m/w/d) (risiko-) controller|miltenberg, bavaria, germany|https://www.linkedin.com/jobs/view/3913384311
fraunhofer iml|initiativbewerbung für absolvent*innen und/oder berufserfahrene|dortmund, north rhine-westphalia, germany|https://www.linkedin.com/jobs/view/3827851865
join.com|10xcrm (fesma solutions gmbh): trainee (m/w/d) in automatisierungen im bereich marketing und vertrieb in bremen|bremen, bremen, germany|https://www.linkedin.com/jobs/view/4080967854
dow|campus graduate 2024/2025 - absolventen verfahrenstechnik / process engineering (m/w/d)|stade, lower saxony, germany|https://www.linkedin.com/jobs/view/4061340736
sap|master of science (m.sc.) (m/w/d) start 2025 standort berlin-potsdam (vt/star)|berlin, berlin, germany|https://www.linkedin.com/jobs/view/4072909594
canonical|technical author (multiple roles and seniority levels)|munich, bavaria, germany|https://www.linkedin.com/jobs/view/4068267609
emerson|service engineer (m/w/d)|hamburg, hamburg, germany|https://www.linkedin.com/jobs/view/3932194577
canonical|technical author (multiple roles and seniority levels)|nuremberg, bavaria, germany|https://www.linkedin.com/jobs/view/4068264823
tietalent|hochschulabsolventen (m/w/d) für das esri graduate program - bereich sales, consulting, product management und customer care|unterschleißheim, bavaria, germany|https://www.linkedin.com/jobs/view/4105042128
huawei|storage engineer / it network engineer|düsseldorf, north rhine-westphalia, germany|https://www.linkedin.com/jobs/view/4102788909
constructor university|assistant professor of computer science (scalable data processing systems) (m/f/d)|bremen, bremen, germany|https://www.linkedin.com/jobs/view/4109549391
motorola solutions|pre-sales solutions engineer|germany|https://www.linkedin.com/jobs/view/4102527025
hero software|trainee sales international - france (f/m/d)|hannover, lower saxony, germany|https://www.linkedin.com/jobs/view/4074587147
fraunhofer fkie|studierende als hilfskraft, pflichtpraktikant*in, absolvent*in für abschlussarbeit (ba/ma)|wachtberg, north rhine-westphalia, germany|https://www.linkedin.com/jobs/view/3827851855
unsw|research associate/senior research associate|berlin, berlin, germany|https://www.linkedin.com/jobs/view/4102455868
eliotax gmbh steuerberatungsgesellschaft|hochschulabsolvent / berufseinsteiger als berater in der steuerberatung (m/w/d) in voll- oder teilzeit|münster, north rhine-westphalia, germany|https://www.linkedin.com/jobs/view/4101729264
yunex traffic|absolvent (w/m/d) der informatik / elektrotechnik / netzwerktechnik|berlin metropolitan area, worldwide|https://www.linkedin.com/jobs/view/4036800212
sap|business processes associate consultant (f/m/d) in coe application integration|sankt leon-rot, baden-württemberg, germany|https://www.linkedin.com/jobs/view/4097673105
dornier medtech|cybersecurity expert(m/f/d)|wessling, bavaria, germany|https://www.linkedin.com/jobs/view/4090957902
sap|business processes associate consultant (f/m/d)|sankt leon-rot, baden-württemberg, germany|https://www.linkedin.com/jobs/view/4088752597
emerson|test as a service (taas) engineer (m/f/d)|baden-württemberg, germany|https://www.linkedin.com/jobs/view/4040071025
sap fioneer|global head talent management|munich, bavaria, germany|https://www.linkedin.com/jobs/view/4073413563
sap|associate engagement engineer (m/w/d) - premium engagement germany|walldorf, baden-württemberg, germany|https://www.linkedin.com/jobs/view/4090186421
sap|associate engagement engineer (m/w/d) - premium engagement germany|walldorf, baden-württemberg, germany|https://www.linkedin.com/jobs/view/4092677525
emerson|(senior) systems engineer aerospace testsolutions (m/f/d)|düsseldorf, north rhine-westphalia, germany|https://www.linkedin.com/jobs/view/4039851172
canonical|junior hr generalist - emea|berlin, berlin, germany|https://www.linkedin.com/jobs/view/4105733306
360 consulting gmbh|trainee account manager (m/w/d) - köln zollstock|cologne, north rhine-westphalia, germany|https://www.linkedin.com/jobs/view/4091477128
repserve|business development manager|berlin, berlin, germany|https://www.linkedin.com/jobs/view/4066325308
asco engineering gmbh|htl absolvent:in stahlbauplanung (m/w/d)|neustadt, brandenburg, germany|https://www.linkedin.com/jobs/view/4062232535
join.com|horbach-stuttgart: trainee financial consultant (m/w/d)|germany|https://www.linkedin.com/jobs/view/4099274998
fichtner|hydropower designer (m/f/x)|frankfurt, hesse, germany|https://www.linkedin.com/jobs/view/4090760231
omni:us|business development representative (all genders)|berlin, berlin, germany|https://www.linkedin.com/jobs/view/4093607226
sap|junior value advisor (f/m/d)|walldorf, baden-württemberg, germany|https://www.linkedin.com/jobs/view/4085169241
hdi group|trainee it management & strategy|cologne, north rhine-westphalia, germany|https://www.linkedin.com/jobs/view/4089614954
copeland|product manager (m/w/d)- industrial heat pumps/chillers|aachen, north rhine-westphalia, germany|https://www.linkedin.com/jobs/view/4084610319
rwth aachen university|wissenschaftliche hilfskraft mit bachelorabschluss (w/m/d)|aachen, north rhine-westphalia, germany|https://www.linkedin.com/jobs/view/4061069212
fortinet|systems engineer - subject matter expert|frankfurt, hesse, germany|https://www.linkedin.com/jobs/view/4104789268
sap|hr project associate (f/m/d) - limited 18 months|walldorf, baden-württemberg, germany|https://www.linkedin.com/jobs/view/4104150613
fortinet|systems engineer - subject matter expert|germany|https://www.linkedin.com/jobs/view/4104786356
fortinet|systems engineer - subject matter expert|frankfurt, hesse, germany|https://www.linkedin.com/jobs/view/4104785434
canonical|embedded linux field engineering manager|nuremberg, bavaria, germany|https://www.linkedin.com/jobs/view/4081166751
canonical|embedded linux field engineering manager|frankfurt am main, hesse, germany|https://www.linkedin.com/jobs/view/4081173348
canonical|junior hr generalist - emea|düsseldorf, north rhine-westphalia, germany|https://www.linkedin.com/jobs/view/4105731480
canonical|embedded linux field engineering manager|hamburg, hamburg, germany|https://www.linkedin.com/jobs/view/4081168727
canonical|junior hr generalist - emea|nuremberg, bavaria, germany|https://www.linkedin.com/jobs/view/4105733307
canonical|embedded linux field engineering manager|berlin, berlin, germany|https://www.linkedin.com/jobs/view/4081168698
canonical|junior hr generalist - emea|hamburg, hamburg, germany|https://www.linkedin.com/jobs/view/4105731476
bitkom|trainee presse- und öffentlichkeitsarbeit|berlin, berlin, germany|https://www.linkedin.com/jobs/view/4010808043
bitkom|trainee presse- und öffentlichkeitsarbeit|berlin, berlin, germany|https://www.linkedin.com/jobs/view/4010804894
canonical|embedded linux field engineering manager|düsseldorf, north rhine-westphalia, germany|https://www.linkedin.com/jobs/view/4081170574
canonical|engineering manager|munich, bavaria, germany|https://www.linkedin.com/jobs/view/4046272689
canonical|engineering manager|frankfurt am main, hesse, germany|https://www.linkedin.com/jobs/view/4068061828
canonical|engineering manager - apparmor|berlin, berlin, germany|https://www.linkedin.com/jobs/view/4074054144
waterkotte gmbh|trainee technischer referent (m/w/d) in vollzeit (40h)|bochum, north rhine-westphalia, germany|https://www.linkedin.com/jobs/view/4107216073
emerson|service technician (m/f/d)|rosenheim, bavaria, germany|https://www.linkedin.com/jobs/view/4070781781
canonical|engineering manager|nuremberg, bavaria, germany|https://www.linkedin.com/jobs/view/4046275394
canonical|engineering manager|düsseldorf, north rhine-westphalia, germany|https://www.linkedin.com/jobs/view/4068132309
embl|group leader – genome biology unit - ai in genome biology/integrative-omics|heidelberg, baden-württemberg, germany|https://www.linkedin.com/jobs/view/4064631615
emerson|product manager for servo motion technology (m/f/d)|amberg, bavaria, germany|https://www.linkedin.com/jobs/view/4044571386
hilti deutschland|karriereprogramm sales & marketing für hochschulabsolventen (m/w/d)|karlsruhe, baden-württemberg, germany|https://www.linkedin.com/jobs/view/4010357377
hilti deutschland|karriereprogramm sales & marketing für hochschulabsolventen (m/w/d)|fürth, bavaria, germany|https://www.linkedin.com/jobs/view/4061569058
canonical|embedded linux software engineering manager - platform optimisation|nuremberg, bavaria, germany|https://www.linkedin.com/jobs/view/4088433042
canonical|engineering manager - apparmor|dresden, saxony, germany|https://www.linkedin.com/jobs/view/4074050928
canonical|embedded linux software engineering manager - platform optimisation|hamburg, hamburg, germany|https://www.linkedin.com/jobs/view/4088432156
canonical|engineering manager - apparmor|leipzig, saxony, germany|https://www.linkedin.com/jobs/view/4074055117
kyriba|implementation consultant|berlin, berlin, germany|https://www.linkedin.com/jobs/view/4092123392
canonical|cloud field engineering manager|hamburg, hamburg, germany|https://www.linkedin.com/jobs/view/4069172739
we.conect - discover a unique b2b event experience!|business development manager - b2b events international (m/f/d)|berlin, berlin, germany|https://www.linkedin.com/jobs/view/4073751385
v2x inc|elektriker/ elektroniker für betriebstechnik - power systems specialist|wiesbaden, hesse, germany|https://www.linkedin.com/jobs/view/4079420251
hilti deutschland|karriereprogramm sales & marketing für hochschulabsolventen (m/w/d)|villingen-schwenningen, baden-württemberg, germany|https://www.linkedin.com/jobs/view/4010353883
infopro digital|strategy analyst (m/f/x)|germany|https://www.linkedin.com/jobs/view/4088233709
canonical|embedded linux software engineering manager - platform optimisation|frankfurt am main, hesse, germany|https://www.linkedin.com/jobs/view/4088432160
copeland|senior product manager hvac|aachen, north rhine-westphalia, germany|https://www.linkedin.com/jobs/view/4077680325
accenture dach|it quereinstieg als trainee - java (all genders)|kronberg, hesse, germany|https://www.linkedin.com/jobs/view/4058544336
amazon web services (aws)|logistics specialist , data center communities|frankfurt, hesse, germany|https://www.linkedin.com/jobs/view/4019404957
canonical|embedded linux software engineering manager - platform optimisation|düsseldorf, north rhine-westphalia, germany|https://www.linkedin.com/jobs/view/4088429811
hilti deutschland|karriereprogramm sales & marketing für hochschulabsolventen (m/w/d)|chemnitz, saxony, germany|https://www.linkedin.com/jobs/view/3963998574
enercon|sustainability specialist - corporate carbon accounting (m/f/d)|bremen, bremen, germany|https://www.linkedin.com/jobs/view/4069930569
essity|absolvent (f/m/d) nachwuchskraft im außendienst|mannheim, baden-württemberg, germany|https://www.linkedin.com/jobs/view/4105791332
hilti deutschland|karriereprogramm sales & marketing für hochschulabsolventen (m/w/d) hannover/braunschweig|hannover-braunschweig-göttingen-wolfsburg region, worldwide|https://www.linkedin.com/jobs/view/4086438363
thost projektmanagement gmbh|ave2402 - absolvent*in (m/w/d) in der projektsteuerung (bereich bau / immobilien / infrastruktur / anlagenbau)|würzburg, bavaria, germany|https://www.linkedin.com/jobs/view/3988210541
amentum|quality control specialist 2.2|mannheim, baden-württemberg, germany|https://www.linkedin.com/jobs/view/4059019910
emerson|werkstudent/in hr (m/w/d)|remscheid, north rhine-westphalia, germany|https://www.linkedin.com/jobs/view/4012699276
thost projektmanagement gmbh|akra2401 - junior-projektmanager*in / absolvent*in (m/w/d) in der projektsteuerung bereich bau / immobilien|munich, bavaria, germany|https://www.linkedin.com/jobs/view/3955558159
hilti deutschland|karriereprogramm sales & marketing für hochschulabsolventen (m/w/d)|biberach an der riß, baden-württemberg, germany|https://www.linkedin.com/jobs/view/4010358350
state of franklin healthcare associates|nurse navigator|schwerin, mecklenburg-west pomerania, germany|https://www.linkedin.com/jobs/view/4046573404
canonical|engineering manager - ubuntu security|munich, bavaria, germany|https://www.linkedin.com/jobs/view/4074050971
canonical|engineering manager - ubuntu security|frankfurt am main, hesse, germany|https://www.linkedin.com/jobs/view/4074054176
emerson|key account manager prozess- und chemieindustrie nrw|düsseldorf, north rhine-westphalia, germany|https://www.linkedin.com/jobs/view/4084375150
canonical|engineering manager - security standards and hardening|munich, bavaria, germany|https://www.linkedin.com/jobs/view/4074051773
ul solutions|senior software sales executive esg|neu-isenburg, hesse, germany|https://www.linkedin.com/jobs/view/4069162043
thost projektmanagement gmbh|junior-projektmanager*in / absolvent*in (m/w/d) in der projektsteuerung bereich bau / immobilien|munich, bavaria, germany|https://www.linkedin.com/jobs/view/4102735336
canonical|engineering manager - security standards and hardening|nuremberg, bavaria, germany|https://www.linkedin.com/jobs/view/4074054114
atlas metrics|customer success intern|berlin, berlin, germany|https://www.linkedin.com/jobs/view/4079646743
emerson|werkstudent/in hr marketing/ employer branding (m/w/d)|remscheid, north rhine-westphalia, germany|https://www.linkedin.com/jobs/view/4005874864
canonical|engineering manager - security standards and hardening|berlin, berlin, germany|https://www.linkedin.com/jobs/view/4074054127
canonical|engineering manager - security standards and hardening|frankfurt am main, hesse, germany|https://www.linkedin.com/jobs/view/4074053586
canonical|hr generalist - emea|leipzig, saxony, germany|https://www.linkedin.com/jobs/view/4068129983
canonical|hr generalist - emea|dresden, saxony, germany|https://www.linkedin.com/jobs/view/4068136113
canonical|cloud professional services manager|leipzig, saxony, germany|https://www.linkedin.com/jobs/view/4069176116
canonical|cloud professional services manager|düsseldorf, north rhine-westphalia, germany|https://www.linkedin.com/jobs/view/4069171808
canonical|hr generalist - emea|hamburg, hamburg, germany|https://www.linkedin.com/jobs/view/4068277168
canonical|hr generalist - emea|düsseldorf, north rhine-westphalia, germany|https://www.linkedin.com/jobs/view/4068136109
canonical|cloud professional services manager|frankfurt am main, hesse, germany|https://www.linkedin.com/jobs/view/4069169970
ul solutions|senior sales executive, software , product stewardship|neu-isenburg, hesse, germany|https://www.linkedin.com/jobs/view/4069160271
canonical|cloud professional services manager|hamburg, hamburg, germany|https://www.linkedin.com/jobs/view/4069177197
canonical|cloud professional services manager|munich, bavaria, germany|https://www.linkedin.com/jobs/view/4069173667
canonical|cloud professional services manager|nuremberg, bavaria, germany|https://www.linkedin.com/jobs/view/4069169971
emerson|ausbildung als fachkraft für metalltechnik - montagetechnik (m/w/d)|remscheid, north rhine-westphalia, germany|https://www.linkedin.com/jobs/view/4018520663
philips|trainee programm - sales für medizinische technolog*in für radiologie / mtra (m/w/d)|schleswig, schleswig-holstein, germany|https://www.linkedin.com/jobs/view/4073768120
sap|associate customer service manager (f/m/d)|dresden, saxony, germany|https://www.linkedin.com/jobs/view/4098449561
mpc capital ag|chartering manager (m/f/d) drybulk - netherlands|hamburg, hamburg, germany|https://www.linkedin.com/jobs/view/4107697249
emerson|sales operations process manager (m/f/d)|munich, bavaria, germany|https://www.linkedin.com/jobs/view/4096081805
emerson|teamleiter montage|baden-württemberg, germany|https://www.linkedin.com/jobs/view/3775361058
emerson|transportation technical marketer (m/f/d)|munich, bavaria, germany|https://www.linkedin.com/jobs/view/4084835528
emerson|transportation technical marketer (m/f/d)|germany|https://www.linkedin.com/jobs/view/4084834805
emerson|ausbildung als fachlagerist/-in (m/w/d)|remscheid, north rhine-westphalia, germany|https://www.linkedin.com/jobs/view/4018523624
amazon|engineering intern|berlin, berlin, germany|https://www.linkedin.com/jobs/view/4107202263
gsk|automation engineering graduate programme, germany, 2025 (f/m/d)|dresden, saxony, germany|https://www.linkedin.com/jobs/view/4045272909
finanz informatik|trainee it (m/w/d)|frankfurt am main, hesse, germany|https://www.linkedin.com/jobs/view/4109235953
