company|title|location|link
sap|user assistance developer (technical writer) for sap cloud alm - maternity leave cover|sankt leon-rot, baden-württemberg, germany|https://www.linkedin.com/jobs/view/4175116033
fzi research center for information technology|student*in im rahmen einer abschlussarbeit zum thema „learning a fluid model for model predictive controller (mpc) on industrial robot arm “|karlsruhe, baden-württemberg, germany|https://www.linkedin.com/jobs/view/4189073376
sap|ui5 framework associate developer (f/m/d)|walldorf, baden-württemberg, germany|https://www.linkedin.com/jobs/view/4176428713
sbi - international innovation group ag|lead business analyst & trainee product owner|eschborn, hesse, germany|https://www.linkedin.com/jobs/view/4188217095
amazon|it support engineer intern|graben, bavaria, germany|https://www.linkedin.com/jobs/view/4140188297
optima packaging group|student (m/w/d) für praktikum - automation/softwareentwicklung|schwäbisch hall, baden-württemberg, germany|https://www.linkedin.com/jobs/view/4167037278
fzi research center for information technology|student*in im rahmen einer abschlussarbeit zum thema entwicklung eines umgebungsmodells basierend auf partikeln|karlsruhe, baden-württemberg, germany|https://www.linkedin.com/jobs/view/4145033628
canonical|software engineer - go - container images|munich, bavaria, germany|https://www.linkedin.com/jobs/view/4170111413
canonical|software engineer - go - container images|hamburg, hamburg, germany|https://www.linkedin.com/jobs/view/4139265766
canonical|software engineer - go - container images|hamburg, hamburg, germany|https://www.linkedin.com/jobs/view/4117647800
canonical|software engineer - go - container images|hamburg, hamburg, germany|https://www.linkedin.com/jobs/view/4089850695
canonical|software engineer - go - container images|hamburg, hamburg, germany|https://www.linkedin.com/jobs/view/4068936420
canonical|software engineer - go - container images|hamburg, hamburg, germany|https://www.linkedin.com/jobs/view/4068133639
canonical|software engineer - go - container images|nuremberg, bavaria, germany|https://www.linkedin.com/jobs/view/4170110410
canonical|software engineer - go - container images|frankfurt am main, hesse, germany|https://www.linkedin.com/jobs/view/4068932966
canonical|software engineer - go - container images|frankfurt am main, hesse, germany|https://www.linkedin.com/jobs/view/4068136158
orderbase consulting gmbh|trainee sales (m/w/d) für den vertrieb von softwarelösungen (it-system-kaufmann/-frau)|münster, north rhine-westphalia, germany|https://www.linkedin.com/jobs/view/4137946237
canonical|software engineer - go - container images|düsseldorf, north rhine-westphalia, germany|https://www.linkedin.com/jobs/view/4170114011
canonical|software engineer - go - container images|munich, bavaria, germany|https://www.linkedin.com/jobs/view/4117652034
tietalent|trainee (w/m/d) business analyse – operations frankfurt|frankfurt, hesse, germany|https://www.linkedin.com/jobs/view/4170846305
canonical|software engineer - go - container images|düsseldorf, north rhine-westphalia, germany|https://www.linkedin.com/jobs/view/4139270326
canonical|software engineer - go - container images|düsseldorf, north rhine-westphalia, germany|https://www.linkedin.com/jobs/view/4117652044
canonical|software engineer - go - container images|düsseldorf, north rhine-westphalia, germany|https://www.linkedin.com/jobs/view/4068936414
canonical|software engineer - go - container images|düsseldorf, north rhine-westphalia, germany|https://www.linkedin.com/jobs/view/4068269778
canonical|software engineer - go - container images|dresden, saxony, germany|https://www.linkedin.com/jobs/view/4139271329
canonical|software engineer - go - container images|dresden, saxony, germany|https://www.linkedin.com/jobs/view/4117650319
canonical|software engineer - go - container images|dresden, saxony, germany|https://www.linkedin.com/jobs/view/4089848877
canonical|software engineer - go - container images|dresden, saxony, germany|https://www.linkedin.com/jobs/view/4068933849
canonical|software engineer - go - container images|dresden, saxony, germany|https://www.linkedin.com/jobs/view/4067126944
modell aachen gmbh|trainee consulting, saas sales, product management (m/w/d)|aachen, north rhine-westphalia, germany|https://www.linkedin.com/jobs/view/4061560104
sap|phd intern (f/m/d) - business ai research|berlin, berlin, germany|https://www.linkedin.com/jobs/view/4072912137
emerson|service engineer (m/w/d)|düsseldorf, north rhine-westphalia, germany|https://www.linkedin.com/jobs/view/3932192940
finanz informatik|trainee business/banking (m/w/d)|frankfurt am main, hesse, germany|https://www.linkedin.com/jobs/view/4109240481
fresenius medical care|software architect (m/f/d)|bad homburg, hesse, germany|https://www.linkedin.com/jobs/view/4178687335
sap|medical assistant (f/m/d) (part-time; 60%)|walldorf, baden-württemberg, germany|https://www.linkedin.com/jobs/view/4095201782
join.com|10xcrm (fesma solutions gmbh): trainee (m/w/d) in automatisierungen im bereich marketing und vertrieb in bremen|bremen, bremen, germany|https://www.linkedin.com/jobs/view/4159673438
dr. wolff group|student für ein praxisintegriertes studium software engineering b.sc. (m/w/d)|bielefeld, north rhine-westphalia, germany|https://www.linkedin.com/jobs/view/4098504366
fzi research center for information technology|student*in im rahmen einer abschlussarbeit zum thema adversariales verstärkungslernen zur diversifizierung des trainings robustheit gegenüber kritischen szenarien|karlsruhe, baden-württemberg, germany|https://www.linkedin.com/jobs/view/4145036243
ing deutschland|trainee im junior expert programme – business banking (w/m/d) in frankfurt / berlin|frankfurt, hesse, germany|https://www.linkedin.com/jobs/view/4181577976
canonical|technical author (multiple roles and seniority levels)|leipzig, saxony, germany|https://www.linkedin.com/jobs/view/4068268626
kfw|trainee (w/m/d) business analyse – operations frankfurt|frankfurt, hesse, germany|https://www.linkedin.com/jobs/view/4169921462
fraunhofer iml|initiativbewerbung für absolvent*innen und/oder berufserfahrene|dortmund, north rhine-westphalia, germany|https://www.linkedin.com/jobs/view/3827851865
deutsche telekom|dual student (f/m/d) network infrastructure|bonn, north rhine-westphalia, germany|https://www.linkedin.com/jobs/view/4188455755
bitworks edv-dienstleistungs-gmbh|trainee vertrieb / junior sales consultant (m/w/d)  software sales, b2b, wirtschaftsinformatik|darmstadt, hesse, germany|https://www.linkedin.com/jobs/view/4137943391
alten|v.i.e  ingenieur hil support (all gender)|stuttgart, baden-württemberg, germany|https://www.linkedin.com/jobs/view/4149394894
bavarian nordic|senior scientist|martinsried, bavaria, germany|https://www.linkedin.com/jobs/view/4176444382
fraunhofer karriere|students:: computer vision in semiconductor metrology|chemnitz, saxony, germany|https://www.linkedin.com/jobs/view/3911758758
canonical|embedded linux field engineering manager|hamburg, hamburg, germany|https://www.linkedin.com/jobs/view/4173812327
yunex traffic|absolvent (w/m/d) der informatik / elektrotechnik / netzwerktechnik|erfurt, thuringia, germany|https://www.linkedin.com/jobs/view/4036497422
canonical|technical author (multiple roles and seniority levels)|frankfurt am main, hesse, germany|https://www.linkedin.com/jobs/view/4068265706
canonical|technical author (multiple roles and seniority levels)|munich, bavaria, germany|https://www.linkedin.com/jobs/view/4068267609
german aerospace center (dlr)|student/in verkehrs-, ingenieurswissenschaften mit fokus verkehr, geoinformatik, data science o. ä. (w/m/d)|berlin, berlin, germany|https://www.linkedin.com/jobs/view/4061559718
fzi research center for information technology|studentische hilfskraft oder student*in für eine abschlussarbeit zur erweiterung eines modellierungswerkzeugs|karlsruhe, baden-württemberg, germany|https://www.linkedin.com/jobs/view/4145038089
canonical|embedded linux field engineering manager|munich, bavaria, germany|https://www.linkedin.com/jobs/view/4173812328
ge healthcare|trainee field service engineer (w/m/d) raum hannover|bavaria, germany|https://www.linkedin.com/jobs/view/4131332756
iav gmbh|thesis – manoeuvre planning and decision making in automated driving|chemnitz, saxony, germany|https://www.linkedin.com/jobs/view/4167477110
canonical|embedded linux field engineering manager|düsseldorf, north rhine-westphalia, germany|https://www.linkedin.com/jobs/view/4173811632
charles river associates|consulting associate (european competition practice) - m/f/d|greater dusseldorf area, worldwide|https://www.linkedin.com/jobs/view/4186442281
prisma|general applications: business operations|germany|https://www.linkedin.com/jobs/view/4125733252
iav gmbh|thesis - manoeuvre planning and decision making in automated driving|chemnitz, saxony, germany|https://www.linkedin.com/jobs/view/4039027463
iron&soul|dualer student: b.sc sport-/gesundheitsinformatik|cologne, north rhine-westphalia, germany|https://www.linkedin.com/jobs/view/4160073103
powerco|battery cell test management expert|salzgitter, lower saxony, germany|https://www.linkedin.com/jobs/view/3823863316
emerson|system designer / technician (m/f/d) - product development & electrical focus|baden-württemberg, germany|https://www.linkedin.com/jobs/view/4099276938
emerson|europe nuclear supplier quality engineer (m/w/d)|korschenbroich, north rhine-westphalia, germany|https://www.linkedin.com/jobs/view/4172318552
krone group|thesis: entwicklung & protypische umsetzung eines secure gateways für eine microservice-struktur|spelle, lower saxony, germany|https://www.linkedin.com/jobs/view/4139516923
yoc|trainee im bereich publisher / account management (m/w/x)|berlin, berlin, germany|https://www.linkedin.com/jobs/view/4180611744
amazon|it support engineer intern - rheinberg|rheinberg, north rhine-westphalia, germany|https://www.linkedin.com/jobs/view/4137563219
climedo|customer success trainee (12m) + unbefristete anstellung im anschluss|munich, bavaria, germany|https://www.linkedin.com/jobs/view/4167831993
fzi research center for information technology|student*in im rahmen einer abschlussarbeit zum thema entwicklung und implementierung einer auf straßentopologien und fahrzeugbeschränkungen basierenden trajektorienprognose|karlsruhe, baden-württemberg, germany|https://www.linkedin.com/jobs/view/4145033592
emerson|test as a service (taas) engineer (m/f/d)|baden-württemberg, germany|https://www.linkedin.com/jobs/view/4040071025
university hospital heidelberg (ukhd)|wissenschaftliche hilfskraft am high - heidelberg institute of global health (m/f/d)|heidelberg, baden-württemberg, germany|https://www.linkedin.com/jobs/view/4102017104
we.conect - discover a unique b2b event experience!|business development manager - b2b events international (m/f/d)|berlin, berlin, germany|https://www.linkedin.com/jobs/view/4185228948
dat deutsche automobil treuhand|dhbw student wirtschaftsinformatik (m/w/d)|ostfildern, baden-württemberg, germany|https://www.linkedin.com/jobs/view/4036982321
fzi research center for information technology|student*in (abschlussarbeit bachelor / master), studentische oder wissenschaftliche hilfskraft zum thema generative ki für autonomes fahren: geometrisch konsistente video prädiktion mit world models|karlsruhe, baden-württemberg, germany|https://www.linkedin.com/jobs/view/4145031957
chg-meridian|trainee junior account manager (m/w/d) start 01.10.2025|greater munich metropolitan area, worldwide|https://www.linkedin.com/jobs/view/4188848650
fortinet|systems engineer – carrier/mssp|munich, bavaria, germany|https://www.linkedin.com/jobs/view/4171059038
data assessment solutions|absolventen der (wirtschafts-)informatik (m/w/d)|hannover, lower saxony, germany|https://www.linkedin.com/jobs/view/4160442603
fzi research center for information technology|student*in für eine abschlussarbeit über die entwicklung eines ki-systems zum tracking von medikamenten in video-aufnahmen|karlsruhe, baden-württemberg, germany|https://www.linkedin.com/jobs/view/4145037220
fzi research center for information technology|student*in (abschlussarbeit bachelor/master), studentische oder wissenschaftliche hilfskraft für die verarbeitung von radardaten mit spiking neural networks|karlsruhe, baden-württemberg, germany|https://www.linkedin.com/jobs/view/4145034400
360 consulting gmbh|trainee account manager (m/w/d) - köln zollstock|cologne, north rhine-westphalia, germany|https://www.linkedin.com/jobs/view/4160066831
join.com|optano gmbh: ux/ui & doku assistant - student (m/w/d)|paderborn, north rhine-westphalia, germany|https://www.linkedin.com/jobs/view/4165475469
atmosfair ggmbh|trainee on the job im bereich klimaschutz-projektentwicklung (d/m/w)|berlin, berlin, germany|https://www.linkedin.com/jobs/view/4091670131
central institute of mental health|wissenschaftliche hilfskraft|mannheim, baden-württemberg, germany|https://www.linkedin.com/jobs/view/4170086313
fzi research center for information technology|student*in im rahmen einer abschlussarbeit für den einsatz generativer ki im requirements engineering|karlsruhe, baden-württemberg, germany|https://www.linkedin.com/jobs/view/4145037126
canonical|iot solutions architecture manager|frankfurt am main, hesse, germany|https://www.linkedin.com/jobs/view/4173809825
canonical|cloud field engineering manager|nuremberg, bavaria, germany|https://www.linkedin.com/jobs/view/4174159909
deutsche börse|enterprise risk manager (f/m/d)|frankfurt, hesse, germany|https://www.linkedin.com/jobs/view/4183328799
fortinet|systems engineer - subject matter expert|frankfurt, hesse, germany|https://www.linkedin.com/jobs/view/4104789268
isfort architekten|architekt:innen oder absolvent:innen (m/w/d) für alle leistungsphasen|klipphausen, saxony, germany|https://www.linkedin.com/jobs/view/4120583343
alaika advisory|fellowship consulting - financial services (3 months) (f/m/d)|munich, bavaria, germany|https://www.linkedin.com/jobs/view/4149945382
fichtner|hydropower designer (m/f/x)|stuttgart region, worldwide|https://www.linkedin.com/jobs/view/4090755713
canonical|cloud field engineering manager|munich, bavaria, germany|https://www.linkedin.com/jobs/view/4174161766
canonical|iot solutions architecture manager|düsseldorf, north rhine-westphalia, germany|https://www.linkedin.com/jobs/view/4173815075
tietalent|karriereprogramm sales & marketing für hochschulabsolventen (m/w/d)|trier-saarburg, rhineland-palatinate, germany|https://www.linkedin.com/jobs/view/4180192333
canonical|engineering manager|hamburg, hamburg, germany|https://www.linkedin.com/jobs/view/4127926355
canonical|cloud field engineering manager|dresden, saxony, germany|https://www.linkedin.com/jobs/view/4174162777
insider.|sales development representative - germany|munich, bavaria, germany|https://www.linkedin.com/jobs/view/4169987948
fortinet|systems engineer - subject matter expert|frankfurt, hesse, germany|https://www.linkedin.com/jobs/view/4104785433
emerson|senior electrical engineer / state-certified technician (m/f/d)|baden-württemberg, germany|https://www.linkedin.com/jobs/view/4130410180
sap|business processes associate consultant center of expertise: career starter in data&analytics(f/m/d)|sankt leon-rot, baden-württemberg, germany|https://www.linkedin.com/jobs/view/4127368276
canonical|iot solutions architecture manager|leipzig, saxony, germany|https://www.linkedin.com/jobs/view/4173814221
emerson|field service engineer|langenfeld, north rhine-westphalia, germany|https://www.linkedin.com/jobs/view/4145054189
fraunhofer fkie|studierende als hilfskraft, pflichtpraktikant*in, absolvent*in für abschlussarbeit (ba/ma)|wachtberg, north rhine-westphalia, germany|https://www.linkedin.com/jobs/view/3827851855
aareon dach|trainee (m/w/d) consulting & customer success|dortmund, north rhine-westphalia, germany|https://www.linkedin.com/jobs/view/4181394976
alaika advisory|fellowship consulting - financial services (6 months) (f/m/d)|munich, bavaria, germany|https://www.linkedin.com/jobs/view/4149637810
canonical|engineering manager|nuremberg, bavaria, germany|https://www.linkedin.com/jobs/view/4127923415
fzi research center for information technology|student*in (abschlussarbeit bachelor / master) zum thema beweis von shift-and-add multiplikation in coq|karlsruhe, baden-württemberg, germany|https://www.linkedin.com/jobs/view/4145032822
canonical|engineering manager|düsseldorf, north rhine-westphalia, germany|https://www.linkedin.com/jobs/view/4127924393
fortinet|systems engineer – subject matter expert – manufacturing/transport|frankfurt, hesse, germany|https://www.linkedin.com/jobs/view/4104785441
canonical|engineering manager - apparmor|düsseldorf, north rhine-westphalia, germany|https://www.linkedin.com/jobs/view/4170110381
inqu solutions gmbh|dualer student (m/w/d) für studiengang wirtschaftsinformatik|dresden, saxony, germany|https://www.linkedin.com/jobs/view/4139805918
insider.|sales development representative - germany|berlin, berlin, germany|https://www.linkedin.com/jobs/view/4169995122
universal music deutschland|trainee creative strategy / creative account management (all genders)|berlin, germany|https://www.linkedin.com/jobs/view/4174776100
fzi research center for information technology|student*in für eine abschlussarbeit zum thema integration von technologien zur patientenkommunikation in einer digitalen gesundheits-plattform|karlsruhe, baden-württemberg, germany|https://www.linkedin.com/jobs/view/4145033484
canonical|engineering manager - apparmor|berlin, berlin, germany|https://www.linkedin.com/jobs/view/4170113058
yoc|trainee im bereich publisher / account management (m/w/x)|berlin, germany|https://www.linkedin.com/jobs/view/4184456079
iav gmbh|thesis - development of operating strategy for hybrid powertrain components|berlin, berlin, germany|https://www.linkedin.com/jobs/view/4168412644
ccc software gmbh|praktikant / dualer student (m/w/d) sportinformatik|leipzig, saxony, germany|https://www.linkedin.com/jobs/view/3999384637
telescope advisory partners (an analysys mason company)|technology strategy consultant (m/f/d)|munich, bavaria, germany|https://www.linkedin.com/jobs/view/4142475500
zipmend gmbh|trainee transport management niederlande (m/w/d) niederländisch + deutsch|hamburg, hamburg, germany|https://www.linkedin.com/jobs/view/4173033167
deutsche bahn|trainee bauingenieur:in/verkehrsingenieur:in: arbeitsvorbereitung in der angebotsbearbeitung (w/m/d)|berlin, berlin, germany|https://www.linkedin.com/jobs/view/4172554310
l3harris technologies|specialist, technical support engineer|landstuhl, rhineland-palatinate, germany|https://www.linkedin.com/jobs/view/4153190193
gartner|senior principal, analyst - oracle software and saas licensing (location: remote - europe)|berlin, berlin, germany|https://www.linkedin.com/jobs/view/4152777712
rhön-klinikum ag|dualer student (m/w/d) digital health|bad neustadt an der saale, bavaria, germany|https://www.linkedin.com/jobs/view/3789486294
thost projektmanagement gmbh|ave2501 - absolvent*in (m/w/d) in der projektsteuerung (bereich bau / immobilien / infrastruktur / anlagenbau)|würzburg, bavaria, germany|https://www.linkedin.com/jobs/view/4133078898
akkodis|absolventen elektrotechnik und elektrotechniker (m/w/d) raum nürnberg|greater nuremberg metropolitan area, worldwide|https://www.linkedin.com/jobs/view/4184142658
fortinet|systems engineer, subject matter expert - vertical retail & media / chemical & pharma|frankfurt, hesse, germany|https://www.linkedin.com/jobs/view/4104784565
fortinet|systems engineer, subject matter expert - vertical finance & energy|hamburg, hamburg, germany|https://www.linkedin.com/jobs/view/4104786408
telescope advisory partners (an analysys mason company)|strategy consultant (m/f/d)|munich, bavaria, germany|https://www.linkedin.com/jobs/view/4142475498
canonical|engineering manager - ubuntu for next-gen silicon|berlin, berlin, germany|https://www.linkedin.com/jobs/view/4160776973
canonical|engineering manager - ubuntu for next-gen silicon|hamburg, hamburg, germany|https://www.linkedin.com/jobs/view/4160779369
sap|thesis/praktikum/werkstudent (w/m/d) - research and development center|markdorf, baden-württemberg, germany|https://www.linkedin.com/jobs/view/4144892716
canonical|engineering manager - ubuntu for next-gen silicon|frankfurt am main, hesse, germany|https://www.linkedin.com/jobs/view/4160782077
sap|working contract (f/m/d): student for communications & change in business area controlling|walldorf, baden-württemberg, germany|https://www.linkedin.com/jobs/view/4181827502
thost projektmanagement gmbh|akra2401 - junior-projektmanager*in / absolvent*in (m/w/d) in der projektsteuerung bereich bau / immobilien|munich, bavaria, germany|https://www.linkedin.com/jobs/view/3955558159
fraunhofer karriere|thesis demographic bias in histopathology|bremen, bremen, germany|https://www.linkedin.com/jobs/view/4149174983
alten|v.i.e aviation consultant (all gender)|hamburg, hamburg, germany|https://www.linkedin.com/jobs/view/4158149630
siemens|dualer student (m/w/d) im studiengang informatik für siemens logistics gmbh|constance, baden-württemberg, germany|https://www.linkedin.com/jobs/view/4143275278
kuhn.partner  kuhn & partner rechtsanwälte steuerberater wirtschaftsprüfer mbb|dualer student im steuer- und prüfungswesen (m/w/d)|frankfurt, hesse, germany|https://www.linkedin.com/jobs/view/4174848736
amazon web services (aws)|logistics specialist , data center communities|frankfurt, hesse, germany|https://www.linkedin.com/jobs/view/4019404957
fortinet|solution architect secops - germany|frankfurt, hesse, germany|https://www.linkedin.com/jobs/view/4104783621
canonical|engineering manager - ubuntu for next-gen silicon|leipzig, saxony, germany|https://www.linkedin.com/jobs/view/4160779370
kuhn.partner  kuhn & partner rechtsanwälte steuerberater wirtschaftsprüfer mbb|dualer student im steuer- und prüfungswesen (m/w/d)|nackenheim, rhineland-palatinate, germany|https://www.linkedin.com/jobs/view/4174849722
canonical|cloud professional services manager|düsseldorf, north rhine-westphalia, germany|https://www.linkedin.com/jobs/view/4173811641
cma cgm|fleet officer (f/m/d)|hamburg, hamburg, germany|https://www.linkedin.com/jobs/view/4159391450
canonical|cloud professional services manager|berlin, berlin, germany|https://www.linkedin.com/jobs/view/4173810677
canonical|engineering manager - ubuntu security|dresden, saxony, germany|https://www.linkedin.com/jobs/view/4170109661
emerson|ausbildung als zerspanungsmechaniker/-in (m/w/d)|remscheid, north rhine-westphalia, germany|https://www.linkedin.com/jobs/view/4018520650
turner & townsend|project cost controller (m/f/d) - construction industry - energy sector|munich, bavaria, germany|https://www.linkedin.com/jobs/view/4187184945
canonical|engineering manager - security standards and hardening|nuremberg, bavaria, germany|https://www.linkedin.com/jobs/view/4170812741
canonical|engineering manager - security standards and hardening|munich, bavaria, germany|https://www.linkedin.com/jobs/view/4170818247
omexom deutschland|trainee projektmanagement hr (m/w/d)|dresden, saxony, germany|https://www.linkedin.com/jobs/view/4175855015
canonical|cloud professional services manager|nuremberg, bavaria, germany|https://www.linkedin.com/jobs/view/4173809794
ou health|app - advanced practice provider - neurosurgery|hamm, north rhine-westphalia, germany|https://www.linkedin.com/jobs/view/4125566740
aras corporation|director global alliance emea (m/f/d)|munich, bavaria, germany|https://www.linkedin.com/jobs/view/4137584314
philips|trainee programm - sales für medizinische technolog*in für radiologie / mtra (m/w/d)|hamburg, hamburg, germany|https://www.linkedin.com/jobs/view/4073767118
philips|trainee programm - sales für medizinische technolog*in für radiologie / mtra (m/w/d)|westphalia, north rhine-westphalia, germany|https://www.linkedin.com/jobs/view/4062021729
jefferson health|vascular technologist (per diem) - torresdale|frankfurt, hesse, germany|https://www.linkedin.com/jobs/view/4102753602
sap|service associate (f/m/d) in sap mailroom (1 year temp.)|walldorf, baden-württemberg, germany|https://www.linkedin.com/jobs/view/4124097397
philips|trainee programm - sales für medizinische technolog*in für radiologie / mtra (m/w/d)|schleswig, schleswig-holstein, germany|https://www.linkedin.com/jobs/view/4073768120
emerson|hr business partner (m/f/d)|augsburg, bavaria, germany|https://www.linkedin.com/jobs/view/4076612700
motorschadenvergleich.de|software-entwicklung & it - trainee / quereinsteiger|mittelhof, rhineland-palatinate, germany|https://www.linkedin.com/jobs/view/4160474142
shyftplan|trainee (m/w/d) vertrieb|berlin, berlin, germany|https://www.linkedin.com/jobs/view/4185208792
finanz informatik|trainee it (m/w/d)|münster, north rhine-westphalia, germany|https://www.linkedin.com/jobs/view/4109235953
tietalent|trainee sap - it & digitalization (m/w/d)|karlsruhe, baden-württemberg, germany|https://www.linkedin.com/jobs/view/4186868984
imms institut für mikroelektronik- und mechatronik-systeme gemeinnützige gmbh (imms gmbh)|student (m/f/d): characterise a nanopositioning system|ilmenau, thuringia, germany|https://www.linkedin.com/jobs/view/3948805193
airbus defence and space|bachelor thesis: modelling of degradatio (d/f/m)n|greater munich metropolitan area, worldwide|https://www.linkedin.com/jobs/view/4181181696
fraunhofer-institut für windenergiesysteme|student* with thesis (optional) verification of a wind farm simulator|bremerhaven, bremen, germany|https://www.linkedin.com/jobs/view/4185778101
