company|title|location|link
codeway|ios developer (new grad)|istanbul, istanbul, worldwide|https://www.linkedin.com/jobs/view/4318773439
sopra steria|senior fullstack java udvikler til afdeling i vækst|copenhagen municipality, capital region of denmark, denmark|https://www.linkedin.com/jobs/view/4283431182
knowit|utvikler?|bergen, vestland, norway|https://www.linkedin.com/jobs/view/4001701789
knowit|data engineer til vårt cloud-team|oslo, oslo, norway|https://www.linkedin.com/jobs/view/4106726068
d3|backend engineer - new grad|los angeles, canada|https://www.linkedin.com/jobs/view/4297925587
snap inc.|software engineer, backend, level 4|los angeles, canada|https://www.linkedin.com/jobs/view/4315124412
circle|new grad software engineer, backend 2026|los angeles metropolitan area, worldwide|https://www.linkedin.com/jobs/view/4340990873
snap inc.|software engineer, backend, level 5|los angeles, canada|https://www.linkedin.com/jobs/view/4309032016
snap inc.|security engineer, infrastructure security, level 5|los angeles, canada|https://www.linkedin.com/jobs/view/4314868249
tenfifty ab|remote data scientist|gothenburg, västra götaland county, sweden|https://www.linkedin.com/jobs/view/4212682500
tenfifty ab|senior pythonutvecklare|gothenburg, västra götaland county, sweden|https://www.linkedin.com/jobs/view/4254604422
targetjobs uk|tech grad – space, defence and intelligence – summer 2026 intake|london, england, united kingdom|https://www.linkedin.com/jobs/view/4306011235
sentry|software engineer, new grad (2026)|innere stadt, vienna, austria|https://www.linkedin.com/jobs/view/4309395825
dl remote|senior system engineer|vienna, vienna, austria|https://www.linkedin.com/jobs/view/4324578298
cvation - part of skaylink|software engineer|copenhagen, capital region of denmark, denmark|https://www.linkedin.com/jobs/view/4342028905
kramer & crew gmbh & co. kg|system engineer (m/w/d) service desk|cologne, north rhine-westphalia, germany|https://www.linkedin.com/jobs/view/4247672547
think about it gmbh|it-system engineer client management (m/w/d)|bochum, north rhine-westphalia, germany|https://www.linkedin.com/jobs/view/4347732643
pb consult gmbh|developer microsoft dynamics 365 business central (m/w/d)|werne an der lippe, north rhine-westphalia, germany|https://www.linkedin.com/jobs/view/4277157797
pb consult gmbh|entwickler microsoft dynamics 365 business central (m/w/d)|werne an der lippe, north rhine-westphalia, germany|https://www.linkedin.com/jobs/view/4277156858
amesto|senior/ principal developer|kristiansand, agder, norway|https://www.linkedin.com/jobs/view/4290965622
emagine|2 backendutviklere|oslo, oslo, norway|https://www.linkedin.com/jobs/view/4325503737
arm|graduate software engineer – system test directx (gpu)|lund, skåne county, sweden|https://www.linkedin.com/jobs/view/4321117200
sweco|utvecklare med fokus på molntjänster till sweco i stockholm/uppsala|stockholm, stockholm county, sweden|https://www.linkedin.com/jobs/view/4314361729
targetjobs uk|halo grad scheme|stowmarket, england, united kingdom|https://www.linkedin.com/jobs/view/4303656675
evoila networks gmbh|technical project manager (m/f/d)|vienna, vienna, austria|https://www.linkedin.com/jobs/view/4334519279
evoila|technical project manager (m/f/d)|vienna, vienna, austria|https://www.linkedin.com/jobs/view/4280337537
simon-kucher|senior consultant data engineering (m/w/d)|vienna, vienna, austria|https://www.linkedin.com/jobs/view/4223037173
magna international|controller (w/m/x)|sankt valentin, lower austria, austria|https://www.linkedin.com/jobs/view/4335353434
heidelberger druckmaschinen ag|duales hochschulstudium bachelor of science informatik (m/w/d)|kiel, flemish region, belgium|https://www.linkedin.com/jobs/view/4324383535
invitario  the smarter way to invite|customer success manager|plovdiv, plovdiv, worldwide|https://www.linkedin.com/jobs/view/4200961575
pso space|software developer|ivanić-grad, zagreb, worldwide|https://www.linkedin.com/jobs/view/4334266620
maslina resort|villa concierge|stari grad, split-dalmatia, worldwide|https://www.linkedin.com/jobs/view/4325703256
johnson & johnson medtech|new technology manager, cardio, cee|zagreb, zagreb, worldwide|https://www.linkedin.com/jobs/view/4339224599
databricks|software engineer - new grad (2026 start) - aarhus|aarhus, central denmark region, denmark|https://www.linkedin.com/jobs/view/4297744052
sopra steria|talent pipeline (uopfordret) - software engineering, tech. management & data intelligence|copenhagen municipality, capital region of denmark, denmark|https://www.linkedin.com/jobs/view/4304684332
frontmatec|c#/.net software ingeniør til frontmatec|tandslet, region of southern denmark, denmark|https://www.linkedin.com/jobs/view/4325141043
travelmind group|erfaren senior backend php & c# udvikler søges til rejsekoncern|horsens, central denmark region, denmark|https://www.linkedin.com/jobs/view/4347929190
travelmind group|vue frontend udvikler, med stærke designkompetencer, søges til rejsekoncern|horsens, central denmark region, denmark|https://www.linkedin.com/jobs/view/4347959132
curia|udviklingschef til telco a/s i aalborg|aalborg, north denmark region, denmark|https://www.linkedin.com/jobs/view/4341020570
trifork|experienced android/kotlin mobile-developer|aarhus, central denmark region, denmark|https://www.linkedin.com/jobs/view/4331748853
sopra steria|talent pipeline - senior .net udvikler til afdeling i vækst|copenhagen municipality, capital region of denmark, denmark|https://www.linkedin.com/jobs/view/4308967816
trifork|experienced android/kotlin mobile-developer|greater aarhus area, worldwide|https://www.linkedin.com/jobs/view/4331736851
bankdata|senior db2 engineer - mainframe dba|fredericia, region of southern denmark, denmark|https://www.linkedin.com/jobs/view/4311381546
eg a/s|supportkonsulent til eg bolig – med flair for regnskab og kundeservice|aarhus, central denmark region, denmark|https://www.linkedin.com/jobs/view/4340029280
eg a/s|supportkonsulent til eg bolig – med flair for regnskab og kundeservice|aarhus, central denmark region, denmark|https://www.linkedin.com/jobs/view/4303048007
forsvaret|erfaren projektleder inden for anskaffelser til luftdivisionen ved forsvarsministeriets materiel- og indkøbsstyrelse|copenhagen, capital region of denmark, denmark|https://www.linkedin.com/jobs/view/4325668305
arm|graduate cpu microarchitecture modelling and performance analysis|sophia antipolis, provence-alpes-côte d'azur, france|https://www.linkedin.com/jobs/view/4312897408
qgenda|implementation consultant - 2025 new grad|ga, atlanta, worldwide|https://www.linkedin.com/jobs/view/4312177194
hntb|new grad engineer i - summer 2026|ga, atlanta, worldwide|https://www.linkedin.com/jobs/view/4314813636
the intersect group|business development representative|ga, atlanta, worldwide|https://www.linkedin.com/jobs/view/4310008182
agnes scott college|graduate admission counselor|ga, decatur, worldwide|https://www.linkedin.com/jobs/view/4298788124
omp|supply chain consultant co-op|ga, atlanta, worldwide|https://www.linkedin.com/jobs/view/4295972634
resmed|npi engineering manager, motors manufacturing|ga, chatsworth, worldwide|https://www.linkedin.com/jobs/view/4206108337
russell tobin|service desk agent|ga, alpharetta, worldwide|https://www.linkedin.com/jobs/view/4348422949
faculty of dentistry  university of toronto|opportunity type
full-time associate wanted|ga, dawson, worldwide|https://www.linkedin.com/jobs/view/4256812460
burns & mcdonnell|energy & utilities analyst, mechanical/industrial engineer – 1898 & co. (atlanta or charlotte)|ga, atlanta, worldwide|https://www.linkedin.com/jobs/view/4210114664
burns & mcdonnell|energy & utilities analyst, electrical engineer – 1898 & co. (multiple locations)|ga, atlanta, worldwide|https://www.linkedin.com/jobs/view/4210118162
1898 & co.|energy & utilities analyst, mechanical engineer- 1898 & co. (atlanta)|ga, atlanta, worldwide|https://www.linkedin.com/jobs/view/4295968915
burns & mcdonnell|assistant civil/structural engineer - transmission & distribution (atlanta)|ga, atlanta, worldwide|https://www.linkedin.com/jobs/view/4297192316
1898 & co.|energy & utilities analyst, electrical engineer - 1898 & co. (atlanta)|ga, atlanta, worldwide|https://www.linkedin.com/jobs/view/4297039277
burns & mcdonnell|assistant structural engineer - aviation & federal (atlanta)|ga, atlanta, worldwide|https://www.linkedin.com/jobs/view/4281881706
pt solutions physical therapy|physical therapist - outpatient|ga, atlanta, worldwide|https://www.linkedin.com/jobs/view/4348039582
innovative therapy concepts|northside gwinnett rehabilitation aide|ga, lawrenceville, worldwide|https://www.linkedin.com/jobs/view/4322918749
augusta university|ast dir grad adms operations|ga, augusta, worldwide|https://www.linkedin.com/jobs/view/4342263162
pt solutions physical therapy|physical therapist - outpatient|ga, atlanta, worldwide|https://www.linkedin.com/jobs/view/4302385231
pt solutions physical therapy|outpatient physical therapist|ga, acworth, worldwide|https://www.linkedin.com/jobs/view/4280269490
pt solutions physical therapy|physical therapist - outpatient|ga, smyrna, worldwide|https://www.linkedin.com/jobs/view/4314919850
pt solutions physical therapy|physical therapist - outpatient|ga, marietta, worldwide|https://www.linkedin.com/jobs/view/4341340169
pt solutions physical therapy|physical therapist - outpatient|ga, marietta, worldwide|https://www.linkedin.com/jobs/view/4340935332
pt solutions physical therapy|physical therapist - outpatient|ga, decatur, worldwide|https://www.linkedin.com/jobs/view/4347770082
databricks|software engineer - new grad (2026 start)|berlin, berlin, germany|https://www.linkedin.com/jobs/view/4297749056
s&n systemhaus für netzwerk- und datentechnik gmbh|full stack java software developer/entwickler (m/w/d)|rostock, mecklenburg-west pomerania, germany|https://www.linkedin.com/jobs/view/4341542965
s&n systemhaus für netzwerk- und datentechnik gmbh|full stack c#/.net software developer/entwickler (m/w/d)|rostock, mecklenburg-west pomerania, germany|https://www.linkedin.com/jobs/view/4341732738
mcmakler|it support specialist (m/w/d)|berlin, berlin, germany|https://www.linkedin.com/jobs/view/4335122592
thinkred|it-supporter (m/w/d)|bad soden am taunus, hesse, germany|https://www.linkedin.com/jobs/view/4347616555
cetos services ag|it-supporter (m/w/d) gesucht|berlin, berlin, germany|https://www.linkedin.com/jobs/view/4337832653
zoiss engineering gmbh|testingenieur für softwaretests (d/w/m)|tettnang, baden-württemberg, germany|https://www.linkedin.com/jobs/view/4340946497
mayflower gmbh|software engineer*in mit schwerpunkt genai (w/d/m)|munich, bavaria, germany|https://www.linkedin.com/jobs/view/4341133354
arvana gmbh|founders associate (m/w/d)|berlin, berlin, germany|https://www.linkedin.com/jobs/view/4347569880
s&n systemhaus für netzwerk- und datentechnik gmbh|devops engineer (m/w/d)|rostock, mecklenburg-west pomerania, germany|https://www.linkedin.com/jobs/view/4342042413
carl|m&a intern ab 2026 (m/w/d)|berlin, berlin, germany|https://www.linkedin.com/jobs/view/4027789640
mayflower gmbh|senior fullstack engineer*in (w/d/m)|würzburg, bavaria, germany|https://www.linkedin.com/jobs/view/4347274473
is2 intelligent solution services ag|devops-spezialist:in|germany|https://www.linkedin.com/jobs/view/4339294999
pechschwarz®|head of performance marketing (m/w/d)|wuppertal, north rhine-westphalia, germany|https://www.linkedin.com/jobs/view/4121369753
heydata|data privacy consultant (all genders)|berlin, berlin, germany|https://www.linkedin.com/jobs/view/4347833933
think about it gmbh|senior it administrator (m/w/d)|bochum, north rhine-westphalia, germany|https://www.linkedin.com/jobs/view/4347563668
bitgrip gmbh|scrum master (m/w/d) / teilzeit 20-32 std. pro woche|berlin, berlin, germany|https://www.linkedin.com/jobs/view/4341661898
datadiorama - it systemhaus für potsdam|netzwerk- und systemadministrator*in (m/w/d)|potsdam, brandenburg, germany|https://www.linkedin.com/jobs/view/4347371150
belform|junior projekteinkäufer (m/w/d) in vollzeit|munich, bavaria, germany|https://www.linkedin.com/jobs/view/4347813937
dekabank|werkstudent (w/m/d) cloud-competence & prozesse|frankfurt, hesse, germany|https://www.linkedin.com/jobs/view/4314132900
csp gmbh & co. kg|account manager / account director – automotive (m/w/d)|germany|https://www.linkedin.com/jobs/view/4347727915
metergrid gmbh|praktikum im sales & growth – energy saas (m/w/d)|germany|https://www.linkedin.com/jobs/view/4319937869
swiss life lebensversicherung se|senior camunda entwickler (m/w/d)|munich, bavaria, germany|https://www.linkedin.com/jobs/view/4336291766
ald vacuum technologies gmbh|software-ingenieur automatisierungstechnik (m/w/div.)|hanau am main, hesse, germany|https://www.linkedin.com/jobs/view/4274338439
ald vacuum technologies gmbh|software-ingenieur standardisierung (m/w/div.)|hanau am main, hesse, germany|https://www.linkedin.com/jobs/view/4255077422
conny|werkstudent case management(m/w/d)|berlin, berlin, germany|https://www.linkedin.com/jobs/view/4124573862
iso-gruppe|junior it sales consultant (m/w/d) sap add-ons & data quality|frankfurt am main, hesse, germany|https://www.linkedin.com/jobs/view/4325185024
mann+hummel|commodity manager it solutions global (m/w/d)|ludwigsburg, baden-württemberg, germany|https://www.linkedin.com/jobs/view/4337290167
mayflower gmbh|senior ai solutions engineer*in (w/d/m)|würzburg, bavaria, germany|https://www.linkedin.com/jobs/view/4284770160
arvana gmbh|key account manager (m/w/d)|berlin, berlin, germany|https://www.linkedin.com/jobs/view/4340607802
rifcon gmbh|data manager (m/f/d) / data manager safety data sheets (m/f/d)|ludwigshafen, rhineland-palatinate, germany|https://www.linkedin.com/jobs/view/4340762769
german aerospace center (dlr)|ingenieur/in (w/m/d) für virtuelles und hybrides testen von flugzeugsystemen|brunswick, lower saxony, germany|https://www.linkedin.com/jobs/view/4318109821
kertos|praktikum customer success (all genders)|berlin, berlin, germany|https://www.linkedin.com/jobs/view/4341150302
klickpiloten|(senior) sea-manager in stuttgart (m/w/d) &amp;#8211; hybrid|stuttgart, baden-württemberg, germany|https://www.linkedin.com/jobs/view/4315034117
e.on|strategy & partnership manager - residential flexibility programme (f/m/d)|essen, north rhine-westphalia, germany|https://www.linkedin.com/jobs/view/4341840247
1komma5°|inside sales coordinator (m/w/d) für intelligente energiesysteme - 1komma5° göttingen / kassel|göttingen, lower saxony, germany|https://www.linkedin.com/jobs/view/4306546596
wechange eg|vertriebsmitarbeit / sales management (m/w/d)|germany|https://www.linkedin.com/jobs/view/4348532106
stf gruppe|vermessungstechniker mobile mapping (m/w/d)|bonn, north rhine-westphalia, germany|https://www.linkedin.com/jobs/view/4312270420
tradias|experte für handelsüberwachung / trade surveillance (m/w/d)|frankfurt, hesse, germany|https://www.linkedin.com/jobs/view/4341141251
stf gruppe|vermessungstechniker mobile mapping (m/w/d)|erfurt, thuringia, germany|https://www.linkedin.com/jobs/view/4318054407
philips|account manager (m/w/d) hospital patient monitoring - region norddeutschland|ruhr region, worldwide|https://www.linkedin.com/jobs/view/4304417413
stf gruppe|vermessungstechniker mobile mapping (m/w/d)|nuremberg, bavaria, germany|https://www.linkedin.com/jobs/view/4254326414
stf gruppe|vermessungstechniker mobile mapping (m/w/d)|langenhagen, lower saxony, germany|https://www.linkedin.com/jobs/view/4318052440
skopos|werkstudent (m/w/d) marktforschung - customer experience (cx) & communities|hürth, north rhine-westphalia, germany|https://www.linkedin.com/jobs/view/4296400757
stf gruppe|vermessungstechniker mobile mapping (m/w/d)|korntal-münchingen, baden-württemberg, germany|https://www.linkedin.com/jobs/view/4318048420
stf gruppe|vermessungstechniker mobile mapping (m/w/d)|fulda, hesse, germany|https://www.linkedin.com/jobs/view/4312283293
skopos|werkstudent (m/w/d) marktforschung - customer experience (cx) & communities|aachen, north rhine-westphalia, germany|https://www.linkedin.com/jobs/view/4340972521
konzmann gruppe|kundendienstleiter (m/w/d)|radolfzell, baden-württemberg, germany|https://www.linkedin.com/jobs/view/4331499862
wtw|tech sales und contracting support (m/w/d)|cologne, north rhine-westphalia, germany|https://www.linkedin.com/jobs/view/4294322133
lapp group|duales studium: bwl-digital commerce management|stuttgart, baden-württemberg, germany|https://www.linkedin.com/jobs/view/4292911051
continentale versicherung|duales studium wirtschaftsinformatik an der th rosenheim, bachelor of science|munich, bavaria, germany|https://www.linkedin.com/jobs/view/4325384226
maxsolar gmbh|buchhaltungsfachkraft / steuerfachangestellte/r (m/w/d) - erneuerbare energien|traunstein, bavaria, germany|https://www.linkedin.com/jobs/view/4340298833
synpulse8 deutschland gmbh|vertriebsunterstützung (innendienst) (m/w/d)|ulm, baden-württemberg, germany|https://www.linkedin.com/jobs/view/4347501502
sfb 1313  university of stuttgart|wissenschaftlicher mitarbeiter (m/w/d) im bereich integrations- und systemtests für virtualisierte echtzeitsteuerungen|stuttgart region, worldwide|https://www.linkedin.com/jobs/view/4348053471
etl-gruppe|steuerassistent (m/w/d)|bremen, bremen, germany|https://www.linkedin.com/jobs/view/4289611525
prime research brazil|field marketing manager dach (german-speaking) (m/w/d)|frankfurt, hesse, germany|https://www.linkedin.com/jobs/view/4324553862
inspiralia gmbh|consultant für fördermittel in deutschland (m/w/d)|berlin, berlin, germany|https://www.linkedin.com/jobs/view/4348186193
holidu|praktikum account management ostsee (w/m/d)|hamburg, hamburg, germany|https://www.linkedin.com/jobs/view/4312043438
holidu|sales quereinsteiger ostsee (w/m/d)|hamburg, hamburg, germany|https://www.linkedin.com/jobs/view/4336703518
cision germany gmbh|field marketing manager dach (german-speaking) (m/w/d)|frankfurt, hesse, germany|https://www.linkedin.com/jobs/view/4341012836
holidu|vertriebsmitarbeiter*in ostsee (w/m/d)|greater hamburg area, worldwide|https://www.linkedin.com/jobs/view/4336068416
bwi gmbh|duales studium zum bachelor of science in wirtschaftsinformatik ki & data science inkl. ausbildung zum fachinformatiker anwendungsentwicklung (m/w/d)|munich, bavaria, germany|https://www.linkedin.com/jobs/view/4303079477
bwi gmbh|duales studium zum bachelor of science in wirtschaftsinformatik ki & data science inkl. ausbildung zum fachinformatiker systemintegration (m/w/d)|frankfurt am main, hesse, germany|https://www.linkedin.com/jobs/view/4303079478
bwi gmbh|duales studium zum bachelor of science in wirtschaftsinformatik cyber security inkl. ausbildung zum fachinformatiker anwendungsentwicklung (m/w/d)|strausberg, brandenburg, germany|https://www.linkedin.com/jobs/view/4303085375
bwi gmbh|duales studium zum bachelor of science in wirtschaftsinformatik cyber security inkl. ausbildung zum fachinformatiker anwendungsentwicklung (m/w/d)|wilhelmshaven, lower saxony, germany|https://www.linkedin.com/jobs/view/4303093295
bwi gmbh|duales studium zum bachelor of science in wirtschaftsinformatik ki & data science inkl. ausbildung zum fachinformatiker systemintegration (m/w/d)|leipzig, saxony, germany|https://www.linkedin.com/jobs/view/4303091277
volkswagen group services gmbh|duales studium 2026 i logistik- und informationsmanagement (m/w/d)|wolfsburg, lower saxony, germany|https://www.linkedin.com/jobs/view/4259762932
arm|graduate software engineer|budapest, budapest, hungary|https://www.linkedin.com/jobs/view/4307639496
innoedu|growth & partnership manager (f/m/d) – europe|budapest, budapest, hungary|https://www.linkedin.com/jobs/view/4340097811
stripe|software engineer, new grad|dublin, county dublin, ireland|https://www.linkedin.com/jobs/view/4294949931
stripe|backend engineer/api, payments and risk|dublin, county dublin, ireland|https://www.linkedin.com/jobs/view/4289317979
ryanair - europe's favourite airline|grad programme – labs|dublin, county dublin, ireland|https://www.linkedin.com/jobs/view/4309853666
stripe|full stack engineer, revenue and finance automation|dublin, county dublin, ireland|https://www.linkedin.com/jobs/view/4289951056
godfrey north|commercial economist|dublin, county dublin, ireland|https://www.linkedin.com/jobs/view/4337779610
nitro software|product manager intern - 6 months (hybrid)|dublin, county dublin, ireland|https://www.linkedin.com/jobs/view/4342252130
analog devices|fy26 electronic engineering graduate opportunities|limerick, county limerick, ireland|https://www.linkedin.com/jobs/view/4341909095
sap|developer associate - sap academy product & engineering|dublin, county dublin, ireland|https://www.linkedin.com/jobs/view/4325365059
kpmg ireland|transfer pricing economist|dublin, county dublin, ireland|https://www.linkedin.com/jobs/view/4313209986
salesforce|commercial graduate rotation program - norwegian speakers (february start)|dublin, county dublin, ireland|https://www.linkedin.com/jobs/view/4336831504
schweitzer|it helpdesk mitarbeiter:in (w/m/x)|naturno, trentino-alto adige, italy|https://www.linkedin.com/jobs/view/4262232744
databricks|software engineer - new grad (2026 start)|amsterdam, north holland, netherlands|https://www.linkedin.com/jobs/view/4297756009
central norway regional health authority|ønsker du å skape verdifulle programvareløsninger for helsesektoren?|trondheim, trøndelag, norway|https://www.linkedin.com/jobs/view/4339873693
ulmatec handling solutions|softwareingeniør|hareid, møre og romsdal, norway|https://www.linkedin.com/jobs/view/4335787419
telenor|seksjonsleder network management systems|oslo, oslo, norway|https://www.linkedin.com/jobs/view/4347514484
profitbase as|senior rådgiver konsolidering|stavanger/sandnes, rogaland, norway|https://www.linkedin.com/jobs/view/4340957685
green ammo|ingeniør|porsgrunn/skien, vestfold og telemark, norway|https://www.linkedin.com/jobs/view/4340952606
era group - emea|supply chain manager|norway|https://www.linkedin.com/jobs/view/4303515963
honeywell|servicetekniker|drammen, viken, norway|https://www.linkedin.com/jobs/view/4338933309
honeywell|servicetekniker - brann|bergen, vestland, norway|https://www.linkedin.com/jobs/view/4312731234
stripe|software engineer, new grad|bucharest, bucharest, romania|https://www.linkedin.com/jobs/view/4294962318
undelucram.ro|inginer proiectant sisteme electrice|bucharest, bucharest, romania|https://www.linkedin.com/jobs/view/4284807073
hipo.ro|inginer proiectant - parc eolian buzau|ilfov, romania|https://www.linkedin.com/jobs/view/4315324839
imsat s.a.|inginer proiectant sisteme electrice|bucharest, romania|https://www.linkedin.com/jobs/view/4338890735
mbk power energy|inginer proiectant – domeniul energetic|cluj, romania|https://www.linkedin.com/jobs/view/4347679208
imsat s.a.|inginer proiectant sisteme electrice|câmpina, prahova, romania|https://www.linkedin.com/jobs/view/4338690926
imsat s.a.|inginer proiectant sisteme electrice|ploieşti, prahova, romania|https://www.linkedin.com/jobs/view/4338900787
ziprecruiter|software engineer - new grad|santa monica, canada|https://www.linkedin.com/jobs/view/4307938042
d3|frontend engineer - new grad|los angeles, canada|https://www.linkedin.com/jobs/view/4298288410
whatnot|software engineer, 2026 new grad|los angeles, canada|https://www.linkedin.com/jobs/view/4324950740
freeform|software engineer (new grad january 2026)|los angeles, canada|https://www.linkedin.com/jobs/view/4295711788
freeform|software engineer (new grad summer 2026)|los angeles, canada|https://www.linkedin.com/jobs/view/4293339453
graymatter robotics|robotics engineer: software, new grad|los angeles metropolitan area, worldwide|https://www.linkedin.com/jobs/view/4278671526
graymatter robotics|robotics engineer: software, new grad|los angeles metropolitan area, worldwide|https://www.linkedin.com/jobs/view/4278669713
freeform|manufacturing engineer (new grad summer 2026)|los angeles, canada|https://www.linkedin.com/jobs/view/4293513497
snap inc.|software engineer c++, 3d graphics, level 4|los angeles, canada|https://www.linkedin.com/jobs/view/4337629350
pcl construction|field engineer- new grad 2026|los angeles, canada|https://www.linkedin.com/jobs/view/4312913952
snap inc.|software engineer, ios, level 4|los angeles, canada|https://www.linkedin.com/jobs/view/4310177009
snap inc.|manager, software engineering, level 6|los angeles, canada|https://www.linkedin.com/jobs/view/4291616956
the aerospace corporation|2026 signal processing and rf engineering grad intern|el segundo, canada|https://www.linkedin.com/jobs/view/4341910891
snap inc.|software engineer, ios, level 5|los angeles, canada|https://www.linkedin.com/jobs/view/4311302264
the aerospace corporation|2026 asic/fpga security engineering grad intern|el segundo, canada|https://www.linkedin.com/jobs/view/4348395481
california therapy services|home health occupational therapist (ot)|los angeles, canada|https://www.linkedin.com/jobs/view/4325219451
california therapy services|home health occupational therapist (ot)|los angeles, canada|https://www.linkedin.com/jobs/view/4325219448
hntb|wed - 2026 new grad civil engineer i (for current/previous hntb interns only)|los angeles, canada|https://www.linkedin.com/jobs/view/4282327041
rosendin|electrical bim modeler i|anaheim, canada|https://www.linkedin.com/jobs/view/4312904967
california therapy services|home health physical therapist assistant (pta)|compton, canada|https://www.linkedin.com/jobs/view/4325431211
rosendin|electrical engineer iii|anaheim, canada|https://www.linkedin.com/jobs/view/4312917318
snap inc.|principal machine learning engineer, content relevance, level 7|los angeles, canada|https://www.linkedin.com/jobs/view/4338913754
