company|title|location|link
meta|production engineer (university grad)|dublin, county dublin, ireland|https://www.linkedin.com/jobs/view/4120826247
meta|production engineer (university grad)|london, england, united kingdom|https://www.linkedin.com/jobs/view/4120824482
trifork|java software developer|aarhus, central denmark region, denmark|https://www.linkedin.com/jobs/view/4133443346
trifork|java software developer|greater aarhus area, worldwide|https://www.linkedin.com/jobs/view/4116584126
trifork|experienced .net developer|greater aarhus area, worldwide|https://www.linkedin.com/jobs/view/4116578863
trifork|experienced .net developer|aarhus, central denmark region, denmark|https://www.linkedin.com/jobs/view/4133443349
sopra steria|senior/lead java udvikler til afdeling i vækst|copenhagen, capital region of denmark, denmark|https://www.linkedin.com/jobs/view/4117390401
sopra steria|senior/lead .net udvikler til afdeling i vækst|copenhagen, capital region of denmark, denmark|https://www.linkedin.com/jobs/view/4117388551
sopra steria|senior data engineer til nyt team|copenhagen, capital region of denmark, denmark|https://www.linkedin.com/jobs/view/4150366345
metergrid gmbh|data engineer|germany|https://www.linkedin.com/jobs/view/4142334549
knowit|utvikler?|bergen, vestland, norway|https://www.linkedin.com/jobs/view/4001701789
norsk rikskringkasting (nrk)|data platform engineer|oslo, oslo, norway|https://www.linkedin.com/jobs/view/4146399326
knowit|data engineer til vårt cloud-team|oslo, oslo, norway|https://www.linkedin.com/jobs/view/4106726068
svensk fastighetsförmedling|machine learning expert & data engineer|stockholm, stockholm county, sweden|https://www.linkedin.com/jobs/view/4106253558
insider.|software developer – insider testinium tech hub (remote)|istanbul, istanbul, worldwide|https://www.linkedin.com/jobs/view/4145476166
insider.|software developer / intercontinental support - insider testinium tech hub (remote)|greater istanbul, worldwide|https://www.linkedin.com/jobs/view/4149064448
insider.|software developer / intercontinental support - insider testinium tech hub (remote)|istanbul, istanbul, worldwide|https://www.linkedin.com/jobs/view/4149060724
fellowmind|udvikler til modern work|aalborg, north denmark region, denmark|https://www.linkedin.com/jobs/view/4146772153
fellowmind|udvikler til modern work|roskilde, region zealand, denmark|https://www.linkedin.com/jobs/view/4146774177
fellowmind|udvikler til modern work|copenhagen, capital region of denmark, denmark|https://www.linkedin.com/jobs/view/4146767677
fellowmind|udvikler til modern work|aarhus, central denmark region, denmark|https://www.linkedin.com/jobs/view/4146768663
fellowmind|udvikler til modern work|odense, region of southern denmark, denmark|https://www.linkedin.com/jobs/view/4146772156
cvation - part of skaylink|software engineer|copenhagen, capital region of denmark, denmark|https://www.linkedin.com/jobs/view/4129384063
bankinvest|it software developer|copenhagen municipality, capital region of denmark, denmark|https://www.linkedin.com/jobs/view/4150509445
fjernvarme fyn a/s|cloud operations engineer|odense, region of southern denmark, denmark|https://www.linkedin.com/jobs/view/4151342207
fellowmind|udvikler til modern work|frederiksberg municipality, capital region of denmark, denmark|https://www.linkedin.com/jobs/view/4149288421
hntb|new grad engineer i - summer 2025|ga, atlanta, worldwide|https://www.linkedin.com/jobs/view/4115740321
giesecke+devrient|software developer (m/w/d)|munich, bavaria, germany|https://www.linkedin.com/jobs/view/4074976697
join.com|mondia group: java backend developer (m/f/d)|hamburg, hamburg, germany|https://www.linkedin.com/jobs/view/4149948842
axel springer|system- / cloud engineer - identity access management (m/w/d)|berlin, germany|https://www.linkedin.com/jobs/view/4144320303
glueckkanja ag|cloud service engineer (m/w/d)|germany|https://www.linkedin.com/jobs/view/4145742632
rudi göbel gmbh & co. kg|it-anwendungsentwickler m/w/d vollzeit. (fachinformatiker/in - anwendungsentwicklung)|helmbrechts, bavaria, germany|https://www.linkedin.com/jobs/view/4149445744
simon-kucher|(senior) it deployment engineer (m/w/d) – berlin|berlin, berlin, germany|https://www.linkedin.com/jobs/view/4069857387
simon-kucher|(senior) it deployment engineer (m/w/d) – hamburg|hamburg, hamburg, germany|https://www.linkedin.com/jobs/view/4069862078
swiss life deutschland|microsoft dynamics 365 developer (m/w/d) – schwerpunkt crm in voll- oder teilzeit|munich, bavaria, germany|https://www.linkedin.com/jobs/view/4111052544
simon-kucher|(senior) it deployment engineer (m/w/d) – frankfurt|frankfurt, hesse, germany|https://www.linkedin.com/jobs/view/4069861052
amesto|senior developer|kristiansand, agder, norway|https://www.linkedin.com/jobs/view/4139940874
braver|braver søker appfarm-utvikler som vil jobbe med digital produktutvikling|oslo, oslo, norway|https://www.linkedin.com/jobs/view/4096095438
columbus|senior data engineer  data & ai|oslo, oslo, norway|https://www.linkedin.com/jobs/view/4142244519
university of applied sciences and arts northwestern switzerland fhnw|it system engineer 80-100%|windisch, aargau, switzerland|https://www.linkedin.com/jobs/view/4129613782
impact recruitment gmbh|senior devops engineer container technologies|zürich metropolitan area, worldwide|https://www.linkedin.com/jobs/view/4141663882
aveniq|senior devops engineer container technologies|baden, aargau, switzerland|https://www.linkedin.com/jobs/view/4131790598
aveniq|senior devops engineer container technologies|dübendorf, zurich, switzerland|https://www.linkedin.com/jobs/view/4131793465
aveniq|senior devops engineer container technologies|oftringen, aargau, switzerland|https://www.linkedin.com/jobs/view/4131789759
anderson green ltd|graduate electrical design engineer|nottingham, england, united kingdom|https://www.linkedin.com/jobs/view/4093672528
sgs|informatiker*in / systemtechniker*in als (senior) it-system engineer (m/w/d)|hamburg, hamburg, germany|https://www.linkedin.com/jobs/view/4034757654
simon-kucher|(senior) it deployment engineer (m/w/d) – münchen|munich, bavaria, germany|https://www.linkedin.com/jobs/view/4069863012
fjernvarme fyn a/s|cloud operation engineer|odense, region of southern denmark, denmark|https://www.linkedin.com/jobs/view/4151355096
simon-kucher|(senior) it deployment engineer (m/w/d) – bonn oder köln|cologne bonn region, worldwide|https://www.linkedin.com/jobs/view/4069857427
rottendorf pharma|systemadministrator (m/w/d) microsoft|ennigerloh, north rhine-westphalia, germany|https://www.linkedin.com/jobs/view/4122639429
testhuset.dk|tester - aarhus|aarhus, central denmark region, denmark|https://www.linkedin.com/jobs/view/4012638999
testhuset.dk|tester - ballerup|ballerup, capital region of denmark, denmark|https://www.linkedin.com/jobs/view/3919168315
testhuset.dk|test manager - aarhus|aarhus, central denmark region, denmark|https://www.linkedin.com/jobs/view/3919163794
trifork|ai/ml expert|greater aarhus area, worldwide|https://www.linkedin.com/jobs/view/4116584120
trifork|ai/ml expert|aarhus, central denmark region, denmark|https://www.linkedin.com/jobs/view/4133439573
testhuset.dk|test manager - ballerup|ballerup, capital region of denmark, denmark|https://www.linkedin.com/jobs/view/3919167574
orifarm|analyst til financial planning & analysis|odense, region of southern denmark, denmark|https://www.linkedin.com/jobs/view/4138061421
khr architecture|khr architecture søger bygningskonstruktørpraktikanter|copenhagen, capital region of denmark, denmark|https://www.linkedin.com/jobs/view/3897195873
tv 2 danmark|product manager til video editing & management|odense, region of southern denmark, denmark|https://www.linkedin.com/jobs/view/4150428264
orifarm|analyst til financial planning & analysis|greater odense area, worldwide|https://www.linkedin.com/jobs/view/4137979819
risma systems|økonomiassistent|copenhagen, capital region of denmark, denmark|https://www.linkedin.com/jobs/view/4145895587
spica technology aps|elektronikfagtekniker til vindmølleindustrien|silkeborg, central denmark region, denmark|https://www.linkedin.com/jobs/view/4142348847
comet x-ray|pta hardware engineer|copenhagen municipality, capital region of denmark, denmark|https://www.linkedin.com/jobs/view/4148257024
comet x-ray|pta hardware ingeniør|taastrup, capital region of denmark, denmark|https://www.linkedin.com/jobs/view/4143262043
ramboll|erfaren softwareudvikler til rambøll stakeholder intelligence|aarhus, central denmark region, denmark|https://www.linkedin.com/jobs/view/4117293880
analog devices|engineer, field applications, new college grad program|helsinki metropolitan area, worldwide|https://www.linkedin.com/jobs/view/4035636205
arm|graduate micro-architect and performance modelling engineer - cpu|sophia antipolis, provence-alpes-côte d'azur, france|https://www.linkedin.com/jobs/view/4059678958
salesforce|software engineering amts/mts (new grad)|ga, atlanta, worldwide|https://www.linkedin.com/jobs/view/4066585330
cargill|software engineering intern summer 2025 - atlanta, ga|ga, atlanta, worldwide|https://www.linkedin.com/jobs/view/4136338665
deposco|associate consultant  - may 2025 grad|ga, alpharetta, worldwide|https://www.linkedin.com/jobs/view/4024329658
enercon services, inc.|may/june 2025 new graduate - distribution engineer - power delivery group|ga, kennesaw, worldwide|https://www.linkedin.com/jobs/view/4032256754
enercon services, inc.|new graduate may/june 2025- safety analysis engineer|ga, kennesaw, worldwide|https://www.linkedin.com/jobs/view/4136832927
enercon services, inc.|new graduate may/june 2025 - civil/structural engineer - enercon federal services|ga, kennesaw, worldwide|https://www.linkedin.com/jobs/view/4031690088
renesas electronics|principal digital engineer|ga, johns creek, worldwide|https://www.linkedin.com/jobs/view/4150594502
enercon services, inc.|intern - distribution engineer - power delivery|ga, kennesaw, worldwide|https://www.linkedin.com/jobs/view/4001277306
holder construction|preconstruction engineer (new college grad 2024-2025)|georgia, united states|https://www.linkedin.com/jobs/view/4125890839
burns & mcdonnell|energy & utilities analyst, electrical engineer - 1898 & co. (atlanta)|ga, atlanta, worldwide|https://www.linkedin.com/jobs/view/4015165679
burns & mcdonnell|energy & utilities analyst, electrical engineer - 1898 & co. (atlanta)|ga, atlanta, worldwide|https://www.linkedin.com/jobs/view/4015165684
1898 & co.|energy & utilities analyst, electrical engineer - 1898 & co. (atlanta)|ga, atlanta, worldwide|https://www.linkedin.com/jobs/view/4017904063
1898 & co.|energy & utilities analyst, electrical engineer - 1898 & co. (atlanta)|ga, atlanta, worldwide|https://www.linkedin.com/jobs/view/4017904064
innovative therapy concepts|northside gwinnett rehabilitation aide|ga, lawrenceville, worldwide|https://www.linkedin.com/jobs/view/4115359302
ripplematch|unitedhealth group - sales support intern, application via ripplematch|ga, atlanta, worldwide|https://www.linkedin.com/jobs/view/4143615909
gamomat development gmbh|software engineer – backend (all genders welcome) - berlin oder 100% remote|berlin, berlin, germany|https://www.linkedin.com/jobs/view/4032241613
steadforce|software backend engineer (m/w/d)|munich, bavaria, germany|https://www.linkedin.com/jobs/view/3837967325
remondis it|softwarearchitekt java (m/w/d)|lünen, north rhine-westphalia, germany|https://www.linkedin.com/jobs/view/4095547219
wattify gmbh|youki - backend developer|amberg, bavaria, germany|https://www.linkedin.com/jobs/view/3834260469
remondis it|softwareentwickler java (m/w/d)|lünen, north rhine-westphalia, germany|https://www.linkedin.com/jobs/view/4095546312
youki gmbh|youki - backend developer  jobs at youki gmbh|würzburg, bavaria, germany|https://www.linkedin.com/jobs/view/4096849460
remondis it|trainee – softwareentwicklung (m/w/d)|lünen, north rhine-westphalia, germany|https://www.linkedin.com/jobs/view/4095549140
orendt studios holding gmbh|software developer, senior (m/w/d)|ratingen, north rhine-westphalia, germany|https://www.linkedin.com/jobs/view/4018165731
doctolib|manager go-to-market strategy (x/f/m)|berlin, berlin, germany|https://www.linkedin.com/jobs/view/4008915066
si pro gmbh|absolvent betriebswirtschaftslehre m.sc. bwl einstieg unternehmensberatung sap (m/w/d), mannheim, berlin, münchen, hamburg|mannheim, baden-württemberg, germany|https://www.linkedin.com/jobs/view/4148249699
mayflower gmbh|senior backend entwickler*in in java, spring boot (w/d/m)|würzburg, bavaria, germany|https://www.linkedin.com/jobs/view/4111038589
mayflower gmbh|senior fullstack engineer*in (w/d/m)|munich, bavaria, germany|https://www.linkedin.com/jobs/view/4136131521
mayflower gmbh|senior fullstack engineer*in (w/d/m)|würzburg, bavaria, germany|https://www.linkedin.com/jobs/view/3999082213
remondis it|oracle datenbankadministrator (m/w/d)|lünen, north rhine-westphalia, germany|https://www.linkedin.com/jobs/view/4095550107
mayflower gmbh|senior backend entwickler*in mit java, spring boot (w/d/m)|munich, bavaria, germany|https://www.linkedin.com/jobs/view/4014346661
swiss life deutschland|(junior) it-lizenzmanager (m/w/d)|hannover, lower saxony, germany|https://www.linkedin.com/jobs/view/4129480028
hoyer|kaufmännischer mitarbeiter (m/w/d) treasury & hedging|visselhövede, lower saxony, germany|https://www.linkedin.com/jobs/view/4026519126
tietalent|senior business development & sales manager m&a (m/w/d) – software / führende unternehmensgruppe|hamburg, hamburg, germany|https://www.linkedin.com/jobs/view/4137184441
datadiorama - it systemhaus für potsdam|netzwerk- und systemadministrator*in (m/w/d)|potsdam, brandenburg, germany|https://www.linkedin.com/jobs/view/4148164533
metergrid gmbh|praktikum im bereich projektmanagement und operations  in berlin(m/w/d)|berlin, berlin, germany|https://www.linkedin.com/jobs/view/4136765697
scalara|marketing manager w/m/d|cologne bonn region, worldwide|https://www.linkedin.com/jobs/view/4127752514
pechschwarz®|head of performance marketing (m/w/d)|wuppertal, north rhine-westphalia, germany|https://www.linkedin.com/jobs/view/4121369753
mayflower gmbh|senior python engineer*in mit schwerpunkt genai (w/d/m)|würzburg, bavaria, germany|https://www.linkedin.com/jobs/view/3993263129
u2d  up2date solutions gmbh|projektmanager event-software (m/w/d) u2d ventari|nuremberg, bavaria, germany|https://www.linkedin.com/jobs/view/4149462365
anschuetz gmbh|systemingenieur regelungstechnik control systems engineer (m/w/d)|kiel, schleswig-holstein, germany|https://www.linkedin.com/jobs/view/4126826438
wattify gmbh|youki - founders associate market|amberg, bavaria, germany|https://www.linkedin.com/jobs/view/3834269594
mayflower gmbh|senior python engineer*in mit schwerpunkt genai (w/d/m)|munich, bavaria, germany|https://www.linkedin.com/jobs/view/3993236571
thought leader systems|manager (m/w/d) webprojekte / websitekonzeption|frankfurt, hesse, germany|https://www.linkedin.com/jobs/view/3834257632
robotron datenbank-software gmbh|(senior -) software developer prognose & ki|dresden, saxony, germany|https://www.linkedin.com/jobs/view/4096842288
conny|werkstudent case management(m/w/d)|berlin, berlin, germany|https://www.linkedin.com/jobs/view/4124573862
mann+hummel|global solution architect network security (m/w/d)|ludwigsburg, baden-württemberg, germany|https://www.linkedin.com/jobs/view/4143653279
simon-kucher|sourcing manager it (m/w/d) – hamburg|hamburg, hamburg, germany|https://www.linkedin.com/jobs/view/4000332720
robotron datenbank-software gmbh|(senior) software developer prognose & ki (m/w/d)|leipzig, saxony, germany|https://www.linkedin.com/jobs/view/4133868863
metergrid gmbh|praktikum im sales management (saas)  (m/w/d)|germany|https://www.linkedin.com/jobs/view/4123163405
agilent technologies|serviceingenieur graduate (m/f/d) - flüssigchromatographie|mainz, rhineland-palatinate, germany|https://www.linkedin.com/jobs/view/4070757733
simon-kucher|sourcing manager it (m/w/d) – münchen|munich, bavaria, germany|https://www.linkedin.com/jobs/view/4000332495
swiss life deutschland|(junior) mathematiker (m/w/d) im risikomanagement mit schwerpunkt risikosysteme|munich, bavaria, germany|https://www.linkedin.com/jobs/view/4136770850
lapp group|duales studium: wirtschaftsinformatik – data science|stuttgart, baden-württemberg, germany|https://www.linkedin.com/jobs/view/4104797604
veeva systems|sales development program (germany)|berlin, germany|https://www.linkedin.com/jobs/view/4025588066
metergrid gmbh|praktikum im bereich partnermanagement und projektmanagement (m/w/d)|germany|https://www.linkedin.com/jobs/view/4122188853
stf gruppe|vermessungstechniker mobile mapping (m/w/d)|ratingen, north rhine-westphalia, germany|https://www.linkedin.com/jobs/view/4127273023
veeva systems|sales development program (germany)|germany|https://www.linkedin.com/jobs/view/4012332641
lisec iberica s.a|sales manager benelux und frankreich für softwareprodukte (m/w/d)|kassel, hesse, germany|https://www.linkedin.com/jobs/view/4146324081
orendt studios holding gmbh|key account manager (m/w/d)|düsseldorf, north rhine-westphalia, germany|https://www.linkedin.com/jobs/view/4141124838
vesterling ag|junior it sales consultant ms dynamics 365  ms business central, erp  hybrid/remote (mwd)|münster, north rhine-westphalia, germany|https://www.linkedin.com/jobs/view/4102264550
orendt studios holding gmbh|key account manager (m/w/d)|hamburg, hamburg, germany|https://www.linkedin.com/jobs/view/4141126361
tonicspaces|sales manager bei tonicspaces (m/w/d)|berlin, berlin, germany|https://www.linkedin.com/jobs/view/4138074699
krempel gmbh|senior specialist product engineering (m/w/d)|kuppenheim, baden-württemberg, germany|https://www.linkedin.com/jobs/view/4151346934
stadtverwaltung bad kissingen|ingenieur / bauingenieur für tiefbau (m/w/d)|bad kissingen, bavaria, germany|https://www.linkedin.com/jobs/view/4120676555
agicap deutschland|customer onboarding manager (m/w/d)|berlin, berlin, germany|https://www.linkedin.com/jobs/view/4105716770
thermo fisher scientific|dualen studenten (m/w/d)  betriebswirtschaftslehre dual b.sc. (m/w/d)|langenselbold, hesse, germany|https://www.linkedin.com/jobs/view/4142059555
berufsakademie rhein-main - university of cooperative education|duales studium wirtschaftsingenieurwesen digital management and engineering (bachelor of science)|frankfurt, hesse, germany|https://www.linkedin.com/jobs/view/4109518626
swiss life deutschland|enterprise architect (m/w/d)|hannover, lower saxony, germany|https://www.linkedin.com/jobs/view/4118297146
belform|senior projektleiter / projektmanager im innenausbau / objekteinrichtung in münchen (m/w/d)|munich, bavaria, germany|https://www.linkedin.com/jobs/view/4094472018
giesecke+devrient|procurement excellence manager (m/w/d)|munich, bavaria, germany|https://www.linkedin.com/jobs/view/4099932223
skopos|werkstudent (m/w/d) marktforschung - customer experience (cx) & communities|hürth, north rhine-westphalia, germany|https://www.linkedin.com/jobs/view/3834281423
provinzial konzern|solution designer - bereich rückversicherung (all genders)|greater munster area, worldwide|https://www.linkedin.com/jobs/view/4078620161
provinzial konzern|solution designer - bereich rückversicherung (all genders)|greater hamburg area, worldwide|https://www.linkedin.com/jobs/view/4102191238
iabg|programm-manager logistik und lifecycle management zukunftsthemen (m/w/d)|bonn, north rhine-westphalia, germany|https://www.linkedin.com/jobs/view/4131750765
shimadzu deutschland gmbh|service ingenieur*in / techniker*in icp & gc|berlin, berlin, germany|https://www.linkedin.com/jobs/view/4102773543
provinzial konzern|solution designer - bereich rückversicherung (all genders)|düsseldorf, north rhine-westphalia, germany|https://www.linkedin.com/jobs/view/4073739968
r+s group gmbh|ausbildung zum elektroniker für gebäudesystemintegration (m/w/d)|nesse-apfelstädt, thuringia, germany|https://www.linkedin.com/jobs/view/3972004297
wwm gmbh & co. kg|kaufmännischer sachbearbeiter (m/w/d)|monschau, north rhine-westphalia, germany|https://www.linkedin.com/jobs/view/3834278351
maxsolar gmbh|ausbildung kaufleute für büromanagement (m/w/d)  ausbildungsstart september 2025|grabenstätt, bavaria, germany|https://www.linkedin.com/jobs/view/4122608870
wwm gmbh & co. kg|kauffrau/-mann für büromanagement schwerpunkt finanzbuchhaltung & controlling (m/w/d)|monschau, north rhine-westphalia, germany|https://www.linkedin.com/jobs/view/3834283011
netto marken-discount|sachbearbeiter e-commerce (m/w/d)|regensburg, bavaria, germany|https://www.linkedin.com/jobs/view/4077600269
horeich|produktmanager:in und product owner steuerungs- und monitoringsysteme umwelt und infrastruktur in vollzeit|erlangen, bavaria, germany|https://www.linkedin.com/jobs/view/4126034336
fis informationssysteme und consulting gmbh|sap presales solution architekten ewm (m/w/d)|grafenrheinfeld, bavaria, germany|https://www.linkedin.com/jobs/view/4036015001
bechtle plm|account manager solidworks software lösungen außendienst (w/m/d)|nuremberg, bavaria, germany|https://www.linkedin.com/jobs/view/4119349674
join.com|eypro mugrauer & schnele gmbh: konstrukteur:in|neresheim, baden-württemberg, germany|https://www.linkedin.com/jobs/view/4080397974
heidelberger druckmaschinen ag|duales hochschulstudium bachelor of science wirtschaftsinformatik software engineering oder application management 2025 (m/w/d) - standort wiesloch-walldorf|wiesloch, baden-württemberg, germany|https://www.linkedin.com/jobs/view/3989304637
holidu|account manager ostsee (w/m/d)|hamburg, germany|https://www.linkedin.com/jobs/view/4139678003
r+s group gmbh|duales studium biss elektro- und informationstechnik (m/w/d)|fulda, hesse, germany|https://www.linkedin.com/jobs/view/4059236117
holidu|sales manager ostsee (w/m/d)|hamburg, germany|https://www.linkedin.com/jobs/view/4139675270
etl-gruppe|steuerfachangestellter (m/w/d)|bremen, bremen, germany|https://www.linkedin.com/jobs/view/4139177910
accenture dach|consultant business analyse – öffentliche verwaltung / public service (all genders)|kronberg, hesse, germany|https://www.linkedin.com/jobs/view/4058531532
holidu|account manager schwarzwald (w/m/d)|freiburg, baden-württemberg, germany|https://www.linkedin.com/jobs/view/4139670952
s&n systemhaus für netzwerk- und datentechnik gmbh|it dozent / trainer (m/w/d) in rostock|rostock, mecklenburg-west pomerania, germany|https://www.linkedin.com/jobs/view/4148259876
vattenfall|regionalleiter:in b2b - pv und wp projekte|cologne, north rhine-westphalia, germany|https://www.linkedin.com/jobs/view/4148122693
continentale versicherung|duales studium wirtschaftsmathematik - aktuarwissenschaften an der th rosenheim, bachelor of science|munich, bavaria, germany|https://www.linkedin.com/jobs/view/4122623586
kaufland e-commerce|übersetzer/translator (all genders) deutsch-italienisch|germany|https://www.linkedin.com/jobs/view/4152164383
vattenfall|regionalleiter:in b2b - pv und wp projekte|düsseldorf, north rhine-westphalia, germany|https://www.linkedin.com/jobs/view/4150335844
vattenfall|regionalleiter:in b2b - pv und wp projekte|berlin, berlin, germany|https://www.linkedin.com/jobs/view/4082182830
vattenfall|regionalleiter:in b2b - pv und wp projekte|hamburg, hamburg, germany|https://www.linkedin.com/jobs/view/4051001481
holidu|(junior) sales manager ostsee (w/m/d) rostock|greater rostock region, worldwide|https://www.linkedin.com/jobs/view/4149944198
holidu|account manager ostsee (w/m/d)|hamburg, hamburg, germany|https://www.linkedin.com/jobs/view/4055807624
die zeit|auszubildende medienkaufleute digital und print zeitverlag (d/w/m)|hamburg, hamburg, germany|https://www.linkedin.com/jobs/view/3945215411
helios kliniken gmbh|pflegeschulleitung dependance standort velbert (m/w/d)|wuppertal, north rhine-westphalia, germany|https://www.linkedin.com/jobs/view/4091905861
whatnot|software engineer, 2025 new grad|dublin, county dublin, ireland|https://www.linkedin.com/jobs/view/4149260099
solas it recruitment|support engineer - grad/junior|galway, county galway, ireland|https://www.linkedin.com/jobs/view/4132277167
analog devices|fy25 graduate software engineering opportunities|limerick, county limerick, ireland|https://www.linkedin.com/jobs/view/4018482472
mongodb|program coordinator|dublin, county dublin, ireland|https://www.linkedin.com/jobs/view/4150808638
analog devices|fy25 graduate electronic engineering opportunities|limerick, county limerick, ireland|https://www.linkedin.com/jobs/view/4018482473
analog devices|fy24 graduate electronic engineering opportunities|limerick, county limerick, ireland|https://www.linkedin.com/jobs/view/3814642546
psc biotech corporation|ehs specialist|carlow, county carlow, ireland|https://www.linkedin.com/jobs/view/4105437526
rizzi group srl|chief financial officer / cfo (m/w/d)|laces, trentino-alto adige, italy|https://www.linkedin.com/jobs/view/4146726439
altair|presales specialist – data analytics|turin, piedmont, italy|https://www.linkedin.com/jobs/view/3707666267
quadigi|paid c++ intership|lithuania, kaunas, worldwide|https://www.linkedin.com/jobs/view/4147627690
databricks|software engineer - new grad (2025 start)|amsterdam, north holland, netherlands|https://www.linkedin.com/jobs/view/4023888460
grafana labs|observability architect (remote, netherlands)|brabantine city row, worldwide|https://www.linkedin.com/jobs/view/4109311165
datek|embedded developer|oslo, norway|https://www.linkedin.com/jobs/view/4135542166
letsreg|chief technology officer|oslo, oslo, norway|https://www.linkedin.com/jobs/view/4104337070
aziwell|lead software engineer|trondheim, trøndelag, norway|https://www.linkedin.com/jobs/view/4135216017
