company|title|location|link
holidu|praktikum account management ostsee (w/m/d)|hamburg, hamburg, germany|https://www.linkedin.com/jobs/view/4312043438
plath ltd|volljurist/wirtschaftsjurist (m/w/d) contract & claim manager|hamburg, hamburg, germany|https://www.linkedin.com/jobs/view/4304270052
wayss & freytag ingenieurbau ag|arbeitsvorbereiter/terminplaner (m/w/d) im ingenieurbau|hamburg, hamburg, germany|https://www.linkedin.com/jobs/view/4245929947
bwi gmbh|senior it system administrator netzwerk - unterstützung der bundeswehr im ausland (m/w/d)|hamburg, hamburg, germany|https://www.linkedin.com/jobs/view/4312573846
swiss life lebensversicherung se|enterprise architect (m/w/d)|hannover, lower saxony, germany|https://www.linkedin.com/jobs/view/4292967436
chicago organizing|graduate it support|london, england, united kingdom|https://www.linkedin.com/jobs/view/4315384320
chicago organizing|graduate trading application support|london, england, united kingdom|https://www.linkedin.com/jobs/view/4315377666
palantir technologies|software engineer, new grad - infrastructure|london, england, united kingdom|https://www.linkedin.com/jobs/view/4277542207
palantir technologies|software engineer, new grad - production infrastructure|london, england, united kingdom|https://www.linkedin.com/jobs/view/4277540268
palantir technologies|product designer, new grad - developer experience|london, england, united kingdom|https://www.linkedin.com/jobs/view/4288259577
retired catholic priest - non-denominational wedding minister|trainee recruitment consultant- immediate start!|london, england, united kingdom|https://www.linkedin.com/jobs/view/4290435345
alfa financial software|technology consulting graduate programme (2026)|london area, united kingdom|https://www.linkedin.com/jobs/view/4309233574
targetjobs uk|manchester software engineering graduate programme 2026 - 2027|manchester, england, united kingdom|https://www.linkedin.com/jobs/view/4311631058
swiss life deutschland|software testmanager (m/w/d)|munich, bavaria, germany|https://www.linkedin.com/jobs/view/4311978744
mayflower gmbh|senior fullstack engineer*in (w/d/m)|munich, bavaria, germany|https://www.linkedin.com/jobs/view/4136131521
mayflower gmbh|senior python engineer*in mit schwerpunkt genai (w/d/m)|munich, bavaria, germany|https://www.linkedin.com/jobs/view/3993236571
eagleburgmann|application engineer (w/m/d)|wolfratshausen, bavaria, germany|https://www.linkedin.com/jobs/view/4284430737
kertos|office manager & teamassistenz (all genders)|munich, bavaria, germany|https://www.linkedin.com/jobs/view/4305868634
marktguru deutschland - ein unternehmen der prosiebensat.1 media se|werkstudent (m/w/d) it administration & support|munich, bavaria, germany|https://www.linkedin.com/jobs/view/4308767251
simon-kucher|senior consultant data engineering (m/w/d)|munich, bavaria, germany|https://www.linkedin.com/jobs/view/4221531742
mayflower gmbh|senior ai solutions engineer*in (w/d/m)|munich, bavaria, germany|https://www.linkedin.com/jobs/view/4284768159
kertos|ai business development representative (all genders)|munich, bavaria, germany|https://www.linkedin.com/jobs/view/4266623336
bwi gmbh|senior it system administrator netzwerk - unterstützung der bundeswehr im ausland (m/w/d)|munich, bavaria, germany|https://www.linkedin.com/jobs/view/4312575743
kannegiesser|konstrukteur maschinenbau (m/w/d)|vlotho, north rhine-westphalia, germany|https://www.linkedin.com/jobs/view/4219182359
samson kt-elektronik|senior softwareentwickler (m/w/d) – golang / typescript / devops|berlin, berlin, germany|https://www.linkedin.com/jobs/view/4307507470
simon-kucher|senior consultant data engineering (m/w/d)|berlin, berlin, germany|https://www.linkedin.com/jobs/view/4221529862
simon-kucher|senior consultant data engineering (m/w/d)|cologne, north rhine-westphalia, germany|https://www.linkedin.com/jobs/view/4221530788
1komma5°|inside sales coordinator (m/w/d) für intelligente energiesysteme - 1komma5° kassel|kassel, hesse, germany|https://www.linkedin.com/jobs/view/4306536867
bettercallpaul|abschlussarbeit bachelor/master: clouds|haar, bavaria, germany|https://www.linkedin.com/jobs/view/4296222625
skopos|werkstudent (m/w/d) marktforschung - customer experience (cx) & communities|hürth, north rhine-westphalia, germany|https://www.linkedin.com/jobs/view/4299216488
hoyer|kaufmännischer sachbearbeiter (m/w/d) im backoffice in großenstein|braunichswalde, thuringia, germany|https://www.linkedin.com/jobs/view/4312424879
tv 2 danmark|data engineer til vores play content recommendations team|odense, region of southern denmark, denmark|https://www.linkedin.com/jobs/view/4305570865
tv 2 danmark|process owner med speciale i it service management|odense, region of southern denmark, denmark|https://www.linkedin.com/jobs/view/4306253371
simtech - cluster of excellence  university of stuttgart|wissenschaftlicher mitarbeiter (m/w/d) im bereich integrations- und systemtests für virtualisierte echtzeitsteuerungen|stuttgart region, worldwide|https://www.linkedin.com/jobs/view/4309753778
ohb digital services gmbh|proposal manager für satellitendatenservices / resilienz (m/w/d) (m/w/d)|bremen, bremen, germany|https://www.linkedin.com/jobs/view/4314080310
shimadzu deutschland gmbh|service ingenieur*in / techniker*in lc/lc-ms|munich, bavaria, germany|https://www.linkedin.com/jobs/view/4311986972
stf gruppe|vermessungstechniker mobile mapping (m/w/d)|münster, north rhine-westphalia, germany|https://www.linkedin.com/jobs/view/4312284250
stf gruppe|vermessungstechniker mobile mapping (m/w/d)|bonn, north rhine-westphalia, germany|https://www.linkedin.com/jobs/view/4312270420
knowit|kubernetes-specialist|copenhagen municipality, capital region of denmark, denmark|https://www.linkedin.com/jobs/view/4256197362
stf gruppe|vermessungstechniker mobile mapping (m/w/d)|fulda, hesse, germany|https://www.linkedin.com/jobs/view/4312283293
salesforce|commercial graduate rotation program - german speaker|dublin, county dublin, ireland|https://www.linkedin.com/jobs/view/4268668338
wayss & freytag ingenieurbau ag|junior arbeitsvorbereiter (m/w/d)|munich, bavaria, germany|https://www.linkedin.com/jobs/view/4302588339
deloitte|2026 future leaders academy: roi tax & legal - gi3 (global investment and innovation incentives) graduate opportunities|dublin, county dublin, ireland|https://www.linkedin.com/jobs/view/4296603099
s&n systemhaus für netzwerk- und datentechnik gmbh|it dozent / trainer (m/w/d) in rostock|rostock, mecklenburg-west pomerania, germany|https://www.linkedin.com/jobs/view/4301865389
cinestar deutschland|head of financial accounting & tax (m/w/d)|lübeck, schleswig-holstein, germany|https://www.linkedin.com/jobs/view/4312055116
sfb 1313  university of stuttgart|wissenschaftlicher mitarbeiter (m/w/d) im bereich integrations- und systemtests für virtualisierte echtzeitsteuerungen|stuttgart region, worldwide|https://www.linkedin.com/jobs/view/4308788550
salesforce|commercial graduate rotation program - dutch speakers (february start)|dublin, county dublin, ireland|https://www.linkedin.com/jobs/view/4305600336
salesforce|commercial graduate rotation program - norwegian speakers (february start)|dublin, county dublin, ireland|https://www.linkedin.com/jobs/view/4266718500
ascom americas|regional marketing specialist dach (m/w/d) - befristet für 1 jahr|frankfurt rhine-main metropolitan area, worldwide|https://www.linkedin.com/jobs/view/4261601468
etl-gruppe|steuerassistent (m/w/d)|bremen, bremen, germany|https://www.linkedin.com/jobs/view/4289611525
heidelberger druckmaschinen ag|duales hochschulstudium bachelor of science wirtschaftsinformatik software engineering oder application management 2026 (m/w/d) - standort wiesloch-walldorf|wiesloch, baden-württemberg, germany|https://www.linkedin.com/jobs/view/4283202297
aurantia|steuerfachangestellte:r|gelsenkirchen, north rhine-westphalia, germany|https://www.linkedin.com/jobs/view/4311990002
plath ltd|volljurist/wirtschaftsjurist (m/w/d) contract & claim manager|munich, bavaria, germany|https://www.linkedin.com/jobs/view/4306544706
bwi gmbh|duales studium zum bachelor of science in wirtschaftsinformatik ki & data science inkl. ausbildung zum fachinformatiker anwendungsentwicklung (m/w/d)|munich, bavaria, germany|https://www.linkedin.com/jobs/view/4303079477
bwi gmbh|senior it system administrator netzwerk - unterstützung der bundeswehr im ausland (m/w/d)|lohheide, north rhine-westphalia, germany|https://www.linkedin.com/jobs/view/4312585561
bwi gmbh|senior it system administrator netzwerk - unterstützung der bundeswehr im ausland (m/w/d)|berlin, berlin, germany|https://www.linkedin.com/jobs/view/4312583607
bwi gmbh|senior it system administrator netzwerk - unterstützung der bundeswehr im ausland (m/w/d)|nuremberg, bavaria, germany|https://www.linkedin.com/jobs/view/4312574787
bwi gmbh|duales studium zum bachelor of science in wirtschaftsinformatik ki & data science inkl. ausbildung zum fachinformatiker systemintegration (m/w/d)|frankfurt am main, hesse, germany|https://www.linkedin.com/jobs/view/4303079478
volkswagen group services gmbh|duales studium 2026 i logistik- und informationsmanagement (m/w/d)|wolfsburg, lower saxony, germany|https://www.linkedin.com/jobs/view/4259762932
bwi gmbh|duales studium zum bachelor of science in wirtschaftsinformatik cyber security inkl. ausbildung zum fachinformatiker anwendungsentwicklung (m/w/d)|wilhelmshaven, lower saxony, germany|https://www.linkedin.com/jobs/view/4303093295
kaufland e-commerce|übersetzer/posteditor (all genders) deutsch-spanisch|germany|https://www.linkedin.com/jobs/view/4298691799
bairesdev|internal communications and community management analyst - remote work  ref#154975|pereira, risaralda, colombia|https://www.linkedin.com/jobs/view/4258060635
bitpanda|graduate, java software engineer (core trading services)|vienna, vienna, austria|https://www.linkedin.com/jobs/view/4312976083
sentry|software engineer, intern (summer 2026)|innere stadt, vienna, austria|https://www.linkedin.com/jobs/view/4309395824
canonical|technical author (multiple roles and seniority levels)|vienna, vienna, austria|https://www.linkedin.com/jobs/view/4068264854
canonical|software engineer - python - ubuntu pro client - graduate level|vienna, vienna, austria|https://www.linkedin.com/jobs/view/4233273386
anton paar|university graduate in natural sciences (f/m/x)|graz, styria, austria|https://www.linkedin.com/jobs/view/4314286153
canonical|graduate sales development representative|vienna, vienna, austria|https://www.linkedin.com/jobs/view/4284584613
segula technologies|automation software lead engineer (m/f/d)|graz, styria, austria|https://www.linkedin.com/jobs/view/4292219936
segula technologies|automation engineer tissue pilot plant (m/w/d)|graz, styria, austria|https://www.linkedin.com/jobs/view/4294451436
segula technologies|it business analyst für produktdatenmanagement & change management (m/w/d)|graz, styria, austria|https://www.linkedin.com/jobs/view/4245438452
canonical|engineering manager|vienna, vienna, austria|https://www.linkedin.com/jobs/view/4204745116
anker innovations ltd|gtm specialist, 2026 graduate|baku, baku ekonomic zone, worldwide|https://www.linkedin.com/jobs/view/4315157453
techwolf|junior software engineer|ghent, flemish region, belgium|https://www.linkedin.com/jobs/view/4292925114
vivid resourcing|graduate/ junior-  software .net developer|ghent, flemish region, belgium|https://www.linkedin.com/jobs/view/4307883071
nxp semiconductors|junior embedded software engineer - machine learning|leuven, flemish region, belgium|https://www.linkedin.com/jobs/view/4311585193
redwire space europe|accounts payable (ap) accountant|kruibeke, flemish region, belgium|https://www.linkedin.com/jobs/view/4285381765
axa|tech graduate program|brussels region, belgium|https://www.linkedin.com/jobs/view/4301372762
axa|tech graduate program.|brussels region, belgium|https://www.linkedin.com/jobs/view/4301548869
canonical|technical author (multiple roles and seniority levels)|brussels, brussels region, belgium|https://www.linkedin.com/jobs/view/4068265695
zetes|junior accountant|brussels region, belgium|https://www.linkedin.com/jobs/view/4314138425
canonical|software engineer - python - ubuntu pro client - graduate level|antwerp, flemish region, belgium|https://www.linkedin.com/jobs/view/4233271679
capgemini|junior software developer sap|diegem, flemish region, belgium|https://www.linkedin.com/jobs/view/4298725471
vivid resourcing|mechanical engineer aerospace engines|herentals, flemish region, belgium|https://www.linkedin.com/jobs/view/4311113058
gsk|engineering graduate programme, belgium, 2026|wavre, walloon region, belgium|https://www.linkedin.com/jobs/view/4308956712
sopra steria|life sciences quality and compliance engineer|machelen, flemish region, belgium|https://www.linkedin.com/jobs/view/4215794390
victaulic|laboratory technician|nazareth, flemish region, belgium|https://www.linkedin.com/jobs/view/4315683087
ppg|entry-level engineer – fire protection|antwerp, flemish region, belgium|https://www.linkedin.com/jobs/view/4308971782
canonical|graduate sales development representative|antwerp, flemish region, belgium|https://www.linkedin.com/jobs/view/4274681128
silverfin|young graduate customer experience|ghent, flemish region, belgium|https://www.linkedin.com/jobs/view/4311385895
barco|embedded software engineer|kortrijk, flemish region, belgium|https://www.linkedin.com/jobs/view/4267169753
hilti group|hilti graduate program - sales / business track|anderlecht, brussels region, belgium|https://www.linkedin.com/jobs/view/4308575304
boston consulting group (bcg)|it associate - platinion - graduates 2026|brussels, brussels region, belgium|https://www.linkedin.com/jobs/view/4297182529
bd nogales norte|entry-level sales executive - multilingual|erembodegem, flemish region, belgium|https://www.linkedin.com/jobs/view/4299813618
canonical|engineering manager|brussels, brussels region, belgium|https://www.linkedin.com/jobs/view/4204747083
canonical|engineering manager|antwerp, flemish region, belgium|https://www.linkedin.com/jobs/view/4204741770
siemens digital industries software|strategic student program belgium, simcenter simulation and test solutions  (sts)|leuven, flemish region, belgium|https://www.linkedin.com/jobs/view/4314798360
esri belux|business manager - training (gis)|wemmel, flemish region, belgium|https://www.linkedin.com/jobs/view/4305361310
canonical|ubuntu security engineer|brussels, brussels region, belgium|https://www.linkedin.com/jobs/view/4284596722
wanaka partners|financial & administrative support|antwerp, flemish region, belgium|https://www.linkedin.com/jobs/view/4304668680
kla|customer support engineer|leuven, flemish region, belgium|https://www.linkedin.com/jobs/view/4294446902
canonical|ubuntu security engineer|antwerp, flemish region, belgium|https://www.linkedin.com/jobs/view/4284901334
canonical|engineering manager - security standards and hardening|antwerp, flemish region, belgium|https://www.linkedin.com/jobs/view/4284595534
inetum-realdolmen|principal consultant cloud|brussels, brussels region, belgium|https://www.linkedin.com/jobs/view/4153825178
procter & gamble|pc&is automation technician (process control & industrial systems) - mechelen plant|mechelen, flemish region, belgium|https://www.linkedin.com/jobs/view/4271600041
kriete truck centers|heavy duty diesel technician - 2nd shift|on, walloon region, belgium|https://www.linkedin.com/jobs/view/4305779333
kriete truck centers|heavy duty diesel technician - 2nd shift|on, walloon region, belgium|https://www.linkedin.com/jobs/view/4305770500
kriete truck centers|heavy duty diesel technician - 2nd shift|on, walloon region, belgium|https://www.linkedin.com/jobs/view/4305779334
kriete truck centers|heavy duty diesel technician - 2nd shift|on, walloon region, belgium|https://www.linkedin.com/jobs/view/4305776436
pm group|team lead process & process mechanical - benelux|antwerp, flemish region, belgium|https://www.linkedin.com/jobs/view/4235667289
copeland|senior controls advanced manufacturing engineer|welkenraedt, walloon region, belgium|https://www.linkedin.com/jobs/view/4277742891
emerson|internal project orders specialist|liege metropolitan area, worldwide|https://www.linkedin.com/jobs/view/4302011329
kpmg delivery network bulgaria llc|junior low-code developer|sofia, sofia city, worldwide|https://www.linkedin.com/jobs/view/4270798842
ukg|junior .net software engineer|sofia, sofia city, worldwide|https://www.linkedin.com/jobs/view/4188540533
ukg|junior .net software engineer|varna, varna, worldwide|https://www.linkedin.com/jobs/view/4206219390
sap|junior developer - genai ci/cd tooling|sofia, sofia city, worldwide|https://www.linkedin.com/jobs/view/4310915902
canonical|software engineer - python - ubuntu pro client - graduate level|plovdiv, plovdiv, worldwide|https://www.linkedin.com/jobs/view/4233271700
canonical|technical author (multiple roles and seniority levels)|sofia, sofia city, worldwide|https://www.linkedin.com/jobs/view/4068267624
canonical|software engineer - python - ubuntu pro client - graduate level|sofia, sofia city, worldwide|https://www.linkedin.com/jobs/view/4233273373
canonical|technical author (multiple roles and seniority levels)|plovdiv, plovdiv, worldwide|https://www.linkedin.com/jobs/view/4068264835
techoutlet|business development|sofia, sofia city, worldwide|https://www.linkedin.com/jobs/view/4308759382
worley|graduate process engineer|sofia, sofia city, worldwide|https://www.linkedin.com/jobs/view/4305708621
canonical|engineering manager|plovdiv, plovdiv, worldwide|https://www.linkedin.com/jobs/view/4204746106
softserve|office administrator|sofia, sofia city, worldwide|https://www.linkedin.com/jobs/view/4310061124
ukg|services project manager|varna, varna, worldwide|https://www.linkedin.com/jobs/view/4281332212
canonical|ubuntu security engineer|sofia, sofia city, worldwide|https://www.linkedin.com/jobs/view/4284594917
canonical|ubuntu security engineer|plovdiv, plovdiv, worldwide|https://www.linkedin.com/jobs/view/4284598478
ringcentral|technical account manager (rcx/rccc)|bulgaria, sofia city, worldwide|https://www.linkedin.com/jobs/view/4298396594
sap|senior developer, ai incubation - fixed-term contract|sofia, sofia city, worldwide|https://www.linkedin.com/jobs/view/4306112399
emerson|service engineer|burgas, burgas, worldwide|https://www.linkedin.com/jobs/view/4291062710
canonical|engineering manager - ubuntu security|plovdiv, plovdiv, worldwide|https://www.linkedin.com/jobs/view/4284596003
canonical|software platform engineering manager - ubuntu for next-gen silicon|sofia, sofia city, worldwide|https://www.linkedin.com/jobs/view/4210795944
canonical|software engineer - python - ubuntu pro client - graduate level|zagreb, zagreb, worldwide|https://www.linkedin.com/jobs/view/4233272494
allianz|graduate programme -junior actuary|croatia, zagreb, worldwide|https://www.linkedin.com/jobs/view/4312582823
canonical|graduate sales development representative|zagreb, zagreb, worldwide|https://www.linkedin.com/jobs/view/4284581962
canonical|engineering manager|zagreb, zagreb, worldwide|https://www.linkedin.com/jobs/view/4204741780
emerson|sales engineer|zagreb, zagreb, worldwide|https://www.linkedin.com/jobs/view/4292394239
canonical|ubuntu security engineer|zagreb, zagreb, worldwide|https://www.linkedin.com/jobs/view/4284901365
canonical|software platform engineering manager - ubuntu for next-gen silicon|zagreb, zagreb, worldwide|https://www.linkedin.com/jobs/view/4211300637
canonical|engineering manager - ubuntu security|zagreb, zagreb, worldwide|https://www.linkedin.com/jobs/view/4284590932
canonical|engineering manager - security standards and hardening|zagreb, zagreb, worldwide|https://www.linkedin.com/jobs/view/4284596505
netu group|full stack developer|nicosia, nicosia, worldwide|https://www.linkedin.com/jobs/view/4111982488
ebos|full stack software developer|nicosia, nicosia, worldwide|https://www.linkedin.com/jobs/view/4313729453
netu group|it business analyst|nicosia, nicosia, worldwide|https://www.linkedin.com/jobs/view/4111983382
netu group|full stack software developer|cyprus, nicosia, worldwide|https://www.linkedin.com/jobs/view/4307866799
cognyte|graduate electrical engineer|cyprus, limassol, worldwide|https://www.linkedin.com/jobs/view/4315120883
openway|junior engineer (support)|nicosia, nicosia, worldwide|https://www.linkedin.com/jobs/view/4302362211
netu group|senior business analyst|cyprus, nicosia, worldwide|https://www.linkedin.com/jobs/view/4315696205
openway|junior engineer (implementation)|cyprus, nicosia, worldwide|https://www.linkedin.com/jobs/view/4302372153
netu group|senior full stack developer|nicosia, nicosia, worldwide|https://www.linkedin.com/jobs/view/4111987020
netu group|devops engineer (ci/cd)|nicosia, nicosia, worldwide|https://www.linkedin.com/jobs/view/4223748311
physics world|postdoc/phd position: advanced x-ray crystallographic data treatment and analysis system (279)|dominican republic, worldwide|https://www.linkedin.com/jobs/view/4296268487
datadiorama - it systemhaus für potsdam|netzwerk- und systemadministrator*in (m/w/d)|potsdam, brandenburg, germany|https://www.linkedin.com/jobs/view/4301893210
arvana gmbh|key account manager (m/w/d)|berlin, berlin, germany|https://www.linkedin.com/jobs/view/4313310175
skopos|werkstudent (m/w/d) marktforschung - customer experience (cx) & communities|hürth, north rhine-westphalia, germany|https://www.linkedin.com/jobs/view/4296400757
california therapy services|home health physical therapist (pt)|los angeles, canada|https://www.linkedin.com/jobs/view/4304595153
california therapy services|home health physical therapist (pt)|altadena, canada|https://www.linkedin.com/jobs/view/4303199957
california therapy services|home health physical therapist (pt)|los angeles, canada|https://www.linkedin.com/jobs/view/4308503758
california therapy services|home health physical therapist (pt)|pasadena, canada|https://www.linkedin.com/jobs/view/4308874178
mayflower gmbh|senior fullstack engineer*in (w/d/m)|würzburg, bavaria, germany|https://www.linkedin.com/jobs/view/3999082213
investsuite|product engineer|leuven, flemish region, belgium|https://www.linkedin.com/jobs/view/4297516265
stadtgemeinde zistersdorf|bautechniker:in|zistersdorf, lower austria, austria|https://www.linkedin.com/jobs/view/4313303476
mitte|steuerfachangestellter (m/w/d)|bremen, bremen, germany|https://www.linkedin.com/jobs/view/4313311446
bwi gmbh|senior it system administrator netzwerk - unterstützung der bundeswehr im ausland (m/w/d)|ulm, baden-württemberg, germany|https://www.linkedin.com/jobs/view/4312589354
burns & mcdonnell|assistant electrical engineer- mission critical (london)|london, england, united kingdom|https://www.linkedin.com/jobs/view/4248193305
iabg|senior projektleiter software engineering (m/w/d)|ottobrunn, bavaria, germany|https://www.linkedin.com/jobs/view/4244037018
deloitte|2026 future leaders academy: roi (dublin) tax & legal - tax technology consulting graduate opportunities|dublin, county dublin, ireland|https://www.linkedin.com/jobs/view/4296496744
instaffo|vertragsmanager im competence center vertrieb|lübeck, schleswig-holstein, germany|https://www.linkedin.com/jobs/view/4299409603
synpulse8 deutschland gmbh|vertriebsunterstützung (innendienst) (m/w/d)|ulm, baden-württemberg, germany|https://www.linkedin.com/jobs/view/4303443035
wayss & freytag ingenieurbau ag|arbeitsvorbereiter (m/w/d)|düsseldorf, north rhine-westphalia, germany|https://www.linkedin.com/jobs/view/4217404109
continentale versicherung|duales studium wirtschaftsmathematik - aktuarwissenschaften an der th rosenheim, bachelor of science|munich, bavaria, germany|https://www.linkedin.com/jobs/view/4281258573
