company|title|location|link
lime technologies|technical project manager trainee|stockholm, stockholm county, sweden|https://www.linkedin.com/jobs/view/4167004869
canonical|engineering manager|stockholm, stockholm county, sweden|https://www.linkedin.com/jobs/view/4127923422
canonical|cloud field engineering manager|stockholm, stockholm county, sweden|https://www.linkedin.com/jobs/view/4174166192
canonical|software engineer - python - container images|tallinn, harjumaa, worldwide|https://www.linkedin.com/jobs/view/4068188034
canonical|software engineer - python - container images|tallinn, harjumaa, worldwide|https://www.linkedin.com/jobs/view/4089853698
canonical|software engineer - python - container images|tallinn, harjumaa, worldwide|https://www.linkedin.com/jobs/view/4117657501
canonical|engineering manager - ubuntu for next-gen silicon|tallinn, harjumaa, worldwide|https://www.linkedin.com/jobs/view/4160783079
tietoevry|software developer - tietoevry banking (m/f/d)|trondheim, trøndelag, norway|https://www.linkedin.com/jobs/view/4152291100
canonical|graduate software engineer, open source and linux, canonical ubuntu|valencia, valencian community, spain|https://www.linkedin.com/jobs/view/4180958649
analog devices|engineer, product engineering|greater valencia metropolitan area, worldwide|https://www.linkedin.com/jobs/view/4103358182
canonical|software engineer - python - container images|valencia, valencian community, spain|https://www.linkedin.com/jobs/view/4168064319
canonical|software engineer - python - container images|valencia, valencian community, spain|https://www.linkedin.com/jobs/view/4138526995
canonical|cloud professional services manager|valencia, valencian community, spain|https://www.linkedin.com/jobs/view/4173816033
canonical|engineering manager - ubuntu security|valencia, valencian community, spain|https://www.linkedin.com/jobs/view/4170112230
canonical|software engineer - python - container images|vienna, vienna, austria|https://www.linkedin.com/jobs/view/4168060894
canonical|software engineer - python - container images|vienna, vienna, austria|https://www.linkedin.com/jobs/view/4117659415
canonical|software engineer - python - container images|vienna, vienna, austria|https://www.linkedin.com/jobs/view/4089851765
canonical|software engineer - python - container images|vienna, vienna, austria|https://www.linkedin.com/jobs/view/4138529494
canonical|software engineer - python - container images|vienna, vienna, austria|https://www.linkedin.com/jobs/view/4089850820
canonical|engineering manager|vienna, vienna, austria|https://www.linkedin.com/jobs/view/4127922698
terma group|rf engineer - space ground segment egse (rf-scoe)|vienna, austria|https://www.linkedin.com/jobs/view/4161533424
österreichische post ag|trainee growth management e-commerce (w/m/d)|vienna, vienna, austria|https://www.linkedin.com/jobs/view/4172040479
canonical|cloud field engineering manager|vienna, vienna, austria|https://www.linkedin.com/jobs/view/4174163680
canonical|iot solutions architecture manager|vienna, vienna, austria|https://www.linkedin.com/jobs/view/4173814228
yougov|graduate backend engineer - python|warsaw, mazowieckie, poland|https://www.linkedin.com/jobs/view/4184032235
emerson|graduate engineer|warsaw, mazowieckie, poland|https://www.linkedin.com/jobs/view/4177395164
pathway|r&d ai software engineer / end-to-end machine learning engineer / rag and llm|warsaw, mazowieckie, poland|https://www.linkedin.com/jobs/view/4090225952
renesas electronics|graduate technical sales engineer (warsaw,poland)|warsaw, mazowieckie, poland|https://www.linkedin.com/jobs/view/4150465862
canonical|software engineer - python - container images|warsaw, mazowieckie, poland|https://www.linkedin.com/jobs/view/4068180955
canonical|software engineer - python - container images|warsaw, mazowieckie, poland|https://www.linkedin.com/jobs/view/4089849859
visa|data & insights analyst|warsaw, mazowieckie, poland|https://www.linkedin.com/jobs/view/4172543247
emerson|intermediate application developer|warsaw, mazowieckie, poland|https://www.linkedin.com/jobs/view/4187468971
yougov|graduate llmops engineer|warsaw, mazowieckie, poland|https://www.linkedin.com/jobs/view/4184032247
simcorp|software engineer for investment operations|warsaw, mazowieckie, poland|https://www.linkedin.com/jobs/view/4153177251
nvidia|manager, deep learning algorithms|warsaw, mazowieckie, poland|https://www.linkedin.com/jobs/view/4074374352
bunge|senior data engineer|warsaw, mazowieckie, poland|https://www.linkedin.com/jobs/view/4188855538
emerson|product support engineer (technical and customer support)|warsaw, mazowieckie, poland|https://www.linkedin.com/jobs/view/4161558478
akademeia high school|school counsellor|warsaw, mazowieckie, poland|https://www.linkedin.com/jobs/view/4175817233
sunscrapers|senior data engineer (w/ devops)|warsaw, mazowieckie, poland|https://www.linkedin.com/jobs/view/4133346146
indegene|graphic designer- german speaking|warsaw, mazowieckie, poland|https://www.linkedin.com/jobs/view/4177134698
percona|senior technical writer - postgresql and valkey|warsaw, mazowieckie, poland|https://www.linkedin.com/jobs/view/4140320145
copeland|sales manager industrial refrigeration dach (m/f/d)|warsaw, mazowieckie, poland|https://www.linkedin.com/jobs/view/3973035057
copeland|sales manager industrial refrigeration dach (m/f/d)|warsaw, mazowieckie, poland|https://www.linkedin.com/jobs/view/4067614055
cd projekt red|intern in online services team (java)|warsaw, mazowieckie, poland|https://www.linkedin.com/jobs/view/4184674298
cd projekt red|intern in online services team (c++)|warsaw, mazowieckie, poland|https://www.linkedin.com/jobs/view/4184673276
equinix|2025 opportunity development summer intern with french|warsaw, mazowieckie, poland|https://www.linkedin.com/jobs/view/4168129985
alexandra marine and general hospital (amgh)|financial analyst|goderich, ontario, canada|https://www.linkedin.com/jobs/view/4182624323
kpmg, microsoft business solutions malta|junior programmer - graduates programme|malta, worldwide|https://www.linkedin.com/jobs/view/4141136344
oracle|software engineer suiteanalytics - fresh graduate|brno, south moravia, worldwide|https://www.linkedin.com/jobs/view/4178535605
ntt data europe & latam|new graduate - information technology/stem|bari, apulia, italy|https://www.linkedin.com/jobs/view/4189440272
ntt data europe & latam|new graduate - information technology/stem|naples, campania, italy|https://www.linkedin.com/jobs/view/4189439393
punch consulting engineers|graduate engineer|corrandulla, county galway, ireland|https://www.linkedin.com/jobs/view/4189401140
horizon quantum|intern - quantum computing scientist (dublin)|dublin, county dublin, ireland|https://www.linkedin.com/jobs/view/4152761649
iakta srl|neolaureato/a full stack & ai developer – progetti di sviluppo web e intelligenza artificiale|turin, piedmont, italy|https://www.linkedin.com/jobs/view/4168409539
hayes mechanical & engineering ltd|junior/graduate mechanical engineer|ballintober, county roscommon, ireland|https://www.linkedin.com/jobs/view/4053797137
elavon europe|graduate engineer|arklow, county wicklow, ireland|https://www.linkedin.com/jobs/view/4184299975
we build ai|trainee ai engineer (w/d/m)|cologne, north rhine-westphalia, germany|https://www.linkedin.com/jobs/view/4178759392
samsara|software engineering intern - poland|poland|https://www.linkedin.com/jobs/view/4141649422
oracle|software engineer in access control team- fresh graduate|brno, south moravia, worldwide|https://www.linkedin.com/jobs/view/4145374105
sap|junior developer (ux engineering team)|brno, south moravia, worldwide|https://www.linkedin.com/jobs/view/4072499585
chanelle pharma|r&d graduate|loughrea, county galway, ireland|https://www.linkedin.com/jobs/view/4168163766
taod consulting gmbh|trainee ai engineer (m/w/d) - 12 monate|cologne, north rhine-westphalia, germany|https://www.linkedin.com/jobs/view/4160073968
ubs|tech graduate program – data engineer|wrocław, dolnośląskie, poland|https://www.linkedin.com/jobs/view/4177758560
oracle|software engineer in access control team - fresh graduate|brno, south moravia, worldwide|https://www.linkedin.com/jobs/view/4182116236
unilin|young graduate microsoft stack/angular software engineer|wielsbeke, flemish region, belgium|https://www.linkedin.com/jobs/view/4125859256
ge-n.nl  graduate engineer - network|junior plc/ software engineer|breda, north brabant, netherlands|https://www.linkedin.com/jobs/view/4169166853
cegeka|young graduate - junior java developer (september 2025)|flemish region, belgium|https://www.linkedin.com/jobs/view/4127612319
canonical|graduate software engineer, open source and linux, canonical ubuntu|amsterdam, north holland, netherlands|https://www.linkedin.com/jobs/view/4180961258
take-off|oferta: associate consultant trainee (m/f) - ericeira/mafra|lisbon, lisbon, portugal|https://www.linkedin.com/jobs/view/3639891055
cegeka|young graduate - software development consultant (september 2025)|flemish region, belgium|https://www.linkedin.com/jobs/view/4127609804
kla|new college graduate engineer|leuven, flemish region, belgium|https://www.linkedin.com/jobs/view/4157298732
chanelle pharma|finance graduate|loughrea, county galway, ireland|https://www.linkedin.com/jobs/view/4168163768
siemens|functional tester trainee (m/f/d)|matosinhos, porto, portugal|https://www.linkedin.com/jobs/view/4180268609
oracle|software engineer in test in access control team - fresh graduate|brno, south moravia, worldwide|https://www.linkedin.com/jobs/view/4182115459
canonical|software engineer - python - ubuntu pro client - graduate level|lille, hauts-de-france, france|https://www.linkedin.com/jobs/view/4180688697
mauritius network services ltd|mns empoweru – graduate programme 2025|oberderdingen, baden-württemberg, germany|https://www.linkedin.com/jobs/view/4170774820
canonical|software engineer - python - ubuntu pro client - graduate level|lisbon, lisbon, portugal|https://www.linkedin.com/jobs/view/4180693435
neodyne|electrical engineering graduate programme 2025 waterford|waterford, county waterford, ireland|https://www.linkedin.com/jobs/view/4146737211
sunscrapers|data engineer|poland|https://www.linkedin.com/jobs/view/4081231860
aelis|consultor junior sage 200 madrid/barcelona - recién graduados ade/economía|madrid, community of madrid, spain|https://www.linkedin.com/jobs/view/4170789224
murphy|graduate design engineer|kildare, county kildare, ireland|https://www.linkedin.com/jobs/view/4188215274
canonical|graduate software engineer, open source and linux, canonical ubuntu|bucharest, bucharest, romania|https://www.linkedin.com/jobs/view/4180961261
westermo network technologies|trainee program at westermo|stora sundby, södermanland county, sweden|https://www.linkedin.com/jobs/view/4174432510
nokia|software tester - summer trainee (wrocław)|wrocław, dolnośląskie, poland|https://www.linkedin.com/jobs/view/4169398440
canonical|graduate software engineer, open source and linux, canonical ubuntu|timişoara, timiş, romania|https://www.linkedin.com/jobs/view/4180956958
noesis|ofera de emprego: trainee java - coimbra (m/f)|coimbra, coimbra, portugal|https://www.linkedin.com/jobs/view/3593029017
qube research & technologies|2025 - internship, data engineering|paris, île-de-france, france|https://www.linkedin.com/jobs/view/4187896790
canonical|graduate software engineer, open source and linux, canonical ubuntu|leipzig, saxony, germany|https://www.linkedin.com/jobs/view/4180957840
neodyne|energy engineering graduate programme 2025 galway|galway, county galway, ireland|https://www.linkedin.com/jobs/view/4146734437
capgemini|young graduates technical sap|brussels, brussels region, belgium|https://www.linkedin.com/jobs/view/4087379907
canonical|software engineer - python - ubuntu pro client - graduate level|leipzig, saxony, germany|https://www.linkedin.com/jobs/view/4180687852
wdr|trainee motion-design|cologne, north rhine-westphalia, germany|https://www.linkedin.com/jobs/view/4183342403
think-cell software|c++ internship (f/m/d)|berlin, germany|https://www.linkedin.com/jobs/view/4163582979
chanelle pharma|mechanical engineering graduate|loughrea, county galway, ireland|https://www.linkedin.com/jobs/view/4168161928
canonical|software engineer - python - ubuntu pro client - graduate level|bordeaux, nouvelle-aquitaine, france|https://www.linkedin.com/jobs/view/4180691479
canonical|software engineer - python - ubuntu pro client - graduate level|coimbra, coimbra, portugal|https://www.linkedin.com/jobs/view/4180694356
nokia|web application developer - summer trainee (kraków)|cracow, małopolskie, poland|https://www.linkedin.com/jobs/view/4178501231
ion|software developer/engineer - graduate development program|milan, lombardy, italy|https://www.linkedin.com/jobs/view/4016661317
lseg (london stock exchange group)|technology graduate (engineering project associate)|bucharest, bucharest, romania|https://www.linkedin.com/jobs/view/4160233502
canonical|software engineer - python - ubuntu pro client - graduate level|strasbourg, grand est, france|https://www.linkedin.com/jobs/view/4180688707
siemens|test automation trainee (m/f/d)|matosinhos, porto, portugal|https://www.linkedin.com/jobs/view/4180267665
canonical|software engineer - python - ubuntu pro client - graduate level|nantes, pays de la loire, france|https://www.linkedin.com/jobs/view/4180689669
think-cell software|c++ internship (f/m/d)|berlin, germany|https://www.linkedin.com/jobs/view/4165405715
tietalent|trainee sap software developer (all genders)|würzburg, bavaria, germany|https://www.linkedin.com/jobs/view/4130150402
kpmg italy|junior intelligent automation (intern) - digital transformation|turin, piedmont, italy|https://www.linkedin.com/jobs/view/4138893659
hiscox|software engineer|lisbon metropolitan area, worldwide|https://www.linkedin.com/jobs/view/4138386921
canonical|graduate software engineer, open source and linux, canonical ubuntu|grenoble, auvergne-rhône-alpes, france|https://www.linkedin.com/jobs/view/4180962281
amazon|graduate automation engineer apprenticeship program|torrazza piemonte, piedmont, italy|https://www.linkedin.com/jobs/view/4173125712
ion|software developer/engineer - graduate development program|any-martin-rieux, hauts-de-france, france|https://www.linkedin.com/jobs/view/4103515071
canonical|graduate software engineer, open source and linux, canonical ubuntu|milan, lombardy, italy|https://www.linkedin.com/jobs/view/4180960339
canonical|software engineer - python - ubuntu pro client - graduate level|salamanca, castilla and leon, spain|https://www.linkedin.com/jobs/view/4180690660
schneider electric|schneider talent incubator program 2025 (sevilla)|greater sevilla metropolitan area, worldwide|https://www.linkedin.com/jobs/view/4178750154
gob software & systeme gmbh & co. kg|trainee softwareentwicklung (w/m/d)|krefeld, north rhine-westphalia, germany|https://www.linkedin.com/jobs/view/4078875472
hipo.ro|programe de internship, trainee sau joburi entry-level in it|ilfov, romania|https://www.linkedin.com/jobs/view/4128258559
commerzbank digital technology centre poland|fullstack developer intern - digital architecture - młodzi w łodzi 2025|łódź, łódzkie, poland|https://www.linkedin.com/jobs/view/4176301858
canonical|graduate software engineer, open source and linux, canonical ubuntu|murcia, región de murcia, spain|https://www.linkedin.com/jobs/view/4180959597
astroscale|computer vision engineer|toulouse, occitanie, france|https://www.linkedin.com/jobs/view/4130430084
ebury|customer payments graduate|málaga, andalusia, spain|https://www.linkedin.com/jobs/view/4167820821
canonical|software engineer - python - ubuntu pro client - graduate level|granada, andalusia, spain|https://www.linkedin.com/jobs/view/4180693432
canonical|software engineer - python - ubuntu pro client - graduate level|rennes, brittany, france|https://www.linkedin.com/jobs/view/4180693441
canonical|graduate software engineer, open source and linux, canonical ubuntu|nantes, pays de la loire, france|https://www.linkedin.com/jobs/view/4180963258
valeo|test tools development engineer graduate (12 month fixed term contract)|tuam, county galway, ireland|https://www.linkedin.com/jobs/view/4179101074
renesas electronics|student/trainee (m-f-d) - mcu ecosystem|düsseldorf, north rhine-westphalia, germany|https://www.linkedin.com/jobs/view/4163090206
tietalent|hochschulabsolvent - berufseinsteiger als it-berater / software-entwickler (m/w/d)|berlin, berlin, germany|https://www.linkedin.com/jobs/view/4168420660
arup|graduate fire engineer - 2025 graduate programme|dublin, county dublin, ireland|https://www.linkedin.com/jobs/view/4182952061
atkinsréalis|graduate structural engineer|dublin, county dublin, ireland|https://www.linkedin.com/jobs/view/4058461777
dassault systèmes|trainee (m/w/d) junior solution architekt|stuttgart region, worldwide|https://www.linkedin.com/jobs/view/4188805336
one unity consulting gmbh & co. kg|trainee (mwd) im it-consulting|gersthofen, bavaria, germany|https://www.linkedin.com/jobs/view/4187658605
ion|software/artificial intelligence engineer - graduate development program|pisa, tuscany, italy|https://www.linkedin.com/jobs/view/4121180425
fraunhofer iis|student job (m/f/d): gui frontend development in dresden|dresden, saxony, germany|https://www.linkedin.com/jobs/view/4165253224
canonical|graduate sales development representative|athens, attiki, greece|https://www.linkedin.com/jobs/view/4184065882
mol group|group cyber security architecture and engineering growwwer/fresh graduate|budapest, budapest, hungary|https://www.linkedin.com/jobs/view/4184876245
urban|graduate architects|dublin, county dublin, ireland|https://www.linkedin.com/jobs/view/4169080210
amazon|graduate automation engineer apprenticeship program|rovigo, veneto, italy|https://www.linkedin.com/jobs/view/4173126691
arcaplanet|space allocation trainee|carasco, liguria, italy|https://www.linkedin.com/jobs/view/4178773939
canonical|graduate sales development representative|paris, île-de-france, france|https://www.linkedin.com/jobs/view/4184070293
hitachi energy|power+ graduate program|cracow, małopolskie, poland|https://www.linkedin.com/jobs/view/4185278201
dassault systèmes|industry process consultant graduate|stockholm, stockholm county, sweden|https://www.linkedin.com/jobs/view/4181884438
thales|graduate programme – parcours chef de projet technique logiciel (f/h)|gennevilliers, île-de-france, france|https://www.linkedin.com/jobs/view/4150199624
check24 vergleichsportal gmbh|trainee (m/w/d) software entwicklung|berlin, berlin, germany|https://www.linkedin.com/jobs/view/4083444410
sap|graduate - solution customer success management (limited employment up to 6 months)|madrid, community of madrid, spain|https://www.linkedin.com/jobs/view/4179812031
epam systems|automated testing in java trainee|bulgaria, worldwide|https://www.linkedin.com/jobs/view/4172656696
bosch|junior managers program – research & development automated driving – trainee program (f/m/div.)|gerlingen, baden-württemberg, germany|https://www.linkedin.com/jobs/view/4184420851
codex|students program codex|madrid, community of madrid, spain|https://www.linkedin.com/jobs/view/4143546017
elia group|young graduate corporate traineeship (september 2025)|brussels, brussels region, belgium|https://www.linkedin.com/jobs/view/4063837641
netlight|software developer (consultant)|stockholm, stockholm county, sweden|https://www.linkedin.com/jobs/view/3686116192
sap|(associate) developer (f/m/d) sap cloud application programming model (cap), sap munich|garching, bavaria, germany|https://www.linkedin.com/jobs/view/4179421287
worley|graduate mechanical engineer|bel, flemish region, belgium|https://www.linkedin.com/jobs/view/4146012682
segula technologies|optics engineer|czechia, worldwide|https://www.linkedin.com/jobs/view/4166267246
nokia|devops - summer trainee (wroclaw)|wrocław, dolnośląskie, poland|https://www.linkedin.com/jobs/view/4171952815
nokia|packet core solution engineer – summer trainee|warsaw, mazowieckie, poland|https://www.linkedin.com/jobs/view/4181937319
huawei|telecom network junior engineer|marousi, attiki, greece|https://www.linkedin.com/jobs/view/4174435532
sap|(associate) developer (f/m/d) sap cloud application programming model (cap), sap munich|garching, bavaria, germany|https://www.linkedin.com/jobs/view/4179424159
epam systems|data software engineering trainee|klaipėda, klaipėdos, worldwide|https://www.linkedin.com/jobs/view/4159236247
canonical|graduate sales development representative|frankfurt am main, hesse, germany|https://www.linkedin.com/jobs/view/4184072025
corecom consulting|angular developer|almere, flevoland, netherlands|https://www.linkedin.com/jobs/view/4181347009
nokia|c++ developer - summer trainee (poland)|cracow, małopolskie, poland|https://www.linkedin.com/jobs/view/4170835651
skycell ag|senior software qa engineer (m/f/d)|poland|https://www.linkedin.com/jobs/view/4084805702
analog devices|fy25 graduate design evaluation engineer|limerick, county limerick, ireland|https://www.linkedin.com/jobs/view/4173641284
arup|structural engineer|galway, county galway, ireland|https://www.linkedin.com/jobs/view/4167142969
sita|graduate - training design|prague, prague, worldwide|https://www.linkedin.com/jobs/view/4158692260
movu robotics|robotics commissioning engineer|lokeren, flemish region, belgium|https://www.linkedin.com/jobs/view/4077653648
complion ag|absolvent:innen data and information science (m/w/d)|gundremmingen, bavaria, germany|https://www.linkedin.com/jobs/view/3737952591
prisma|general applications: product development|germany|https://www.linkedin.com/jobs/view/4098729385
canonical|graduate sales development representative|coimbra, coimbra, portugal|https://www.linkedin.com/jobs/view/4184067706
nkt|offshore analysis engineer|brøndby municipality, capital region of denmark, denmark|https://www.linkedin.com/jobs/view/4178023669
canonical|graduate sales development representative|cluj-napoca, cluj, romania|https://www.linkedin.com/jobs/view/4184067705
epam systems|automated testing in java trainee|lithuania, worldwide|https://www.linkedin.com/jobs/view/4144430941
canonical|software engineer - python - container images|munich, bavaria, germany|https://www.linkedin.com/jobs/view/4168065260
dassault systèmes|client executive - sales graduate program|stockholm, stockholm county, sweden|https://www.linkedin.com/jobs/view/4184889380
deutsche telekom|trainee focus technology (m/f/d) - board area technology & innovation|bonn, north rhine-westphalia, germany|https://www.linkedin.com/jobs/view/4027609680
canonical|software engineer - python - container images|paris, île-de-france, france|https://www.linkedin.com/jobs/view/4068940133
vestas|power system engineer, trainee|leça do bailio, porto, portugal|https://www.linkedin.com/jobs/view/4187657977
analog devices|graduate engineer - facilities department|limerick, county limerick, ireland|https://www.linkedin.com/jobs/view/4186525934
canonical|graduate sales development representative|granada, andalusia, spain|https://www.linkedin.com/jobs/view/4184064911
adecco|neolaureato stem - junior system administrator workplace roma o bari|rome, latium, italy|https://www.linkedin.com/jobs/view/4180274396
ion|business analyst - graduate development program|milan, lombardy, italy|https://www.linkedin.com/jobs/view/4016661344
join.com|21unity gmbh: trainee cloud engineer - operations (m/w/d)|aschaffenburg, bavaria, germany|https://www.linkedin.com/jobs/view/4170819017
yougov|graduate data processing executive|bucharest, bucharest, romania|https://www.linkedin.com/jobs/view/4184029642
analog devices|fy24 graduate product engineer|limerick, county limerick, ireland|https://www.linkedin.com/jobs/view/4050292443
hp|software quality engineer|warsaw, mazowieckie, poland|https://www.linkedin.com/jobs/view/4126628319
skycell ag|senior software qa engineer (m/f/d)|portugal|https://www.linkedin.com/jobs/view/4058371980
gamma informatica s.r.l.|neolaureato/a ingegneria gestionale/economia aziendale|lucca, tuscany, italy|https://www.linkedin.com/jobs/view/4185638267
jonas software|mid developer|sundsvall municipality, västernorrland county, sweden|https://www.linkedin.com/jobs/view/4128282075
sanmarco informatica spa|neolaureato/a economia/ingegneria gestionale|asti, piedmont, italy|https://www.linkedin.com/jobs/view/4175206590
altenar|data scientist|san ġiljan, saint julian's, worldwide|https://www.linkedin.com/jobs/view/4027263268
canonical|software engineer - python - container images|frankfurt am main, hesse, germany|https://www.linkedin.com/jobs/view/4138533076
canonical|software engineer - python - container images|frankfurt am main, hesse, germany|https://www.linkedin.com/jobs/view/4068935682
canonical|software engineer - python - container images|frankfurt am main, hesse, germany|https://www.linkedin.com/jobs/view/4068180943
salice|ingegnere neolaureato - programmazione  cam|greater como metropolitan area, worldwide|https://www.linkedin.com/jobs/view/4180261506
sgs|trainee (it) security evaluator (barcelona)|barcelona, catalonia, spain|https://www.linkedin.com/jobs/view/3971891942
canonical|software engineer - python - container images|marousi, attiki, greece|https://www.linkedin.com/jobs/view/4138534001
adesso se|trainee sap software developer (all genders)|frankfurt, hesse, germany|https://www.linkedin.com/jobs/view/3733044191
canonical|software engineer - python - container images|hamburg, hamburg, germany|https://www.linkedin.com/jobs/view/4138530348
wüstenrot gruppe|full-stack developer - banking &amp; customer portal (m/w/d)|vienna, vienna, austria|https://www.linkedin.com/jobs/view/4087662519
wüstenrot gruppe|full-stack developer - banking &amp; customer portal (m/w/d)|salzburg, salzburg, austria|https://www.linkedin.com/jobs/view/4087659738
