company|title|location|link
sopra steria|er du klar til nye udfordringer som senior java udvikler?|copenhagen, capital region of denmark, denmark|https://www.linkedin.com/jobs/view/3940056676
personalhuset norway|fullstack-developer|arendal, agder, norway|https://www.linkedin.com/jobs/view/3972358014
marketer ux gmbh|webflow-developer (m/w/d) im medienhafen düsseldorf|düsseldorf, north rhine-westphalia, germany|https://www.linkedin.com/jobs/view/3832254064
acronis|macos c++/ objective-c developer (trueimage)|serbia, stari grad, worldwide|https://www.linkedin.com/jobs/view/3989937217
meta|production engineer (university grad)|dublin, county dublin, ireland|https://www.linkedin.com/jobs/view/3902597882
meta|production engineer (university grad)|london, england, united kingdom|https://www.linkedin.com/jobs/view/3973077686
devoteam g cloud|young graduates program|machelen, flemish region, belgium|https://www.linkedin.com/jobs/view/3860522964
sopra steria|er du klar til at skabe innovative løsninger som senior .net udvikler?|copenhagen, capital region of denmark, denmark|https://www.linkedin.com/jobs/view/3940056678
sopra steria|er du vores nye senior data engineer til nyopstartet team?|copenhagen, capital region of denmark, denmark|https://www.linkedin.com/jobs/view/3967060960
schwarz dienstleistungen|chat- und voicebot engineer (m/w/d)|neckarsulm, baden-württemberg, germany|https://www.linkedin.com/jobs/view/3921334559
schwarz dienstleistungen|senior analytics engineer (m/w/d)|neckarsulm, baden-württemberg, germany|https://www.linkedin.com/jobs/view/3972975462
the hub|senior utvikler på backend og infrastruktur|oslo, oslo, norway|https://www.linkedin.com/jobs/view/3962229042
knowit|data engineer - google cloud|oslo, oslo, norway|https://www.linkedin.com/jobs/view/3738818688
acronis|business intelligence developer|serbia, stari grad, worldwide|https://www.linkedin.com/jobs/view/3885072607
acronis|senior software developer golang (c2c backup)|serbia, stari grad, worldwide|https://www.linkedin.com/jobs/view/3972023038
insider.|software developer – insider testinium tech hub (remote)|greater istanbul, worldwide|https://www.linkedin.com/jobs/view/3799942268
sentry|software engineer, new grad (2025)|vienna, vienna, austria|https://www.linkedin.com/jobs/view/3990425120
hitachi energy|service engineer|zagreb, zagreb, worldwide|https://www.linkedin.com/jobs/view/3973747796
cvation - part of skaylink|software engineer|copenhagen, capital region of denmark, denmark|https://www.linkedin.com/jobs/view/3979114580
twoday|seniorkonsulent (software engineer) - til at drive kundeengagementer|copenhagen municipality, capital region of denmark, denmark|https://www.linkedin.com/jobs/view/3945427802
peak rekruttering|to skarpe sw-udviklere søges til spændende fintech virksomhed i aarhus c.|aarhus, central denmark region, denmark|https://www.linkedin.com/jobs/view/3862365639
sopra steria|vi søger en erfaren rpa udvikler til vores spændende projekter|copenhagen, capital region of denmark, denmark|https://www.linkedin.com/jobs/view/3967066072
hntb|returning new grad engineer i - southeast division (for current/previous hntb interns only) (campus recruiting hub requisition)|ga, atlanta, worldwide|https://www.linkedin.com/jobs/view/3976379750
hntb|returning new grad engineer i - southeast division (for current/previous hntb interns only)|ga, atlanta, worldwide|https://www.linkedin.com/jobs/view/3978068868
remondis it|system engineer – e-mail / microsoft exchange (m/w/d)|lünen, north rhine-westphalia, germany|https://www.linkedin.com/jobs/view/3834268505
instaffo|frontend web-entwickler (m/w/d) - react software developer|hamburg, hamburg, germany|https://www.linkedin.com/jobs/view/3983531042
join.com|mondia group: java backend developer (m/f/d)|hamburg, hamburg, germany|https://www.linkedin.com/jobs/view/3832180375
dg timework gmbh by synergie|softwareentwickler (m/w/d)|munich, bavaria, germany|https://www.linkedin.com/jobs/view/3965667325
remondis it|system engineer – e-mail / microsoft exchange (m/w/d)|lünen, north rhine-westphalia, germany|https://www.linkedin.com/jobs/view/3834258550
thought leader systems|senior web-developer (w/m/d) – schwerpunkt hubspot cms|frankfurt, hesse, germany|https://www.linkedin.com/jobs/view/3881457130
simon-kucher|senior cloud engineer (m/w/d) – deutschlandweit|berlin, germany|https://www.linkedin.com/jobs/view/3872023287
stonebranch|werkstudent systems engineer|frankfurt am main, hesse, germany|https://www.linkedin.com/jobs/view/3918453581
stonebranch|werkstudent solution engineer|frankfurt am main, hesse, germany|https://www.linkedin.com/jobs/view/3918458250
sd worx|fullstack developer|trondheim, trøndelag, norway|https://www.linkedin.com/jobs/view/3962416206
columbus|senior data engineer  data & ai|oslo, oslo, norway|https://www.linkedin.com/jobs/view/3664572173
acronis|cloud expert engineer with french|serbia, stari grad, worldwide|https://www.linkedin.com/jobs/view/3892718128
acronis|cloud expert engineer with italian|serbia, stari grad, worldwide|https://www.linkedin.com/jobs/view/3902974937
acronis|cloud software support engineer (german language)|serbia, stari grad, worldwide|https://www.linkedin.com/jobs/view/3943997738
jobbusters ab|data engineer|greater stockholm metropolitan area, worldwide|https://www.linkedin.com/jobs/view/3986928631
jobbusters ab|data engineer|stockholm, stockholm county, sweden|https://www.linkedin.com/jobs/view/3987047507
deploja|senior azure devops utvecklare|solna, stockholm county, sweden|https://www.linkedin.com/jobs/view/3970448496
helios kliniken gmbh|it security engineer (m/w/d) mit schwerpunkt (azure) active directory|berlin, berlin, germany|https://www.linkedin.com/jobs/view/3967846855
swiss life deutschland|(junior) data warehouse-entwickler (m/w/d)|hannover, lower saxony, germany|https://www.linkedin.com/jobs/view/3877641052
swiss life deutschland|anwendungs- und devops entwickler (m/w/d)|munich, bavaria, germany|https://www.linkedin.com/jobs/view/3983972456
wikifolio financial technologies ag|it-system administrator (m/w/d) (wien)|vienna, austria|https://www.linkedin.com/jobs/view/3985631258
michael page|software entwicklungsingenieur (m/w/d) mechatronics|salzburg, salzburg, austria|https://www.linkedin.com/jobs/view/3982432693
alten belgium|embedded software developer (fr/nl + en)|brussels metropolitan area, worldwide|https://www.linkedin.com/jobs/view/3932472338
patrique mercier recruitment|fresh grad: dutch speaking job in greece that enhances your resume|belgium|https://www.linkedin.com/jobs/view/3970120937
hitachi energy|sales specialist - network control systems (f/m/d)|sofia, sofia city, worldwide|https://www.linkedin.com/jobs/view/3973749343
job squad|german customer support agent in sofia|sofia, sofia city, worldwide|https://www.linkedin.com/jobs/view/3685737944
hitachi energy|sales specialist - network control systems (f/m/d)|zagreb, zagreb, worldwide|https://www.linkedin.com/jobs/view/3973747512
twoday|software developer|copenhagen municipality, capital region of denmark, denmark|https://www.linkedin.com/jobs/view/3945432124
testhuset.dk|tester - aarhus|aarhus, central denmark region, denmark|https://www.linkedin.com/jobs/view/3919167560
the hub|fullstack engineer|copenhagen, capital region of denmark, denmark|https://www.linkedin.com/jobs/view/3987036922
testhuset.dk|tester - ballerup|ballerup, capital region of denmark, denmark|https://www.linkedin.com/jobs/view/3919168315
the hub|praktikant  junior softwareudvikler|copenhagen, capital region of denmark, denmark|https://www.linkedin.com/jobs/view/3963017607
moment a/s|applications engineer|copenhagen, capital region of denmark, denmark|https://www.linkedin.com/jobs/view/3967040338
testhuset.dk|test manager - ballerup|ballerup, capital region of denmark, denmark|https://www.linkedin.com/jobs/view/3919167574
körber|automation engineer, remote assistance|svenstrup, region zealand, denmark|https://www.linkedin.com/jobs/view/3954038209
danx carousel|onsite it supporter (lvl. 2)|ishøj municipality, capital region of denmark, denmark|https://www.linkedin.com/jobs/view/3987823156
lundbeck|drug dispensary laboratory technician|copenhagen, capital region of denmark, denmark|https://www.linkedin.com/jobs/view/3974321328
twoday|client relations partner - vest|aarhus, central denmark region, denmark|https://www.linkedin.com/jobs/view/3976469726
energinet|softwaretester med fokus på den gode brugeroplevelse|fredericia, region of southern denmark, denmark|https://www.linkedin.com/jobs/view/3987501634
khr architecture|khr architecture søger bygningskonstruktørpraktikanter|copenhagen, capital region of denmark, denmark|https://www.linkedin.com/jobs/view/3897195873
sweco|it-konsulent med interesse for geografiske informationssystemer|copenhagen municipality, capital region of denmark, denmark|https://www.linkedin.com/jobs/view/3967648703
bankdata|software developer - arbejd med løsninger inden for internationale betalinger|fredericia, region of southern denmark, denmark|https://www.linkedin.com/jobs/view/3966055601
körber supply chain|technical documentation engineer / technical writer|arden, north denmark region, denmark|https://www.linkedin.com/jobs/view/3954181484
ramboll|erfaren softwareudvikler til rambøll stakeholder intelligence|aarhus, central denmark region, denmark|https://www.linkedin.com/jobs/view/3919898997
iss danmark|iss danmark søger en kompetent og serviceminded it supporter til vores servicedesk i søborg|copenhagen, capital region of denmark, denmark|https://www.linkedin.com/jobs/view/3982947067
te connectivity|co-op/intern|pontoise, île-de-france, france|https://www.linkedin.com/jobs/view/3840772138
burger & cie|apprenti.e technicien.ne bureau d'etude h/f|lièpvre, grand est, france|https://www.linkedin.com/jobs/view/3942674426
burger & cie|technicien.ne helpdesk h/f|lièpvre, grand est, france|https://www.linkedin.com/jobs/view/3987638617
burger & cie|directeur / directrice de centre de formation d'apprentis (h/f)|ste.-marie-aux-mines, grand est, france|https://www.linkedin.com/jobs/view/3980429734
agnes scott college|graduate admission counselor|ga, decatur, worldwide|https://www.linkedin.com/jobs/view/3982908001
tractian|sales development representative|ga, atlanta, worldwide|https://www.linkedin.com/jobs/view/3837055446
nr consulting|engineering technician i|ga, dublin, worldwide|https://www.linkedin.com/jobs/view/3921600348
burns & mcdonnell|assistant electrical engineer- energy & utilities consulting (atlanta)|ga, atlanta, worldwide|https://www.linkedin.com/jobs/view/3982701841
ripplematch|ciena - new grad: verification and field application engineer, application via ripplematch|ga, alpharetta, worldwide|https://www.linkedin.com/jobs/view/3975590999
burns & mcdonnell|assistant electrical engineer- aero & industrial|ga, atlanta, worldwide|https://www.linkedin.com/jobs/view/3982706151
burns & mcdonnell|assistant electrical engineer- aviation & federal (atlanta, aiken or oak ridge)|ga, atlanta, worldwide|https://www.linkedin.com/jobs/view/3982707083
1898 & co.|assistant electrical engineer- energy & utilities consulting (atlanta)|ga, atlanta, worldwide|https://www.linkedin.com/jobs/view/3732430614
burns & mcdonnell|assistant mechanical engineer - commissioning (atlanta)|ga, atlanta, worldwide|https://www.linkedin.com/jobs/view/3988628173
workwise|frontend developer - angular / javascript / bitbucket / home office (m/f/d)|bochum, north rhine-westphalia, germany|https://www.linkedin.com/jobs/view/3984546943
steadforce|software backend engineer (m/w/d)|munich, bavaria, germany|https://www.linkedin.com/jobs/view/3837967325
workwise|frontend developer - angular / javascript / bitbucket / home office (m/f/d)|berlin, berlin, germany|https://www.linkedin.com/jobs/view/3984552308
workwise|frontend developer - angular / javascript / bitbucket / home office (m/f/d)|hamburg, hamburg, germany|https://www.linkedin.com/jobs/view/3984548639
workwise|frontend developer - angular / javascript / bitbucket / home office (m/f/d)|karlsruhe, baden-württemberg, germany|https://www.linkedin.com/jobs/view/3984551329
workwise|frontend developer - angular / javascript / bitbucket / home office (m/f/d)|munich, bavaria, germany|https://www.linkedin.com/jobs/view/3984551347
workwise|frontend developer - angular / javascript / bitbucket / home office (m/f/d)|frankfurt, hesse, germany|https://www.linkedin.com/jobs/view/3984548627
workwise|frontend developer - angular / javascript / bitbucket / home office (m/f/d)|stuttgart, baden-württemberg, germany|https://www.linkedin.com/jobs/view/3984549479
workwise|frontend developer - angular / javascript / bitbucket / home office (m/f/d)|hannover, lower saxony, germany|https://www.linkedin.com/jobs/view/3984546975
workwise|frontend developer - angular / javascript / bitbucket / home office (m/f/d)|bonn, north rhine-westphalia, germany|https://www.linkedin.com/jobs/view/3984546932
cision|analyst - rapid intelligence team - part time|frankfurt, hesse, germany|https://www.linkedin.com/jobs/view/3982430352
carl|m&a intern (m/w/d)|berlin, berlin, germany|https://www.linkedin.com/jobs/view/3837962780
remondis it|oracle datenbankentwickler (m/w/d)|lünen, north rhine-westphalia, germany|https://www.linkedin.com/jobs/view/3834279462
dl remote|product manager  e-commerce|frankfurt am main, hesse, germany|https://www.linkedin.com/jobs/view/3984815896
dl remote|product manager  e-commerce|leipzig, saxony, germany|https://www.linkedin.com/jobs/view/3984814996
dl remote|product manager  e-commerce|hannover, lower saxony, germany|https://www.linkedin.com/jobs/view/3984821014
dl remote|product manager|berlin, berlin, germany|https://www.linkedin.com/jobs/view/3984632033
dl remote|product manager  e-commerce|hamburg, hamburg, germany|https://www.linkedin.com/jobs/view/3984817716
flex capital|executive assistant und team assistenz|berlin, berlin, germany|https://www.linkedin.com/jobs/view/3970616468
polizei berlin|studierende für den dualen studiengang „informatik“ (w/m/d)|berlin, berlin, germany|https://www.linkedin.com/jobs/view/3987548752
kannegiesser|konstrukteur maschinenbau (m/w/d)|vlotho, north rhine-westphalia, germany|https://www.linkedin.com/jobs/view/3967901080
thought leader systems|initiativbewerbung|frankfurt, hesse, germany|https://www.linkedin.com/jobs/view/3834271917
1000°digital gmbh|werkstudent für php-webentwicklung (m/w/d)|leipzig, saxony, germany|https://www.linkedin.com/jobs/view/3859793584
heydata|data privacy consultant (all genders)|berlin, berlin, germany|https://www.linkedin.com/jobs/view/3961164220
dentolo|junior strategic operations manager (m/w/d)|berlin, berlin, germany|https://www.linkedin.com/jobs/view/3834081039
polizei berlin|studierende für den dualen studiengang „informatik“ (w/m/d)|berlin metropolitan area, worldwide|https://www.linkedin.com/jobs/view/3988040036
einhell germany ag|it-projektmanager (m/w/d)|wörth an der isar, bavaria, germany|https://www.linkedin.com/jobs/view/3978129183
remondis it|oracle datenbankadministrator (m/w/d)|lünen, north rhine-westphalia, germany|https://www.linkedin.com/jobs/view/3834273007
liebherr group|teamleader software development (m/w/d)|lindenberg im allgäu, bavaria, germany|https://www.linkedin.com/jobs/view/3871224385
immatics|lab operations associate*|tübingen, baden-württemberg, germany|https://www.linkedin.com/jobs/view/3948362319
schwarz dienstleistungen|junior it consultant atlassian tools (m/w/d)|neckarsulm, baden-württemberg, germany|https://www.linkedin.com/jobs/view/3965982289
myterial|ceo associate intern (m/w/d) - zum 01.01.2024|munich, bavaria, germany|https://www.linkedin.com/jobs/view/3811841835
immocloud gmbh|senior full-stack entwickler (d/w/m)|düsseldorf, north rhine-westphalia, germany|https://www.linkedin.com/jobs/view/3811838032
simon-kucher|it compliance experte (m/w/d) – berlin|berlin, germany|https://www.linkedin.com/jobs/view/3987505893
workwise|praktikum operations management - automatisierung / datenqualität (m/w/d)|munich, bavaria, germany|https://www.linkedin.com/jobs/view/3980861265
simon-kucher|it compliance experte (m/w/d) – bonn oder köln|cologne bonn region, worldwide|https://www.linkedin.com/jobs/view/3987512042
simon-kucher|it compliance experte (m/w/d) – münchen|munich, bavaria, germany|https://www.linkedin.com/jobs/view/3987509364
personalwerk gmbh|support- und applikationsingenieur (m/w/d)|heilbronn, baden-württemberg, germany|https://www.linkedin.com/jobs/view/3951167706
simon-kucher|it compliance experte (m/w/d) – hamburg|hamburg, germany|https://www.linkedin.com/jobs/view/3987507709
iabg|senior projektleiter software engineering (m/w/d)|munich, bavaria, germany|https://www.linkedin.com/jobs/view/3945798948
coveto ats gmbh - recruiting software|monteur (m/w/d)|heppenheim an der bergstraße, hesse, germany|https://www.linkedin.com/jobs/view/3989929790
thought leader systems|manager (m/w/d) webprojekte / websitekonzeption|frankfurt, hesse, germany|https://www.linkedin.com/jobs/view/3834257632
sap|werkstudent (w/m/d) - project management consultant|walldorf, baden-württemberg, germany|https://www.linkedin.com/jobs/view/3840468592
remondis it|mitarbeiter im service desk / it support (m/w/d)|lünen, north rhine-westphalia, germany|https://www.linkedin.com/jobs/view/3834256869
wattify gmbh|youki - founders associate market|amberg, bavaria, germany|https://www.linkedin.com/jobs/view/3834269594
veeva systems|sales development program (germany)|germany|https://www.linkedin.com/jobs/view/3956480464
veeva systems|sales development program (germany)|germany|https://www.linkedin.com/jobs/view/3956477975
barmenia versicherungen|it specialist (w/m/d) pam - iam|wuppertal, north rhine-westphalia, germany|https://www.linkedin.com/jobs/view/3708049836
polizei berlin|studierende für den dualen studiengang „informatik“ (w/m/d)|berlin, germany|https://www.linkedin.com/jobs/view/3987511175
charry gmbh|praktikant (m/w/d) - business development|munich, bavaria, germany|https://www.linkedin.com/jobs/view/3832202213
coveto ats gmbh - recruiting software|elektrotechniker (m/w/d)|heppenheim an der bergstraße, hesse, germany|https://www.linkedin.com/jobs/view/3989930967
arvana gmbh|key account manager (agentur)|berlin, germany|https://www.linkedin.com/jobs/view/3981991367
siemens digital industries software|services operations specialist (w/m/d)|frankfurt am main, hesse, germany|https://www.linkedin.com/jobs/view/3903240015
flex capital|executive assistant und team assistenz – (w/m/d)|berlin, berlin, germany|https://www.linkedin.com/jobs/view/3916521801
unique personalservice gmbh (deutschland)|mitarbeiter it-support (m/w/d)|tittling, bavaria, germany|https://www.linkedin.com/jobs/view/3980833761
iu international university of applied sciences|research and academic support librarian / open access specialist (m/w/d)|stuttgart, baden-württemberg, germany|https://www.linkedin.com/jobs/view/3973977798
iu international university of applied sciences|research and academic support librarian / open access specialist (m/w/d)|germany|https://www.linkedin.com/jobs/view/3973979528
think about it gmbh|devops architect mit schwerpunkt automatisierung (m/w/d)|munich, bavaria, germany|https://www.linkedin.com/jobs/view/3989381734
zalando|hr project manager (all genders) - befristet bis ende dezember 2025|berlin, berlin, germany|https://www.linkedin.com/jobs/view/3988730857
siemens digital industries software|services operations specialist (w/m/d)|frankfurt am main, hesse, germany|https://www.linkedin.com/jobs/view/3903238729
skopos|werkstudent (m/w/d) marktforschung - customer experience (cx) & communities|hürth, north rhine-westphalia, germany|https://www.linkedin.com/jobs/view/3834281423
otto-von-guericke university magdeburg|218/2024 2 wissenschaftliche*r mitarbeiter*innen (m/w/d) im bereich künstliche intelligenz für robotik in der pflege und logistik sowie medizinische anwendungen|magdeburg, saxony-anhalt, germany|https://www.linkedin.com/jobs/view/3958563022
bite gmbh|customer success manager (m/w/d)|neu ulm, bavaria, germany|https://www.linkedin.com/jobs/view/3974304865
shimadzu deutschland gmbh|service ingenieur*in / techniker*in lc/lc-ms|munich, bavaria, germany|https://www.linkedin.com/jobs/view/3978103702
wwm gmbh & co. kg|kaufmännischer sachbearbeiter (m/w/d)|monschau, north rhine-westphalia, germany|https://www.linkedin.com/jobs/view/3834278351
quanta part of qcs staffing|projektplaner|stuttgart, baden-württemberg, germany|https://www.linkedin.com/jobs/view/3915052368
gp joule|werkstudent*in im bereich geschäftsfeldentwicklung / produktmanagement|reußenköge, schleswig-holstein, germany|https://www.linkedin.com/jobs/view/3842109519
arvana gmbh|key account manager (agentur)|berlin, berlin, germany|https://www.linkedin.com/jobs/view/3970297475
datadiorama - it systemhaus für potsdam|netzwerk- und systemadministrator*in (m/w/d)|potsdam, brandenburg, germany|https://www.linkedin.com/jobs/view/3832184237
veeva systems|sales development program (germany)|berlin, berlin, germany|https://www.linkedin.com/jobs/view/3967876220
skopos|werkstudent (m/w/d) marktforschung - customer experience (cx) & communities|aachen, north rhine-westphalia, germany|https://www.linkedin.com/jobs/view/3834285048
würth deutschland|anwendungstechniker division auto (m/w/d)|leipzig, saxony, germany|https://www.linkedin.com/jobs/view/3941839679
engineering people|technischer systemplaner cae / cad für elektro (m/w/d)|ingelheim am rhein, rhineland-palatinate, germany|https://www.linkedin.com/jobs/view/3937186332
shimadzu deutschland gmbh|service ingenieur*in / techniker*in  toc & gc/gc-ms|berlin, berlin, germany|https://www.linkedin.com/jobs/view/3929008203
modellfabrik papier ggmbh|masterabsolvent*in (m/w/d) maschinenbau, mess-, steuerungs- und regeltechnik, elektrotechnik - promotion möglich (100% stelle)|jülich, north rhine-westphalia, germany|https://www.linkedin.com/jobs/view/3863900606
giesecke+devrient|experte solution integration personalisierung (m/w/d)|munich, bavaria, germany|https://www.linkedin.com/jobs/view/3859014373
r+s group gmbh|ausbildung zum elektroniker für gebäudesystemintegration (m/w/d)|nesse-apfelstädt, thuringia, germany|https://www.linkedin.com/jobs/view/3972004297
tüv rheinland group|business development manager für it-projekte und betrieb (w/m/d)|cologne, north rhine-westphalia, germany|https://www.linkedin.com/jobs/view/3976355119
time2 business consulting gmbh|entwicklung - und zertifizierungsingenieur obd (m/w/d) - nr. 405|stuttgart, baden-württemberg, germany|https://www.linkedin.com/jobs/view/3811835424
mann+hummel|corporate customs expert origin of goods (m/w/d)|ludwigsburg, baden-württemberg, germany|https://www.linkedin.com/jobs/view/3988575229
amadeus fire|it-administrator (m/w/d) finanzbranche|mannheim, baden-württemberg, germany|https://www.linkedin.com/jobs/view/3982274640
engineering people|technischer systemplaner cae / cad für tga (m/w/d)|ingelheim am rhein, rhineland-palatinate, germany|https://www.linkedin.com/jobs/view/3937187195
r+s group gmbh|ausbildung zum elektroniker für gebäudesystemintegration (m/w/d)|fulda, hesse, germany|https://www.linkedin.com/jobs/view/3972008085
jobs via efinancialcareers|operations manager im bereich mieterstrom (m/w/d)|stuttgart, baden-württemberg, germany|https://www.linkedin.com/jobs/view/3977995818
cision|news briefings assistant - student worker (german speaking) - rapid intelligence team (m/w/d)|frankfurt, hesse, germany|https://www.linkedin.com/jobs/view/3979330836
wwm gmbh & co. kg|kauffrau/-mann für büromanagement schwerpunkt finanzbuchhaltung & controlling (m/w/d)|monschau, north rhine-westphalia, germany|https://www.linkedin.com/jobs/view/3834283011
join.com|bremer rechenzentrum gmbh: it-systemadministrator (m/w/d)|germany|https://www.linkedin.com/jobs/view/3892837875
volkswagen group services gmbh|duales studium 2025 i logistik- und informationsmanagement (m/w/d)|brunswick, lower saxony, germany|https://www.linkedin.com/jobs/view/3964143015
marketer ux gmbh|werkstudent (m/w/d) - vertrieb / kundenberater  düsseldorf medienhafen|düsseldorf, north rhine-westphalia, germany|https://www.linkedin.com/jobs/view/3832594993
giesecke+devrient|strategischer category manager it (m/w/d)|munich, bavaria, germany|https://www.linkedin.com/jobs/view/3903678153
continentale versicherungsverbund|duales studium wirtschaftsinformatik an der th rosenheim, bachelor of science|munich, bavaria, germany|https://www.linkedin.com/jobs/view/3955476235
accenture dach|consultant business analyse – öffentliche verwaltung / public service (all genders)|kronberg, hesse, germany|https://www.linkedin.com/jobs/view/3775609726
würth deutschland|kundenberater für digitale lösungen im handwerk (m/w/d)|erfurt, thuringia, germany|https://www.linkedin.com/jobs/view/3960555612
cision|sales development representative (german speaker) (m/f/d)|frankfurt, hesse, germany|https://www.linkedin.com/jobs/view/3837494770
die zeit|auszubildende medienkaufleute digital und print zeitverlag (d/w/m)|hamburg, hamburg, germany|https://www.linkedin.com/jobs/view/3945215411
s&n systemhaus für netzwerk- und datentechnik gmbh|it dozent / trainer (m/w/d) in rostock|rostock, mecklenburg-west pomerania, germany|https://www.linkedin.com/jobs/view/3832118699
join.com|sarraf praxen für physiotherapie: physiotherapeut:in|kissing, bavaria, germany|https://www.linkedin.com/jobs/view/3832568363
zeit verlagsgruppe|auszubildende medienkaufleute digital und print zeitverlag (d/w/m)|hamburg, hamburg, germany|https://www.linkedin.com/jobs/view/3967315277
bbrecruiting personalberatung|immobilienfachmann gewerbeimmobilien (m/w/d) in sinsheim / nähe heidelberg|sinsheim, baden-württemberg, germany|https://www.linkedin.com/jobs/view/3985660367
