company|title|location|link
backstage hotel vernissage|trainee front office wintersaison (m/w/d) nach vereinbarung|zermatt, valais, switzerland|https://www.linkedin.com/jobs/view/4101722884
telpa a.ş.|fresh graduate java developer|istanbul, istanbul, worldwide|https://www.linkedin.com/jobs/view/4125069659
telpa a.ş.|fresh graduate java backend developer|istanbul, istanbul, worldwide|https://www.linkedin.com/jobs/view/4125075349
telpa a.ş.|fresh graduate/ software test engineer|istanbul, istanbul, worldwide|https://www.linkedin.com/jobs/view/4125075716
telpa a.ş.|fresh graduate recruitment (java, test & frontend)|istanbul, istanbul, worldwide|https://www.linkedin.com/jobs/view/4125075175
beymen group|frontend developer|türkiye, istanbul, worldwide|https://www.linkedin.com/jobs/view/4111025783
valven|new graduate program|greater kocaeli, worldwide|https://www.linkedin.com/jobs/view/4124576297
aimultiple|industry analyst (new or recent graduate)|türkiye, worldwide|https://www.linkedin.com/jobs/view/4112543070
canonical|software engineer - python - container images|türkiye, i̇stanbul, worldwide|https://www.linkedin.com/jobs/view/4117660198
canonical|software engineer - python - container images|türkiye, i̇stanbul, worldwide|https://www.linkedin.com/jobs/view/4089854419
canonical|graduate sales development representative|türkiye, i̇stanbul, worldwide|https://www.linkedin.com/jobs/view/4068127326
canonical|software engineer - python - container images|türkiye, i̇stanbul, worldwide|https://www.linkedin.com/jobs/view/4089849865
canonical|software engineer - python - container images|türkiye, i̇stanbul, worldwide|https://www.linkedin.com/jobs/view/4068937361
canonical|software engineer - python - container images|ankara, ankara, worldwide|https://www.linkedin.com/jobs/view/4089850819
canonical|software engineer - python - container images|türkiye, i̇stanbul, worldwide|https://www.linkedin.com/jobs/view/4068180942
canonical|software engineer - python - container images|ankara, ankara, worldwide|https://www.linkedin.com/jobs/view/4068937360
kartaca|system administrator intern|türkiye, istanbul, worldwide|https://www.linkedin.com/jobs/view/4123152192
canonical|software engineer - go - container images|türkiye, i̇stanbul, worldwide|https://www.linkedin.com/jobs/view/4117649400
testinium|senior java software engineer|türkiye, istanbul, worldwide|https://www.linkedin.com/jobs/view/4104731970
canonical|software engineer - go - container images|ankara, ankara, worldwide|https://www.linkedin.com/jobs/view/4117651252
canonical|software engineer - go - container images|türkiye, i̇stanbul, worldwide|https://www.linkedin.com/jobs/view/4068937205
canonical|software engineer - go - container images|türkiye, i̇stanbul, worldwide|https://www.linkedin.com/jobs/view/4089853567
canonical|software engineer - go - container images|türkiye, i̇stanbul, worldwide|https://www.linkedin.com/jobs/view/4068276099
canonical|software engineer - go - container images|ankara, ankara, worldwide|https://www.linkedin.com/jobs/view/4068130964
canonical|software engineer - go - container images|ankara, ankara, worldwide|https://www.linkedin.com/jobs/view/4089851624
canonical|software engineer - go - container images|ankara, ankara, worldwide|https://www.linkedin.com/jobs/view/4068931990
di̇as teknoloji|database administrator|türkiye, istanbul, worldwide|https://www.linkedin.com/jobs/view/4118611180
canonical|embedded linux field engineering manager|türkiye, i̇stanbul, worldwide|https://www.linkedin.com/jobs/view/4122063141
mastercard|senior managing consultant, advisors business development-r-223308|greater istanbul, worldwide|https://www.linkedin.com/jobs/view/4069961767
adesso turkey|lead software developer (ios)|türkiye, worldwide|https://www.linkedin.com/jobs/view/4108504415
canonical|embedded linux field engineering manager|ankara, ankara, worldwide|https://www.linkedin.com/jobs/view/4122065015
rem people|senior computer vision engineer|şişli, istanbul, worldwide|https://www.linkedin.com/jobs/view/4114802323
insider.|management trainee for chief revenue officer  revenue operations team|türkiye, i̇stanbul, worldwide|https://www.linkedin.com/jobs/view/3673324996
adesso turkey|sales manager (sap business line)|türkiye, istanbul, worldwide|https://www.linkedin.com/jobs/view/3942908408
adesso turkey|senior software developer (flutter)|türkiye, worldwide|https://www.linkedin.com/jobs/view/4108536775
akcok law office, a professional law corporation|immigration paralegal|türkiye, worldwide|https://www.linkedin.com/jobs/view/4089264567
eren perakende|accounting responsible|türkiye, tekirdağ, worldwide|https://www.linkedin.com/jobs/view/4092551389
byd europe|human resources supervisor|manisa, manisa, worldwide|https://www.linkedin.com/jobs/view/4101304641
canonical|hr generalist - emea|türkiye, i̇stanbul, worldwide|https://www.linkedin.com/jobs/view/4068272720
canonical|engineering manager - ubuntu security|türkiye, i̇stanbul, worldwide|https://www.linkedin.com/jobs/view/4118549440
canonical|cloud professional services manager|türkiye, i̇stanbul, worldwide|https://www.linkedin.com/jobs/view/4069177109
adesso turkey|sales manager (insurance)|türkiye, istanbul, worldwide|https://www.linkedin.com/jobs/view/3966450609
canonical|engineering manager - ubuntu security|ankara, ankara, worldwide|https://www.linkedin.com/jobs/view/4118552185
icterra information and communication technologies|content specialist|türkiye, istanbul, worldwide|https://www.linkedin.com/jobs/view/4113609043
canonical|cloud professional services manager|ankara, ankara, worldwide|https://www.linkedin.com/jobs/view/4069172708
greco group|account executive health and benefits  full-time (all genders)|türkiye, istanbul, worldwide|https://www.linkedin.com/jobs/view/4096863723
canonical|engineering manager - security standards and hardening|türkiye, i̇stanbul, worldwide|https://www.linkedin.com/jobs/view/4118745338
özyeğin university|phd candidates fluid dynamics & spray laboratory|çekmeköy, istanbul, worldwide|https://www.linkedin.com/jobs/view/4108517275
amc bridge, inc.|c++ software development engineer (trainee)|ukraine|https://www.linkedin.com/jobs/view/4072904570
globallogic|trainee c developer irc253243|lviv, lviv, ukraine|https://www.linkedin.com/jobs/view/4124133428
globallogic|trainee с/c++ embedded developer irc252860|lviv, lviv, ukraine|https://www.linkedin.com/jobs/view/4124673834
appexoft|qa engineer (trainee/junior)|lviv, lviv, ukraine|https://www.linkedin.com/jobs/view/4122027286
globallogic|trainee с/c++ embedded developer irc252859|lviv, lviv, ukraine|https://www.linkedin.com/jobs/view/4124183256
globallogic|trainee с embedded developer (linux, networking) irc243016|lviv, lviv, ukraine|https://www.linkedin.com/jobs/view/4087423365
globallogic|trainee .net azure cloud engineer irc253345|lviv, lviv, ukraine|https://www.linkedin.com/jobs/view/4124181242
agileengine|paid media specialist (trainee: 6+ months of exp.) id23396|lviv, ukraine|https://www.linkedin.com/jobs/view/4125141594
agileengine|paid media specialist (trainee: 6+ months of exp.) id23396|kharkiv, ukraine|https://www.linkedin.com/jobs/view/4065894090
cisco|cisco incubator program 13 edition (networking) - emea|ukraine|https://www.linkedin.com/jobs/view/4126526145
kauri one inc|secretary manager (fintech/bank experience)|ukraine|https://www.linkedin.com/jobs/view/4118525683
agileengine|ppc marketing specialist (trainee: 6+ months of exp.) id23396|odessa, ukraine|https://www.linkedin.com/jobs/view/4085578839
agileengine|ppc marketing specialist (trainee: 6+ months of exp.) id23396|kyiv, kyiv city, ukraine|https://www.linkedin.com/jobs/view/4085582521
agileengine|ppc marketing specialist (trainee: 6+ months of exp.) id23396|dnipropetrovsk, ukraine|https://www.linkedin.com/jobs/view/4085582522
rio hondo college|graduate software developer - fully remote|basildon, england, united kingdom|https://www.linkedin.com/jobs/view/4120279470
dorset software|graduate software developer|poole, england, united kingdom|https://www.linkedin.com/jobs/view/4115787791
rio hondo college|graduate software developer - fully remote|nottingham, england, united kingdom|https://www.linkedin.com/jobs/view/4120275902
john gerlach & company llc|graduate software engineer|cambridge, england, united kingdom|https://www.linkedin.com/jobs/view/4103491310
sinara|graduate software engineer|london, england, united kingdom|https://www.linkedin.com/jobs/view/4120277704
dorset software|graduate software developer|manchester, england, united kingdom|https://www.linkedin.com/jobs/view/4082023228
dorset software|graduate software developer|oxford, england, united kingdom|https://www.linkedin.com/jobs/view/4082022589
roku|software engineer intern|cambridge, england, united kingdom|https://www.linkedin.com/jobs/view/4121361931
john gerlach & company llc|graduate software engineer|west midlands, england, united kingdom|https://www.linkedin.com/jobs/view/4105045945
gradfuel europe|software engineering graduate programme|london, england, united kingdom|https://www.linkedin.com/jobs/view/4075547496
it career switch|trainee web developer - no experience required|reading, england, united kingdom|https://www.linkedin.com/jobs/view/3976929364
it career switch|trainee web developer - no experience required|brighton, england, united kingdom|https://www.linkedin.com/jobs/view/4039235421
gradfuel europe|software engineering technology graduate|birmingham, england, united kingdom|https://www.linkedin.com/jobs/view/4117625074
gradfuel europe|software engineering technology graduate|leeds, england, united kingdom|https://www.linkedin.com/jobs/view/4117636030
reply|graduate software developer|manchester, england, united kingdom|https://www.linkedin.com/jobs/view/4077503225
grayce|graduate data consultant|twickenham, england, united kingdom|https://www.linkedin.com/jobs/view/4108542863
grayce|graduate data analyst - london|london, england, united kingdom|https://www.linkedin.com/jobs/view/4081283430
gradfuel europe|software engineering technology graduate|sheffield, england, united kingdom|https://www.linkedin.com/jobs/view/4117644284
gradfuel europe|software engineering graduate programme|edinburgh, scotland, united kingdom|https://www.linkedin.com/jobs/view/4075546552
gradfuel europe|software engineering graduate programme|glasgow, scotland, united kingdom|https://www.linkedin.com/jobs/view/4075544846
grayce|graduate data consultant|cambridge, england, united kingdom|https://www.linkedin.com/jobs/view/4108546230
it career switch|trainee web developer - no experience required|canterbury, england, united kingdom|https://www.linkedin.com/jobs/view/4089103408
it career switch|trainee web developer - no experience required|bradford, england, united kingdom|https://www.linkedin.com/jobs/view/4015529410
highbury consulting|graduate software engineer|city of london, england, united kingdom|https://www.linkedin.com/jobs/view/4118642069
it career switch|trainee web developer - no experience required|glasgow, scotland, united kingdom|https://www.linkedin.com/jobs/view/3976929373
it career switch|trainee web developer - no experience required|newcastle upon tyne, england, united kingdom|https://www.linkedin.com/jobs/view/4082014623
it career switch|trainee web developer - no experience required|bath, england, united kingdom|https://www.linkedin.com/jobs/view/4015527651
grayce|graduate data analyst|bolton, england, united kingdom|https://www.linkedin.com/jobs/view/4114507747
grayce|graduate data analyst|manchester, england, united kingdom|https://www.linkedin.com/jobs/view/4114507745
it career switch|trainee web developer - no experience required|exeter, england, united kingdom|https://www.linkedin.com/jobs/view/3946568546
oliver bernard|graduate software developer|newcastle upon tyne, england, united kingdom|https://www.linkedin.com/jobs/view/4119544690
storyteq|graduate data administrator|birmingham, england, united kingdom|https://www.linkedin.com/jobs/view/4118677794
hackajob|graduate software engineer|shirebrook, england, united kingdom|https://www.linkedin.com/jobs/view/4104082208
bending spoons|graduate software engineer|manchester area, united kingdom|https://www.linkedin.com/jobs/view/4125977481
oliver bernard|graduate software engineer|newcastle upon tyne, england, united kingdom|https://www.linkedin.com/jobs/view/4102935431
ocado group|software engineering graduate|hatfield, england, united kingdom|https://www.linkedin.com/jobs/view/4105585010
mondrian alpha|graduate software developer – boutique systematic mayfair hedge fund – excellent compensation + benefits|london area, united kingdom|https://www.linkedin.com/jobs/view/4117159699
oliver bernard|graduate software developer|newcastle upon tyne, england, united kingdom|https://www.linkedin.com/jobs/view/4125913549
amazon|2025 graduate software dev engineer|london, england, united kingdom|https://www.linkedin.com/jobs/view/4051048565
hunter bond|2025 graduate software engineer – elite startup (up to £200k + bonus + hybrid)|london area, united kingdom|https://www.linkedin.com/jobs/view/4122611160
spectrum it recruitment|graduate software developer|southampton, england, united kingdom|https://www.linkedin.com/jobs/view/4118953320
bending spoons|graduate software engineer|cambridgeshire, england, united kingdom|https://www.linkedin.com/jobs/view/4125913316
tpp|graduate software developer|leeds, england, united kingdom|https://www.linkedin.com/jobs/view/4093233285
bending spoons|graduate software engineer|leeds, england, united kingdom|https://www.linkedin.com/jobs/view/4125980035
e-careers|software developer trainee|blackpool, england, united kingdom|https://www.linkedin.com/jobs/view/4079078640
bt group|software engineering graduate|belfast, northern ireland, united kingdom|https://www.linkedin.com/jobs/view/4092115072
bending spoons|graduate software engineer|exeter, england, united kingdom|https://www.linkedin.com/jobs/view/4125974689
bending spoons|graduate software engineer|edinburgh, scotland, united kingdom|https://www.linkedin.com/jobs/view/4125908811
synkka|graduate software engineer|london area, united kingdom|https://www.linkedin.com/jobs/view/4118678277
oho group ltd|graduate software engineer|cambridge, england, united kingdom|https://www.linkedin.com/jobs/view/4120706216
e-careers|software developer trainee|culcheth, england, united kingdom|https://www.linkedin.com/jobs/view/4079075960
motorola solutions|graduate software engineer|glasgow, scotland, united kingdom|https://www.linkedin.com/jobs/view/4120274960
samsung cambridge solution centre|graduate embedded software engineer (wi-fi firmware)|cambridge, england, united kingdom|https://www.linkedin.com/jobs/view/4052006164
oho group ltd|graduate software engineer|london area, united kingdom|https://www.linkedin.com/jobs/view/4120716466
oho group ltd|graduate software engineer|hertfordshire, england, united kingdom|https://www.linkedin.com/jobs/view/4119824568
oho group ltd|graduate software engineer|london area, united kingdom|https://www.linkedin.com/jobs/view/4118951021
grayce|graduate data scientist|london area, united kingdom|https://www.linkedin.com/jobs/view/4117247518
fitch group, inc.|associate software engineer, graduate program, london - september 2025|london, england, united kingdom|https://www.linkedin.com/jobs/view/4057299139
grayce|graduate data analyst|london area, united kingdom|https://www.linkedin.com/jobs/view/4117246601
emerge web studio|junior software engineer - c#|east sussex, england, united kingdom|https://www.linkedin.com/jobs/view/4083522330
reply|graduate java developer|london area, united kingdom|https://www.linkedin.com/jobs/view/4093603518
capua|graduate data analyst (visa sponsorship available)|london area, united kingdom|https://www.linkedin.com/jobs/view/4123355663
oliver bernard|2025 graduate developer|newcastle upon tyne, england, united kingdom|https://www.linkedin.com/jobs/view/4118299367
moody's corporation|moody's insurance solutions graduate program 2025-data science|london, england, united kingdom|https://www.linkedin.com/jobs/view/4078139701
mustard systems ltd.|graduate execution trader|london area, united kingdom|https://www.linkedin.com/jobs/view/4123336869
mediatek|graduate software engineer 2025|cambourne, england, united kingdom|https://www.linkedin.com/jobs/view/4043519831
grayce|digital graduate - register your interest|greater london, england, united kingdom|https://www.linkedin.com/jobs/view/4062528397
quick release_|graduate analyst intake 2025|derby, england, united kingdom|https://www.linkedin.com/jobs/view/4110712741
complete probe solutions inc.|front end developer|brighton, england, united kingdom|https://www.linkedin.com/jobs/view/4120275987
randstad digital|graduate embedded software engineer|buckingham, england, united kingdom|https://www.linkedin.com/jobs/view/4121339069
virgin media o2|technology graduate|reading, england, united kingdom|https://www.linkedin.com/jobs/view/4116860133
oliver bernard|graduate engineer|newcastle upon tyne, england, united kingdom|https://www.linkedin.com/jobs/view/4117139464
adsyst (automation) limited|trainee / junior / graduate project engineer|yateley, england, united kingdom|https://www.linkedin.com/jobs/view/4104284385
gradfuel europe|modern engineering graduate programme|newcastle upon tyne, england, united kingdom|https://www.linkedin.com/jobs/view/4058291606
supersmith|graduate r&d engineer|greater bristol area, united kingdom|https://www.linkedin.com/jobs/view/4125775369
capgemini|graduate software engineering programme 2025|telford, england, united kingdom|https://www.linkedin.com/jobs/view/4058376396
motorola solutions|junior software engineer|glasgow, scotland, united kingdom|https://www.linkedin.com/jobs/view/3965161661
gradfuel europe|financial services banking graduate trainee|london, england, united kingdom|https://www.linkedin.com/jobs/view/4045750683
gradfuel europe|actuarial pensions graduate programme|birmingham, england, united kingdom|https://www.linkedin.com/jobs/view/4046651209
free-work uk|graduate software developer|churchdown, england, united kingdom|https://www.linkedin.com/jobs/view/4123147258
ic resources|graduate embedded software engineer|cambridgeshire, england, united kingdom|https://www.linkedin.com/jobs/view/4126123323
gradbay|graduate software engineer|london area, united kingdom|https://www.linkedin.com/jobs/view/4126032007
apadmi|2025 software engineering internship|manchester, england, united kingdom|https://www.linkedin.com/jobs/view/4117263223
gradfuel europe|corporate tax compliance graduate trainee|milton keynes, england, united kingdom|https://www.linkedin.com/jobs/view/4045810912
gradfuel europe|technology solutions programme 2025|london, england, united kingdom|https://www.linkedin.com/jobs/view/4047744117
robustelli ∙ soucy ∙ hussey, p.a.|data entry specialist graduate considered|city of london, england, united kingdom|https://www.linkedin.com/jobs/view/4106023967
grayce|graduate data engineer|london area, united kingdom|https://www.linkedin.com/jobs/view/4117248339
gradfuel europe|corporate tax compliance graduate trainee|birmingham, england, united kingdom|https://www.linkedin.com/jobs/view/4045811481
gradfuel europe|corporate tax compliance graduate trainee|nottingham, england, united kingdom|https://www.linkedin.com/jobs/view/4045815135
neurocore llc|graduate design engineer|alfreton, england, united kingdom|https://www.linkedin.com/jobs/view/4120281182
hydrock, now stantec|graduate mechanical engineer - plymouth (september 2025)|plympton, england, united kingdom|https://www.linkedin.com/jobs/view/4025740318
intellect group|graduate mechanical engineer|manchester, england, united kingdom|https://www.linkedin.com/jobs/view/4119773859
gradfuel europe|actuarial pensions graduate programme|leeds, england, united kingdom|https://www.linkedin.com/jobs/view/4046647969
labman|graduate robotics engineer start september 2025 at labman automation|harrogate, england, united kingdom|https://www.linkedin.com/jobs/view/4120280101
moody's corporation|moody's insurance solutions graduate program 2025 - customer success|london, england, united kingdom|https://www.linkedin.com/jobs/view/4069037344
informed solutions|placement programme - digital transformation 2025/26|altrincham, england, united kingdom|https://www.linkedin.com/jobs/view/4084886529
oliver bernard|graduate platform engineer - saas - £40k|london area, united kingdom|https://www.linkedin.com/jobs/view/4125956520
intellect group|junior devops engineer – graduate - cloud / devops|united kingdom|https://www.linkedin.com/jobs/view/4118705091
jpmorganchase|2025 glasgow graduate software apprenticeship - emerging talent programme|glasgow, scotland, united kingdom|https://www.linkedin.com/jobs/view/4048234371
hydrock, now stantec|graduate electrical engineer - plymouth (september 2025)|plympton, england, united kingdom|https://www.linkedin.com/jobs/view/4025741064
ocado group|ux graduate|hatfield, england, united kingdom|https://www.linkedin.com/jobs/view/4124739313
one utility bill|full-stack developer|newcastle upon tyne, england, united kingdom|https://www.linkedin.com/jobs/view/4108506381
rsm uk|graduate analyst - digital careers - birmingham - august 2025|birmingham, england, united kingdom|https://www.linkedin.com/jobs/view/4048445846
gradfuel europe|technology solutions programme 2025|birmingham, england, united kingdom|https://www.linkedin.com/jobs/view/4047739607
leonardo|software engineering graduate apprenticeship|edinburgh, scotland, united kingdom|https://www.linkedin.com/jobs/view/4058000921
gradfuel europe|specialist tax graduate trainee|london, england, united kingdom|https://www.linkedin.com/jobs/view/4045814671
motorola solutions|graduate c# software engineer|glasgow, scotland, united kingdom|https://www.linkedin.com/jobs/view/4123060539
gradfuel europe|technology solutions programme 2025|southampton, england, united kingdom|https://www.linkedin.com/jobs/view/4047737939
gradfuel europe|technology solutions programme 2025|nottingham, england, united kingdom|https://www.linkedin.com/jobs/view/4047742504
canonical|graduate/associate software engineer - build & release infrastructure|manchester, england, united kingdom|https://www.linkedin.com/jobs/view/4121136440
itdev|graduate digital design engineer|southampton, england, united kingdom|https://www.linkedin.com/jobs/view/4125037547
hardeman communicatie|full-stack developer|newcastle upon tyne, england, united kingdom|https://www.linkedin.com/jobs/view/4120278307
gradfuel europe|technology solutions programme 2025|leeds, england, united kingdom|https://www.linkedin.com/jobs/view/4047742499
gradfuel europe|technology solutions programme 2025|manchester, england, united kingdom|https://www.linkedin.com/jobs/view/4047740690
talan|marketing executive - graduate position|london, england, united kingdom|https://www.linkedin.com/jobs/view/4125866093
tiptopjob|graduate design engineer|dorset, england, united kingdom|https://www.linkedin.com/jobs/view/4107482728
wrc group|graduate consultant (technical consulting)|united kingdom|https://www.linkedin.com/jobs/view/4118688640
gradfuel europe|technology solutions programme 2025|warwick, england, united kingdom|https://www.linkedin.com/jobs/view/4047743176
gradfuel europe|public sector graduate trainee|newcastle upon tyne, england, united kingdom|https://www.linkedin.com/jobs/view/4045802539
gradfuel europe|technology solutions programme 2025|bath, england, united kingdom|https://www.linkedin.com/jobs/view/4047740518
cavendish nuclear|data analyst graduate apprenticeship|helensburgh, scotland, united kingdom|https://www.linkedin.com/jobs/view/4073070789
whd consulting ltd.|software engineer|southampton, england, united kingdom|https://www.linkedin.com/jobs/view/4099099717
gradfuel europe|technology solutions programme 2025|glasgow, scotland, united kingdom|https://www.linkedin.com/jobs/view/4047705629
genesis|graduate process engineer, london|london, england, united kingdom|https://www.linkedin.com/jobs/view/4107887434
proserv|graduate engineer|cumbernauld, scotland, united kingdom|https://www.linkedin.com/jobs/view/4098426960
gps ltd.|graduate software engineer|bristol, england, united kingdom|https://www.linkedin.com/jobs/view/4125084561
siluettispa|graduate business development executive|london, england, united kingdom|https://www.linkedin.com/jobs/view/4035356680
tiptopjob|graduate mechanical engineer|milton keynes, england, united kingdom|https://www.linkedin.com/jobs/view/4107482654
tiptopjob|graduate design engineer|high wycombe, england, united kingdom|https://www.linkedin.com/jobs/view/4107485415
crouch waterfall & partners ltd|graduate civil/structural engineer|cardiff, wales, united kingdom|https://www.linkedin.com/jobs/view/4122191286
queueco|quantitative developer hft|london, england, united kingdom|https://www.linkedin.com/jobs/view/3982452372
leonardo|graduate test software engineer|southampton, england, united kingdom|https://www.linkedin.com/jobs/view/4057211148
s-sa digital|software engineer|milton keynes, england, united kingdom|https://www.linkedin.com/jobs/view/4121820957
canonical|graduate/associate software engineer - build & release infrastructure|glasgow, scotland, united kingdom|https://www.linkedin.com/jobs/view/4121137288
siluettispa|stem graduate software sales development representative|london, england, united kingdom|https://www.linkedin.com/jobs/view/4092994179
experis scotland|software engineer|stoke-on-trent, england, united kingdom|https://www.linkedin.com/jobs/view/4112130743
moody's corporation|moody's insurance solutions graduate program 2025- software engineering|edinburgh, scotland, united kingdom|https://www.linkedin.com/jobs/view/4069037346
