company|title|location|link
trifork|experienced .net developer|aarhus, central denmark region, denmark|https://www.linkedin.com/jobs/view/4058098205
trifork|experienced .net developer|greater aarhus area, worldwide|https://www.linkedin.com/jobs/view/4102448666
sopra steria|er du klar til at skabe innovative løsninger som senior .net udvikler?|copenhagen, capital region of denmark, denmark|https://www.linkedin.com/jobs/view/4074253527
lederne - danmarks største lederorganisation|lead cloud engineer|copenhagen metropolitan area, worldwide|https://www.linkedin.com/jobs/view/4102928758
sopra steria|senior data engineer til nyopstartet team|copenhagen, capital region of denmark, denmark|https://www.linkedin.com/jobs/view/4067800298
1worldsync|(senior) software engineer|cologne, north rhine-westphalia, germany|https://www.linkedin.com/jobs/view/3999858868
smarketer gmbh|full stack developer (w/m/d)|berlin, berlin, germany|https://www.linkedin.com/jobs/view/4104171073
knowit|data engineer til vårt cloud-team|oslo, oslo, norway|https://www.linkedin.com/jobs/view/4106726068
ev.careers|senior cloud software engineer, cloud infrastructure|serbia, stari grad, worldwide|https://www.linkedin.com/jobs/view/4097295877
insider.|software developer – insider testinium tech hub (remote)|greater istanbul, worldwide|https://www.linkedin.com/jobs/view/4092393853
faktor zehn|junior softwareentwickler java für unser trainee programm (mensch*)|austria|https://www.linkedin.com/jobs/view/4105585036
twoday|software developer|copenhagen municipality, capital region of denmark, denmark|https://www.linkedin.com/jobs/view/4106254515
twoday|software developer|aarhus, central denmark region, denmark|https://www.linkedin.com/jobs/view/4106254504
testhuset.dk|tester - aarhus|aarhus, central denmark region, denmark|https://www.linkedin.com/jobs/view/4012638999
cvation - part of skaylink|software engineer|copenhagen, capital region of denmark, denmark|https://www.linkedin.com/jobs/view/4105025300
testhuset.dk|tester - ballerup|ballerup, capital region of denmark, denmark|https://www.linkedin.com/jobs/view/3919168315
analog devices|engineer, field applications, new college grad program|copenhagen metropolitan area, worldwide|https://www.linkedin.com/jobs/view/4035639096
testhuset.dk|test manager - aarhus|aarhus, central denmark region, denmark|https://www.linkedin.com/jobs/view/3919163794
testhuset.dk|test manager - ballerup|ballerup, capital region of denmark, denmark|https://www.linkedin.com/jobs/view/3919167574
körber|automation engineer, remote assistance|svenstrup, region zealand, denmark|https://www.linkedin.com/jobs/view/3954038209
bloom|erfaren project manager|odense, region of southern denmark, denmark|https://www.linkedin.com/jobs/view/4091440171
comet x-ray|pta technician|copenhagen metropolitan area, worldwide|https://www.linkedin.com/jobs/view/4089317669
kombit a/s|kombit søger en product manager til beskæftigelses- og ydelsesområdet|copenhagen metropolitan area, worldwide|https://www.linkedin.com/jobs/view/4102723075
ramboll|erfaren softwareudvikler til rambøll stakeholder intelligence|aarhus, central denmark region, denmark|https://www.linkedin.com/jobs/view/3994746394
kvik a/s|planlægningsspecialist|vildbjerg, central denmark region, denmark|https://www.linkedin.com/jobs/view/4106452835
oluf brønnum & co a/s|regnskabsansvarlig|ellekær, capital region of denmark, denmark|https://www.linkedin.com/jobs/view/4094424157
hofor|løsningsarkitekt til strategiske platforme|copenhagen, capital region of denmark, denmark|https://www.linkedin.com/jobs/view/4095825137
banedanmark|vil du udvide dine kompetencer som software developer?|copenhagen, capital region of denmark, denmark|https://www.linkedin.com/jobs/view/4090216636
analog devices|engineer, field applications, new college grad program|helsinki metropolitan area, worldwide|https://www.linkedin.com/jobs/view/4035636205
arm|graduate micro-architect and performance modelling engineer - cpu|sophia antipolis, provence-alpes-côte d'azur, france|https://www.linkedin.com/jobs/view/4059678958
burger & cie|chargé paie & administration du personnel h/f|lièpvre, grand est, france|https://www.linkedin.com/jobs/view/4102326476
deposco|associate consultant  - may 2025 grad|ga, alpharetta, worldwide|https://www.linkedin.com/jobs/view/4024329658
salesforce|software engineering amts/mts (new grad)|ga, atlanta, worldwide|https://www.linkedin.com/jobs/view/4066585330
enercon services, inc.|new graduate may/june 2025 - electrical engineer - enercon federal services|ga, kennesaw, worldwide|https://www.linkedin.com/jobs/view/3998510365
enercon services, inc.|new graduate may/june 2025- safety analysis engineer|ga, kennesaw, worldwide|https://www.linkedin.com/jobs/view/4001285104
hntb|new grad engineer i - summer 2025|ga, atlanta, worldwide|https://www.linkedin.com/jobs/view/4033105826
salesforce|sales development representative (new grad)|ga, atlanta, worldwide|https://www.linkedin.com/jobs/view/4090626277
enercon services, inc.|new graduate may/june 2025 - civil/structural engineer - enercon federal services|ga, kennesaw, worldwide|https://www.linkedin.com/jobs/view/4031690088
enercon services, inc.|may/june 2025 new graduate - distribution engineer - power delivery group|ga, kennesaw, worldwide|https://www.linkedin.com/jobs/view/4032256754
enercon services, inc.|intern - distribution engineer - power delivery|ga, kennesaw, worldwide|https://www.linkedin.com/jobs/view/4001277306
enercon services, inc.|new graduate may/june 2025 - civil/structural engineer - nuclear services group|ga, kennesaw, worldwide|https://www.linkedin.com/jobs/view/4098330525
1898 & co.|energy & utilities analyst, electrical engineer 1898 & co. (atlanta or charlotte)|ga, atlanta, worldwide|https://www.linkedin.com/jobs/view/4017902341
databricks|software engineer - new grad (2025 start)|berlin, berlin, germany|https://www.linkedin.com/jobs/view/4023889358
steadforce|software backend engineer (m/w/d)|munich, bavaria, germany|https://www.linkedin.com/jobs/view/3837967325
sc media house|werkstudent:in fullstack development (m/w/d)|munich, bavaria, germany|https://www.linkedin.com/jobs/view/4089977388
wattify gmbh|youki - backend developer|amberg, bavaria, germany|https://www.linkedin.com/jobs/view/3834260469
doctolib|head of go-to-market strategy (x/f/m)|berlin, germany|https://www.linkedin.com/jobs/view/3987549147
analog devices|engineer, field applications, new college grad program|greater munich metropolitan area, worldwide|https://www.linkedin.com/jobs/view/4011673105
remondis it|softwarearchitekt java (m/w/d)|lünen, north rhine-westphalia, germany|https://www.linkedin.com/jobs/view/4095547219
barmeniagothaer|backend-entwickler (w/m/d) java|wuppertal, north rhine-westphalia, germany|https://www.linkedin.com/jobs/view/3602966863
bonprix|software engineer fullstack (m/w/d)|hamburg, hamburg, germany|https://www.linkedin.com/jobs/view/4090618568
carl|m&a intern (m/w/d)|berlin, berlin, germany|https://www.linkedin.com/jobs/view/4027789640
mayflower gmbh|senior backend entwickler*in in java, spring boot (w/d/m)|nuremberg, bavaria, germany|https://www.linkedin.com/jobs/view/4014347743
mayflower gmbh|senior fullstack engineer*in (w/d/m)|munich, bavaria, germany|https://www.linkedin.com/jobs/view/3999078685
thought leader systems|initiativbewerbung|frankfurt, hesse, germany|https://www.linkedin.com/jobs/view/3834271917
mayflower gmbh|senior fullstack engineer*in (w/d/m)|nuremberg, bavaria, germany|https://www.linkedin.com/jobs/view/3999083270
doctolib|manager go-to-market strategy (x/f/m)|berlin, berlin, germany|https://www.linkedin.com/jobs/view/4008915066
u2d  up2date solutions gmbh|projektmanager event-software (m/w/d)|nuremberg, bavaria, germany|https://www.linkedin.com/jobs/view/4091928177
iabg|projektleiter software engineering (m/w/d)|munich, bavaria, germany|https://www.linkedin.com/jobs/view/4022381305
mayflower gmbh|senior python engineer*in mit schwerpunkt genai (w/d/m)|munich, bavaria, germany|https://www.linkedin.com/jobs/view/3993236571
orendt studios holding gmbh|ai technical artist for stable diffusion / flux (m/w/d)|ratingen, north rhine-westphalia, germany|https://www.linkedin.com/jobs/view/4026293495
remondis it|devops engineer (m/w/d)|lünen, north rhine-westphalia, germany|https://www.linkedin.com/jobs/view/4095550247
wattify gmbh|youki - founders associate market|amberg, bavaria, germany|https://www.linkedin.com/jobs/view/3834269594
the formula consulting|praktikum (d/m/w) recruiting|berlin, berlin, germany|https://www.linkedin.com/jobs/view/4030180637
november - vorsorge & bestattungen|sales operations manager (gn)|berlin, berlin, germany|https://www.linkedin.com/jobs/view/4089489394
mayflower gmbh|senior python engineer*in mit schwerpunkt genai (w/d/m)|nuremberg, bavaria, germany|https://www.linkedin.com/jobs/view/3993260708
simon-kucher|sourcing manager it (m/w/d) – frankfurt|frankfurt, hesse, germany|https://www.linkedin.com/jobs/view/4000336363
the formula consulting|praktikum (d/m/w) entrepreneurship bei remote first personalberatungs-startup|berlin, berlin, germany|https://www.linkedin.com/jobs/view/4086673019
remondis it|mitarbeiter im service desk / it support (m/w/d)|lünen, north rhine-westphalia, germany|https://www.linkedin.com/jobs/view/4016828934
swiss life deutschland|anwendungsentwickler (m/w/d) / devops engineer (m/w/d)|munich, bavaria, germany|https://www.linkedin.com/jobs/view/4084789841
holcim|it specialist/it-spezialist|mannheim, baden-württemberg, germany|https://www.linkedin.com/jobs/view/4088308398
mayflower gmbh|senior python engineer mit schwerpunkt genai (w/d/m)|nuremberg, bavaria, germany|https://www.linkedin.com/jobs/view/4107852577
simon-kucher|sourcing manager it (m/w/d) – hamburg|hamburg, hamburg, germany|https://www.linkedin.com/jobs/view/4000332720
schöller si|marketing- und sales-manager (m/w/d)|reutlingen, baden-württemberg, germany|https://www.linkedin.com/jobs/view/4090300426
mayflower gmbh|senior frontend developer mit typescript (w/d/m)|nuremberg, bavaria, germany|https://www.linkedin.com/jobs/view/4107856062
mayflower gmbh|senior frontend developer mit typescript (w/d/m)|würzburg, bavaria, germany|https://www.linkedin.com/jobs/view/4107854270
provinzial konzern|solution designer - bereich rückversicherung (all genders)|greater kiel area, worldwide|https://www.linkedin.com/jobs/view/4078622163
tietalent|oracle datenbankadministrator (m/w/d)|lünen, north rhine-westphalia, germany|https://www.linkedin.com/jobs/view/4084353704
rentcard gmbh|werkstudent (m/w/d) - produkt management  operations  support|augsburg, bavaria, germany|https://www.linkedin.com/jobs/view/4106080312
mayflower gmbh|senior frontend developer*in mit typescript (w/d/m)|nuremberg, bavaria, germany|https://www.linkedin.com/jobs/view/4100471563
provinzial konzern|solution designer - bereich rückversicherung (all genders)|greater munster area, worldwide|https://www.linkedin.com/jobs/view/4078620161
dekabank|werkstudent (w/m/d) für financial planning|frankfurt, hesse, germany|https://www.linkedin.com/jobs/view/4101192076
mayflower gmbh|senior frontend developer*in mit typescript (w/d/m)|munich, bavaria, germany|https://www.linkedin.com/jobs/view/4100474344
charry gmbh|praktikant (m/w/d) - business development|munich, bavaria, germany|https://www.linkedin.com/jobs/view/4101733366
remondis it|it lizenzmanager (m/w/d)|lünen, north rhine-westphalia, germany|https://www.linkedin.com/jobs/view/4095548219
veeva systems|sales development program (germany)|berlin, germany|https://www.linkedin.com/jobs/view/4025588066
itb consulting gmbh|spezialist:in für online-umfragen & datenmanagement (m/w/d) gesucht!|bonn, north rhine-westphalia, germany|https://www.linkedin.com/jobs/view/4106701895
join.com|conny gmbh: no-code specialist  (m/w/d)|berlin, berlin, germany|https://www.linkedin.com/jobs/view/4106740905
join.com|veeva systems: sales development program|germany|https://www.linkedin.com/jobs/view/4107122047
tietalent|it lizenzmanager (m/w/d)|lünen, north rhine-westphalia, germany|https://www.linkedin.com/jobs/view/4084350994
deutsche hausverwaltung plus gmbh|it-support und schulungskoordinator (m/w/d)|düsseldorf, north rhine-westphalia, germany|https://www.linkedin.com/jobs/view/4091415159
veeva systems|sales development program (germany)|germany|https://www.linkedin.com/jobs/view/4012332641
bite gmbh|customer success manager (m/w/d)|neu ulm, bavaria, germany|https://www.linkedin.com/jobs/view/4053116128
belform|senior projektleiter / projektmanager im innenausbau / objekteinrichtung in münchen (m/w/d)|munich, bavaria, germany|https://www.linkedin.com/jobs/view/4094472018
thermo fisher scientific|dualen studenten (m/w/d)  betriebswirtschaftslehre dual b.sc. (m/w/d)|langenselbold, hesse, germany|https://www.linkedin.com/jobs/view/4095478130
tietalent|consultant business analyse – öffentliche verwaltung / public service (all genders)|stuttgart, baden-württemberg, germany|https://www.linkedin.com/jobs/view/4081600949
robotron datenbank-software gmbh|(senior-) software developer prognose & ki|leipzig, saxony, germany|https://www.linkedin.com/jobs/view/4108510586
robert walters|saas - sales consultant (m/w/d)|düsseldorf, north rhine-westphalia, germany|https://www.linkedin.com/jobs/view/3602817577
join.com|eypro mugrauer & schnele gmbh: konstrukteur:in|neresheim, baden-württemberg, germany|https://www.linkedin.com/jobs/view/4080397974
deutsche hausverwaltung plus gmbh|objektbetreuer (m/w/d) in der weg-verwaltung|leipzig, saxony, germany|https://www.linkedin.com/jobs/view/4072744342
gp joule|werkstudent*in im bereich geschäftsfeldentwicklung / produktmanagement|hamburg, hamburg, germany|https://www.linkedin.com/jobs/view/3842102345
tietalent|consultant business analyse – öffentliche verwaltung / public service (all genders)|kaiserslautern, rhineland-palatinate, germany|https://www.linkedin.com/jobs/view/4081607074
tietalent|consultant business analyse – öffentliche verwaltung / public service (all genders)|dresden, saxony, germany|https://www.linkedin.com/jobs/view/4081600950
testa motari automotive gmbh|teilkonstrukteur/technischer zeichner (m/w/d) (technische/r produktdesigner/in (ohne fachrichtungen))|johanngeorgenstadt, saxony, germany|https://www.linkedin.com/jobs/view/4096836638
giesecke+devrient|procurement excellence manager (m/w/d)|munich, bavaria, germany|https://www.linkedin.com/jobs/view/4099932223
shimadzu deutschland gmbh|service ingenieur*in / techniker*in toc|düsseldorf, north rhine-westphalia, germany|https://www.linkedin.com/jobs/view/4075643272
payback|praktikum loyalty consulting (m/w/d)|munich, bavaria, germany|https://www.linkedin.com/jobs/view/4090960253
volkswagen group services gmbh|duales studium 2025 i logistik- und informationsmanagement (m/w/d)|wolfsburg, lower saxony, germany|https://www.linkedin.com/jobs/view/3964141397
swiss life deutschland|enterprise architect (m/w/d)|hannover, lower saxony, germany|https://www.linkedin.com/jobs/view/4086887317
inspiralia gmbh|consultant für fördermittel in deutschland (m/w/d)|berlin, berlin, germany|https://www.linkedin.com/jobs/view/4105707297
shimadzu deutschland gmbh|service ingenieur*in / techniker*in icp & gc|berlin, berlin, germany|https://www.linkedin.com/jobs/view/4102773543
vesterling ag|junior berater sap ppm  kundenprojekte, prozesse, sap eppm  homeoffice (mwd)|frankfurt, hesse, germany|https://www.linkedin.com/jobs/view/3904080050
horeich|produktmanager:in und product owner steuerungs- und monitoringsysteme umwelt und infrastruktur in vollzeit|erlangen, bavaria, germany|https://www.linkedin.com/jobs/view/4100535123
shimadzu deutschland gmbh|service ingenieur*in / techniker*in toc & gc/gcms|hannover, lower saxony, germany|https://www.linkedin.com/jobs/view/4103698904
otto-von-guericke university magdeburg|435/2024 wissenschaftliche*r mitarbeiter*in (m/w/d) im bereich "transfer learning für ki-anwendungen auf basis von low-cost fpgas“|magdeburg, saxony-anhalt, germany|https://www.linkedin.com/jobs/view/4102196872
lapp group|duales studium: bwl-digital business management|stuttgart, baden-württemberg, germany|https://www.linkedin.com/jobs/view/4104794768
inspiralia gmbh|consultant für fördermittel in deutschland (m/w/d)|berlin, germany|https://www.linkedin.com/jobs/view/4101124611
join.com|pier7 architekten gmbh: architekt (m/w/d) für die entwurfs- und ausführungsplanung|düsseldorf, north rhine-westphalia, germany|https://www.linkedin.com/jobs/view/4099667148
robotron datenbank-software gmbh|(senior-) software-developer für den fachbereich messwesen und iot energiewirtschaft|dresden, saxony, germany|https://www.linkedin.com/jobs/view/4102910687
rent4event|bürokraft für die verwaltung und buchhaltung m/w/d|düsseldorf, north rhine-westphalia, germany|https://www.linkedin.com/jobs/view/4106776452
holidu|praktikum account management schwarzwald (w/m/d)|freiburg, baden-württemberg, germany|https://www.linkedin.com/jobs/view/4099777478
kaufland e-commerce|übersetzer/translator (all genders) deutsch-italienisch|germany|https://www.linkedin.com/jobs/view/4091843670
vesterling ag|sap eppm senior consultant  projekte, prozesse, ppm, eppm  bis 95.000€, homeoffice möglich (mwd)|germany|https://www.linkedin.com/jobs/view/3904077725
holidu|sales manager schwarzwald (w/m/d)|freiburg, baden-württemberg, germany|https://www.linkedin.com/jobs/view/4022773126
insulet corporation|territory manager (field based)|erfurt, thuringia, germany|https://www.linkedin.com/jobs/view/4068388944
accenture dach|consultant business analyse – öffentliche verwaltung / public service (all genders)|kronberg, hesse, germany|https://www.linkedin.com/jobs/view/4058531532
continentale versicherungsverbund|duales studium wirtschaftsmathematik aktuarwissenschaften an der th rosenheim, bachelor of science|munich, bavaria, germany|https://www.linkedin.com/jobs/view/4089899305
vesterling ag|sap eppm senior consultant  projekte, prozesse, ppm, eppm  bis 95.000€, homeoffice möglich (mwd)|frankfurt, hesse, germany|https://www.linkedin.com/jobs/view/3904079115
twilio|software engineering graduate - dublin, ireland (start: june/july 2025)|ireland|https://www.linkedin.com/jobs/view/4101153244
2k|senior manager, engineering graduate program|dublin, county dublin, ireland|https://www.linkedin.com/jobs/view/4101277920
motorola solutions|junior embedded software engineer|cork, county cork, ireland|https://www.linkedin.com/jobs/view/4072061965
analog devices|fy24 graduate software engineering opportunities|limerick, county limerick, ireland|https://www.linkedin.com/jobs/view/3814645177
analog devices|fy25 graduate software engineering opportunities|limerick, county limerick, ireland|https://www.linkedin.com/jobs/view/4018482472
analog devices|fy24 graduate electronic engineering opportunities|limerick, county limerick, ireland|https://www.linkedin.com/jobs/view/3814642546
analog devices|fy25 graduate electronic engineering opportunities|limerick, county limerick, ireland|https://www.linkedin.com/jobs/view/4018482473
psc biotech corporation|ehs specialist|carlow, county carlow, ireland|https://www.linkedin.com/jobs/view/4105437526
altair|presales specialist – data analytics|turin, piedmont, italy|https://www.linkedin.com/jobs/view/3707666267
databricks|software engineer - new grad (2025 start)|amsterdam, north holland, netherlands|https://www.linkedin.com/jobs/view/4023888460
grafana labs|observability architect (remote, netherlands)|brabantine city row, worldwide|https://www.linkedin.com/jobs/view/4109311165
telenor|software engineer frontend / fullstack|norway|https://www.linkedin.com/jobs/view/4095726066
accenture nordics|fullstack java utvickler|oslo, oslo, norway|https://www.linkedin.com/jobs/view/4106575494
storebrand|senior backend-utvikler|stavanger, rogaland, norway|https://www.linkedin.com/jobs/view/4106492247
datek|embedded developer|oslo, norway|https://www.linkedin.com/jobs/view/4084421825
letsreg|chief technology officer|oslo, oslo, norway|https://www.linkedin.com/jobs/view/4104337070
storebrand|team development manager|stavanger, rogaland, norway|https://www.linkedin.com/jobs/view/4090659387
norconsult|supportmedarbeider it|bærum, viken, norway|https://www.linkedin.com/jobs/view/4106214950
johnson controls|project engineer/prosjektingeniør - nybygg & retrofit prosjekter|oslo, oslo, norway|https://www.linkedin.com/jobs/view/4092009875
johnson controls|automasjonsingeniør|greater oslo region, worldwide|https://www.linkedin.com/jobs/view/4092012801
johnson controls|serviceingeniør – byggautomasjon|oslo, oslo, norway|https://www.linkedin.com/jobs/view/4092010822
amd|optical flow engineer – temporal image analysis|warsaw, mazowieckie, poland|https://www.linkedin.com/jobs/view/4030403057
stripe|software engineer, new grad|bucharest, bucharest, romania|https://www.linkedin.com/jobs/view/4008213454
hipo.ro|software engineer, new grad|ilfov, romania|https://www.linkedin.com/jobs/view/4058713548
whatnot|software engineer, 2025 new grad|los angeles metropolitan area, worldwide|https://www.linkedin.com/jobs/view/4082660346
varda space industries|general application (new grad)|el segundo, canada|https://www.linkedin.com/jobs/view/4088900472
skanska|2025 new-grad entry level engineer rotation program (california/cctp)|los angeles, canada|https://www.linkedin.com/jobs/view/4067603686
technip energies|process design engineer (2025 new grad)|claremont, canada|https://www.linkedin.com/jobs/view/4107385947
technip energies|mechanical engineer (new grad)|claremont, canada|https://www.linkedin.com/jobs/view/4107391275
hntb|new grad electrical engineer i - summer 2025|los angeles, canada|https://www.linkedin.com/jobs/view/4072345731
hntb|new grad civil engineer i - summer 2025|los angeles, canada|https://www.linkedin.com/jobs/view/4040478845
technip energies|civil/structural engineer (2025 new grad)|claremont, canada|https://www.linkedin.com/jobs/view/4107386853
technip energies|(new grad) scheduler i|claremont, canada|https://www.linkedin.com/jobs/view/4088568738
hntb|new grad civil engineer i - aviation - summer 2025|los angeles, canada|https://www.linkedin.com/jobs/view/4072957340
california therapy services|home health occupational therapist assistant (cota)|alhambra, canada|https://www.linkedin.com/jobs/view/4098610025
california therapy services|home health occupational therapist (ot)|montebello, canada|https://www.linkedin.com/jobs/view/4106275312
california therapy services|home health occupational therapist (ot)|downey, canada|https://www.linkedin.com/jobs/view/4105438130
california therapy services|home health occupational therapist (ot) - pasadena|pasadena, canada|https://www.linkedin.com/jobs/view/4107925042
california therapy services|home health occupational therapist (ot)|los angeles, canada|https://www.linkedin.com/jobs/view/4102136835
california therapy services|home health occupational therapist (ot)|glendale, canada|https://www.linkedin.com/jobs/view/4102073492
california therapy services|home health speech therapist (slp)|los angeles, canada|https://www.linkedin.com/jobs/view/4103385431
california therapy services|home health speech therapist (slp)|los angeles, canada|https://www.linkedin.com/jobs/view/4106238845
california therapy services|home health occupational therapist assistant (cota)|los angeles, canada|https://www.linkedin.com/jobs/view/4102585432
california therapy services|home health occupational therapist assistant (cota)|east los angeles, canada|https://www.linkedin.com/jobs/view/4102583738
california therapy services|home health occupational therapist (ot)|los angeles, canada|https://www.linkedin.com/jobs/view/4086203262
california therapy services|home health occupational therapist (ot)|los angeles, canada|https://www.linkedin.com/jobs/view/4085983193
california therapy services|home health occupational therapist assistant (cota)|west covina, canada|https://www.linkedin.com/jobs/view/4103390180
california therapy services|home health occupational therapist (ot)|los angeles, canada|https://www.linkedin.com/jobs/view/4109741380
california therapy services|home health speech therapist (slp)|los angeles, canada|https://www.linkedin.com/jobs/view/4105433605
california therapy services|home health occupational therapist (ot)|inglewood, canada|https://www.linkedin.com/jobs/view/4098604683
california therapy services|home health occupational therapist (ot)|los angeles, canada|https://www.linkedin.com/jobs/view/4107699896
california therapy services|home health occupational therapist (ot)|los angeles, canada|https://www.linkedin.com/jobs/view/4107704112
california therapy services|home health occupational therapist (ot)|bell gardens, canada|https://www.linkedin.com/jobs/view/4088798503
california therapy services|home health occupational therapist (ot)|los angeles, canada|https://www.linkedin.com/jobs/view/4108484552
california therapy services|home health occupational therapist (ot)|los angeles, canada|https://www.linkedin.com/jobs/view/4084652500
california therapy services|home health occupational therapist (ot)|los angeles, canada|https://www.linkedin.com/jobs/view/4084651531
california therapy services|home health occupational therapist (ot) west covina|west covina, canada|https://www.linkedin.com/jobs/view/4097033965
california therapy services|home health occupational therapist (ot)|los angeles, canada|https://www.linkedin.com/jobs/view/4108729858
california therapy services|home health speech therapist (slp)|east los angeles, canada|https://www.linkedin.com/jobs/view/4090146163
california therapy services|home health occupational therapist (ot)|culver city, canada|https://www.linkedin.com/jobs/view/4109739758
california therapy services|home health speech therapist (slp)|los angeles, canada|https://www.linkedin.com/jobs/view/4102071550
