company|title|location|link
amazon web services (aws)|engagement manager, aws professional services|madrid, community of madrid, spain|https://www.linkedin.com/jobs/view/4126622083
canonical|cloud professional services manager|valencia, valencian community, spain|https://www.linkedin.com/jobs/view/4139240913
canonical|engineering manager - ubuntu security|murcia, región de murcia, spain|https://www.linkedin.com/jobs/view/4118547705
canonical|engineering manager - ubuntu security|málaga, andalusia, spain|https://www.linkedin.com/jobs/view/4118548664
canonical|cloud professional services manager|málaga, andalusia, spain|https://www.linkedin.com/jobs/view/4139246497
canonical|engineering manager - ubuntu security|valencia, valencian community, spain|https://www.linkedin.com/jobs/view/4118548670
canonical|engineering manager - ubuntu security|barcelona, catalonia, spain|https://www.linkedin.com/jobs/view/4118548659
canonical|cloud professional services manager|murcia, región de murcia, spain|https://www.linkedin.com/jobs/view/4139245517
canonical|hr generalist - emea|barcelona, catalonia, spain|https://www.linkedin.com/jobs/view/4068132736
canonical|cloud professional services manager|barcelona, catalonia, spain|https://www.linkedin.com/jobs/view/4139246487
clarivate|product owner - ipfolio|barcelona, catalonia, spain|https://www.linkedin.com/jobs/view/4103444429
sap|sales development executive - turkey|barcelona, catalonia, spain|https://www.linkedin.com/jobs/view/4130577180
canonical|engineering manager - security standards and hardening|madrid, community of madrid, spain|https://www.linkedin.com/jobs/view/4118746236
canonical|engineering manager - security standards and hardening|sevilla la nueva, community of madrid, spain|https://www.linkedin.com/jobs/view/4118743572
legal army|senior privacy & data protection consultant|madrid, community of madrid, spain|https://www.linkedin.com/jobs/view/4132706704
advento|german speaking marketing consultant (hybrid)|barcelona, catalonia, spain|https://www.linkedin.com/jobs/view/4107793628
advento.spain|german speaking marketing consultant (hybrid)|barcelona, catalonia, spain|https://www.linkedin.com/jobs/view/4143661024
worley|senior technical consultant, power & new energy|madrid, community of madrid, spain|https://www.linkedin.com/jobs/view/4036927589
advento|german speaking marketing consultant - hybrid (with relocation package)|barcelona, catalonia, spain|https://www.linkedin.com/jobs/view/4107790962
airbus aircraft|#discover i 2025-2026 maintenance engineering support in illescas plant internship|illescas, castile-la mancha, spain|https://www.linkedin.com/jobs/view/4046672531
bosch españa|estudiante en prácticas -- departamento rbem/mss1|madrid, community of madrid, spain|https://www.linkedin.com/jobs/view/4137895473
airbus aircraft|#discover i 2025-2026 maintenance support to new production line in illescas plant internship|illescas, castile-la mancha, spain|https://www.linkedin.com/jobs/view/4043152404
spain internship|business assistant internship in barcelona, spain|barcelona, catalonia, spain|https://www.linkedin.com/jobs/view/4061484933
abb|marketing trainee|sant quirze del vallès, catalonia, spain|https://www.linkedin.com/jobs/view/4145481695
six senses hotels resorts spas|finance trainee (2025) - six senses ibiza|balearic islands, spain|https://www.linkedin.com/jobs/view/4055504629
vall d’hebron institute of research (vhir) - vall d'hebron institut de recerca|phd student (clinical neuroimmunology)|barcelona, catalonia, spain|https://www.linkedin.com/jobs/view/4086636988
saab|recent graduated engineers - your future challenge starts here!|järfälla, stockholm county, sweden|https://www.linkedin.com/jobs/view/4040494140
netlight|software developer (consultant, graduate)|stockholm, stockholm county, sweden|https://www.linkedin.com/jobs/view/3686111631
sectra|junior software developer, backend - sectra medical|linköping, östergötland county, sweden|https://www.linkedin.com/jobs/view/4138256780
sambanova systems|software engineer|stockholm, stockholm county, sweden|https://www.linkedin.com/jobs/view/4096917063
ericsson|next generation: junior developer|stockholm, stockholm county, sweden|https://www.linkedin.com/jobs/view/4150087004
canonical|graduate/associate software engineer - build & release infrastructure|stockholm, stockholm county, sweden|https://www.linkedin.com/jobs/view/4121139013
zettle by paypal|ios developer - recent graduate|stockholm, stockholm county, sweden|https://www.linkedin.com/jobs/view/4017505082
verisure|graduate program: full-stack developer – installation & maintenance|malmo, skåne county, sweden|https://www.linkedin.com/jobs/view/4149638786
ericsson|next generation: software developer|stockholm, stockholm county, sweden|https://www.linkedin.com/jobs/view/4151578780
canonical|software engineer - python - container images|stockholm, stockholm county, sweden|https://www.linkedin.com/jobs/view/4117658470
canonical|software engineer - python - container images|stockholm, stockholm county, sweden|https://www.linkedin.com/jobs/view/4138531352
emerson|summer job - product engineer|mölnlycke, västra götaland county, sweden|https://www.linkedin.com/jobs/view/4142111436
ocean infinity|trainee geophysicist|gothenburg, västra götaland county, sweden|https://www.linkedin.com/jobs/view/4135526348
canonical|software engineer - python - container images|stockholm, stockholm county, sweden|https://www.linkedin.com/jobs/view/4068934763
canonical|software engineer - python - container images|stockholm, stockholm county, sweden|https://www.linkedin.com/jobs/view/4089849856
canonical|software engineer - python - container images|stockholm, stockholm county, sweden|https://www.linkedin.com/jobs/view/4089851755
canonical|software engineer - python - container images|stockholm, stockholm county, sweden|https://www.linkedin.com/jobs/view/4068181963
ericsson|next generation: developer verification|stockholm, stockholm county, sweden|https://www.linkedin.com/jobs/view/4145202410
scandic hotels|scandic hotels tech trainee program 2025/2026|stockholm, stockholm county, sweden|https://www.linkedin.com/jobs/view/4152105282
canonical|software engineer - go - container images|stockholm, stockholm county, sweden|https://www.linkedin.com/jobs/view/4068275119
thermo fisher scientific|senior software developer|uppsala, uppsala county, sweden|https://www.linkedin.com/jobs/view/4142989829
canonical|software engineer - go - container images|stockholm, stockholm county, sweden|https://www.linkedin.com/jobs/view/4068932967
ssab|production platform specialist - digital graduate program|luleå, norrbotten county, sweden|https://www.linkedin.com/jobs/view/4147604831
lime technologies|technical project manager trainee|stockholm, stockholm county, sweden|https://www.linkedin.com/jobs/view/4137516900
lime technologies|technical project manager trainee|lund, skåne county, sweden|https://www.linkedin.com/jobs/view/4137517519
koenigsegg automotive ab|infotainment aosp software engineer|ängelholm, skåne county, sweden|https://www.linkedin.com/jobs/view/4119393284
emerson|approvals engineer|mölnlycke, västra götaland county, sweden|https://www.linkedin.com/jobs/view/4151607704
luleå university of technology|phd student in cyber-physical systems|luleå, norrbotten county, sweden|https://www.linkedin.com/jobs/view/4133395561
syntronic - a global design house|thesis proposal - predictive cloud-based scaling algorithms|gothenburg, västra götaland county, sweden|https://www.linkedin.com/jobs/view/4064481043
uppsala university|phd student in machine learning for computational linear algebra|uppsala, uppsala county, sweden|https://www.linkedin.com/jobs/view/4132342785
canonical|embedded linux field engineering manager|stockholm, stockholm county, sweden|https://www.linkedin.com/jobs/view/4122063144
canonical|junior hr generalist - emea|stockholm, stockholm county, sweden|https://www.linkedin.com/jobs/view/4105731485
canonical|engineering manager|stockholm, stockholm county, sweden|https://www.linkedin.com/jobs/view/4127923422
canonical|linux software manager - server platforms|stockholm, stockholm county, sweden|https://www.linkedin.com/jobs/view/4136389023
zscaler latam|sales development representative ftc|stockholm, stockholm county, sweden|https://www.linkedin.com/jobs/view/4118846546
canonical|iot solutions architecture manager|stockholm, stockholm county, sweden|https://www.linkedin.com/jobs/view/4138530277
kongsberg maritime|technical sales support - hydrodynamics|kristinehamn, värmland county, sweden|https://www.linkedin.com/jobs/view/4149418069
emerson|summer job - production planner|mölnlycke, västra götaland county, sweden|https://www.linkedin.com/jobs/view/4142489642
sap|sales development executive - sap concur|stockholm, stockholm county, sweden|https://www.linkedin.com/jobs/view/4124092566
ul solutions|senior sales executive, esg reporting software|gothenburg, västra götaland county, sweden|https://www.linkedin.com/jobs/view/4143591215
gartner|sr director, analyst - advising chief marketing officers in tech companies (remote uk, ireland, netherlands, sweden, denmark, finland)|stockholm, stockholm county, sweden|https://www.linkedin.com/jobs/view/4144002684
quintus technologies|quintus trainee program|västerås, västmanland county, sweden|https://www.linkedin.com/jobs/view/4106444293
oracle|graduate software developer|zurich, zurich, switzerland|https://www.linkedin.com/jobs/view/4142049143
julius baer|university graduate – software engineering 100% (f/m/d)|zurich, zurich, switzerland|https://www.linkedin.com/jobs/view/4151097811
ubs|2025 graduate talent program – tech – front-end engineer – zurich|zurich, zurich, switzerland|https://www.linkedin.com/jobs/view/4110875022
ubs|2025 graduate talent program – tech – full stack engineer – zurich|zurich, zurich, switzerland|https://www.linkedin.com/jobs/view/4110868933
talendo|2025 tomorrow’s talent program – technology – switzerland|zurich, zurich, switzerland|https://www.linkedin.com/jobs/view/4151631329
talendo|2025 graduate talent program – technology – data engineer – zurich|zurich, zurich, switzerland|https://www.linkedin.com/jobs/view/4151625794
anybotics|manipulation software engineering internship|zurich, zurich, switzerland|https://www.linkedin.com/jobs/view/4109030901
julius baer|university graduate – junior business analyst (flex-track) 100% (f/m/d)|zurich, zurich, switzerland|https://www.linkedin.com/jobs/view/4151305166
anybotics|perception software engineering internship|zurich, zurich, switzerland|https://www.linkedin.com/jobs/view/4136333734
ubs|2025 graduate talent program – technology – data engineer – zurich|zurich, zurich, switzerland|https://www.linkedin.com/jobs/view/4112965058
specialized bicycle components|ride control engineer|cham, zug, switzerland|https://www.linkedin.com/jobs/view/4064315667
monolithic power systems, inc.|r & d engineer/scientist intern|tolochenaz, vaud, switzerland|https://www.linkedin.com/jobs/view/4080034059
siga|trainee digitalisierung und softwareentwicklung|ruswil, lucerne, switzerland|https://www.linkedin.com/jobs/view/3991644184
international olympic committee – ioc|athletes engagement trainee|lausanne, vaud, switzerland|https://www.linkedin.com/jobs/view/4131436643
ubs|2025 summer internship program – technology – eng & architecture – zh|zurich, zurich, switzerland|https://www.linkedin.com/jobs/view/4015645952
westermo network technologies|senior software engineer (all genders)|bubikon, zurich, switzerland|https://www.linkedin.com/jobs/view/4092717320
cern|hvac project engineer (sce-sam-in-2024-168-grap)|geneva, geneva, switzerland|https://www.linkedin.com/jobs/view/4130507114
suva|trainee system-engineer 80 - 100 %|lucerne, lucerne, switzerland|https://www.linkedin.com/jobs/view/4141798364
uniplex ag|trainee / praktikum online marketing (m,w,100%)|dübendorf, zurich, switzerland|https://www.linkedin.com/jobs/view/4148210538
international olympic committee – ioc|internal communications trainee|lausanne, vaud, switzerland|https://www.linkedin.com/jobs/view/4144416269
emerson|service engineer (m/w/d)|baar, zug, switzerland|https://www.linkedin.com/jobs/view/3970147725
bavarian nordic|trainee quality control|bern, berne, switzerland|https://www.linkedin.com/jobs/view/4144905739
geo technology s.a.|avl expert dyno testing technician m/w/x|roche, vaud, switzerland|https://www.linkedin.com/jobs/view/4138966569
vertiv|project manager|zurich, switzerland|https://www.linkedin.com/jobs/view/4126244981
zurich international school|upper school design technology teacher|adliswil, zurich, switzerland|https://www.linkedin.com/jobs/view/4147604359
thomson reuters|senior research scientist (foundational research, machine learning)|zug, zug, switzerland|https://www.linkedin.com/jobs/view/4068256735
zhaw zurich university of applied sciences|phd student in mixed reality and generative ai|winterthur, zurich, switzerland|https://www.linkedin.com/jobs/view/4126027043
ubs|sr. software engineer in mobile banking|zurich, zurich, switzerland|https://www.linkedin.com/jobs/view/3963879919
emerson|senior control systems engineer|basel, basel, switzerland|https://www.linkedin.com/jobs/view/3970146782
emerson|senior control systems engineer|baar, zug, switzerland|https://www.linkedin.com/jobs/view/3970147730
medicalis  suisse|secrétaire médicale diplômée avec formation panorama|geneva, geneva, switzerland|https://www.linkedin.com/jobs/view/4149735721
emerson|product marketing manager (m/w/d) - handling and feeding europe|zell, lucerne, switzerland|https://www.linkedin.com/jobs/view/4151335297
university of bern|phd student in gender studies and epidemiology|bern, berne, switzerland|https://www.linkedin.com/jobs/view/4151318680
csem|phd student or post-doc in sustainable trust anchor for iot|neuchâtel, neuchâtel, switzerland|https://www.linkedin.com/jobs/view/3802412748
kanton bern|phd student in gender studies and epidemiology|bern-mittelland, berne, switzerland|https://www.linkedin.com/jobs/view/4151937811
datasite|senior sales executive|zurich, zurich, switzerland|https://www.linkedin.com/jobs/view/4077535006
centre dentaire carouge|assistante dentaire diplomée|carouge, geneva, switzerland|https://www.linkedin.com/jobs/view/4080376209
fis freeride world tour|community manager|lausanne, vaud, switzerland|https://www.linkedin.com/jobs/view/4139635461
dia|associate director, marketing - emeai|basel, basel, switzerland|https://www.linkedin.com/jobs/view/4126542803
talendo|it trainee (w/m/d)|zurich, zurich, switzerland|https://www.linkedin.com/jobs/view/4151624700
telpa a.ş.|cloud engineer (fresh graduate)|istanbul, istanbul, worldwide|https://www.linkedin.com/jobs/view/4144348392
jungleworks|software sales trainee (remote job)|türkiye, worldwide|https://www.linkedin.com/jobs/view/4006370177
icron  planning and optimization solutions|new graduate program (industrial engineers)|sarıyer, istanbul, worldwide|https://www.linkedin.com/jobs/view/3972373160
adesso turkey|software developer (.net)|türkiye, worldwide|https://www.linkedin.com/jobs/view/4130862060
insider.|deal desk (fresh graduate)|istanbul, istanbul, worldwide|https://www.linkedin.com/jobs/view/4143016212
tei - tusaş engine industries, inc.|stress analysis engineer|kartal, istanbul, worldwide|https://www.linkedin.com/jobs/view/4054900364
hewlett packard enterprise|onsite engineer - graduate|istanbul, istanbul, worldwide|https://www.linkedin.com/jobs/view/4142237395
epam systems|.net specialization trainee|türkiye, worldwide|https://www.linkedin.com/jobs/view/4151321296
canonical|software engineer - python - container images|türkiye, i̇stanbul, worldwide|https://www.linkedin.com/jobs/view/4117660198
canonical|software engineer - python - container images|türkiye, i̇stanbul, worldwide|https://www.linkedin.com/jobs/view/4089854419
canonical|software engineer - python - container images|türkiye, i̇stanbul, worldwide|https://www.linkedin.com/jobs/view/4068937361
canonical|software engineer - python - container images|türkiye, i̇stanbul, worldwide|https://www.linkedin.com/jobs/view/4089849865
canonical|software engineer - python - container images|ankara, ankara, worldwide|https://www.linkedin.com/jobs/view/4138532209
canonical|software engineer - python - container images|ankara, ankara, worldwide|https://www.linkedin.com/jobs/view/4138526956
canonical|software engineer - python - container images|türkiye, i̇stanbul, worldwide|https://www.linkedin.com/jobs/view/4068180942
canonical|software engineer - python - container images|ankara, ankara, worldwide|https://www.linkedin.com/jobs/view/4089850819
horse|tuning project leader|nilufer, bursa, worldwide|https://www.linkedin.com/jobs/view/4149061732
canonical|graduate sales development representative|türkiye, i̇stanbul, worldwide|https://www.linkedin.com/jobs/view/4068127326
eurasia tunnel operation construction and investment sa|information system specialist|türkiye, istanbul, worldwide|https://www.linkedin.com/jobs/view/4144350023
canonical|software engineer - go - container images|türkiye, i̇stanbul, worldwide|https://www.linkedin.com/jobs/view/4068937205
canonical|software engineer - go - container images|türkiye, i̇stanbul, worldwide|https://www.linkedin.com/jobs/view/4068276099
canonical|software engineer - go - container images|ankara, ankara, worldwide|https://www.linkedin.com/jobs/view/4117651252
canonical|software engineer - go - container images|türkiye, i̇stanbul, worldwide|https://www.linkedin.com/jobs/view/4089853567
radiometer|its professional|ataşehir, istanbul, worldwide|https://www.linkedin.com/jobs/view/4151426572
canonical|software engineer - go - container images|ankara, ankara, worldwide|https://www.linkedin.com/jobs/view/4068130964
canonical|software engineer - go - container images|ankara, ankara, worldwide|https://www.linkedin.com/jobs/view/4089851624
adesso turkey|devops engineer|türkiye, worldwide|https://www.linkedin.com/jobs/view/4142443923
canonical|software engineer - go - container images|ankara, ankara, worldwide|https://www.linkedin.com/jobs/view/4068931990
renesas electronics|ams verification engineer|greater istanbul, worldwide|https://www.linkedin.com/jobs/view/4074079504
renesas electronics|ams verification engineer|greater istanbul, worldwide|https://www.linkedin.com/jobs/view/4058461561
canonical|embedded linux field engineering manager|ankara, ankara, worldwide|https://www.linkedin.com/jobs/view/4122065015
canonical|embedded linux field engineering manager|türkiye, i̇stanbul, worldwide|https://www.linkedin.com/jobs/view/4122063141
lely turkey software development|human resources specialist|maltepe, istanbul, worldwide|https://www.linkedin.com/jobs/view/4128046963
etiya|technical expert, application operations|türkiye, istanbul, worldwide|https://www.linkedin.com/jobs/view/4133396562
eurasia tunnel operation construction and investment sa|information technology specialist|türkiye, istanbul, worldwide|https://www.linkedin.com/jobs/view/4144358167
adesso turkey|lead software developer (ios)|türkiye, worldwide|https://www.linkedin.com/jobs/view/4108504415
canonical|linux software manager - server platforms|ankara, ankara, worldwide|https://www.linkedin.com/jobs/view/4136386277
canonical|linux software manager - server platforms|türkiye, i̇stanbul, worldwide|https://www.linkedin.com/jobs/view/4136381771
good job games|motion designer, marketing|türkiye, istanbul, worldwide|https://www.linkedin.com/jobs/view/4086477532
adesso turkey|senior software developer (ios)|türkiye, worldwide|https://www.linkedin.com/jobs/view/4142440226
canonical|iot solutions architecture manager|türkiye, i̇stanbul, worldwide|https://www.linkedin.com/jobs/view/4138527347
canonical|cloud field engineering manager|ankara, ankara, worldwide|https://www.linkedin.com/jobs/view/4138527362
san diego supercomputer center|mas csp program coordinator - 134302|of, trabzon, worldwide|https://www.linkedin.com/jobs/view/4141607039
roofstacks|senior platform support specialist|istanbul, istanbul, worldwide|https://www.linkedin.com/jobs/view/4108538517
intertech information technology and marketing inc.|main banking senior application system engineer|türkiye, istanbul, worldwide|https://www.linkedin.com/jobs/view/4132082698
vakıf katılım|customer analytics manager|ümraniye, istanbul, worldwide|https://www.linkedin.com/jobs/view/4129848231
canonical|junior hr generalist - emea|ankara, ankara, worldwide|https://www.linkedin.com/jobs/view/4105731484
sestek|sales account manager|istanbul, istanbul, worldwide|https://www.linkedin.com/jobs/view/4099206540
mavi|store manager|istanbul, istanbul, worldwide|https://www.linkedin.com/jobs/view/4138569766
canonical|hr generalist - emea|ankara, ankara, worldwide|https://www.linkedin.com/jobs/view/4068134219
peoplein i̇nsan kaynakları ve danışmanlık|cyber security and network admin|greater istanbul, worldwide|https://www.linkedin.com/jobs/view/4145106207
adesso turkey|senior sap sd consultant|türkiye, istanbul, worldwide|https://www.linkedin.com/jobs/view/4126133899
sestek|product owner|greater ankara, worldwide|https://www.linkedin.com/jobs/view/4126457774
adesso turkey|senior sap mm consultant|türkiye, istanbul, worldwide|https://www.linkedin.com/jobs/view/4126139579
metro türkiye|construction projects executive|türkiye, istanbul, worldwide|https://www.linkedin.com/jobs/view/4137903376
sestek|product owner|türkiye, ankara, worldwide|https://www.linkedin.com/jobs/view/4125825235
hilton|cluster commercial clerk - bodrum|bodrum bucağı, muğla, worldwide|https://www.linkedin.com/jobs/view/4104803017
n-ix|trainee data engineer|ukraine|https://www.linkedin.com/jobs/view/4145564543
n-ix|trainee manual qa engineer|ukraine|https://www.linkedin.com/jobs/view/4137549382
renesas electronics|graduate business systems analyst|lviv, lviv, ukraine|https://www.linkedin.com/jobs/view/4152407016
globallogic|java trainee engineer irc254319|lviv, lviv, ukraine|https://www.linkedin.com/jobs/view/4151425106
globallogic|trainee software engineer (c/embedded) irc253755|kyiv, kyiv city, ukraine|https://www.linkedin.com/jobs/view/4130555578
globallogic|trainee software engineer (c/embedded) irc253755|lviv, lviv, ukraine|https://www.linkedin.com/jobs/view/4130552861
globallogic|java trainee engineer irc254319|kyiv, kyiv city, ukraine|https://www.linkedin.com/jobs/view/4151425105
globallogic|trainee c developer irc255364|lviv, lviv, ukraine|https://www.linkedin.com/jobs/view/4141952633
everymatrix|trainee-junior incident manager|lviv, lviv, ukraine|https://www.linkedin.com/jobs/view/4120410080
techmagic|trainee devops engineer|lviv, lviv, ukraine|https://www.linkedin.com/jobs/view/4139721709
mercedes-amg petronas formula one team|graduate software engineer|brackley, england, united kingdom|https://www.linkedin.com/jobs/view/4145306183
dorset software|graduate software developer|bristol, england, united kingdom|https://www.linkedin.com/jobs/view/4133976196
dorset software|graduate software developer|manchester, england, united kingdom|https://www.linkedin.com/jobs/view/4082023228
dorset software|graduate software developer|oxford, england, united kingdom|https://www.linkedin.com/jobs/view/4082022589
dorset software|graduate software developer|poole, england, united kingdom|https://www.linkedin.com/jobs/view/4115787791
autodesk|graduate software engineer (starting q1 2025)|birmingham, england, united kingdom|https://www.linkedin.com/jobs/view/4141988416
sinara|graduate software engineer|london, england, united kingdom|https://www.linkedin.com/jobs/view/4137036696
dorset software|graduate software developer|edinburgh, scotland, united kingdom|https://www.linkedin.com/jobs/view/4132956842
robustelli ∙ soucy ∙ hussey, p.a.|application software engineer - javascript - graduate considered|cambridge, england, united kingdom|https://www.linkedin.com/jobs/view/4146402186
bipsync|graduate software engineer|cardiff, wales, united kingdom|https://www.linkedin.com/jobs/view/4149000306
tata technologies|graduate software engineer|warwick, england, united kingdom|https://www.linkedin.com/jobs/view/4139627820
reply|graduate software developer|manchester, england, united kingdom|https://www.linkedin.com/jobs/view/4129882937
it career switch|trainee web developer - no experience required|birmingham, england, united kingdom|https://www.linkedin.com/jobs/view/3976930357
grayce|graduate data analyst - london|london, england, united kingdom|https://www.linkedin.com/jobs/view/4145039512
robustelli ∙ soucy ∙ hussey, p.a.|graduate software engineer|cambridge, england, united kingdom|https://www.linkedin.com/jobs/view/4132960756
it career switch|trainee web developer - no experience required|wolverhampton, england, united kingdom|https://www.linkedin.com/jobs/view/3976931290
it career switch|trainee web developer - no experience required|canterbury, england, united kingdom|https://www.linkedin.com/jobs/view/4089103408
it career switch|trainee web developer - no experience required|dartford, england, united kingdom|https://www.linkedin.com/jobs/view/3925854467
it career switch|trainee web developer - no experience required|stourbridge, england, united kingdom|https://www.linkedin.com/jobs/view/4015526816
it career switch|trainee web developer - no experience required|nottingham, england, united kingdom|https://www.linkedin.com/jobs/view/3934738223
it career switch|trainee web developer - no experience required|newcastle upon tyne, england, united kingdom|https://www.linkedin.com/jobs/view/4082014623
s&p global|graduate software engineer|london, england, united kingdom|https://www.linkedin.com/jobs/view/4125950170
roku|software engineer intern|manchester, england, united kingdom|https://www.linkedin.com/jobs/view/4121361930
