company|title|location|link
analog devices|fy25 graduate product engineer, biosensor group|limerick, county limerick, ireland|https://www.linkedin.com/jobs/view/4102786378
canonical|software engineer - python - container images|stockholm, stockholm county, sweden|https://www.linkedin.com/jobs/view/4089849856
alpha bank|solution designer|athens metropolitan area, worldwide|https://www.linkedin.com/jobs/view/4095547620
canonical|software engineer - python - container images|budapest, budapest, hungary|https://www.linkedin.com/jobs/view/4068939135
canonical|graduate sales development representative|granada, andalusia, spain|https://www.linkedin.com/jobs/view/4023493231
canonical|software engineer - python - container images|stockholm, stockholm county, sweden|https://www.linkedin.com/jobs/view/4068934763
canonical|software engineer - python - container images|dresden, saxony, germany|https://www.linkedin.com/jobs/view/4089851752
canonical|software engineer - python - container images|dresden, saxony, germany|https://www.linkedin.com/jobs/view/4089849851
segula technologies|engine calibration engineer|titu, dîmboviţa, romania|https://www.linkedin.com/jobs/view/4095544176
analog devices|fy25 graduate analog design engineer|limerick, county limerick, ireland|https://www.linkedin.com/jobs/view/4088559404
canonical|software engineer - python - container images|wrocław, dolnośląskie, poland|https://www.linkedin.com/jobs/view/4089856002
mckinsey & company|junior capabilities & insights analyst - private equity|milan, lombardy, italy|https://www.linkedin.com/jobs/view/4002475321
canonical|graduate visual ui designer|tartu, tartumaa, worldwide|https://www.linkedin.com/jobs/view/4068270659
intracom defense|cybersecurity engineer|koropi, attiki, greece|https://www.linkedin.com/jobs/view/4108501162
canonical|software engineer - python - container images|düsseldorf, north rhine-westphalia, germany|https://www.linkedin.com/jobs/view/4089854414
canonical|software engineer - python - container images|wrocław, dolnośląskie, poland|https://www.linkedin.com/jobs/view/4068937363
deloitte|junior integration developer @ thessaloniki, patras, heraklion|iráklion, crete, greece|https://www.linkedin.com/jobs/view/3909945908
canonical|software engineer - python - container images|warsaw, mazowieckie, poland|https://www.linkedin.com/jobs/view/4089849859
3shape|graduate program - technical track|copenhagen, capital region of denmark, denmark|https://www.linkedin.com/jobs/view/4091174278
sgs|trainee (it) security evaluator (barcelona)|barcelona, catalonia, spain|https://www.linkedin.com/jobs/view/3971891942
asco engineering gmbh|htl-absolvent:in - technik talent (m/w/d)|wolfsberg, carinthia, austria|https://www.linkedin.com/jobs/view/4089271137
canonical|graduate visual ui designer|helsinki, uusimaa, finland|https://www.linkedin.com/jobs/view/4068270645
canonical|software engineer - python - container images|budapest, budapest, hungary|https://www.linkedin.com/jobs/view/4089852711
canonical|software engineer - python - container images|dresden, saxony, germany|https://www.linkedin.com/jobs/view/4026766735
oceaneering|engineer|stavanger, rogaland, norway|https://www.linkedin.com/jobs/view/4102043834
canonical|graduate sales development representative|bordeaux, nouvelle-aquitaine, france|https://www.linkedin.com/jobs/view/4068126414
canonical|graduate sales development representative|lille, hauts-de-france, france|https://www.linkedin.com/jobs/view/4068127324
canonical|software engineer - python - container images|barcelona, catalonia, spain|https://www.linkedin.com/jobs/view/4068934746
canonical|graduate visual ui designer|paris, île-de-france, france|https://www.linkedin.com/jobs/view/4068273335
deloitte|junior integration developer @ thessaloniki, patras, heraklion|thessaloniki, central macedonia, greece|https://www.linkedin.com/jobs/view/3909943913
segula technologies|engine calibration engineer|titu, dîmboviţa, romania|https://www.linkedin.com/jobs/view/4095542593
ifsas s.a.|field engineer|thessaloniki, central macedonia, greece|https://www.linkedin.com/jobs/view/4102751520
canonical|software engineer - python - container images|marousi, attiki, greece|https://www.linkedin.com/jobs/view/4089850815
adesso orange ag|trainee sap software developer (all genders)|karlsruhe, baden-württemberg, germany|https://www.linkedin.com/jobs/view/3733038933
canonical|software engineer - python - container images|marousi, attiki, greece|https://www.linkedin.com/jobs/view/4068938191
nokia|trainee, soc validation|oulu, north ostrobothnia, finland|https://www.linkedin.com/jobs/view/4074449252
canonical|software engineer - python - container images|granada, andalusia, spain|https://www.linkedin.com/jobs/view/4068938175
canonical|graduate visual ui designer|sevilla la nueva, community of madrid, spain|https://www.linkedin.com/jobs/view/4068130243
canonical|graduate visual ui designer|prague, prague, worldwide|https://www.linkedin.com/jobs/view/4068276240
amaris consulting|data engineer f/m/x|brussels, brussels region, belgium|https://www.linkedin.com/jobs/view/4010089598
sms group italy|automation engineer (rif. aut eng)|tarcento, friuli-venezia giulia, italy|https://www.linkedin.com/jobs/view/3980233585
canonical|graduate sales development representative|dresden, saxony, germany|https://www.linkedin.com/jobs/view/4068127321
canonical|graduate sales development representative|toulouse, occitanie, france|https://www.linkedin.com/jobs/view/4068127367
alma|sales enablement intern - 6 months internship (starting from january 2025)|paris, île-de-france, france|https://www.linkedin.com/jobs/view/4082664756
adesso orange ag|trainee sap software developer (all genders)|nuremberg, bavaria, germany|https://www.linkedin.com/jobs/view/3944436642
canonical|software engineer - python - container images|pisa, tuscany, italy|https://www.linkedin.com/jobs/view/4068184235
haeger consulting|trainee devops (als quereinsteiger)*|bonn, north rhine-westphalia, germany|https://www.linkedin.com/jobs/view/4104315419
canonical|software engineer - python - container images|nantes, pays de la loire, france|https://www.linkedin.com/jobs/view/4067131456
canonical|software engineer - python - container images|nantes, pays de la loire, france|https://www.linkedin.com/jobs/view/4068940116
adesso orange ag|trainee sap software developer (all genders)|flensburg, schleswig-holstein, germany|https://www.linkedin.com/jobs/view/3733040673
amazon|embedded camera system development engineer i, ring|tampere metropolitan area, worldwide|https://www.linkedin.com/jobs/view/4107203181
canonical|software engineer - python - container images|málaga, andalusia, spain|https://www.linkedin.com/jobs/view/4089853694
adesso orange ag|trainee sap software developer (all genders)|göttingen, lower saxony, germany|https://www.linkedin.com/jobs/view/3836753609
wüstenrot gruppe|full-stack developer - banking &amp; customer portal (m/w/d)|vienna, vienna, austria|https://www.linkedin.com/jobs/view/4087662519
wüstenrot gruppe|full-stack developer - banking &amp; customer portal (m/w/d)|salzburg, salzburg, austria|https://www.linkedin.com/jobs/view/4087659738
optidata a/s|back end developer|odense, region of southern denmark, denmark|https://www.linkedin.com/jobs/view/4095182146
apromas|softwareingeniør|viborg, central denmark region, denmark|https://www.linkedin.com/jobs/view/4105129598
fellowmind|data scientist med passion for data og fremtidens energiløsninger|copenhagen, capital region of denmark, denmark|https://www.linkedin.com/jobs/view/4091956093
inmobile|senior .net developer|aarhus municipality, central denmark region, denmark|https://www.linkedin.com/jobs/view/4103406562
plsp|softwareudvikler til fremtidens sundheds-it|skanderborg municipality, central denmark region, denmark|https://www.linkedin.com/jobs/view/4099091578
papa oscar ventures|junior web developer (m/w/d)|frankfurt, hesse, germany|https://www.linkedin.com/jobs/view/4079955902
papa oscar ventures|web developer - praktikum/werkstudent (m/w/d)|frankfurt, hesse, germany|https://www.linkedin.com/jobs/view/4079958465
itaricon|javascript entwickler (mensch*)|dresden, saxony, germany|https://www.linkedin.com/jobs/view/4072414658
dymatrix|(junior) cloud data engineer (all genders)|stuttgart, baden-württemberg, germany|https://www.linkedin.com/jobs/view/4017143419
marketer ux gmbh|webflow-developer (m/w/d) im medienhafen düsseldorf|düsseldorf, north rhine-westphalia, germany|https://www.linkedin.com/jobs/view/4094976293
nayoki|fullstack web developer (m/w/d) online marketing|munich, bavaria, germany|https://www.linkedin.com/jobs/view/4100511200
barmeniagothaer|full-stack entwickler (w/m/d)|wuppertal, north rhine-westphalia, germany|https://www.linkedin.com/jobs/view/3602972023
remondis it|softwareentwickler java (m/w/d)|lünen, north rhine-westphalia, germany|https://www.linkedin.com/jobs/view/4095546312
barmeniagothaer|linux system engineer (w/m/d)|wuppertal, north rhine-westphalia, germany|https://www.linkedin.com/jobs/view/3822572815
tietalent|oracle datenbankentwickler (m/w/d)|lünen, north rhine-westphalia, germany|https://www.linkedin.com/jobs/view/4084354574
tietalent|systems engineer linux (m/w/d)|lünen, north rhine-westphalia, germany|https://www.linkedin.com/jobs/view/4084351999
mayflower gmbh|senior fullstack engineer (w/d/m)|würzburg, bavaria, germany|https://www.linkedin.com/jobs/view/4107853519
mayflower gmbh|senior frontend developer mit typescript (w/d/m)|munich, bavaria, germany|https://www.linkedin.com/jobs/view/4014347661
mayflower gmbh|senior python engineer*in mit schwerpunkt genai (w/d/m)|würzburg, bavaria, germany|https://www.linkedin.com/jobs/view/3993263129
barmeniagothaer|sap entwickler (w/m/d) abap|wuppertal, north rhine-westphalia, germany|https://www.linkedin.com/jobs/view/3697208707
barmeniagothaer|site reliability engineer (w/m/d)|wuppertal, north rhine-westphalia, germany|https://www.linkedin.com/jobs/view/3737942064
barmeniagothaer|it system engineer (w/m/d) backup & recovery|wuppertal, north rhine-westphalia, germany|https://www.linkedin.com/jobs/view/3711081890
swiss life deutschland|generative ai engineer (m/w/d) mit aws expertise|munich, bavaria, germany|https://www.linkedin.com/jobs/view/4083888915
t&a systeme gmbh|business and web app developer (m/w/d)|hattingen, north rhine-westphalia, germany|https://www.linkedin.com/jobs/view/4105522000
robotron datenbank-software gmbh|(senior -) software developer prognose & ki|dresden, saxony, germany|https://www.linkedin.com/jobs/view/4096842288
tietalent|duales masterstudium data science und artificial intelligence (m/w/d) in wedel 2025|wedel, schleswig-holstein, germany|https://www.linkedin.com/jobs/view/4096137043
tietalent|auszubildende fachinformatikerin/fachinformatiker fuer systemintegration in berlin (w/m/d)|berlin, berlin, germany|https://www.linkedin.com/jobs/view/4096133703
tietalent|auszubildende fachinformatikerin/fachinformatiker fuer systemintegration in wiesbaden (w/m/d)|wiesbaden, hesse, germany|https://www.linkedin.com/jobs/view/4093506461
it search and selection|principal engineer production environment – dublin hybrid onsite/wfh|dublin, county dublin, ireland|https://www.linkedin.com/jobs/view/4104751926
euronext oslo børs|digital junior frontend developer|oslo, oslo, norway|https://www.linkedin.com/jobs/view/4102720632
sogeti|java utvikler|bergen, vestland, norway|https://www.linkedin.com/jobs/view/4100581777
tietoevry banking|oracle developer|greater oslo region, worldwide|https://www.linkedin.com/jobs/view/4090646714
gjensidige|data scientist|oslo, oslo, norway|https://www.linkedin.com/jobs/view/4102703793
tryg norge|devops engineer|bergen, vestland, norway|https://www.linkedin.com/jobs/view/4087142157
rule14 llc|data scientist - ai, ml, nlp developer|los angeles, canada|https://www.linkedin.com/jobs/view/4065927292
ev.careers|senior camera imaging software engineer|serbia, stari grad, worldwide|https://www.linkedin.com/jobs/view/4097294904
ev.careers|senior analytics engineer, sc&l|serbia, stari grad, worldwide|https://www.linkedin.com/jobs/view/4102538813
acronis|cloud expert engineer with french|serbia, stari grad, worldwide|https://www.linkedin.com/jobs/view/4000300808
acronis|secops engineer|serbia, stari grad, worldwide|https://www.linkedin.com/jobs/view/4074028903
knowit|frontend-utvecklare|linköping, östergötland county, sweden|https://www.linkedin.com/jobs/view/3654216648
b3 consulting group|system developer|linköping, östergötland county, sweden|https://www.linkedin.com/jobs/view/4092814477
b3 reach|system developer|linköpings kommun, östergötland county, sweden|https://www.linkedin.com/jobs/view/3818113088
b3 reach|system developer|linköpings kommun, östergötland county, sweden|https://www.linkedin.com/jobs/view/3831016208
b3 consulting group|system developer|jönköping, jönköping county, sweden|https://www.linkedin.com/jobs/view/4092811708
jobcourier|system engineer (m/w)|bern, berne, switzerland|https://www.linkedin.com/jobs/view/4042443760
aveniq|senior devops engineer container technologies|baden, aargau, switzerland|https://www.linkedin.com/jobs/view/4101151507
peak|data scientist (new grad)|türkiye, istanbul, worldwide|https://www.linkedin.com/jobs/view/4071395633
seges innovation|data engineer med sort bælte i databricks|aarhus, central denmark region, denmark|https://www.linkedin.com/jobs/view/4094721694
axel springer|system- / cloud engineer - identity access management (m/w/d)|berlin, germany|https://www.linkedin.com/jobs/view/4058444100
tietalent|auszubildende fachinformatikerin/fachinformatiker fuer anwendungsentwicklung in berlin (w/m/d)|berlin, berlin, germany|https://www.linkedin.com/jobs/view/4094687693
fluido|salesforce developer - danmark|gentofte, capital region of denmark, denmark|https://www.linkedin.com/jobs/view/3724308452
ikb deutsche industriebank ag|trainee firmenkundenbetreuung  (m/w/d)|frankfurt, hesse, germany|https://www.linkedin.com/jobs/view/3841782831
techseed|bi developer till medarbetarägt konsultbolag!|gothenburg, västra götaland county, sweden|https://www.linkedin.com/jobs/view/4072421532
we-site gmbh - shopify agentur|fullstack-entwickler (m/w/d) in vollzeit|hamburg, hamburg, germany|https://www.linkedin.com/jobs/view/4094682330
join.com|mondia group: java backend developer (m/f/d)|hamburg, hamburg, germany|https://www.linkedin.com/jobs/view/4097613599
ritz instrument transformers|application engineer (m/w/d)|hamburg, hamburg, germany|https://www.linkedin.com/jobs/view/4088229143
fis informationssysteme und consulting gmbh|sap entwickler abap (m/w/d)|hamburg, hamburg, germany|https://www.linkedin.com/jobs/view/3933375500
sgs|informatiker*in / systemtechniker*in als (senior) it-system engineer (m/w/d)|hamburg, hamburg, germany|https://www.linkedin.com/jobs/view/4034757654
palantir technologies|forward deployed software engineer, new grad|london, england, united kingdom|https://www.linkedin.com/jobs/view/3988302426
analog devices|engineer, field applications, new college grad program|hayes, england, united kingdom|https://www.linkedin.com/jobs/view/4011673103
planisware|solution engineer (w/m/d)|munich, bavaria, germany|https://www.linkedin.com/jobs/view/3584054253
columbus|senior data engineer  data & ai|oslo, oslo, norway|https://www.linkedin.com/jobs/view/3664572173
gjensidige|senior data scientist|oslo, oslo, norway|https://www.linkedin.com/jobs/view/4102744625
hiq|devops engineer|stockholm, stockholm county, sweden|https://www.linkedin.com/jobs/view/3927601855
opus recruitment solutions|frontend ingenieur (m/w/d)|karlsruhe, baden-württemberg, germany|https://www.linkedin.com/jobs/view/4088076850
t&a systeme gmbh|java enterprise developer (m/w/d)|hattingen, north rhine-westphalia, germany|https://www.linkedin.com/jobs/view/4108559529
remondis it|trainee requirements engineer (m/w/d)|lünen, north rhine-westphalia, germany|https://www.linkedin.com/jobs/view/4093675401
glueckkanja ag|cloud service engineer (m/w/d)|germany|https://www.linkedin.com/jobs/view/4087059095
saint-gobain|developer (m/w/d) organization & culture|herzogenrath, north rhine-westphalia, germany|https://www.linkedin.com/jobs/view/4077733970
testhuset.dk|teknisk tester - ballerup|ballerup, capital region of denmark, denmark|https://www.linkedin.com/jobs/view/3919164634
barmeniagothaer|devops engineer (w/m/d) kubernetes|wuppertal, north rhine-westphalia, germany|https://www.linkedin.com/jobs/view/3737938722
robotron datenbank-software gmbh|(senior-) software developer prognose & ki (m/w/d)|leipzig, saxony, germany|https://www.linkedin.com/jobs/view/4104054562
mayflower gmbh|senior python engineer mit schwerpunkt genai (w/d/m)|würzburg, bavaria, germany|https://www.linkedin.com/jobs/view/4107857041
breuninger|(senior) it systemadministrator / system engineer / devops engineer (m/w/d)|stuttgart, baden-württemberg, germany|https://www.linkedin.com/jobs/view/4074069686
robotron datenbank-software gmbh|robotron datenbank-software gmbh: (senior-) software-developer für den fachbereich messwesen und iot energiewirtschaft (m/w/d) - robotron datenbank-software gmbh - wachstumsregion dresden|dresden, saxony, germany|https://www.linkedin.com/jobs/view/4096845031
iabg|projektleiter systems engineering (heer) (m/w/d)|munich, bavaria, germany|https://www.linkedin.com/jobs/view/3780384893
canonical|software engineer - go - container images|vienna, vienna, austria|https://www.linkedin.com/jobs/view/4068937210
canonical|software engineer - go - container images|vienna, vienna, austria|https://www.linkedin.com/jobs/view/4089851648
canonical|software engineer - go - container images|vienna, vienna, austria|https://www.linkedin.com/jobs/view/4068132782
canonical|engineering manager|vienna, vienna, austria|https://www.linkedin.com/jobs/view/4068130537
accenture dach|trainee software-qualitätssicherung und testautomatisierung (all genders)|vienna, vienna, austria|https://www.linkedin.com/jobs/view/4058537553
in4matic|system engineer|ghent, flemish region, belgium|https://www.linkedin.com/jobs/view/4077597648
canonical|software engineer - go - container images|zagreb, zagreb, worldwide|https://www.linkedin.com/jobs/view/4068269906
canonical|software engineer - go - container images|zagreb, zagreb, worldwide|https://www.linkedin.com/jobs/view/4089851641
canonical|software engineer - go - container images|zagreb, zagreb, worldwide|https://www.linkedin.com/jobs/view/4068937245
avl in croatia|system engineer power electronic converters|zagreb, zagreb, worldwide|https://www.linkedin.com/jobs/view/4094494124
canonical|engineering manager|zagreb, zagreb, worldwide|https://www.linkedin.com/jobs/view/4068061836
netu group|senior system engineer|cyprus, nicosia, worldwide|https://www.linkedin.com/jobs/view/4091845142
hitachi rail|signalling it test and integration engineer|copenhagen, capital region of denmark, denmark|https://www.linkedin.com/jobs/view/4090636701
canonical|software engineer - go - container images|tartu, tartumaa, worldwide|https://www.linkedin.com/jobs/view/4089854304
kongsberg maritime|summer trainee, test engineer|turku, southwest finland, finland|https://www.linkedin.com/jobs/view/4106835770
canonical|software engineer - python - container images|helsinki, uusimaa, finland|https://www.linkedin.com/jobs/view/4068186023
canonical|software engineer - python - container images|lille, hauts-de-france, france|https://www.linkedin.com/jobs/view/4068934752
canonical|software engineer - python - container images|lille, hauts-de-france, france|https://www.linkedin.com/jobs/view/4068182318
canonical|software engineer - python - container images|marseille, provence-alpes-côte d'azur, france|https://www.linkedin.com/jobs/view/4089854417
canonical|software engineer - python - container images|marseille, provence-alpes-côte d'azur, france|https://www.linkedin.com/jobs/view/4089853708
canonical|software engineer - python - container images|paris, île-de-france, france|https://www.linkedin.com/jobs/view/4089852714
canonical|software engineer - python - container images|grenoble, auvergne-rhône-alpes, france|https://www.linkedin.com/jobs/view/4068939139
canonical|software engineer - go - container images|nice, provence-alpes-côte d'azur, france|https://www.linkedin.com/jobs/view/4089853566
canonical|software engineer - go - container images|nice, provence-alpes-côte d'azur, france|https://www.linkedin.com/jobs/view/4068936430
canonical|software engineer - go - container images|nice, provence-alpes-côte d'azur, france|https://www.linkedin.com/jobs/view/4068270509
canonical|software engineer - go - container images|lyon, auvergne-rhône-alpes, france|https://www.linkedin.com/jobs/view/4089852589
canonical|software engineer - go - container images|toulouse, occitanie, france|https://www.linkedin.com/jobs/view/4068272407
canonical|software engineer - go - container images|rennes, brittany, france|https://www.linkedin.com/jobs/view/4068938034
canonical|software engineer - go - container images|rennes, brittany, france|https://www.linkedin.com/jobs/view/4026768565
canonical|software engineer - go - container images|nantes, pays de la loire, france|https://www.linkedin.com/jobs/view/4089855060
canonical|software engineer - go - container images|lille, hauts-de-france, france|https://www.linkedin.com/jobs/view/4068934595
canonical|software engineer - go - container images|lille, hauts-de-france, france|https://www.linkedin.com/jobs/view/4068136152
canonical|software engineer - go - container images|strasbourg, grand est, france|https://www.linkedin.com/jobs/view/4089850707
canonical|engineering manager|grenoble, auvergne-rhône-alpes, france|https://www.linkedin.com/jobs/view/4068065164
canonical|engineering manager|nantes, pays de la loire, france|https://www.linkedin.com/jobs/view/4068129553
canonical|engineering manager|rennes, brittany, france|https://www.linkedin.com/jobs/view/4068126832
canonical|engineering manager|lyon, auvergne-rhône-alpes, france|https://www.linkedin.com/jobs/view/4068133173
top secret clearance jobs|software/systems engineer|ga, fort gordon, worldwide|https://www.linkedin.com/jobs/view/4060380071
georgia institute of technology|software engineer - open rank research engineer i/ii/sr.|ga, atlanta, worldwide|https://www.linkedin.com/jobs/view/4081324593
mueller water products|aws data engineer (non-sponsorship eligible role)|ga, atlanta, worldwide|https://www.linkedin.com/jobs/view/4010274073
thomas & hutton|project manager - civil site development|ga, savannah, worldwide|https://www.linkedin.com/jobs/view/4084621855
thomas & hutton|project manager - water wastewater engineer|ga, atlanta, worldwide|https://www.linkedin.com/jobs/view/4083593407
thomas & hutton|project manager - water wastewater engineer|ga, savannah, worldwide|https://www.linkedin.com/jobs/view/4083594234
thomas & hutton|senior project manager - water wastewater engineer|ga, savannah, worldwide|https://www.linkedin.com/jobs/view/4083593406
thomas & hutton|senior project manager - water wastewater engineer|ga, buford, worldwide|https://www.linkedin.com/jobs/view/4081048104
pwc|data privacy technologist - manager|ga, atlanta, worldwide|https://www.linkedin.com/jobs/view/4097076229
amazon|2025 graduate software dev engineer|aachen, north rhine-westphalia, germany|https://www.linkedin.com/jobs/view/4099249001
amazon web services (aws)|2025 graduate software dev engineer|aachen, north rhine-westphalia, germany|https://www.linkedin.com/jobs/view/4093519475
paretos|senior backend engineer (f/m/d)|heidelberg, baden-württemberg, germany|https://www.linkedin.com/jobs/view/4086184710
canonical|software engineer - python - container images|düsseldorf, north rhine-westphalia, germany|https://www.linkedin.com/jobs/view/4089852721
canonical|software engineer - python - container images|düsseldorf, north rhine-westphalia, germany|https://www.linkedin.com/jobs/view/4068936572
ml6  your partner in ai|data engineer (m/f/d)|berlin, berlin, germany|https://www.linkedin.com/jobs/view/3966446582
canonical|software engineer - python - container images|dresden, saxony, germany|https://www.linkedin.com/jobs/view/4068938177
emerson|(senior) software engineer (m/f/d)|düsseldorf, north rhine-westphalia, germany|https://www.linkedin.com/jobs/view/4098236536
crowdstrike|software engineer intern - intelligence automation (remote, uk/germany|munich, bavaria, germany|https://www.linkedin.com/jobs/view/4089043139
avodaq ag|trainee it system engineer (m/w/d) security/collaboration/infrastructure|hamburg, hamburg, germany|https://www.linkedin.com/jobs/view/4029764216
canonical|software engineer - go - container images|nuremberg, bavaria, germany|https://www.linkedin.com/jobs/view/4068937244
canonical|software engineer - go - container images|nuremberg, bavaria, germany|https://www.linkedin.com/jobs/view/4068276105
canonical|software engineer - go - container images|leipzig, saxony, germany|https://www.linkedin.com/jobs/view/4089855058
canonical|software engineer - go - container images|leipzig, saxony, germany|https://www.linkedin.com/jobs/view/4068936423
canonical|software engineer - go - container images|leipzig, saxony, germany|https://www.linkedin.com/jobs/view/4068131791
canonical|software engineer - go - container images|dresden, saxony, germany|https://www.linkedin.com/jobs/view/4089848877
canonical|software engineer - go - container images|dresden, saxony, germany|https://www.linkedin.com/jobs/view/4067126944
canonical|software engineer - python - container images|marousi, attiki, greece|https://www.linkedin.com/jobs/view/4068185073
canonical|software engineer - python - container images|budapest, budapest, hungary|https://www.linkedin.com/jobs/view/4089852720
canonical|software engineer - python - container images|budapest, budapest, hungary|https://www.linkedin.com/jobs/view/4068181899
