company|title|location|link
canonical|engineering manager|frankfurt am main, hesse, germany|https://www.linkedin.com/jobs/view/3966997458
canonical|engineering manager|munich, bavaria, germany|https://www.linkedin.com/jobs/view/3966997462
genua gmbh|mint-promovierter/absolvent (w/m/d)* für zulassung von it-security produkten|munich, bavaria, germany|https://www.linkedin.com/jobs/view/3967544850
genua gmbh|mint-promovierter/absolvent (w/m/d)* für zulassung von it-security produkten|berlin, berlin, germany|https://www.linkedin.com/jobs/view/3967546840
black pen recruitment|relocate to malta d365 for customer engagement solution architect (big 4)|berlin, berlin, germany|https://www.linkedin.com/jobs/view/3978981798
blue yonder|sr data science consultant|hamburg, hamburg, germany|https://www.linkedin.com/jobs/view/3928167204
black pen recruitment|relocate to malta d365 finance and operations technical architect (big 4)|berlin, berlin, germany|https://www.linkedin.com/jobs/view/3977172315
canonical|engineering manager|nuremberg, bavaria, germany|https://www.linkedin.com/jobs/view/3967200003
hilti deutschland|karriereprogramm sales & marketing für hochschulabsolventen (m/w/d)|stuttgart region, worldwide|https://www.linkedin.com/jobs/view/3963951223
blue yonder|sr data science consultant|karlsruhe, baden-württemberg, germany|https://www.linkedin.com/jobs/view/3928162953
thost projektmanagement gmbh|ave2402 - absolvent*in (m/w/d) in der projektsteuerung (bereich bau / immobilien / infrastruktur / anlagenbau)|würzburg, bavaria, germany|https://www.linkedin.com/jobs/view/3988210541
universitätsklinikum hamburg eppendorf|research associate (phd / postdoc) (all genders) for neuroscientific research in the field of retinal ischaemia and stroke|hamburg, hamburg, germany|https://www.linkedin.com/jobs/view/3935188341
canonical|engineering manager|leipzig, saxony, germany|https://www.linkedin.com/jobs/view/3966998375
bsi|sales support executive|germany|https://www.linkedin.com/jobs/view/3980220966
sap|sap digital supply chain ixp intern (f/m/d) - business development|walldorf, baden-württemberg, germany|https://www.linkedin.com/jobs/view/3969995096
hilti deutschland|karriereprogramm sales & marketing für hochschulabsolventen (m/w/d)|greater dresden area, worldwide|https://www.linkedin.com/jobs/view/3963998574
foba laser marking + engraving|junior service technician innendienst / trainee (m/w/d)|selmsdorf, mecklenburg-west pomerania, germany|https://www.linkedin.com/jobs/view/3837532224
siemens|trainee (w/m/d) digital enterprise sales – fördere nachhaltigkeit und digitalisierung|cologne, north rhine-westphalia, germany|https://www.linkedin.com/jobs/view/3981311450
workwise|trainee sales manager &amp; customer service (m/w/d) hamburg|hamburg, hamburg, germany|https://www.linkedin.com/jobs/view/3984546970
juvigo gmbh|trainee key account management & customer success  (m/w/d)|berlin, berlin, germany|https://www.linkedin.com/jobs/view/3967466571
sap|become a professional customer success manager (f/m/d) - munich - powered by sap academy|hallbergmoos, bavaria, germany|https://www.linkedin.com/jobs/view/3972894556
siemens|trainee (w/m/d) digital enterprise sales – fördere nachhaltigkeit und digitalisierung|frankfurt am main, hesse, germany|https://www.linkedin.com/jobs/view/3981312448
akkodis|absolventen elektrotechnik und elektrotechniker (m/w/d) raum nürnberg|greater nuremberg metropolitan area, worldwide|https://www.linkedin.com/jobs/view/3890900466
canonical|linux software engineering manager - ubuntu platform optimisation|hamburg, hamburg, germany|https://www.linkedin.com/jobs/view/3959712784
siemens|trainee (w/m/d) digital enterprise sales – fördere nachhaltigkeit und digitalisierung|berlin, berlin, germany|https://www.linkedin.com/jobs/view/3981308960
strabag|trainee (m/w/d) im bereich property management mit fokus auf  digitalisierung und neue technologien|frankfurt, hesse, germany|https://www.linkedin.com/jobs/view/3982981412
sap|cyber security architect (m/f/d) - sap defensive architecture team|berlin, berlin, germany|https://www.linkedin.com/jobs/view/3985688120
computacenter|trainee it-berater:in - quereinstieg w/m/d|berlin metropolitan area, worldwide|https://www.linkedin.com/jobs/view/3986950465
sap|cyber security architect (m/f/d) - sap defensive architecture team|frankfurt, hesse, germany|https://www.linkedin.com/jobs/view/3985689048
airpaz.com|customer service|germany|https://www.linkedin.com/jobs/view/3928666938
computacenter|trainee it-berater:in - quereinstieg w/m/d|greater dusseldorf area, worldwide|https://www.linkedin.com/jobs/view/3986952191
computacenter|trainee it-berater:in - quereinstieg w/m/d|greater hamburg area, worldwide|https://www.linkedin.com/jobs/view/3986954222
computacenter|trainee it-berater:in - quereinstieg w/m/d|greater nuremberg metropolitan area, worldwide|https://www.linkedin.com/jobs/view/3986951377
computacenter|trainee it-berater:in - quereinstieg w/m/d|greater munich metropolitan area, worldwide|https://www.linkedin.com/jobs/view/3986949643
oil and gas job search ltd|project manager|langenfeld, rhineland-palatinate, germany|https://www.linkedin.com/jobs/view/3952953844
computacenter|trainee it-berater:in - quereinstieg w/m/d|hannover-braunschweig-göttingen-wolfsburg region, worldwide|https://www.linkedin.com/jobs/view/3986947847
computacenter|trainee it-berater:in - quereinstieg w/m/d|stuttgart region, worldwide|https://www.linkedin.com/jobs/view/3986952361
iqvia|associate director accounting|frankfurt am main, hesse, germany|https://www.linkedin.com/jobs/view/3974452042
bosch rexroth|premaster für bachelor-absolvent:innen im bereich fertigungsprüfingenieur (für in-circuit-testing)|lohr, bavaria, germany|https://www.linkedin.com/jobs/view/3965410259
häcker küchen gmbh & co. kg|dualer student (m/w/d) - wirtschaftsinformatik|rödinghausen, north rhine-westphalia, germany|https://www.linkedin.com/jobs/view/3810208604
canonical|linux software engineering manager - ubuntu platform optimisation|munich, bavaria, germany|https://www.linkedin.com/jobs/view/3960301414
canonical|linux software engineering manager - ubuntu platform optimisation|dresden, saxony, germany|https://www.linkedin.com/jobs/view/3959718027
canonical|linux software engineering manager - ubuntu platform optimisation|düsseldorf, north rhine-westphalia, germany|https://www.linkedin.com/jobs/view/3959711999
canonical|linux software engineering manager - ubuntu platform optimisation|frankfurt am main, hesse, germany|https://www.linkedin.com/jobs/view/3959710981
workwise|duales studium wirtschaftsinformatik - prozessmanagement / hr-software / sap hcm (m/w/d)|rietheim, baden-württemberg, germany|https://www.linkedin.com/jobs/view/3982926912
aareon dach|trainee (m/w/d) consulting und customer success|stuttgart, baden-württemberg, germany|https://www.linkedin.com/jobs/view/3989356828
aareon dach|trainee (m/w/d) consulting und customer success|dortmund, north rhine-westphalia, germany|https://www.linkedin.com/jobs/view/3989356829
sap|become a professional customer success manager (f/m/d) - berlin - powered by sap academy|berlin, berlin, germany|https://www.linkedin.com/jobs/view/3972891945
elastic|regional services partner|germany|https://www.linkedin.com/jobs/view/3971265278
global university systems|lecturer in photography - bsbi hamburg (m/f/d)|hamburg, hamburg, germany|https://www.linkedin.com/jobs/view/3738067912
gunnebo|sustainability analyst m/w/d|markersdorf, saxony, germany|https://www.linkedin.com/jobs/view/3970859544
sap|finance associate (w/m/d) commercial business partner market unit germany|walldorf, baden-württemberg, germany|https://www.linkedin.com/jobs/view/3980064058
oil and gas job search ltd|hr business partner (m/w/d))|ölbronn-dürrn, baden-württemberg, germany|https://www.linkedin.com/jobs/view/3952953843
oil and gas job search ltd|teamleiter montage (m/f/d)|ölbronn-dürrn, baden-württemberg, germany|https://www.linkedin.com/jobs/view/3952941990
copeland|director industrial sales europe (m/f/d)|aachen, north rhine-westphalia, germany|https://www.linkedin.com/jobs/view/3971079628
ep unger hifi-studio|trainee creative strategy / creative account management (all genders)|berlin, berlin, germany|https://www.linkedin.com/jobs/view/3986777247
ftapi|trainee sales (w/m/d)|munich, bavaria, germany|https://www.linkedin.com/jobs/view/3834271967
robotron datenbank-software gmbh|trainee  (m/w/d)|dresden, saxony, germany|https://www.linkedin.com/jobs/view/3850226354
gob software & systeme gmbh & co. kg|trainee vertrieb (w/m/d) b2b softwarelösungen|krefeld, north rhine-westphalia, germany|https://www.linkedin.com/jobs/view/3972613662
unternehmertum|unsolicited application: intern or working student for our investment team at uvc|munich, bavaria, germany|https://www.linkedin.com/jobs/view/3871218662
basalt-actien-gesellschaft|trainee rohstoffingenieur / rohstoffgeologe  (m/w/d) – bag traineeprogramm 2025|linz am rhein, rhineland-palatinate, germany|https://www.linkedin.com/jobs/view/3970232543
quattron gmbh|student trainee (m/w/d)|aachen, north rhine-westphalia, germany|https://www.linkedin.com/jobs/view/3959381168
basalt-actien-gesellschaft|trainee rohstoffingenieur / rohstoffgeologe (m/w/d) - bag traineeprogramm 2025|ludwigshafen am rhein, rhineland-palatinate, germany|https://www.linkedin.com/jobs/view/3970206016
l-mobile|trainee (m/w/d) it projektmanagement / consulting|sulzbach an der murr, baden-württemberg, germany|https://www.linkedin.com/jobs/view/3871720335
michael page|trainee (m/w/d) - elektrotechnik|aschaffenburg, bavaria, germany|https://www.linkedin.com/jobs/view/3949779883
chg-meridian|trainee@chg –finance (m/w/d) start 01.10.2024|weingarten, baden-württemberg, germany|https://www.linkedin.com/jobs/view/3969879861
boston consulting group (bcg)|student - recruiting|düsseldorf, north rhine-westphalia, germany|https://www.linkedin.com/jobs/view/3917561268
tso-data|trainee (w/m/d)|nuremberg, bavaria, germany|https://www.linkedin.com/jobs/view/3979327630
bmw group|dualer student informatik (w/m/x)|regensburg, bavaria, germany|https://www.linkedin.com/jobs/view/3921053075
nintendo of europe|student help technical support (m/f/d)|frankfurt am main, hesse, germany|https://www.linkedin.com/jobs/view/3985553012
german aerospace center (dlr)|student/in informatik, mathematik, maschinenbau, elektrotechnik o. ä. (w/m/d)|cottbus, brandenburg, germany|https://www.linkedin.com/jobs/view/3951053964
magna international|it trainee (m/f/x)|munich, bavaria, germany|https://www.linkedin.com/jobs/view/3934333798
xenon automation|student w/m/d duales studium elektrotechnik (bachelor of engineering)|dresden, saxony, germany|https://www.linkedin.com/jobs/view/3931392077
ftapi|trainee sales (w/m/d)|munich, bavaria, germany|https://www.linkedin.com/jobs/view/3834271967
edag group|praktikum / thesis cae|wiesbaden, hesse, germany|https://www.linkedin.com/jobs/view/3682737715
ntt data business solutions|dual studierende wirtschaftsinformatik (w/m/d)|dresden, saxony, germany|https://www.linkedin.com/jobs/view/3913974736
german aerospace center (dlr)|student/in graphikdesign o. ä. (w/m/d)|hamburg, hamburg, germany|https://www.linkedin.com/jobs/view/3964547288
ntt data business solutions|dual studierende wirtschaftsinformatik (w/m/d)|bautzen, saxony, germany|https://www.linkedin.com/jobs/view/3913977691
bmw group|dualer student künstliche intelligenz (w/m/x)|munich, bavaria, germany|https://www.linkedin.com/jobs/view/3921052163
german aerospace center (dlr)|student informatik - hiwi improving the performance of a distributed computing network protocol|brunswick, lower saxony, germany|https://www.linkedin.com/jobs/view/3902216080
basalt-actien-gesellschaft|trainee rohstoffingenieur / rohstoffgeologe  (m/w/d) – bag traineeprogramm 2025|linz am rhein, rhineland-palatinate, germany|https://www.linkedin.com/jobs/view/3970232543
hewlett packard enterprise|dualstudy by hpe student (f/m/d)|böblingen, baden-württemberg, germany|https://www.linkedin.com/jobs/view/3984948180
quattron gmbh|student trainee (m/w/d)|aachen, north rhine-westphalia, germany|https://www.linkedin.com/jobs/view/3959381168
ivu traffic technologies|studenten (m/w/d)|aachen, north rhine-westphalia, germany|https://www.linkedin.com/jobs/view/3981305307
fraunhofer karriere|student: power cycling testing methodology|chemnitz, saxony, germany|https://www.linkedin.com/jobs/view/3973948064
german aerospace center (dlr)|student/in maschinenbau, fahrzeugtechnik o. ä. (w/m/d)|stuttgart, baden-württemberg, germany|https://www.linkedin.com/jobs/view/3958670251
oehmichen & bürgers industrieplanung gmbh|trainee elektroplanung und automatisierung (m/w/d)|düsseldorf, north rhine-westphalia, germany|https://www.linkedin.com/jobs/view/3984534062
gicon® group|praktikant/ studentische hilfskraft/ absolvent (m/w/d)|dresden, saxony, germany|https://www.linkedin.com/jobs/view/3844359054
ortec|student healthcare|bremen, germany|https://www.linkedin.com/jobs/view/3954248477
mitsui chemicals group|student ki - basierter chatbot zur prozessdigitalisierung (m/w/d)|munich, bavaria, germany|https://www.linkedin.com/jobs/view/3783394945
max planck society|student assistant positions (m/f/d)  data entry for carneiro database project|leipzig, saxony, germany|https://www.linkedin.com/jobs/view/3962845984
adesso se|trainee sicherheitsinfrastruktur (all genders)|nuremberg, bavaria, germany|https://www.linkedin.com/jobs/view/3925559411
mercedes-benz tech innovation|duale studentin (m/w/d) data science und ki in kooperation mit der dualen hochschule baden-württemberg heidenheim 2025|ulm, baden-württemberg, germany|https://www.linkedin.com/jobs/view/3967699244
little bird gmbh|trainee projektmanagement (w/m/d)|berlin, berlin, germany|https://www.linkedin.com/jobs/view/3988517372
balluff emea|technischer student für das studiumplus (b. eng.) 2025|neuhausen auf den fildern, baden-württemberg, germany|https://www.linkedin.com/jobs/view/3915843820
acbis gmbh|student*innen (m/w/d) für praxissemester, studienarbeiten und/oder bachelorthesen|karlsruhe, baden-württemberg, germany|https://www.linkedin.com/jobs/view/3675428724
light ds gmbh|trainee it-projektmanagement (m/w/d)|hürth, north rhine-westphalia, germany|https://www.linkedin.com/jobs/view/3831463237
endress+hauser group|student (m/w/d) dhbw-studium embedded systems ab 2025|gerlingen, baden-württemberg, germany|https://www.linkedin.com/jobs/view/3960302612
german aerospace center (dlr)|student/in verkehrswissenschaft, ingenieurswissenschaft mit fokus verkehr, geoinformatik, data science o. ä.|berlin, berlin, germany|https://www.linkedin.com/jobs/view/3902214652
vector informatik|trainee softwareentwicklung (m/w/d)|stuttgart, baden-württemberg, germany|https://www.linkedin.com/jobs/view/3786923703
mygwork - lgbtq+ business community|working student / intern structured debt finance (real estate)|munich, bavaria, germany|https://www.linkedin.com/jobs/view/3973069941
german aerospace center (dlr)|student/in der luft- und raumfahrttechnik, physik, mechatronik o.ä. (w/m/d)|göttingen, lower saxony, germany|https://www.linkedin.com/jobs/view/3950621961
vector informatik|trainee softwareentwicklung embedded (m/w/d)|stuttgart, baden-württemberg, germany|https://www.linkedin.com/jobs/view/3786930051
funke works gmbh|trainee (m/w/d) sales/vertrieb für azubiyo|munich, bavaria, germany|https://www.linkedin.com/jobs/view/3940962900
black flag agency - performance marketing|trainee / werkstudent / praktikant - performance marketing (m/w/d)|munich, bavaria, germany|https://www.linkedin.com/jobs/view/3977761208
adesso se|trainee sicherheitsinfrastruktur (all genders)|stuttgart, baden-württemberg, germany|https://www.linkedin.com/jobs/view/3733041591
adesso se|trainee sicherheitsinfrastruktur (all genders)|ulm, baden-württemberg, germany|https://www.linkedin.com/jobs/view/3733042407
rentenbank|trainee (d/m/w) operations financial markets|frankfurt am main, hesse, germany|https://www.linkedin.com/jobs/view/3970130543
mercedes-benz tech innovation|duale studentin (m/w/d) wirtschaftsinformatik in kooperation mit der dualen hochschule baden-württemberg 2025|ulm, baden-württemberg, germany|https://www.linkedin.com/jobs/view/3968742221
workwise|trainee vertrieb - sales pipeline / bestandskunden / cross-selling (m/w/d)|karlsruhe, baden-württemberg, germany|https://www.linkedin.com/jobs/view/3986055172
computacenter|trainee it consulting - netzwerk w/m/d|berlin metropolitan area, worldwide|https://www.linkedin.com/jobs/view/3972072978
hilti deutschland|global management trainee program – outperformer business track (m/w/d)|kaufering, bavaria, germany|https://www.linkedin.com/jobs/view/3967492183
vector informatik|thesis  survey and benchmarking on fault density in software|chemnitz, saxony, germany|https://www.linkedin.com/jobs/view/3834074655
deutsche bahn|trainee angebotserstellung (w/m/d)|berlin, berlin, germany|https://www.linkedin.com/jobs/view/3955777269
coveto ats gmbh - recruiting software|ferienjob - schüler / helfer (m/w/d)|crailsheim, baden-württemberg, germany|https://www.linkedin.com/jobs/view/3989932644
thales|dualer student (m/w/d) informatik|ditzingen, baden-württemberg, germany|https://www.linkedin.com/jobs/view/3980257458
mtr legal rechtsanwälte|student, werksstudent, studentische mitarbeit (m/w/d)|cologne, north rhine-westphalia, germany|https://www.linkedin.com/jobs/view/3834281339
wilken software group|schüler- bzw. schnupperpraktikum|ulm, baden-württemberg, germany|https://www.linkedin.com/jobs/view/3983971799
pilz|student für abschlussarbeit im bereich entwicklung technologien (m/w/d)|ostfildern, baden-württemberg, germany|https://www.linkedin.com/jobs/view/3932768297
westfalen ag|dualer student wirtschaftsinformatik (m/w/d)|diepholz, lower saxony, germany|https://www.linkedin.com/jobs/view/3983994728
wisag|duales studium  dualer student (m/w/d) für angewandte informatik|hanau am main, hesse, germany|https://www.linkedin.com/jobs/view/3986134536
wisag|duales studium  dualer student (m/w/d) für angewandte informatik|groß-gerau, hesse, germany|https://www.linkedin.com/jobs/view/3986130959
thales|dualer student (m/w/d) wirtschaftsingenieurwesen-elektrotechnik|ditzingen, baden-württemberg, germany|https://www.linkedin.com/jobs/view/3980255415
ferchau|sales trainee (m/w/d) stuttgart automotive|weissach, baden-württemberg, germany|https://www.linkedin.com/jobs/view/3964514089
wisag|duales studium  dualer student (m/w/d) für angewandte informatik|mainz, rhineland-palatinate, germany|https://www.linkedin.com/jobs/view/3986133558
kuhn.partner  kuhn & partner rechtsanwälte steuerberater wirtschaftsprüfer mbb|dualer student im steuer- und prüfungswesen (m/w/d)|frankfurt, hesse, germany|https://www.linkedin.com/jobs/view/3980367019
epg ehrhardt partner group|dualer student (m/w/d) logistikmanagement|hamburg, hamburg, germany|https://www.linkedin.com/jobs/view/3908893054
peoplecert|english speaking examiners (full-time)|athens, attiki, greece|https://www.linkedin.com/jobs/view/3681793174
threenitas|full-stack developer trainee (internship)|athens, attiki, greece|https://www.linkedin.com/jobs/view/3971884961
peoplecert|payroll trainee|athens, attiki, greece|https://www.linkedin.com/jobs/view/3951991712
intracom defense|application software engineer|koropi, attiki, greece|https://www.linkedin.com/jobs/view/3977516589
deloitte|junior iot developer @ thessaloniki|thessaloniki metropolitan area, worldwide|https://www.linkedin.com/jobs/view/3979999748
pwc greece|graduate opportunities in deals - brs|athens, attiki, greece|https://www.linkedin.com/jobs/view/3940572651
renesas electronics|graduate embedded software engineer|athens, attiki, greece|https://www.linkedin.com/jobs/view/3906261861
deloitte|full stack developer (deloitte digital) - athens or patras|athens, attiki, greece|https://www.linkedin.com/jobs/view/3934299968
workable|workable internship program - engineering|athens, attiki, greece|https://www.linkedin.com/jobs/view/3987785704
deloitte|junior integration developer @ thessaloniki|thessaloniki metropolitan area, worldwide|https://www.linkedin.com/jobs/view/3980200556
peoplecert|talent acquisition trainee|athens, attiki, greece|https://www.linkedin.com/jobs/view/3979947131
think-cell software|c++ internship (f/m/d) with relocation to berlin|thessaloniki, central macedonia, greece|https://www.linkedin.com/jobs/view/3970104849
patrique mercier recruitment|french speaking jobs in greece - fully paid relocation package|thessaloniki, central macedonia, greece|https://www.linkedin.com/jobs/view/3970140319
alpha bank|solution designer|athens metropolitan area, worldwide|https://www.linkedin.com/jobs/view/3982823594
deloitte|junior iot developer @ thessaloniki, patras, heraklion, ioannina|patras, western greece, greece|https://www.linkedin.com/jobs/view/3927270832
deloitte|junior iot developer @ thessaloniki, patras, heraklion, ioannina|thessaloniki, central macedonia, greece|https://www.linkedin.com/jobs/view/3927269923
signal|commercial tech product graduate|athens, attiki, greece|https://www.linkedin.com/jobs/view/3989680260
patrique mercier recruitment|french speaking jobs in greece - fully paid relocation package|kos, southern aegean, greece|https://www.linkedin.com/jobs/view/3970137565
cobblestone energy|graduate software engineer - dubai, uae|athens, attiki, greece|https://www.linkedin.com/jobs/view/3958004281
canonical|graduate sales development representative|marousi, attiki, greece|https://www.linkedin.com/jobs/view/3979911107
deloitte|junior integration developer @ thessaloniki, patras, heraklion|iráklion, crete, greece|https://www.linkedin.com/jobs/view/3909945908
canonical|graduate visual ui designer|athens, attiki, greece|https://www.linkedin.com/jobs/view/3959701214
canonical|software engineer (linux/python or go) - container images|marousi, attiki, greece|https://www.linkedin.com/jobs/view/3959704669
deloitte|junior integration developer @ thessaloniki, patras, heraklion|patras, western greece, greece|https://www.linkedin.com/jobs/view/3909945907
patrique mercier recruitment|perfect job in greece for dutch speaking fresh graduates - apply now|greece|https://www.linkedin.com/jobs/view/3970135316
canonical|software engineer (linux/python or go) - container images|athens, attiki, greece|https://www.linkedin.com/jobs/view/3959702825
salfo & associates sa.|μηχανικός επίβλεψης έργου οδοποιίας (αθήνα-πάτρα)|patras, western greece, greece|https://www.linkedin.com/jobs/view/3838666870
netu group|project manager|athens, attiki, greece|https://www.linkedin.com/jobs/view/3970593110
peoplecert|english speaking examiner|athens, attiki, greece|https://www.linkedin.com/jobs/view/3983957817
salfo & associates sa.|βοηθός μηχανικός επίβλεψης έργου οδοποιίας (ριζόμυλος-καλαμάτα)|greater kalamata area, worldwide|https://www.linkedin.com/jobs/view/3932915887
intracom defense|senior power systems design engineer|koropi, attiki, greece|https://www.linkedin.com/jobs/view/3977516573
xp courier|assistant accountant|metamorfosi, attiki, greece|https://www.linkedin.com/jobs/view/3981997167
okto|financial operations agent|marousi, attiki, greece|https://www.linkedin.com/jobs/view/3964352834
victus networks|transport network operation engineer|pallíni, attiki, greece|https://www.linkedin.com/jobs/view/3983993735
demo pharmaceuticals s.a.|analytical development physical chemical protein analysis senior scientist|athens, attiki, greece|https://www.linkedin.com/jobs/view/3986549004
victus networks|transport network operation engineer (1-year contract)|pallíni, attiki, greece|https://www.linkedin.com/jobs/view/3985508812
black pen recruitment|relocate to malta d365 for customer engagement solution architect (big 4)|athens, attiki, greece|https://www.linkedin.com/jobs/view/3978985423
emerson|inside sales engineer, athens|greece|https://www.linkedin.com/jobs/view/3832037257
demo pharmaceuticals s.a.|analytical development physical chemical protein analysis supervisor|athens, attiki, greece|https://www.linkedin.com/jobs/view/3987031518
intracom defense|senior analog hardware design engineer|koropi, attiki, greece|https://www.linkedin.com/jobs/view/3977515607
deutsche telekom cloud services|mobile access architect|athens, attiki, greece|https://www.linkedin.com/jobs/view/3959573150
canonical|linux software engineering manager - ubuntu platform optimisation|athens, attiki, greece|https://www.linkedin.com/jobs/view/3960098887
biomérieux|account manager, clinical diagnostics greece|athens, attiki, greece|https://www.linkedin.com/jobs/view/3950339019
oracle|consulting technical manager|athens, attiki, greece|https://www.linkedin.com/jobs/view/3984635512
muevo: museum evolution|senior industrial designer|athens, attiki, greece|https://www.linkedin.com/jobs/view/3978712655
canonical|linux software engineering manager - ubuntu platform optimisation|marousi, attiki, greece|https://www.linkedin.com/jobs/view/3959714731
deutsche telekom cloud services|mobile access principal architect|athens, attiki, greece|https://www.linkedin.com/jobs/view/3987820005
archirodon group n.v.|senior process engineer|koropi, attiki, greece|https://www.linkedin.com/jobs/view/3978722413
qualco|health & safety manager|athens, attiki, greece|https://www.linkedin.com/jobs/view/3989688972
iqvia|senior consultant in heor/hta statistics and evidence synthesis - various locations|athens, attiki, greece|https://www.linkedin.com/jobs/view/3983076203
allianz technology|junior java developer (12 months fixed term contract)|budapest, budapest, hungary|https://www.linkedin.com/jobs/view/3964313185
kpmg global services hungary|data processing trainee|budapest, budapest, hungary|https://www.linkedin.com/jobs/view/3985079532
