company|title|location|link
academia sinica, taiwan|tenure-track faculty positions|sinicë, korçë, worldwide|https://www.linkedin.com/jobs/view/4393525103
searchapi|browser / kernel engineer|albania, worldwide|https://www.linkedin.com/jobs/view/4431717348
apple|cellular rf receiver systems engineer - dsp (m/f/d)|linz, upper austria, austria|https://www.linkedin.com/jobs/view/4414162514
apple|experienced cellular ip design engineer (m/f/d)|linz, upper austria, austria|https://www.linkedin.com/jobs/view/4414457698
snap inc.|software engineer, c++|vienna, vienna, austria|https://www.linkedin.com/jobs/view/4431694167
parityqc|quantum algorithm developer – fault tolerance|innsbruck, tyrol, austria|https://www.linkedin.com/jobs/view/4420136242
a player|founding engineer rust (full remote)|vienna, vienna, austria|https://www.linkedin.com/jobs/view/4426307135
snap inc.|machine learning engineer, cv|vienna, austria|https://www.linkedin.com/jobs/view/4418580317
salesforce|lead software engineer|austria|https://www.linkedin.com/jobs/view/4429120203
snap inc.|embedded engineer, operating system|vienna, vienna, austria|https://www.linkedin.com/jobs/view/4417082673
snap inc.|embedded software engineer, operating system|vienna, austria|https://www.linkedin.com/jobs/view/4426229237
research unit water quality management|assistant professorship (all genders)- tenure track|vienna, vienna, austria|https://www.linkedin.com/jobs/view/4418472377
lam research|software engineer (all genders)|villach, carinthia, austria|https://www.linkedin.com/jobs/view/4407059354
teamviewer|ai software architect|linz, upper austria, austria|https://www.linkedin.com/jobs/view/4429911535
ait austrian institute of technology|research engineer (m/w/d) im bereich “experience prototyping & development” (vollzeit/teilzeit)|vienna, vienna, austria|https://www.linkedin.com/jobs/view/4258366655
apple|at-specialist (m/w/x)|vienna, vienna, austria|https://www.linkedin.com/jobs/view/4414155578
sentry|engineering manager, (apple/android), sdk|innere stadt, vienna, austria|https://www.linkedin.com/jobs/view/4402168564
university of vienna|2 universitätsassistent*innen praedoc (gruppe „algorithmen und optimierung")|vienna, vienna, austria|https://www.linkedin.com/jobs/view/4422766833
gostudent|technical product generalist|vienna, vienna, austria|https://www.linkedin.com/jobs/view/4399753255
nxp semiconductors|embedded crypto software developer (m/f/d)|gratkorn, styria, austria|https://www.linkedin.com/jobs/view/4431898495
red bull|data cloud architect|elsbethen, salzburg, austria|https://www.linkedin.com/jobs/view/4430459881
german association of women engineers - dib, deutscher ingenieurinnenbund|university assistant post-doc (all genders)|vienna, vienna, austria|https://www.linkedin.com/jobs/view/4431372971
hewlett packard enterprise|hpe labs - postdoctoral research scientist: generative ai for photonic and analog electronic design automation|machelen, flemish region, belgium|https://www.linkedin.com/jobs/view/4390371029
cisco|tetragon software engineering technical leader|brussels, brussels region, belgium|https://www.linkedin.com/jobs/view/4411821368
google|software engineer iii, embedded systems/firmware|mont-saint-guibert, walloon region, belgium|https://www.linkedin.com/jobs/view/4419312238
siemens|cfd software engineer|leuven, flemish region, belgium|https://www.linkedin.com/jobs/view/4423939926
imec|principal architect - compute systems|leuven, flemish region, belgium|https://www.linkedin.com/jobs/view/4424177701
apple|legal counsel - regulatory legal|brussels, brussels region, belgium|https://www.linkedin.com/jobs/view/4414173044
techwolf|lead ai researcher|ghent, flemish region, belgium|https://www.linkedin.com/jobs/view/4421857467
ku leuven|phd position in human-centred explainable constraint solving|leuven, flemish region, belgium|https://www.linkedin.com/jobs/view/4432410076
cisco|security research engineering technical leader|brussels, brussels region, belgium|https://www.linkedin.com/jobs/view/4418963288
apple|be-manager|brussels, brussels region, belgium|https://www.linkedin.com/jobs/view/4430836627
vib|computer vision engineer|ghent, flemish region, belgium|https://www.linkedin.com/jobs/view/4419231845
nxp semiconductors|embedded crypto software developer (m/f/d)|leuven, flemish region, belgium|https://www.linkedin.com/jobs/view/4431896552
nokia|fiber growth: host developer|antwerp, flemish region, belgium|https://www.linkedin.com/jobs/view/4360504505
pfizer|director, ai engineering--clinical development and operations (cd&o)|zaventem, flemish region, belgium|https://www.linkedin.com/jobs/view/4408562242
vib|llm engineer|leuven, flemish region, belgium|https://www.linkedin.com/jobs/view/4413615292
redis|principal engineer – ai search & vector infrastructure|sofia metropolitan area, worldwide|https://www.linkedin.com/jobs/view/4419634245
sap|ai software developer|sofia, sofia city, worldwide|https://www.linkedin.com/jobs/view/4324831231
sap|expert ai developer in hyperspace security & quality tools team|sofia, sofia city, worldwide|https://www.linkedin.com/jobs/view/4412963993
google|senior software engineer, generative ai, learnx|zagreb, zagreb, worldwide|https://www.linkedin.com/jobs/view/4426959949
autodesk|machine learning technical manager|zagreb, zagreb, worldwide|https://www.linkedin.com/jobs/view/4327153366
searchapi|browser / kernel engineer|croatia, worldwide|https://www.linkedin.com/jobs/view/4431726226
american university of beirut - mediterraneo|tenure-track – faculty position in computer science and engineering|paphos municipality, paphos, worldwide|https://www.linkedin.com/jobs/view/4395856527
plum|staff engineer|nicosia, nicosia, worldwide|https://www.linkedin.com/jobs/view/4411591463
jetbrains|research engineer (llm training and performance)|limassol, limassol, worldwide|https://www.linkedin.com/jobs/view/4328943728
jetbrains|technical lead (intellij platform)|cyprus, paphos, worldwide|https://www.linkedin.com/jobs/view/4420101015
duckduckgo|senior privacy engineer|cyprus, worldwide|https://www.linkedin.com/jobs/view/4430020433
revolut|applied ai engineer|cyprus, worldwide|https://www.linkedin.com/jobs/view/4407473235
jetbrains|technical lead (intellij platform)|limassol, limassol, worldwide|https://www.linkedin.com/jobs/view/4328791016
jetbrains|senior research engineer (agentic behavior)|limassol, limassol, worldwide|https://www.linkedin.com/jobs/view/4424880432
plum|ios engineer|nicosia, nicosia, worldwide|https://www.linkedin.com/jobs/view/4303994490
jetbrains|staff research engineer (llm pre-training)|cyprus, paphos, worldwide|https://www.linkedin.com/jobs/view/4385773333
microsoft|senior / principal quantum error correction engineer|kongens lyngby, capital region of denmark, denmark|https://www.linkedin.com/jobs/view/4426795193
microsoft|senior applied scientist - computer vision for quantum|kongens lyngby, capital region of denmark, denmark|https://www.linkedin.com/jobs/view/4426792681
microsoft|principal technical program manager (quantum)|kongens lyngby, capital region of denmark, denmark|https://www.linkedin.com/jobs/view/4427952693
google|software engineer iii, kotlin, compiler|aarhus, central denmark region, denmark|https://www.linkedin.com/jobs/view/4429658055
synopsys inc|staff engineer (r&d engineering)|copenhagen, capital region of denmark, denmark|https://www.linkedin.com/jobs/view/4429911621
microsoft|senior process engineer - quantum|kongens lyngby, capital region of denmark, denmark|https://www.linkedin.com/jobs/view/4406869011
aalborg university|phd in secure multiparty computation in quantum networks|aalborg, north denmark region, denmark|https://www.linkedin.com/jobs/view/4429507269
aalborg university|assistant professor or assistant professor tenure track in ai in software engineering - hcc|aalborg, north denmark region, denmark|https://www.linkedin.com/jobs/view/4428840825
aalborg university|assistant professor or tenure-track assistant professor  in distributed, embedded and intelligent systems (deis)|aalborg, north denmark region, denmark|https://www.linkedin.com/jobs/view/4428856126
aalborg university|assistant/associate professor with expertise in artificial intelligence and its applications (re-advertisement)|aalborg, north denmark region, denmark|https://www.linkedin.com/jobs/view/4429223490
laboratory automation screening and microscopy (lasm)|phd-positions|copenhagen, capital region of denmark, denmark|https://www.linkedin.com/jobs/view/4432896549
accenture nordics|join halfspace’s ai & advanced analytics team - shaping the future with ai|copenhagen, capital region of denmark, denmark|https://www.linkedin.com/jobs/view/4328059516
aarhus university|phd position in efficient test-time model adaptation in dynamic edge environments|aarhus, central denmark region, denmark|https://www.linkedin.com/jobs/view/4428246586
amazon web services (aws)|enterprise solutions architect|copenhagen, capital region of denmark, denmark|https://www.linkedin.com/jobs/view/4389789149
bcg x|forward deployed ai engineer, denmark - bcg x|copenhagen, capital region of denmark, denmark|https://www.linkedin.com/jobs/view/4387796321
accenture nordics|join halfspace’s engineering team - shaping the future with ai|copenhagen, capital region of denmark, denmark|https://www.linkedin.com/jobs/view/4328039810
a.p. moller - maersk|senior network analytics engineer|copenhagen, capital region of denmark, denmark|https://www.linkedin.com/jobs/view/4414574707
aalborg university|phd stipend in anomaly detection for future urban cooling systems|aalborg, north denmark region, denmark|https://www.linkedin.com/jobs/view/4430942321
nokia|senior standards researcher, 6g physical layer|aalborg, north denmark region, denmark|https://www.linkedin.com/jobs/view/4417926571
roku|software engineering manager|greater aarhus area, worldwide|https://www.linkedin.com/jobs/view/4421843610
n8n|senior/staff engineer, n8n labs|estonia, worldwide|https://www.linkedin.com/jobs/view/4428854977
searchapi|browser / kernel engineer|estonia, worldwide|https://www.linkedin.com/jobs/view/4431717347
duckduckgo|senior privacy engineer|estonia, worldwide|https://www.linkedin.com/jobs/view/4430018770
university of oulu|doctoral researcher, software engineering|oulu, north ostrobothnia, finland|https://www.linkedin.com/jobs/view/4431666401
aalto university|research software engineer / staff scientist|espoo, uusimaa, finland|https://www.linkedin.com/jobs/view/4426976590
huawei|senior researcher, agentic safety & alignment|helsinki, uusimaa, finland|https://www.linkedin.com/jobs/view/4403947794
huawei|senior researcher, multimodal reasoning|helsinki, uusimaa, finland|https://www.linkedin.com/jobs/view/4403969201
amazon web services (aws)|sr. applied scientist, cedar authorization|finland|https://www.linkedin.com/jobs/view/4410052159
amd|senior agentic system & application engineer|helsinki, uusimaa, finland|https://www.linkedin.com/jobs/view/4374590963
amazon|lead isp algorithm developer, camera and imaging|tampere metropolitan area, worldwide|https://www.linkedin.com/jobs/view/4402074326
6g flagship|doctoral researcher, software engineering|oulu, north ostrobothnia, finland|https://www.linkedin.com/jobs/view/4431685074
silicon labs|senior research engineer|espoo, uusimaa, finland|https://www.linkedin.com/jobs/view/4417616835
nokia|senior research/standardization specialist|oulu, north ostrobothnia, finland|https://www.linkedin.com/jobs/view/4418741304
amazon|system development engineer - image quality, rbks camera and imaging, rbks camera and imaging|tampere metropolitan area, worldwide|https://www.linkedin.com/jobs/view/4432491057
axon|senior ai research scientist|finland|https://www.linkedin.com/jobs/view/4370884711
university of oulu|2 project researchers, machine learning|oulu, north ostrobothnia, finland|https://www.linkedin.com/jobs/view/4432523622
a player|product engineer|helsinki, uusimaa, finland|https://www.linkedin.com/jobs/view/4426314104
nokia|senior staff research specialist position in technology standards - research & innovation|espoo, uusimaa, finland|https://www.linkedin.com/jobs/view/4414019340
supercell|senior tools programmer|helsinki, uusimaa, finland|https://www.linkedin.com/jobs/view/4419217406
n8n|senior/staff engineer, n8n labs|finland|https://www.linkedin.com/jobs/view/4428866152
aalto university|associate or full professor, art, society and technology|espoo, uusimaa, finland|https://www.linkedin.com/jobs/view/4424356598
iqm quantum computers|quantum engineer, calibration & benchmarking|espoo, uusimaa, finland|https://www.linkedin.com/jobs/view/4422274836
duckduckgo|senior privacy engineer|finland|https://www.linkedin.com/jobs/view/4430032138
apple|aiml - machine learning researcher, mlr|paris, île-de-france, france|https://www.linkedin.com/jobs/view/4414150972
apple|software engineering manager – system applications (paris)|paris, île-de-france, france|https://www.linkedin.com/jobs/view/4414159647
apple|vulnerability researcher|paris, île-de-france, france|https://www.linkedin.com/jobs/view/4414162524
apple|offensive security researcher, sear|paris, île-de-france, france|https://www.linkedin.com/jobs/view/4414163520
apple|security tooling - senior software engineer, sear|paris, île-de-france, france|https://www.linkedin.com/jobs/view/4414154737
apple|offensive security research manager|paris, île-de-france, france|https://www.linkedin.com/jobs/view/4414159676
apple|firmware security researcher, sear|paris, île-de-france, france|https://www.linkedin.com/jobs/view/4414152835
apple|offensive security researcher - kernel & embedded security|paris, île-de-france, france|https://www.linkedin.com/jobs/view/4414162515
apple|offensive security researcher - remote attack surface|paris, île-de-france, france|https://www.linkedin.com/jobs/view/4414170138
apple|applied machine learning engineer - security|paris, île-de-france, france|https://www.linkedin.com/jobs/view/4414157697
seer|lead, fault tolerant quantum computing|île-de-france, france|https://www.linkedin.com/jobs/view/4421835534
pasqal|algorithm developer - register team w/m|palaiseau, île-de-france, france|https://www.linkedin.com/jobs/view/4429973923
nvidia|senior math libraries engineer – emulation in ai and hpc|marseille, provence-alpes-côte d'azur, france|https://www.linkedin.com/jobs/view/4395471735
alice & bob|staff software engineer pulse|paris, île-de-france, france|https://www.linkedin.com/jobs/view/4426866799
meta|staff research scientist, fair (rl / llm's)|paris, île-de-france, france|https://www.linkedin.com/jobs/view/4422274111
ansys|r&d engineering, principal engineer (f/m)|villeurbanne, auvergne-rhône-alpes, france|https://www.linkedin.com/jobs/view/4427194763
ansys|r&d engineering, principal engineer (f/m)|france|https://www.linkedin.com/jobs/view/4426049766
google deepmind|research scientist, pretraining, gemini data, deepmind|paris, île-de-france, france|https://www.linkedin.com/jobs/view/4430567942
cohere|member of technical staff, multilingual|paris, île-de-france, france|https://www.linkedin.com/jobs/view/4423898800
arm|system performance analysis engineer|sophia antipolis, provence-alpes-côte d'azur, france|https://www.linkedin.com/jobs/view/4406220286
google|software engineer, phd, early career, infrastructure, 2026 start|ga, atlanta, worldwide|https://www.linkedin.com/jobs/view/4365577515
google|software engineer, phd, early career, ai/machine learning, 2026 start|ga, atlanta, worldwide|https://www.linkedin.com/jobs/view/4365589174
dolby laboratories|sr researcher - experience delivery|ga, atlanta, worldwide|https://www.linkedin.com/jobs/view/4389797825
dolby laboratories|ai architect|ga, atlanta, worldwide|https://www.linkedin.com/jobs/view/4384882883
dolby laboratories|staff data research engineer|ga, atlanta, worldwide|https://www.linkedin.com/jobs/view/4271027631
salesforce|principal architect|ga, atlanta, worldwide|https://www.linkedin.com/jobs/view/4425667764
dolby laboratories|senior ai researcher|ga, atlanta, worldwide|https://www.linkedin.com/jobs/view/4389298851
dolby laboratories|sr data researcher -agentic systems|ga, atlanta, worldwide|https://www.linkedin.com/jobs/view/4403508126
dolby laboratories|sr researcher, sight lab|ga, atlanta, worldwide|https://www.linkedin.com/jobs/view/4366857037
dolby laboratories|senior multimodal ai researcher|ga, atlanta, worldwide|https://www.linkedin.com/jobs/view/4402178712
mastercard|principal software engineer|ga, atlanta, worldwide|https://www.linkedin.com/jobs/view/4421152666
google|senior software engineer, infrastructure, google cloud global networking|ga, atlanta, worldwide|https://www.linkedin.com/jobs/view/4362578340
google|forward deployed engineer v, generative ai, google cloud|ga, atlanta, worldwide|https://www.linkedin.com/jobs/view/4427499687
apple|us-operations specialist|ga, atlanta, worldwide|https://www.linkedin.com/jobs/view/4414164423
google|forward deployed engineer iv, genai, google cloud|ga, atlanta, worldwide|https://www.linkedin.com/jobs/view/4417884250
google|mechanical engineer, advanced analytics|ga, atlanta, worldwide|https://www.linkedin.com/jobs/view/4424204763
mastercard|principal systems engineer|ga, atlanta, worldwide|https://www.linkedin.com/jobs/view/4427392526
cnn|ios staff software engineer|ga, atlanta, worldwide|https://www.linkedin.com/jobs/view/4432099222
inside higher ed|center for scientific software engineering - research engineer (open rank)|ga, atlanta, worldwide|https://www.linkedin.com/jobs/view/4419988764
georgia tech research institute|software engineer - asl - open rank|ga, atlanta, worldwide|https://www.linkedin.com/jobs/view/4410990198
apple|sw optimization engineer ai/ml|munich, bavaria, germany|https://www.linkedin.com/jobs/view/4414157731
apple|software formal verification engineer|munich, bavaria, germany|https://www.linkedin.com/jobs/view/4432894892
apple|build and developer productivity engineer (m/f/d)|munich, bavaria, germany|https://www.linkedin.com/jobs/view/4414171035
apple|software engineer, backend systems|munich, bavaria, germany|https://www.linkedin.com/jobs/view/4414162385
apple|analog mixed-signal modeling software engineer (m/f/d)|munich, bavaria, germany|https://www.linkedin.com/jobs/view/4414172038
apple|early career analog mixed-signal modeling software engineer (m/f/d)|munich, bavaria, germany|https://www.linkedin.com/jobs/view/4430845574
apple|software build engineer, software delivery|munich, bavaria, germany|https://www.linkedin.com/jobs/view/4414152852
apple|software engineer - backend systems, software delivery|munich, bavaria, germany|https://www.linkedin.com/jobs/view/4414156789
apple|silicon validation engineer|munich, bavaria, germany|https://www.linkedin.com/jobs/view/4414163528
apple|site reliability engineer, software delivery|munich, bavaria, germany|https://www.linkedin.com/jobs/view/4428429271
apple|pmu design verification engineer (m/f/d)|nabern, baden-württemberg, germany|https://www.linkedin.com/jobs/view/4414162510
apple|cellular rf receiver systems engineer (m/f/d)|munich, bavaria, germany|https://www.linkedin.com/jobs/view/4414164429
apple|pmu design verification engineer (m/f/d)|stuttgart, baden-württemberg, germany|https://www.linkedin.com/jobs/view/4414157700
apple|engineering project manager, swe programs|munich, bavaria, germany|https://www.linkedin.com/jobs/view/4414164418
apple|quality engineer - machine learning|rellingen, schleswig-holstein, germany|https://www.linkedin.com/jobs/view/4414169252
apple|cad logic equivalence checking (lec) engineer - m/f/d|munich, bavaria, germany|https://www.linkedin.com/jobs/view/4414170144
apple|cellular soc frontend sta engineer (m/f/d)|munich, bavaria, germany|https://www.linkedin.com/jobs/view/4414166478
apple|systems engineer - enterprise and education sales|munich, bavaria, germany|https://www.linkedin.com/jobs/view/4414166450
apple|experienced cellular ip design engineer (m/f/d)|munich, bavaria, germany|https://www.linkedin.com/jobs/view/4414160643
apple|experienced analog design engineer (m/f/d)|munich, bavaria, germany|https://www.linkedin.com/jobs/view/4414154731
cisco|tetragon software engineering technical leader|athens, attiki, greece|https://www.linkedin.com/jobs/view/4411811624
nvidia|optical networking research post-doc|athens, attiki, greece|https://www.linkedin.com/jobs/view/4426177002
niki digital engineering|postdoc/phd/phd cand. in computer science and engineering|ioannina, epirus, greece|https://www.linkedin.com/jobs/view/4411868708
accenture|ai engineer|athens, attiki, greece|https://www.linkedin.com/jobs/view/4431222640
plum|staff engineer|athens, attiki, greece|https://www.linkedin.com/jobs/view/4411578965
niki digital engineering|postdoc/phd/phd cand. in physics/computer science|ioannina, epirus, greece|https://www.linkedin.com/jobs/view/4415371297
duckduckgo|senior privacy engineer|greece|https://www.linkedin.com/jobs/view/4430025237
accenture greece|ai foundation model specialist (athens)|athens, attiki, greece|https://www.linkedin.com/jobs/view/4328059643
arista networks|software engineer - platform team - greece|athens, attiki, greece|https://www.linkedin.com/jobs/view/4429686485
apple|systems engineer - enterprise & education sales|budapest, budapest, hungary|https://www.linkedin.com/jobs/view/4415749035
cisco|tetragon software engineering technical leader|budapest, budapest, hungary|https://www.linkedin.com/jobs/view/4411816599
sap|software development architect|budapest, budapest, hungary|https://www.linkedin.com/jobs/view/4428480416
reasonable ai|member of technical staff - hu|budapest, budapest, hungary|https://www.linkedin.com/jobs/view/4423047132
hawk-eye innovations|principal computer vision engineer|budapest, budapest, hungary|https://www.linkedin.com/jobs/view/4409410384
arm|senior/staff software engineer - compilers (llvm)|budapest, budapest, hungary|https://www.linkedin.com/jobs/view/4424003361
hawk-eye innovations|principal computer vision engineer|budapest, budapest, hungary|https://www.linkedin.com/jobs/view/4409488443
siemens|cfd software engineer|budapest, budapest, hungary|https://www.linkedin.com/jobs/view/4423949232
larkin lane films, llc|lead imaging scientist|budapest, budapest, hungary|https://www.linkedin.com/jobs/view/4424182902
larkin lane films, llc|senior ml researcher|budapest, budapest, hungary|https://www.linkedin.com/jobs/view/4424180912
bosch magyarország|software architect – transmission control|budapest, budapest, hungary|https://www.linkedin.com/jobs/view/4406297318
searchapi|browser / kernel engineer|hungary|https://www.linkedin.com/jobs/view/4431713389
apple|linux kernel engineer|dublin, county dublin, ireland|https://www.linkedin.com/jobs/view/4414169235
apple|software engineering manager, batch compute|dublin, county dublin, ireland|https://www.linkedin.com/jobs/view/4414151994
apple|site reliability engineer, dublin|dublin, county dublin, ireland|https://www.linkedin.com/jobs/view/4414164436
apple|software engineering manager (sre) - apple services engineering, dublin|dublin, county dublin, ireland|https://www.linkedin.com/jobs/view/4422888409
apple|lead ai engineer, finance digital transformation|cork, county cork, ireland|https://www.linkedin.com/jobs/view/4426033658
apple|ml engineer, ai & data platforms|cork, county cork, ireland|https://www.linkedin.com/jobs/view/4414168343
apple|software engineer (data), ai & data platforms|cork, county cork, ireland|https://www.linkedin.com/jobs/view/4414169230
apple|software automation engineer, localisation & release engineering|cork, county cork, ireland|https://www.linkedin.com/jobs/view/4414161558
apple|analog design engineer - serdes|dublin, county dublin, ireland|https://www.linkedin.com/jobs/view/4430840556
apple|software automation engineer, localisation & release engineering|cork, county cork, ireland|https://www.linkedin.com/jobs/view/4414155760
huawei enterprise italia|principal data researcher|greater dublin, worldwide|https://www.linkedin.com/jobs/view/4432813983
apple|global geo expansion project manager|cork, county cork, ireland|https://www.linkedin.com/jobs/view/4425529980
software placements|system architect|cork, county cork, ireland|https://www.linkedin.com/jobs/view/4419884193
qualcomm|gpu performance modelling engineer - cork, ireland|cork, county cork, ireland|https://www.linkedin.com/jobs/view/4273837275
apple|localisation quality manager, localisation & release engineering|cork, county cork, ireland|https://www.linkedin.com/jobs/view/4414169234
amazon web services (aws)|kernel / hypervisor engineer, firecracker|dublin, county dublin, ireland|https://www.linkedin.com/jobs/view/4425921846
amazon web services (aws)|principal software engineer, aws lambda|dublin, county dublin, ireland|https://www.linkedin.com/jobs/view/4420938344
intel|ai frameworks engineer|leixlip, county kildare, ireland|https://www.linkedin.com/jobs/view/4418839550
qualcomm|compiler design engineer - cork, ireland|cork, county cork, ireland|https://www.linkedin.com/jobs/view/4431851465
intel|ai research engineer/scientist (openvino, nncf)|leixlip, county kildare, ireland|https://www.linkedin.com/jobs/view/4418828836
apple|it-operations specialist|florence, tuscany, italy|https://www.linkedin.com/jobs/view/4419067125
apple|it-operations specialist|florence, tuscany, italy|https://www.linkedin.com/jobs/view/4419060538
apple|it - senior manager - milan metro market|milan, lombardy, italy|https://www.linkedin.com/jobs/view/4414163525
amazon|applied scientist, alexa ai|turin, piedmont, italy|https://www.linkedin.com/jobs/view/4421255862
amazon|applied scientist, alexa ai|turin, piedmont, italy|https://www.linkedin.com/jobs/view/4421259662
amazon|applied scientist, alexa ai|turin, piedmont, italy|https://www.linkedin.com/jobs/view/4421273273
