company|title|location|link
ace games|generative ai engineer|istanbul, istanbul, worldwide|https://www.linkedin.com/jobs/view/3997287126
dogma alares|machine learning engineer|greater istanbul, worldwide|https://www.linkedin.com/jobs/view/3934798098
bosch türkiye|development engineer|türkiye, manisa, worldwide|https://www.linkedin.com/jobs/view/4008625852
mapin data|data scientist|istanbul, istanbul, worldwide|https://www.linkedin.com/jobs/view/4014944066
denizbank|data scientist (retail analytics & strategy department)|türkiye, istanbul, worldwide|https://www.linkedin.com/jobs/view/4003576726
paribu|data scientist|türkiye, istanbul, worldwide|https://www.linkedin.com/jobs/view/3947683770
zynga|mobile game engineer|istanbul, istanbul, worldwide|https://www.linkedin.com/jobs/view/3994587585
new mind ai|senior machine learning engineer|sariyer, istanbul, worldwide|https://www.linkedin.com/jobs/view/4010793740
bis - business integration services|lead data scientist|türkiye, istanbul, worldwide|https://www.linkedin.com/jobs/view/4013966912
aksa akrilik kimya sanayii a.ş.|research and development senior specialist|türkiye, yalova, worldwide|https://www.linkedin.com/jobs/view/3993293429
gbd consultancy|senior data scientist|kadikoy, istanbul, worldwide|https://www.linkedin.com/jobs/view/4008932566
epam systems|senior data scientist|türkiye, worldwide|https://www.linkedin.com/jobs/view/3998866185
oil and gas job search ltd|thermal systems, aerothermal and heat transfer lead engineer- hybrid|fatih, istanbul, worldwide|https://www.linkedin.com/jobs/view/3994371071
oil and gas job search ltd|thermal systems, aerothermal and heat transfer lead engineer- hybrid|fatih, istanbul, worldwide|https://www.linkedin.com/jobs/view/3962710078
dataroid|devops engineer|türkiye, istanbul, worldwide|https://www.linkedin.com/jobs/view/3836233540
turing|remote python data scientist|türkiye, i̇stanbul, worldwide|https://www.linkedin.com/jobs/view/3832800112
turing|remote python data scientist|türkiye, i̇stanbul, worldwide|https://www.linkedin.com/jobs/view/3832801081
turing|remote python data scientist|türkiye, worldwide|https://www.linkedin.com/jobs/view/3832595870
turing|remote data scientist|türkiye, worldwide|https://www.linkedin.com/jobs/view/3832597553
turing|remote data scientist|türkiye, i̇stanbul, worldwide|https://www.linkedin.com/jobs/view/3832802067
turing|remote python data scientist|türkiye, worldwide|https://www.linkedin.com/jobs/view/3832597351
turing|remote python data scientist|türkiye, i̇stanbul, worldwide|https://www.linkedin.com/jobs/view/3818409761
turing|remote data scientist - python|türkiye, i̇stanbul, worldwide|https://www.linkedin.com/jobs/view/3871189718
turing|remote data scientist - python|türkiye, i̇stanbul, worldwide|https://www.linkedin.com/jobs/view/3871190641
turing|remote data scientist - python|türkiye, i̇stanbul, worldwide|https://www.linkedin.com/jobs/view/3871187914
turing|remote data scientist|türkiye, worldwide|https://www.linkedin.com/jobs/view/3818409774
turing|remote data scientist|türkiye, worldwide|https://www.linkedin.com/jobs/view/3875219564
turing|remote data scientist - python|türkiye, worldwide|https://www.linkedin.com/jobs/view/3871190479
turing|remote data scientist|türkiye, worldwide|https://www.linkedin.com/jobs/view/3832597434
turing|remote data scientist - python|türkiye, i̇stanbul, worldwide|https://www.linkedin.com/jobs/view/3871188639
turing|remote data scientist|türkiye, i̇stanbul, worldwide|https://www.linkedin.com/jobs/view/3818409753
turing|remote data scientist|türkiye, worldwide|https://www.linkedin.com/jobs/view/3941959926
turing|remote data scientist|türkiye, i̇stanbul, worldwide|https://www.linkedin.com/jobs/view/3941962815
turing|remote data scientist|türkiye, i̇stanbul, worldwide|https://www.linkedin.com/jobs/view/3818410778
turing|remote data scientist|türkiye, worldwide|https://www.linkedin.com/jobs/view/3818414095
turing|remote data scientist|türkiye, i̇stanbul, worldwide|https://www.linkedin.com/jobs/view/3818414108
turing|remote python data scientist|türkiye, worldwide|https://www.linkedin.com/jobs/view/3832598309
turing|remote python data scientist|türkiye, i̇stanbul, worldwide|https://www.linkedin.com/jobs/view/3832800185
turing|remote data scientist|türkiye, worldwide|https://www.linkedin.com/jobs/view/3818408945
turing|remote data scientist|türkiye, i̇stanbul, worldwide|https://www.linkedin.com/jobs/view/3832804027
turing|remote data scientist|türkiye, worldwide|https://www.linkedin.com/jobs/view/3832597342
otp bank, ukraine|senior data scientist/team lead|kyiv city, ukraine|https://www.linkedin.com/jobs/view/4005721778
the kaizen company|technical advisor: e-health|ukraine|https://www.linkedin.com/jobs/view/3739479381
the kaizen company|technical advisor: supply chain/procurement expert|ukraine|https://www.linkedin.com/jobs/view/3854345861
the kaizen company|technical advisor: governance|ukraine|https://www.linkedin.com/jobs/view/3739476771
the kaizen company|technical advisor: health financing|ukraine|https://www.linkedin.com/jobs/view/3739476751
dai|chief of party, ukraine new workforce development activity|ukraine|https://www.linkedin.com/jobs/view/3987575936
skill farm|internship - machine learning|london, england, united kingdom|https://www.linkedin.com/jobs/view/4014933774
quanta part of qcs staffing|r&d scientist|england, united kingdom|https://www.linkedin.com/jobs/view/4004982113
astrazeneca|senior scientist|cambridgeshire, england, united kingdom|https://www.linkedin.com/jobs/view/4000225167
aviadobio|scientist ii, vector sciences|london, england, united kingdom|https://www.linkedin.com/jobs/view/3991371973
srg|senior scientist, mathematical modeller|stockport, england, united kingdom|https://www.linkedin.com/jobs/view/4001559267
gardline limited|acoustic scientist|norfolk, england, united kingdom|https://www.linkedin.com/jobs/view/4002992475
cubiq recruitment|specialist biomedical scientist|greater oxford area, worldwide|https://www.linkedin.com/jobs/view/3982885062
beauty pie|senior data scientist (experimentation lead)|london, england, united kingdom|https://www.linkedin.com/jobs/view/4012903007
nextlink group|research scientist|slough, england, united kingdom|https://www.linkedin.com/jobs/view/4013582802
nxera pharma|research scientist / senior scientist - protein engineering|cambridge, england, united kingdom|https://www.linkedin.com/jobs/view/4010469900
mediatek|deep learning internship - students pursing phd only|london area, united kingdom|https://www.linkedin.com/jobs/view/4008966464
tether.io|head of ai research and development (100% remote)|london, england, united kingdom|https://www.linkedin.com/jobs/view/3952020715
samaya ai|member of technical staff (ml)|london, england, united kingdom|https://www.linkedin.com/jobs/view/3958454054
ometria|director of ai and data|united kingdom|https://www.linkedin.com/jobs/view/3958907676
srg|r&d scientist (bioprocess analytics and automation)|slough, england, united kingdom|https://www.linkedin.com/jobs/view/4016269630
east kent hospitals university nhs foundation trust|biomedical scientist - immunology|ashford, england, united kingdom|https://www.linkedin.com/jobs/view/4012873240
nethermind|phd internship program|london, england, united kingdom|https://www.linkedin.com/jobs/view/3989411179
selby jennings|futures quantitative researcher - london/paris|london area, united kingdom|https://www.linkedin.com/jobs/view/3996366236
arthur recruitment|data science actuary|united kingdom|https://www.linkedin.com/jobs/view/4008634033
rokos capital management|2025 quant graduate programme|london area, united kingdom|https://www.linkedin.com/jobs/view/4005555097
huawei technologies research & development (uk) ltd|research scientist (contractor) - cv-camera team|london, england, united kingdom|https://www.linkedin.com/jobs/view/3927512793
genomics plc|scientist|london, england, united kingdom|https://www.linkedin.com/jobs/view/3866892183
source technology|senior data scientist (sports)|london area, united kingdom|https://www.linkedin.com/jobs/view/4011606352
university of cambridge|research associate (fixed term)|cambridge, england, united kingdom|https://www.linkedin.com/jobs/view/3997922530
bruker|applications scientist|durham, england, united kingdom|https://www.linkedin.com/jobs/view/3981981787
toshiba europe ltd|researcher (embodied ai / computer vision / machine learning)|cambridge, england, united kingdom|https://www.linkedin.com/jobs/view/4008857662
university of brighton|professor of engineering|brighton, england, united kingdom|https://www.linkedin.com/jobs/view/4005601455
national physical laboratory (npl)|scientist|teddington, england, united kingdom|https://www.linkedin.com/jobs/view/4011146268
bridge4people, bridgespinner a/s|principal scientist|warrington, england, united kingdom|https://www.linkedin.com/jobs/view/4013210216
cognify search|senior data scientist|london area, united kingdom|https://www.linkedin.com/jobs/view/4011975003
thinkwork|ai & ml advisor – equity compensation|united kingdom|https://www.linkedin.com/jobs/view/4011622076
wrc group|engineer / scientist - flow and metering|swindon, england, united kingdom|https://www.linkedin.com/jobs/view/3978221265
xcede|senior data scientist|london area, united kingdom|https://www.linkedin.com/jobs/view/3999353110
huawei technologies research & development (uk) ltd|senior/research scientist - ai agent|london, england, united kingdom|https://www.linkedin.com/jobs/view/3826118640
ernest gordon recruitment|lead data scientist {music technology}|city of london, england, united kingdom|https://www.linkedin.com/jobs/view/4000676192
energy jobline|physicist - defence sector engineering - cambridge|cambridge, england, united kingdom|https://www.linkedin.com/jobs/view/4015719544
the university of manchester|research associate in pharmacoepidemiology and causal inference|manchester area, united kingdom|https://www.linkedin.com/jobs/view/4011322597
deep science ventures|co-founder in residence (engineering/cto), secure and scalable co2 storage|london, england, united kingdom|https://www.linkedin.com/jobs/view/4004559570
fujitsu research|high performance computing senior researcher|slough, england, united kingdom|https://www.linkedin.com/jobs/view/4017157108
university of birmingham|research associate - college of engineering and physical sciences - 104388 - grade 6|birmingham, england, united kingdom|https://www.linkedin.com/jobs/view/4008792438
energy jobline|research scientist - nanopore research|oxford, england, united kingdom|https://www.linkedin.com/jobs/view/4015723410
search technology|senior machine learning researcher|london area, united kingdom|https://www.linkedin.com/jobs/view/3995406938
fera science ltd.|science lead- land use|york, england, united kingdom|https://www.linkedin.com/jobs/view/4016157067
microtech global ltd|machine learning researcher|greater preston area, worldwide|https://www.linkedin.com/jobs/view/3954247835
verso recruitment group|phd graduate – technical solutions specialist|milton, england, united kingdom|https://www.linkedin.com/jobs/view/4010851098
futurelearn|online lecturer - computing science|united kingdom|https://www.linkedin.com/jobs/view/4006581693
rise technical|algorithm researcher|solihull, england, united kingdom|https://www.linkedin.com/jobs/view/4000945204
phd|analyst - marketing sciences|london, england, united kingdom|https://www.linkedin.com/jobs/view/3925875403
fathom.io|senior data scientist - 1 year ftc - saudi arabia relocation|london, england, united kingdom|https://www.linkedin.com/jobs/view/3985514521
harnham|principal ai consultant|london area, united kingdom|https://www.linkedin.com/jobs/view/3947920222
harnham|senior data scientist|london area, united kingdom|https://www.linkedin.com/jobs/view/3976869683
harnham|staff ai consultant|london area, united kingdom|https://www.linkedin.com/jobs/view/3947918170
lancaster university|research associate/senior research associate (5 posts)|lancashire, england, united kingdom|https://www.linkedin.com/jobs/view/3978242702
adlib recruitment  b corp™|engineering manager|norwich, england, united kingdom|https://www.linkedin.com/jobs/view/4009289737
university of bath|lecturer (assistant professor) in chemical engineering (fm11847)|bath, england, united kingdom|https://www.linkedin.com/jobs/view/3991558877
harnham|staff ai consultant|london area, united kingdom|https://www.linkedin.com/jobs/view/3947970633
tenth revolution group|senior data scientist - hybrid/london - £90,000|city of london, england, united kingdom|https://www.linkedin.com/jobs/view/3994290264
dyson|senior lecturer - software engineering|malmesbury, england, united kingdom|https://www.linkedin.com/jobs/view/3982330257
harnham|lead data scientist|london area, united kingdom|https://www.linkedin.com/jobs/view/3976664143
ucb|research associate / scientist, antibody discovery & optimisation|slough, england, united kingdom|https://www.linkedin.com/jobs/view/4000705189
harnham|senior data scientist - sport|london area, united kingdom|https://www.linkedin.com/jobs/view/4006865485
hays|technology director|kidlington, england, united kingdom|https://www.linkedin.com/jobs/view/4011406521
harnham|lead data scientist - pricing|london area, united kingdom|https://www.linkedin.com/jobs/view/3961088966
harnham|senior data scientist|birmingham, england, united kingdom|https://www.linkedin.com/jobs/view/3952248702
ve3|ai policy and research expert|city of london, england, united kingdom|https://www.linkedin.com/jobs/view/4008760504
harnham|senior data scientist|solihull, england, united kingdom|https://www.linkedin.com/jobs/view/3952248717
wheely|senior data scientist, marketplace|london, england, united kingdom|https://www.linkedin.com/jobs/view/4016151053
the university of manchester|research associate fflux|manchester, england, united kingdom|https://www.linkedin.com/jobs/view/3992345897
novocomms limited|communication system architect|birmingham, england, united kingdom|https://www.linkedin.com/jobs/view/3964843124
harnham|senior data scientist|london area, united kingdom|https://www.linkedin.com/jobs/view/3921068619
medpace|director of ai strategy|london, england, united kingdom|https://www.linkedin.com/jobs/view/3968883434
university of southampton|research fellow, pure mathematics|southampton, england, united kingdom|https://www.linkedin.com/jobs/view/3980431610
ernest gordon recruitment|lead data scientist music technology}|london, england, united kingdom|https://www.linkedin.com/jobs/view/4011395738
the university of manchester|research associate in generative ai for biological systems|manchester, england, united kingdom|https://www.linkedin.com/jobs/view/3992347782
harnham|lead data scientist|england, united kingdom|https://www.linkedin.com/jobs/view/4011469015
aichemy|research fellow in ai-driven automated chemistry at university of liverpool|liverpool, england, united kingdom|https://www.linkedin.com/jobs/view/3991350089
squeaky wheel promotions|beamline scientist/senior beamline scientist - i07 surface diffraction beamline|didcot, england, united kingdom|https://www.linkedin.com/jobs/view/4016226698
energy jobline|lead data scientist {music technology}|london, england, united kingdom|https://www.linkedin.com/jobs/view/4015721969
pharmaron|scientist, drug product (analytical chemistry)|hoddesdon, england, united kingdom|https://www.linkedin.com/jobs/view/3998148808
hoxton farms|🥼cell line development lead|london, england, united kingdom|https://www.linkedin.com/jobs/view/3860722127
huawei technologies research & development (uk) ltd|cpu research scientist (contractor)|cambridge, england, united kingdom|https://www.linkedin.com/jobs/view/3933351621
harnham|data architect|united kingdom|https://www.linkedin.com/jobs/view/3999367147
energy jobline|engineering manager|cambridge, england, united kingdom|https://www.linkedin.com/jobs/view/4008793094
hays|technology director|oxfordshire, england, united kingdom|https://www.linkedin.com/jobs/view/4000479190
the university of manchester|research associate in generative deep learning for synthetising virtual patient populations for in-silico trials|manchester, england, united kingdom|https://www.linkedin.com/jobs/view/3992352346
jobs via efinancialcareers|london start up hiring junior quant researcher with internship experience|london, england, united kingdom|https://www.linkedin.com/jobs/view/4007143182
peel hunt|senior data scientist|london, england, united kingdom|https://www.linkedin.com/jobs/view/3999625887
gkn aerospace|principal research engineer - materials and testing|bristol, england, united kingdom|https://www.linkedin.com/jobs/view/3995861220
foster + partners|environmental design analyst - cfd|london area, united kingdom|https://www.linkedin.com/jobs/view/4011331792
university of southampton|research fellow in contrail simulation and modelling for future aircraft|southampton, england, united kingdom|https://www.linkedin.com/jobs/view/4002455227
adlib recruitment  b corp™|senior data scientist|bristol, england, united kingdom|https://www.linkedin.com/jobs/view/4012310440
koura|technical manager - medical devices and gases|ince, england, united kingdom|https://www.linkedin.com/jobs/view/4013704435
university of birmingham|research fellow - school of engineering - 103985 - grade 7|birmingham, england, united kingdom|https://www.linkedin.com/jobs/view/4010866578
pharmiweb.jobs: global life science jobs|analyst - health technology assessment|bristol, england, united kingdom|https://www.linkedin.com/jobs/view/4016178724
switchee|lead data scientist|london, england, united kingdom|https://www.linkedin.com/jobs/view/3979334885
the university of sheffield|research associate in neuromorphic computing|sheffield, england, united kingdom|https://www.linkedin.com/jobs/view/4007024424
techire ai|senior research scientist - neuro-symbolic ai|london area, united kingdom|https://www.linkedin.com/jobs/view/4003461978
linklaters|senior data scientist|london, england, united kingdom|https://www.linkedin.com/jobs/view/3988014878
auticon uk|data consultant|greater london, england, united kingdom|https://www.linkedin.com/jobs/view/3970118640
clickjobs.io|artificial intelligence researcher|glasgow, scotland, united kingdom|https://www.linkedin.com/jobs/view/4008323328
clickjobs.io|artificial intelligence researcher|leeds, england, united kingdom|https://www.linkedin.com/jobs/view/4008316719
unsw|lecturer / senior lecturer in computer science and engineering|sheffield, england, united kingdom|https://www.linkedin.com/jobs/view/4010462573
cytiva|senior principal engineer|portsmouth, england, united kingdom|https://www.linkedin.com/jobs/view/3979730399
costello medical|analyst - health technology assessment (hta)|cambridge, england, united kingdom|https://www.linkedin.com/jobs/view/3977553754
university of warwick|research fellow (109482-0724)|coventry, england, united kingdom|https://www.linkedin.com/jobs/view/4016861736
unsw|lecturer / senior lecturer in computer science and engineering (education focussed)|bristol, england, united kingdom|https://www.linkedin.com/jobs/view/4010465426
nvidia|senior software & cloud architect|united kingdom|https://www.linkedin.com/jobs/view/4001881269
university of birmingham|research fellow in microfluidics technology - school of engineering - 104451 - grade 7|birmingham, england, united kingdom|https://www.linkedin.com/jobs/view/4011257950
ecocareers|senior protein engineer & biocatalysis scientist|england, united kingdom|https://www.linkedin.com/jobs/view/4011427530
the open university|lecturer in computing and communications (artificial intelligence)|milton keynes, england, united kingdom|https://www.linkedin.com/jobs/view/3994486459
hackajob|senior machine learning research scientist|united kingdom|https://www.linkedin.com/jobs/view/3997285407
zoetis|associate scientist/senior associate scientist|cambridge, england, united kingdom|https://www.linkedin.com/jobs/view/4006419553
university of southampton|research fellow in wireless communications|southampton, england, united kingdom|https://www.linkedin.com/jobs/view/4007334870
european tech recruit|chief vector database architect|edinburgh, scotland, united kingdom|https://www.linkedin.com/jobs/view/4011433881
intellias|head of cyber security, global leader|england, united kingdom|https://www.linkedin.com/jobs/view/4006873410
j k barnes|senior quant researcher - equities / futures (london, amsterdam or chicago)|london area, united kingdom|https://www.linkedin.com/jobs/view/4013419082
energy jobline|senior data scientist|bristol, england, united kingdom|https://www.linkedin.com/jobs/view/4014772513
university of warwick|research fellow (terabotics) (109569-0824)|coventry, england, united kingdom|https://www.linkedin.com/jobs/view/4016860692
phd|digital manager|london, england, united kingdom|https://www.linkedin.com/jobs/view/3961344216
diamond search recruitment ltd|senior photonics engineer|torquay, england, united kingdom|https://www.linkedin.com/jobs/view/3989096958
jazz pharmaceuticals|principal scientist, preformulation and biopharmaceutics|sittingbourne, england, united kingdom|https://www.linkedin.com/jobs/view/3959555600
element materials technology|principal structural consultant & team leader|bristol, england, united kingdom|https://www.linkedin.com/jobs/view/3961904767
the alan turing institute|data study group (early-career) principal investigator|london area, united kingdom|https://www.linkedin.com/jobs/view/4002065991
university of nottingham|phd studentship: improving reliability of medical processes using system modelling and artificial intelligence techniques|nottingham, england, united kingdom|https://www.linkedin.com/jobs/view/3970236752
almac group|senior analyst|loughborough, england, united kingdom|https://www.linkedin.com/jobs/view/3994752930
university of east london|research excellence phd studentship - school of architecture, computing and engineering (fintech)|london, england, united kingdom|https://www.linkedin.com/jobs/view/4005940614
owkin|senior / principal scientist - fixed term contract|united kingdom|https://www.linkedin.com/jobs/view/3973390442
jobs via efinancialcareers|machine learning equity quant researcher/ flexible location|london, england, united kingdom|https://www.linkedin.com/jobs/view/3995004091
jobs via efinancialcareers|research led start up recruiting machine learning researcher|london, england, united kingdom|https://www.linkedin.com/jobs/view/3995325500
focalpoint|principal gnss scientist|cambridge batch, england, united kingdom|https://www.linkedin.com/jobs/view/3786404040
leeds beckett university|lecturer in games & digital art|leeds, england, united kingdom|https://www.linkedin.com/jobs/view/4014926470
microtech global ltd|researcher in multimodal ai|egham, england, united kingdom|https://www.linkedin.com/jobs/view/3955623092
huawei technologies research & development (uk) ltd|gpu architecture/algorithm researcher (phd)|cambridge, england, united kingdom|https://www.linkedin.com/jobs/view/3664556544
cytiva|sr manager, mlops|little chalfont, england, united kingdom|https://www.linkedin.com/jobs/view/3979171647
university of cambridge|standardisation engineering director|cambridgeshire, england, united kingdom|https://www.linkedin.com/jobs/view/4001442773
best buy|senior data scientist – medical/clinical informatics|london, england, united kingdom|https://www.linkedin.com/jobs/view/4008494681
mbda|autonomous systems team lead|bristol, england, united kingdom|https://www.linkedin.com/jobs/view/3672795730
viridien|researcher 2024 programme|west sussex, england, united kingdom|https://www.linkedin.com/jobs/view/3984649533
the university of sheffield|research associate in permanent magnet synchronous machines|sheffield, england, united kingdom|https://www.linkedin.com/jobs/view/4012917831
omnicom media group uk|business/tech transformation consulting - 12 month ftc|london, england, united kingdom|https://www.linkedin.com/jobs/view/4004407066
axelera ai|director of compiler engineering|united kingdom|https://www.linkedin.com/jobs/view/3860727667
clickjobs.io|co-founder - chief ai scientist (equity only)|bristol, england, united kingdom|https://www.linkedin.com/jobs/view/4008322450
inverto  a bcg company|(associate) consultant in strategic procurement/supply chain|greater london, england, united kingdom|https://www.linkedin.com/jobs/view/4004171002
nexperia|senior/principal reliability engineer (m/f/d) - gan|manchester, england, united kingdom|https://www.linkedin.com/jobs/view/3977332872
ge vernova|power systems modelling lead|rugby, england, united kingdom|https://www.linkedin.com/jobs/view/3826638421
jobs via efinancialcareers|machine learning signal construction quant|london, england, united kingdom|https://www.linkedin.com/jobs/view/3995325509
citi|quant developer, vice president|london, england, united kingdom|https://www.linkedin.com/jobs/view/3991679561
huawei technologies research & development (uk) ltd|gpu architect (hardware team - london, cambridge or edinburgh)|cambridge, england, united kingdom|https://www.linkedin.com/jobs/view/3664571106
monzo bank|lead machine learning scientist|london, england, united kingdom|https://www.linkedin.com/jobs/view/3956313564
phd|digital platforms associate director|london, england, united kingdom|https://www.linkedin.com/jobs/view/3946564827
jobs via efinancialcareers|start up futures/ fx trader|london, england, united kingdom|https://www.linkedin.com/jobs/view/3995321775
phd|senior planner, social|london, england, united kingdom|https://www.linkedin.com/jobs/view/3947979915
jobs via efinancialcareers|medium frequency quant trader/ london|london, england, united kingdom|https://www.linkedin.com/jobs/view/3995325516
