company|title|location|link
sipearl|[permanent position] compiler engineer|maisons-laffitte, île-de-france, france|https://www.linkedin.com/jobs/view/4383023947
apple|fr-store leader|paris, île-de-france, france|https://www.linkedin.com/jobs/view/4424010457
accenture dach|r&d systems manager (all genders)|munich, bavaria, germany|https://www.linkedin.com/jobs/view/4367006974
nvidia|senior software engineer, applied ai|munich, bavaria, germany|https://www.linkedin.com/jobs/view/4427773536
black forest labs|member of technical staff - research infrastructure engineer|freiburg, baden-württemberg, germany|https://www.linkedin.com/jobs/view/4315862864
nvidia|principal simulation engineer, industrial physics and robotics|finland|https://www.linkedin.com/jobs/view/4423991883
sony interactive entertainment|senior platform engineer|berlin, berlin, germany|https://www.linkedin.com/jobs/view/4414020841
technische universität berlin|wiss. mitarbeiter*in (d/m/w)|berlin, berlin, germany|https://www.linkedin.com/jobs/view/4431135138
microsoft|cryogenic engineer|delft, south holland, netherlands|https://www.linkedin.com/jobs/view/4429936388
sipearl|[permanent position] benchmark cloud & hpc engineer|maisons-laffitte, île-de-france, france|https://www.linkedin.com/jobs/view/4383022966
sonos, inc.|senior machine learning engineer|eu, normandy, france|https://www.linkedin.com/jobs/view/4397619036
apple|senior legal counsel - regulatory legal|cork, county cork, ireland|https://www.linkedin.com/jobs/view/4414435763
duckduckgo|senior privacy engineer|austria|https://www.linkedin.com/jobs/view/4430035120
nvidia|senior software engineer, ai inference systems|poland|https://www.linkedin.com/jobs/view/4407976242
mongodb|senior staff engineer|dublin, county dublin, ireland|https://www.linkedin.com/jobs/view/4377465704
airbus aircraft|robotics functional design & software architect m/f|toulouse, occitanie, france|https://www.linkedin.com/jobs/view/4417979917
apple|facilities manager|munich, bavaria, germany|https://www.linkedin.com/jobs/view/4426697464
alphasense|staff engineer, ios|helsinki, uusimaa, finland|https://www.linkedin.com/jobs/view/4423531062
microsoft|software engineer - m365 copilot|dublin, county dublin, ireland|https://www.linkedin.com/jobs/view/4430436976
nvidia|solutions architect – ai factory|hamburg, hamburg, germany|https://www.linkedin.com/jobs/view/4395482546
waymo|staff software engineer, linux kernel|warsaw, mazowieckie, poland|https://www.linkedin.com/jobs/view/4326329071
amazon science|applied scientist, eu intech consumer selection discovery, nintai|madrid, community of madrid, spain|https://www.linkedin.com/jobs/view/4427327672
google|senior software engineer, ai/ml infrastructure|warsaw, mazowieckie, poland|https://www.linkedin.com/jobs/view/4424222040
bmw group|validation engineer - multi-agent ai systems (f/m/x)|munich, bavaria, germany|https://www.linkedin.com/jobs/view/4400857986
bao|senior engineer|france|https://www.linkedin.com/jobs/view/4404804892
arise app|ios app developer (remote - m/f/d)|berlin, berlin, germany|https://www.linkedin.com/jobs/view/4427005793
siemens|principal applied scientist (f/m/d)|munich, bavaria, germany|https://www.linkedin.com/jobs/view/4430859737
spotify|senior staff machine learning engineer, content platform|stockholm, stockholm county, sweden|https://www.linkedin.com/jobs/view/4408506243
arm|electronics engineer|sophia antipolis, provence-alpes-côte d'azur, france|https://www.linkedin.com/jobs/view/4406998003
cisco|senior software engineer - apps|galway, county galway, ireland|https://www.linkedin.com/jobs/view/4404056919
apple|emeia bpr business operations lead - 23 month|cork, county cork, ireland|https://www.linkedin.com/jobs/view/4428002002
universal quantum|software engineer (compilers) (f/m/d)|hamburg, hamburg, germany|https://www.linkedin.com/jobs/view/4366771410
bosch|phd thesis - scalable and explainable end2end driving model (seed)|leonberg, baden-württemberg, germany|https://www.linkedin.com/jobs/view/4385264540
phrase|principal ai researcher|europe|https://www.linkedin.com/jobs/view/4427833884
airbus aircraft|phd student on "logistics optimization: a human-centric approach" (d/f/m)|hamburg, hamburg, germany|https://www.linkedin.com/jobs/view/4406413811
tether.io|ai research engineer (kernel & inference optimization)|netherlands|https://www.linkedin.com/jobs/view/4429184774
apple|nl-manager|the hague, south holland, netherlands|https://www.linkedin.com/jobs/view/4424466112
mistral|applied scientist / domain expert, ai4engineering - emea|munich, bavaria, germany|https://www.linkedin.com/jobs/view/4422158402
google|ads solutions engineer, gtech|dublin, county dublin, ireland|https://www.linkedin.com/jobs/view/4430561129
bmw group|domain architect for camera signal processing automotive (f/m/x)|ulm, baden-württemberg, germany|https://www.linkedin.com/jobs/view/4385760412
abn amro bank n.v.|ai techlead|amsterdam, north holland, netherlands|https://www.linkedin.com/jobs/view/4412111530
king|principal software developer – c++ /test automation|stockholm, stockholm county, sweden|https://www.linkedin.com/jobs/view/4399426438
siemens|principal applied scientist (f/m/d)|berlin, berlin, germany|https://www.linkedin.com/jobs/view/4430860765
msab|software engineers|stockholm, stockholm county, sweden|https://www.linkedin.com/jobs/view/4392435158
google|senior software engineer, app hub|warsaw, mazowieckie, poland|https://www.linkedin.com/jobs/view/4423248567
tether.io|ai research engineer (kernel & inference optimization) - 100% remote worldwide|italy|https://www.linkedin.com/jobs/view/4429194608
siemens|senior principal applied scientist (f/m/d)|berlin, berlin, germany|https://www.linkedin.com/jobs/view/4430867760
naver labs europe|geometric deep learning research scientist f/m|meylan, auvergne-rhône-alpes, france|https://www.linkedin.com/jobs/view/4430456579
nvidia|senior solution architect - physical ai, medical and surgical robotics|munich, bavaria, germany|https://www.linkedin.com/jobs/view/4418533210
black forest labs|member of technical staff - image / video generation|freiburg, baden-württemberg, germany|https://www.linkedin.com/jobs/view/4315852967
adobe|software development engineer|hamburg, hamburg, germany|https://www.linkedin.com/jobs/view/4428762706
uit- the arctic university of norway|professor/førsteamanuensis|narvik, nordland, norway|https://www.linkedin.com/jobs/view/4419517589
helmholtz-zentrum dresden-rossendorf (hzdr)|postdoc (f/m/d) gpgpu computing|dresden, saxony, germany|https://www.linkedin.com/jobs/view/4405347251
mastercard|principal ai engineer|greater dublin, worldwide|https://www.linkedin.com/jobs/view/4408896017
technische universität wien|university assistant prae-doc (all genders)|vienna, vienna, austria|https://www.linkedin.com/jobs/view/4411395935
mistral|ai scientist - paris/london - onsite or hybrid or remote|paris, île-de-france, france|https://www.linkedin.com/jobs/view/4428105159
duckduckgo|senior privacy engineer|iceland, worldwide|https://www.linkedin.com/jobs/view/4430028160
openai|forward deployed engineer - dublin|dublin, county dublin, ireland|https://www.linkedin.com/jobs/view/4417179054
apple|it - specialist (sales)|turin, piedmont, italy|https://www.linkedin.com/jobs/view/4414146879
university of agder (uia)|post-doctoral research fellow in ai and cultural heritage|kristiansand, agder, norway|https://www.linkedin.com/jobs/view/4425638228
google|senior ai/ml software engineer, youtube knowledge|paris, île-de-france, france|https://www.linkedin.com/jobs/view/4400783517
federal state of saxony|wiss. mitarbeiterin bzw. mitarbeiter (m/w/d) dateisysteme und daten im hpc-bereich|dresden, saxony, germany|https://www.linkedin.com/jobs/view/4426038705
apple|it - specialist (sales) - opportunities for protected categories|florence, tuscany, italy|https://www.linkedin.com/jobs/view/4428490627
silicon austria labs (sal)|pilot line pdk & design enablement lead (all genders)|villach, carinthia, austria|https://www.linkedin.com/jobs/view/4416502491
bmw group|doktorand optimierung von flexibilitätspotenzialen im bmw‑energiesystem (w/m/x)|munich, bavaria, germany|https://www.linkedin.com/jobs/view/4426437602
university of galway|phd gso 031-26 fully funded phd scholarship in decarb-ai (a innovate for ireland centre) ichec & school of computer science|galway, county galway, ireland|https://www.linkedin.com/jobs/view/4429302949
apple|de-specialist (m/w/x)|berlin, berlin, germany|https://www.linkedin.com/jobs/view/4414149884
google|software engineer iii, compute infrastructure control|warsaw, mazowieckie, poland|https://www.linkedin.com/jobs/view/4418262114
air apps|software architect - mobile|madrid, community of madrid, spain|https://www.linkedin.com/jobs/view/4422701228
karlsruhe institute of technology (kit)|akademische mitarbeiterin / akademischer mitarbeiter (w/m/d)|eggenstein, baden-württemberg, germany|https://www.linkedin.com/jobs/view/4427923780
artelys|expert optimisation numérique f/h|paris, île-de-france, france|https://www.linkedin.com/jobs/view/4390728646
amazon web services (aws)|system development engineer, esc|dublin, county dublin, ireland|https://www.linkedin.com/jobs/view/4405885970
eindhoven university of technology|assistant professor in sustainable agentic ai|eindhoven, north brabant, netherlands|https://www.linkedin.com/jobs/view/4422437603
bcg x|forward deployed ai engineer, germany & austria - bcg x|munich, bavaria, germany|https://www.linkedin.com/jobs/view/4424672727
mastercard|principal software engineer|greater dublin, worldwide|https://www.linkedin.com/jobs/view/4428264396
cloudera|staff performance engineer|barcelona, catalonia, spain|https://www.linkedin.com/jobs/view/4330901972
constant innovation ab|🏍️ looking for a technical co-founder|sweden|https://www.linkedin.com/jobs/view/4427533764
bosch france|(h/f/n) software architect|valbonne, provence-alpes-côte d'azur, france|https://www.linkedin.com/jobs/view/4406638249
sap|principal agentic ai engineer / architect at ai coe (f/m/d)|garching, bavaria, germany|https://www.linkedin.com/jobs/view/4383922293
amd|simd software engineer|warsaw, mazowieckie, poland|https://www.linkedin.com/jobs/view/4412812404
aalto university|doctoral positions in the bridge-ai network (ai-health) in germany and finland|espoo, uusimaa, finland|https://www.linkedin.com/jobs/view/4422817708
black forest labs|developer experience engineer|freiburg, baden-württemberg, germany|https://www.linkedin.com/jobs/view/4419961460
bluefish|staff ai platform engineer|berlin, germany|https://www.linkedin.com/jobs/view/4407852923
nvidia|senior gpu networking architect|poland|https://www.linkedin.com/jobs/view/4425543718
q.ant|llvm / mlir compiler architect - photonic computing (f/m/d)|stuttgart, baden-württemberg, germany|https://www.linkedin.com/jobs/view/4418347752
nxp semiconductors|embedded crypto software developer (m/f/d)|gratkorn, styria, austria|https://www.linkedin.com/jobs/view/4431883741
waymo|staff software engineer, speciality pudo|warsaw, mazowieckie, poland|https://www.linkedin.com/jobs/view/4413579541
jetbrains|research engineer (llm training and performance)|munich, bavaria, germany|https://www.linkedin.com/jobs/view/4328737997
apple|supply demand planner - 18 months contract|cork, county cork, ireland|https://www.linkedin.com/jobs/view/4430833580
sap|principal software architect (m/f/d)  sap knowledge graph|walldorf, baden-württemberg, germany|https://www.linkedin.com/jobs/view/4395975079
pasqal|quantum software engineer – qpu programming and compilation|palaiseau, île-de-france, france|https://www.linkedin.com/jobs/view/4368180481
apple|apple store advisor, neuss|neuss, north rhine-westphalia, germany|https://www.linkedin.com/jobs/view/4416742181
thryve|mathematician / physicist for software engineering|hamburg, germany|https://www.linkedin.com/jobs/view/4419188449
airbus defence and space|software developer - modeling & simulation (d/m/w)|immenstaad am bodensee, baden-württemberg, germany|https://www.linkedin.com/jobs/view/4364161191
apple|it - specialista (vendite)|lonato, lombardy, italy|https://www.linkedin.com/jobs/view/4414158540
nvidia|senior hpc ai cluster engineer|sweden|https://www.linkedin.com/jobs/view/4417501986
mastercard|principal software engineer r-280605|dublin, county dublin, ireland|https://www.linkedin.com/jobs/view/4429627878
apple|apple channel store advisor, bad dürrheim|stuttgart, baden-württemberg, germany|https://www.linkedin.com/jobs/view/4414160493
apple|de-specialist (m/w/x)|sindelfingen, baden-württemberg, germany|https://www.linkedin.com/jobs/view/4414161409
ibm|firmware engineer|waterford, county waterford, ireland|https://www.linkedin.com/jobs/view/4429883188
ibm|firmware engineer|waterford, county waterford, ireland|https://www.linkedin.com/jobs/view/4423126860
the flex|founding software engineer|albania, worldwide|https://www.linkedin.com/jobs/view/4429171653
the flex|software engineer|albania, worldwide|https://www.linkedin.com/jobs/view/4429163717
the flex|full-stack engineering lead|albania, worldwide|https://www.linkedin.com/jobs/view/4429173527
omilia|text & reasoning llm / nlu tech lead|albania, worldwide|https://www.linkedin.com/jobs/view/4402931191
searchapi|ai integrations engineer (open source)|albania, worldwide|https://www.linkedin.com/jobs/view/4431718340
bairesdev|principal software engineer (rust) - remote work  ref#289885|tirana, tirana, worldwide|https://www.linkedin.com/jobs/view/4420467227
globaldev group|senior ml engineer (mlops-focused)|albania, worldwide|https://www.linkedin.com/jobs/view/4410542883
bairesdev|staff systems engineer (c++) - remote work  ref#289959|tirana, tirana, worldwide|https://www.linkedin.com/jobs/view/4420465455
bairesdev|staff software engineer (rust) - remote work  ref#289725|tirana, tirana, worldwide|https://www.linkedin.com/jobs/view/4420462546
technische universität graz|cryptographic software engineer (zkp)|graz, styria, austria|https://www.linkedin.com/jobs/view/4428506449
the flex|founding software engineer|austria|https://www.linkedin.com/jobs/view/4429170589
n8n|community software engineer  remote  europe|austria|https://www.linkedin.com/jobs/view/4419884062
dynatrace|platform performance engineer (m/f/x) with an ai-first mindset|vienna, vienna, austria|https://www.linkedin.com/jobs/view/4426497009
keyrock|engineering lead- options|vienna, vienna, austria|https://www.linkedin.com/jobs/view/4404461765
canva|machine learning engineering manager - evaluations|innere stadt, vienna, austria|https://www.linkedin.com/jobs/view/4418137207
mistral|applied scientist / research engineer, ai4engineering - emea|linz, upper austria, austria|https://www.linkedin.com/jobs/view/4416906916
the flex|software engineer|austria|https://www.linkedin.com/jobs/view/4429164668
dynatrace|platform performance engineer (m/f/x) with an ai-first mindset|linz, upper austria, austria|https://www.linkedin.com/jobs/view/4426482833
bairesdev|principal software engineer (rust) - remote work  ref#289886|vienna, vienna, austria|https://www.linkedin.com/jobs/view/4420470134
the flex|founding software engineer|azerbaijan, worldwide|https://www.linkedin.com/jobs/view/4429154981
the flex|software engineer|azerbaijan, worldwide|https://www.linkedin.com/jobs/view/4429169660
epam systems|lead ai engineer|azerbaijan, worldwide|https://www.linkedin.com/jobs/view/4427840087
the flex|full-stack engineering lead|azerbaijan, worldwide|https://www.linkedin.com/jobs/view/4429166657
xsolla|technical lead|baku, baku ekonomic zone, worldwide|https://www.linkedin.com/jobs/view/4341327260
epam systems|generative ai operations engineer (genai ops)|azerbaijan, worldwide|https://www.linkedin.com/jobs/view/4428938036
quadcode|ai skills engineer|belarus, worldwide|https://www.linkedin.com/jobs/view/4418252731
bairesdev|staff systems engineer (c++) - remote work  ref#289950|minsk, minsk, worldwide|https://www.linkedin.com/jobs/view/4420453849
mapbox|software development engineer ii, android, navigation sdk|minsk, minsk, worldwide|https://www.linkedin.com/jobs/view/4367458546
bairesdev|principal software engineer (rust) - remote work  ref#289873|minsk, minsk, worldwide|https://www.linkedin.com/jobs/view/4420450886
mapbox|senior machine learning engineer, hd maps|minsk, minsk, worldwide|https://www.linkedin.com/jobs/view/4427093295
mapbox|software development engineer ii (data engineer), hd maps|minsk, minsk, worldwide|https://www.linkedin.com/jobs/view/4403445768
mapbox|senior/lead software data engineer (roads team)|minsk, minsk, worldwide|https://www.linkedin.com/jobs/view/4388739060
bairesdev|staff software engineer (rust) - remote work  ref#289717|minsk, minsk, worldwide|https://www.linkedin.com/jobs/view/4420459689
mapbox|senior/lead software data engineer (roads team)|minsk, minsk, worldwide|https://www.linkedin.com/jobs/view/4388726530
epam systems|lead ai python engineer|belarus, worldwide|https://www.linkedin.com/jobs/view/4360548893
searchapi|browser / kernel engineer|belgium|https://www.linkedin.com/jobs/view/4432290087
magics technologies|senior compiler software engineer|leuven, flemish region, belgium|https://www.linkedin.com/jobs/view/4428359292
mozilla|senior software engineer - engineering workflow and ci|belgium|https://www.linkedin.com/jobs/view/4404478710
nikon metrology|software architect — global x-ray software (xsw)|leuven, flemish region, belgium|https://www.linkedin.com/jobs/view/4425791403
vito|research software engineer|mol, flemish region, belgium|https://www.linkedin.com/jobs/view/4425588583
the flex|founding software engineer|belgium|https://www.linkedin.com/jobs/view/4429161750
swave photonics|senior software engineer c++|leuven, flemish region, belgium|https://www.linkedin.com/jobs/view/4405219883
the flex|full-stack engineering lead|belgium|https://www.linkedin.com/jobs/view/4429161745
ml6|senior software engineer|ghent, flemish region, belgium|https://www.linkedin.com/jobs/view/4330792616
capgemini|ai engineering lead|diegem, flemish region, belgium|https://www.linkedin.com/jobs/view/4425487384
cohere|forward deployed engineer, agentic platform (uk/europe)|brussels, brussels region, belgium|https://www.linkedin.com/jobs/view/4418815761
alan|fullstack software engineer (x/f/m) - global architecture|brussels region, belgium|https://www.linkedin.com/jobs/view/4366158647
bairesdev|staff systems engineer (c++) - remote work  ref#289941|brussels, brussels region, belgium|https://www.linkedin.com/jobs/view/4420462552
optimile|tech lead|ghent, flemish region, belgium|https://www.linkedin.com/jobs/view/4390369433
alan|fullstack software engineer (x/f/m) - global architecture|antwerp, flemish region, belgium|https://www.linkedin.com/jobs/view/4366154743
bairesdev|staff systems engineer (c++) - remote work  ref#289955|sarajevo, federation of bosnia and herzegovina, worldwide|https://www.linkedin.com/jobs/view/4420459698
bairesdev|principal software engineer (rust) - remote work  ref#289881|sarajevo, federation of bosnia and herzegovina, worldwide|https://www.linkedin.com/jobs/view/4420463575
salt square|ai/ml architect/lead|sarajevo, federation of bosnia and herzegovina, worldwide|https://www.linkedin.com/jobs/view/4393523235
mwdn|low-level rust developer|sarajevo, federation of bosnia and herzegovina, worldwide|https://www.linkedin.com/jobs/view/4429021656
softserve|lead omniverse engineer|bulgaria, worldwide|https://www.linkedin.com/jobs/view/4425871880
searchapi|browser / kernel engineer|bulgaria, worldwide|https://www.linkedin.com/jobs/view/4431721301
softserve|senior omniverse engineer|bulgaria, worldwide|https://www.linkedin.com/jobs/view/4418599275
the flex|founding software engineer|bulgaria, worldwide|https://www.linkedin.com/jobs/view/4429158776
softserve|senior r&d engineer|bulgaria, worldwide|https://www.linkedin.com/jobs/view/4404294609
redis|senior software engineer , ai and search team - c/c++ or rust|sofia metropolitan area, worldwide|https://www.linkedin.com/jobs/view/4395010966
goodgame studios|senior ai specialist - game development|sofia, sofia city, worldwide|https://www.linkedin.com/jobs/view/4394767871
searchapi|anti-bot engineer|bulgaria, worldwide|https://www.linkedin.com/jobs/view/4342421598
duckduckgo|senior privacy engineer|bulgaria, worldwide|https://www.linkedin.com/jobs/view/4430041026
fourth|lead ai engineer|sofia, sofia city, worldwide|https://www.linkedin.com/jobs/view/4432287812
hotschedules|lead ai engineer|sofia, sofia city, worldwide|https://www.linkedin.com/jobs/view/4390134162
the flex|software engineer|bulgaria, worldwide|https://www.linkedin.com/jobs/view/4429154973
flutter international|principal software engineer|sofia, sofia city, worldwide|https://www.linkedin.com/jobs/view/4410807253
partyhat|game mathematician|bulgaria, worldwide|https://www.linkedin.com/jobs/view/4429441211
keyrock|engineering lead- options|sofia, sofia city, worldwide|https://www.linkedin.com/jobs/view/4404464716
palo alto networks|staff software engineer - secure ai agents|sofia, sofia city, worldwide|https://www.linkedin.com/jobs/view/4417944892
luxoft bulgaria|vision systems architect|bulgaria, worldwide|https://www.linkedin.com/jobs/view/4420423601
muck rack|lead software engineer, content ingestion|varna, varna, worldwide|https://www.linkedin.com/jobs/view/4407992775
n8n|community software engineer  remote  europe|bulgaria, worldwide|https://www.linkedin.com/jobs/view/4419879148
the flex|founding software engineer|croatia, worldwide|https://www.linkedin.com/jobs/view/4429155770
delta reality|computer vision engineer|zagreb, zagreb, worldwide|https://www.linkedin.com/jobs/view/4380529928
gideon smart home|c++ software engineer - croatia|zagreb, zagreb, worldwide|https://www.linkedin.com/jobs/view/4432873601
goodgame studios|senior ai specialist - game development|zagreb, zagreb, worldwide|https://www.linkedin.com/jobs/view/4394765868
super|senior engineer, machine learning platform|croatia, zagreb, worldwide|https://www.linkedin.com/jobs/view/4418252015
vumedi|principal software engineer|zagreb, zagreb, worldwide|https://www.linkedin.com/jobs/view/4384510324
autodesk|machine learning engineer|croatia, worldwide|https://www.linkedin.com/jobs/view/4377753536
zscaler|sr. staff ai engineer|greater split area, worldwide|https://www.linkedin.com/jobs/view/4426330874
keyrock|engineering lead- options|zagreb, zagreb, worldwide|https://www.linkedin.com/jobs/view/4404463769
bairesdev|staff systems engineer (c++) - remote work  ref#289963|zagreb, zagreb, worldwide|https://www.linkedin.com/jobs/view/4420458757
the flex|full-stack engineering lead|croatia, worldwide|https://www.linkedin.com/jobs/view/4429155769
abysalto|ai tech lead (m/f)|zagreb, zagreb, worldwide|https://www.linkedin.com/jobs/view/4392439021
super|senior backend engineer|croatia, zagreb, worldwide|https://www.linkedin.com/jobs/view/4392408288
roko labs|senior ai engineer|zagreb, zagreb, worldwide|https://www.linkedin.com/jobs/view/4392443044
super|machine learning engineer - applied ml & research|croatia, zagreb, worldwide|https://www.linkedin.com/jobs/view/4401470442
bairesdev|principal software engineer (rust) - remote work  ref#289889|zagreb, zagreb, worldwide|https://www.linkedin.com/jobs/view/4420465439
abysalto|embodied ai engineer (m/f)|zagreb, zagreb, worldwide|https://www.linkedin.com/jobs/view/4401142286
keyrock|head of engineering - options|zagreb, zagreb, worldwide|https://www.linkedin.com/jobs/view/4404469748
metaquotes ltd.|senior с++ developer|cyprus, limassol, worldwide|https://www.linkedin.com/jobs/view/4353756417
the flex|founding software engineer|cyprus, worldwide|https://www.linkedin.com/jobs/view/4429159725
metaquotes ltd.|head of qa|limassol municipality, limassol, worldwide|https://www.linkedin.com/jobs/view/4335881817
revolut|software engineer (python) - autodl|cyprus, worldwide|https://www.linkedin.com/jobs/view/4406516991
jetbrains|research engineer (agentic models)|limassol, limassol, worldwide|https://www.linkedin.com/jobs/view/4353495285
playrix|lead unity software engineer (gameplay)|cyprus, worldwide|https://www.linkedin.com/jobs/view/4346564468
jetbrains|founding ml engineer (spectrum)|limassol, limassol, worldwide|https://www.linkedin.com/jobs/view/4373105200
kraken|site reliability engineer - ai agents|cyprus, worldwide|https://www.linkedin.com/jobs/view/4426625454
searchapi|ai integrations engineer (open source)|cyprus, worldwide|https://www.linkedin.com/jobs/view/4432259943
workato|staff ai engineer|nicosia, nicosia, worldwide|https://www.linkedin.com/jobs/view/4426307031
exness|dataops engineer (ai platform engineer)|cyprus, limassol, worldwide|https://www.linkedin.com/jobs/view/4397229796
jetbrains|senior research engineer (code world models)|limassol, limassol, worldwide|https://www.linkedin.com/jobs/view/4427347653
revolut|lead software engineer (data)|cyprus, worldwide|https://www.linkedin.com/jobs/view/4406575607
kraken|ai agents solutions architect - hr|cyprus, worldwide|https://www.linkedin.com/jobs/view/4389385814
bairesdev|staff systems engineer (c++) - remote work  ref#289951|nicosia, nicosia, worldwide|https://www.linkedin.com/jobs/view/4420451834
miro|ai engineer|copenhagen, capital region of denmark, denmark|https://www.linkedin.com/jobs/view/4364588559
miro|staff design engineer|copenhagen, capital region of denmark, denmark|https://www.linkedin.com/jobs/view/4426837976
tether.io|machine learning systems engineer|denmark|https://www.linkedin.com/jobs/view/4420456992
unity|senior data platform engineer|copenhagen, capital region of denmark, denmark|https://www.linkedin.com/jobs/view/4429986657
the lego group|lead software engineer - game ecosystem integration|billund, region of southern denmark, denmark|https://www.linkedin.com/jobs/view/4414366258
