company|title|location|link
capgemini|embedded systems research scientist|porto, porto, portugal|https://www.linkedin.com/jobs/view/3928442138
factfinder|senior ai researcher (m/f/d)|germany|https://www.linkedin.com/jobs/view/3993289485
oil and gas job search ltd|research specialist - energy systems|bonn, north rhine-westphalia, germany|https://www.linkedin.com/jobs/view/4000661562
1dea|senior data scientist (azureml)|warsaw, mazowieckie, poland|https://www.linkedin.com/jobs/view/3970003443
liebherr group|data & ai manager (m/f/d)|ulm, baden-württemberg, germany|https://www.linkedin.com/jobs/view/3972610819
abbvie|bioassay expert / scientist s&t  (all genders)|ludwigshafen, rhineland-palatinate, germany|https://www.linkedin.com/jobs/view/4006437159
oil and gas job search ltd|research scientist - networked automation systems|västerås, västmanland county, sweden|https://www.linkedin.com/jobs/view/3999321634
tampere university|doctoral researcher (prein i-deep doctoral education pilot),|länsi-aure, pirkanmaa, finland|https://www.linkedin.com/jobs/view/4008256737
sap fioneer|partner business it solutions and business development finance (m/f/d) dach|austria|https://www.linkedin.com/jobs/view/3950168300
qiagen|senior data scientist (m/f/d)|hilden, north rhine-westphalia, germany|https://www.linkedin.com/jobs/view/4001659921
pzem|trader gas|middelburg, zeeland, netherlands|https://www.linkedin.com/jobs/view/3921389164
horváth|consultant (w/m/d) operations - schwerpunkt research & development (r&d) and product lifecycle management|düsseldorf, north rhine-westphalia, germany|https://www.linkedin.com/jobs/view/3640979189
philips|research scientist - audio video standardization|eindhoven, north brabant, netherlands|https://www.linkedin.com/jobs/view/4016514168
horváth|consultant (w/m/d) consolidation & group reporting (all levels)|munich, bavaria, germany|https://www.linkedin.com/jobs/view/3580589277
oil and gas job search ltd|senior software architect (f/m/d)|regensburg, bavaria, germany|https://www.linkedin.com/jobs/view/3968338565
quanterix|field applications scientist, sweden|sweden|https://www.linkedin.com/jobs/view/3977166112
unsw|lecturer / senior lecturer in computer science and engineering (education focussed)|delft, south holland, netherlands|https://www.linkedin.com/jobs/view/4010459900
horváth|consultant (w/m/d) consolidation & group reporting (all levels)|düsseldorf, north rhine-westphalia, germany|https://www.linkedin.com/jobs/view/3640979171
lesjeudis|field application scientist, europe|le kremlin-bicêtre, île-de-france, france|https://www.linkedin.com/jobs/view/3984959994
sioux technologies|senior applied physicist|eindhoven, north brabant, netherlands|https://www.linkedin.com/jobs/view/3831007800
fh st. pölten – university of applied sciences|junior researcher in data science for digital wellbeing m/f/d (30-40 h)|st pölten, lower austria, austria|https://www.linkedin.com/jobs/view/4009826792
microsure|senior verification engineer|son, north brabant, netherlands|https://www.linkedin.com/jobs/view/3928444647
biontech se|manager* business development / due diligence (part-time; limited for 1 year)|frankfurt rhine-main metropolitan area, worldwide|https://www.linkedin.com/jobs/view/3999508647
agilent technologies|curriculum manager (m/f/d) - spectroscopy|les ulis, île-de-france, france|https://www.linkedin.com/jobs/view/3987675628
infineon technologies|senior product development engineer (f/m/div)|warstein, north rhine-westphalia, germany|https://www.linkedin.com/jobs/view/4011393078
thermo fisher scientific|product evaluation scientist|brno, south moravia, worldwide|https://www.linkedin.com/jobs/view/3993438709
ubs|quantitative analyst, ch & int. mortgage models|cracow, małopolskie, poland|https://www.linkedin.com/jobs/view/3962874252
agilent technologies|curriculum manager (m/f/d) - spectroscopy|ruhr region, worldwide|https://www.linkedin.com/jobs/view/3987675634
unsw|lecturer / senior lecturer in computer science and engineering|barcelona, catalonia, spain|https://www.linkedin.com/jobs/view/4010465402
agilent technologies|curriculum manager (m/f/d) - spectroscopy|denmark|https://www.linkedin.com/jobs/view/3987672999
universidad del país vasco/euskal herriko unibertsitatea|? (25/8/2024) research associate on soc design for critical systems|álava, principality of asturias, spain|https://www.linkedin.com/jobs/view/4013426791
omp|ux product analyst|antwerp, flemish region, belgium|https://www.linkedin.com/jobs/view/3930462642
grifols|associate director, statistical programming|dublin, county dublin, ireland|https://www.linkedin.com/jobs/view/3972034584
dtu - technical university of denmark|phd scholarship in quantum computing for transportation applications – the quantra project – dtu management|kongens lyngby, capital region of denmark, denmark|https://www.linkedin.com/jobs/view/4005872459
waters corporation|senior director, r&d program management|wexford, county wexford, ireland|https://www.linkedin.com/jobs/view/3998754917
jll technologies|senior data scientist|madrid, community of madrid, spain|https://www.linkedin.com/jobs/view/3952541134
antler|chief data scientist & startup founder (september 2024)|luxembourg, luxembourg|https://www.linkedin.com/jobs/view/4015750135
aetion|senior scientist - real world evidence|barcelona, catalonia, spain|https://www.linkedin.com/jobs/view/3983291759
ubs|quantitative analyst, ch & int. mortgage models|wrocław, dolnośląskie, poland|https://www.linkedin.com/jobs/view/3962877046
snowflake|director of engineering – product experience (ui) team|warsaw, mazowieckie, poland|https://www.linkedin.com/jobs/view/4016047573
horváth|senior consultant (w/m/d) digital change management|hamburg, hamburg, germany|https://www.linkedin.com/jobs/view/3650071842
lesjeudis|post-doctoral research visit f/m generative ai to augment training data for network security|nancy, grand est, france|https://www.linkedin.com/jobs/view/4004462243
horváth|senior consultant (w/m/d) operations - schwerpunkt research & development (r&d) and product lifecycle management|stuttgart, baden-württemberg, germany|https://www.linkedin.com/jobs/view/3580584856
amdt|product owner (m/f/d)|germany|https://www.linkedin.com/jobs/view/3828241065
sck cen|physical chemistry researcher|mol, flemish region, belgium|https://www.linkedin.com/jobs/view/4010310804
dtu - technical university of denmark|phd in modelling, control and stability assessment of converter-rich power plants in tomorrow’s power systems - dtu wind|kongens lyngby, capital region of denmark, denmark|https://www.linkedin.com/jobs/view/3982414584
capgemini invent|senior consultant / manager (gen) ai & data scientist  ai garage (m/w/d)|hamburg, hamburg, germany|https://www.linkedin.com/jobs/view/3737654273
university of amsterdam|phd position in experimental physics: nanophotonics with 2d quantum materials|amsterdam, north holland, netherlands|https://www.linkedin.com/jobs/view/4016184749
university of amsterdam|phd in adaptive and ai-based reliability techniques for complex iot-based systems|amsterdam, north holland, netherlands|https://www.linkedin.com/jobs/view/4011495753
up.labs|ceo - stealth embedded automotive saas startup|berlin, germany|https://www.linkedin.com/jobs/view/3978224870
flatiron health|scientific advisor, real-world evidence & life science strategy|berlin, berlin, germany|https://www.linkedin.com/jobs/view/4013765336
electrolux group|simulations ecosystem expert|porcia, friuli-venezia giulia, italy|https://www.linkedin.com/jobs/view/3983409167
wuxi biologics|manufacturing systems specialist|dundalk, county louth, ireland|https://www.linkedin.com/jobs/view/4005374815
horváth|senior consultant / manager (w/m/d) pricing & commercial excellence – auch in teilzeit (80 %) möglich|frankfurt, hesse, germany|https://www.linkedin.com/jobs/view/3769597372
european investment bank (eib)|(senior) derivatives valuation officer – based in luxembourg|brussels region, belgium|https://www.linkedin.com/jobs/view/3976461668
deltaplan consulting partner|senior optical scientist (w/m/d)|überlingen, baden-württemberg, germany|https://www.linkedin.com/jobs/view/3919371288
nxp semiconductors|senior principal software security architect (m/f/d)|toulouse, occitanie, france|https://www.linkedin.com/jobs/view/4004190966
datadog|manager i, engineering - capacity management|paris, île-de-france, france|https://www.linkedin.com/jobs/view/3731018156
ibm|ibm-tcd  pre-doctoral researcher ai|mulhuddart, fingal, ireland|https://www.linkedin.com/jobs/view/4013429791
nordea|senior/quantitative risk analyst, ead models|warsaw, mazowieckie, poland|https://www.linkedin.com/jobs/view/3981458483
imec the netherlands|senior business development manager|eindhoven, north brabant, netherlands|https://www.linkedin.com/jobs/view/4008426058
technogym|tech product owner, apis|cesena, emilia-romagna, italy|https://www.linkedin.com/jobs/view/3975895019
zanders|senior manager - quantative software development|utrecht, utrecht, netherlands|https://www.linkedin.com/jobs/view/3851116219
delft university of technology|phd position value-based assessment methods for ai systems|delft, south holland, netherlands|https://www.linkedin.com/jobs/view/4012039690
oil and gas job search ltd|flow controller intern|budapest, budapest, hungary|https://www.linkedin.com/jobs/view/3978256812
european investment bank (eib)|(senior) derivatives valuation officer – based in luxembourg|dublin, county dublin, ireland|https://www.linkedin.com/jobs/view/3976461670
european investment bank (eib)|(senior) derivatives valuation officer – based in luxembourg|budapest, budapest, hungary|https://www.linkedin.com/jobs/view/3976459996
novartis|rlt drug product project lead (m/f/d)|ivrea, piedmont, italy|https://www.linkedin.com/jobs/view/3972689806
kraken digital asset exchange|sr. data scientist - compliance tech|europe|https://www.linkedin.com/jobs/view/4009806976
datadog|manager i, engineering - capacity management|madrid, community of madrid, spain|https://www.linkedin.com/jobs/view/3731015683
ey|digital factory - senior product owner|luxembourg, luxembourg, luxembourg|https://www.linkedin.com/jobs/view/3977320851
thermo fisher scientific|associate clinical science development director, emea|portugal|https://www.linkedin.com/jobs/view/4007469632
royal college of surgeons in ireland (rcsi)|translational electrophysiology core manager|dublin, county dublin, ireland|https://www.linkedin.com/jobs/view/4007535940
thermo fisher scientific|compute system manager & cryo-em application specialist|eindhoven, north brabant, netherlands|https://www.linkedin.com/jobs/view/3993247030
oniq|senior manager strategy & business development (f/m/d)|cologne bonn region, worldwide|https://www.linkedin.com/jobs/view/4000455897
thermo fisher scientific|electrical engineering team manager|brno, south moravia, worldwide|https://www.linkedin.com/jobs/view/4007667236
hilti nederland bv|global management traineeship – outperfomer program|nederland, overijssel, netherlands|https://www.linkedin.com/jobs/view/3944092942
university of twente|phd position in ic design group|enschede, overijssel, netherlands|https://www.linkedin.com/jobs/view/3785837167
university of oulu|phd in 3 years: doctoral researcher in human-ai collaboration and self-regulated learning research, let lab, faculty of education and psychology|oulu, north ostrobothnia, finland|https://www.linkedin.com/jobs/view/4006238552
technogym|tech product owner, formats|cesena, emilia-romagna, italy|https://www.linkedin.com/jobs/view/3975892353
oil and gas job search ltd|geophysics r&d project leader m/f|la celle-sous-gouzon, nouvelle-aquitaine, france|https://www.linkedin.com/jobs/view/3934823203
meta|research engineer - brain & ai|paris, île-de-france, france|https://www.linkedin.com/jobs/view/3953547719
quandela|quantum optics engineer - fabrication of single-photon sources|palaiseau, île-de-france, france|https://www.linkedin.com/jobs/view/3978440255
synopsys inc|r&d engineer - c++ developer|montbonnot-saint-martin, auvergne-rhône-alpes, france|https://www.linkedin.com/jobs/view/4005832214
université gustave eiffel|post doc dans le cadre du projet ademe-france 2030  “remed rga” retrait-gonflement des argiles|champs-sur-marne, île-de-france, france|https://www.linkedin.com/jobs/view/4009385628
artefact|research scientist - large language models with industrial use-cases|paris, île-de-france, france|https://www.linkedin.com/jobs/view/3966712948
cma cgm|data scientist - operations research|marseille, provence-alpes-côte d'azur, france|https://www.linkedin.com/jobs/view/4013423886
the exploration company|future projects thermal analysis engineer|bordeaux, nouvelle-aquitaine, france|https://www.linkedin.com/jobs/view/4014008169
datadog|software engineer - distributed systems|nantes, pays de la loire, france|https://www.linkedin.com/jobs/view/3705379671
datadog|senior software engineer - datastores|nantes, pays de la loire, france|https://www.linkedin.com/jobs/view/3965447303
jobs via efinancialcareers|validation engineer|paris, île-de-france, france|https://www.linkedin.com/jobs/view/4006278469
oil and gas job search ltd|ingénieur innovation & process design wastewater - h/f|courbevoie, île-de-france, france|https://www.linkedin.com/jobs/view/3973353505
lesjeudis|senior software engineer|paris, île-de-france, france|https://www.linkedin.com/jobs/view/3993097948
hid|engineer contractor|suresnes, île-de-france, france|https://www.linkedin.com/jobs/view/4012001749
datadog|staff data scientist - data scientist|paris, île-de-france, france|https://www.linkedin.com/jobs/view/3765154267
datadog|software engineer - distributed systems|bordeaux, nouvelle-aquitaine, france|https://www.linkedin.com/jobs/view/3705378677
datadog|senior software engineer - foundationdb|paris, île-de-france, france|https://www.linkedin.com/jobs/view/3964927125
datadog|software engineer - historical metrics query|lyon, auvergne-rhône-alpes, france|https://www.linkedin.com/jobs/view/3746215180
datadog|senior software engineer - high performance transaction systems|paris, île-de-france, france|https://www.linkedin.com/jobs/view/3964920917
flowie|senior data engineer|france|https://www.linkedin.com/jobs/view/4010688340
datadog|library software engineer - go (emea)|paris, île-de-france, france|https://www.linkedin.com/jobs/view/3967139467
the exploration company|flight safety certification senior engineer|bordeaux, nouvelle-aquitaine, france|https://www.linkedin.com/jobs/view/3986506487
datadog|library software engineer - go (emea)|montpellier, occitanie, france|https://www.linkedin.com/jobs/view/3967143121
lesjeudis|senior data scientist|paris, île-de-france, france|https://www.linkedin.com/jobs/view/3984963266
datadog|senior software engineer - cloud security platform|sophia antipolis, provence-alpes-côte d'azur, france|https://www.linkedin.com/jobs/view/3540969411
lesjeudis|postdoctoral of ultra-low power spectrum sensing optimization based on machine learning - cdd 12 months|palaiseau, île-de-france, france|https://www.linkedin.com/jobs/view/3986033603
spacex|summer 2025 software engineering internship/co-op|any-martin-rieux, hauts-de-france, france|https://www.linkedin.com/jobs/view/4017125449
manomano|[internship] data scientist [w/m/n]|paris, île-de-france, france|https://www.linkedin.com/jobs/view/4007348664
quandela|internship: fabrication and optimization of quantum light sources|palaiseau, île-de-france, france|https://www.linkedin.com/jobs/view/3941675903
cesi|chercheur doctorant h/f|saint-étienne-du-rouvray, normandy, france|https://www.linkedin.com/jobs/view/3979958871
jobs via efinancialcareers|2025 quantitative finance off-cycle internship (paris)|paris, île-de-france, france|https://www.linkedin.com/jobs/view/4014750875
empfehlungsbund jobs|senior data scientist (gn) advisory/presales|munich, bavaria, germany|https://www.linkedin.com/jobs/view/4015168510
sima.ai|principal automotive sw architect (ai2336)|stuttgart, baden-württemberg, germany|https://www.linkedin.com/jobs/view/4011955859
sap|(senior) developer (f/m/d) - custom specific business ai solutions cis (former ibso)|garching, bavaria, germany|https://www.linkedin.com/jobs/view/4011654131
capgemini|(senior-) business analyst für telekommunikation (w/m/d)|cologne, north rhine-westphalia, germany|https://www.linkedin.com/jobs/view/4011975563
agoda|senior quantitative user experience researcher (frontend) (bangkok-based, relocation provided)|munich, bavaria, germany|https://www.linkedin.com/jobs/view/3742044789
universal quantum|quantum hardware engineer (m/f/d)|hamburg, hamburg, germany|https://www.linkedin.com/jobs/view/3849700985
barkhausen institut|software-defined-radio and testbed engineer (m/f/d)|dresden, saxony, germany|https://www.linkedin.com/jobs/view/3704365777
helsing|ai research engineer - automation and control|munich, bavaria, germany|https://www.linkedin.com/jobs/view/4011603924
unsw|quantum applications scientist|berlin, berlin, germany|https://www.linkedin.com/jobs/view/4014320180
fraunhofer ipm|data-scientist / ki-expert*in für 3d-lidar-multisensor-daten|freiburg, baden-württemberg, germany|https://www.linkedin.com/jobs/view/3989092328
hottgenroth gruppe|data scientist (m/w/d)|cologne, north rhine-westphalia, germany|https://www.linkedin.com/jobs/view/3907362280
novel - accurate force & pressure sensors|electronical engineer  (master degree required for a required phd enrolement) and software developer|munich, bavaria, germany|https://www.linkedin.com/jobs/view/3812329057
allianz in deutschland|junior aktuar / data scientist für das pricing aktuariat (m/w/d)|unterföhring, bavaria, germany|https://www.linkedin.com/jobs/view/3746216975
universitätsklinikum münster|phd student (gn) analytical chemistry, molecular biology, biophysics|münster, north rhine-westphalia, germany|https://www.linkedin.com/jobs/view/4004320068
s[&]t|senior afm developer|rotterdam, south holland, netherlands|https://www.linkedin.com/jobs/view/4009263594
radboud university|phd position: role of user feedback and introspection mechanisms in the context of neurotechnological systems|nijmegen, gelderland, netherlands|https://www.linkedin.com/jobs/view/4012928970
utrecht university|combined phd - lecturer position in research mediatisation in transitions|utrecht, utrecht, netherlands|https://www.linkedin.com/jobs/view/3986686895
mca nederland|embedded software engineer|eindhoven area, worldwide|https://www.linkedin.com/jobs/view/4009740604
inpact|data scientist|veenendaal, utrecht, netherlands|https://www.linkedin.com/jobs/view/3811598636
nordea|senior/quantitative risk analyst, ead models|gdańsk, pomorskie, poland|https://www.linkedin.com/jobs/view/3981460224
capgemini invent|data scientist|warsaw, mazowieckie, poland|https://www.linkedin.com/jobs/view/4002991078
elavon europe|data scientist (credit risk team)|warsaw, mazowieckie, poland|https://www.linkedin.com/jobs/view/4010258701
visa|senior consultant software engineer|warsaw, mazowieckie, poland|https://www.linkedin.com/jobs/view/3971249668
visa|lead software engineer|warsaw, mazowieckie, poland|https://www.linkedin.com/jobs/view/4000531155
boeing|full stack software developer - boeing defense & space (associate, experienced, senior or lead)|gdansk metropolitan area, worldwide|https://www.linkedin.com/jobs/view/4012042450
sii poland|data scientist|warsaw, mazowieckie, poland|https://www.linkedin.com/jobs/view/3980347062
jobs via efinancialcareers|quantitative analyst, ch & int. mortgage models|cracow, małopolskie, poland|https://www.linkedin.com/jobs/view/3998407276
synopsys inc|senior analog design methodology engineer|porto, porto, portugal|https://www.linkedin.com/jobs/view/3880799486
wayup|public notice for direct hire (data modernization) - computer scientist|los angeles, canada|https://www.linkedin.com/jobs/view/3933282755
fabric cryptography|digital design verification consultant|los angeles, canada|https://www.linkedin.com/jobs/view/4013765342
samsung electronics america|machine learning model engineer|los angeles metropolitan area, worldwide|https://www.linkedin.com/jobs/view/3952439613
doordash|software engineer, backend (all teams)|los angeles, canada|https://www.linkedin.com/jobs/view/3999826223
summithr|0_it_software engineer - frontend|los angeles, canada|https://www.linkedin.com/jobs/view/3887970230
arcfield|system test & verification engineer|los angeles, canada|https://www.linkedin.com/jobs/view/4008714633
doodle labs|rf engineer|los angeles, canada|https://www.linkedin.com/jobs/view/3927714119
actalent|linguist|bell gardens, canada|https://www.linkedin.com/jobs/view/4015174448
fabric cryptography|principal design verification engineer (contract)|los angeles, canada|https://www.linkedin.com/jobs/view/4012983224
evident scientific|sales associate - microscopy|los angeles, canada|https://www.linkedin.com/jobs/view/3841311742
clearancejobs|principal software engineer, senior with security clearance|los angeles, canada|https://www.linkedin.com/jobs/view/4010452661
unsw|quantum applications scientist|glasgow, scotland, united kingdom|https://www.linkedin.com/jobs/view/4014319227
agricarbon|senior soil carbon scientist|united kingdom|https://www.linkedin.com/jobs/view/4017454214
newcastle university|research associate: sonic intangibles|newcastle, england, united kingdom|https://www.linkedin.com/jobs/view/3979163488
energy jobline|senior scientist - (yeast technical expert)|bracknell, england, united kingdom|https://www.linkedin.com/jobs/view/4014765926
diamond light source|beamline scientist/senior beamline scientist - i07 surface diffraction beamline|oxfordshire, england, united kingdom|https://www.linkedin.com/jobs/view/4014327294
thermo fisher scientific|research associate iii evidera|united kingdom|https://www.linkedin.com/jobs/view/4016657400
nxp semiconductors|senior principal software security architect (m/f/d)|glasgow, scotland, united kingdom|https://www.linkedin.com/jobs/view/4004510809
certara|senior scientist qsp|sheffield, england, united kingdom|https://www.linkedin.com/jobs/view/3969094729
labcorp|lcms method development scientist|harrogate, england, united kingdom|https://www.linkedin.com/jobs/view/3948400509
capco|senior data scientist - financial services|greater london, england, united kingdom|https://www.linkedin.com/jobs/view/3922180788
johnson & johnson|data transparency document anonymization director|high wycombe, england, united kingdom|https://www.linkedin.com/jobs/view/3988088234
clickjobs.io|communication system architect|birmingham, england, united kingdom|https://www.linkedin.com/jobs/view/4008324153
unsw|director, x-ray facility|manchester, england, united kingdom|https://www.linkedin.com/jobs/view/4010458379
citi|counterparty credit risk senior developer, vice president|london, england, united kingdom|https://www.linkedin.com/jobs/view/4012323034
zerorisc|software engineer (swe) role|cambridge, england, united kingdom|https://www.linkedin.com/jobs/view/3925958357
oracle|applied scientist|england, united kingdom|https://www.linkedin.com/jobs/view/4012676059
sprout.ai|data scientist|london, england, united kingdom|https://www.linkedin.com/jobs/view/3930467639
google deepmind|research scientists at google deepmind|london, england, united kingdom|https://www.linkedin.com/jobs/view/3550371173
burns sheehan|data scientist|london area, united kingdom|https://www.linkedin.com/jobs/view/3999734017
alexander rhodes associates ltd|data scientist|wales, united kingdom|https://www.linkedin.com/jobs/view/4013695836
quantinuum|research scientist qnlp/ml|oxford, england, united kingdom|https://www.linkedin.com/jobs/view/3841168554
oxa|senior software engineer (safety path)|oxford, england, united kingdom|https://www.linkedin.com/jobs/view/3764799204
starling bank|machine learning scientist (fincrime)|london, england, united kingdom|https://www.linkedin.com/jobs/view/4017403986
slingshot ai|research scientist (machine learning)|london, england, united kingdom|https://www.linkedin.com/jobs/view/3988112211
oho group ltd|software engineer|london area, united kingdom|https://www.linkedin.com/jobs/view/4005047670
mpb|data scientist|brighton, england, united kingdom|https://www.linkedin.com/jobs/view/3953032918
gsk|data engineer i|london, england, united kingdom|https://www.linkedin.com/jobs/view/4012930221
energy jobline|data scientist ai engineer|london, england, united kingdom|https://www.linkedin.com/jobs/view/4015714309
european bioinformatics institute  embl-ebi|bioinformatician|england, united kingdom|https://www.linkedin.com/jobs/view/4006852372
mizuho|career opportunities: director - lead ml engineer (2534)|london area, united kingdom|https://www.linkedin.com/jobs/view/3997763141
graphics unlimited (vic) pty ltd|associate data scientist|birmingham, england, united kingdom|https://www.linkedin.com/jobs/view/4014002791
gordon murray group|senior cae engineer|shalford, england, united kingdom|https://www.linkedin.com/jobs/view/3921696302
graphics unlimited (vic) pty ltd|associate data scientist|london, england, united kingdom|https://www.linkedin.com/jobs/view/4014001944
faculty|mechatronics engineer|london area, united kingdom|https://www.linkedin.com/jobs/view/4014328503
builder.ai|data scientist|london area, united kingdom|https://www.linkedin.com/jobs/view/3977759209
unsw|quantum applications scientist|sheffield, england, united kingdom|https://www.linkedin.com/jobs/view/4014315755
ansys|industrial post doc - materials science - 2 year ftc|england, united kingdom|https://www.linkedin.com/jobs/view/4012614861
newcastle university|research assistant/associate (health services research)|newcastle, england, united kingdom|https://www.linkedin.com/jobs/view/3972890659
holt executive ltd|senior computer vision engineer|oxford, england, united kingdom|https://www.linkedin.com/jobs/view/4006133699
