company|title|location|link
apple|aiml - senior ml/rl training infrastructure engineer, afm|zurich, zurich, switzerland|https://www.linkedin.com/jobs/view/4414170160
apple|ai research scientist - multimodal intelligence|zurich, zurich, switzerland|https://www.linkedin.com/jobs/view/4414154744
apple|aiml - machine learning research engineer, generative ai - afm|zurich, zurich, switzerland|https://www.linkedin.com/jobs/view/4414162533
apple|aiml - senior machine learning research scientist, afm|zurich, zurich, switzerland|https://www.linkedin.com/jobs/view/4414165477
apple|senior machine learning engineer in human-centric computer vision|zurich, zurich, switzerland|https://www.linkedin.com/jobs/view/4427792091
apple|applied machine learning engineer - security|zurich, zurich, switzerland|https://www.linkedin.com/jobs/view/4414167390
apple|aiml - research scientist, health|zurich, zurich, switzerland|https://www.linkedin.com/jobs/view/4417524508
nvidia|senior software architect, gpu networking research|zurich, zurich, switzerland|https://www.linkedin.com/jobs/view/4424000359
nvidia|senior hpc and ai network software architect|zurich, zurich, switzerland|https://www.linkedin.com/jobs/view/4395922294
google|software engineer iii, xr world context|zurich, zurich, switzerland|https://www.linkedin.com/jobs/view/4430561130
google|engineer iii, ai/ml, online calibration, xr|zurich, zurich, switzerland|https://www.linkedin.com/jobs/view/4427497710
google|software engineer iii, 3d modelling, xr|zurich, zurich, switzerland|https://www.linkedin.com/jobs/view/4426116013
nvidia|senior compiler engineer|zurich, zurich, switzerland|https://www.linkedin.com/jobs/view/4427243069
nvidia|senior compiler engineer|zurich, zurich, switzerland|https://www.linkedin.com/jobs/view/4395484286
google|software engineer iii, database systems|zurich, zurich, switzerland|https://www.linkedin.com/jobs/view/4422038383
google|software engineer iii, ai/ml, sensor fusion, xr|zurich, zurich, switzerland|https://www.linkedin.com/jobs/view/4430547982
google|software engineer iii, infrastructure|zurich, zurich, switzerland|https://www.linkedin.com/jobs/view/4418808887
google|software engineer iii, ml pipeline development, xr|zurich, zurich, switzerland|https://www.linkedin.com/jobs/view/4426114066
avl in türkiye research and engineering|international outstanding and early-stage researchers program|greater istanbul, worldwide|https://www.linkedin.com/jobs/view/4424236145
apple|product marketing manager, ipad & mac|greater istanbul, worldwide|https://www.linkedin.com/jobs/view/4423407117
apple|enterprise account executive, major accounts|greater istanbul, worldwide|https://www.linkedin.com/jobs/view/4414153643
apple|tr-manager|greater istanbul, worldwide|https://www.linkedin.com/jobs/view/4414171060
apple|apple channel store advisor, cevahir|greater istanbul, worldwide|https://www.linkedin.com/jobs/view/4432250622
apple|business development and affordability manager - turkiye|greater istanbul, worldwide|https://www.linkedin.com/jobs/view/4414162363
apple|tr - store leader - istanbul metro market|greater istanbul, worldwide|https://www.linkedin.com/jobs/view/4414157554
beko corporate|researcher (r&d)|greater istanbul, worldwide|https://www.linkedin.com/jobs/view/4426968148
adesso turkey|researcher|türkiye, worldwide|https://www.linkedin.com/jobs/view/4421671389
apple|carrier account manager - turkiye|greater istanbul, worldwide|https://www.linkedin.com/jobs/view/4428778337
commit|ai/ml research scientist|kyiv, kyiv city, ukraine|https://www.linkedin.com/jobs/view/4432818641
partyhat|game mathematician|ukraine|https://www.linkedin.com/jobs/view/4429431299
apple|performance architect– platform architecture|london, england, united kingdom|https://www.linkedin.com/jobs/view/4419066186
apple|system software engineer|cambridge, england, united kingdom|https://www.linkedin.com/jobs/view/4423405123
apple|graphics architect|london, england, united kingdom|https://www.linkedin.com/jobs/view/4414173037
apple|performance modelling engineer|cambridge, england, united kingdom|https://www.linkedin.com/jobs/view/4414164447
apple|virtualisation engineer, coreos|london, england, united kingdom|https://www.linkedin.com/jobs/view/4414157719
apple|aiml - research lead (machine learning), mlr|cambridge, england, united kingdom|https://www.linkedin.com/jobs/view/4414152829
apple|gpu architect - platform architecture|london, england, united kingdom|https://www.linkedin.com/jobs/view/4414174013
apple|marcom creative technologist|london, england, united kingdom|https://www.linkedin.com/jobs/view/4414152820
apple|machine learning researcher - apple music - recommender systems|london, england, united kingdom|https://www.linkedin.com/jobs/view/4422531986
apple|ml software engineer, london|london, england, united kingdom|https://www.linkedin.com/jobs/view/4414171025
apple|software engineer, apple cloud object store|london, england, united kingdom|https://www.linkedin.com/jobs/view/4414174016
apple|gpu design verification engineer|london, england, united kingdom|https://www.linkedin.com/jobs/view/4414163512
apple|sr. software engineer - siri agentic evaluation platform|cambridge, england, united kingdom|https://www.linkedin.com/jobs/view/4424635509
apple|applied machine learning engineer - developer publications|london, england, united kingdom|https://www.linkedin.com/jobs/view/4414165439
apple|site reliability engineer (sre), london|london, england, united kingdom|https://www.linkedin.com/jobs/view/4429099738
apple|senior software engineer, photos ui, camera & photos|cambridge, england, united kingdom|https://www.linkedin.com/jobs/view/4414167407
apple|cad physical design engineer|cambridge, england, united kingdom|https://www.linkedin.com/jobs/view/4426053199
apple|site reliability engineer, icloud|london, england, united kingdom|https://www.linkedin.com/jobs/view/4418876267
apple|principal machine learning engineer, ai & data platforms (aidp)|london, england, united kingdom|https://www.linkedin.com/jobs/view/4414167405
apple|data architect, emeia sales|london, england, united kingdom|https://www.linkedin.com/jobs/view/4424283300
systematic|research architect|aarhus, central denmark region, denmark|https://www.linkedin.com/jobs/view/4419154641
n8n|senior/staff engineer, n8n labs|denmark|https://www.linkedin.com/jobs/view/4413728222
uber|software engineer - denmark pool|aarhus, central denmark region, denmark|https://www.linkedin.com/jobs/view/4418903028
uber|senior software engineer (storage platform)|aarhus, central denmark region, denmark|https://www.linkedin.com/jobs/view/4369285854
trackman|signal processing developer – new sports (c++/python)|aarhus, central denmark region, denmark|https://www.linkedin.com/jobs/view/4410039008
kapa.ai|research engineer, applied ai|denmark|https://www.linkedin.com/jobs/view/4231618942
plum|ios engineer|athens, attiki, greece|https://www.linkedin.com/jobs/view/4366774459
king|senior tools developer|barcelona, catalonia, spain|https://www.linkedin.com/jobs/view/4410048909
apple|software engineering - audio & music apps - m/f/d|berlin, berlin, germany|https://www.linkedin.com/jobs/view/4414171041
microsoft|ai for science residency - machine learning resident|berlin, berlin, germany|https://www.linkedin.com/jobs/view/4422953074
amazon|applied scientist, amazon robotics|berlin, germany|https://www.linkedin.com/jobs/view/4413751706
amazon web services (aws)|principal engineer, ec2|berlin, germany|https://www.linkedin.com/jobs/view/4269252301
amazon science|applied scientist, amazon robotics|berlin, berlin, germany|https://www.linkedin.com/jobs/view/4417982299
nvidia|principal ai developer technology engineer|berlin, berlin, germany|https://www.linkedin.com/jobs/view/4395468903
amazon|applied scientist, amazon robotics r&d|berlin, germany|https://www.linkedin.com/jobs/view/4420467746
amazon|sr. applied scientist, amazon robotics|berlin, germany|https://www.linkedin.com/jobs/view/4425925849
amazon web services (aws)|principal software engineer|berlin, germany|https://www.linkedin.com/jobs/view/4359625574
audible|applied scientist|berlin, germany|https://www.linkedin.com/jobs/view/4429740416
google|software engineer iii, android system ui|bucharest, bucharest, romania|https://www.linkedin.com/jobs/view/4425297679
rokoko|senior engineer|copenhagen, capital region of denmark, denmark|https://www.linkedin.com/jobs/view/4429220905
alipes aps|machine learning researcher|copenhagen, capital region of denmark, denmark|https://www.linkedin.com/jobs/view/4401909832
microsoft|principal technical program manager (quantum manufacturing)|kongens lyngby, capital region of denmark, denmark|https://www.linkedin.com/jobs/view/4431316252
inreality|founding engineer|copenhagen, capital region of denmark, denmark|https://www.linkedin.com/jobs/view/4427072465
nil technology|computational imaging expert|kongens lyngby, capital region of denmark, denmark|https://www.linkedin.com/jobs/view/4421102762
apple|web services engineer - localisation & release engineering|cork, county cork, ireland|https://www.linkedin.com/jobs/view/4414152811
apple|full stack development engineer - operations rad bi - 18 month contract|cork, county cork, ireland|https://www.linkedin.com/jobs/view/4418803077
apple|software engineer (data apps + frontend), ai & data platforms|cork, county cork, ireland|https://www.linkedin.com/jobs/view/4414166441
apple|hardware test engineer - product operations|cork, county cork, ireland|https://www.linkedin.com/jobs/view/4415747038
apple|partner solutions specialist emeia - cork|cork, county cork, ireland|https://www.linkedin.com/jobs/view/4414164453
hitachi energy|software engineering researcher|cracow metropolitan area, worldwide|https://www.linkedin.com/jobs/view/4427912303
google|software engineer iii, compute infrastructure, control simulations|cracow, małopolskie, poland|https://www.linkedin.com/jobs/view/4426610163
hitachi energy|industrial research engineer for parallel/high-performance computing (cpus/gpus)|cracow metropolitan area, worldwide|https://www.linkedin.com/jobs/view/4427901367
google|mobile technical lead, rcs for business|cracow, małopolskie, poland|https://www.linkedin.com/jobs/view/4424241718
google|senior research data scientist, android tablets|cracow, małopolskie, poland|https://www.linkedin.com/jobs/view/4399624420
google|staff forward deployed engineer, genai, google cloud|cracow, małopolskie, poland|https://www.linkedin.com/jobs/view/4427777142
cisco|security research engineering technical leader|cracow, małopolskie, poland|https://www.linkedin.com/jobs/view/4418967265
pepsico|software eng assoc manager|cracow, małopolskie, poland|https://www.linkedin.com/jobs/view/4410198069
vrije universiteit amsterdam (vu amsterdam)|full professor in computer systems|amsterdam, north holland, netherlands|https://www.linkedin.com/jobs/view/4419471038
utrecht university|postdoc position in cloud and edge systems|utrecht, utrecht, netherlands|https://www.linkedin.com/jobs/view/4427384190
drift|software architect|amsterdam, north holland, netherlands|https://www.linkedin.com/jobs/view/4431499160
ibm|research scientist – quantum algorithms for differential equations|dublin, county dublin, ireland|https://www.linkedin.com/jobs/view/4423131858
apple|experienced ams analog layout engineer|dublin, county dublin, ireland|https://www.linkedin.com/jobs/view/4422064661
apple|senior full stack engineer - services technology|dublin, county dublin, ireland|https://www.linkedin.com/jobs/view/4414163504
huawei ireland research center|2026 - principal personalization and recommendation researcher - permanent|dublin, county dublin, ireland|https://www.linkedin.com/jobs/view/4414160712
huawei ireland research center|2026 - senior r&d engineer - graphics reverse engineering & optimization - permanent|dublin, county dublin, ireland|https://www.linkedin.com/jobs/view/4404701133
huawei technologies research & development (uk) ltd|systems research engineer|edinburgh, scotland, united kingdom|https://www.linkedin.com/jobs/view/4354782468
huawei technologies research & development (uk) ltd|data infrastructure and ai engineer|edinburgh, scotland, united kingdom|https://www.linkedin.com/jobs/view/4429697886
synopsys inc|staff engineer (r&d engineering)|glasgow, scotland, united kingdom|https://www.linkedin.com/jobs/view/4394682160
amazon|applied scientist, intelligent talent acquisition - lead generation & detection services|edinburgh, scotland, united kingdom|https://www.linkedin.com/jobs/view/4410206341
amazon|applied scientist, intelligent talent acquisition - lead generation & detection services|edinburgh, scotland, united kingdom|https://www.linkedin.com/jobs/view/4429723864
european tech recruit|systems research engineer|edinburgh, scotland, united kingdom|https://www.linkedin.com/jobs/view/4429548417
jpmorganchase|applied ai lead|glasgow, scotland, united kingdom|https://www.linkedin.com/jobs/view/4407586493
european tech recruit|systems research engineer|edinburgh, scotland, united kingdom|https://www.linkedin.com/jobs/view/4427022883
amazon science|applied scientist, intelligent talent acquisition - lead generation & detection services|greater edinburgh area, worldwide|https://www.linkedin.com/jobs/view/4411991028
amazon science|applied scientist, intelligent talent acquisition - lead generation & detection services|greater edinburgh area, worldwide|https://www.linkedin.com/jobs/view/4427801220
apple|de-business expert (m/f/d)|sulzbach, hesse, germany|https://www.linkedin.com/jobs/view/4430842621
goethe university frankfurt|research associate (postdoc) (m/f/d)|frankfurt, hesse, germany|https://www.linkedin.com/jobs/view/4429932249
nvidia ai|applied ai researcher - world reconstruction and generation|ludwigshafen, rhineland-palatinate, germany|https://www.linkedin.com/jobs/view/4421505926
apple|de-business expert (m/w/x)|sulzbach, hesse, germany|https://www.linkedin.com/jobs/view/4430827602
goethe university frankfurt|research associate (m/f/d)|frankfurt, hesse, germany|https://www.linkedin.com/jobs/view/4429922306
aleph alpha|senior ai researcher- pre-training (f/m/d)|heidelberg, baden-württemberg, germany|https://www.linkedin.com/jobs/view/4405291067
apple|de-specialist (m/w/x)|sulzbach, hesse, germany|https://www.linkedin.com/jobs/view/4414149885
infineon technologies|principal engineer system compute (f/m/div)|frankfurt, hesse, germany|https://www.linkedin.com/jobs/view/4405235415
aerovect|staff platform engineer|frankfurt, hesse, germany|https://www.linkedin.com/jobs/view/4404912338
aleph alpha|senior ai researcher- reinforcement learning (f/m/d)|heidelberg, baden-württemberg, germany|https://www.linkedin.com/jobs/view/4380303870
proton|r+d engineer|geneva, geneva, switzerland|https://www.linkedin.com/jobs/view/4392956713
cern|software engineer - high-performance computing (ep-sft-2026-137-ld)|geneva, geneva, switzerland|https://www.linkedin.com/jobs/view/4428240433
logitech|machine learning training infrastructure engineer|lausanne, vaud, switzerland|https://www.linkedin.com/jobs/view/4422369512
apple|ch-technical specialist (m/w/x)|geneva, geneva, switzerland|https://www.linkedin.com/jobs/view/4414455675
cern|gpu & ml developer for reconstruction and simulation (ep-ali-sc-2026-106-grap)|geneva, geneva, switzerland|https://www.linkedin.com/jobs/view/4430395921
proton|senior r&d engineer|geneva, geneva, switzerland|https://www.linkedin.com/jobs/view/4342309775
apple|ch-technical specialist (m/f/d)|geneva, geneva, switzerland|https://www.linkedin.com/jobs/view/4414452728
cern|software engineer - software reliability (te-mpe-cb-2026-93-grap)|geneva, geneva, switzerland|https://www.linkedin.com/jobs/view/4430379997
epfl|research software engineer|lausanne metropolitan area, worldwide|https://www.linkedin.com/jobs/view/4423997165
nvidia|developer relations manager, retail & media entertainment|gothenburg, västra götaland county, sweden|https://www.linkedin.com/jobs/view/4395473406
coretura|is coretura your next adventure?|gothenburg, västra götaland county, sweden|https://www.linkedin.com/jobs/view/4357403581
opera|ios developer|gothenburg, västra götaland county, sweden|https://www.linkedin.com/jobs/view/4424565081
chalmers university of technology|assistant/associate professor in quantum technologies|gothenburg, västra götaland county, sweden|https://www.linkedin.com/jobs/view/4425868366
chalmers university of technology|two postdocs in programming languages|gothenburg, västra götaland county, sweden|https://www.linkedin.com/jobs/view/4430445251
chalmers university of technology|project assistant in high performance computing|gothenburg, västra götaland county, sweden|https://www.linkedin.com/jobs/view/4428083013
university of gothenburg|två forskare|gothenburg, västra götaland county, sweden|https://www.linkedin.com/jobs/view/4425308616
cerve|founding software engineer|gothenburg, västra götaland county, sweden|https://www.linkedin.com/jobs/view/4402506267
chalmers university of technology|doctoral student in human-in-the-loop autonomous systems|gothenburg, västra götaland county, sweden|https://www.linkedin.com/jobs/view/4426993109
apple|software engineering - audio & music apps - m/f/d|hamburg, hamburg, germany|https://www.linkedin.com/jobs/view/4414154713
apple|software engineering - audio & music apps - m/f/d|rellingen, schleswig-holstein, germany|https://www.linkedin.com/jobs/view/4414156773
nvidia|senior software architect - deep learning and hpc communications|hamburg, hamburg, germany|https://www.linkedin.com/jobs/view/4395473620
nvidia|senior hpc performance engineer|hamburg, hamburg, germany|https://www.linkedin.com/jobs/view/4413846255
nvidia|senior software engineer, ai inference systems|hamburg, hamburg, germany|https://www.linkedin.com/jobs/view/4407985132
nvidia|applied ai researcher - world reconstruction and generation|hamburg, hamburg, germany|https://www.linkedin.com/jobs/view/4424639363
nvidia|senior hpc performance engineer|hamburg, hamburg, germany|https://www.linkedin.com/jobs/view/4402755734
nvidia|security research architect|hamburg, hamburg, germany|https://www.linkedin.com/jobs/view/4409716931
nvidia|senior research scientist|hamburg, hamburg, germany|https://www.linkedin.com/jobs/view/4424005336
volkswagen group|phd student ai methods powertrain (f/m/d)|wolfsburg, lower saxony, germany|https://www.linkedin.com/jobs/view/4409788881
volkswagen group|phd student development ai‑native development models & virtual ai agents (f/m/d)|wolfsburg, lower saxony, germany|https://www.linkedin.com/jobs/view/4429675862
volkswagen group|phd student ai-based graphrag parking functions (f/m/d)|wolfsburg, lower saxony, germany|https://www.linkedin.com/jobs/view/4424555313
volkswagen group|phd student - ai ai electrical systems planning (f/m/d)|wolfsburg, lower saxony, germany|https://www.linkedin.com/jobs/view/4429691686
volkswagen algérie|phd student ai methods powertrain (f/m/d)|wolfsburg, lower saxony, germany|https://www.linkedin.com/jobs/view/4409784880
volkswagen group|doktorandin / doktorand ki-methoden antriebsstrang (w/m/d)|wolfsburg, lower saxony, germany|https://www.linkedin.com/jobs/view/4409786934
volkswagen group|doktorandin / doktorand ki-basierte graphrag parkfunktionen (w/m/d)|wolfsburg, lower saxony, germany|https://www.linkedin.com/jobs/view/4424561267
volkswagen group|doktorandin / doktorand entwicklung ai‑native entwicklungsmodelle & virtuelle ki‑agenten (w/m/d)|wolfsburg, lower saxony, germany|https://www.linkedin.com/jobs/view/4429693476
volkswagen group|phd student industrial cybersecurity (f/m/d)|wolfsburg, lower saxony, germany|https://www.linkedin.com/jobs/view/4411707766
volkswagen algérie|phd student development ai‑native development models & virtual ai agents (f/m/d)|wolfsburg, lower saxony, germany|https://www.linkedin.com/jobs/view/4431151551
air apps|software architect - mobile|helsinki, uusimaa, finland|https://www.linkedin.com/jobs/view/4428241471
nokia|senior research/standardization specialist|espoo, uusimaa, finland|https://www.linkedin.com/jobs/view/4418746311
nokia|senior staff research/standardization specialist|espoo, uusimaa, finland|https://www.linkedin.com/jobs/view/4418761521
aalto university|several postdoctoral researcher and 1-2 doctoral researcher positions in machine learning in kaski lab, ellis institute finland and manchester centre for ai fundamentals|espoo, uusimaa, finland|https://www.linkedin.com/jobs/view/4421715201
supercell|senior engine programmer|helsinki, uusimaa, finland|https://www.linkedin.com/jobs/view/4407783921
apple|small business lead, turkey|greater istanbul, worldwide|https://www.linkedin.com/jobs/view/4414166266
michelin|technical product leader (f/h) (lyon)|lyon, auvergne-rhône-alpes, france|https://www.linkedin.com/jobs/view/4414627842
ansys|r&d engineering, staff engineer (f/m)|villeurbanne, auvergne-rhône-alpes, france|https://www.linkedin.com/jobs/view/4416154203
ansys|r&d engineering, staff engineer f/m|villeurbanne, auvergne-rhône-alpes, france|https://www.linkedin.com/jobs/view/4422443204
volvo group|senior cybersecurity researcher - ai security|vénissieux, auvergne-rhône-alpes, france|https://www.linkedin.com/jobs/view/4431731361
alstom|software architect_(m/f)|villeurbanne, auvergne-rhône-alpes, france|https://www.linkedin.com/jobs/view/4375258173
alstom|software architect (h/f)|villeurbanne, auvergne-rhône-alpes, france|https://www.linkedin.com/jobs/view/4406062793
alan|fullstack software engineer (x/f/m) - global architecture|la roche-vineuse, bourgogne-franche-comté, france|https://www.linkedin.com/jobs/view/4366148784
alstom|architect logiciel (f/h)|villeurbanne, auvergne-rhône-alpes, france|https://www.linkedin.com/jobs/view/4416858462
alan|fullstack software engineer (x/f/m) - global architecture|greater lyon area, worldwide|https://www.linkedin.com/jobs/view/4366160618
clo virtual fashion|research scientist, r&d (2026)|madrid, community of madrid, spain|https://www.linkedin.com/jobs/view/4423279807
nvidia|senior software and system architect|spain|https://www.linkedin.com/jobs/view/4395475452
amazon|applied scientist, eu intech consumer selection discovery, eu intech consumer selection discovery|madrid, community of madrid, spain|https://www.linkedin.com/jobs/view/4412459891
amazon|applied scientist, eu intech consumer selection discovery, nintai|madrid, community of madrid, spain|https://www.linkedin.com/jobs/view/4429733728
amazon|applied scientist, eu intech consumer selection discovery, nintai|madrid, community of madrid, spain|https://www.linkedin.com/jobs/view/4429729777
airbus helicopters|perception technology lead|getafe, community of madrid, spain|https://www.linkedin.com/jobs/view/4427864918
apple|se-pro|malmo, skåne county, sweden|https://www.linkedin.com/jobs/view/4416332965
apple|se-pro|malmo, skåne county, sweden|https://www.linkedin.com/jobs/view/4416339759
king|principal software engineer|malmo, skåne county, sweden|https://www.linkedin.com/jobs/view/4420420898
arm|graduate gpu software developer|lund, skåne county, sweden|https://www.linkedin.com/jobs/view/4381872729
king|senior software engineer (c++) – candy crush soda saga (x2)|malmo, skåne county, sweden|https://www.linkedin.com/jobs/view/4420671364
intui|software engineer|lund, skåne county, sweden|https://www.linkedin.com/jobs/view/4375745589
nvidia|senior quantum algorithm researcher|united kingdom|https://www.linkedin.com/jobs/view/4417564882
nvidia|senior software and system architect|united kingdom|https://www.linkedin.com/jobs/view/4395477555
nvidia|senior software architect - deep learning and hpc communications|united kingdom|https://www.linkedin.com/jobs/view/4395478288
nvidia|senior hpc performance engineer|united kingdom|https://www.linkedin.com/jobs/view/4413841456
nvidia|senior hpc and ai network software architect|united kingdom|https://www.linkedin.com/jobs/view/4395922296
nvidia|applied ai researcher - world reconstruction and generation|united kingdom|https://www.linkedin.com/jobs/view/4424637378
meta|software specialist (tl) - ai/ml - monetisation|united kingdom|https://www.linkedin.com/jobs/view/4316214753
rolls-royce|quantum computational science specialist|derby, england, united kingdom|https://www.linkedin.com/jobs/view/4430977362
nvidia|senior hpc performance engineer|united kingdom|https://www.linkedin.com/jobs/view/4402772532
nvidia|security research architect|united kingdom|https://www.linkedin.com/jobs/view/4409725838
apple|it- store leader - milan metro market|milan, lombardy, italy|https://www.linkedin.com/jobs/view/4414164442
apple|pr manager, italy|milan, lombardy, italy|https://www.linkedin.com/jobs/view/4414153788
apple|it-technical specialist|milan, lombardy, italy|https://www.linkedin.com/jobs/view/4430407428
apple|it-specialista tecnico|milan, lombardy, italy|https://www.linkedin.com/jobs/view/4430407429
apple|it - specialist (sales)|bergamo, lombardy, italy|https://www.linkedin.com/jobs/view/4414158520
apple|it - specialista (vendite)|milan, lombardy, italy|https://www.linkedin.com/jobs/view/4414146892
apple|it - specialist (sales) - opportunities for protected categories|milan, lombardy, italy|https://www.linkedin.com/jobs/view/4428491343
bcg x|forward deployed ai engineer, norway - bcg x|oslo, oslo, norway|https://www.linkedin.com/jobs/view/4387792504
oslomet – oslo metropolitan university|førsteamanuensis i informasjonsteknologi|oslo, oslo, norway|https://www.linkedin.com/jobs/view/4429796345
microsoft|compiler software engineer|prague, prague, worldwide|https://www.linkedin.com/jobs/view/4381975375
microsoft|principal software engineer - github actions|prague, prague, worldwide|https://www.linkedin.com/jobs/view/4421340424
microsoft|software engineer -.net libraries|prague, prague, worldwide|https://www.linkedin.com/jobs/view/4424703719
