company|title|location|link
integral ad science|lead data scientist - computer vision and deep learning|dublin, county dublin, ireland|https://www.linkedin.com/jobs/view/4012885907
jobs via efinancialcareers|ai engineer/ data scientist, hybrid|dublin, county dublin, ireland|https://www.linkedin.com/jobs/view/4006275549
red hat|principal software engineer - openshift ai model training|waterford, county waterford, ireland|https://www.linkedin.com/jobs/view/4001013570
manpower uk|principal software engineer-openshift ai model training|greater dublin, worldwide|https://www.linkedin.com/jobs/view/4014221814
analog devices|senior engineer, mixed signal design engineering|limerick, county limerick, ireland|https://www.linkedin.com/jobs/view/3926329973
analog devices|staff engineer, mixed signal design engineering|limerick, county limerick, ireland|https://www.linkedin.com/jobs/view/3926331453
huawei ireland research center|2024 - principal research engineer (formal methods) - permanent|dublin, county dublin, ireland|https://www.linkedin.com/jobs/view/4008303041
analog devices|senior engineer, analog design engineering|limerick, county limerick, ireland|https://www.linkedin.com/jobs/view/4006054172
analog devices|senior engineer, design verification engineering|limerick, county limerick, ireland|https://www.linkedin.com/jobs/view/4006052664
viatris|manager, device program lead|dublin, county dublin, ireland|https://www.linkedin.com/jobs/view/4015290313
qualcomm|gpu physical implementation engineer - cork, ireland|cork, county cork, ireland|https://www.linkedin.com/jobs/view/3857547406
analog devices|senior engineer, design verification engineering|limerick, county limerick, ireland|https://www.linkedin.com/jobs/view/4006057058
cmcc foundation - centro euro mediterraneo sui cambiamenti climatici|12543 - early warning scientist|bologna, emilia-romagna, italy|https://www.linkedin.com/jobs/view/3968106153
gi group|scientist|naples, campania, italy|https://www.linkedin.com/jobs/view/4015784660
empatica|director of digital biomarkers development|milan, lombardy, italy|https://www.linkedin.com/jobs/view/3986977175
crif|senior generative ai specialist|milan, lombardy, italy|https://www.linkedin.com/jobs/view/4010464928
euforlegal|nlp specialist|greater rome metropolitan area, worldwide|https://www.linkedin.com/jobs/view/4015913601
etas|etas - autosar expert|greater turin metropolitan area, worldwide|https://www.linkedin.com/jobs/view/4008120842
cosmo intelligent medical devices|lead software as medical device team|rome, latium, italy|https://www.linkedin.com/jobs/view/3990390233
università degli studi di udine|research fellow|udine, friuli-venezia giulia, italy|https://www.linkedin.com/jobs/view/4001551663
siemens|operations research scientist - apprenticeship|rome, latium, italy|https://www.linkedin.com/jobs/view/3914561769
hill's pet nutrition|thermal process scientist|castiglione delle stiviere, lombardy, italy|https://www.linkedin.com/jobs/view/3929065808
rina|sustainability consultant|naples, campania, italy|https://www.linkedin.com/jobs/view/3966236114
3brain ag|technical sales specialist|genoa, liguria, italy|https://www.linkedin.com/jobs/view/4003766396
essilorluxottica|jr principal investigator- smart eyewear optical integration|milan, lombardy, italy|https://www.linkedin.com/jobs/view/3880170609
rina|sustainability consultant|casalecchio di reno, emilia-romagna, italy|https://www.linkedin.com/jobs/view/3966229967
world food programme|nutrition researcher|rome, latium, italy|https://www.linkedin.com/jobs/view/4015978735
rina|sustainability consultant|genoa, liguria, italy|https://www.linkedin.com/jobs/view/3966234239
unsw|lecturer / senior lecturer in computer science and engineering (education focussed)|milan, lombardy, italy|https://www.linkedin.com/jobs/view/4010465359
rina|sustainability consultant|lecce, apulia, italy|https://www.linkedin.com/jobs/view/3966233505
agoda|data science manager (bangkok based, relocation provided)|milan, lombardy, italy|https://www.linkedin.com/jobs/view/3999952016
agoda|data science manager (bangkok based, relocation provided)|rome, latium, italy|https://www.linkedin.com/jobs/view/3999947970
agoda|senior quantitative user experience researcher (frontend) (bangkok-based, relocation provided)|rome, latium, italy|https://www.linkedin.com/jobs/view/3742049566
agoda|senior quantitative user experience researcher (frontend) (bangkok-based, relocation provided)|milan, lombardy, italy|https://www.linkedin.com/jobs/view/3742044791
sesa spa|junior data scientist|florence, tuscany, italy|https://www.linkedin.com/jobs/view/3994735635
pwc italy|junior data scientist - milano [cns]|milan, lombardy, italy|https://www.linkedin.com/jobs/view/3825899217
radical|deep learning scientist|italy|https://www.linkedin.com/jobs/view/3996672332
kapa.ai|research engineer, applied ai|italy|https://www.linkedin.com/jobs/view/3982878971
crif|internship data scientist junior|bologna, emilia-romagna, italy|https://www.linkedin.com/jobs/view/3825508546
eustema s.p.a.|machine learning engineer|naples, campania, italy|https://www.linkedin.com/jobs/view/4003260252
scai tecno|machine learning engineer & lead data scientist  financial services|milan, lombardy, italy|https://www.linkedin.com/jobs/view/4012138275
agenzia del lavoro trentino|ingegnere elettronico|rovereto, trentino-alto adige, italy|https://www.linkedin.com/jobs/view/4014327215
moxoff spa|esperto in nlp (natural language processing)|milan, lombardy, italy|https://www.linkedin.com/jobs/view/3887805522
startup bakery|software developer|milan, lombardy, italy|https://www.linkedin.com/jobs/view/4011541658
bridgestone emea|r&d material laboratory engineer|rome, latium, italy|https://www.linkedin.com/jobs/view/3888422398
contents|data scientist|milan, lombardy, italy|https://www.linkedin.com/jobs/view/3976887483
poppi technologies|data engineer|valenzano, apulia, italy|https://www.linkedin.com/jobs/view/3999438017
engineering group|data scientist|rome, latium, italy|https://www.linkedin.com/jobs/view/3984433121
world food programme|data scientist consultant|rome, latium, italy|https://www.linkedin.com/jobs/view/4012665618
ge healthcare|mr clinical research scientist - southern europe|milan, lombardy, italy|https://www.linkedin.com/jobs/view/4002919177
gem foundation|product manager|pavia, lombardy, italy|https://www.linkedin.com/jobs/view/4005392451
confidential|senior software developer (c++) - fulltime remote|italy|https://www.linkedin.com/jobs/view/4015318423
michael page|software engineer python - realtà di prodotto - roma - ibrido|rome, latium, italy|https://www.linkedin.com/jobs/view/3904646114
danieli group|process control engineer - professional|buttrio, friuli-venezia giulia, italy|https://www.linkedin.com/jobs/view/4015020643
futurae technologies ag|technical support engineer / remote|italy|https://www.linkedin.com/jobs/view/3972228404
micron technology|technology cad / device engineer|vimercate, lombardy, italy|https://www.linkedin.com/jobs/view/4016648847
akronos technologies|hardware engineer|milan, lombardy, italy|https://www.linkedin.com/jobs/view/3949274862
university of nottingham italy|senior researcher in aircraft electric power systems design and optimisation|greater naples metropolitan area, worldwide|https://www.linkedin.com/jobs/view/3933491349
xtel|senior data engineer|bologna, emilia-romagna, italy|https://www.linkedin.com/jobs/view/3882831364
zuru tech|computational mechanics engineer|modena, emilia-romagna, italy|https://www.linkedin.com/jobs/view/3998228673
world food programme|evaluation officer (impact evaluation) p4, rome, italy|rome, latium, italy|https://www.linkedin.com/jobs/view/4001579011
glinters|quantitative researcher|italy|https://www.linkedin.com/jobs/view/4014529254
human technopole|senior bioinformatician - testa group|milan, lombardy, italy|https://www.linkedin.com/jobs/view/4013817955
leithà  unipol group|platform and cloud engineer|milan, lombardy, italy|https://www.linkedin.com/jobs/view/3987780723
oil and gas job search ltd|future projects thermal analysis engineer|turin, piedmont, italy|https://www.linkedin.com/jobs/view/4013819286
kla|field application engineer|monza, lombardy, italy|https://www.linkedin.com/jobs/view/4003537182
saipem|pipeline engineer –- encar - fano|fano, marches, italy|https://www.linkedin.com/jobs/view/3845636624
ion|senior software engineer, italy|pisa, tuscany, italy|https://www.linkedin.com/jobs/view/4016659494
ion|senior software engineer, italy|milan, lombardy, italy|https://www.linkedin.com/jobs/view/4016660397
ion|principal software engineer, italy|pisa, tuscany, italy|https://www.linkedin.com/jobs/view/4016659475
vishay intertechnology, inc.|staff engineer digital ic verification, hybrid|greater milan metropolitan area, worldwide|https://www.linkedin.com/jobs/view/3994367377
ion|lead software engineer, italy|turin, piedmont, italy|https://www.linkedin.com/jobs/view/4016658783
ion|lead software engineer, italy|milan, lombardy, italy|https://www.linkedin.com/jobs/view/4016657998
jakala|generative ai  senior data scientist|milan, lombardy, italy|https://www.linkedin.com/jobs/view/4001528790
ion|senior software engineer, italy|collecchio, emilia-romagna, italy|https://www.linkedin.com/jobs/view/4016659490
ion|lead software engineer, italy|pisa, tuscany, italy|https://www.linkedin.com/jobs/view/4016664081
illumina|sr. field application scientist italy south|rome, latium, italy|https://www.linkedin.com/jobs/view/3953252962
thermo fisher scientific|technical application scientist ii, clinical ngs|milan, lombardy, italy|https://www.linkedin.com/jobs/view/3995606254
jobs via efinancialcareers|senior ai engineer, italy|pisa, tuscany, italy|https://www.linkedin.com/jobs/view/3998408426
iba|service engineer beam physics|rozzano, lombardy, italy|https://www.linkedin.com/jobs/view/3936558650
micron technology|mnand verification engineer|arzano, campania, italy|https://www.linkedin.com/jobs/view/4000544412
micron technology|mnand verification engineer|vimercate, lombardy, italy|https://www.linkedin.com/jobs/view/4000541771
electrolux group|senior cybersecurity architect, mobile technology|forlì, emilia-romagna, italy|https://www.linkedin.com/jobs/view/4012660407
oil and gas job search ltd|fluid and thermal senior engineer|turin, piedmont, italy|https://www.linkedin.com/jobs/view/4013820082
electrolux group|senior cybersecurity architect, mobile technology|porcia, friuli-venezia giulia, italy|https://www.linkedin.com/jobs/view/4012664070
mozarc medical|senior hardware engineer|mirandola, emilia-romagna, italy|https://www.linkedin.com/jobs/view/4007566403
the exploration company|fluid and thermal senior engineer|turin, piedmont, italy|https://www.linkedin.com/jobs/view/4000837760
rina|seismic hazard engineer|rozzano, lombardy, italy|https://www.linkedin.com/jobs/view/4011497368
basf|breeder tomato bush and tomato rootstock - basf  nunhems|sant’agata bolognese, emilia-romagna, italy|https://www.linkedin.com/jobs/view/3999423596
synopsys inc|analog design, principal engineer/serdes|pavia, lombardy, italy|https://www.linkedin.com/jobs/view/4001448056
synopsys inc|analog design, principal engineer/serdes|pavia, lombardy, italy|https://www.linkedin.com/jobs/view/4001443622
mathworks|university of pisa matlab student ambassador|turin, piedmont, italy|https://www.linkedin.com/jobs/view/3954483015
visa|middle data scientist|almaty, almaty, worldwide|https://www.linkedin.com/jobs/view/4011426531
kapa.ai|research engineer, applied ai|latvia, worldwide|https://www.linkedin.com/jobs/view/3982886022
evolution|data scientist (risk and fraud detection)|riga, riga, worldwide|https://www.linkedin.com/jobs/view/3979541715
hilti group|intern – advanced battery data analysis (m/f/x)|schaan, schaan, worldwide|https://www.linkedin.com/jobs/view/3979661419
thermo fisher scientific|product evaluation scientist|vilnius, vilniaus, worldwide|https://www.linkedin.com/jobs/view/4007474308
european investment bank (eib)|(senior) derivatives valuation officer – based in luxembourg|vilniaus rajonas, vilniaus, worldwide|https://www.linkedin.com/jobs/view/3976463460
kickertech|mathematician - data scientist|vilnius, vilniaus, worldwide|https://www.linkedin.com/jobs/view/4007558638
kapa.ai|research engineer, applied ai|lithuania, worldwide|https://www.linkedin.com/jobs/view/3982883642
revolut|data scientist (nlp deep learning engineer)|lithuania, worldwide|https://www.linkedin.com/jobs/view/4006455355
revolut|data scientist (nlp deep learning engineer)|vilnius, vilniaus, worldwide|https://www.linkedin.com/jobs/view/4006456282
cast ai|senior data scientist / llm engineer - ai optimizer team|vilnius, vilniaus, worldwide|https://www.linkedin.com/jobs/view/4014929478
thermo fisher scientific|scientist ii, manufacturing sciences|vilnius, vilniaus, worldwide|https://www.linkedin.com/jobs/view/4002320498
cast ai|senior data scientist / llm engineer - ai optimizer team|lithuania, worldwide|https://www.linkedin.com/jobs/view/4005562292
paul wurth s.a.|internship/phd – modeling researcher (m/f/d)|luxembourg|https://www.linkedin.com/jobs/view/3967871790
european dynamics|application cloud architect (semantic graphics)|luxembourg, luxembourg, luxembourg|https://www.linkedin.com/jobs/view/4016695346
european dynamics|expert in service management|luxembourg, luxembourg, luxembourg|https://www.linkedin.com/jobs/view/3984538684
university of luxembourg|research scientist in secure mobile software engineering|luxembourg|https://www.linkedin.com/jobs/view/4000214815
university of luxembourg|research associates / spontaneous applications|luxembourg|https://www.linkedin.com/jobs/view/3631975916
spire|senior ai weather scientist|luxembourg|https://www.linkedin.com/jobs/view/4015132498
luxembourg institute of science and technology (list)|r&t scientist in life cycle assessment and industrial process modelling|esch-sur-alzette, luxembourg, luxembourg|https://www.linkedin.com/jobs/view/3994639648
champ cargosystems|data scientist|luxembourg, luxembourg|https://www.linkedin.com/jobs/view/4012104886
european dynamics|full stack developer|luxembourg, luxembourg, luxembourg|https://www.linkedin.com/jobs/view/4013533856
luxspace|senior ( lead ) satellite and space systems engineer (m/f/o) – space industry luxembourg|betzdorf, grevenmacher, luxembourg|https://www.linkedin.com/jobs/view/4008278299
university of luxembourg|research associate in artificial intelligence and software engineering|luxembourg|https://www.linkedin.com/jobs/view/3829980608
hydrosat|machine learning scientist|kirchberg, luxembourg, luxembourg|https://www.linkedin.com/jobs/view/4015905010
university of luxembourg|phd candidate in artificial intelligence and software engineering|luxembourg|https://www.linkedin.com/jobs/view/3825028827
university of luxembourg|doctoral positions in cybersecurity, software engineering and ai|luxembourg|https://www.linkedin.com/jobs/view/3992305020
nsi it software & services|nsi – senior data scientist & artificial intelligence engineer – fr/en|esch-sur-alzette, luxembourg, luxembourg|https://www.linkedin.com/jobs/view/4005547903
university of luxembourg|postdoc in experimental test and validation of 5g/6g non-terrestrial networks and satellite communications|luxembourg|https://www.linkedin.com/jobs/view/3889312946
luxembourg institute of science and technology (list)|post-doc in real-time hardware-in-the loop simulation of smart grids (24 months contract)|esch-sur-alzette, luxembourg, luxembourg|https://www.linkedin.com/jobs/view/3999078358
join.com|luxprovide: hpc software engineer|bertrange, luxembourg, luxembourg|https://www.linkedin.com/jobs/view/3970220947
university of luxembourg|phd candidate in 5g/6g communications for uav cross-border service continuity|luxembourg|https://www.linkedin.com/jobs/view/3998803849
university of luxembourg|research associate (postdoc) in meta-mac layer development|luxembourg, luxembourg, luxembourg|https://www.linkedin.com/jobs/view/3944453700
university of luxembourg|postdoc sdr for advanced satellite communication techniques|luxembourg, luxembourg, luxembourg|https://www.linkedin.com/jobs/view/3958562388
university of luxembourg|postdoc 5g/6g non-terrestrial networks and satellite networks|luxembourg, luxembourg, luxembourg|https://www.linkedin.com/jobs/view/3947876454
chabre|security architect|luxembourg, luxembourg, luxembourg|https://www.linkedin.com/jobs/view/3941415268
university of luxembourg|phd in developmental psychology|luxembourg|https://www.linkedin.com/jobs/view/3972896242
university of luxembourg|postdoc in reconfigurable intelligent surface-empowered 6g networks|luxembourg, luxembourg, luxembourg|https://www.linkedin.com/jobs/view/3993251342
european investment bank (eib)|(senior) derivatives valuation officer – based in luxembourg|oh, malta, worldwide|https://www.linkedin.com/jobs/view/3976459995
lesjeudis|manager - software engineering & cloud platform|nice, provence-alpes-côte d'azur, france|https://www.linkedin.com/jobs/view/4012802003
adsearch|ingénieur machine learning (h/f)|nice, provence-alpes-côte d'azur, france|https://www.linkedin.com/jobs/view/3985098706
arteris|digital ic design engineer|biot, provence-alpes-côte d'azur, france|https://www.linkedin.com/jobs/view/3783191182
datadog|senior software engineer|sophia antipolis, provence-alpes-côte d'azur, france|https://www.linkedin.com/jobs/view/3541528088
datadog|software engineer - distributed systems|sophia antipolis, provence-alpes-côte d'azur, france|https://www.linkedin.com/jobs/view/3705374969
growdev|banco de talentos i professor(a) de tecnologia|campo bom, rio grande do sul, brazil|https://www.linkedin.com/jobs/view/3911003219
nano dimension|materials scientist / engineer|alkmaar, north holland, netherlands|https://www.linkedin.com/jobs/view/3977473582
european dynamics|solution architect|the hague, south holland, netherlands|https://www.linkedin.com/jobs/view/4009745975
medis medical imaging|clinical scientist|leiden, south holland, netherlands|https://www.linkedin.com/jobs/view/4003271227
rand europe|research leader - crime and justice - netherlands|rotterdam, south holland, netherlands|https://www.linkedin.com/jobs/view/3930147222
discover international|protein purification scientist|netherlands|https://www.linkedin.com/jobs/view/4004940494
trinamics|open job application asml|veldhoven, north brabant, netherlands|https://www.linkedin.com/jobs/view/3957363411
brookwood recruitment ltd|user experience researcher|amsterdam, north holland, netherlands|https://www.linkedin.com/jobs/view/4015215270
dsm-firmenich|scientist sensory & flavor science|delft, south holland, netherlands|https://www.linkedin.com/jobs/view/3995619750
mars|rapid spectroscopy scientist|veghel, north brabant, netherlands|https://www.linkedin.com/jobs/view/3999460111
nonstop consulting|clinical consultant - regulatory affairs|north brabant, netherlands|https://www.linkedin.com/jobs/view/4003278694
tno|researcher photonics  eindhoven|eindhoven, north brabant, netherlands|https://www.linkedin.com/jobs/view/4008687552
tmc|technical architect build systems|veldhoven, north brabant, netherlands|https://www.linkedin.com/jobs/view/3999096401
qualcomm|principal machine learning researcher - qualcomm - amsterdam|amsterdam, north holland, netherlands|https://www.linkedin.com/jobs/view/3818017437
university of amsterdam|faculty positions at qusoft|amsterdam, north holland, netherlands|https://www.linkedin.com/jobs/view/3991681401
growity systems|quantitative trader|rotterdam, south holland, netherlands|https://www.linkedin.com/jobs/view/3983526112
nextenergy|senior data scientist|utrecht, utrecht, netherlands|https://www.linkedin.com/jobs/view/4008050013
eindhoven university of technology|research it consultant - mathematics and computer science (1,0 fte)|eindhoven, north brabant, netherlands|https://www.linkedin.com/jobs/view/4016980770
capgemini|data science consultant - hybrid intelligence - nl|utrecht, utrecht, netherlands|https://www.linkedin.com/jobs/view/3996119476
thermo fisher scientific|sensor specialist, r&d tem|eindhoven, north brabant, netherlands|https://www.linkedin.com/jobs/view/4010415878
booking.com|senior data scientist - experimentation team|amsterdam, north holland, netherlands|https://www.linkedin.com/jobs/view/3987536656
brookwood recruitment ltd|ux researcher|amsterdam, north holland, netherlands|https://www.linkedin.com/jobs/view/4014168359
context labs bv|senior data scientist|amsterdam, north holland, netherlands|https://www.linkedin.com/jobs/view/3970233195
unsw|lecturer / senior lecturer in computer science and engineering|delft, south holland, netherlands|https://www.linkedin.com/jobs/view/4010462575
independent recruiters|senior test architect - automated testing|eindhoven, north brabant, netherlands|https://www.linkedin.com/jobs/view/3969819872
mathworks|technical specialist code generation & verification|eindhoven, north brabant, netherlands|https://www.linkedin.com/jobs/view/3819589416
thermo fisher scientific|senior scientist - electron optics r&d|eindhoven, north brabant, netherlands|https://www.linkedin.com/jobs/view/3997739119
ing nederland|senior credit risk model developer|amsterdam area, worldwide|https://www.linkedin.com/jobs/view/4011339247
philips|clinical science director|best, north brabant, netherlands|https://www.linkedin.com/jobs/view/4006200401
asml|senior architect|veldhoven, north brabant, netherlands|https://www.linkedin.com/jobs/view/4010580667
booking.com|senior machine learning scientist i - customer-centric data|amsterdam, north holland, netherlands|https://www.linkedin.com/jobs/view/3982959044
imec|senior business development manager|eindhoven, north brabant, netherlands|https://www.linkedin.com/jobs/view/4009272518
tno|experienced lca scientist|utrecht, utrecht, netherlands|https://www.linkedin.com/jobs/view/4012135710
amsterdam university college|phd in adaptive and ai-based reliability techniques for complex iot-based systems|amsterdam, north holland, netherlands|https://www.linkedin.com/jobs/view/4011436235
genmab|senior research associate, protein separations & cmc|utrecht, utrecht, netherlands|https://www.linkedin.com/jobs/view/3988554482
oil and gas job search ltd|technical specialist code generation & verification (m/f/d)|eindhoven, north brabant, netherlands|https://www.linkedin.com/jobs/view/3973351079
cgi nederland|senior gnss engineer – space unit|rotterdam, south holland, netherlands|https://www.linkedin.com/jobs/view/3935069723
delft university of technology|phd position modelling solid oxide fuel cells - gas turbine (sofc-gt) for aviation|delft, south holland, netherlands|https://www.linkedin.com/jobs/view/3972648853
university of amsterdam|two phd positions in erc starting grant project on multiple jobholders|amsterdam, north holland, netherlands|https://www.linkedin.com/jobs/view/3999502524
codeguild|senior core java developer - medtech open source product help een van de meest impactvolle aandoening aan te pakken - €100.000|amsterdam, north holland, netherlands|https://www.linkedin.com/jobs/view/4007558866
university of twente|phd position on modeling of smart additive-manufacturing processes for high-performance concrete|enschede, overijssel, netherlands|https://www.linkedin.com/jobs/view/3980358135
antler|chief data scientist & startup founder (september 2024)|rotterdam, south holland, netherlands|https://www.linkedin.com/jobs/view/4015750125
utrecht university|phd position on the future of work and organisational creativity|utrecht, utrecht, netherlands|https://www.linkedin.com/jobs/view/3954911040
join.com|shanx medtech bv: system architect|nijmegen, gelderland, netherlands|https://www.linkedin.com/jobs/view/3970166751
delft university of technology|nextworkx phd position safe use of ai in telecommunication networks|delft, south holland, netherlands|https://www.linkedin.com/jobs/view/3975256585
knaw - koninklijke nederlandse akademie van wetenschappen|phd position - nioo - knaw|wageningen, gelderland, netherlands|https://www.linkedin.com/jobs/view/4011968773
utrecht university|phd positions: mechano-catalytic depolymerisation of plastic waste|utrecht, utrecht, netherlands|https://www.linkedin.com/jobs/view/4017453689
itsync|master cost modeller|amsterdam, north holland, netherlands|https://www.linkedin.com/jobs/view/4004313499
kwr water research institute|phd onderzoeker ‘data-analyse non-target screening hoge resolutie massaspectrometrie in de watercyclus’|nieuwegein, utrecht, netherlands|https://www.linkedin.com/jobs/view/3982948498
delft university of technology|phd position jointly optimizing waveforms, beamforming and radio resource management for joint communications and sensing in 6g networks|delft, south holland, netherlands|https://www.linkedin.com/jobs/view/4004405792
delft university of technology|phd position effective metadata management for data-driven plant resilience enhancement|delft, south holland, netherlands|https://www.linkedin.com/jobs/view/4010604537
feadship|cfd specialist|hoofddorp, north holland, netherlands|https://www.linkedin.com/jobs/view/3977879985
wageningen university & research|phd opportunity on the diet-related consequences of obesity treatment|wageningen, gelderland, netherlands|https://www.linkedin.com/jobs/view/4009729353
techniekwerkt.nl|it/ot specialist manufacturing - cosun|cuijk, north brabant, netherlands|https://www.linkedin.com/jobs/view/3994283716
wageningen university & research|phd position on sinking river deltas: modelling of land subsidence processes, projecting impacts of relative sea-level rise and designing solutions|wageningen, gelderland, netherlands|https://www.linkedin.com/jobs/view/4013985056
arcadis|(senior) consultant transmission & distribution|amsterdam, north holland, netherlands|https://www.linkedin.com/jobs/view/3955925396
