company|title|location|link
amazon|data scientist, prime air|graz, styria, austria|https://www.linkedin.com/jobs/view/4011514338
european dynamics|devsecops expert|brussels, brussels region, belgium|https://www.linkedin.com/jobs/view/3901132135
european dynamics|full stack developer|brussels, brussels region, belgium|https://www.linkedin.com/jobs/view/4001368547
uber|sr staff engineer, service management platform|aarhus, central denmark region, denmark|https://www.linkedin.com/jobs/view/3965681248
hexaly|operations research scientist|paris, île-de-france, france|https://www.linkedin.com/jobs/view/3929796369
amazon web services (aws)|applied science manager, aws generative ai innovation center|courbevoie, île-de-france, france|https://www.linkedin.com/jobs/view/3935049292
bigblue|senior data scientist|paris, île-de-france, france|https://www.linkedin.com/jobs/view/3890885842
pasqal|standards manager - quantum computing & simulation|massy, île-de-france, france|https://www.linkedin.com/jobs/view/4000809477
pathway|software engineer - algorithms & data processing magician - ex-faang wel|paris, île-de-france, france|https://www.linkedin.com/jobs/view/3887693789
amazon web services (aws)|data scientist, aws generative ai innovation center|courbevoie, île-de-france, france|https://www.linkedin.com/jobs/view/4008698394
pasqal|quantum developer|massy, île-de-france, france|https://www.linkedin.com/jobs/view/3991368787
pasqal|mid level system performance engineer|massy, île-de-france, france|https://www.linkedin.com/jobs/view/3972547473
pasqal|mid-senior hardware systems engineer- quantum register|massy, île-de-france, france|https://www.linkedin.com/jobs/view/3956138388
amazon web services (aws)|sr. data scientist - customer insights & audience targeting, worldwide specialist org (wwso)|ga, atlanta, worldwide|https://www.linkedin.com/jobs/view/4017010012
amazon web services (aws)|sr. data scientist, proserve genai|ga, atlanta, worldwide|https://www.linkedin.com/jobs/view/3964675643
amazon web services (aws)|sr. responsible ai data scientist, generative ai innovation center|ga, atlanta, worldwide|https://www.linkedin.com/jobs/view/3969279237
koch|sr. operations research scientist|ga, atlanta, worldwide|https://www.linkedin.com/jobs/view/3938958149
amazon web services (aws)|sr. deep learning architect, proserve genai|ga, atlanta, worldwide|https://www.linkedin.com/jobs/view/3928857066
amazon web services (aws)|sr. deep learning architect, proserve genai|ga, atlanta, worldwide|https://www.linkedin.com/jobs/view/3954900216
amazon web services (aws)|applied scientist, gen ai innovation center|ga, atlanta, worldwide|https://www.linkedin.com/jobs/view/4017003685
steneral consulting|hybrid work - need sr data scientist in sandy springs ga|ga, sandy springs, worldwide|https://www.linkedin.com/jobs/view/3903430226
amazon web services (aws)|software engineer ii|ga, atlanta, worldwide|https://www.linkedin.com/jobs/view/3964675439
amazon web services (aws)|sr. applied scientist, generative ai innovation center|ga, atlanta, worldwide|https://www.linkedin.com/jobs/view/3930463834
amazon|sr. simulation engineer, innovation, engineering & sustainability|berlin, germany|https://www.linkedin.com/jobs/view/4016209450
amazon|sr. simulation engineer, eu aces|berlin, germany|https://www.linkedin.com/jobs/view/3982312535
amazon|software development engineer, amazon robotics r&d|berlin, germany|https://www.linkedin.com/jobs/view/4015643131
amazon|applied scientist - rufus, amazon|berlin, germany|https://www.linkedin.com/jobs/view/4012645433
amazon|postdoctoral scientist, amazon robotics|berlin, germany|https://www.linkedin.com/jobs/view/3959794931
amazon|applied scientist, agi conversational assistant services|berlin, germany|https://www.linkedin.com/jobs/view/4010787281
amazon|applied scientist / nlp, customer engagement technology, self-service & automation|berlin, germany|https://www.linkedin.com/jobs/view/4009007735
amazon|applied scientist ii, agi-sensory understanding|aachen, north rhine-westphalia, germany|https://www.linkedin.com/jobs/view/4007077450
amazon music|manager applied science, amazon music machine learning/personalization|berlin, germany|https://www.linkedin.com/jobs/view/3963464174
amazon web services (aws)|senior manager of software development (product pricing & agreements ), aws billing ppoa|berlin, germany|https://www.linkedin.com/jobs/view/4010592110
pwc greece|ai engineering senior associate/ manager|athens, attiki, greece|https://www.linkedin.com/jobs/view/3806762813
i-sensegroup/iccs|generative llm/ mlops engineer|athens, attiki, greece|https://www.linkedin.com/jobs/view/4014944242
datapao|senior data scientist|budapest, hungary|https://www.linkedin.com/jobs/view/3997248688
amazon web services (aws)|data scientist|dublin, county dublin, ireland|https://www.linkedin.com/jobs/view/3990932216
amazon web services (aws)|sr. applied scientist, aws support|cork, county cork, ireland|https://www.linkedin.com/jobs/view/4002457315
doctor|graduate cloud support associate - july 2025 start, support engineering|county dublin, ireland|https://www.linkedin.com/jobs/view/4011768073
amazon web services (aws)|supplier quality engineer, infrastructure reliability & quality|dublin, county dublin, ireland|https://www.linkedin.com/jobs/view/3974264942
amazon web services (aws)|esg strategist / program mgr, aws sustainability|dublin, county dublin, ireland|https://www.linkedin.com/jobs/view/3955004251
amazon web services (aws)|sr. supplier quality engineer, infrastructure reliability & quality (irq)|dublin, county dublin, ireland|https://www.linkedin.com/jobs/view/3974271018
broadcom|client servies consultant|greater milan metropolitan area, worldwide|https://www.linkedin.com/jobs/view/3994287291
amazon web services (aws)|ml engineer, generative ai innovation center|milan, lombardy, italy|https://www.linkedin.com/jobs/view/3941642760
studio cappello [wmr]|data scientist (digital)|greater padova (padua) metropolitan area, worldwide|https://www.linkedin.com/jobs/view/3881488427
studio cappello [wmr]|data scientist (digital)|venice, veneto, italy|https://www.linkedin.com/jobs/view/3884712334
amazon|sr. data scientist, eu s/c, supply chain science|luxembourg, luxembourg, luxembourg|https://www.linkedin.com/jobs/view/3911831402
amazon|senior or scientist, global reliability, maintenance & engineering, decision science and technology|luxembourg, luxembourg, luxembourg|https://www.linkedin.com/jobs/view/3877266649
amazon|snr data scientist, customer insights, amazon pay|luxembourg, luxembourg, luxembourg|https://www.linkedin.com/jobs/view/3877282568
amazon|manager, applied science, operations risk compliance (orc) science|luxembourg, luxembourg, luxembourg|https://www.linkedin.com/jobs/view/3945837191
amazon|applied scientist, eu ats science and tech|luxembourg, luxembourg, luxembourg|https://www.linkedin.com/jobs/view/4010023127
amazon|data scientist, eu s/c, supply chain science|luxembourg, luxembourg, luxembourg|https://www.linkedin.com/jobs/view/3994792003
amazon|senior research scientist, global reliability, maintenance & engineering, decision science and technology|luxembourg, luxembourg, luxembourg|https://www.linkedin.com/jobs/view/3895632479
amazon|ml scientist / applied scientist, eu prime & marketing science|amsterdam, north holland, netherlands|https://www.linkedin.com/jobs/view/4003557042
pasqal|general application for future pasqal amsterdam opportunities|amsterdam, north holland, netherlands|https://www.linkedin.com/jobs/view/3716736259
jit team|senior data scientist|poland|https://www.linkedin.com/jobs/view/4013377998
pathway|software engineer - algorithms & data processing magician|cracow, małopolskie, poland|https://www.linkedin.com/jobs/view/3887662467
in4ge|data scientist|warsaw, mazowieckie, poland|https://www.linkedin.com/jobs/view/4000380900
in4ge|data scientist|warsaw, mazowieckie, poland|https://www.linkedin.com/jobs/view/4006327630
ryanair - europe's favourite airline|optimization engineer - work from home/ fully remote|portugal|https://www.linkedin.com/jobs/view/3955480732
amazon|sr. data scientist, supply chain science|santa monica, canada|https://www.linkedin.com/jobs/view/3944153253
amazon|principal economist, program valuation, fashion intelligence|los angeles metropolitan area, worldwide|https://www.linkedin.com/jobs/view/3947243857
amazon|applied science manager, agi- web information svcs.|los angeles metropolitan area, worldwide|https://www.linkedin.com/jobs/view/3996252893
amazon|sr data scientist, f2 tech|los angeles metropolitan area, worldwide|https://www.linkedin.com/jobs/view/3994595633
amazon|applied scientist (l5), sponsored products marketplace intelligence|santa monica, canada|https://www.linkedin.com/jobs/view/4014436487
amazon|applied scientist ii, sponsored products|santa monica, canada|https://www.linkedin.com/jobs/view/4007350779
amazon|applied scientist, sponsored products marketplace intelligence|santa monica, canada|https://www.linkedin.com/jobs/view/4001894224
amazon|sr. applied scientist, agi - web & knowledge services|el segundo, canada|https://www.linkedin.com/jobs/view/3925332860
amazon web services (aws)|quantum research scientist, aws center for quantum computing|pasadena, canada|https://www.linkedin.com/jobs/view/3916531542
amazon web services (aws)|quantum research scientist, aws center for quantum computing|pasadena, canada|https://www.linkedin.com/jobs/view/4005556895
motivo|software engineer|gardena, canada|https://www.linkedin.com/jobs/view/3891681884
samsung electronics america|machine learning serving engineer - vd|los angeles metropolitan area, worldwide|https://www.linkedin.com/jobs/view/3950758807
amazon web services (aws)|quantum research scientist, hardware - aws center for quantum computing|pasadena, canada|https://www.linkedin.com/jobs/view/3894478646
motivo|senior embedded firmware engineer|gardena, canada|https://www.linkedin.com/jobs/view/4011716163
jerry|full stack software engineer, retention|los angeles, canada|https://www.linkedin.com/jobs/view/3860721826
ziprecruiter|senior software engineer, big data|santa monica, canada|https://www.linkedin.com/jobs/view/3984475743
jerry|senior full stack software engineer, chatbot|los angeles, canada|https://www.linkedin.com/jobs/view/3860723147
amazon|applied scientist|barcelona, catalonia, spain|https://www.linkedin.com/jobs/view/3953943358
amazon|applied scientist|barcelona, catalonia, spain|https://www.linkedin.com/jobs/view/3989060658
amazon|machine learning scientist, ats machine learning & engineering|barcelona, catalonia, spain|https://www.linkedin.com/jobs/view/4006157321
amazon|applied scientist, eu intech consumer selection discovery|madrid, community of madrid, spain|https://www.linkedin.com/jobs/view/4007072826
amazon|applied scientist, eu intech consumer selection discovery|madrid, community of madrid, spain|https://www.linkedin.com/jobs/view/3877285017
amazon|sr. applied scientist|barcelona, catalonia, spain|https://www.linkedin.com/jobs/view/3877276637
gds modellica|senior system administrator (linux) & technical support specialist|madrid, community of madrid, spain|https://www.linkedin.com/jobs/view/3919683364
join.com|gds modellica: senior system administrator (linux) & technical support specialist|madrid, community of madrid, spain|https://www.linkedin.com/jobs/view/3970297991
olx|principal data scientist|barcelona, catalonia, spain|https://www.linkedin.com/jobs/view/4004087408
pathway|software engineer - algorithms & data processing magician|stockholm, stockholm county, sweden|https://www.linkedin.com/jobs/view/3887680802
dataroid|solutions architect|türkiye, istanbul, worldwide|https://www.linkedin.com/jobs/view/4007628482
dataroid|software engineering team lead|türkiye, istanbul, worldwide|https://www.linkedin.com/jobs/view/4014322191
dataroid|senior backend engineer|türkiye, istanbul, worldwide|https://www.linkedin.com/jobs/view/3916826971
epam systems|lead data &mle engineer|ukraine|https://www.linkedin.com/jobs/view/4002918299
amazon|sr. data scientist, eu s/c, supply chain science|london, england, united kingdom|https://www.linkedin.com/jobs/view/3931413983
amazon|principal applied scientist, personalization team|edinburgh, scotland, united kingdom|https://www.linkedin.com/jobs/view/3877288076
amazon|applied scientist, amazon ads|london, england, united kingdom|https://www.linkedin.com/jobs/view/3931419501
amazon|applied scientist, amazon ads|greater edinburgh area, worldwide|https://www.linkedin.com/jobs/view/3931419500
amazon|applied scientist, contextual ads|london, england, united kingdom|https://www.linkedin.com/jobs/view/3983417088
amazon|applied scientist, personalization|edinburgh, scotland, united kingdom|https://www.linkedin.com/jobs/view/3988722326
amazon|senior applied scientist, amazon ads|london, england, united kingdom|https://www.linkedin.com/jobs/view/3931420506
amazon|sr. applied scientist - global operational excellence|london, england, united kingdom|https://www.linkedin.com/jobs/view/3984629016
amazon|senior applied scientist, amazon ads|greater edinburgh area, worldwide|https://www.linkedin.com/jobs/view/3931415959
amazon|applied scientist , adsp: campaign & creative|london, england, united kingdom|https://www.linkedin.com/jobs/view/3995523336
pitchbook|staff software development engineer|london, england, united kingdom|https://www.linkedin.com/jobs/view/3993966432
worldpay|senior data platform engineer|greater london, england, united kingdom|https://www.linkedin.com/jobs/view/3970996545
amazon music|applied scientist, amazon music machine learning/personalization|berlin, germany|https://www.linkedin.com/jobs/view/3979719276
amazon|applied scientist , adsp: campaign & creative|greater edinburgh area, worldwide|https://www.linkedin.com/jobs/view/3995520710
amazon|principal applied scientist, adsp: contextual targeting|greater edinburgh area, worldwide|https://www.linkedin.com/jobs/view/3934852437
s1jobs|principal applied scientist, adsp: contextual targeting|edinburgh, scotland, united kingdom|https://www.linkedin.com/jobs/view/4012123683
amazon web services (aws)|logistics specialist , data center communities|frankfurt rhine-main metropolitan area, worldwide|https://www.linkedin.com/jobs/view/4017471282
amazon|senior applied scientist, agi - intelligent decisions|london, england, united kingdom|https://www.linkedin.com/jobs/view/3881682293
amazon|principal applied scientist, adsp: contextual targeting|london, england, united kingdom|https://www.linkedin.com/jobs/view/3934850823
amazon|sr. applied scientist llm/lvm, contextual ads|london, england, united kingdom|https://www.linkedin.com/jobs/view/3945832727
amazon|sr. applied scientist agi, contextual ads|london, england, united kingdom|https://www.linkedin.com/jobs/view/3901712361
pathway|software engineer - algorithms & data processing magician - ex-faang wel|munich, bavaria, germany|https://www.linkedin.com/jobs/view/3887674864
lesjeudis|doctorant f/h measuring brain microstructure through myelin content modelling in neurodegenerative diseases|rennes, brittany, france|https://www.linkedin.com/jobs/view/3989058020
synergisticit|entry level data scientist|ga, atlanta, worldwide|https://www.linkedin.com/jobs/view/4015654715
synergisticit|junior data scientist/analyst/engineer - remote|ga, savannah, worldwide|https://www.linkedin.com/jobs/view/3997873798
synergisticit|entry level developer/coder/programmer/data scientist/analyst/engineer|ga, macon, worldwide|https://www.linkedin.com/jobs/view/3818360622
synergisticit|entry level programmer/coder/developer/data scientist/analyst/engineer|ga, atlanta, worldwide|https://www.linkedin.com/jobs/view/3833866561
synergisticit|data scientist/engineer/analyst - entry level|ga, macon, worldwide|https://www.linkedin.com/jobs/view/3995223714
synergisticit|data scientist - entry level|ga, columbus, worldwide|https://www.linkedin.com/jobs/view/3833868084
synergisticit|entry level java git  developer /data scientist|ga, atlanta, worldwide|https://www.linkedin.com/jobs/view/3999763868
synergisticit|junior data analyst/engineer/scientist|ga, athens, worldwide|https://www.linkedin.com/jobs/view/4009303676
synergisticit|junior data analyst/scientist/engineer|ga, atlanta, worldwide|https://www.linkedin.com/jobs/view/3998821500
ultramarin|internship: data scientist - quantitative investment research (m/f/d)|berlin, berlin, germany|https://www.linkedin.com/jobs/view/3981226053
algoriddim|data scientist|munich, bavaria, germany|https://www.linkedin.com/jobs/view/4011787034
omilia - conversational intelligence|nlp research scientist|athens, attiki, greece|https://www.linkedin.com/jobs/view/3969074980
emarsys|data scientist team lead|budapest, hungary|https://www.linkedin.com/jobs/view/4011894573
ordina a sopra steria company|data scientist|nieuwegein, utrecht, netherlands|https://www.linkedin.com/jobs/view/3987505901
synergisticit|entry/junior level data scientist/python programmer (remote)|el monte, canada|https://www.linkedin.com/jobs/view/3818360691
synergisticit|junior data scientist (remote)|los angeles, canada|https://www.linkedin.com/jobs/view/4010061425
synergisticit|data scientist/ java developer (remote)|fullerton, canada|https://www.linkedin.com/jobs/view/3818359748
synergisticit|entry level data scientist/data analyst/java developer with aws|los angeles, canada|https://www.linkedin.com/jobs/view/3999766637
liom|senior algorithm engineer / data scientist (ppg) (80-100%)|freienbach, schwyz, switzerland|https://www.linkedin.com/jobs/view/4007657400
liom|senior machine learning scientist - deep learning (100% - senior/principal)|freienbach, schwyz, switzerland|https://www.linkedin.com/jobs/view/3964912603
liom|senior algorithm engineer / data scientist (ppg), (m/f/d, 100%)|freienbach, schwyz, switzerland|https://www.linkedin.com/jobs/view/4007660233
gaia labs llc|senior media performance architect - platform architecture|southampton, england, united kingdom|https://www.linkedin.com/jobs/view/3986087739
gaia labs llc|design verification manager|southampton, england, united kingdom|https://www.linkedin.com/jobs/view/3986086737
gaia labs llc|swe - applied machine learning engineer|southampton, england, united kingdom|https://www.linkedin.com/jobs/view/4010169765
gaia labs llc|performance modelling engineer|southampton, england, united kingdom|https://www.linkedin.com/jobs/view/3986084813
gaia labs llc|performance modelling engineer|cambridge, england, united kingdom|https://www.linkedin.com/jobs/view/3986085870
causeway technologies|lead data and ai scientist|middlesbrough, england, united kingdom|https://www.linkedin.com/jobs/view/3994852212
gaia labs llc|gpu hardware modelling engineer|cambridge, england, united kingdom|https://www.linkedin.com/jobs/view/3986091167
gaia labs llc|gpu hardware modelling engineer|southampton, england, united kingdom|https://www.linkedin.com/jobs/view/3986091165
google|principal, specialized software, ai, office of the cto|vienna, vienna, austria|https://www.linkedin.com/jobs/view/4000288429
outstaff your team|(fluent ukrainian or english) data scientist (mlops, ai devops)|vienna, vienna, austria|https://www.linkedin.com/jobs/view/4006576445
google|software engineer iii, embedded systems|ottignies-louvain-la-neuve, walloon region, belgium|https://www.linkedin.com/jobs/view/4008799817
european dynamics|cloud architect|brussels, brussels region, belgium|https://www.linkedin.com/jobs/view/3934473392
etinars|european institutions: data scientist - ai/ml/nlp|brussels, brussels region, belgium|https://www.linkedin.com/jobs/view/3933493456
etinars|european institutions: data scientist - ai/ml/nlp|antwerp, flemish region, belgium|https://www.linkedin.com/jobs/view/3933489856
etinars|european institutions: data scientist - ai/ml/nlp|ghent, flemish region, belgium|https://www.linkedin.com/jobs/view/3933492459
in the pocket|machine learning engineer|flemish region, belgium|https://www.linkedin.com/jobs/view/4011068054
madison recruitment|software engineer (java)|ghent, flemish region, belgium|https://www.linkedin.com/jobs/view/3957741407
scalefocus|data scientist|sofia, sofia city, worldwide|https://www.linkedin.com/jobs/view/4004783246
outstaff your team|(fluent ukrainian or english) data scientist (mlops, ai devops)|sofia, sofia city, worldwide|https://www.linkedin.com/jobs/view/4006574726
softserve|senior data scientist|bulgaria, worldwide|https://www.linkedin.com/jobs/view/4002849301
outstaff your team|(fluent ukrainian or english) data scientist (mlops, ai devops)|zagreb, zagreb, worldwide|https://www.linkedin.com/jobs/view/4006579153
google|engineering manager|aarhus, central denmark region, denmark|https://www.linkedin.com/jobs/view/4013909801
dtu - technical university of denmark|phd scholarship in enzyme engineering - dtu biosustain|kongens lyngby, capital region of denmark, denmark|https://www.linkedin.com/jobs/view/4014918121
liveintent, inc.|vp, data science, machine learning & identity|copenhagen, capital region of denmark, denmark|https://www.linkedin.com/jobs/view/3945822561
trustpilot|data scientist - go-to-market (gtm) applied ai team|copenhagen, capital region of denmark, denmark|https://www.linkedin.com/jobs/view/3954274465
liveintent, inc.|senior data scientist|copenhagen, capital region of denmark, denmark|https://www.linkedin.com/jobs/view/3976383101
zendesk|senior data scientist|estonia, worldwide|https://www.linkedin.com/jobs/view/4007825785
google|principal, specialized software, ai, office of the cto|helsinki, uusimaa, finland|https://www.linkedin.com/jobs/view/4000285568
unity|senior data scientist, iads|helsinki, uusimaa, finland|https://www.linkedin.com/jobs/view/4007570867
google|senior staff software engineer, cloud storage|france|https://www.linkedin.com/jobs/view/4002615017
instadeep|research scientist, deep learning for biology|paris, île-de-france, france|https://www.linkedin.com/jobs/view/3993625518
instadeep|applied research scientist, computational protein design|paris, île-de-france, france|https://www.linkedin.com/jobs/view/3927163379
voodoo|senior data scientist|paris, île-de-france, france|https://www.linkedin.com/jobs/view/3944578915
voodoo|senior data scientist - ad network|paris, île-de-france, france|https://www.linkedin.com/jobs/view/3947236865
pathway|devrel & community manager|paris, île-de-france, france|https://www.linkedin.com/jobs/view/3891666903
instadeep|machine learning engineer - computational biology|paris, île-de-france, france|https://www.linkedin.com/jobs/view/3947964410
ansys|senior build and integration devops engineer f/m|toulouse, occitanie, france|https://www.linkedin.com/jobs/view/3938781921
artefact|intern data scientist - paris|paris, île-de-france, france|https://www.linkedin.com/jobs/view/3902580709
google|modem performance analyst, pixel|ga, atlanta, worldwide|https://www.linkedin.com/jobs/view/3996461971
google|mixed method ux researcher, trust and safety ux|ga, atlanta, worldwide|https://www.linkedin.com/jobs/view/4011156880
google|research scientist, google research|ga, atlanta, worldwide|https://www.linkedin.com/jobs/view/3991641690
google|software engineer iii, machine learning, google health|ga, atlanta, worldwide|https://www.linkedin.com/jobs/view/4011900334
google|business data scientist, gtech ads|ga, atlanta, worldwide|https://www.linkedin.com/jobs/view/3996936127
google|software engineer iii, google cloud netinfra|ga, atlanta, worldwide|https://www.linkedin.com/jobs/view/3968092366
google|software engineer iii, google cloud global networking|ga, atlanta, worldwide|https://www.linkedin.com/jobs/view/4001674742
google|software engineer iii, security/privacy|ga, atlanta, worldwide|https://www.linkedin.com/jobs/view/4017409370
google|senior software engineer, google cloud global networking|ga, atlanta, worldwide|https://www.linkedin.com/jobs/view/4014506360
google|senior staff software engineer, google cloud|ga, atlanta, worldwide|https://www.linkedin.com/jobs/view/4005641389
stellar consulting solutions, llc|data scientist|ga, atlanta, worldwide|https://www.linkedin.com/jobs/view/4015039546
the home depot|distinguished data scientist (search & personalization)|ga, atlanta, worldwide|https://www.linkedin.com/jobs/view/3789769207
stellar consulting solutions, llc|senior data scientist - search|ga, atlanta, worldwide|https://www.linkedin.com/jobs/view/4011101579
the home depot|principal data scientist, online data science|ga, atlanta, worldwide|https://www.linkedin.com/jobs/view/3763052232
geotab|senior data scientist, its|ga, atlanta, worldwide|https://www.linkedin.com/jobs/view/3983309507
the home depot|principal data scientist - genai|ga, atlanta, worldwide|https://www.linkedin.com/jobs/view/3982724927
montrose environmental group|project air quality engineer/scientist|ga, sandy springs, worldwide|https://www.linkedin.com/jobs/view/3826628671
google|engineering manager, trusted partner cloud|munich, bavaria, germany|https://www.linkedin.com/jobs/view/3989268924
google|software engineer, android automotive|munich, bavaria, germany|https://www.linkedin.com/jobs/view/4002835034
google|staff software engineer, core|munich, bavaria, germany|https://www.linkedin.com/jobs/view/4015531227
lunit cancer screening|(global) senior applied research scientist|frankfurt, hesse, germany|https://www.linkedin.com/jobs/view/3883932065
jobs.de - kariera group|vertriebsleiter:in für digitale lösungen (m/w/d)|munich, bavaria, germany|https://www.linkedin.com/jobs/view/4014782598
jobs.de - kariera group|leiter:in vertriebsstrategien (m/w/d)|munich, bavaria, germany|https://www.linkedin.com/jobs/view/4014783460
yeah! global|ai engineer - germany|berlin, berlin, germany|https://www.linkedin.com/jobs/view/4011455928
coach4expats|c++ developer (phd candidates)|berlin, berlin, germany|https://www.linkedin.com/jobs/view/4011194589
