company|title|location|link
amazon|2026 applied scientist intern, amazon university talent acquisition|courbevoie, île-de-france, france|https://www.linkedin.com/jobs/view/4373969951
bigblue|data science internship - warehouse optimisation|paris, île-de-france, france|https://www.linkedin.com/jobs/view/4334828942
amazon|2026 applied scientist intern, amazon university talent acquisition|munich, bavaria, germany|https://www.linkedin.com/jobs/view/4369763629
amazon|2026 applied scientist intern, amazon university talent acquisition|berlin, berlin, germany|https://www.linkedin.com/jobs/view/4369755791
amazon|2026 applied scientist intern, amazon university talent acquisition|aachen, north rhine-westphalia, germany|https://www.linkedin.com/jobs/view/4369769443
about you|senior data scientist - search engine (all genders)|greater hamburg area, worldwide|https://www.linkedin.com/jobs/view/4401198649
taktile|software engineer intern|berlin, berlin, germany|https://www.linkedin.com/jobs/view/4342501529
amazon|2026 applied scientist intern, amazon university talent acquisition|turin, piedmont, italy|https://www.linkedin.com/jobs/view/4335966728
amazon|2026 data scientist internship , amazon university talent acquisition|luxembourg, luxembourg, luxembourg|https://www.linkedin.com/jobs/view/4345499682
amazon|2026 applied scientist intern, amazon university talent acquisition|luxembourg, luxembourg, luxembourg|https://www.linkedin.com/jobs/view/4336689485
taktile|software engineer intern|iaşi, iaşi, romania|https://www.linkedin.com/jobs/view/4318298888
tatari|data science, intern|los angeles, canada|https://www.linkedin.com/jobs/view/4374683916
amazon|2026 applied scientist intern, amazon university talent acquisition|madrid, community of madrid, spain|https://www.linkedin.com/jobs/view/4400325015
amazon|2026 applied scientist intern, amazon university talent acquisition|barcelona, catalonia, spain|https://www.linkedin.com/jobs/view/4400324136
amazon web services (aws)|2026 applied scientist intern, amazon university talent acquisition|london, england, united kingdom|https://www.linkedin.com/jobs/view/4336304822
amazon web services (aws)|2026 applied scientist intern, amazon university talent acquisition|cambridge, england, united kingdom|https://www.linkedin.com/jobs/view/4336304821
amazon web services (aws)|2026 applied scientist intern, amazon university talent acquisition|edinburgh, scotland, united kingdom|https://www.linkedin.com/jobs/view/4336145396
amazon web services (aws)|associate professional services consultant intern 2026|london, england, united kingdom|https://www.linkedin.com/jobs/view/4362332807
thomson reuters|phd research scientist intern - foundational research|london, england, united kingdom|https://www.linkedin.com/jobs/view/4373381635
deductive ai|software engineer intern, london|london, england, united kingdom|https://www.linkedin.com/jobs/view/4318516271
meta|research scientist intern, ai/ml, core ads growth (phd)|zurich, zurich, switzerland|https://www.linkedin.com/jobs/view/4350551757
meta|research scientist intern, ai/ml, core ads growth (phd)|london, england, united kingdom|https://www.linkedin.com/jobs/view/4350561859
nato|nato internship - cyber and digital transformation division (cdt)|brussels, brussels region, belgium|https://www.linkedin.com/jobs/view/4389609314
agc glass europe|data science intern - arg pricing transformation|louvain-la-neuve, walloon region, belgium|https://www.linkedin.com/jobs/view/4405256141
fujifilm biotechnologies|engineering intern for drug product manufacturing|hillerød, capital region of denmark, denmark|https://www.linkedin.com/jobs/view/4388394989
lseg|intern financial risk|paris, île-de-france, france|https://www.linkedin.com/jobs/view/4385956595
s&p global|ratings analytical intern - emea|paris, île-de-france, france|https://www.linkedin.com/jobs/view/4404471958
danone|stage - finance & tax digitalization intern - juillet 2026 - h/f|paris, île-de-france, france|https://www.linkedin.com/jobs/view/4395300359
geosyntec consultants|data scientist/artificial intelligence (ai) intern|ga, kennesaw, worldwide|https://www.linkedin.com/jobs/view/4400038492
chatgpt jobs|data engineer intern|ga, atlanta, worldwide|https://www.linkedin.com/jobs/view/4356933264
pratt industries|process improvement intern|ga, newnan, worldwide|https://www.linkedin.com/jobs/view/4401354679
clarios|intern (m/f/d) for ai and data analysis in vehicle lab|hannover, lower saxony, germany|https://www.linkedin.com/jobs/view/4359253694
pmone group|(senior) ai engineer - consultant (w/m/d)|cologne, north rhine-westphalia, germany|https://www.linkedin.com/jobs/view/4399376981
tagueri ag|talentpool - (senior) data platform architekt (m/w/d)*|hamburg, hamburg, germany|https://www.linkedin.com/jobs/view/4400703857
s&p global|ratings analytical intern - emea|frankfurt, hesse, germany|https://www.linkedin.com/jobs/view/4404470918
ki performance gmbh|cloud ai architect (m/w/d)|cologne, north rhine-westphalia, germany|https://www.linkedin.com/jobs/view/4365068769
tesla|equipment engineering internship (m/f/d) - gigafactory berlin-brandenburg|grünheide, brandenburg, germany|https://www.linkedin.com/jobs/view/4375641027
electrolux professional group|ai developer - intern|pordenone, friuli-venezia giulia, italy|https://www.linkedin.com/jobs/view/4404999077
procter & gamble|data engineer internship|rome, latium, italy|https://www.linkedin.com/jobs/view/4398834337
philip morris international|intern - project engineering|bologna, emilia-romagna, italy|https://www.linkedin.com/jobs/view/4391939370
danfoss|field system engineer internship|pessano con bornago, lombardy, italy|https://www.linkedin.com/jobs/view/4400235340
fanuc europe|intern sustainability|contern, luxembourg, luxembourg|https://www.linkedin.com/jobs/view/4390376031
caresource|caresource ai intern - r12597-71|oh, mcconnelsville, worldwide|https://www.linkedin.com/jobs/view/4402422349
caresource|caresource ai intern - r12597-86|oh, caldwell, worldwide|https://www.linkedin.com/jobs/view/4402426301
caresource|caresource ai intern - r12597-70|oh, new lexington, worldwide|https://www.linkedin.com/jobs/view/4402429209
caresource|caresource ai intern - r12597-59|oh, zanesville, worldwide|https://www.linkedin.com/jobs/view/4402425238
daf trucks nv|bachelor or master graduation assignment: paccar financial europe credit data analyst|eindhoven, north brabant, netherlands|https://www.linkedin.com/jobs/view/4402714038
devoteam|azure machine learning engineer|amsterdam, north holland, netherlands|https://www.linkedin.com/jobs/view/4376997903
zig|chief ai officer (caio)|de meern, utrecht, netherlands|https://www.linkedin.com/jobs/view/4401354064
wind mee|medior/senior sea specialist|rotterdam, south holland, netherlands|https://www.linkedin.com/jobs/view/4261492684
alcon|ai engineer intern - early careers program|warsaw, mazowieckie, poland|https://www.linkedin.com/jobs/view/4398379938
abb|data & analytics internship|cracow metropolitan area, worldwide|https://www.linkedin.com/jobs/view/4402521572
abb|data & analytics internship|cracow, małopolskie, poland|https://www.linkedin.com/jobs/view/4402588895
dhl supply chain|it data engineer intern|warsaw, mazowieckie, poland|https://www.linkedin.com/jobs/view/4387839469
bnp paribas|structured products and investment solutions - trainee|lisbon, lisbon, portugal|https://www.linkedin.com/jobs/view/4403427172
bnp paribas cib|structured products and investment solutions - trainee|lisboa, lisbon, portugal|https://www.linkedin.com/jobs/view/4388574694
hipo.ro|internship system and security management for it (tm)|ilfov, romania|https://www.linkedin.com/jobs/view/4403511442
hipo.ro|internship system and security management for it - inp sym (tm)|ilfov, romania|https://www.linkedin.com/jobs/view/4402994358
undelucram.ro|internship system and security management for it (tm)|timisoara metropolitan area, worldwide|https://www.linkedin.com/jobs/view/4402333023
undelucram.ro|internship secure connectivity solutions for it (tm)|timisoara metropolitan area, worldwide|https://www.linkedin.com/jobs/view/4402315982
hipo.ro|internship secure connectivity solutions for it (tm)|ilfov, romania|https://www.linkedin.com/jobs/view/4403491854
aumovio|internship system and security management for it (tm)|timisoara metropolitan area, worldwide|https://www.linkedin.com/jobs/view/4402916144
hipo.ro|internship secure connectivity solutions for it - inp scs (tm)|ilfov, romania|https://www.linkedin.com/jobs/view/4402981505
aumovio|internship secure connectivity solutions for it (tm)|timisoara metropolitan area, worldwide|https://www.linkedin.com/jobs/view/4402904284
niagara bottling|ai software engineer ii|diamond bar, canada|https://www.linkedin.com/jobs/view/4405485717
niagara bottling|systems development engineer i (advanced robotics & ai systems)|diamond bar, canada|https://www.linkedin.com/jobs/view/4400365525
niagara bottling|manufacturing technology engineer ii|diamond bar, canada|https://www.linkedin.com/jobs/view/4389297321
niagara bottling|automation technician iii|diamond bar, canada|https://www.linkedin.com/jobs/view/4354561861
niagara bottling|engineering technician iii|diamond bar, canada|https://www.linkedin.com/jobs/view/4402076060
niagara bottling|engineering technician iii|diamond bar, canada|https://www.linkedin.com/jobs/view/4402075115
niagara bottling|engineering technician iii|diamond bar, canada|https://www.linkedin.com/jobs/view/4395719904
niagara bottling|engineering technician iii|diamond bar, canada|https://www.linkedin.com/jobs/view/4390818806
niagara bottling|engineering technician ii|diamond bar, canada|https://www.linkedin.com/jobs/view/4393218750
smadex|ad operations intern|barcelona, catalonia, spain|https://www.linkedin.com/jobs/view/4371976257
parc taulí hospital universitari|1 cap de gestió de dades (26_47_ipv_dir_cap)|sabadell, catalonia, spain|https://www.linkedin.com/jobs/view/4392893245
verisure|procurement support intern|pozuelo de alarcón, community of madrid, spain|https://www.linkedin.com/jobs/view/4397176539
s&p global|ratings analytical intern - emea|madrid, community of madrid, spain|https://www.linkedin.com/jobs/view/4404470919
s&p global|ratings analytical intern - emea|stockholm, stockholm county, sweden|https://www.linkedin.com/jobs/view/4404494009
enersys|data engineering intern - ai/ml systems|zug, zug, switzerland|https://www.linkedin.com/jobs/view/4404208113
elca group|internship : soar automation engineer|geneva, geneva, switzerland|https://www.linkedin.com/jobs/view/4389580002
iom - un migration|intern - shelter, land and site coordination (slsc) cluster information management (im) (ug)|geneva, geneva, switzerland|https://www.linkedin.com/jobs/view/4402285590
cloudflare|dcsc automation coordinator intern|greater london, england, united kingdom|https://www.linkedin.com/jobs/view/4392760967
deutsche börse group|student - business & data operations (f/m/d)|prague, prague, worldwide|https://www.linkedin.com/jobs/view/4391878797
sap|sap ixp intern - it data & analytics|prague, prague, worldwide|https://www.linkedin.com/jobs/view/4387157334
netflix|machine learning/ai scientist intern (phd), 2026|los angeles, canada|https://www.linkedin.com/jobs/view/4312233312
global nomadic|volunteer: plants, people, and healing: discovering ecuador s amazonian ethnobotany|paris, île-de-france, france|https://www.linkedin.com/jobs/view/4398684885
amazon|deu business development intern - 12 months, amazon university talent acquisition|munich, bavaria, germany|https://www.linkedin.com/jobs/view/4364026859
amazon|deu business development intern - 6 months, amazon university talent acquisition|munich, bavaria, germany|https://www.linkedin.com/jobs/view/4359465731
amazon|program manager intern|düsseldorf, north rhine-westphalia, germany|https://www.linkedin.com/jobs/view/4405405179
amazon web services (aws)|program manager intern aws|frankfurt, hesse, germany|https://www.linkedin.com/jobs/view/4402010037
finperks|intern - founders associate (f/m/d) fintech startup (serial entrepreneurs) starting in october 2026|berlin, berlin, germany|https://www.linkedin.com/jobs/view/4399033971
global nomadic|volunteer: plants, people, and healing: discovering ecuador s amazonian ethnobotany|dublin, county dublin, ireland|https://www.linkedin.com/jobs/view/4398676966
amazon|ita business development intern - 6 months, amazon university talent acquisition|milan, lombardy, italy|https://www.linkedin.com/jobs/view/4386962489
global nomadic|volunteer: plants, people, and healing: discovering ecuador s amazonian ethnobotany|amsterdam, north holland, netherlands|https://www.linkedin.com/jobs/view/4398698022
global nomadic|volunteer: plants, people, and healing: discovering ecuador s amazonian ethnobotany|pasadena, canada|https://www.linkedin.com/jobs/view/4398684906
amazon web services (aws)|program manager intern|zaragoza, aragon, spain|https://www.linkedin.com/jobs/view/4400571694
publicis groupe españa|account director|barcelona, catalonia, spain|https://www.linkedin.com/jobs/view/4402133802
amazon|uk b.development intern - 12 months, amazon university talent acquisition|london, england, united kingdom|https://www.linkedin.com/jobs/view/4335144147
global nomadic|volunteer: plants, people, and healing: discovering ecuador s amazonian ethnobotany|london, england, united kingdom|https://www.linkedin.com/jobs/view/4398676970
global nomadic|volunteer: plants, people, and healing: discovering ecuador s amazonian ethnobotany|berlin, berlin, germany|https://www.linkedin.com/jobs/view/4398681945
global nomadic|volunteer: plants, people, and healing: discovering ecuador s amazonian ethnobotany|munich, bavaria, germany|https://www.linkedin.com/jobs/view/4398683866
capgemini|intern in the recruitment team (with german)|gdańsk, pomorskie, poland|https://www.linkedin.com/jobs/view/4401728484
leeroo|research scientist intern – phd (ai agentic systems)|london, england, united kingdom|https://www.linkedin.com/jobs/view/4270923748
lanch|portfolio analysis manager (m/w/d)|berlin, berlin, germany|https://www.linkedin.com/jobs/view/4355819539
lanch|account manager (m/w/d)|berlin, berlin, germany|https://www.linkedin.com/jobs/view/4377744685
xsens entertainment|internship sensor fusion algorithms|enschede, overijssel, netherlands|https://www.linkedin.com/jobs/view/4384488196
webtoon|[webtoon] brand & partnership marketing intern|los angeles, canada|https://www.linkedin.com/jobs/view/4398626844
acceleration community of companies (acc)|intern, acc ai lab|los angeles metropolitan area, worldwide|https://www.linkedin.com/jobs/view/4392850563
webtoon|[webtoon] content safety & policy intern|los angeles, canada|https://www.linkedin.com/jobs/view/4398635800
fever|digital assets intern|madrid, community of madrid, spain|https://www.linkedin.com/jobs/view/4399055725
fever|audiovisual assets intern|madrid, community of madrid, spain|https://www.linkedin.com/jobs/view/4399061541
amazon|ux design intern, interaction design|london, england, united kingdom|https://www.linkedin.com/jobs/view/4377860756
gen|partner sales intern (psm) – europe|prague, prague, worldwide|https://www.linkedin.com/jobs/view/4402010674
gen|partner sales intern (psm) – europe|brno, south moravia, worldwide|https://www.linkedin.com/jobs/view/4402006721
apple|cellular rf systems engineering intern – phase lock loop|linz, upper austria, austria|https://www.linkedin.com/jobs/view/4360015068
apple|software engineering intern (machine learning & ai workflows)|munich, bavaria, germany|https://www.linkedin.com/jobs/view/4393010506
apple|research scientist intern – human-centric generative ai|munich, bavaria, germany|https://www.linkedin.com/jobs/view/4360015036
apple|platform engineering intern|munich, bavaria, germany|https://www.linkedin.com/jobs/view/4359295364
apple|circuit design intern (m/f/d)|munich, bavaria, germany|https://www.linkedin.com/jobs/view/4359275107
apple|circuit design intern (m/f/d)|munich, bavaria, germany|https://www.linkedin.com/jobs/view/4359196601
apple|design for test intern (m/f/d)|munich, bavaria, germany|https://www.linkedin.com/jobs/view/4360054904
apple|6g cellular internship (m/f/d)|munich, bavaria, germany|https://www.linkedin.com/jobs/view/4359187986
apple|ams digital design intern (m/f/d)|munich, bavaria, germany|https://www.linkedin.com/jobs/view/4359225501
apple|rf datapath correction algorithms - engineering intern/co-op (m/f/d)|munich, bavaria, germany|https://www.linkedin.com/jobs/view/4359255249
apple|soc power integrity / emir intern (m/f/d)|munich, bavaria, germany|https://www.linkedin.com/jobs/view/4377908900
apple|research intern - human-centric computer vision|zurich, zurich, switzerland|https://www.linkedin.com/jobs/view/4359215311
apple|camera algorithms intern|cambridge, england, united kingdom|https://www.linkedin.com/jobs/view/4372523742
apple|soc performance modeling internship - platform architecture|london, england, united kingdom|https://www.linkedin.com/jobs/view/4360074180
google|phd outreach program manager|ga, atlanta, worldwide|https://www.linkedin.com/jobs/view/4393009637
danfoss|field system engineer internship|turin, piedmont, italy|https://www.linkedin.com/jobs/view/4399246192
caresource|caresource ai intern - r12597-69|oh, mcconnelsville, worldwide|https://www.linkedin.com/jobs/view/4402423290
caresource|caresource ai intern - r12597-89|oh, caldwell, worldwide|https://www.linkedin.com/jobs/view/4402429213
caresource|caresource ai intern - r12597-60|oh, zanesville, worldwide|https://www.linkedin.com/jobs/view/4402420555
caresource|caresource ai intern - r12597-68|oh, new lexington, worldwide|https://www.linkedin.com/jobs/view/4402432200
netflix|machine learning engineer intern, (ms/phd) 2026|los angeles, canada|https://www.linkedin.com/jobs/view/4312232372
