company|title|location|link
amazon web services (aws)|2025 applied scientist internship, amazon university talent acquisition|munich, bavaria, germany|https://www.linkedin.com/jobs/view/4048225174
amazon web services (aws)|2025 applied scientist internship, amazon university talent acquisition|berlin, berlin, germany|https://www.linkedin.com/jobs/view/4048220680
amazon web services (aws)|2025 applied scientist internship, amazon university talent acquisition|aachen, north rhine-westphalia, germany|https://www.linkedin.com/jobs/view/4262954631
bmw group|intern ai-based recommender systems (f/m/x)|munich, bavaria, germany|https://www.linkedin.com/jobs/view/4264451343
energy robotics|ai engineer working student / intern (m/f/d)|darmstadt, hesse, germany|https://www.linkedin.com/jobs/view/4264427912
joinrs|[stage - amazon] data scientist intern (stem graduate)|italy|https://www.linkedin.com/jobs/view/4279586870
amazon|2025 applied scientist internship, amazon university talent acquisition|luxembourg, luxembourg, luxembourg|https://www.linkedin.com/jobs/view/4046264809
amazon|2025 applied scientist internship, amazon university talent acquisition|amsterdam, north holland, netherlands|https://www.linkedin.com/jobs/view/4066244289
amazon web services (aws)|2025 applied scientist internship, amazon university talent acquisition|leek, groningen, netherlands|https://www.linkedin.com/jobs/view/4262084521
kyndryl|intern hbo ict: sdg|north holland, netherlands|https://www.linkedin.com/jobs/view/4267696909
amazon web services (aws)|research scientist intern, device team, aws center for quantum computing|pasadena, canada|https://www.linkedin.com/jobs/view/4255379050
amazon|2025 applied scientist internship, amazon university talent acquisition|madrid, community of madrid, spain|https://www.linkedin.com/jobs/view/4046092062
amazon|2025 applied scientist internship, amazon university talent acquisition|barcelona, catalonia, spain|https://www.linkedin.com/jobs/view/4046091208
xr solutions|backend developer intern|stockholm county, sweden|https://www.linkedin.com/jobs/view/4278807096
international air transport association (iata)|intern, data science|geneva, geneva, switzerland|https://www.linkedin.com/jobs/view/4279580008
amazon|2025 applied scientist internship, amazon university talent acquisition|london, england, united kingdom|https://www.linkedin.com/jobs/view/4040164728
amazon|2025 applied scientist internship, amazon university talent acquisition|cambridge, england, united kingdom|https://www.linkedin.com/jobs/view/4040163933
amazon|2025 applied scientist internship, amazon university talent acquisition|edinburgh, scotland, united kingdom|https://www.linkedin.com/jobs/view/4040163934
amazon|2025 data scientist internship (multiple locations), amazon university talent acquisition|london, england, united kingdom|https://www.linkedin.com/jobs/view/4244821230
deductive ai|software engineer intern, london|london, england, united kingdom|https://www.linkedin.com/jobs/view/4085602965
targetjobs uk|2025 applied scientist internship|london, england, united kingdom|https://www.linkedin.com/jobs/view/4240708751
msd czech republic|technical analyst intern - part time for a student|prague, prague, worldwide|https://www.linkedin.com/jobs/view/4278342518
bigblue|software engineer intern|paris, île-de-france, france|https://www.linkedin.com/jobs/view/3575815459
taktile|software engineer working student/intern|berlin, berlin, germany|https://www.linkedin.com/jobs/view/4205745296
intersystems italia|technical services helpdesk specialist (intern)|milan, lombardy, italy|https://www.linkedin.com/jobs/view/4277688981
the heineken company|internship - sustainable production at procurement (energy & water focus)|amsterdam, north holland, netherlands|https://www.linkedin.com/jobs/view/4268653838
bits to atoms|[fall 2025] fullstack ml intern|san francisco bay area, worldwide|https://www.linkedin.com/jobs/view/4278399866
vendra (yc s24)|full stack ml engineering intern|san francisco, canada|https://www.linkedin.com/jobs/view/4270548464
vendra (yc s24)|software engineering intern|san francisco, canada|https://www.linkedin.com/jobs/view/4270549461
sri|research intern, computational design|menlo park, canada|https://www.linkedin.com/jobs/view/4233452623
albuquerque public schools|district program intern|nm, albuquerque, worldwide|https://www.linkedin.com/jobs/view/4262752604
genbio ai|research scientist intern|paris, île-de-france, france|https://www.linkedin.com/jobs/view/4280722562
believe|data science & machine learning - platform operational excellence - stage (m/w/n)|paris, île-de-france, france|https://www.linkedin.com/jobs/view/4278249064
cybelangel|growth marketing intern|paris, île-de-france, france|https://www.linkedin.com/jobs/view/4275230344
terra one|working student or intern  (m/f/d) – data engineering|berlin, berlin, germany|https://www.linkedin.com/jobs/view/4279638573
energy robotics|robot simulation & synthetic data generation working student / intern (m/f/d)|darmstadt, hesse, germany|https://www.linkedin.com/jobs/view/4268952095
hucon ag|ingenieur (mwd) für industrielle bildverarbeitung & deep learning|ulm, baden-württemberg, germany|https://www.linkedin.com/jobs/view/4266186763
msci inc.|data science intern|budapest, budapest, hungary|https://www.linkedin.com/jobs/view/4255816158
subito|junior digital advertising intern|milan, lombardy, italy|https://www.linkedin.com/jobs/view/4251658694
skilllab|data science internship|amsterdam, north holland, netherlands|https://www.linkedin.com/jobs/view/4267064220
ups|information technology internship|eindhoven, north brabant, netherlands|https://www.linkedin.com/jobs/view/4242248653
ups|information technology internship|eindhoven, north brabant, netherlands|https://www.linkedin.com/jobs/view/4242248278
accenture the netherlands|data science / machine learning engineering graduation internship|amsterdam, north holland, netherlands|https://www.linkedin.com/jobs/view/4260603391
bolder group|data engineering, hubspot analysis & ai implementation intern|amsterdam, north holland, netherlands|https://www.linkedin.com/jobs/view/4266389709
wind mee|medior/senior sea specialist|rotterdam, south holland, netherlands|https://www.linkedin.com/jobs/view/4261492684
surplusmap|internship data engineer|oslo, oslo, norway|https://www.linkedin.com/jobs/view/4226127074
air space intelligence|internship - software engineer|gdańsk, pomorskie, poland|https://www.linkedin.com/jobs/view/4214759554
employability ltd|software engineer/site reliability engineer internship|warsaw, mazowieckie, poland|https://www.linkedin.com/jobs/view/4279602460
smadex|machine learning intern|barcelona, catalonia, spain|https://www.linkedin.com/jobs/view/4261139588
carrots|data scientist intern|barcelona, catalonia, spain|https://www.linkedin.com/jobs/view/4279580819
adsmurai|copywriter creativo intern (they/he/she)|barcelona, catalonia, spain|https://www.linkedin.com/jobs/view/4274312775
geotab|marketing intern (bilingual french)|madrid, community of madrid, spain|https://www.linkedin.com/jobs/view/4236258581
adsmurai|video editor / filmmaker intern (they/he/she)|barcelona, catalonia, spain|https://www.linkedin.com/jobs/view/4259176989
cradle|software engineering/machine learning intern (f/m/*)|zurich, zurich, switzerland|https://www.linkedin.com/jobs/view/4243585036
insider.|digital sales development representative intern|istanbul, istanbul, worldwide|https://www.linkedin.com/jobs/view/4200201475
instadeep|phd research engineer intern - active learning for molecular modelling|london, england, united kingdom|https://www.linkedin.com/jobs/view/4277244982
instadeep|phd research engineer intern - language models for biological sequences|london, england, united kingdom|https://www.linkedin.com/jobs/view/4226661014
m365connect|ai content & copywriting internship|vienna, vienna, austria|https://www.linkedin.com/jobs/view/4256720971
delen private bank|ml engineer – ai team - kantoor antwerpen|antwerp metropolitan area, worldwide|https://www.linkedin.com/jobs/view/4277612975
delaware belux|marketing intern|ghent metropolitan area, worldwide|https://www.linkedin.com/jobs/view/4273916014
qevlar ai|software engineer intern (m/f/d)|paris, île-de-france, france|https://www.linkedin.com/jobs/view/4258626486
protiviti|atlanta technology consulting intern - 2026|ga, atlanta, worldwide|https://www.linkedin.com/jobs/view/4051082997
simon-kucher|summer 2026 intern - americas division [ug/masters]|ga, atlanta, worldwide|https://www.linkedin.com/jobs/view/4271738666
price industries|intern - manufacturing engineer - fall 2025|ga, suwanee, worldwide|https://www.linkedin.com/jobs/view/4260284151
battelle|skillbridge - network security analyst|ga, augusta, worldwide|https://www.linkedin.com/jobs/view/4278027484
lufthansa|internship data science in data and analytics department|frankfurt, hesse, germany|https://www.linkedin.com/jobs/view/4268350982
hahn-schickard|masterarbeit (m/w/d) ki-analyse von ultraschall-emissionen v. pflanzen|villingen-schwenningen, baden-württemberg, germany|https://www.linkedin.com/jobs/view/4266684508
m365connect|ai content & copywriting internship|cologne, north rhine-westphalia, germany|https://www.linkedin.com/jobs/view/4256719931
m365connect|ai content & copywriting internship|hamburg, hamburg, germany|https://www.linkedin.com/jobs/view/4256720963
genoverband e.v.|expert - ki consulting (m/w/d)|neu-isenburg, hesse, germany|https://www.linkedin.com/jobs/view/4261776302
peraton|social scientist - stuttgart, germany - dod ts/sci|stuttgart region, worldwide|https://www.linkedin.com/jobs/view/4256329675
genoverband e.v.|(senior) expert - künstliche intelligenz (m/w/d)|neu-isenburg, hesse, germany|https://www.linkedin.com/jobs/view/4259995038
mission technologies, a division of hii|logistics technician (skillbridge intern) - 22873|naples, campania, italy|https://www.linkedin.com/jobs/view/4245301026
pwc luxembourg|intern reinsurance business analyst (m/f/d)|luxembourg|https://www.linkedin.com/jobs/view/4161946665
iquality|afstudeeropdracht security testing ai|nijmegen, gelderland, netherlands|https://www.linkedin.com/jobs/view/4094005116
van lanschot kempen|ai-driven network monitoring and troubleshooting internship(en)|amsterdam, north holland, netherlands|https://www.linkedin.com/jobs/view/4271681196
haskoning|internship: ai in supply chain management|amersfoort, utrecht, netherlands|https://www.linkedin.com/jobs/view/4198342379
haskoning|internship: ai in supply chain management|amersfoort, utrecht, netherlands|https://www.linkedin.com/jobs/view/4198338893
diakonessenhuis|data scientist|utrecht, netherlands|https://www.linkedin.com/jobs/view/4272166467
m365connect|ai content & copywriting internship|lisbon, lisbon, portugal|https://www.linkedin.com/jobs/view/4256720966
ibm|ibm internship data science|bucharest, bucharest, romania|https://www.linkedin.com/jobs/view/4253304855
ibm|ibm internship data science|cluj-napoca, cluj, romania|https://www.linkedin.com/jobs/view/4253307765
ibm|ibm internship data science|timişoara, timiş, romania|https://www.linkedin.com/jobs/view/4253306806
microsoft|data science: internship opportunities – redmond|wa, redmond, worldwide|https://www.linkedin.com/jobs/view/4280819032
gptzero|machine learning intern|ny, new york, worldwide|https://www.linkedin.com/jobs/view/4273808833
rand technology|ai specialist intern|irvine, canada|https://www.linkedin.com/jobs/view/4246610721
lensa|r&d data scientist intern|brea, canada|https://www.linkedin.com/jobs/view/4280906033
lensa|data analyst intern|fl, tallahassee, worldwide|https://www.linkedin.com/jobs/view/4280904366
rippling|machine learning engineer intern - winter 2026|san francisco, canada|https://www.linkedin.com/jobs/view/4243698131
ormco|r&d data scientist intern|brea, canada|https://www.linkedin.com/jobs/view/4244218720
terrafuse ai|geospatial data scientist (research fellow or part-time consultant)|san francisco, canada|https://www.linkedin.com/jobs/view/4252851297
canvas|test engineering intern|san francisco, canada|https://www.linkedin.com/jobs/view/4268108254
protiviti|chicago technology consulting intern - 2026|chicago, israel|https://www.linkedin.com/jobs/view/4051083845
protiviti|phoenix technology consulting intern - 2026|az, phoenix, worldwide|https://www.linkedin.com/jobs/view/4051081968
undp careers|geospatial sciences internship|ks, home, worldwide|https://www.linkedin.com/jobs/view/4271430688
protiviti|dallas technology consulting intern - 2026|tx, dallas, worldwide|https://www.linkedin.com/jobs/view/4051083850
readyone industries|engineering intern university student|tx, el paso, worldwide|https://www.linkedin.com/jobs/view/4280516379
undp in the arab states region|geospatial sciences internship|ks, home, worldwide|https://www.linkedin.com/jobs/view/4270725772
stress engineering services, inc.|legal technology intern|tx, houston, worldwide|https://www.linkedin.com/jobs/view/4277902427
m365connect|ai content & copywriting internship|los angeles, canada|https://www.linkedin.com/jobs/view/4256724448
protiviti|los angeles technology consulting intern - 2026|los angeles, canada|https://www.linkedin.com/jobs/view/4051187042
ferrovial|ai engineer internship|madrid, community of madrid, spain|https://www.linkedin.com/jobs/view/4281423950
smadex|data analyst intern|barcelona, catalonia, spain|https://www.linkedin.com/jobs/view/4235213675
tomtom|data scientist intern - madrid|madrid, community of madrid, spain|https://www.linkedin.com/jobs/view/4243333012
verisure|procurement & compliance intern|pozuelo de alarcón, community of madrid, spain|https://www.linkedin.com/jobs/view/4278212924
m365connect|ai content & copywriting internship|zurich, zurich, switzerland|https://www.linkedin.com/jobs/view/4256721939
tietalent|senior data consultant|basel, switzerland|https://www.linkedin.com/jobs/view/4167585239
rapsodo|people & culture intern|i̇zmir, i̇zmir, worldwide|https://www.linkedin.com/jobs/view/4237727588
opella|demand forecasting long term intern|greater istanbul, worldwide|https://www.linkedin.com/jobs/view/4262408500
ezpada|cloud automation & ai (3-months internship, possible to prolong)|czechia, prague, worldwide|https://www.linkedin.com/jobs/view/4277386652
ab inbev|data engineer intern|czechia, prague, worldwide|https://www.linkedin.com/jobs/view/4192092687
analytics vidhya|content writer intern|gurugram, haryana, india|https://www.linkedin.com/jobs/view/4280540251
netflix|machine learning intern, fall 2025|los gatos, canada|https://www.linkedin.com/jobs/view/4212084336
global nomadic|volunteer: plants, people, and healing: discovering ecuador s amazonian ethnobotany|paris, île-de-france, france|https://www.linkedin.com/jobs/view/4218853514
amazon web services (aws)|2025 software development engineer intern - embedded development (m/w/d)|berlin, germany|https://www.linkedin.com/jobs/view/4147788039
global nomadic|volunteer: plants, people, and healing: discovering ecuador s amazonian ethnobotany|munich, bavaria, germany|https://www.linkedin.com/jobs/view/3803763516
global nomadic|volunteer: plants, people, and healing: discovering ecuador s amazonian ethnobotany|berlin, berlin, germany|https://www.linkedin.com/jobs/view/4218847919
global nomadic|volunteer: plants, people, and healing: discovering ecuador s amazonian ethnobotany|dublin, county dublin, ireland|https://www.linkedin.com/jobs/view/4005628834
global nomadic|volunteer: plants, people, and healing: discovering ecuador s amazonian ethnobotany|amsterdam, north holland, netherlands|https://www.linkedin.com/jobs/view/3803761709
amazon|2025 applied scientist internship, amazon university talent acquisition|will county, israel|https://www.linkedin.com/jobs/view/4040220314
amazon|2026 applied science internship - gen ai & large language models - united states, phd student science recruiting|wa, seattle, worldwide|https://www.linkedin.com/jobs/view/4278530278
amazon|2026 applied science internship - recommender systems/ information retrieval (machine learning) - united states, phd student science recruiting|wa, seattle, worldwide|https://www.linkedin.com/jobs/view/4279039524
amazon|2026 applied science internship - computer vision - united states, phd student science recruiting|wa, seattle, worldwide|https://www.linkedin.com/jobs/view/4279043111
amazon|2026 applied science internship - information & knowledge management (machine learning) - united states, phd student science recruiting|wa, seattle, worldwide|https://www.linkedin.com/jobs/view/4279920456
amazon|2026 applied science internship - united states, phd student science recruiting, frontier ai & robotics|san francisco, canada|https://www.linkedin.com/jobs/view/4280479032
amazon|2026 applied science internship - united states, phd student science recruiting, frontier ai & robotics|wa, seattle, worldwide|https://www.linkedin.com/jobs/view/4280472714
mygwork - lgbtq+ business community|2026 applied science internship - computer vision - united states, phd student science recruiting|wa, seattle, worldwide|https://www.linkedin.com/jobs/view/4278861563
front row|video intern, digital marketing - consumer|san diego, canada|https://www.linkedin.com/jobs/view/4273391250
global nomadic|volunteer: plants, people, and healing: discovering ecuador s amazonian ethnobotany|pasadena, canada|https://www.linkedin.com/jobs/view/3803759800
global nomadic|volunteer: plants, people, and healing: discovering ecuador s amazonian ethnobotany|london, england, united kingdom|https://www.linkedin.com/jobs/view/4218852585
precis|digital marketing internship|copenhagen metropolitan area, worldwide|https://www.linkedin.com/jobs/view/4206590745
upflow|data analyst intern|paris, île-de-france, france|https://www.linkedin.com/jobs/view/4224025499
infomotion gmbh|ai principal consultant (m/w/d)|cologne, north rhine-westphalia, germany|https://www.linkedin.com/jobs/view/4264582896
zero100|research intern|london, england, united kingdom|https://www.linkedin.com/jobs/view/4277841842
accor|digital communications intern|issy-les-moulineaux, île-de-france, france|https://www.linkedin.com/jobs/view/4265330210
l'oréal|stage de 6 mois – digital, e-commerce and innovation – janvier 2026|paris, île-de-france, france|https://www.linkedin.com/jobs/view/4278567504
döhlergroup|sales & market insights intern|ga, cartersville, worldwide|https://www.linkedin.com/jobs/view/4244974037
protiviti|atlanta business performance improvement intern - 2026|ga, atlanta, worldwide|https://www.linkedin.com/jobs/view/4051087022
wtw|early careers: intern conversion only - corporate risk and broking graduate development program analyst – broking- 2026|ga, atlanta, worldwide|https://www.linkedin.com/jobs/view/4280974733
protiviti|atlanta internal audit and financial advisory intern - 2026|ga, atlanta, worldwide|https://www.linkedin.com/jobs/view/4051088000
tozero|strategy finance intern (m/f/x)  climate tech startup|karlsfeld, bavaria, germany|https://www.linkedin.com/jobs/view/4277399772
altman solon|strategy consulting intern tmt (m/f/d)|munich, bavaria, germany|https://www.linkedin.com/jobs/view/4209798893
tozero|strategy finance intern (m/f/x)  climate tech startup|karlsfeld, bavaria, germany|https://www.linkedin.com/jobs/view/4277704629
teamviewer|work student, product strategy (all genders)|munich, bavaria, germany|https://www.linkedin.com/jobs/view/4258019284
teamviewer|work student, product strategy (all genders)|karlsruhe, baden-württemberg, germany|https://www.linkedin.com/jobs/view/4258020164
teamviewer|work student, product strategy (all genders)|göppingen, baden-württemberg, germany|https://www.linkedin.com/jobs/view/4229144413
alaika advisory|working student - workspace management & executive support (f/m/d)|munich, bavaria, germany|https://www.linkedin.com/jobs/view/4224553771
sap|working student (f/m/d): global treasury|walldorf, baden-württemberg, germany|https://www.linkedin.com/jobs/view/4280088331
threenitas|office admin & accounting (internship)|valtetsi, peloponnese, greece|https://www.linkedin.com/jobs/view/4278526130
exxonmobil|marine claims intern|budapest, budapest, hungary|https://www.linkedin.com/jobs/view/4261490714
altman solon|strategy consulting intern tmt (m/f/d)|milan, lombardy, italy|https://www.linkedin.com/jobs/view/4060234049
avanade|intern business analyst_software engineering|rome, latium, italy|https://www.linkedin.com/jobs/view/4280316580
always friday|event specialist intern - curricular internship|milan, lombardy, italy|https://www.linkedin.com/jobs/view/4268536399
avanade|ui/ux designer - stage|milan, lombardy, italy|https://www.linkedin.com/jobs/view/4223732550
avanade|intern scm business analyst - erp microsoft dynamics 365|turin, piedmont, italy|https://www.linkedin.com/jobs/view/4201260579
avanade|intern scm business analyst - erp microsoft dynamics 365|milan, lombardy, italy|https://www.linkedin.com/jobs/view/4201257929
avanade|intern finance business analyst - erp microsoft dynamics 365|milan, lombardy, italy|https://www.linkedin.com/jobs/view/4215833492
avanade|organizational change management_intern|milan, lombardy, italy|https://www.linkedin.com/jobs/view/4274327145
avanade|intern scm business analyst - erp microsoft dynamics 365|naples, campania, italy|https://www.linkedin.com/jobs/view/4260942189
chiesi group|intern - r&d planning & control jr analyst|parma, emilia-romagna, italy|https://www.linkedin.com/jobs/view/4266950774
intercept|intern - technical support/customer care (cloud & azure)|zwolle, overijssel, netherlands|https://www.linkedin.com/jobs/view/4264344801
boehringer ingelheim|digital marketing & communications internship|amsterdam, north holland, netherlands|https://www.linkedin.com/jobs/view/4278547955
catawiki|communications intern|the randstad, netherlands|https://www.linkedin.com/jobs/view/4256493351
element solutions inc|hr intern|naarden, north holland, netherlands|https://www.linkedin.com/jobs/view/4271327138
altman solon|strategy consulting intern tmt (m/f/d)|warsaw, mazowieckie, poland|https://www.linkedin.com/jobs/view/4173606772
deutsche bank|corporate coverage intern|lisbon, lisbon, portugal|https://www.linkedin.com/jobs/view/4229119582
avanade|professional internship in crm (customer relationship management)|lisboa, lisbon, portugal|https://www.linkedin.com/jobs/view/4255248703
avanade|professional internship in crm-hub (customer relationship management)|lisboa, lisbon, portugal|https://www.linkedin.com/jobs/view/4271372447
avanade|professional internship in data analytics with french|lisboa, lisbon, portugal|https://www.linkedin.com/jobs/view/4258777310
boston consulting group (bcg)|hr recruiting intern - emesa region|lisbon, lisbon, portugal|https://www.linkedin.com/jobs/view/4235481119
flow|senior full stack data scientist intern (august 2025 start)|tx, austin, worldwide|https://www.linkedin.com/jobs/view/4278867332
studio71, lp|social platform development snap internship fall 25'|beverly hills, canada|https://www.linkedin.com/jobs/view/4275013422
studio71, lp|social platform development facebook intern fall 25'|beverly hills, canada|https://www.linkedin.com/jobs/view/4275014375
protiviti|san francisco technology consulting intern - 2026|san francisco, canada|https://www.linkedin.com/jobs/view/4051183361
ebizcharge|senior ai developer|irvine, canada|https://www.linkedin.com/jobs/view/4261047806
simon-kucher|summer 2026 intern - americas division [ug/masters]|san carlos, canada|https://www.linkedin.com/jobs/view/4271737792
simon-kucher|summer 2026 intern - healthcare & life sciences division [ug/ms]|ny, new york, worldwide|https://www.linkedin.com/jobs/view/4271736987
wtw|early careers: intern conversion only - corporate risk and broking graduate development program -multicultural client management - 2026|ny, new york, worldwide|https://www.linkedin.com/jobs/view/4281442198
baird|internship – equity research analyst (summer 2026)|wi, milwaukee, worldwide|https://www.linkedin.com/jobs/view/4242954618
live nation entertainment|fall 2025 intern - latin marketing (distribution)|ny, new york, worldwide|https://www.linkedin.com/jobs/view/4275253505
simon-kucher|summer 2026 intern - healthcare & life sciences division [ug/ms]|san francisco, canada|https://www.linkedin.com/jobs/view/4271739633
aecom|engineering intern|nc, raleigh, worldwide|https://www.linkedin.com/jobs/view/4242971144
simon-kucher|summer 2026 intern - americas division [ug/masters]|chicago, israel|https://www.linkedin.com/jobs/view/4271740570
daktronics|motion artist intern|sd, home, worldwide|https://www.linkedin.com/jobs/view/4278988379
peraton|sharepoint developer|va, arlington, worldwide|https://www.linkedin.com/jobs/view/4280899819
protiviti|los angeles business performance improvement intern - 2026|los angeles, canada|https://www.linkedin.com/jobs/view/4051181781
protiviti|los angeles risk and compliance intern - 2026|los angeles, canada|https://www.linkedin.com/jobs/view/4051183360
protiviti|los angeles internal audit and financial advisory intern - 2026|los angeles, canada|https://www.linkedin.com/jobs/view/4051187045
sap|intern - product associate|bratislava, bratislava, worldwide|https://www.linkedin.com/jobs/view/4272067310
verisure|learning & development intern|pozuelo de alarcón, community of madrid, spain|https://www.linkedin.com/jobs/view/4273891962
loewe|wholesale business performance internship|madrid, community of madrid, spain|https://www.linkedin.com/jobs/view/4261909118
verisure|group operations strategy intern|pozuelo de alarcón, community of madrid, spain|https://www.linkedin.com/jobs/view/4273897614
verisure|group operations strategy intern|pozuelo de alarcón, community of madrid, spain|https://www.linkedin.com/jobs/view/4261410175
ge vernova|commissioning documentation intern|barcelona, catalonia, spain|https://www.linkedin.com/jobs/view/4278636266
