company|title|location|link
microsoft|software engineering student worker opportunities|region zealand, denmark|https://www.linkedin.com/jobs/view/4311165392
databricks|software engineering intern (2026 start) - aarhus|aarhus, central denmark region, denmark|https://www.linkedin.com/jobs/view/4297752014
nova founders capital|internship volunteer|copenhagen, capital region of denmark, denmark|https://www.linkedin.com/jobs/view/4225338192
ultrasoc|project management student intern|rom by, central denmark region, denmark|https://www.linkedin.com/jobs/view/4315369350
undp careers|business operations internship|copenhagen, capital region of denmark, denmark|https://www.linkedin.com/jobs/view/4304132052
devoteam|junior strategy consultant for ai transformation|copenhagen municipality, capital region of denmark, denmark|https://www.linkedin.com/jobs/view/4309749733
performativ - wealth management software|[paid student job] founder's associate in vc-funded fintech scaleup|copenhagen municipality, capital region of denmark, denmark|https://www.linkedin.com/jobs/view/4304055989
microsoft|software engineering student worker opportunities|central denmark region, denmark|https://www.linkedin.com/jobs/view/4311159592
ungdommens røde kors aalborg|do you want to use and develop your communication skills and help others?
røde kors|stenlille, region zealand, denmark|https://www.linkedin.com/jobs/view/4302067661
