company|title|location|link
thomson reuters|applied research intern|london, england, united kingdom|https://www.linkedin.com/jobs/view/4195191557
app science®|data science intern|los angeles metropolitan area, worldwide|https://www.linkedin.com/jobs/view/4214640477
meta|research scientist intern, language generative ai|london, england, united kingdom|https://www.linkedin.com/jobs/view/4181334949
pros|machine learning engineering intern|bulgaria, sofia city, worldwide|https://www.linkedin.com/jobs/view/4203302835
accenture the netherlands|data science / machine learning engineering graduation internship|amsterdam, north holland, netherlands|https://www.linkedin.com/jobs/view/4216608265
moloco|data science intern|london, england, united kingdom|https://www.linkedin.com/jobs/view/4168499746
anna money|data science intern cardiff|cardiff, wales, united kingdom|https://www.linkedin.com/jobs/view/4089520748
ups|supply chain network optimization intern|ga, alpharetta, worldwide|https://www.linkedin.com/jobs/view/4208282367
constructor tech|hr intern|bremen, bremen, germany|https://www.linkedin.com/jobs/view/4161565456
smadex|sales operations internship|barcelona, catalonia, spain|https://www.linkedin.com/jobs/view/4209820053
bellevue asset management|internship multi asset solutions / quantitative analyst|zurich, zurich, switzerland|https://www.linkedin.com/jobs/view/4215365872
tietalent|senior data engineering consultant|basel, switzerland|https://www.linkedin.com/jobs/view/4209858800
tietalent|senior data consultant|basel, switzerland|https://www.linkedin.com/jobs/view/4167585239
amazon|applied science internship, amazon university talent acquisition|graz, styria, austria|https://www.linkedin.com/jobs/view/4168648019
amazon|2025 applied scientist internship, amazon university talent acquisition, amazon university talent acquisition|paris, île-de-france, france|https://www.linkedin.com/jobs/view/4160554807
amazon web services (aws)|2025 software development engineer intern - machine learning (m/w/d)|berlin, germany|https://www.linkedin.com/jobs/view/4077929852
amazon web services (aws)|2025 software development engineer intern - embedded development (m/w/d)|berlin, germany|https://www.linkedin.com/jobs/view/4147788039
amazon web services (aws)|2025 software development engineer intern - embedded development (m/w/d)|dresden, saxony, germany|https://www.linkedin.com/jobs/view/4161596934
amazon web services (aws)|2025 applied scientist internship, amazon university talent acquisition|munich, bavaria, germany|https://www.linkedin.com/jobs/view/4048225174
amazon web services (aws)|2025 applied scientist internship, amazon university talent acquisition|berlin, berlin, germany|https://www.linkedin.com/jobs/view/4048220680
amazon web services (aws)|2025 applied scientist internship, amazon university talent acquisition|aachen, north rhine-westphalia, germany|https://www.linkedin.com/jobs/view/4111217670
infomotion gmbh|ai principal consultant (m/w/d)|frankfurt rhine-main metropolitan area, worldwide|https://www.linkedin.com/jobs/view/4208605719
amazon|mba program - launch summer internship , student programs|luxembourg, luxembourg, luxembourg|https://www.linkedin.com/jobs/view/4182424425
amazon|launch mba internship - luxembourg, amazon university talent acquisition|luxembourg, luxembourg, luxembourg|https://www.linkedin.com/jobs/view/4137558735
amazon|launch mba internship in germany, student programs|luxembourg, luxembourg, luxembourg|https://www.linkedin.com/jobs/view/4135668461
amazon|2025 applied scientist internship, amazon university talent acquisition|luxembourg, luxembourg, luxembourg|https://www.linkedin.com/jobs/view/4046264809
amazon|2025 applied scientist internship, amazon university talent acquisition|amsterdam, north holland, netherlands|https://www.linkedin.com/jobs/view/4066244289
amazon web services (aws)|2025 applied scientist internship, amazon university talent acquisition|leek, groningen, netherlands|https://www.linkedin.com/jobs/view/4213752450
amazon|2025 software development engineer intern - embedded development|madrid, community of madrid, spain|https://www.linkedin.com/jobs/view/4071890759
amazon|2025 applied scientist internship, amazon university talent acquisition|madrid, community of madrid, spain|https://www.linkedin.com/jobs/view/4046092062
amazon|2025 applied scientist internship, amazon university talent acquisition|barcelona, catalonia, spain|https://www.linkedin.com/jobs/view/4046091208
amazon|2025 software development engineer intern - embedded development|london, england, united kingdom|https://www.linkedin.com/jobs/view/4069891911
amazon|2025 software development engineer intern - embedded development|cambridge, england, united kingdom|https://www.linkedin.com/jobs/view/4069890890
amazon|2025 applied scientist internship, amazon university talent acquisition|london, england, united kingdom|https://www.linkedin.com/jobs/view/4040164728
amazon|2025 applied scientist internship, amazon university talent acquisition|cambridge, england, united kingdom|https://www.linkedin.com/jobs/view/4040163933
amazon|2025 applied scientist internship, amazon university talent acquisition|edinburgh, scotland, united kingdom|https://www.linkedin.com/jobs/view/4040163934
rival|phd research intern, ai-powered 2d-to-3d video conversion|london, england, united kingdom|https://www.linkedin.com/jobs/view/4210649723
make|ai software engineer intern|prague, prague, worldwide|https://www.linkedin.com/jobs/view/4203374349
research|(intern) business development in ml - german speaking, d/f/m|germany|https://www.linkedin.com/jobs/view/4214784020
taktile|software engineer working student/intern|berlin, berlin, germany|https://www.linkedin.com/jobs/view/4205745296
silicon austria labs (sal)|internship – inverse photonics design for nonlinear meta-optics (all genders) // job-id: 184-0|villach, carinthia, austria|https://www.linkedin.com/jobs/view/4200882303
samsung electronics uk|intern researcher in computer vision and machine learning|cambridge, england, united kingdom|https://www.linkedin.com/jobs/view/4173978396
genbio ai|research scientist intern|paris, île-de-france, france|https://www.linkedin.com/jobs/view/4219251440
tchibo|praktikum data science marketing analytics & customer insights (m/w/d)|hamburg, hamburg, germany|https://www.linkedin.com/jobs/view/4183851489
oracle|intern as ai engineer - part time for student|budapest, budapest, hungary|https://www.linkedin.com/jobs/view/4184199303
xomnia|machine learning engineer|amsterdam, north holland, netherlands|https://www.linkedin.com/jobs/view/4198857360
cloudflare|data scientist intern, business intelligence (summer 2025)|lisbon, portugal|https://www.linkedin.com/jobs/view/4118852088
veridion|software engineering intern – deeptech|bucharest metropolitan area, worldwide|https://www.linkedin.com/jobs/view/4190699662
instadeep|research engineer intern - applied reinforcement learning (deeppcb)|london, england, united kingdom|https://www.linkedin.com/jobs/view/4169981899
instadeep|research intern, machine learning for biology|london, england, united kingdom|https://www.linkedin.com/jobs/view/4145953788
niantic, inc.|2025 r&d software engineering intern (phd, publishing)|london, england, united kingdom|https://www.linkedin.com/jobs/view/4193271143
instadeep|research engineer intern in bioai|london, england, united kingdom|https://www.linkedin.com/jobs/view/4199860972
instadeep|research intern, generative ai (multimodal foundation models)|london, england, united kingdom|https://www.linkedin.com/jobs/view/4145958082
nokia|internship – data-driven 6g radio access solutions: learning from system level simulations|massy, île-de-france, france|https://www.linkedin.com/jobs/view/4119572514
avanade|praktikant full stack development (w/m/x)|vienna, vienna, austria|https://www.linkedin.com/jobs/view/4201255989
axa|internship  data scientist september 2025|paris, île-de-france, france|https://www.linkedin.com/jobs/view/4210914203
danone|apprenticeship - danone communities - september 2025 (h/f)|paris, île-de-france, france|https://www.linkedin.com/jobs/view/4210658757
kennesaw state university|research intern|ga, kennesaw, worldwide|https://www.linkedin.com/jobs/view/4213119451
microsoft|research engineering intern|berlin, berlin, germany|https://www.linkedin.com/jobs/view/4200548473
audi ag|praktikum - applikation ottomoren - konventioneller antrieb / hybrid (w/m/d)|ingolstadt, bavaria, germany|https://www.linkedin.com/jobs/view/4159070669
hahn-schickard|masterarbeit (m/w/d) ki-analyse von ultraschall-emissionen v. pflanzen|villingen-schwenningen, baden-württemberg, germany|https://www.linkedin.com/jobs/view/4200284877
trost progress|artificial intelligence specialist|stuttgart, baden-württemberg, germany|https://www.linkedin.com/jobs/view/4219105862
audi ag|praktikum - data science in der supply chain (w/m/d)|neckarsulm, baden-württemberg, germany|https://www.linkedin.com/jobs/view/4213535236
martinrea international|praktika / projekt- /bachelor- / masterarbeiten im bereich advanced technologies mit dem schwerpunkt „gießerei 4.0“ (m/w/d)|meschede, north rhine-westphalia, germany|https://www.linkedin.com/jobs/view/4103461343
halvotec group|ai consultant (m/w/d)|raubling, bavaria, germany|https://www.linkedin.com/jobs/view/4212061148
altman solon|strategy consulting intern tmt (m/f/d)|munich, bavaria, germany|https://www.linkedin.com/jobs/view/4209798893
konzern versicherungskammer|praktikant (d/w/m) im portfolio management aktien/multi-asset|munich, bavaria, germany|https://www.linkedin.com/jobs/view/4206901943
electrolux professional türkiye|junior ai developer - intern|pordenone, friuli-venezia giulia, italy|https://www.linkedin.com/jobs/view/4211135509
altman solon|strategy consulting intern tmt (m/f/d)|milan, lombardy, italy|https://www.linkedin.com/jobs/view/4060234049
kesko senukai lithuania|artificial intelligence programming intern|kaunas, kaunas, worldwide|https://www.linkedin.com/jobs/view/4211597882
national bank of moldova|economist coordonator al direcției cercetări economice|chişinău, chișinău, worldwide|https://www.linkedin.com/jobs/view/4211712263
microsoft|research engineering intern|amsterdam, north holland, netherlands|https://www.linkedin.com/jobs/view/4200552044
asml|optomechanics internship: investigate and develop tolerance analysis methods|eindhoven, north brabant, netherlands|https://www.linkedin.com/jobs/view/4204283088
microsoft power platform community|research engineering intern|amsterdam, north holland, netherlands|https://www.linkedin.com/jobs/view/4198805400
tno|data scientist|utrecht, utrecht, netherlands|https://www.linkedin.com/jobs/view/4219854069
altman solon|strategy consulting intern tmt (m/f/d)|warsaw, mazowieckie, poland|https://www.linkedin.com/jobs/view/4173606772
avanade|professional internship in data analytics|lisboa, lisbon, portugal|https://www.linkedin.com/jobs/view/4201260590
avanade|intern, data engineering - june 2025|los angeles, canada|https://www.linkedin.com/jobs/view/4202018391
cushman & wakefield|intern|los angeles, canada|https://www.linkedin.com/jobs/view/4219382204
mn8 energy|performance intern|madrid, community of madrid, spain|https://www.linkedin.com/jobs/view/4198863868
crypto finance group|strategy & projects internship (80 -100 percent) - 3 months|zurich, zurich, switzerland|https://www.linkedin.com/jobs/view/4204884214
altman solon|strategy consulting intern tmt (m/f/d)|zurich, zurich, switzerland|https://www.linkedin.com/jobs/view/4060235028
microsoft|research engineering intern|cambridge, england, united kingdom|https://www.linkedin.com/jobs/view/4200546767
sap|sap ixp finance intern - ai exploration and learning initiatives - global controlling|prague, prague, worldwide|https://www.linkedin.com/jobs/view/4217808587
bigblue|software engineer intern|paris, île-de-france, france|https://www.linkedin.com/jobs/view/3575815459
jus mundi|internship in legaltech – jus ai arbitration legal expert intern (6 months)|paris, île-de-france, france|https://www.linkedin.com/jobs/view/4207361544
motorschadenvergleich.de|software-entwicklung & it - trainee / quereinsteiger / praktiktum|mittelhof, rhineland-palatinate, germany|https://www.linkedin.com/jobs/view/4216081771
amazon web services (aws)|2025 software development engineer intern - databases (m/w/d)|berlin, germany|https://www.linkedin.com/jobs/view/4145088413
amazon|2025 software dev engineer intern - ireland|dublin, county dublin, ireland|https://www.linkedin.com/jobs/view/4023782082
amazon|2025 software development engineer intern - embedded development|warsaw, mazowieckie, poland|https://www.linkedin.com/jobs/view/4143636180
amazon|2025 software development engineer intern - embedded development|gdańsk, pomorskie, poland|https://www.linkedin.com/jobs/view/4143633676
precisely|software development, intern|bielsko-biała, śląskie, poland|https://www.linkedin.com/jobs/view/4198013944
precisely|software engineer, intern|bielsko-biała, śląskie, poland|https://www.linkedin.com/jobs/view/4198014768
amazing auctane|software engineer intern|zielona góra, lubuskie, poland|https://www.linkedin.com/jobs/view/4143013253
signify|global digital marketing intern|madrid, community of madrid, spain|https://www.linkedin.com/jobs/view/4208436741
signify lighting academy|global digital marketing intern|madrid, community of madrid, spain|https://www.linkedin.com/jobs/view/4215846454
amazon|2025 software dev engineer intern - uk|london, england, united kingdom|https://www.linkedin.com/jobs/view/4188981625
amazon|2025 software dev engineer intern - uk|cambridge, england, united kingdom|https://www.linkedin.com/jobs/view/4188979801
amazon|2025 software dev engineer intern - uk|edinburgh, scotland, united kingdom|https://www.linkedin.com/jobs/view/4188979802
threecolts|ai innovation internship program – summer 2025|london, england, united kingdom|https://www.linkedin.com/jobs/view/4219182090
deductive ai|software engineer intern, london|london, england, united kingdom|https://www.linkedin.com/jobs/view/4085602965
konux|intern accounting - 6 months (m/f/x)|munich, bavaria, germany|https://www.linkedin.com/jobs/view/4213559869
infobip|ios software engineer intern - košice|košice, kosice, worldwide|https://www.linkedin.com/jobs/view/4214479349
interdigital, inc.|intern, implicit neural representation of haptic data|greater rennes metropolitan area, worldwide|https://www.linkedin.com/jobs/view/4051008739
accurat.ai|intern data scientist|ghent, flemish region, belgium|https://www.linkedin.com/jobs/view/4204351851
weld|marketing intern (design & content creation)|copenhagen municipality, capital region of denmark, denmark|https://www.linkedin.com/jobs/view/4211328352
devoteam|vi søger tech-management konsulenter med 3+ års erfaring til devoteam danmark|copenhagen, capital region of denmark, denmark|https://www.linkedin.com/jobs/view/4218888633
devoteam|vi søger tech-management konsulenter med 3+ års erfaring til devoteam danmark|copenhagen municipality, capital region of denmark, denmark|https://www.linkedin.com/jobs/view/4218823567
kompanion care|digital sales & marketing intern|paris, île-de-france, france|https://www.linkedin.com/jobs/view/4049588957
naptha ai|software engineer (intern)|paris, île-de-france, france|https://www.linkedin.com/jobs/view/4151316671
alice & bob|intern - software engineer (july/august 2025)|paris, île-de-france, france|https://www.linkedin.com/jobs/view/4197490881
owkin|intern - biomed discovery|paris, île-de-france, france|https://www.linkedin.com/jobs/view/4182097412
kameleoon|[internship] product manager junior h/f|paris, île-de-france, france|https://www.linkedin.com/jobs/view/4202381464
le village by ca paris|sales development representative (sdr) intern|paris, île-de-france, france|https://www.linkedin.com/jobs/view/4217721306
mago|founder associate / bras droit (stage)|paris, île-de-france, france|https://www.linkedin.com/jobs/view/4197576830
nextaudit|praktikum (w/m/d) softwareentwickler - vue.js|aachen, north rhine-westphalia, germany|https://www.linkedin.com/jobs/view/4212087355
snowflake|software engineer intern - berlin (2025)|berlin, berlin, germany|https://www.linkedin.com/jobs/view/4205341606
naptha ai|software engineer (intern)|berlin, berlin, germany|https://www.linkedin.com/jobs/view/4151321449
epapa|design software engineer internship (unpaid)|berlin, germany|https://www.linkedin.com/jobs/view/4218866866
naptha ai|software engineer (intern)|dublin, county dublin, ireland|https://www.linkedin.com/jobs/view/4151323166
italian itinerary|ai-driven business & market strategy internship|rome, latium, italy|https://www.linkedin.com/jobs/view/4219694257
air liquide|trainee - software product developer|pioltello, lombardy, italy|https://www.linkedin.com/jobs/view/4034633750
bizpal s.r.l. gruppo italiaonline|stage social media assistant|turin, piedmont, italy|https://www.linkedin.com/jobs/view/4209685283
naptha ai|software engineer (intern)|amsterdam, north holland, netherlands|https://www.linkedin.com/jobs/view/4151316672
keepbook|back-end engineer intern|amsterdam, north holland, netherlands|https://www.linkedin.com/jobs/view/4219690912
air space intelligence|internship - software engineer|gdańsk, pomorskie, poland|https://www.linkedin.com/jobs/view/4214759554
cloudflare|software engineer intern, business intelligence (summer 2025)|lisbon, portugal|https://www.linkedin.com/jobs/view/4116724021
inbody usa (biospace)|full stack software developer intern (paid) - bilingual korean|cerritos, canada|https://www.linkedin.com/jobs/view/4153112450
roche|becas deja tu huella- finance intern|madrid, community of madrid, spain|https://www.linkedin.com/jobs/view/4219195842
dynatrace|internship - software engineering|barcelona, catalonia, spain|https://www.linkedin.com/jobs/view/4213520117
tui|nazar nordic swe speaking  internship at the hq 1|malmo, skåne county, sweden|https://www.linkedin.com/jobs/view/4199482833
revolutionrace|seo lead|borås, västra götaland county, sweden|https://www.linkedin.com/jobs/view/4215248709
tietoevry|c++ trainee engineer (m/f/d/v)|lviv, lviv, ukraine|https://www.linkedin.com/jobs/view/4217490070
naptha ai|software engineer (intern)|london, england, united kingdom|https://www.linkedin.com/jobs/view/4151319483
justpark|people & talent intern|london, england, united kingdom|https://www.linkedin.com/jobs/view/4212316362
rift-ar technologies inc.|software engineer intern|europe|https://www.linkedin.com/jobs/view/4211408635
gen|software engineering intern|prague, prague, worldwide|https://www.linkedin.com/jobs/view/4192408130
gen|software engineering intern|prague, prague, worldwide|https://www.linkedin.com/jobs/view/4192408129
hudson benelux|it manager|antwerp metropolitan area, worldwide|https://www.linkedin.com/jobs/view/4178248273
hudson benelux|it project manager wms/mes|niel, flemish region, belgium|https://www.linkedin.com/jobs/view/4178248249
fourth|intern analytics engineer|sofia, sofia city, worldwide|https://www.linkedin.com/jobs/view/4178606859
real ai dynamics|sales representative intern|dominican republic, worldwide|https://www.linkedin.com/jobs/view/4073325014
escp business school|alternant en intelligence artificielle h/f|paris, île-de-france, france|https://www.linkedin.com/jobs/view/4210984025
profisee|software development intern (hybrid)|ga, alpharetta, worldwide|https://www.linkedin.com/jobs/view/4212082065
gws gesellschaft fuer warenwirtschafts-systeme mbh|praktikum als softwareentwickler (m/w/d) - abschlussarbeit möglich|münster, north rhine-westphalia, germany|https://www.linkedin.com/jobs/view/4169812051
kisling consulting gmbh|trainee softwareentwicklung erp (m/w/d)|heilbronn, baden-württemberg, germany|https://www.linkedin.com/jobs/view/4200967644
sap|sap ixp intern (w/m/d) - softwareentwicklung in der supply chain management-beratung|hamburg, hamburg, germany|https://www.linkedin.com/jobs/view/4208980977
yendou|intern/working student - software engineering (m/w/d)|berlin, berlin, germany|https://www.linkedin.com/jobs/view/4169613509
gob software & systeme gmbh & co. kg|trainee softwareentwicklung (w/m/d)|krefeld, north rhine-westphalia, germany|https://www.linkedin.com/jobs/view/4078875472
allianz global investors|intern genai program (f/m/d)|munich, bavaria, germany|https://www.linkedin.com/jobs/view/4218729725
deepadvisor|werkstudent backend - asp.net / .net 9.0 / c#  (m/f/x)|würzburg, bavaria, germany|https://www.linkedin.com/jobs/view/4159637773
twt gmbh science & innovation|mathematiker, informatiker, naturwissenschaftler für industrie und forschung / research manager (m/w/d)|munich, bavaria, germany|https://www.linkedin.com/jobs/view/4136711897
e80 group|software programmer intern|viano, emilia-romagna, italy|https://www.linkedin.com/jobs/view/4189529395
otp bank, moldova|auditor it, direcția audit it și audit de proces, departamentul audit|moldova, chișinău, worldwide|https://www.linkedin.com/jobs/view/4196523175
van lanschot kempen|software developer – internship(en)|amsterdam, north holland, netherlands|https://www.linkedin.com/jobs/view/4214713814
ikea|stagiaire digital|haarlem, north holland, netherlands|https://www.linkedin.com/jobs/view/4213313759
damen|internship: ai training program|gorinchem, south holland, netherlands|https://www.linkedin.com/jobs/view/4172064453
royal haskoningdhv|internship: ai in supply chain management|amersfoort, utrecht, netherlands|https://www.linkedin.com/jobs/view/4198342379
royal haskoningdhv|internship: ai in supply chain management|amersfoort, utrecht, netherlands|https://www.linkedin.com/jobs/view/4198338893
relativity|software engineering intern|cracow, małopolskie, poland|https://www.linkedin.com/jobs/view/4169751903
relativity|software engineering intern|cracow, małopolskie, poland|https://www.linkedin.com/jobs/view/4200848735
relativity|software engineering intern|cracow, małopolskie, poland|https://www.linkedin.com/jobs/view/4206614368
relativity|software engineering intern|cracow, małopolskie, poland|https://www.linkedin.com/jobs/view/4167819787
relativity|software engineering intern|cracow, małopolskie, poland|https://www.linkedin.com/jobs/view/4167827042
relativity|software engineering intern|cracow, małopolskie, poland|https://www.linkedin.com/jobs/view/4200853396
bain & company|ai & innovation intern (risk team)|warsaw, mazowieckie, poland|https://www.linkedin.com/jobs/view/4204230208
relativity|software engineering intern|cracow, małopolskie, poland|https://www.linkedin.com/jobs/view/4167825150
relativity|software engineering intern|cracow, małopolskie, poland|https://www.linkedin.com/jobs/view/4167826055
relativity|software engineering intern|cracow, małopolskie, poland|https://www.linkedin.com/jobs/view/4167816788
tech economy|ai & innovation intern (risk team)|warsaw, mazowieckie, poland|https://www.linkedin.com/jobs/view/4204395944
intapp|software engineering intern|lisbon metropolitan area, worldwide|https://www.linkedin.com/jobs/view/4204360341
banca transilvania|auditor intern subsidiare|bucharest, bucharest, romania|https://www.linkedin.com/jobs/view/4181738855
tutor perini corporation|data and analytics intern|los angeles, canada|https://www.linkedin.com/jobs/view/4216767374
continental|low code programmer trainee|zvolen, banska bystrica, worldwide|https://www.linkedin.com/jobs/view/4202592444
signify|project finance analyst internship|madrid, community of madrid, spain|https://www.linkedin.com/jobs/view/4205086590
signify lighting academy|project finance analyst internship|madrid, community of madrid, spain|https://www.linkedin.com/jobs/view/4215844607
vantel (yc w25)|software engineer - intern|stockholm, stockholm county, sweden|https://www.linkedin.com/jobs/view/4201215258
pharmony|communication and digital marketing intern (unpaid)|lugano, ticino, switzerland|https://www.linkedin.com/jobs/view/4212019002
cyberpeace institute|internship: business development & fundraising|geneva, geneva, switzerland|https://www.linkedin.com/jobs/view/4092579953
lanes group|trainee planner/programmer|sheffield, england, united kingdom|https://www.linkedin.com/jobs/view/4153443179
lanes infrastructure|trainee planner/programmer|sheffield, england, united kingdom|https://www.linkedin.com/jobs/view/4150268038
aize|software engineering intern|kingswells, scotland, united kingdom|https://www.linkedin.com/jobs/view/4214416238
aize|software engineering intern|aberdeen, scotland, united kingdom|https://www.linkedin.com/jobs/view/4182622975
couchbase|sales development intern|london, england, united kingdom|https://www.linkedin.com/jobs/view/4213687693
couchbase|sales development intern|london, england, united kingdom|https://www.linkedin.com/jobs/view/4213692269
couchbase|sales development intern|london, england, united kingdom|https://www.linkedin.com/jobs/view/4213690572
joinrs uk|[eu - internship] human resources directorate (hr)|european union, worldwide|https://www.linkedin.com/jobs/view/4219619387
joinrs uk|[eu - internship] chief financial controller directorate (finance)|european union, worldwide|https://www.linkedin.com/jobs/view/4219614883
relativity|software engineering intern|cracow, małopolskie, poland|https://www.linkedin.com/jobs/view/4167826018
relativity|software engineering intern|cracow, małopolskie, poland|https://www.linkedin.com/jobs/view/4167822226
relativity|software engineering intern|cracow, małopolskie, poland|https://www.linkedin.com/jobs/view/4167819801
relativity|software engineering intern|cracow, małopolskie, poland|https://www.linkedin.com/jobs/view/4167824207
relativity|software engineering intern|cracow, małopolskie, poland|https://www.linkedin.com/jobs/view/4167822202
relativity|software engineering intern|cracow, małopolskie, poland|https://www.linkedin.com/jobs/view/4167816890
