company|title|location|link
mirakl|ai research intern|paris, île-de-france, france|https://www.linkedin.com/jobs/view/4307544362
bmw group|intern ai-based recommender systems (f/m/x)|munich, bavaria, germany|https://www.linkedin.com/jobs/view/4264451343
allsides (formerly covision media)|business development analyst intern|bressanone, trentino-alto adige, italy|https://www.linkedin.com/jobs/view/4309548626
motorola solutions|cloud devops intern|cracow, małopolskie, poland|https://www.linkedin.com/jobs/view/4310363098
opplane|iefp internship - business & marketing|lisbon, lisbon, portugal|https://www.linkedin.com/jobs/view/4311981783
etecnic|data scientist intern|reus, catalonia, spain|https://www.linkedin.com/jobs/view/4303989967
thomson reuters|applied scientist intern|zug, zug, switzerland|https://www.linkedin.com/jobs/view/4311139065
deductive ai|software engineer intern, london|london, england, united kingdom|https://www.linkedin.com/jobs/view/4085602965
thomson reuters|applied science intern|london, england, united kingdom|https://www.linkedin.com/jobs/view/4311118969
adesso austria gmbh|lead data engineer (all genders) [wien]|vienna, austria|https://www.linkedin.com/jobs/view/3866805015
adesso austria gmbh|lead data engineer (all genders) [graz]|graz, styria, austria|https://www.linkedin.com/jobs/view/3866802372
bigblue|software engineer intern|paris, île-de-france, france|https://www.linkedin.com/jobs/view/3575815459
taktile|software engineer working student/intern|berlin, berlin, germany|https://www.linkedin.com/jobs/view/4205745296
taktile|software engineer working student/intern|iaşi, iaşi, romania|https://www.linkedin.com/jobs/view/4312339939
sophia genetics|it support specialist intern|rolle, vaud, switzerland|https://www.linkedin.com/jobs/view/4305619272
meta|research scientist intern, representation learning|paris, île-de-france, france|https://www.linkedin.com/jobs/view/4311947502
meta|research scientist intern, ai core machine learning|paris, île-de-france, france|https://www.linkedin.com/jobs/view/4309509934
meta|research scientist intern, code generation (msc)|paris, île-de-france, france|https://www.linkedin.com/jobs/view/4309525071
meta|research scientist intern, comms & language (phd) language research scientist|paris, île-de-france, france|https://www.linkedin.com/jobs/view/4310297381
meta|research scientist intern, code generation (phd) (paris)|paris, île-de-france, france|https://www.linkedin.com/jobs/view/4312233711
meta|research scientist intern, ai core machine learning (phd)|paris, île-de-france, france|https://www.linkedin.com/jobs/view/4309524081
meta|research scientist intern, representation learning (phd)|paris, île-de-france, france|https://www.linkedin.com/jobs/view/4311955399
meta|research scientist intern, comms and language (phd) computer vision research|paris, île-de-france, france|https://www.linkedin.com/jobs/view/4310285589
meta|research scientist intern, fair embodiment & actions (phd)|paris, île-de-france, france|https://www.linkedin.com/jobs/view/4311910449
meta|research scientist intern, reinforcement learning and large language models, phd|paris, île-de-france, france|https://www.linkedin.com/jobs/view/4309516830
meta|research scientist intern, machine learning, human motion models (phd)|zurich, zurich, switzerland|https://www.linkedin.com/jobs/view/4311030047
meta|research scientist intern, perception for human inputs and interactions (phd)|zurich, zurich, switzerland|https://www.linkedin.com/jobs/view/4302967562
meta|research scientist intern, 3d computer vision and generative ai (phd)|zurich, zurich, switzerland|https://www.linkedin.com/jobs/view/4306506280
meta|research scientist intern, generative ai (phd)|zurich, zurich, switzerland|https://www.linkedin.com/jobs/view/4311344188
meta|research scientist intern, rendering and reconstruction (phd)|zurich, zurich, switzerland|https://www.linkedin.com/jobs/view/4305872702
meta|research scientist intern, physics-based simulation for avatars and robotics phd|zurich, zurich, switzerland|https://www.linkedin.com/jobs/view/4303751822
meta|software engineer intern|london, england, united kingdom|https://www.linkedin.com/jobs/view/4299534674
meta|detection & response security engineer, intern|london, england, united kingdom|https://www.linkedin.com/jobs/view/4303768540
meta|product security engineer, intern|london, england, united kingdom|https://www.linkedin.com/jobs/view/4301045185
meta|software engineer intern, machine learning (phd)|london, england, united kingdom|https://www.linkedin.com/jobs/view/4306109884
meta|research scientist intern, code generation (phd) (london)|london, england, united kingdom|https://www.linkedin.com/jobs/view/4312234689
meta|security engineer, intern - identity & access management|london, england, united kingdom|https://www.linkedin.com/jobs/view/4294414332
meta|research scientist intern, monetization computer vision (phd)|london, england, united kingdom|https://www.linkedin.com/jobs/view/4301485470
meta|research scientist intern, machine learning, character animation (phd)|london, england, united kingdom|https://www.linkedin.com/jobs/view/4303755722
meta|research scientist intern, photorealistic telepresence (phd)|london, england, united kingdom|https://www.linkedin.com/jobs/view/4296741612
wpp media|bliv business intelligence intern hos wpp media|copenhagen, capital region of denmark, denmark|https://www.linkedin.com/jobs/view/4302337782
instadeep|ai & genomics intern|paris, île-de-france, france|https://www.linkedin.com/jobs/view/4303093574
genbio ai|research scientist intern|paris, île-de-france, france|https://www.linkedin.com/jobs/view/4313726175
qantev|internship sales executive h/f|paris, île-de-france, france|https://www.linkedin.com/jobs/view/4310885664
cox enterprises|enterprise architect intern - summer 2026|ga, atlanta, worldwide|https://www.linkedin.com/jobs/view/4302064859
parloa|it intern (f/m/d)*|berlin, germany|https://www.linkedin.com/jobs/view/4309940914
merantix momentum|founder's associate intern (m/f/d)|berlin, berlin, germany|https://www.linkedin.com/jobs/view/4300342018
melotech|content operations specialist intern|berlin, berlin, germany|https://www.linkedin.com/jobs/view/4307008323
msci inc.|data science intern|budapest, budapest, hungary|https://www.linkedin.com/jobs/view/4299592350
qualcomm|fy26 intern - systems data engineer internship – sensors (cork, ireland)|cork, county cork, ireland|https://www.linkedin.com/jobs/view/4297851597
wind mee|medior/senior sea specialist|rotterdam, south holland, netherlands|https://www.linkedin.com/jobs/view/4261492684
surplusmap|internship data engineer|oslo, oslo, norway|https://www.linkedin.com/jobs/view/4226127074
unit8|young talent in data & ai consulting (6-month internship, krakow, poland)|cracow, małopolskie, poland|https://www.linkedin.com/jobs/view/4307022467
stellantis|ai & data analytics intern|gliwice, śląskie, poland|https://www.linkedin.com/jobs/view/4302335936
newegg|ai project intern – computer vision|diamond bar, canada|https://www.linkedin.com/jobs/view/4303704897
lightly|marketing intern (ai startup)|zurich, zurich, switzerland|https://www.linkedin.com/jobs/view/4305810490
thomson reuters|research engineering intern|zug, zug, switzerland|https://www.linkedin.com/jobs/view/4312756097
insider.|digital sales development representative intern|istanbul, istanbul, worldwide|https://www.linkedin.com/jobs/view/4200201475
amd|summer 2026 software engineering intern|cambridge, england, united kingdom|https://www.linkedin.com/jobs/view/4309911066
instadeep|research engineer intern bioai|london, england, united kingdom|https://www.linkedin.com/jobs/view/4283928978
instadeep|research engineer intern, deep learning for protein structure modelling|london, england, united kingdom|https://www.linkedin.com/jobs/view/4308077226
thomson reuters|research engineering intern|london, england, united kingdom|https://www.linkedin.com/jobs/view/4312750158
monzo bank|associate data scientist - intern|london, england, united kingdom|https://www.linkedin.com/jobs/view/4301319759
latinx in ai (lxai)|2026 summer intern, phd, machine learning engineer, simulation|city of london, england, united kingdom|https://www.linkedin.com/jobs/view/4310317624
targetjobs uk|summer 2026 software engineering intern|cambridge, england, united kingdom|https://www.linkedin.com/jobs/view/4312608813
waymo|2026 summer intern, phd, machine learning engineer, simulation|london, england, united kingdom|https://www.linkedin.com/jobs/view/4301605050
melotech|content operations specialist intern|london, england, united kingdom|https://www.linkedin.com/jobs/view/4307010305
visser & van baars|data & ai specialist|antwerp, flemish region, belgium|https://www.linkedin.com/jobs/view/4314247323
tailormade logistics|internship - fleet trainee|ghent, flemish region, belgium|https://www.linkedin.com/jobs/view/4294716780
tailormade logistics|internship - transport trainee|ghent, flemish region, belgium|https://www.linkedin.com/jobs/view/4294709956
delen private bank|mlops engineer – ai team - kantoor antwerpen|antwerp metropolitan area, worldwide|https://www.linkedin.com/jobs/view/4308407400
fujifilm biotechnologies|intern for drug product manufacturing|hillerød, capital region of denmark, denmark|https://www.linkedin.com/jobs/view/4296408753
microsoft|applied science phd internship opportunities|estonia, worldwide|https://www.linkedin.com/jobs/view/4306227262
descartes underwriting|internal audit intern|paris, île-de-france, france|https://www.linkedin.com/jobs/view/4306611388
capital fund management (cfm)|internship - multimodal analysis of central bank communication|paris, île-de-france, france|https://www.linkedin.com/jobs/view/4310324433
descartes underwriting|internal audit intern|paris, île-de-france, france|https://www.linkedin.com/jobs/view/4307892291
lensa|data analytics intern- summer 2026|ga, atlanta, worldwide|https://www.linkedin.com/jobs/view/4312541664
veritiv|data science intern|ga, atlanta, worldwide|https://www.linkedin.com/jobs/view/4304275767
elevance health|data analytics intern- summer 2026|ga, atlanta, worldwide|https://www.linkedin.com/jobs/view/4311786086
lensa|americas region business analytics summer 2026 intern|ga, atlanta, worldwide|https://www.linkedin.com/jobs/view/4311364338
veritiv|business analytics intern|ga, atlanta, worldwide|https://www.linkedin.com/jobs/view/4303494671
ups|americas region business analytics summer 2026 intern|ga, atlanta, worldwide|https://www.linkedin.com/jobs/view/4307383611
ups|americas region business analytics summer 2026 intern|ga, atlanta, worldwide|https://www.linkedin.com/jobs/view/4307323676
protiviti|atlanta technology consulting intern - 2026|ga, atlanta, worldwide|https://www.linkedin.com/jobs/view/4311711919
price industries|intern - manufacturing engineer - summer 2026|ga, suwanee, worldwide|https://www.linkedin.com/jobs/view/4310636817
microsoft|research intern: audio and acoustics|brandenburg, germany|https://www.linkedin.com/jobs/view/4314850162
microsoft|research intern: audio and acoustics|berlin, berlin, germany|https://www.linkedin.com/jobs/view/4314839411
microsoft|research intern: audio and acoustics|baden-württemberg, germany|https://www.linkedin.com/jobs/view/4314840443
microsoft|research intern: audio and acoustics|bavaria, germany|https://www.linkedin.com/jobs/view/4314846266
microsoft|research intern: audio and acoustics|rhineland-palatinate, germany|https://www.linkedin.com/jobs/view/4314854099
microsoft|research intern: audio and acoustics|lower saxony, germany|https://www.linkedin.com/jobs/view/4314846274
microsoft|research intern: audio and acoustics|saxony-anhalt, germany|https://www.linkedin.com/jobs/view/4314851114
microsoft|research intern: audio and acoustics|hesse, germany|https://www.linkedin.com/jobs/view/4314839409
microsoft|research intern: audio and acoustics|hamburg, hamburg, germany|https://www.linkedin.com/jobs/view/4314838476
microsoft|research intern: audio and acoustics|schleswig-holstein, germany|https://www.linkedin.com/jobs/view/4314854091
eaton|software engineering intern|dublin, county dublin, ireland|https://www.linkedin.com/jobs/view/4291778206
mission technologies, a division of hii|logistics technician (skillbridge intern) - 22873|naples, campania, italy|https://www.linkedin.com/jobs/view/4245301026
nato|internship hq jfc brunssum - joint assessment's division|brunssum, limburg, netherlands|https://www.linkedin.com/jobs/view/4305714925
nato|internship hq jfc brunssum - information knowledge management plans section (ikm plans)|brunssum, limburg, netherlands|https://www.linkedin.com/jobs/view/4305726234
iquality|afstudeeropdracht security testing ai|nijmegen, gelderland, netherlands|https://www.linkedin.com/jobs/view/4094005116
verisk|2026  summer intern programme  business analyst|cracow, małopolskie, poland|https://www.linkedin.com/jobs/view/4315353779
bnp paribas|marketing investment products intern - italian speaker|lisbon, lisbon, portugal|https://www.linkedin.com/jobs/view/4312794979
bnp paribas cib|marketing investment products intern - italian speaker|lisboa, lisbon, portugal|https://www.linkedin.com/jobs/view/4310241853
divergent|summer 2026 supply chain intern|los angeles, canada|https://www.linkedin.com/jobs/view/4307563553
transperfect|ai solutions - director, business development|los angeles metropolitan area, worldwide|https://www.linkedin.com/jobs/view/4304555882
microsoft|research intern - gray systems lab (gsl)|barcelona, catalonia, spain|https://www.linkedin.com/jobs/view/4312721214
verisure|procurement support intern|pozuelo de alarcón, community of madrid, spain|https://www.linkedin.com/jobs/view/4308356091
parc taulí hospital universitari|1 analista de dades (25_122_ipv_dirges_diresda_analis)|sabadell, catalonia, spain|https://www.linkedin.com/jobs/view/4298382691
sany group|internship position: service technician intern (mechanical/electrical)|norrköping, östergötland county, sweden|https://www.linkedin.com/jobs/view/4310325653
ey|senior konsult  data engineering  technology consulting  stockholm, göteborg, malmö|stockholm, stockholm county, sweden|https://www.linkedin.com/jobs/view/4301000298
ey|senior konsult  data engineering  technology consulting  stockholm, göteborg, malmö|gothenburg, västra götaland county, sweden|https://www.linkedin.com/jobs/view/4300695337
ey|senior konsult  data engineering  technology consulting  stockholm, göteborg, malmö|malmo, skåne county, sweden|https://www.linkedin.com/jobs/view/4301006153
merck healthcare|internship - ai & ml - operational excellence ai & ml - all genders|corsier, vaud, switzerland|https://www.linkedin.com/jobs/view/4289265527
syngenta|internship digital chemistry bayesian optimisation|stein, aargau, switzerland|https://www.linkedin.com/jobs/view/4292009473
microsoft|applied science phd internship opportunities|zurich, zurich, switzerland|https://www.linkedin.com/jobs/view/4303086120
swissgrid ag|platform engineering internship (80-100% - 12 months)|aarau, aargau, switzerland|https://www.linkedin.com/jobs/view/4289901430
microsoft|research intern in machine learning, machine intelligence|cambridge, england, united kingdom|https://www.linkedin.com/jobs/view/4314147524
microsoft|security applied ai/ml research intern - microsoft threat intelligence center|london, england, united kingdom|https://www.linkedin.com/jobs/view/4314894579
microsoft|research intern llm – ai for science|cambridge, england, united kingdom|https://www.linkedin.com/jobs/view/4309637409
microsoft|security researcher intern - microsoft threat intelligence center|london, england, united kingdom|https://www.linkedin.com/jobs/view/4315104400
microsoft|internship opportunities – multimodal deep learning for healthcare – microsoft research|cambridge, england, united kingdom|https://www.linkedin.com/jobs/view/4310422059
microsoft|research intern on bioemu|cambridge, england, united kingdom|https://www.linkedin.com/jobs/view/4304662765
princeton biopartners|part-time software engineering intern uk (full stack) – healthcare|united kingdom|https://www.linkedin.com/jobs/view/4315323159
microsoft|applied science phd internship opportunities|london, england, united kingdom|https://www.linkedin.com/jobs/view/4309690637
verisk|2026 year-long internship: business support analyst (intern)|london, england, united kingdom|https://www.linkedin.com/jobs/view/4314167133
verisk|2026  summer internship programme  sales|london, england, united kingdom|https://www.linkedin.com/jobs/view/4314158576
ab inbev|data engineer intern|czechia, prague, worldwide|https://www.linkedin.com/jobs/view/4192092687
sap|sap btp ixp intern - site reliability engineering job|sofia, sofia city, worldwide|https://www.linkedin.com/jobs/view/4308230806
global nomadic|volunteer: plants, people, and healing: discovering ecuador s amazonian ethnobotany|paris, île-de-france, france|https://www.linkedin.com/jobs/view/4218853514
global nomadic|volunteer: plants, people, and healing: discovering ecuador s amazonian ethnobotany|munich, bavaria, germany|https://www.linkedin.com/jobs/view/3803763516
verisure|internship - arlo europe amazon sales account manager intern|munich, bavaria, germany|https://www.linkedin.com/jobs/view/4293909605
verisure|internship - arlo europe amazon sales account manager intern|ratingen, north rhine-westphalia, germany|https://www.linkedin.com/jobs/view/4311964975
global nomadic|volunteer: plants, people, and healing: discovering ecuador s amazonian ethnobotany|berlin, berlin, germany|https://www.linkedin.com/jobs/view/4218847919
global nomadic|volunteer: plants, people, and healing: discovering ecuador s amazonian ethnobotany|dublin, county dublin, ireland|https://www.linkedin.com/jobs/view/4005628834
global nomadic|volunteer: plants, people, and healing: discovering ecuador s amazonian ethnobotany|amsterdam, north holland, netherlands|https://www.linkedin.com/jobs/view/3803761709
global nomadic|volunteer: plants, people, and healing: discovering ecuador s amazonian ethnobotany|pasadena, canada|https://www.linkedin.com/jobs/view/3803759800
amazon|program manager intern|london, england, united kingdom|https://www.linkedin.com/jobs/view/4312514258
amazon|program manager intern|london, england, united kingdom|https://www.linkedin.com/jobs/view/4312506538
global nomadic|volunteer: plants, people, and healing: discovering ecuador s amazonian ethnobotany|london, england, united kingdom|https://www.linkedin.com/jobs/view/4218852585
finperks|intern founders associate fintech startup (100+m exit founders)|berlin, berlin, germany|https://www.linkedin.com/jobs/view/4312263905
meta|research scientist intern, ai-driven neural interfaces (phd)|paris, île-de-france, france|https://www.linkedin.com/jobs/view/4292755942
precis|digital marketing internship|copenhagen municipality, capital region of denmark, denmark|https://www.linkedin.com/jobs/view/4302718630
precis|digital marketing internship|aarhus, central denmark region, denmark|https://www.linkedin.com/jobs/view/4302714928
precis|digital marketing internship|copenhagen metropolitan area, worldwide|https://www.linkedin.com/jobs/view/4206590745
the home depot|data science phd level internship (summer 2026 - hybrid/in-office)|ga, atlanta, worldwide|https://www.linkedin.com/jobs/view/4301166358
infomotion gmbh|ai principal consultant (m/w/d)|berlin, berlin, germany|https://www.linkedin.com/jobs/view/4302266645
olala!|data operations intern|barcelona, catalonia, spain|https://www.linkedin.com/jobs/view/4289623902
lanch|entrepreneur in residence (m/w/d)|berlin, berlin, germany|https://www.linkedin.com/jobs/view/4256458520
lizy|marketing content intern|brussels metropolitan area, worldwide|https://www.linkedin.com/jobs/view/4290038454
lizy|marketing content intern (dutch speaking)|hôpital etterbeek-ixelles, brussels region, belgium|https://www.linkedin.com/jobs/view/4290409509
comena|software engineering intern|munich, bavaria, germany|https://www.linkedin.com/jobs/view/4309748645
vivere|mandatory production intern (f/m/x)|hamburg, hamburg, germany|https://www.linkedin.com/jobs/view/4306103362
plaion pictures|(senior) operations manager (all genders)|munich, bavaria, germany|https://www.linkedin.com/jobs/view/4307052541
clp trading gmbh|content manager e-commerce (m/w/d) – mit berufserfahrung & seo-expertise|hamburg, germany|https://www.linkedin.com/jobs/view/4302501326
plaion|(senior) operations manager (all genders)|krailling, bavaria, germany|https://www.linkedin.com/jobs/view/4307034307
fler|e-commerce & digital marketing intern|milan, lombardy, italy|https://www.linkedin.com/jobs/view/4309964727
qomodo|finance intern|milan, lombardy, italy|https://www.linkedin.com/jobs/view/4311103339
qomodo|customer support & credit collection intern|milan, lombardy, italy|https://www.linkedin.com/jobs/view/4283403344
omnishopper & co.|ecommerce internship|milan, lombardy, italy|https://www.linkedin.com/jobs/view/4305739309
rituals (b corp™)|marketing & e-commerce internships recruitment day!|amsterdam, north holland, netherlands|https://www.linkedin.com/jobs/view/4299166295
cover genius|gtm strategy & operations intern|amsterdam, north holland, netherlands|https://www.linkedin.com/jobs/view/4305140179
versuni|internship: d2c digital marketing intern- north district|amsterdam area, worldwide|https://www.linkedin.com/jobs/view/4301787574
vanderlande|graduation: automating configuration processes with ai|veghel, north brabant, netherlands|https://www.linkedin.com/jobs/view/4310711897
vanderlande|internship: ticket quality auditing tool|veghel, north brabant, netherlands|https://www.linkedin.com/jobs/view/4230811047
reacher|software engineer intern (fall 2025/summer 2026)|los angeles, canada|https://www.linkedin.com/jobs/view/4290120711
amazon|engineering intern|getafe, community of madrid, spain|https://www.linkedin.com/jobs/view/4300968660
amazon|engineering intern|madrid, community of madrid, spain|https://www.linkedin.com/jobs/view/4300970687
amazon|engineering intern|barcelona, catalonia, spain|https://www.linkedin.com/jobs/view/4300968658
amazon|engineering intern|barberà del vallès, catalonia, spain|https://www.linkedin.com/jobs/view/4300977359
amazon web services (aws)|2026 software dev engineer intern - spain|barcelona, catalonia, spain|https://www.linkedin.com/jobs/view/4308986221
amazon web services (aws)|2026 software dev engineer intern - spain|madrid, community of madrid, spain|https://www.linkedin.com/jobs/view/4308986222
amazon|engineering intern|siero, principality of asturias, spain|https://www.linkedin.com/jobs/view/4300974393
visualised ab|product manager - zoom cx & contact center|greater stockholm metropolitan area, worldwide|https://www.linkedin.com/jobs/view/4233034137
tata consultancy services|software engineer intern|zurich, switzerland|https://www.linkedin.com/jobs/view/4311871299
amazon|2026 software dev engineer intern - uk, digital native business (dnb)|london, england, united kingdom|https://www.linkedin.com/jobs/view/4308097460
sota|social media marketing intern|united kingdom|https://www.linkedin.com/jobs/view/4315312713
amazon|2026 software dev engineer intern - uk, digital native business (dnb)|cambridge, england, united kingdom|https://www.linkedin.com/jobs/view/4308092612
amazon|2026 software dev engineer intern - uk, digital native business (dnb)|edinburgh, scotland, united kingdom|https://www.linkedin.com/jobs/view/4308093564
leeroo|research scientist intern – phd (ai agentic systems)|london, england, united kingdom|https://www.linkedin.com/jobs/view/4270923748
eyeline|research intern (fall 2025/spring 2026)|los angeles, canada|https://www.linkedin.com/jobs/view/4293711974
eyeline|research intern (summer 2026)|los angeles, canada|https://www.linkedin.com/jobs/view/4293721009
webtoon|[webtoon] content intern|los angeles, canada|https://www.linkedin.com/jobs/view/4308791606
meta|research scientist intern, alignment - brain and ai (phd) (paris)|paris, île-de-france, france|https://www.linkedin.com/jobs/view/4312444506
meta|network production engineer, intern|dublin, county dublin, ireland|https://www.linkedin.com/jobs/view/4312449503
meta|research scientist intern, 3d computer vision and machine learning (phd)|zurich, zurich, switzerland|https://www.linkedin.com/jobs/view/4297404922
meta|research scientist intern, multimodal audio generation (phd)|zurich, zurich, switzerland|https://www.linkedin.com/jobs/view/4296749474
meta|network production engineer, intern|london, england, united kingdom|https://www.linkedin.com/jobs/view/4312454471
meta|research scientist intern, 3d world modelling, robotics and generative ai (phd)|london, england, united kingdom|https://www.linkedin.com/jobs/view/4295889706
meta|research scientist intern, hearing science and auditory perception (phd)|cambridge, england, united kingdom|https://www.linkedin.com/jobs/view/4295222069
meta|research scientist intern, audio, machine learning and computer vision (phd)|cambridge, england, united kingdom|https://www.linkedin.com/jobs/view/4294760052
founderful|working student in ai-training/model evaluation|zurich, zurich, switzerland|https://www.linkedin.com/jobs/view/4310695158
founderful|marketing intern (ai startup)|zurich, zurich, switzerland|https://www.linkedin.com/jobs/view/4310677970
founderful|head of operations (100%) at ai startup|zurich, zurich, switzerland|https://www.linkedin.com/jobs/view/4310690808
founderful|(senior) full-stack engineer in a fast-growing ai startup|zurich, zurich, switzerland|https://www.linkedin.com/jobs/view/4310802029
founderful|business development representative in a fast-growing ai startup|zurich, zurich, switzerland|https://www.linkedin.com/jobs/view/4310693180
superb|some intern (copenhagen)|copenhagen, capital region of denmark, denmark|https://www.linkedin.com/jobs/view/4295698677
