company|title|location|link
ripplematch|banking analyst intern|ga, atlanta, worldwide|https://www.linkedin.com/jobs/view/4271115886
ripplematch|banking analyst intern, application via ripplematch|ga, atlanta, worldwide|https://www.linkedin.com/jobs/view/4268606399
yendou|intern/working student - software engineering (m/w/d)|berlin, berlin, germany|https://www.linkedin.com/jobs/view/4265996282
yendou|intern/working student - frontend engineering (m/w/d)|berlin, berlin, germany|https://www.linkedin.com/jobs/view/4265996286
edgeless systems|ai business development intern|berlin, berlin, germany|https://www.linkedin.com/jobs/view/4257891208
quantagonia|intern/working student (muc) - founders associate (m/f/x)|munich, bavaria, germany|https://www.linkedin.com/jobs/view/4208685991
valantic|intern technology & transactions (all genders)|cologne, north rhine-westphalia, germany|https://www.linkedin.com/jobs/view/4149476821
allianz|intern (m/f/d) in group sustainable operations at allianz se|munich, bavaria, germany|https://www.linkedin.com/jobs/view/4275364280
a11|finance and accounting intern (m/f/d)|berlin, berlin, germany|https://www.linkedin.com/jobs/view/4278036432
negu enterprises|intern sales & marketing analytics (m/f/d)|walldorf, baden-württemberg, germany|https://www.linkedin.com/jobs/view/4279586591
western digital|sales and marketing intern|düsseldorf, north rhine-westphalia, germany|https://www.linkedin.com/jobs/view/4279676915
tietalent|(junior) software asset management consultant (m/w/d)|oldenburg, lower saxony, germany|https://www.linkedin.com/jobs/view/4276077795
allianz|intern (m/f/d) in group technology - global it economics at allianz se|munich, bavaria, germany|https://www.linkedin.com/jobs/view/4278093126
ntt data, inc.|werkstudent im marketing/social media für den bereich public & energy (m/w/d)|teltow, brandenburg, germany|https://www.linkedin.com/jobs/view/4253261730
tso-data|it-consultant für ai agents (w/m/d)|osnabrück, lower saxony, germany|https://www.linkedin.com/jobs/view/4267582503
mol group|it tester intern|budapest, budapest, hungary|https://www.linkedin.com/jobs/view/4267072876
hippocrates holding s.p.a.|it retail application intern|milan, lombardy, italy|https://www.linkedin.com/jobs/view/4278993689
kiko milano|product manager intern|bergamo, lombardy, italy|https://www.linkedin.com/jobs/view/4270276176
istituto marangoni|ict intern / headquarters|milan, lombardy, italy|https://www.linkedin.com/jobs/view/4277619538
kpmg italy|business analyst (intern) - microsoft dynamics|milan, lombardy, italy|https://www.linkedin.com/jobs/view/4270299616
miscusi|hr generalist internship|milan, lombardy, italy|https://www.linkedin.com/jobs/view/4280821888
the adecco group|assessment solutions intern|milan, lombardy, italy|https://www.linkedin.com/jobs/view/4268577899
pwc italy|legal risk management intern - milano [ifs]|milan, lombardy, italy|https://www.linkedin.com/jobs/view/4266643218
douglas italia|legal affairs support - intern|milan, lombardy, italy|https://www.linkedin.com/jobs/view/4261146663
markas|operational marketing & events intern|bolzano, trentino-alto adige, italy|https://www.linkedin.com/jobs/view/4275373835
kpmg italy|junior consultant - forensic accounting & investigations (intern)|milan, lombardy, italy|https://www.linkedin.com/jobs/view/4259199844
pwc italy|digital process & hyperautomation intern - roma - financial services|rome, latium, italy|https://www.linkedin.com/jobs/view/4266643206
kering|kering technologies production project management intern|milan, lombardy, italy|https://www.linkedin.com/jobs/view/4268602901
irca group|central planning intern|gallarate, lombardy, italy|https://www.linkedin.com/jobs/view/4245517164
deutsche börse|intern - ai process improvement (f/m/d)|luxembourg|https://www.linkedin.com/jobs/view/4235447828
ey|digital factory - business analyst intern|luxembourg, luxembourg, luxembourg|https://www.linkedin.com/jobs/view/4268276913
blackbirds|stage/traineeship rpa & automation development|rotterdam, south holland, netherlands|https://www.linkedin.com/jobs/view/4277223184
ntt data, inc.|learning & development internship|amsterdam, north holland, netherlands|https://www.linkedin.com/jobs/view/4267685673
blackbirds|junior rpa & automation developer (werkstudent of starter)|rotterdam, south holland, netherlands|https://www.linkedin.com/jobs/view/4265031908
vonq|marketing internship|rotterdam, south holland, netherlands|https://www.linkedin.com/jobs/view/4275344340
ilionx|data engineer|greater groningen area, worldwide|https://www.linkedin.com/jobs/view/4268781517
bridgestone mobility solutions|knowledge management intern|amsterdam, north holland, netherlands|https://www.linkedin.com/jobs/view/4271709042
van lanschot kempen|management assistant|amsterdam, north holland, netherlands|https://www.linkedin.com/jobs/view/4255591885
signify|field quality product analysis intern|eindhoven, north brabant, netherlands|https://www.linkedin.com/jobs/view/4210661602
decent|performance marketeer|amsterdam, north holland, netherlands|https://www.linkedin.com/jobs/view/4262394207
tacstone technology|senior mendix developer|amsterdam, north holland, netherlands|https://www.linkedin.com/jobs/view/4271184070
msd netherlands|stagiair(e) - bedrijfskunde - facility management|boxmeer, north brabant, netherlands|https://www.linkedin.com/jobs/view/4278532876
focus enterprise solutions|solution architect dynamics 365 finance en supply chain management|bunnik, utrecht, netherlands|https://www.linkedin.com/jobs/view/3982945774
kpmg nederland|director organizational change management|amstelveen, north holland, netherlands|https://www.linkedin.com/jobs/view/4255222903
bergman clinics|senior corporate communicatie specialist|bussum, north holland, netherlands|https://www.linkedin.com/jobs/view/4257461214
sparebank 1 smn|ki-utvikler|trondheim, trøndelag, norway|https://www.linkedin.com/jobs/view/4276578607
earlywarning insight|dyktige dataanalytikere/konsulenter med god forretningsforståelse|oslo, oslo, norway|https://www.linkedin.com/jobs/view/4274624529
oceaneering|project manager ssr|stavanger, rogaland, norway|https://www.linkedin.com/jobs/view/4253176707
elanco|reporting and automation internship|warsaw, mazowieckie, poland|https://www.linkedin.com/jobs/view/4264480658
ecolab life sciences|hr operations/associate data analyst|cracow, małopolskie, poland|https://www.linkedin.com/jobs/view/4276994465
ecolab|hr operations/associate data analyst|cracow, małopolskie, poland|https://www.linkedin.com/jobs/view/4276985782
signify|procurement internship (non-thesis)|piła, wielkopolskie, poland|https://www.linkedin.com/jobs/view/4266299757
lasvegas|back office agent|brasov metropolitan area, worldwide|https://www.linkedin.com/jobs/view/4280739928
vertiv|c&c intern|cluj-napoca, cluj, romania|https://www.linkedin.com/jobs/view/4258097070
emag|contract management specialist|bucharest, bucharest, romania|https://www.linkedin.com/jobs/view/4277671436
undelucram.ro|purchasing analyst - promoții non-food (f/m)|bucharest, bucharest, romania|https://www.linkedin.com/jobs/view/4278184571
dr. max romania|internal audit specialist|bucharest, romania|https://www.linkedin.com/jobs/view/4266754025
profi|due diligence & supplier masterdata analyst|timisoara metropolitan area, worldwide|https://www.linkedin.com/jobs/view/4279624279
vertiv|credit & collection intern|cluj-napoca, cluj, romania|https://www.linkedin.com/jobs/view/4263976320
naptha ai|software engineer (intern)|san francisco, canada|https://www.linkedin.com/jobs/view/4151321450
naptha ai|software engineer (intern)|san francisco, canada|https://www.linkedin.com/jobs/view/4151315774
naptha ai|software engineer (intern)|ny, new york, worldwide|https://www.linkedin.com/jobs/view/4151323165
naptha ai|software engineer (intern)|wa, seattle, worldwide|https://www.linkedin.com/jobs/view/4151317597
naptha ai|software engineer (intern)|tx, austin, worldwide|https://www.linkedin.com/jobs/view/4151316670
harmonic|software engineer intern (summer '26)|ny, new york, worldwide|https://www.linkedin.com/jobs/view/4277852295
naptha ai|software engineer (intern)|philadelphia, panama|https://www.linkedin.com/jobs/view/4151320489
naptha ai|software engineer (intern)|boston, morocco|https://www.linkedin.com/jobs/view/4151316669
csi-cancer: usc michelson center convergent science institute in cancer|intern in strategy & data science at ekimetrics|los angeles, canada|https://www.linkedin.com/jobs/view/4281420052
ripplematch|business process analyst intern|los angeles, canada|https://www.linkedin.com/jobs/view/4277200946
ripplematch|business process analyst intern, application via ripplematch|los angeles, canada|https://www.linkedin.com/jobs/view/4269938102
ripplematch|consulting intern, application via ripplematch|los angeles, canada|https://www.linkedin.com/jobs/view/4270421910
ripplematch|business development intern, application via ripplematch|los angeles, canada|https://www.linkedin.com/jobs/view/4269572918
ripplematch|investment analyst intern, application via ripplematch (los angeles)|los angeles, canada|https://www.linkedin.com/jobs/view/4279186376
lenovo|back office support intern|bratislava, bratislava, worldwide|https://www.linkedin.com/jobs/view/4280356224
lenovo|services support intern|bratislava, bratislava, worldwide|https://www.linkedin.com/jobs/view/4280352646
ibm|early associates internship program|madrid, community of madrid, spain|https://www.linkedin.com/jobs/view/4274259798
mygwork - lgbtq+ business community|learning intern|barcelona, catalonia, spain|https://www.linkedin.com/jobs/view/4278857896
allianz technology|talent attraction intern|barcelona, catalonia, spain|https://www.linkedin.com/jobs/view/4275624788
ogury|learning intern|barcelona, catalonia, spain|https://www.linkedin.com/jobs/view/4280364304
allianz technology|finance hub intern|barcelona, catalonia, spain|https://www.linkedin.com/jobs/view/4242807369
mygwork - lgbtq+ business community|culture intern (esg & community engagement)|madrid, community of madrid, spain|https://www.linkedin.com/jobs/view/4278865100
ogury|culture intern (esg & community engagement)|madrid, community of madrid, spain|https://www.linkedin.com/jobs/view/4280359855
signify|project finance analyst internship|madrid, community of madrid, spain|https://www.linkedin.com/jobs/view/4205086590
accenture nordics|accenture winter internship 2025 - technology and song|stockholm, stockholm county, sweden|https://www.linkedin.com/jobs/view/4196911472
itm8 sverige|ai solution manager|bromma, stockholm county, sweden|https://www.linkedin.com/jobs/view/4265371604
itm8 sverige|ai solution manager|mölndal, västra götaland county, sweden|https://www.linkedin.com/jobs/view/4265371603
swedish armed forces|utbildningsutvecklare/ikt pedagog|botkyrka kommun, stockholm county, sweden|https://www.linkedin.com/jobs/view/4267538766
itm8 sverige|ai solution manager|malmo, skåne county, sweden|https://www.linkedin.com/jobs/view/4265370594
itm8 sverige|ai solution manager|kristianstads kommun, skåne county, sweden|https://www.linkedin.com/jobs/view/4265369897
itm8 sverige|ai solution manager|helsingborg, skåne county, sweden|https://www.linkedin.com/jobs/view/4265372538
gamla uppsala buss ab|systemadministratör/systemutvecklare till it-avdelning!|uppsala, uppsala county, sweden|https://www.linkedin.com/jobs/view/4274708265
ey|konsult / senior konsult  risk consulting  financial services  stockholm|stockholm, stockholm county, sweden|https://www.linkedin.com/jobs/view/4259835774
lindt & sprüngli|intern cocoa sustainability data analyst (100%)|kilchberg, zurich, switzerland|https://www.linkedin.com/jobs/view/4274205626
siemens|working student in ai and innovation communications 40–60%|zug, zug, switzerland|https://www.linkedin.com/jobs/view/4280310150
ey|intern - consulting - technology strategy and transformation|zurich, zurich, switzerland|https://www.linkedin.com/jobs/view/4253858061
ey|intern - consulting - technology strategy and transformation|lancy, geneva, switzerland|https://www.linkedin.com/jobs/view/4253852838
ey|intern - technology risk - industries (geneva)|lancy, geneva, switzerland|https://www.linkedin.com/jobs/view/4175541007
cyberpeace institute|internship: business development & fundraising|geneva, geneva, switzerland|https://www.linkedin.com/jobs/view/4092579953
skan|internship in innovative software development - intelligent desktop and cad solutions with c# / wpf|allschwil, basel-country, switzerland|https://www.linkedin.com/jobs/view/4249169751
totalenergies|operational risk intern|geneva, geneva, switzerland|https://www.linkedin.com/jobs/view/4271436156
novartis|editorial intern|basel, switzerland|https://www.linkedin.com/jobs/view/4254315317
microsoft|channel marketing internship opportunities|istanbul, istanbul, worldwide|https://www.linkedin.com/jobs/view/4275646833
slb|hse facilities analyst and communication intern|london area, united kingdom|https://www.linkedin.com/jobs/view/4268793664
sungrow europe|compliance intern - uk|milton keynes, england, united kingdom|https://www.linkedin.com/jobs/view/4273866929
dassault systèmes|business planning & operations intern|cambridge, england, united kingdom|https://www.linkedin.com/jobs/view/4269575221
creative clicks|brand design internship|amsterdam, north holland, netherlands|https://www.linkedin.com/jobs/view/4267477544
signify|intern - treasury corporate finance, cash management and financial risk|amsterdam, north holland, netherlands|https://www.linkedin.com/jobs/view/4233618314
sopra steria|power platform consultant  nl|nieuwegein, utrecht, netherlands|https://www.linkedin.com/jobs/view/4219005417
ecolab|hr operations/associate data analyst|barcelona, catalonia, spain|https://www.linkedin.com/jobs/view/4276981996
sap|sap ixp internship - sales support associate (ssa) barcelona, spain|barcelona, catalonia, spain|https://www.linkedin.com/jobs/view/4272404711
zaubar|pre-sales internship|berlin, berlin, germany|https://www.linkedin.com/jobs/view/4268598641
gocomo gmbh|finanzbuchhalter (m/w/x)|berlin, berlin, germany|https://www.linkedin.com/jobs/view/4267458207
gocomo gmbh|buchhalter (m/w/x)|berlin, berlin, germany|https://www.linkedin.com/jobs/view/4267457403
seco belgium|quotation engineer|machelen, flemish region, belgium|https://www.linkedin.com/jobs/view/4263447582
hudson benelux|it manager|antwerp metropolitan area, worldwide|https://www.linkedin.com/jobs/view/4246204631
lidl românia|purchasing analyst - promoții non-food (f/m)|bucharest, romania|https://www.linkedin.com/jobs/view/4277151493
unilever|internship - supply chain management and operations|rotterdam, south holland, netherlands|https://www.linkedin.com/jobs/view/4260539805
quantagonia|intern/working student (fra) - founders associate (m/f/x)|frankfurt, hesse, germany|https://www.linkedin.com/jobs/view/4208188061
beiersdorf|intern process automation (all genders)|hamburg, hamburg, germany|https://www.linkedin.com/jobs/view/4277364448
shift technology|senior fullstack developer - c# and react - madrid|madrid, community of madrid, spain|https://www.linkedin.com/jobs/view/4278272787
totalenergies|power platform developer intern|milan, lombardy, italy|https://www.linkedin.com/jobs/view/4271032659
tagueri ag|werkstudent projektmanagement assistenz (m/w/d)*|munich, bavaria, germany|https://www.linkedin.com/jobs/view/4268192662
allianz|intern (m/f/d) within global insurance procurement at allianz se|munich, bavaria, germany|https://www.linkedin.com/jobs/view/4277839213
twt gmbh science & innovation|mathematiker, informatiker, naturwissenschaftler für industrie und forschung / research manager (m/w/d)|munich, bavaria, germany|https://www.linkedin.com/jobs/view/4259941271
sap|sap ixp - partneredge design team - internship (limited - part time)|prague, prague, worldwide|https://www.linkedin.com/jobs/view/4274339673
ois group|hr intern|rome, latium, italy|https://www.linkedin.com/jobs/view/4270102225
ayvens|network operations consultant intern|rome, latium, italy|https://www.linkedin.com/jobs/view/4204641694
kpmg italy|junior consultant - investigation and disputes (intern)|rome, latium, italy|https://www.linkedin.com/jobs/view/4274311390
kpmg italy|junior intelligent automation (intern) - digital transformation|rome, latium, italy|https://www.linkedin.com/jobs/view/4236565306
webuild|intern technical quality|rome, latium, italy|https://www.linkedin.com/jobs/view/4270626054
zavo|sales intern|delhi, delhi, india|https://www.linkedin.com/jobs/view/4280818303
aaizel international technologies pvt ltd|sales and marketing intern|gurugram, haryana, india|https://www.linkedin.com/jobs/view/4277791039
netflix|security protocols engineering intern|los gatos, canada|https://www.linkedin.com/jobs/view/4260326224
safetykit|full stack engineer, intern|san francisco, canada|https://www.linkedin.com/jobs/view/4214745176
eyeline studios|research intern (fall 2025/spring 2026)|los angeles, canada|https://www.linkedin.com/jobs/view/4244920583
eyeline studios|research intern (summer 2026)|los angeles, canada|https://www.linkedin.com/jobs/view/4247535495
sb energy|ai strategy & data science intern|redwood city, canada|https://www.linkedin.com/jobs/view/4252093395
lensa|data associate (fall/winter internship)|united states|https://www.linkedin.com/jobs/view/4280748480
genbio ai|research scientist intern|palo alto, canada|https://www.linkedin.com/jobs/view/4270487330
hydrow, inc.|social media intern|boston, morocco|https://www.linkedin.com/jobs/view/4247377193
toyota research institute|future product innovation research intern, hci creativity|los altos, canada|https://www.linkedin.com/jobs/view/4249867459
x, the moonshot factory|2025 phd / masters residency - ml, ai for mental health|mountain view, canada|https://www.linkedin.com/jobs/view/4255266386
wgi|intern - geospatial ai fall 2025|al, huntsville, worldwide|https://www.linkedin.com/jobs/view/4274683997
global nomadic|volunteer: plants, people, and healing: discovering ecuador s amazonian ethnobotany|ct, new haven, worldwide|https://www.linkedin.com/jobs/view/4218851695
global nomadic|volunteer: plants, people, and healing: discovering ecuador s amazonian ethnobotany|md, baltimore, worldwide|https://www.linkedin.com/jobs/view/4218848896
mitre|computational finance technology and regulation analyst|va, mclean, worldwide|https://www.linkedin.com/jobs/view/4278624950
peraton|cloud systems administrator, lead associate|md, laurel, worldwide|https://www.linkedin.com/jobs/view/4245632136
oak ridge institute for science and education|kinetic technology systems modeling, testing and analysis fellowship|nm, albuquerque, worldwide|https://www.linkedin.com/jobs/view/4206152483
str|it support specialist|va, arlington, worldwide|https://www.linkedin.com/jobs/view/4189840875
genbio ai|research scientist intern|paris, île-de-france, france|https://www.linkedin.com/jobs/view/4279404691
university of michigan|data science intern, temporary|mi, ann arbor, worldwide|https://www.linkedin.com/jobs/view/4279918575
point72|summer 2026 quantitative researcher internship|new york, united states|https://www.linkedin.com/jobs/view/3914460825
jobright.ai|data science intern, temporary|mi, ann arbor, worldwide|https://www.linkedin.com/jobs/view/4280086163
prosus group|ml engineering intern - llm research & development|amsterdam, north holland, netherlands|https://www.linkedin.com/jobs/view/4230629565
gptzero|software engineering intern|ny, new york, worldwide|https://www.linkedin.com/jobs/view/4273806951
cimpress|data engineer intern, pex team - netherlands remote|netherlands|https://www.linkedin.com/jobs/view/4243899391
internations|online marketing intern - seo|germany|https://www.linkedin.com/jobs/view/4275564217
dept®|digital strategy and research intern|amsterdam, north holland, netherlands|https://www.linkedin.com/jobs/view/4219646802
catharina hospital eindhoven|digital marketeer - parttime|eindhoven, north brabant, netherlands|https://www.linkedin.com/jobs/view/4269273391
owkin|marketing intern (generalist)|paris, île-de-france, france|https://www.linkedin.com/jobs/view/4249054419
le village by ca paris|sales development representative (sdr) intern|paris, île-de-france, france|https://www.linkedin.com/jobs/view/4250592949
blauwe monsters (part of conclusion)|sea specialist|haarlem, north holland, netherlands|https://www.linkedin.com/jobs/view/4250233122
red panda works|paid ads specialist b2b - linkedin & google, amsterdam|amsterdam, north holland, netherlands|https://www.linkedin.com/jobs/view/4267970584
trustpair|hr generalist intern/apprentice m/f/mx|greater paris metropolitan region, worldwide|https://www.linkedin.com/jobs/view/4256330052
international education corporation|marketing intern (57856)|irvine, canada|https://www.linkedin.com/jobs/view/4259643616
meta|research scientist intern, ai core machine learning (phd)|ny, new york, worldwide|https://www.linkedin.com/jobs/view/4255809915
meta|research scientist intern, ai core machine learning (phd)|san francisco, canada|https://www.linkedin.com/jobs/view/4255815175
meta|research scientist intern, ai core machine learning (phd)|wa, seattle, worldwide|https://www.linkedin.com/jobs/view/4255813699
meta|research scientist intern, ai core machine learning (phd)|menlo park, canada|https://www.linkedin.com/jobs/view/4255811894
meta|research scientist intern, holography & material (phd)|wa, redmond, worldwide|https://www.linkedin.com/jobs/view/4270394863
sabato ai|artificial intelligence engineer (intern)|barcelona, catalonia, spain|https://www.linkedin.com/jobs/view/4279425283
mindverse|werkstudent im bereich seo (m/w/d) bei der ki-gestützten seo-agentur, mit dem besten angewandten sprachmodell|berlin, berlin, germany|https://www.linkedin.com/jobs/view/4270345350
inbold|project management intern (danish, relocate to vietnam)|copenhagen, capital region of denmark, denmark|https://www.linkedin.com/jobs/view/4281158751
cordaan|managementassistent hr en financiën – amsterdam|amsterdam, north holland, netherlands|https://www.linkedin.com/jobs/view/4275955918
lensa|software engineering intern - summer 2026|mn, minneapolis, worldwide|https://www.linkedin.com/jobs/view/4279434046
breatheit, inc.|marketing intern|minnesota, united states|https://www.linkedin.com/jobs/view/4279712073
ripplematch|business process analyst intern|mn, minneapolis, worldwide|https://www.linkedin.com/jobs/view/4277207185
ripplematch|business process analyst intern, application via ripplematch|mn, minneapolis, worldwide|https://www.linkedin.com/jobs/view/4269937176
ripplematch|investment analyst intern|mn, minneapolis, worldwide|https://www.linkedin.com/jobs/view/4277204526
ripplematch|investment analyst intern, application via ripplematch|mn, minneapolis, worldwide|https://www.linkedin.com/jobs/view/4279183614
ripplematch|business development intern, application via ripplematch|mn, minneapolis, worldwide|https://www.linkedin.com/jobs/view/4269574880
ripplematch|banking analyst intern|mn, minneapolis, worldwide|https://www.linkedin.com/jobs/view/4271118814
ripplematch|banking analyst intern, application via ripplematch|mn, minneapolis, worldwide|https://www.linkedin.com/jobs/view/4268601695
ripplematch|business operations intern, application via ripplematch|mn, minneapolis, worldwide|https://www.linkedin.com/jobs/view/4269938098
