company|title|location|link
amazon|applied science internship, amazon university talent acquisition|graz, styria, austria|https://www.linkedin.com/jobs/view/4168648019
amazon|2025 applied scientist internship, amazon university talent acquisition, amazon university talent acquisition|paris, île-de-france, france|https://www.linkedin.com/jobs/view/4160554807
amazon web services (aws)|2025 applied scientist internship, amazon university talent acquisition|munich, bavaria, germany|https://www.linkedin.com/jobs/view/4048225174
amazon web services (aws)|2025 applied scientist internship, amazon university talent acquisition|berlin, berlin, germany|https://www.linkedin.com/jobs/view/4048220680
amazon web services (aws)|2025 applied scientist internship, amazon university talent acquisition|aachen, north rhine-westphalia, germany|https://www.linkedin.com/jobs/view/4254721235
taktile|accounting (finance) working student|berlin, berlin, germany|https://www.linkedin.com/jobs/view/4251952190
infomotion gmbh|ai principal consultant (m/w/d)|frankfurt rhine-main metropolitan area, worldwide|https://www.linkedin.com/jobs/view/4250413948
amazon|2025 applied scientist internship, amazon university talent acquisition|luxembourg, luxembourg, luxembourg|https://www.linkedin.com/jobs/view/4046264809
amazon|2025 applied scientist internship, amazon university talent acquisition|amsterdam, north holland, netherlands|https://www.linkedin.com/jobs/view/4066244289
amazon web services (aws)|2025 applied scientist internship, amazon university talent acquisition|leek, groningen, netherlands|https://www.linkedin.com/jobs/view/4257274090
sopra steria|data scientist|nieuwegein, utrecht, netherlands|https://www.linkedin.com/jobs/view/4227021508
vanderlande|internship/graduation: data-driven service - millions of logs, one insight: can you find it?|veghel, north brabant, netherlands|https://www.linkedin.com/jobs/view/4234996731
operator one|internship  performance marketing marketplaces|almere, flevoland, netherlands|https://www.linkedin.com/jobs/view/4121104385
amazon web services (aws)|research scientist intern, device team, aws center for quantum computing|pasadena, canada|https://www.linkedin.com/jobs/view/4255379050
amazon|2025 applied scientist internship, amazon university talent acquisition|madrid, community of madrid, spain|https://www.linkedin.com/jobs/view/4046092062
amazon|2025 applied scientist internship, amazon university talent acquisition|barcelona, catalonia, spain|https://www.linkedin.com/jobs/view/4046091208
xr solutions|web developer intern|stockholm county, sweden|https://www.linkedin.com/jobs/view/4254344070
amazon|2025 applied scientist internship, amazon university talent acquisition|london, england, united kingdom|https://www.linkedin.com/jobs/view/4040164728
amazon|2025 applied scientist internship, amazon university talent acquisition|cambridge, england, united kingdom|https://www.linkedin.com/jobs/view/4040163933
amazon|2025 applied scientist internship, amazon university talent acquisition|edinburgh, scotland, united kingdom|https://www.linkedin.com/jobs/view/4040163934
amazon|2025 data scientist internship (multiple locations), amazon university talent acquisition|london, england, united kingdom|https://www.linkedin.com/jobs/view/4244821230
deductive ai|software engineer intern, london|london, england, united kingdom|https://www.linkedin.com/jobs/view/4085602965
targetjobs uk|2025 applied scientist internship|london, england, united kingdom|https://www.linkedin.com/jobs/view/4240708751
bigblue|software engineer intern|paris, île-de-france, france|https://www.linkedin.com/jobs/view/3575815459
taktile|software engineer working student/intern|berlin, berlin, germany|https://www.linkedin.com/jobs/view/4205745296
getml|(intern) business development in ml - german speaking, d/f/m|germany|https://www.linkedin.com/jobs/view/4253942724
csi-cancer: usc michelson center convergent science institute in cancer|2025 phd scientist internship (eater pricing and incentives), united states at uber|los angeles, canada|https://www.linkedin.com/jobs/view/4256822390
genbio ai|research scientist intern|paris, île-de-france, france|https://www.linkedin.com/jobs/view/4257215500
equativ|data scientist intern|paris, île-de-france, france|https://www.linkedin.com/jobs/view/4250490631
equativ|data scientist intern|paris, île-de-france, france|https://www.linkedin.com/jobs/view/4248732499
employability ltd|software engineer/site reliability engineer internship|paris, île-de-france, france|https://www.linkedin.com/jobs/view/4257249752
owkin|intern - ai research scientist - frontier research|paris, île-de-france, france|https://www.linkedin.com/jobs/view/4249258308
oracle|intern as ai engineer - part time for student|budapest, budapest, hungary|https://www.linkedin.com/jobs/view/4184199303
subito|junior digital advertising intern|milan, lombardy, italy|https://www.linkedin.com/jobs/view/4251658694
revantage europe, a blackstone portfolio company|technology, artificial intelligence internship – research & development (6 months starting july/august 2025)|luxembourg, luxembourg|https://www.linkedin.com/jobs/view/4242009102
skytree|quality intern - plm project|amsterdam, north holland, netherlands|https://www.linkedin.com/jobs/view/4250394005
surplusmap|internship data engineer|oslo, oslo, norway|https://www.linkedin.com/jobs/view/4226127074
air space intelligence|internship - software engineer|gdańsk, pomorskie, poland|https://www.linkedin.com/jobs/view/4214759554
feedzai|fp&a moonshot internship|portugal|https://www.linkedin.com/jobs/view/4222316463
genies|marketing and social media intern|los angeles metropolitan area, worldwide|https://www.linkedin.com/jobs/view/4243057334
geotab|marketing intern (bilingual spanish)|madrid, community of madrid, spain|https://www.linkedin.com/jobs/view/4236210963
adsmurai|paid media specialist intern - madrid (they/he/she)|madrid, community of madrid, spain|https://www.linkedin.com/jobs/view/4244770085
geotab|marketing intern (bilingual french)|madrid, community of madrid, spain|https://www.linkedin.com/jobs/view/4236258581
cradle|software engineering/machine learning intern (f/m/*)|zurich, zurich, switzerland|https://www.linkedin.com/jobs/view/4243585036
insider.|digital sales development representative intern|istanbul, istanbul, worldwide|https://www.linkedin.com/jobs/view/4200201475
cubic corporation|innovation intern ai|salfords, england, united kingdom|https://www.linkedin.com/jobs/view/4238265716
instadeep|research engineer intern - applied reinforcement learning (deeppcb)|london, england, united kingdom|https://www.linkedin.com/jobs/view/4169981899
cubic corporation|innovation intern|baker street, england, united kingdom|https://www.linkedin.com/jobs/view/4238268528
instadeep|research engineer intern in bioai|london, england, united kingdom|https://www.linkedin.com/jobs/view/4199860972
instadeep|phd research engineer intern - language models for biological sequences|london, england, united kingdom|https://www.linkedin.com/jobs/view/4226661014
delaware belux|data & ai internship (summer 2025)|kortrijk metropolitan area, worldwide|https://www.linkedin.com/jobs/view/4253157045
delaware belux|data & ai internship (summer 2025)|ghent metropolitan area, worldwide|https://www.linkedin.com/jobs/view/4227053771
egov select|cybersecurity analyst @ cert (m/v/x)|brussels, brussels region, belgium|https://www.linkedin.com/jobs/view/4255149279
protiviti|atlanta technology consulting intern - 2026|ga, atlanta, worldwide|https://www.linkedin.com/jobs/view/4051082997
freddie mac|data science engineer, associate|ga, atlanta, worldwide|https://www.linkedin.com/jobs/view/4254158088
battelle|skillbridge - network security analyst|ga, augusta, worldwide|https://www.linkedin.com/jobs/view/4160586746
lufthansa|internship data science in data and analytics department|frankfurt, hesse, germany|https://www.linkedin.com/jobs/view/4240065166
hahn-schickard|masterarbeit (m/w/d) ki-analyse von ultraschall-emissionen v. pflanzen|villingen-schwenningen, baden-württemberg, germany|https://www.linkedin.com/jobs/view/4200284877
hopn|unpaid remote internships as full-stack software engineer, software tester & mobile developer|germany|https://www.linkedin.com/jobs/view/4236071600
constructor tech|hr intern|bremen, bremen, germany|https://www.linkedin.com/jobs/view/4161565456
dailytalents|data engineer bei der integrated worlds gmbh in holzgerlingen oder oschatz|holzgerlingen, baden-württemberg, germany|https://www.linkedin.com/jobs/view/4241860117
constructor tech|finance intern|bremen, bremen, germany|https://www.linkedin.com/jobs/view/4161565458
deutsche börse|intern - derivatives clearing design (f/m/d)|frankfurt, hesse, germany|https://www.linkedin.com/jobs/view/4247019835
electrolux professional türkiye|junior ai developer - intern|pordenone, friuli-venezia giulia, italy|https://www.linkedin.com/jobs/view/4255064394
electrolux professional group|junior ai developer - intern|pordenone, friuli-venezia giulia, italy|https://www.linkedin.com/jobs/view/4252319946
mission technologies, a division of hii|logistics technician (skillbridge intern) - 22873|naples, campania, italy|https://www.linkedin.com/jobs/view/4245301026
pwc luxembourg|intern reinsurance business analyst (m/f/d)|luxembourg|https://www.linkedin.com/jobs/view/4161946665
iquality|afstudeeropdracht security testing ai|nijmegen, gelderland, netherlands|https://www.linkedin.com/jobs/view/4094005116
haskoning|internship: ai in supply chain management|amersfoort, utrecht, netherlands|https://www.linkedin.com/jobs/view/4198342379
haskoning|internship: ai in supply chain management|amersfoort, utrecht, netherlands|https://www.linkedin.com/jobs/view/4198338893
ibm|ibm internship data science|bucharest, bucharest, romania|https://www.linkedin.com/jobs/view/4253305859
ibm|ibm internship data science|bucharest, bucharest, romania|https://www.linkedin.com/jobs/view/4253304855
ibm|ibm internship data science|cluj-napoca, cluj, romania|https://www.linkedin.com/jobs/view/4253313139
ibm|ibm internship data science|cluj-napoca, cluj, romania|https://www.linkedin.com/jobs/view/4253307765
ibm|ibm internship data science|timişoara, timiş, romania|https://www.linkedin.com/jobs/view/4253309639
ibm|ibm internship data science|timişoara, timiş, romania|https://www.linkedin.com/jobs/view/4253306806
ormco|r&d data scientist intern|brea, canada|https://www.linkedin.com/jobs/view/4244218720
protiviti|los angeles technology consulting intern - 2026|los angeles, canada|https://www.linkedin.com/jobs/view/4051187042
gt's living foods|ci intern operations & engineering|los angeles metropolitan area, worldwide|https://www.linkedin.com/jobs/view/4213965428
mygwork - lgbtq+ business community|data scientist intern|madrid, community of madrid, spain|https://www.linkedin.com/jobs/view/4253920844
tomtom|data scientist intern|madrid, community of madrid, spain|https://www.linkedin.com/jobs/view/4255230499
smadex|data analyst intern|barcelona, catalonia, spain|https://www.linkedin.com/jobs/view/4235213675
ferrovial|human resources innovation intern: ai, automation & data science|madrid, community of madrid, spain|https://www.linkedin.com/jobs/view/4234242478
mygwork - lgbtq+ business community|data scientist intern|madrid, community of madrid, spain|https://www.linkedin.com/jobs/view/4252480981
mantu|fullstack developer internship - f/m/x|greater barcelona metropolitan area, worldwide|https://www.linkedin.com/jobs/view/4249221156
verisure|procurement & compliance intern|pozuelo de alarcón, community of madrid, spain|https://www.linkedin.com/jobs/view/4252502926
tietalent|senior data consultant|basel, switzerland|https://www.linkedin.com/jobs/view/4167585239
rapsodo|people & culture intern|i̇zmir, i̇zmir, worldwide|https://www.linkedin.com/jobs/view/4237727588
tomtom|data scientist intern|madrid, community of madrid, spain|https://www.linkedin.com/jobs/view/4243333012
ezpada|cloud automation & ai intern (part-time/full-time)|czechia, prague, worldwide|https://www.linkedin.com/jobs/view/4252664927
eyeline studios - powered by netflix|research intern (fall 2025/spring 2026)|los angeles, canada|https://www.linkedin.com/jobs/view/4244920583
eyeline studios - powered by netflix|research intern (summer 2026)|los angeles, canada|https://www.linkedin.com/jobs/view/4247535495
amazon|stages 2025 – product/program management (h/f/x)|clichy, île-de-france, france|https://www.linkedin.com/jobs/view/4036665609
global nomadic|volunteer: plants, people, and healing: discovering ecuador s amazonian ethnobotany|paris, île-de-france, france|https://www.linkedin.com/jobs/view/4218853514
amazon web services (aws)|2025 software development engineer intern - embedded development (m/w/d)|berlin, germany|https://www.linkedin.com/jobs/view/4147788039
amazon web services (aws)|2025 software development engineer intern - embedded development (m/w/d)|dresden, saxony, germany|https://www.linkedin.com/jobs/view/4161596934
global nomadic|volunteer: plants, people, and healing: discovering ecuador s amazonian ethnobotany|munich, bavaria, germany|https://www.linkedin.com/jobs/view/3803763516
global nomadic|volunteer: plants, people, and healing: discovering ecuador s amazonian ethnobotany|berlin, berlin, germany|https://www.linkedin.com/jobs/view/4218847919
global nomadic|volunteer: plants, people, and healing: discovering ecuador s amazonian ethnobotany|dublin, county dublin, ireland|https://www.linkedin.com/jobs/view/4005628834
global nomadic|volunteer: plants, people, and healing: discovering ecuador s amazonian ethnobotany|amsterdam, north holland, netherlands|https://www.linkedin.com/jobs/view/3803761709
global nomadic|volunteer: plants, people, and healing: discovering ecuador s amazonian ethnobotany|pasadena, canada|https://www.linkedin.com/jobs/view/3803759800
amazon|2025 software development engineer intern - embedded development|madrid, community of madrid, spain|https://www.linkedin.com/jobs/view/4071890759
global nomadic|volunteer: plants, people, and healing: discovering ecuador s amazonian ethnobotany|london, england, united kingdom|https://www.linkedin.com/jobs/view/4218852585
precis|digital marketing internship|copenhagen metropolitan area, worldwide|https://www.linkedin.com/jobs/view/4206590745
upflow|data analyst intern|paris, île-de-france, france|https://www.linkedin.com/jobs/view/4224025499
s2e  business technology consultants|artificial intelligence intern|milan, lombardy, italy|https://www.linkedin.com/jobs/view/4242413869
caltech|research intern|pasadena, canada|https://www.linkedin.com/jobs/view/4247959317
sap|working student / intern (f/m/d) - consulting and project operations|innere stadt, vienna, austria|https://www.linkedin.com/jobs/view/4255220872
lincoln international|intern, m&a|brussels, brussels region, belgium|https://www.linkedin.com/jobs/view/4205582632
hello tomorrow|startup challenge analyst (internship)|paris, île-de-france, france|https://www.linkedin.com/jobs/view/4253242501
altman solon|strategy consulting intern tmt (m/f/d)|paris, île-de-france, france|https://www.linkedin.com/jobs/view/4239717791
accor|digital communications intern|paris, île-de-france, france|https://www.linkedin.com/jobs/view/4255084747
accor|digital communications intern|issy-les-moulineaux, île-de-france, france|https://www.linkedin.com/jobs/view/4248677980
accor|digital communications intern|issy-les-moulineaux, île-de-france, france|https://www.linkedin.com/jobs/view/4248212031
döhlergroup|product manager intern|ga, cartersville, worldwide|https://www.linkedin.com/jobs/view/4244974037
crowe|tax learning strategy senior associate|ga, atlanta, worldwide|https://www.linkedin.com/jobs/view/4246103400
tozero|strategy finance intern (m/f/x)  climate tech startup|karlsfeld, bavaria, germany|https://www.linkedin.com/jobs/view/4226415870
altman solon|strategy consulting intern tmt (m/f/d)|munich, bavaria, germany|https://www.linkedin.com/jobs/view/4209798893
teamviewer|work student, product strategy (all genders)|göppingen, baden-württemberg, germany|https://www.linkedin.com/jobs/view/4229144413
welthungerhilfe (whh)|intern people and organizational development|bonn, north rhine-westphalia, germany|https://www.linkedin.com/jobs/view/4255194308
alaika advisory|working student - workspace management & executive support (f/m/d)|munich, bavaria, germany|https://www.linkedin.com/jobs/view/4224553771
teamviewer|intern, talent acquisition (all genders)|karlsruhe, baden-württemberg, germany|https://www.linkedin.com/jobs/view/4230950772
teamviewer|intern, talent acquisition (all genders)|stuttgart, baden-württemberg, germany|https://www.linkedin.com/jobs/view/4230956320
teamviewer|intern, talent acquisition (all genders)|göppingen, baden-württemberg, germany|https://www.linkedin.com/jobs/view/4230956321
mckinsey & company|capabilities & insights intern|athens metropolitan area, worldwide|https://www.linkedin.com/jobs/view/4253491951
calor ireland|business intelligence intern (6 month contract)|dublin, county dublin, ireland|https://www.linkedin.com/jobs/view/4244889978
altman solon|strategy consulting intern tmt (m/f/d)|milan, lombardy, italy|https://www.linkedin.com/jobs/view/4060234049
avanade|ui/ux designer - stage|milan, lombardy, italy|https://www.linkedin.com/jobs/view/4223732550
bacardi|internship 6 months – visitor center & shop|pessione, piedmont, italy|https://www.linkedin.com/jobs/view/4245513715
avanade|intern scm business analyst - erp microsoft dynamics 365|turin, piedmont, italy|https://www.linkedin.com/jobs/view/4201260579
avanade|intern finance business analyst - erp microsoft dynamics 365|milan, lombardy, italy|https://www.linkedin.com/jobs/view/4215833492
avanade|intern scm business analyst - erp microsoft dynamics 365|bologna, emilia-romagna, italy|https://www.linkedin.com/jobs/view/4201258660
avanade|intern scm business analyst - erp microsoft dynamics 365|milan, lombardy, italy|https://www.linkedin.com/jobs/view/4201257929
tripadvisor|accountant intern - milan, italy|milan, lombardy, italy|https://www.linkedin.com/jobs/view/4248774140
the heineken company|internship - global p&ci risk response|amsterdam, north holland, netherlands|https://www.linkedin.com/jobs/view/4240901745
elekta|people service center intern|warsaw, mazowieckie, poland|https://www.linkedin.com/jobs/view/4238264082
deutsche bank|corporate coverage intern|lisbon, lisbon, portugal|https://www.linkedin.com/jobs/view/4229119582
avanade|professional internship in crm (customer relationship management)|lisboa, lisbon, portugal|https://www.linkedin.com/jobs/view/4255248703
avanade|professional internship in erp (enterprise resource planning)|lisboa, lisbon, portugal|https://www.linkedin.com/jobs/view/4255248705
boston consulting group (bcg)|hr recruiting intern - emesa region|lisbon, lisbon, portugal|https://www.linkedin.com/jobs/view/4235481119
protiviti|los angeles business performance improvement intern - 2026|los angeles, canada|https://www.linkedin.com/jobs/view/4051181781
protiviti|los angeles risk and compliance intern - 2026|los angeles, canada|https://www.linkedin.com/jobs/view/4051183360
protiviti|los angeles internal audit and financial advisory intern - 2026|los angeles, canada|https://www.linkedin.com/jobs/view/4051187045
cohnreznick|audit winter 2026 internship - san francisco|los angeles, canada|https://www.linkedin.com/jobs/view/4239373855
cohnreznick|audit summer 2026 internship - san francisco, ca|los angeles, canada|https://www.linkedin.com/jobs/view/4239371919
cohnreznick|audit summer 2026 internship - los angeles, ca|los angeles, canada|https://www.linkedin.com/jobs/view/4239375733
crowe|tax learning strategy senior associate|los angeles, canada|https://www.linkedin.com/jobs/view/4245999602
cohnreznick|audit winter 2026 internship - los angeles, ca|los angeles, canada|https://www.linkedin.com/jobs/view/4239372911
verisure|learning & development intern|pozuelo de alarcón, community of madrid, spain|https://www.linkedin.com/jobs/view/4249084154
axa xl|underwriting intern financial lines / graduate|zurich, zurich, switzerland|https://www.linkedin.com/jobs/view/4253624024
sap|ch_working student/intern (f/m/d): controlling and accounting|lausanne, vaud, switzerland|https://www.linkedin.com/jobs/view/4204866460
lincoln international|internship, portfolio valuations|london, england, united kingdom|https://www.linkedin.com/jobs/view/4229142928
thefork|accountant intern - milan, italy|milan, lombardy, italy|https://www.linkedin.com/jobs/view/4248452843
allianz services|intern (m/f/d) - allianz consulting - germany, sales and distribution|unterföhring, bavaria, germany|https://www.linkedin.com/jobs/view/4249062408
instaffo|customer success manager|munich, bavaria, germany|https://www.linkedin.com/jobs/view/4240946690
paradox en|client success & operation intern|paris, île-de-france, france|https://www.linkedin.com/jobs/view/4255310389
paradox en|client success & operation intern|nice, provence-alpes-côte d'azur, france|https://www.linkedin.com/jobs/view/4255304962
paradox en|client success & operation intern|lille, hauts-de-france, france|https://www.linkedin.com/jobs/view/4255311333
paradox en|client success & operation intern|strasbourg, grand est, france|https://www.linkedin.com/jobs/view/4255305726
paradox en|client success & operation intern|paris, île-de-france, france|https://www.linkedin.com/jobs/view/4255308591
paradox en|client success & operation intern|lyon, auvergne-rhône-alpes, france|https://www.linkedin.com/jobs/view/4255311332
paradox en|client success & operation intern|bordeaux, nouvelle-aquitaine, france|https://www.linkedin.com/jobs/view/4255307638
paradox en|client success & operation intern|nantes, pays de la loire, france|https://www.linkedin.com/jobs/view/4255305727
paradox en|client success & operation intern|marseille, provence-alpes-côte d'azur, france|https://www.linkedin.com/jobs/view/4255309507
paradox en|client success & operation intern|rennes, brittany, france|https://www.linkedin.com/jobs/view/4255305729
lizy|marketing content intern nl|hôpital etterbeek-ixelles, brussels region, belgium|https://www.linkedin.com/jobs/view/4200204496
distrilink|accountmanager|antwerp, flemish region, belgium|https://www.linkedin.com/jobs/view/4253682941
sap|sap ixp intern - sap analytics cloud|sofia, sofia city, worldwide|https://www.linkedin.com/jobs/view/4245345313
ntt data, inc.|alternance - inside client manager dc/cloud f/h|paris, île-de-france, france|https://www.linkedin.com/jobs/view/4253264180
evertech|marketing intern - growth & automation|ga, atlanta, worldwide|https://www.linkedin.com/jobs/view/4251662350
sparkloft media|social media intern (atl  mia  pdx)|ga, atlanta, worldwide|https://www.linkedin.com/jobs/view/4249003806
sanaexpert gmbh|working student/intern amazon department assistant (f/m/d)|greater munich metropolitan area, worldwide|https://www.linkedin.com/jobs/view/4249610478
mysecurityevent community für eine digital sichere welt|junior online marketing manager:in - social media|berlin, germany|https://www.linkedin.com/jobs/view/4253388993
mysecurityevent community für eine digital sichere welt|jr. sales manager:in  cyber-security events  verkauf  vertrieb|berlin, germany|https://www.linkedin.com/jobs/view/4255123713
qomodo|business development intern|milan, lombardy, italy|https://www.linkedin.com/jobs/view/4233608676
groupm|seo internship|milan, lombardy, italy|https://www.linkedin.com/jobs/view/4250406111
qomodo|boarding development representative intern (bdr)|milan, lombardy, italy|https://www.linkedin.com/jobs/view/4255744288
joinrs italia|[graduate program - amazon] marketing intern|italy|https://www.linkedin.com/jobs/view/4255130120
wpp media|seo internship|milan, lombardy, italy|https://www.linkedin.com/jobs/view/4248134465
qomodo|customer support & credit collection intern|milan, lombardy, italy|https://www.linkedin.com/jobs/view/4199362401
signify lighting academy|marketplace internship|eindhoven, north brabant, netherlands|https://www.linkedin.com/jobs/view/4251852057
g-star|intern strategic accounts – amazon|amsterdam, north holland, netherlands|https://www.linkedin.com/jobs/view/4220108975
signify|marketplace internship|eindhoven, north brabant, netherlands|https://www.linkedin.com/jobs/view/4224393727
vanderlande|internship: ticket quality auditing tool|veghel, north brabant, netherlands|https://www.linkedin.com/jobs/view/4230811047
single grain  start growing|ai automation internship|los angeles, canada|https://www.linkedin.com/jobs/view/4250741323
bdeo|technical support specialist|madrid, community of madrid, spain|https://www.linkedin.com/jobs/view/4241882256
visualised ab|product manager - zoom cx & contact center|greater stockholm metropolitan area, worldwide|https://www.linkedin.com/jobs/view/4233034137
rival|social media marketing intern|london, england, united kingdom|https://www.linkedin.com/jobs/view/4247478160
mysecurityevent community für eine digital sichere welt|performance marketing manager:in|berlin, germany|https://www.linkedin.com/jobs/view/4254308028
mysecurityevent community für eine digital sichere welt|social media marketing manager:in  online marketing|berlin, germany|https://www.linkedin.com/jobs/view/4252654544
jus mundi|internship in legaltech – jus ai arbitration legal expert intern (6 months)|paris, île-de-france, france|https://www.linkedin.com/jobs/view/4207361544
groupm|lia/internship within creative|stockholm, stockholm county, sweden|https://www.linkedin.com/jobs/view/4256083800
wpp media|lia/internship within creative|stockholm, stockholm county, sweden|https://www.linkedin.com/jobs/view/4253944434
qomodo|hr intern - recruiting & people operations|milan, lombardy, italy|https://www.linkedin.com/jobs/view/4257449710
