company|title|location|link
ubs|2025 off-cycle internship – technology – ai research assistant – lu|cassarate, ticino, switzerland|https://www.linkedin.com/jobs/view/4168235422
ubs|2025 off-cycle internship – technology – ai research assistant – lu|paradiso, ticino, switzerland|https://www.linkedin.com/jobs/view/4168234651
turbo reach|summer intern|england, united kingdom|https://www.linkedin.com/jobs/view/4220525318
microtech global ltd|artificial intelligence intern|staines-upon-thames, england, united kingdom|https://www.linkedin.com/jobs/view/4215331323
villanova university|graduate research assistant - data analyst: migration|law, scotland, united kingdom|https://www.linkedin.com/jobs/view/4153885751
meta|ai research assistant (phd)|london, england, united kingdom|https://www.linkedin.com/jobs/view/4148726117
villanova university|graduate research assistant - data analyst: migration|law, scotland, united kingdom|https://www.linkedin.com/jobs/view/4159635535
university of glasgow|research assistant / associate - artificial intelligence (ai) for cancer project|glasgow, scotland, united kingdom|https://www.linkedin.com/jobs/view/4213618876
meta|ai research assistant (phd)|london, england, united kingdom|https://www.linkedin.com/jobs/view/4120824753
simon-kucher|praktikum associate consultant data science (m/w/d) – berlin|berlin, berlin, germany|https://www.linkedin.com/jobs/view/4178428192
deutsche bundesbank|praktikum im bereich market intelligence|frankfurt am main, hesse, germany|https://www.linkedin.com/jobs/view/3667267721
hawkins\brown|research internship|london, england, united kingdom|https://www.linkedin.com/jobs/view/4218215512
tno|internship  energy prediction digital twin for electric vehicles integrating carla into matlab/simulink|helmond, north brabant, netherlands|https://www.linkedin.com/jobs/view/3909849424
iav gmbh|internship – transmission and edrive test|stollberg, saxony, germany|https://www.linkedin.com/jobs/view/4167472656
tno|internship  implementation of battery ageing models in a modular simulation framework|helmond, north brabant, netherlands|https://www.linkedin.com/jobs/view/3766786387
huawei|research intern/master thesis/working student for safe generative ai (m/f/d)|munich, bavaria, germany|https://www.linkedin.com/jobs/view/4166726725
interdigital, inc.|r&i research intern, 3d-mesh and 3d-gaussians|greater rennes metropolitan area, worldwide|https://www.linkedin.com/jobs/view/4196106618
fraunhofer-alumni e.v.|praktikum o. abschlussarbeit im bereich 2d/3d computer vision und deep learning f. autonomes fliegen|ingolstadt, bavaria, germany|https://www.linkedin.com/jobs/view/4219649262
innosent gmbh|praktikum/praxissemester im bereich radarentwicklung|erlangen, bavaria, germany|https://www.linkedin.com/jobs/view/4051974800
german aerospace center (dlr)|praktikum/masterarbeit (w/m/d) - kamerabasierte lagebestimmung für autonome mondlandungen|bremen, bremen, germany|https://www.linkedin.com/jobs/view/4207494240
tietalent|praktikum im bereich adas - sensordatenfusion für hochautomatisierte nutzfahrzeuge|stuttgart, baden-württemberg, germany|https://www.linkedin.com/jobs/view/4211492191
fev europe gmbh|abschlussarbeiter/praktikant (m/w/d) im bereich ki-basierte unterstützung für modellbasierte funktionsentwicklung|aldenhoven, north rhine-westphalia, germany|https://www.linkedin.com/jobs/view/4147177252
edag group|praktikum toolentwicklung fahrwerk / fahrdynamik|wolfsburg, lower saxony, germany|https://www.linkedin.com/jobs/view/4209575531
ksb company|praktikum-abschlussarbeit entwicklungsunterstützung|frankenthal, rhineland-palatinate, germany|https://www.linkedin.com/jobs/view/3981623696
claas|praktikum / abschlussarbeit automatisierungs- und regelungstechnik|harsewinkel, north rhine-westphalia, germany|https://www.linkedin.com/jobs/view/4204640441
tietalent|praktikum im bereich "data, ai and digital compliance" ab juni 2025|stuttgart, baden-württemberg, germany|https://www.linkedin.com/jobs/view/4200246506
metro österreich|international management trainee (m/w/d) - metro potential programm|vösendorf, lower austria, austria|https://www.linkedin.com/jobs/view/4206505059
eurofunk kappacher gmbh|trainee softwareentwicklung (m/w/d)|sankt johann im pongau, salzburg, austria|https://www.linkedin.com/jobs/view/4143170633
stmicroelectronics|software engineer internship: enhance user experience for cutting-edge software|graz, styria, austria|https://www.linkedin.com/jobs/view/4150450826
infineon technologies|internship: digitalization - software programmer in the ip context (f/m/div)|villach, carinthia, austria|https://www.linkedin.com/jobs/view/4214652767
dynatrace|internship in technical writing & ux / ui|linz, upper austria, austria|https://www.linkedin.com/jobs/view/4209533380
ge healthcare|ai regulatory and data management internship|vöcklamarkt, upper austria, austria|https://www.linkedin.com/jobs/view/4188266178
greenomy|marketing intern|ixelles, belgium|https://www.linkedin.com/jobs/view/4205936879
furt'her|digital marketing intern|brussels metropolitan area, worldwide|https://www.linkedin.com/jobs/view/4217807445
efficy|internal communication intern|kraainem, flemish region, belgium|https://www.linkedin.com/jobs/view/4195460303
procter & gamble|ai engineering internship|brussels, brussels region, belgium|https://www.linkedin.com/jobs/view/4204920835
odoo|software engineer intern|ramillies, walloon region, belgium|https://www.linkedin.com/jobs/view/4214509296
proximus ada|internship - full stack developer|brussels, brussels region, belgium|https://www.linkedin.com/jobs/view/4186412125
madison.partners|development intern – strategic data & ai consultancy|ghent, flemish region, belgium|https://www.linkedin.com/jobs/view/4217335181
bestmix software|internship: standardized data dashboard for smarter insights|maldegem, flemish region, belgium|https://www.linkedin.com/jobs/view/4161466684
progress sitefinity|business development intern|sofia, sofia city, worldwide|https://www.linkedin.com/jobs/view/4214563826
progress|business development intern|sofia, sofia city, worldwide|https://www.linkedin.com/jobs/view/4214572988
pros|software engineer intern|bulgaria, sofia city, worldwide|https://www.linkedin.com/jobs/view/4204581964
liveperson|software engineer- intern|sofia, sofia city, worldwide|https://www.linkedin.com/jobs/view/4159194039
progress sitefinity|software engineer intern - javascript|sofia, sofia city, worldwide|https://www.linkedin.com/jobs/view/4214696554
progress sitefinity|software engineer intern - c#|sofia, sofia city, worldwide|https://www.linkedin.com/jobs/view/4214699078
progress|software engineer intern - javascript|sofia, sofia city, worldwide|https://www.linkedin.com/jobs/view/4214660383
scaleup.agency|ai & business analyst / consultant (remote internship)|split, split-dalmatia, worldwide|https://www.linkedin.com/jobs/view/4213479093
infobip|software engineer intern - zagreb|zagreb, zagreb, worldwide|https://www.linkedin.com/jobs/view/4214406113
infobip|split - software engineer intern|split, split-dalmatia, worldwide|https://www.linkedin.com/jobs/view/4214476791
infobip|services engineering intern|zagreb, zagreb, worldwide|https://www.linkedin.com/jobs/view/4214834805
scaleup.agency|ai & business analyst / consultant (remote internship)|limassol, limassol, worldwide|https://www.linkedin.com/jobs/view/4213479092
scaleup.agency|ai & business analyst / consultant (remote internship)|nicosia, nicosia, worldwide|https://www.linkedin.com/jobs/view/4213472744
cardinal health|software engineering intern|nicosia, nicosia, worldwide|https://www.linkedin.com/jobs/view/4192459985
scaleup.agency|ai & business analyst / consultant (remote internship)|copenhagen, capital region of denmark, denmark|https://www.linkedin.com/jobs/view/4213476511
scaleup.agency|ai & business analyst / consultant (remote internship)|odense, region of southern denmark, denmark|https://www.linkedin.com/jobs/view/4213472743
digibate|full-stack javascript internship|copenhagen, capital region of denmark, denmark|https://www.linkedin.com/jobs/view/4205457088
schneider electric|software engineering intern|kolding, region of southern denmark, denmark|https://www.linkedin.com/jobs/view/4215891926
scaleup.agency|ai & business analyst / consultant (remote internship)|aarhus, central denmark region, denmark|https://www.linkedin.com/jobs/view/4213472737
reshape biotech|laboratory technician intern|copenhagen, capital region of denmark, denmark|https://www.linkedin.com/jobs/view/4195841358
scaleup.agency|ai & business analyst / consultant (remote internship)|tartu, tartumaa, worldwide|https://www.linkedin.com/jobs/view/4213472742
kuva space|graphic design intern|espoo, uusimaa, finland|https://www.linkedin.com/jobs/view/4214483073
axa investment managers|data scientist intern|puteaux, île-de-france, france|https://www.linkedin.com/jobs/view/4147699783
escp business school|stagiaire en intelligence artificielle h/f|paris, île-de-france, france|https://www.linkedin.com/jobs/view/4206297863
scaleup.agency|ai & business analyst / consultant (remote internship)|paris, île-de-france, france|https://www.linkedin.com/jobs/view/4213473744
scaleup.agency|ai & business analyst / consultant (remote internship)|rennes, brittany, france|https://www.linkedin.com/jobs/view/4213478143
chantier naval couach - cnc|stagiaire en intelligence artificielle h/f|gujan-mestras, nouvelle-aquitaine, france|https://www.linkedin.com/jobs/view/4091875940
idemia|data scientist / genai intern|osny, île-de-france, france|https://www.linkedin.com/jobs/view/4216333871
criteo|product data scientist intern|paris, île-de-france, france|https://www.linkedin.com/jobs/view/4189801421
euronext|ai & innovation intern|paris, île-de-france, france|https://www.linkedin.com/jobs/view/4208972192
vadis technologies - a moody's company|software engineering intern|montbonnot-saint-martin, auvergne-rhône-alpes, france|https://www.linkedin.com/jobs/view/4124867168
lucca|software developer intern - equipe office|nantes, pays de la loire, france|https://www.linkedin.com/jobs/view/4203655870
interdigital, inc.|intern, ai/ml for media over mobile network|greater rennes metropolitan area, worldwide|https://www.linkedin.com/jobs/view/4189828790
nokia|modelling and optimization summer intern|massy, île-de-france, france|https://www.linkedin.com/jobs/view/4104167542
ge vernova|stagiaire ingénieur développement logiciel - (h/f)|massy, île-de-france, france|https://www.linkedin.com/jobs/view/4145969799
danone|apprenticeship - global communication for hr and finance  - september 2025 - (m/w)|paris, île-de-france, france|https://www.linkedin.com/jobs/view/4195981044
numind (yc s22)|sales associate internship|paris, île-de-france, france|https://www.linkedin.com/jobs/view/4217426557
cea|improving the effectiveness of llm-assisted iss generation from design specification h/f|saclay, île-de-france, france|https://www.linkedin.com/jobs/view/4060370568
impiricus|design intern|ga, atlanta, worldwide|https://www.linkedin.com/jobs/view/4213665039
crowe|audit intern winter 2026|ga, atlanta, worldwide|https://www.linkedin.com/jobs/view/4012665945
flock safety|software engineer, intern|georgia, united states|https://www.linkedin.com/jobs/view/4214785318
solopulse corp|software engineer intern/co-op - summer 2025|ga, atlanta, worldwide|https://www.linkedin.com/jobs/view/4170514763
impiricus|software engineer intern|ga, atlanta, worldwide|https://www.linkedin.com/jobs/view/4213587402
ametek|software engineering intern|ga, atlanta, worldwide|https://www.linkedin.com/jobs/view/4205429668
cargill|software engineering intern summer 2025 - atlanta, ga|ga, atlanta, worldwide|https://www.linkedin.com/jobs/view/4136338665
vidlab7|intern/working student - machine learning|munich, bavaria, germany|https://www.linkedin.com/jobs/view/4160079405
trusteq gmbh|intern artificial intelligence consulting (m/w/d)|munich, bavaria, germany|https://www.linkedin.com/jobs/view/4205798237
bmw group|intern software development high-voltage energy storages (f/m/x)|munich, bavaria, germany|https://www.linkedin.com/jobs/view/4189909111
energy job search|intern software development high-voltage energy storages (f/m/x)|munich, bavaria, germany|https://www.linkedin.com/jobs/view/4198409194
maddox ai|business development intern (m/w/d)|cologne, north rhine-westphalia, germany|https://www.linkedin.com/jobs/view/3925886367
hävg hausärztliche vertragsgemeinschaft ag|trainee softwareentwicklung (alle*) schwerpunkt ki|cologne, north rhine-westphalia, germany|https://www.linkedin.com/jobs/view/4203314073
dataiku|marketing intern dach (berlin, munich or frankfurt)|munich, bavaria, germany|https://www.linkedin.com/jobs/view/4184951998
merantix ai campus|content & marketing intern (mid may - mid nov)|berlin, berlin, germany|https://www.linkedin.com/jobs/view/4211329644
merantix capital|content & marketing intern (mid may - mid nov)|berlin, berlin, germany|https://www.linkedin.com/jobs/view/4186599668
bloom future|software developer (python, ai, mobile) - intern / working student (m/f/d)|heilbronn, baden-württemberg, germany|https://www.linkedin.com/jobs/view/4214789454
finn|internship - automation & ai (m/f/x)|munich, bavaria, germany|https://www.linkedin.com/jobs/view/4139666240
abb|internship / master thesis (m/f/d) - generative ai for code generation|mannheim, baden-württemberg, germany|https://www.linkedin.com/jobs/view/4202618717
mtu aero engines|intern at center of excellence for artificial intelligence (all genders)|munich, bavaria, germany|https://www.linkedin.com/jobs/view/4033164646
xenara ai|nestjs backend internship|frankfurt, hesse, germany|https://www.linkedin.com/jobs/view/4204576726
critalog gmbh|praktikant*in, werkstudent*in, bachelorand - softwareentwicklung autonome drohne (m/w/d)|heilbronn, baden-württemberg, germany|https://www.linkedin.com/jobs/view/4139119265
check24 vergleichsportal gmbh|trainee (m/w/d) software entwicklung|berlin, berlin, germany|https://www.linkedin.com/jobs/view/4083444410
check24 vergleichsportal gmbh|trainee (m/w/d) software entwicklung insurtech|frankfurt, hesse, germany|https://www.linkedin.com/jobs/view/4137703188
huawei|model-driven software engineering for automotive systems intern (m/f/d)|munich, bavaria, germany|https://www.linkedin.com/jobs/view/4213989704
huawei|intern - ai-based image and video compression (m/f/d)|munich, bavaria, germany|https://www.linkedin.com/jobs/view/4143891896
adesso business consulting ag|trainee sap software developer (all genders)|hamburg, hamburg, germany|https://www.linkedin.com/jobs/view/4193259075
huawei|decentralized ai learning for advanced driving systems intern (m/f/d)|munich, bavaria, germany|https://www.linkedin.com/jobs/view/4213989753
tietalent|trainee sap software developer (all genders)|berlin, berlin, germany|https://www.linkedin.com/jobs/view/4130147705
wagner informatik gmbh|trainee software-entwickler bereich digitalisierung / industrie 4.0 - initiativstelle (m/w/d)|nuremberg, bavaria, germany|https://www.linkedin.com/jobs/view/4205965987
tietalent|software entwickler als trainee (w/m/d)|wiesbaden, hesse, germany|https://www.linkedin.com/jobs/view/4219698607
tietalent|trainee sap software developer (all genders)|würzburg, bavaria, germany|https://www.linkedin.com/jobs/view/4130150402
areus gmbh|praktikant (m/w/d) softwareentwicklung|herrenberg, baden-württemberg, germany|https://www.linkedin.com/jobs/view/4164151425
adesso business consulting ag|trainee sap software developer (all genders)|würzburg, bavaria, germany|https://www.linkedin.com/jobs/view/4193255488
tietalent|informatiker als trainee softwareentwicklung (w/m/d)|wiesbaden, hesse, germany|https://www.linkedin.com/jobs/view/4219338454
tanso|technical product intern (f/m/x)|munich, bavaria, germany|https://www.linkedin.com/jobs/view/4201033600
sap|sap ixp intern (f/m/d): btp abap ai developer|walldorf, baden-württemberg, germany|https://www.linkedin.com/jobs/view/4204868437
mecklenburgische versicherungs-gesellschaft a. g.|trainee (m/w/d) softwareentwicklung, schwerpunkt cobol|hannover, lower saxony, germany|https://www.linkedin.com/jobs/view/4178766346
tietalent|wirtschaftsinformatiker als trainee softwareentwicklung (w/m/d)|wiesbaden, hesse, germany|https://www.linkedin.com/jobs/view/4219802448
serviceplan group|product marketing manager (all genders) ai & innovation|munich, bavaria, germany|https://www.linkedin.com/jobs/view/4217365474
deloitte|consultant audit - power, utilities & renewables sektor (m/w/d)|düsseldorf, north rhine-westphalia, germany|https://www.linkedin.com/jobs/view/4182900873
auto fleet control|head of product (m/w/d)|hamburg, hamburg, germany|https://www.linkedin.com/jobs/view/4199182471
accenture dach|consultant/manager – hr transformation & moderne workforce services (all genders)|berlin, berlin, germany|https://www.linkedin.com/jobs/view/4212693913
etteplan|digital solutions manager (m/w/d)|munich, bavaria, germany|https://www.linkedin.com/jobs/view/4210939772
etteplan|digital solutions manager (m/w/d)|stuttgart, baden-württemberg, germany|https://www.linkedin.com/jobs/view/4210940643
capgemini|senior berater it lösungen für versicherungen (w/m/d)|munich, bavaria, germany|https://www.linkedin.com/jobs/view/4011977543
capgemini|senior berater it lösungen für versicherungen (w/m/d)|hannover, lower saxony, germany|https://www.linkedin.com/jobs/view/4011979260
capgemini|senior berater it lösungen für versicherungen (w/m/d)|düsseldorf, north rhine-westphalia, germany|https://www.linkedin.com/jobs/view/4011977547
etteplan|digital solutions manager (m/w/d)|dortmund, north rhine-westphalia, germany|https://www.linkedin.com/jobs/view/4210936836
deloitte|(senior) manager sap methods & tools (m/w/d) in köln|cologne, north rhine-westphalia, germany|https://www.linkedin.com/jobs/view/4153115443
deloitte|(senior) manager sap methods & tools (m/w/d) in münchen|munich, bavaria, germany|https://www.linkedin.com/jobs/view/4153119072
deloitte|(senior) manager sap methods & tools (m/w/d) in stuttgart|stuttgart, baden-württemberg, germany|https://www.linkedin.com/jobs/view/4153116419
deloitte|(senior) manager sap methods & tools (m/w/d)|berlin, berlin, germany|https://www.linkedin.com/jobs/view/4153120059
deloitte|(senior) manager sap methods & tools (m/w/d) in walldorf|walldorf, baden-württemberg, germany|https://www.linkedin.com/jobs/view/4153112945
deloitte|(senior) manager sap methods & tools (m/w/d) in hannover|hannover, lower saxony, germany|https://www.linkedin.com/jobs/view/4153118275
altair|software development intern - pulse|athens, attiki, greece|https://www.linkedin.com/jobs/view/4170148614
dialectica|software engineer intern|athens, attiki, greece|https://www.linkedin.com/jobs/view/4211376294
dialectica|software engineering intern|athens, attiki, greece|https://www.linkedin.com/jobs/view/4213369591
nokia|internship - web-based sw engineer|athens, attiki, greece|https://www.linkedin.com/jobs/view/4201276677
scaleup.agency|ai & business analyst / consultant (remote internship)|budapest, budapest, hungary|https://www.linkedin.com/jobs/view/4213473741
scaleup.agency|ai & business analyst / consultant (remote internship)|debrecen, hajdú-bihar, hungary|https://www.linkedin.com/jobs/view/4213477261
eurowag|law student part-time|fót, pest, hungary|https://www.linkedin.com/jobs/view/4216671111
ericsson|software developer intern|budapest, budapest, hungary|https://www.linkedin.com/jobs/view/4216477230
opswat|software developer intern|veszprém, veszprém, hungary|https://www.linkedin.com/jobs/view/4198041347
opswat|software developer intern|veszprém, veszprém, hungary|https://www.linkedin.com/jobs/view/4198035878
tata consultancy services|generative ai intern|budapest, hungary|https://www.linkedin.com/jobs/view/4166308729
ericsson|software engineering intern - ericsson orchestrator|budapest, budapest, hungary|https://www.linkedin.com/jobs/view/4206821770
opswat|software developer intern|veszprém, veszprém, hungary|https://www.linkedin.com/jobs/view/4219100340
emerson|software engineer intern|debrecen, hajdú-bihar, hungary|https://www.linkedin.com/jobs/view/4216376999
scaleup.agency|ai & business analyst / consultant (remote internship)|cork, county cork, ireland|https://www.linkedin.com/jobs/view/4213477257
squarespace|software engineering intern - summer 2025|dublin, county dublin, ireland|https://www.linkedin.com/jobs/view/4206871371
murex|software engineer internship 2025|dublin, county dublin, ireland|https://www.linkedin.com/jobs/view/4216710673
arista networks|graduate/intern software engineer|dublin, county dublin, ireland|https://www.linkedin.com/jobs/view/4215268708
jentic|ise - internship|dublin, county dublin, ireland|https://www.linkedin.com/jobs/view/4217294143
scaleup.agency|ai & business analyst / consultant (remote internship)|milan, lombardy, italy|https://www.linkedin.com/jobs/view/4213472739
scaleup.agency|ai & business analyst / consultant (remote internship)|turin, piedmont, italy|https://www.linkedin.com/jobs/view/4213479095
scaleup.agency|ai & business analyst / consultant (remote internship)|bologna, emilia-romagna, italy|https://www.linkedin.com/jobs/view/4213476516
scaleup|ai & business analyst / consultant (remote internship)|milan, lombardy, italy|https://www.linkedin.com/jobs/view/4212438358
scaleup|ai & business analyst / consultant (remote internship)|turin, piedmont, italy|https://www.linkedin.com/jobs/view/4212437517
scaleup|ai & business analyst / consultant (remote internship)|bologna, emilia-romagna, italy|https://www.linkedin.com/jobs/view/4212437525
theinterna|commercial operations intern in an ai company in milan|milan, lombardy, italy|https://www.linkedin.com/jobs/view/4208179794
foolfarm group|marketing communication & lead generation intern @ foolfarm|milan, lombardy, italy|https://www.linkedin.com/jobs/view/4217893791
foolfarm group|marketing communication & social media  intern @ foolfarm|milan, lombardy, italy|https://www.linkedin.com/jobs/view/4217899611
kpmg italy|software engineer - intern|milan, lombardy, italy|https://www.linkedin.com/jobs/view/4211549513
comobile software solutions|stagista sviluppo software|bagheria, sicily, italy|https://www.linkedin.com/jobs/view/4209983525
critalog gmbh|praktikant*in, werkstudent*in, bachelorand - softwareentwicklung autonome drohne (m/w/d)|martina franca, apulia, italy|https://www.linkedin.com/jobs/view/4219271963
eidosmedia|sales associate intern|milan, lombardy, italy|https://www.linkedin.com/jobs/view/4197886632
ephos|summer intern (engineering, research, or communications)|milan, lombardy, italy|https://www.linkedin.com/jobs/view/4202977558
fastweb + vodafone|internal audit control analyst intern|milan, lombardy, italy|https://www.linkedin.com/jobs/view/4198549702
hype|it operations - stage|greater milan metropolitan area, worldwide|https://www.linkedin.com/jobs/view/4217857167
russotti gestioni hotels s.p.a.|stage eventi - delta hotels marriott giardini naxos|catania, sicily, italy|https://www.linkedin.com/jobs/view/4184639053
dhl express|quality intern - malpensa hub|lonate pozzolo, lombardy, italy|https://www.linkedin.com/jobs/view/4214570244
epam systems|data software engineering trainee|kazakhstan, worldwide|https://www.linkedin.com/jobs/view/4143864011
epam systems|data software engineering trainee|karaganda, karaganda region, worldwide|https://www.linkedin.com/jobs/view/4143863160
epam systems|data software engineering trainee|shymkent, shymkent, worldwide|https://www.linkedin.com/jobs/view/4143860525
epam systems|data software engineering trainee|almaty, almaty, worldwide|https://www.linkedin.com/jobs/view/4143860526
epam systems|data software engineering trainee|актобе, aqtöbe region, worldwide|https://www.linkedin.com/jobs/view/4143862305
epam systems|data software engineering trainee|atyrau, atyrau region, worldwide|https://www.linkedin.com/jobs/view/4143865010
epam systems|data software engineering trainee|ventspils, ventspils, worldwide|https://www.linkedin.com/jobs/view/4149945909
epam systems|data software engineering trainee|riga, riga, worldwide|https://www.linkedin.com/jobs/view/4149949320
epam systems|data software engineering trainee|jelgava, jelgava municipality, worldwide|https://www.linkedin.com/jobs/view/4149949329
epam systems|data software engineering trainee|daugavpils, daugavpils, worldwide|https://www.linkedin.com/jobs/view/4149945914
epam systems|data software engineering trainee|liepāja, liepaja, worldwide|https://www.linkedin.com/jobs/view/4149947673
bentley systems|intern, software engineering|vilnius, vilniaus, worldwide|https://www.linkedin.com/jobs/view/4204780867
bentley systems|intern, software engineering|kaunas, kaunas, worldwide|https://www.linkedin.com/jobs/view/4204782667
epam systems|data software engineering trainee|vilnius, vilniaus, worldwide|https://www.linkedin.com/jobs/view/4149947668
epam systems|data software engineering trainee|lithuania, worldwide|https://www.linkedin.com/jobs/view/4149948442
epam systems|data software engineering trainee|siauliai, siauliu, worldwide|https://www.linkedin.com/jobs/view/4149946918
epam systems|data software engineering trainee|klaipėda, klaipėdos, worldwide|https://www.linkedin.com/jobs/view/4159236247
epam systems|data software engineering trainee|kaunas, kaunas, worldwide|https://www.linkedin.com/jobs/view/4149944971
helical|business & ops intern|luxembourg, luxembourg, luxembourg|https://www.linkedin.com/jobs/view/4217830219
sonia|venture development intern|luxembourg, luxembourg, luxembourg|https://www.linkedin.com/jobs/view/4212034166
under armour|software engineering intern - rookie program fw' 2025|amsterdam, north holland, netherlands|https://www.linkedin.com/jobs/view/4210661253
